index,url,valid,domain,title,description,image,published,archive,content,quote,language,keyword
https://www.golem.de/sonstiges/zustimmung/auswahl.html?from=https://www.golem.de/news/statische-aufladung-ikea-stuhl-sorgt-fuer-blackout-des-bildschirms-2305-173963.html&referer=https://t.co/42948cb57d,https://www.golem.de/sonstiges/zustimmung/auswahl.html?from=https://www.golem.de/news/statische-aufladung-ikea-stuhl-sorgt-fuer-blackout-des-bildschirms-2305-173963.html&referer=https://t.co/42948cb57d,0,www.golem.de,Statische Aufladung: Ikea-Stuhl sorgt für Blackout des Bildschirms,"Ein Entwickler staunte nicht schlecht, dass jedes Mal, wenn er sich auf seinen Ikea-Stuhl setzte, der Bildschirm schwarz wurde. (Ikea, Display)",,2023-05-05T14:45:02Z,,"Besuchen Sie Golem.de wie gewohnt mit Werbung und Tracking,
 indem Sie der Nutzung aller Cookies zustimmen.
 Details zum Tracking finden Sie im Privacy Center.
Skript wurde nicht geladen. Informat… [+607 chars]",,de,'Blackout'
https://consent.google.com/ml?continue=https://news.google.com/rss/articles/CBMiJWh0dHBzOi8vd2luZnV0dXJlLmRlL25ld3MsMTM2MDM3Lmh0bWzSASZodHRwczovL20ud2luZnV0dXJlLmRlL2FtcC9uZXdzLzEzNjAzNw?oc%3D5&gl=FR&hl=en-US&cm=2&pc=n&src=1,https://consent.google.com/ml?continue=https://news.google.com/rss/articles/CBMiJWh0dHBzOi8vd2luZnV0dXJlLmRlL25ld3MsMTM2MDM3Lmh0bWzSASZodHRwczovL20ud2luZnV0dXJlLmRlL2FtcC9uZXdzLzEzNjAzNw?oc%3D5&gl=FR&hl=en-US&cm=2&pc=n&src=1,0,consent.google.com,"Entwickler findet heraus, dass populärer Ikea-Stuhl Displays ausschaltet - WinFuture","<ol><li>Entwickler findet heraus, dass populärer Ikea-Stuhl Displays ausschaltet  WinFuture
</li><li>Statische Aufladung: Ikea-Stuhl verursacht Blackout des Bildschirms - Golem.de  Golem.de
</li><li>Beliebter Ikea-Sessel sorgt dafür, dass Bildschirm schwarz…",,2023-05-05T15:21:00Z,,"We use cookies and data to<ul><li>Deliver and maintain Google services</li><li>Track outages and protect against spam, fraud, and abuse</li><li>Measure audience engagement and site statistics to unde… [+1131 chars]",,de,'Blackout'
https://www.zeit.de/news/2023-05/05/bus-rutscht-in-graben-drei-kinder-leicht-verletzt,https://www.zeit.de/news/2023-05/05/bus-rutscht-in-graben-drei-kinder-leicht-verletzt,0,www.zeit.de,Neuwied: Bus rutscht in Graben: Drei Kinder leicht verletzt,,,2023-05-05T15:21:40Z,https://web.archive.org/web/20230505232243/https://www.zeit.de/news/2023-05/05/bus-rutscht-in-graben-drei-kinder-leicht-verletzt,"When browsing with ads:
We collect personal data and also transmit it to third-party providers
 that help us improve and finance our digital content. Some of the information stored on your device, … [+732 chars]",,de,'Kinder'
https://www.focus.de/klima/report/muehlrose-soll-plattgemacht-werden-in-sachsens-anti-luetzerath-wird-gegen-aktivisten-protestiert-statt-gegen-kohle_id_193051064.html,https://www.focus.de/klima/report/muehlrose-soll-plattgemacht-werden-in-sachsens-anti-luetzerath-wird-gegen-aktivisten-protestiert-statt-gegen-kohle_id_193051064.html,0,www.focus.de,Mühlrose soll plattgemacht werden - In Sachsens Anti-Lützerath wird gegen Aktivisten protestiert statt gegen Kohle,"Ein ganzes Dorf soll sterben - und fast niemand protestiert: Mühlrose in Sachsen ist vermutlich das letzte Dorf in Deutschland, das der Kohle weichen muss. Anders als in Lützerath gibt es bislang keinen massiven Widerstand. In Sachen Kohleausstieg ist die Sti…",https://p6.focus.de/img/fotos/id_193050743/imago0198965313h.jpg?im=Crop%3D%280%2C633%2C3266%2C1633%29%3BResize%3D%281200%2C627%29&hash=345ec971af9fc4118094644406da2e0a95ced9ff3bdb3ab8493031ef9ce47ac2,2023-05-06T09:53:07Z,https://web.archive.org/web/20230506212719/https://www.focus.de/klima/report/muehlrose-soll-plattgemacht-werden-in-sachsens-anti-luetzerath-wird-gegen-aktivisten-protestiert-statt-gegen-kohle_id_193051064.html,"<ul><li>
Kommentare</li><li>
E-Mail</li><li>
Teilen</li><li>
Mehr</li><li>
Twitter</li><li>
Drucken</li><li>
Feedback</li><li>
Fehler meldenSie haben einen Fehler gefunden?
Bitte markieren S… [+7673 chars]",,de,'Kohle'
https://www.zeit.de/news/2023-05/06/kultusministerium-plant-sprachtests-und-foerderung-fuer-kinder,https://www.zeit.de/news/2023-05/06/kultusministerium-plant-sprachtests-und-foerderung-fuer-kinder,0,www.zeit.de,Bildung: Kultusministerium plant Sprachtests und Förderung für Kinder,,,2023-05-06T11:27:57Z,,"When browsing with ads:
We collect personal data and also transmit it to third-party providers
 that help us improve and finance our digital content. Some of the information stored on your device, … [+732 chars]",,de,'Kinder'
https://www.kicker.de/popp-zum-drohenden-tv-blackout-das-finde-ich-brutal-traurig-950223/video,https://www.kicker.de/popp-zum-drohenden-tv-blackout-das-finde-ich-brutal-traurig-950223/video,0,www.kicker.de,"Popp zum drohenden TV-Blackout: ""Das finde ich brutal traurig""",Video: Wird die Frauen-WM in Neuseeland und Australien im deutschen TV übertragen? Nationalstürmerin Alexandra Popp äußert ihre Meinung und hat auch für FIFA-Präsident Gianni Infantino eine paar Worte übrig.,"https://derivates.kicker.de/image/upload/c_crop,x_0,y_109,w_3000,h_1687/w_1200,q_auto/v1/2023/05/06/beb5ddba-7632-4d6d-b130-70eb5b8045ff.jpeg",2023-05-06T18:05:59Z,https://web.archive.org/web/20230506190229/https://www.kicker.de/popp-zum-drohenden-tv-blackout-das-finde-ich-brutal-traurig-950223/video,"Werbung und Tracking: Um dir relevante Inhalte und personalisierte Werbung anzubieten, setzen wir Cookies und andere Technologien ein. Damit messen wir, wie und womit du unsere Angebote nutzt. Diese … [+2186 chars]",,de,'Blackout'
