index,url,valid,domain,title,description,image,published,archive,content,quote,language,keyword
https://www.bild.de/regional/berlin/berliner-blackout-gebiet-polizisten-verhindern-einbruch-695b6badc83d5f8e0659c983,https://www.bild.de/regional/berlin/berliner-blackout-gebiet-polizisten-verhindern-einbruch-695b6badc83d5f8e0659c983,0,www.bild.de,Im Blackout-Gebiet - Polizisten verhindern Einbruch in Berlin,Sie wollten die Notlage der Menschen im vom Stromausfall betroffenen Südwesten Berlins ausnutzen. Doch ein aufmerksamer Passant rief die Polizei.,"https://images.bild.de/695b6badc83d5f8e0659c983/7b49c67c699b931da0c9a58f1a40c8ec,88db291f?w=1280",2026-01-05T17:47:48Z,,Berlin Sie wollten die Notlage der Menschen im vom Stromausfall betroffenen Südwesten Berlins ausnutzen. Doch ein aufmerksamer Passant und Beamte der 23. Hundertschaft der Bereitschaftspolizei machte… [+1285 chars],,de,'Blackout'
https://www.morgenpost.de/wirtschaft/article410854839/komplett-getroffen-das-heisst-der-blackout-fuer-unternehmen.html,https://www.morgenpost.de/wirtschaft/article410854839/komplett-getroffen-das-heisst-der-blackout-fuer-unternehmen.html,0,www.morgenpost.de,„Komplett getroffen“: Das heißt der Blackout für Unternehmen,"Der Berliner Stromausfall trifft auch Unternehmen hart. Daraus sollten Firmen vor allem eine Lehre ziehen, sagen Verbände.",https://img.sparknews.funkemedien.de/410840833/410840833_1767470193_v16_9_1600.jpeg,2026-01-05T17:59:45Z,,"Das Goerzwerk in Lichterfelde ist am Montag nicht per Festnetz erreichbar. Wir sind von dem Stromausfall komplett getroffen, erklärt Sprecherin Anusch Guyenz am Handy. Seit Montag laufen drei Notstro… [+6766 chars]",,de,'Blackout'
https://www.bild.de/regional/berlin/blackout-in-berlin-keine-heizung-jetzt-drohen-wasserrohre-zu-platzen-695bb85ffb77630dac2781e5,https://www.bild.de/regional/berlin/blackout-in-berlin-keine-heizung-jetzt-drohen-wasserrohre-zu-platzen-695bb85ffb77630dac2781e5,0,www.bild.de,Nach dem Blackout in Berlin - Keine Heizung! Jetzt drohen die Rohre zu platzen,Der Stromausfall im Südwesten Berlins führte in vielen Tausend Haushalten auch zum Ausfall der Heizung. Das kann gefährlich werden.,"https://images.bild.de/695bb85ffb77630dac2781e5/378ca3e75f8706fc8114abf88523b816,45646656?w=1280",2026-01-05T18:11:20Z,,"Berlin Der Stromausfall im Südwesten Berlins führte in vielen Tausend Haushalten auch zum Ausfall der Heizung. Eine Gefahr für die Leitungen in den Häusern! 
Denn: Bei dem aktuellen Dauerfrost (nach… [+1833 chars]",,de,'Blackout'
https://www.bild.de/news/inland/berlin-stromausfall-experten-kaempfen-gegen-kaelte-695bc92ab0086aa64be6f6cf,https://www.bild.de/news/inland/berlin-stromausfall-experten-kaempfen-gegen-kaelte-695bc92ab0086aa64be6f6cf,0,www.bild.de,Berlin Blackout - An dieser Baustelle wird das Licht angeknipst,Mehr als 30.000 Haushalte in Berlin ohne Strom nach Anschlag auf das Stromnetz. Rettungsteam arbeitet rund um die Uhr.,"https://images.bild.de/695bc92ab0086aa64be6f6cf/6c63915713ab2c799854be83459f649a,b77aa63a?w=1280",2026-01-06T03:51:52Z,,"Berlin In ihren Händen ruhen die Hoffnungen zehntausender frierender und bibbernder Berliner. Mehr als drei Dutzend Experten, Bauarbeiter und Techniker arbeiten in drei Schichten rund um die Uhr im K… [+2704 chars]",,de,'Blackout'
https://www.zeit.de/news/2026-01/06/eisunfall-wenn-der-winter-lebensgefaehrlich-wird,https://www.zeit.de/news/2026-01/06/eisunfall-wenn-der-winter-lebensgefaehrlich-wird,0,www.zeit.de,Frostperiode: Eisunfall – wenn der Winter lebensgefährlich wird,Hier finden Sie Informationen zu dem Thema „Frostperiode“. Lesen Sie jetzt „Eisunfall – wenn der Winter lebensgefährlich wird“.,https://img.zeit.de/news/2026-01/06/eisunfall-wenn-der-winter-lebensgefaehrlich-wird-image-group/wide__1300x731,2026-01-06T04:02:05Z,,"Spiegelglatte Eisflächen laden derzeit vielerorts zum Schlittern und Schlittschuhfahren auf zugefrorenen Seen ein. Doch das kann lebensgefährlich sein, warnt Dominik Schneider von der Deutschen Leben… [+4119 chars]",,de,'Winter'
https://www.zeit.de/news/2026-01/06/dauerfrost-und-schnee-in-berlin-und-brandenburg,https://www.zeit.de/news/2026-01/06/dauerfrost-und-schnee-in-berlin-und-brandenburg,0,www.zeit.de,Wetter: Dauerfrost und Schnee in Berlin und Brandenburg,Hier finden Sie Informationen zu dem Thema „Wetter“. Lesen Sie jetzt „Dauerfrost und Schnee in Berlin und Brandenburg“.,https://img.zeit.de/news/2026-01/06/dauerfrost-und-schnee-in-berlin-und-brandenburg-image-group/wide__1300x731,2026-01-06T05:10:11Z,,"Es wird frostig in Berlin und Brandenburg: Die Temperaturen bleiben im Minusbereich, wie der Deutsche Wetterdienst mitteilt. Demnach startet der Tag mit Tiefstwerten zwischen minus sechs und minus ne… [+929 chars]",,de,'Schnee'
https://www.morgenpost.de/berlin/article410857178/blackout-des-regierenden-buergermeisters-kai-wegner.html,https://www.morgenpost.de/berlin/article410857178/blackout-des-regierenden-buergermeisters-kai-wegner.html,0,www.morgenpost.de,Blackout des Regierenden Bürgermeisters Kai Wegner,"Der Stromausfall vom Wochenende zeigt, wie schlecht Berlin beim Katastrophenschutz aufgestellt ist.",https://img.sparknews.funkemedien.de/410855722/410855722_1767632869_v16_9_1600.jpeg,2026-01-06T05:30:00Z,,"Liebe Leserin, lieber Leser,
die Monteure der Stromnetz Berlin arbeiten derzeit unter widrigsten Bedingungen bei Bodenfrost und Schnee, eine Gasleitung liegt auch noch im Weg. Einsatzkräfte des THW … [+5091 chars]",,de,'Blackout'
https://www.zeit.de/news/2026-01/06/dauerfrost-und-schnee-glaettegefahr-in-hessen,https://www.zeit.de/news/2026-01/06/dauerfrost-und-schnee-glaettegefahr-in-hessen,0,www.zeit.de,Winterwetter: Dauerfrost und Schnee – Glättegefahr in Hessen,Hier finden Sie Informationen zu dem Thema „Winterwetter“. Lesen Sie jetzt „Dauerfrost und Schnee – Glättegefahr in Hessen“.,https://img.zeit.de/news/2026-01/06/dauerfrost-und-schnee-glaettegefahr-in-hessen-image-group/wide__1300x731,2026-01-06T06:17:26Z,,"In den kommenden Tagen wird es in Hessen frostig und kalt, immer wieder gibt es auch Schnee. Wie der Deutsche Wetterdienst mitteilte, gibt es heute verbreitet Dauerfrost bei Temperaturen zwischen min… [+646 chars]",,de,'Winter'
https://www.zeit.de/news/2026-01/06/glatteis-gefahr-bei-schnee-und-regen-in-den-kommenden-tagen,https://www.zeit.de/news/2026-01/06/glatteis-gefahr-bei-schnee-und-regen-in-den-kommenden-tagen,0,www.zeit.de,Winterwetter: Glatteis-Gefahr bei Schnee und Regen in den kommenden Tagen,Hier finden Sie Informationen zu dem Thema „Winterwetter“. Lesen Sie jetzt „Glatteis-Gefahr bei Schnee und Regen in den kommenden Tagen“.,https://img.zeit.de/news/2026-01/06/glatteis-gefahr-bei-schnee-und-regen-in-den-kommenden-tagen-image-group/wide__1300x731,2026-01-06T06:41:41Z,,"In den kommenden Tagen bleibt es kalt und frostig in Rheinland-Pfalz und im Saarland, immer wieder gibt es auch neuen Schnee. Wie der Deutsche Wetterdienst mitteilte, gibt es heute verbreitet Dauerfr… [+690 chars]",,de,'Glatteis'
https://www.zeit.de/news/2026-01/06/schnee-und-glaette-in-nrw-wetter-bleibt-frostig,https://www.zeit.de/news/2026-01/06/schnee-und-glaette-in-nrw-wetter-bleibt-frostig,0,www.zeit.de,Winterlich: Schnee und Glätte in NRW - Wetter bleibt frostig,Hier finden Sie Informationen zu dem Thema „Winterlich“. Lesen Sie jetzt „Schnee und Glätte in NRW - Wetter bleibt frostig“.,https://img.zeit.de/news/2026-01/06/schnee-und-glaette-in-nrw-wetter-bleibt-frostig-image-group/wide__1300x731,2026-01-06T08:03:52Z,,"In den kommenden Tagen müssen sich die Menschen in Nordrhein-Westfalen auf Schnee, Frost und Kälte einstellen. Wie der Deutsche Wetterdienst mitteilte, fällt heute vereinzelt Schnee bei Temperaturen … [+757 chars]",,de,'Schnee'
https://www.stern.de/kaufkosmos/deals/luftentfeuchter-fuer-kleine-raeume---heute-46-prozent-guenstiger-37013526.html,https://www.stern.de/kaufkosmos/deals/luftentfeuchter-fuer-kleine-raeume---heute-46-prozent-guenstiger-37013526.html,0,www.stern.de,46 % Rabatt: Heute stark reduziert: Luftentfeuchter für kleine Räume,Luftentfeuchter sind nicht nur im Winter ein Segen. Sie reduzieren das Schimmelrisiko und verbessern das Raumklima. Amazon lockt heute mit einem starken Deal.,https://image.stern.de/37013690/t/h_/v2/w1440/r1.7778/-/deal-news-luftentfeuchter-aufmacher-januar-2026.jpg,2026-01-06T08:48:00Z,,"Kopiere den aktuellen Link
Zur Merkliste hinzufügen
Luftentfeuchter sind nicht nur im Winter ein Segen. Sie reduzieren das Schimmelrisiko und verbessern das Raumklima. Amazon lockt heute mit einem … [+1992 chars]",,de,'Schimmel'
https://www.tagesschau.de/ausland/europa/schnee-frankreich-niederlande-ausfaelle-100.html,https://www.tagesschau.de/ausland/europa/schnee-frankreich-niederlande-ausfaelle-100.html,0,www.tagesschau.de,"Schnee und Eis: Verkehrschaos in Paris, Flugausfälle in Amsterdam","Kilometerlange Staus, Flug- und Zugausfälle: Das Winterwetter hat in Teilen Europas zu erheblichen Behinderungen geführt. Auch der Deutsche Wetterdienst warnt weiterhin vor Glätte und strengem Frost.",https://images.tagesschau.de/image/6b3bdd78-a376-4d4d-8d3b-8cf3c9eeb11d/AAABm5JXQlQ/AAABmyZE0EA/16x9-big/verkehr-winter-paris-100.jpg?width=1280,2026-01-06T09:07:18Z,,"Stand: 06.01.2026 10:07 Uhr
Kilometerlange Staus, Flug- und Zugausfälle: Das Winterwetter hat in Teilen Europas zu erheblichen Behinderungen geführt. Auch der Deutsche Wetterdienst warnt weiterhin v… [+3049 chars]",,de,'Glatteis'
https://www.zeit.de/news/2026-01/06/defekte-heizung-setzt-gas-frei-drei-verletzte-in-lemgo,https://www.zeit.de/news/2026-01/06/defekte-heizung-setzt-gas-frei-drei-verletzte-in-lemgo,0,www.zeit.de,Feuerwehreinsatz: Defekte Heizung setzt Gas frei – Drei Verletzte in Lemgo,Hier finden Sie Informationen zu dem Thema „Feuerwehreinsatz“. Lesen Sie jetzt „Defekte Heizung setzt Gas frei – Drei Verletzte in Lemgo“.,https://img.zeit.de/news/2026-01/06/defekte-heizung-setzt-gas-frei-drei-verletzte-in-lemgo-image-group/wide__1300x731,2026-01-06T09:25:53Z,,"In einem Wohnhaus in Lemgo (Kreis Lippe) sind durch eine anscheinend defekte Heizung drei Menschen verletzt worden. Wie die Feuerwehr mitteilte, fiel einem Autofahrer am Montag zunächst eine Frau auf… [+475 chars]",,de,'Gas'
https://www.zeit.de/news/2026-01/06/dauerfrost-und-glatteis-in-bayern,https://www.zeit.de/news/2026-01/06/dauerfrost-und-glatteis-in-bayern,0,www.zeit.de,Wettervorhersage: Dauerfrost und Glatteis in Bayern,Hier finden Sie Informationen zu dem Thema „Wettervorhersage“. Lesen Sie jetzt „Dauerfrost und Glatteis in Bayern“.,https://img.zeit.de/news/2026-01/06/dauerfrost-und-glatteis-in-bayern-image-group/wide__1300x731,2026-01-06T10:07:40Z,,In Bayern bleibt es eisig kalt. Bis zu minus 7 Grad sagt der Deutsche Wetterdienst (DWD) für heute vorher. In der Nacht zum Mittwoch könne die Temperatur in höheren Lagen gar auf minus 17 Grad sinken… [+312 chars],,de,'Glatteis'
https://www.zeit.de/news/2026-01/06/was-sind-frost-und-eistage,https://www.zeit.de/news/2026-01/06/was-sind-frost-und-eistage,0,www.zeit.de,Winter: Was sind Frost- und Eistage?,Hier finden Sie Informationen zu dem Thema „Winter“. Lesen Sie jetzt „Was sind Frost- und Eistage?“.,https://img.zeit.de/news/2026-01/06/was-sind-frost-und-eistage-image-group/wide__1300x731,2026-01-06T11:07:51Z,,Zu Beginn des Jahres lädt das Wetter noch einmal zu winterlichen Aktivitäten in ganz Hessen ein. Aber bei Frost und Schnee und Temperaturen rund um den Gefrierpunkt stellt sich auch die Frage: Ist di… [+943 chars],,de,'Winter'
https://www.zeit.de/news/2026-01/06/kohlenmonoxid-mutter-und-sohn-bewusstlos-in-zimmern,https://www.zeit.de/news/2026-01/06/kohlenmonoxid-mutter-und-sohn-bewusstlos-in-zimmern,0,www.zeit.de,Gas-Unfall: Kohlenmonoxid: Mutter und Sohn bewusstlos in Zimmern,Hier finden Sie Informationen zu dem Thema „Gas-Unfall“. Lesen Sie jetzt „Kohlenmonoxid: Mutter und Sohn bewusstlos in Zimmern“.,https://img.zeit.de/news/2026-01/06/kohlenmonoxid-mutter-und-sohn-bewusstlos-in-zimmern-image-group/wide__1300x731,2026-01-06T12:02:35Z,,Eine erhöhte Kohlenmonoxid-Konzentration in einem Wohnhaus in Burladingen (Zollernalbkreis) hat mehrere Menschen in große Gefahr gebracht. Eine Frau und ihr elfjähriger Sohn wurden am Dienstagmorgen … [+916 chars],,de,'Kohle'
https://www.zeit.de/news/2026-01/06/winterdienst-im-dauereinsatz,https://www.zeit.de/news/2026-01/06/winterdienst-im-dauereinsatz,0,www.zeit.de,Winter in Norddeutschland: Winterdienst im Dauereinsatz,Hier finden Sie Informationen zu dem Thema „Winter in Norddeutschland“. Lesen Sie jetzt „Winterdienst im Dauereinsatz“.,https://img.zeit.de/news/2026-01/06/winterdienst-im-dauereinsatz-image-group/wide__1300x731,2026-01-06T13:41:58Z,,"Gut gewappnet für den Winter: Kommunen im Norden und Nordosten haben noch ausreichend Streugut, um auch in der nächsten Zeit für sichere Straßenverhältnisse zu sorgen. Dies ergab eine stichprobenarti… [+2762 chars]",,de,'Winter'
https://www.zeit.de/news/2026-01/06/schnee-und-eis-stoeren-umschlag-im-hamburger-hafen,https://www.zeit.de/news/2026-01/06/schnee-und-eis-stoeren-umschlag-im-hamburger-hafen,0,www.zeit.de,Wetter: Schnee und Eis stören Umschlag im Hamburger Hafen,Hier finden Sie Informationen zu dem Thema „Wetter“. Lesen Sie jetzt „Schnee und Eis stören Umschlag im Hamburger Hafen“.,https://img.zeit.de/news/2026-01/06/schnee-und-eis-stoeren-umschlag-im-hamburger-hafen-image-group/wide__1300x731,2026-01-06T16:21:09Z,,"Schnee und Eis stören den Umschlag im Hamburger Hafen. Der Hafenlogistiker HHLA teilte mit, an den drei Containerterminals des Unternehmens in Hamburg dauere zwar der Betrieb an. «Es kommt durch die … [+982 chars]",,de,'Schnee'
https://www.zeit.de/news/2026-01/06/eis-und-schnee-verzoegern-abholung-von-muelltonnen,https://www.zeit.de/news/2026-01/06/eis-und-schnee-verzoegern-abholung-von-muelltonnen,0,www.zeit.de,Wintereinbruch: Eis und Schnee verzögern Abholung von Mülltonnen,Hier finden Sie Informationen zu dem Thema „Wintereinbruch“. Lesen Sie jetzt „Eis und Schnee verzögern Abholung von Mülltonnen“.,https://img.zeit.de/news/2026-01/06/eis-und-schnee-verzoegern-abholung-von-muelltonnen-image-group/wide__1300x731,2026-01-06T16:52:07Z,,Wegen des Wintereinbruchs bleiben im Landkreis Hameln-Pyrmont Mülltonnen zum Teil länger stehen. Durch Eis und Schnee komme es im gesamten Abfuhrbereich derzeit zu zeitlichen Verzögerungen bei der Mü… [+429 chars],,de,'Schnee'
https://www.zeit.de/news/2026-01/06/hamburg-hebt-streusalz-verbot-nach-starkem-schneefall-auf,https://www.zeit.de/news/2026-01/06/hamburg-hebt-streusalz-verbot-nach-starkem-schneefall-auf,0,www.zeit.de,Winterwetter: Hamburg hebt Streusalz-Verbot nach starkem Schneefall auf,Hier finden Sie Informationen zu dem Thema „Winterwetter“. Lesen Sie jetzt „Hamburg hebt Streusalz-Verbot nach starkem Schneefall auf“.,https://img.zeit.de/news/2026-01/06/hamburg-hebt-streusalz-verbot-nach-starkem-schneefall-auf-image-group/wide__1300x731,2026-01-06T17:45:57Z,,Angesichts der heftigsten Schneefälle seit 15 Jahren und dem ständigen Wechsel von Tau- und Frostzeiten hat die Verkehrsbehörde in Hamburg das Verbot von Streusalz auf Gehwegen und Nebenflächen bis z… [+878 chars],,de,'Winter'
https://www.tagesschau.de/ausland/europa/winter-europa-todesopfer-100.html,https://www.tagesschau.de/ausland/europa/winter-europa-todesopfer-100.html,0,www.tagesschau.de,Winterwetter in Europa: Fünf Tote nach Glätteunfällen in Frankreich,Große Teile Europas werden weiter von Winterwetter beherrscht. In Frankreich kamen bei Unfällen fünf Menschen ums Leben. Die niederländische Airline KLM streicht am Mittwoch 600 Flüge - das Mittel zum Enteisen von Flugzeugen gehe aus.,https://images.tagesschau.de/image/6d3037f9-b1a3-45bf-85e7-806834bd7de8/AAABm5Q7gs0/AAABmyZE0EA/16x9-big/schnee-paris-100.jpg?width=1280,2026-01-06T18:09:23Z,,"Stand: 06.01.2026 19:09 Uhr
Große Teile Europas werden weiter von Winterwetter beherrscht. In Frankreich kamen bei Unfällen fünf Menschen ums Leben. Die niederländische Airline KLM streicht am Mittw… [+4166 chars]",,de,'Winter'
https://www.faz.net/aktuell/wirtschaft/nach-anschlaegen-in-berlin-zeitenwende-im-stromnetz-110814679.html,https://www.faz.net/aktuell/wirtschaft/nach-anschlaegen-in-berlin-zeitenwende-im-stromnetz-110814679.html,0,www.faz.net,Blackout in Berlin: Zeitenwende im Stromnetz,Nach Anschlägen in Berlin neue Diskussion um sichere Stromnetze,https://media0.faz.net/image/w1200h627/4407424d2145/w3000h1567x0y267o/012026/1.10814676/notstrom-ein-geraetewagen-des.webp,2026-01-06T21:26:46Z,,"Zum Glück gibt es in Berlin noch Gaslaternen. Der Bewohner eines Einfamilienhauses im Stadtteil Schlachtensee, der seit Samstagfrüh ohne Strom und Heizung auskommen muss, berichtet, dass der warmgelb… [+426 chars]",,de,'Blackout'
https://www.zeit.de/news/2026-01/07/wohnungslosenhilfe-lebensgefahr-fuer-obdachlose-durch-kaelte,https://www.zeit.de/news/2026-01/07/wohnungslosenhilfe-lebensgefahr-fuer-obdachlose-durch-kaelte,0,www.zeit.de,Winter: Wohnungslosenhilfe: Lebensgefahr für Obdachlose durch Kälte,Hier finden Sie Informationen zu dem Thema „Winter“. Lesen Sie jetzt „Wohnungslosenhilfe: Lebensgefahr für Obdachlose durch Kälte“.,https://img.zeit.de/news/2026-01/07/wohnungslosenhilfe-lebensgefahr-fuer-obdachlose-durch-kaelte-image-group/wide__1300x731,2026-01-07T02:04:04Z,,Angesichts der eisigen Temperaturen warnt die Bundesarbeitsgemeinschaft Wohnungslosenhilfe vor Lücken bei der Versorgung von Menschen ohne eigene Wohnung. «Kälte stellt für obdachlose Menschen eine l… [+1782 chars],,de,'Kälte'
https://www.zeit.de/news/2026-01/07/das-gilt-bei-schnee-und-glaette-an-niedersachsens-schulen,https://www.zeit.de/news/2026-01/07/das-gilt-bei-schnee-und-glaette-an-niedersachsens-schulen,0,www.zeit.de,Winterwetter: Das gilt bei Schnee und Glätte an Niedersachsens Schulen,Hier finden Sie Informationen zu dem Thema „Winterwetter“. Lesen Sie jetzt „Das gilt bei Schnee und Glätte an Niedersachsens Schulen“.,https://img.zeit.de/news/2026-01/07/das-gilt-bei-schnee-und-glaette-an-niedersachsens-schulen-image-group/wide__1300x731,2026-01-07T04:30:04Z,,Der Winter hat Niedersachsen fest im Griff: Vielerorts liegt Schnee und es ist glatt. Auch in den nächsten Tagen soll es frostig bleiben. Was bedeutet das für die Schulen und Kitas? Die wichtigsten F… [+2732 chars],,de,'Schnee'
https://www.zeit.de/news/2026-01/07/wie-tiere-im-frankfurter-zoo-den-winter-meistern,https://www.zeit.de/news/2026-01/07/wie-tiere-im-frankfurter-zoo-den-winter-meistern,0,www.zeit.de,Tier und Kälte: Wie Tiere im Frankfurter Zoo den Winter meistern,Hier finden Sie Informationen zu dem Thema „Tier und Kälte“. Lesen Sie jetzt „Wie Tiere im Frankfurter Zoo den Winter meistern“.,https://img.zeit.de/news/2026-01/07/wie-tiere-im-frankfurter-zoo-den-winter-meistern-image-group/wide__1300x731,2026-01-07T06:15:05Z,,"Beheizte Felsen für die Löwen, Wärmemöglichkeiten für die Erdmännchen oder das dicke Winterfell der Alpakas: Bei der eisigen Kälte helfen natürliche Anpassung oder technische Unterstützung den Tieren… [+2545 chars]",,de,'Kälte'
https://www.zeit.de/news/2026-01/07/warm-einpacken-klirrende-kaelte-im-suedosten-erwartet,https://www.zeit.de/news/2026-01/07/warm-einpacken-klirrende-kaelte-im-suedosten-erwartet,0,www.zeit.de,Wetter: Warm einpacken – Klirrende Kälte im Südosten erwartet,Hier finden Sie Informationen zu dem Thema „Wetter“. Lesen Sie jetzt „Warm einpacken – Klirrende Kälte im Südosten erwartet“.,https://img.zeit.de/news/2026-01/07/warm-einpacken-klirrende-kaelte-im-suedosten-erwartet-image-group/wide__1300x731,2026-01-07T06:29:50Z,,"Im Südosten Deutschlands bleibt es tiefwinterlich. Kalte Meeresluft sorgt weiter für verbreiteten Dauerfrost sowie Schnee- und Eisglätte, wie der Deutsche Wetterdienst (DWD) mitteilte. Besonders im E… [+724 chars]",,de,'Kälte'
https://www.zeit.de/news/2026-01/07/wie-obdachlosen-in-rheinland-pfalz-im-winter-geholfen-wird,https://www.zeit.de/news/2026-01/07/wie-obdachlosen-in-rheinland-pfalz-im-winter-geholfen-wird,0,www.zeit.de,Soziales: Wie Obdachlosen in Rheinland-Pfalz im Winter geholfen wird,Hier finden Sie Informationen zu dem Thema „Soziales“. Lesen Sie jetzt „Wie Obdachlosen in Rheinland-Pfalz im Winter geholfen wird“.,https://img.zeit.de/news/2026-01/07/wie-obdachlosen-in-rheinland-pfalz-im-winter-geholfen-wird-image-group/wide__1300x731,2026-01-07T06:30:05Z,,Seit Mitte November stehen wieder drei Iglus auf der Festwiese in Neustadt an der Weinstraße. Die halbrunden Kammern bestehen aus wetterfestem Isoliermaterial und haben einen lebensrettenden Zweck: S… [+3390 chars],,de,'Winter'
https://www.morgenpost.de/berlin/article410837880/stromausfall-berlin-blackout-news-aktuell-live-polizei-feuerwehr-zehlendorf.html,https://www.morgenpost.de/berlin/article410837880/stromausfall-berlin-blackout-news-aktuell-live-polizei-feuerwehr-zehlendorf.html,0,www.morgenpost.de,Black-Out-Ende in Sicht: Ab 11 Uhr haben alle wieder Strom,Knapp 20.000 Haushalte im Berliner Südwesten können sich Hoffnung machen: Der Strom soll nach dem Blackout ab Mittwochvormittag wieder fließen. News im Blog.,https://img.sparknews.funkemedien.de/410846757/410846757_1767545535_v16_9_1600.jpeg,2026-01-07T07:31:59Z,,"Während der großflächige Stromausfall im Südwesten Berlins die Stadt lahmlegte, wollten offenbar Kriminelle die Gelegenheit nutzen, um an Bargeld zu gelangen. Die Polizei kam ihnen jedoch zuvor: In d… [+1268 chars]",,de,'Black Out'
https://www.zeit.de/news/2026-01/07/kaelte-und-defekte-heizung-unterricht-faellt-an-schule-aus,https://www.zeit.de/news/2026-01/07/kaelte-und-defekte-heizung-unterricht-faellt-an-schule-aus,0,www.zeit.de,Winterwetter: Kälte und defekte Heizung: Unterricht fällt an Schule aus,Hier finden Sie Informationen zu dem Thema „Winterwetter“. Lesen Sie jetzt „Kälte und defekte Heizung: Unterricht fällt an Schule aus“.,https://img.zeit.de/news/2026-01/07/kaelte-und-defekte-heizung-unterricht-faellt-an-schule-aus-image-group/wide__1300x731,2026-01-07T08:18:42Z,,Wegen der Störung an der Heizungsanlage fällt in einer Schule in Lauf an der Pegnitz (Nürnberger Land) der Präsenzunterricht teilweise aus. Wie das Bayerische Staatsministerium für Unterricht und Kul… [+706 chars],,de,'Winter'
https://www.stern.de/gesundheit/psychologie/gesichtserkennung--warum-die-gen-z-probleme-mit-alten-gesichtern-hat-37010544.html,https://www.stern.de/gesundheit/psychologie/gesichtserkennung--warum-die-gen-z-probleme-mit-alten-gesichtern-hat-37010544.html,0,www.stern.de,Gesichter erkennen: Für die Gen Z sind die Boomer ein blinder Fleck,"Die Gen Z und Gesichtserkennung? Ein Problem. Die jungen Erwachsenen erkennen zwar ihresgleichen wieder, aber schwächeln, wenn es um die Gesichter ältere Menschen geht.",https://image.stern.de/37012140/t/oE/v5/w1440/r1.7778/-/gesichtserkennung-der-gen-z.jpg,2026-01-07T08:22:00Z,,"Zugang zu stern+statt 11,96 
 nur 1  
<ul><li>Alles von stern+ mit erstklassigen Inhalten von GEO und Capital</li><li>4 Wochen testen, dann 2,99  je Woche</li><li>jederzeit kündbar</li></ul>",,de,'ältere Menschen'
https://www.zeit.de/news/2026-01/07/winternotprogramm-oeffnet-wegen-kaelte-tagsueber,https://www.zeit.de/news/2026-01/07/winternotprogramm-oeffnet-wegen-kaelte-tagsueber,0,www.zeit.de,Obdachlosenhilfe: Winternotprogramm öffnet wegen Kälte tagsüber,Hier finden Sie Informationen zu dem Thema „Obdachlosenhilfe“. Lesen Sie jetzt „Winternotprogramm öffnet wegen Kälte tagsüber“.,https://img.zeit.de/news/2026-01/07/winternotprogramm-oeffnet-wegen-kaelte-tagsueber-image-group/wide__1300x731,2026-01-07T09:46:40Z,,Aufgrund der wohl auch in den kommenden Tagen noch anhaltend frostigen Temperaturen können obdachlose Menschen das Hamburger Winternotprogramm rund um die Uhr nutzen. Mit Blick auf die Wetterlage sei… [+884 chars],,de,'Kälte'
https://www.stern.de/news/csu-landesgruppe-kritisiert-bruesseler-wirtschaftspolitik---katastrophal--37017728.html,https://www.stern.de/news/csu-landesgruppe-kritisiert-bruesseler-wirtschaftspolitik---katastrophal--37017728.html,0,www.stern.de,"CSU-Landesgruppe kritisiert Brüsseler Wirtschaftspolitik: ""Katastrophal""","CSU-Landesgruppenchef Alexander Hoffmann hat die Wirtschaftspolitik der Europäischen Union scharf kritisiert. ""Brüssel muss aufwachen"", sagte Hoffmann am Mittwoch am Rande der Winterklausur der CSU-Landesgruppe in Kloster Seeon. Europa sei seit Monaten mit ge…",https://image.stern.de/37017730/t/Hm/v1/w1440/r1.7778/-/07--alexander-hoffmann---38031557d036fd40.jpg,2026-01-07T10:41:12Z,,"Kopiere den aktuellen Link
Zur Merkliste hinzufügen
CSU-Landesgruppenchef Alexander Hoffmann hat die Wirtschaftspolitik der Europäischen Union scharf kritisiert. ""Brüssel muss aufwachen"", sagte Hof… [+1225 chars]",,de,'Energiekosten'
https://www.zeit.de/news/2026-01/07/auch-bei-eis-und-schnee-schulen-grundsaetzlich-geoeffnet,https://www.zeit.de/news/2026-01/07/auch-bei-eis-und-schnee-schulen-grundsaetzlich-geoeffnet,0,www.zeit.de,Schulbetrieb im Winter: Auch bei Eis und Schnee: Schulen grundsätzlich geöffnet,Hier finden Sie Informationen zu dem Thema „Schulbetrieb im Winter“. Lesen Sie jetzt „Auch bei Eis und Schnee: Schulen grundsätzlich geöffnet“.,https://img.zeit.de/news/2026-01/07/auch-bei-eis-und-schnee-schulen-grundsaetzlich-geoeffnet-image-group/wide__1300x731,2026-01-07T11:49:56Z,,Das Schweriner Bildungsministerium hat angesichts der Wetterprognosen auf die Regelungen für den Schulbetrieb in der Winterzeit hingewiesen. Die Schulen seien grundsätzlich geöffnet und für alle Jahr… [+607 chars],,de,'Winter'
