index,url,valid,domain,title,description,image,published,archive,content,quote,language,keyword
https://www.focus.de/politik/wegen-hoher-nachzahlungen-linke-fordert-mieterschutz-durch-heizkostenfonds-von-zehn-millionen-euro_id_259645622.html,https://www.focus.de/politik/wegen-hoher-nachzahlungen-linke-fordert-mieterschutz-durch-heizkostenfonds-von-zehn-millionen-euro_id_259645622.html,0,www.focus.de,Wegen hoher Nachzahlungen - Linke fordert Mieterschutz durch Heizkostenfonds von zehn Millionen Euro,"Hohe Nachzahlungsforderungen für Heizung und Warmwasser belasten viele Mieter. Die Linke macht nun Vorschläge, um Menschen mit weniger Geld in dieser Lage zu helfen.",https://p6.focus.de/img/regional/berlin/id_259645621/eine-person-macht-eine-heizung-an.-zu-dpa-linke-schlaegt-heizkostenfonds-fuer-mieter-vor-.jpg?im=Crop%3D%280%2C169%2C2048%2C1024%29%3BResize%3D%281200%2C627%29&impolicy=perceptual&quality=mediumHigh&hash=2e57793209db8eb2324632c062a2c726597805073f2abc227b11f860ec920b6a,2024-02-06T15:30:12Z,,"Die Linksfraktion im Berliner Abgeordnetenhaus schlägt einen Fonds des Landes vor, um Haushalten mit sehr hohen Nachzahlungsforderungen für Warmwasser und Heizung zu helfen. Ein Heizkostenfonds könne… [+1882 chars]",,de,'Gas'
https://www.sueddeutsche.de/muenchen/muenchner-wohnen-gas-nachzahlungen-1.6344977,https://www.sueddeutsche.de/muenchen/muenchner-wohnen-gas-nachzahlungen-1.6344977,0,www.sueddeutsche.de,Mieter der Münchner Wohnen: Bis zu 3000 Euro Nachzahlung fürs Gas,Hat die städtische Wohnungsgesellschaft einen besonders ungünstigen Tarif bei den Stadtwerken abgeschlossen? Mieter berichten von horrenden Nachforderungen.,https://www.sueddeutsche.de/image/sz.1.6344980/1200x675?v=1707236890,2024-02-06T16:28:15Z,,Hat die städtische Wohnungsgesellschaft einen besonders ungünstigen Tarif bei den Stadtwerken abgeschlossen? Mieter berichten von horrenden Nachforderungen. Die Münchner Linke erhält derzeit außergew… [+363 chars],,de,'Gas'
https://www.welt.de/regionales/hamburg/article249951766/Heizen-Hamburg-will-Fern-und-Nahwaerme-ausbauen-aber-jeder-vierte-Haushalt-geht-leer-aus.html,https://www.welt.de/regionales/hamburg/article249951766/Heizen-Hamburg-will-Fern-und-Nahwaerme-ausbauen-aber-jeder-vierte-Haushalt-geht-leer-aus.html,0,www.welt.de,Hamburg will Fern- und Nahwärme ausbauen – aber jeder vierte Haushalt geht leer aus,"Bis 2026 muss Hamburg, wie alle Großstädte in Deutschland, eine Wärmeleitplanung vorlegen, die straßengenau zeigt, wo Häuser an Fern-, Nah- oder umweltfreundliche Gasnetze angeschlossen werden können. Einen ersten Entwurf hat der Senat jetzt vorgelegt.",https://img.welt.de/img/regionales/hamburg/mobile249953034/6061350747-ci16x9-w1200/Fernwaermerohre.jpg,2024-02-06T16:46:14Z,,"Künftig soll in Deutschland viel seltener mit Öl-, Erdgas oder sogar Kohle geheizt werden. In Hamburg gilt seit Langem, dass beim Austausch einer Heizung mindestens 15 Prozent der eingesetzten Brenns… [+4872 chars]",,de,'Gas'
https://www.zeit.de/wissen/umwelt/2024-02/energiewende-emissionen-europa-wind-sonne-gas-fossile,https://www.zeit.de/wissen/umwelt/2024-02/energiewende-emissionen-europa-wind-sonne-gas-fossile,0,www.zeit.de,Energiewende: Erstmals mehr Wind als Gas in Europas Energiemix,Weniger Nachfrage und mehr Wind- und Solarstrom haben 2023 die Emissionen im EU-Energiesektor gesenkt. Europas Windkraft konnte Frankreichs kompletten Strombedarf decken.,https://img.zeit.de/wissen/umwelt/2024-02/energiewende-emissionen-europa-wind-sonne-gas-bild/wide__1300x731,2024-02-06T23:50:52Z,,"Die Emissionen im Energiesektor in der EU sind einer Analyse 
zufolge in der Europäischen Union im vergangenen Jahr so stark 
zurückgegangen wie noch nie. Der Emissionsrückgang um 19 Prozent sei zu… [+2754 chars]",,de,'Gas'
https://www.sueddeutsche.de/leben/spielen-kinder-allein-spielen-familientrio-1.6345377,https://www.sueddeutsche.de/leben/spielen-kinder-allein-spielen-familientrio-1.6345377,0,www.sueddeutsche.de,"Familientrio: Ist es für die Entwicklung wichtig, dass Kinder allein spielen?","Der vierjährige Sohn möchte zu Hause am liebsten mit seiner Mutter spielen. Die fragt sich: Wäre es nicht besser, wenn er sich auch mal selber beschäftigen könnte? Das Familientrio weiß Rat.",https://www.sueddeutsche.de/image/sz.1.3158768/1200x675?v=1707314516,2024-02-07T13:58:13Z,,"Der vierjährige Sohn möchte zu Hause am liebsten mit seiner Mutter spielen. Die fragt sich: Wäre es nicht besser, wenn er sich auch mal selber beschäftigen könnte? Das Familientrio weiß Rat.Mein Sohn… [+514 chars]",,de,'Kinder'
https://www.tagesschau.de/inland/innenpolitik/kindesmissbrauch-strafrecht-reform-100.html,https://www.tagesschau.de/inland/innenpolitik/kindesmissbrauch-strafrecht-reform-100.html,0,www.tagesschau.de,Kabinett macht Strafverschärfung bei Kinderpornografie teils rückgängig,"Die Strafen für Besitz und Weiterverbreitung von Kinderpornografie sollen teils abgeschwächt werden. Ein Grund: Bislang mussten etwa auch Eltern bestraft werden, die Bilder weitergeleitet hatten, um Missstände aufzuzeigen.",https://images.tagesschau.de/image/0acc5f1f-b32f-4a71-b343-efac419f8626/AAABjYOf2O8/AAABibBxqrQ/16x9-1280/smartphone-porno-100.jpg,2024-02-07T13:59:04Z,,"Stand: 07.02.2024 14:59 Uhr
Die Strafen für Besitz und Weiterverbreitung von Kinderpornografie sollen teils abgeschwächt werden. Ein Grund: Bislang mussten etwa auch Eltern bestraft werden, die Bild… [+3685 chars]",,de,'Kinder'
https://www.sueddeutsche.de/politik/kinderpornografie-verbreitung-gesetz-aenderung-1.6345378,https://www.sueddeutsche.de/politik/kinderpornografie-verbreitung-gesetz-aenderung-1.6345378,0,www.sueddeutsche.de,Strafrecht: Bund ändert Gesetz zu Kinderpornografie,"Vor gut zwei Jahren erst wurden die Strafen für alle, die Darstellungen sexuellen Missbrauchs an Kindern verbreiten, deutlich verschärft. Nach Kritik aus der Praxis sieht sich die Bundesregierung nun zu einer neuerlichen Reform veranlasst.",https://www.sueddeutsche.de/image/sz.1.5593144/1200x675?v=1707315671,2024-02-07T14:22:31Z,,"Das Bundeskabinett hat sich nach Kritik aus der Praxis entschieden, die im Juli 2021 in Kraft getretenen strafrechtlichen Bestimmungen zur Verbreitung von Darstellungen sexuellen Missbrauchs an Kinde… [+2004 chars]",,de,'Kinder'
https://www.sueddeutsche.de/politik/myanmar-luftangriff-gegen-schule-1.6345457,https://www.sueddeutsche.de/politik/myanmar-luftangriff-gegen-schule-1.6345457,0,www.sueddeutsche.de,Myanmar: Luftangriff gegen Schule,In Myanmar sind bei einem Luftangriff auf eine Schule im Bundesstaat Kayah laut Menschenrechtlern vier Kinder getötet und 15 weitere verletzt worden. Wie der...,https://www.sueddeutsche.de/assets/png/sz-ecb090256670a577bd629a9718686332.png,2024-02-07T15:10:29Z,,In Myanmar sind bei einem Luftangriff auf eine Schule im Bundesstaat Kayah laut Menschenrechtlern vier Kinder getötet und 15 weitere verletzt worden. Wie der Pressedienst Ucanews am Mittwoch berichte… [+509 chars],,de,'Kinder'
