index,url,valid,domain,title,description,image,published,archive,content,quote,language,keyword
https://www.zeit.de/news/2026-04/17/limo-tiefkuehlpizza-wurst-fuer-kinder-besonders-schaedlich,https://www.zeit.de/news/2026-04/17/limo-tiefkuehlpizza-wurst-fuer-kinder-besonders-schaedlich,0,www.zeit.de,"Ernährung: Limo, Tiefkühlpizza, Wurst - für Kinder besonders schädlich?","Hier finden Sie Informationen zu dem Thema „Ernährung“. Lesen Sie jetzt „Limo, Tiefkühlpizza, Wurst - für Kinder besonders schädlich?“.",https://img.zeit.de/news/2026-04/17/limo-tiefkuehlpizza-wurst-fuer-kinder-besonders-schaedlich-image-group/wide__1300x731,2026-04-17T04:00:09Z,,"Limos in bunten Flaschen, Wurst oder Chips in Tierform und gesüßter Joghurt mit beliebten Filmmotiven - in den Supermarktregalen gibt es viele Fertigprodukte, die besonders für Kinder und Jugendliche… [+6490 chars]",,de,'Kinder'
https://www.zeit.de/news/2026-04/17/hera-lind-wuerde-sich-immer-wieder-fuer-kinder-entscheiden,https://www.zeit.de/news/2026-04/17/hera-lind-wuerde-sich-immer-wieder-fuer-kinder-entscheiden,0,www.zeit.de,Literatur: Hera Lind würde sich immer wieder für Kinder entscheiden,Hier finden Sie Informationen zu dem Thema „Literatur“. Lesen Sie jetzt „Hera Lind würde sich immer wieder für Kinder entscheiden“.,https://img.zeit.de/news/2026-04/17/hera-lind-wuerde-sich-immer-wieder-fuer-kinder-entscheiden-image-group/wide__1300x731,2026-04-17T04:56:12Z,,"Schriftstellerin Hera Lind (68/«Das Superweib») würde sich nach eigenen Angaben immer wieder für Kinder entscheiden. «Loriot schrieb, dass ein Leben ohne Hund möglich, aber sinnlos sei, für mich gilt… [+643 chars]",,de,'Kinder'
https://www.n-tv.de/wirtschaft/EU-Kommission-will-Stromsteuer-fuer-einige-Haushalte-auf-null-senken-id30723955.html,https://www.n-tv.de/wirtschaft/EU-Kommission-will-Stromsteuer-fuer-einige-Haushalte-auf-null-senken-id30723955.html,0,www.n-tv.de,Reaktion auf Energiekrise: EU-Kommission will Stromsteuer für einige Haushalte auf null senken,"Nicht nur einzelne Staaten reagieren auf die Energiekrise infolge des Iran-Kriegs. Auch die EU-Kommission hat einen Plan, wie Bürger und Unternehmen entlastet werden könnten. Die Unabhängigkeit von Öl und Gas steht im Zentrum, was sogar ein Umweltverband begr…",https://www.n-tv.de/img/30723991/1776408780/Img_16_9/1200/Mehrere-Strommasten-mit-Hochspannungsleitungen-vor-blauem-Himmel-zeigen-die-Verteilung-elektrischer-Energie-Das-Bild-steht-fuer-Stromversorgung-steigende-Energiepreise-und-die-Bedeutung-stabiler-Netze-in-der-Energiepolitik.jpg,2026-04-17T05:15:13Z,,"Die EU-Kommission will in Sachen Energie künftig noch stärker auf Strom setzen. (Foto: picture alliance / CHROMORANGE)
Nicht nur einzelne Staaten reagieren auf die Energiekrise infolge des Iran-Krie… [+3290 chars]",,de,'Gas'
https://www.faz.net/aktuell/wirtschaft/immobilien-wohnen/energie-heizung/wohnstadt-asemwald-1137-eigentumswohnungen-accg-200715201.html,https://www.faz.net/aktuell/wirtschaft/immobilien-wohnen/energie-heizung/wohnstadt-asemwald-1137-eigentumswohnungen-accg-200715201.html,0,www.faz.net,Wohnstadt Asemwald: Die Verwaltung wird zur Mammutaufgabe,"23 Stockwerke, 1137 Eigentumswohnungen: Im Asemwald ist alles eine Spur größer. Renovierungen werden zu Großprojekten: Was soll aus der Gasheizung werden?",https://media0.faz.net/image/w1200h627/990ca8719d28/w5347h2793x0y446o/202604/f1259714-327c-11f1-bb17-0096ce342f8e/in-38-aufzuegen-nach-oben-die.webp,2026-04-17T06:00:00Z,,"Bei den drei riesigen Wohngebäuden im Asemwald in Stuttgart greifen übliche Klischees nicht. Die Wohnstadt mit 23 Stockwerken gilt nicht als Ghetto, sondern als beliebte Wohnanlage mit 1137 Eigentums… [+6946 chars]",,de,'Gas'
https://www.zeit.de/news/2026-04/17/talfahrt-der-spritpreise-haelt-an,https://www.zeit.de/news/2026-04/17/talfahrt-der-spritpreise-haelt-an,0,www.zeit.de,Mobilitätskosten: Talfahrt der Spritpreise hält an,Hier finden Sie Informationen zu dem Thema „Mobilitätskosten“. Lesen Sie jetzt „Talfahrt der Spritpreise hält an“.,https://img.zeit.de/news/2026-04/17/talfahrt-der-spritpreise-haelt-an-image-group/wide__1300x731,2026-04-17T07:13:04Z,,"Die langsame Entspannung an den Tankstellen geht weiter: Vor allem Diesel, aber auch Superbenzin der Sorte E10 werden billiger. Im bundesweiten Tagesschnitt kostete E10 pro Liter 2,077 Euro, wie der … [+1022 chars]",,de,'Spritpreise'
https://scilogs.spektrum.de/natur-des-glaubens/verschwoerungsfragen-68-mit-bettina-rommelfanger-daniel-koehler-von-konex-zur-deradikalisierung-von-verschwoerungsglaeubigen/,https://scilogs.spektrum.de/natur-des-glaubens/verschwoerungsfragen-68-mit-bettina-rommelfanger-daniel-koehler-von-konex-zur-deradikalisierung-von-verschwoerungsglaeubigen/,0,scilogs.spektrum.de,Verschwörungsfragen 68 mit Bettina Rommelfanger & Daniel Köhler von Konex zur Deradikalisierung von Verschwörungsgläubigen,"Aus den SciLogs: Ich hoffe, wir sind uns einig: Durch das Irankrieg-Desaster der USA sind die Öl- und Gas- und damit auch Benzin-, Diesel-, Kerosin-, („Sprit“) und Düngerpreise längst global viel zu hoch. Viele vor allem asiatische Länder schränken den Verbra…",https://scilogs.spektrum.de/natur-des-glaubens/files/Podcastcover_neu-3.jpg,2026-04-17T09:13:19Z,,"Ich hoffe, wir sind uns einig: Durch das Irankrieg-Desaster der USA sind die Öl- und Gas- und damit auch Benzin-, Diesel-, Kerosin-, („Sprit“) und Düngerpreise längst global viel zu hoch. Viele vor a… [+5131 chars]",,de,'Gas'
https://www.zeit.de/news/2026-04/17/autokonvoi-gegen-hohe-spritpreise-rollt-richtung-berlin,https://www.zeit.de/news/2026-04/17/autokonvoi-gegen-hohe-spritpreise-rollt-richtung-berlin,0,www.zeit.de,Fahrt über Bundesstraßen: Autokonvoi gegen hohe Spritpreise rollt Richtung Berlin,Hier finden Sie Informationen zu dem Thema „Fahrt über Bundesstraßen“. Lesen Sie jetzt „Autokonvoi gegen hohe Spritpreise rollt Richtung Berlin“.,https://img.zeit.de/news/2026-04/17/autokonvoi-gegen-hohe-spritpreise-rollt-richtung-berlin-image-group/wide__1300x731,2026-04-17T09:26:06Z,,Aus Protest gegen die stark gestiegenen Spritpreise ist seit dem Morgen ein Autokonvoi von Ostfriesland unterwegs Richtung Berlin. Kurz nach der Abfahrt in Emden hatten sich rund 35 Fahrzeuge zu der … [+2407 chars],,de,'Spritpreise'
https://www.stern.de/gesellschaft/regional/hessen/arbeitsunfall--darum-ist-kohlenmonoxid-so-gefaehrlich-37318514.html,https://www.stern.de/gesellschaft/regional/hessen/arbeitsunfall--darum-ist-kohlenmonoxid-so-gefaehrlich-37318514.html,0,www.stern.de,Arbeitsunfall: Darum ist Kohlenmonoxid so gefährlich,Runkel (lhe) - Nach dem tödlichen Arbeitsunfall in einer mittelhessischen Gerberei beginnt die Ursachenforschung. Ein möglicher Grund ist eine,https://image.stern.de/37318516/t/Ge/v1/w1440/r1.7778/-/17--e63wokd6thv5axs2048jpeg---f45baaaa8ef07fbb.jpg,2026-04-17T10:02:31Z,,"Kopiere den aktuellen Link
Zur Merkliste hinzufügen
Noch ist unklar, woran die drei Männer in einer mittelhessischen Gerberei starben. Als mögliche Ursache genannt wird Kohlenmonoxid.
Nach dem töd… [+2467 chars]",,de,'Kohle'
https://kaernten.orf.at/stories/3350423/,https://kaernten.orf.at/stories/3350423/,0,kaernten.orf.at,Mieter zahlte 27 Jahre Heizkosten doppelt,"Der Mieter einer Privatwohnung in Klagenfurt zahlte über viele Jahre Heizkosten doppelt, beim Vermieter und bei der Firma, die die Heizkostenabrechnung erstellte. Nach einer Beschwerde bei der Arbeiterkammer heißt es nun aber: Alles rechtens. Der Grund sind F…",https://ibs.orf.at/ktn?image=https%3A%2F%2Foekastatic.orf.at%2Fmims%2F2022%2F41%2F23%2Fcrops%2Fw%3D1200%2Ch%3D627%2Cq%3D75%2F1525135_master_555623_kalte_unis_daksi00576_00_10_35_01.jpg%3Fs%3D297796b94c46184121f73b2c6ec6e7b786f9df7f,2026-04-17T10:31:12Z,,"Herr F., dessen Name von der Redaktion geändert wurde, bewohnt seit Jahrzehnten eine Wohnung bei einem Privatvermieter in Klagenfurt. Ein erster Mietvertrag stammt noch aus dem Beginn der 1990er Jahr… [+1944 chars]",,de,'Heizkosten'
https://www.stern.de/news/demonstrationen-am-samstag-fuer-abkehr-von-kohle--oel-und-gas-37319602.html,https://www.stern.de/news/demonstrationen-am-samstag-fuer-abkehr-von-kohle--oel-und-gas-37319602.html,0,www.stern.de,"Demonstrationen am Samstag für Abkehr von Kohle, Öl und Gas","Umweltverbände und Initiativen haben für diesen Samstag in den Metropolen Berlin, Hamburg, München und Köln zu Demonstrationen für den Fortgang der Energiewende aufgerufen. Unter dem Motto ""Erneuerbare Energien verteidigen"" fordern die Initiatoren eine Abkehr…",https://image.stern.de/37319604/t/Z0/v1/w1440/r1.7778/-/17--demonstrationen-am-samstag-fuer-fortgang-der-energiewende---42e9a919c2e6d348.jpg,2026-04-17T14:17:48Z,,"Kopiere den aktuellen Link
Zur Merkliste hinzufügen
Umweltverbände und Initiativen haben für diesen Samstag in den Metropolen Berlin, Hamburg, München und Köln zu Demonstrationen für den Fortgang d… [+2346 chars]",,de,'Gas'
https://www.sueddeutsche.de/projekte/artikel/gesellschaft/lachgas-verbot-k-o-tropfen-e951591/,https://www.sueddeutsche.de/projekte/artikel/gesellschaft/lachgas-verbot-k-o-tropfen-e951591/,0,www.sueddeutsche.de,Lachgas-Verbot: Schluss mit lustig,Seit dieser Woche schränkt ein Gesetz auch in Deutschland den Besitz von Lachgas und K.-o.-Tropfen ein. Vollständig verboten werden die Stoffe aber nicht. Warum das so ist und was Eltern betroffener Kinder tun können.,https://www.sueddeutsche.de/projekte/artikel/gesellschaft/lachgas-verbot-k-o-tropfen-e951591/5528ca534b291f2968d52cecf2f22b9a0595ffcd3e1141b5b1f7ef96d1b58d69_w2400_h1256_q70.jpg,2026-04-17T15:14:00Z,,"Meistens hat Emil das Lachgas zu Freunden mitgebracht, anfangs auch, als er noch keine 18 war. Umso praktischer, dass er die Droge gleich nebenan im Supermarkt kaufen konnte. In kleiner Runde, zu vie… [+284 chars]",,de,'Kinder'
https://www.zeit.de/news/2026-04/17/schueler-gestalten-gedenkfeier-fuer-ermordete-juedische-kinder,https://www.zeit.de/news/2026-04/17/schueler-gestalten-gedenkfeier-fuer-ermordete-juedische-kinder,0,www.zeit.de,NS-Verbrechen: Schüler gestalten Gedenkfeier für ermordete jüdische Kinder,Hier finden Sie Informationen zu dem Thema „NS-Verbrechen“. Lesen Sie jetzt „Schüler gestalten Gedenkfeier für ermordete jüdische Kinder“.,https://img.zeit.de/news/2026-04/17/schueler-gestalten-gedenkfeier-fuer-ermordete-juedische-kinder-image-group/wide__1300x731,2026-04-17T16:55:44Z,,"Mit einer Gedenkfeier erinnert der Hamburger Verein «Kinder vom Bullenhuser Damm» am Montag an die Ermordung von 20 jüdischen Kindern vor 81 Jahren. 
Das Programm der Gedenkfeier wird von Mädchen un… [+1624 chars]",,de,'Kinder'
https://www.zeit.de/news/2026-04/18/wwf-vermieter-sollen-extra-heizkosten-tragen,https://www.zeit.de/news/2026-04/18/wwf-vermieter-sollen-extra-heizkosten-tragen,0,www.zeit.de,Wohnen: WWF: Vermieter sollen Extra-Heizkosten tragen,Hier finden Sie Informationen zu dem Thema „Wohnen“. Lesen Sie jetzt „WWF: Vermieter sollen Extra-Heizkosten tragen“.,https://img.zeit.de/news/2026-04/18/wwf-vermieter-sollen-extra-heizkosten-tragen-image-group/wide__1300x731,2026-04-18T04:00:04Z,,"Vermieter sollten nach Ansicht des WWF künftige Extrakosten durch fossile Heizbrennstoffe gänzlich übernehmen müssen. Das verlangt die Umweltschutzorganisation in einem Forderungspapier, das der Deut… [+2065 chars]",,de,'Heizkosten'
https://www.stern.de/wirtschaft/news/wohnen--wwf--vermieter-sollen-extra-heizkosten-tragen-37320500.html,https://www.stern.de/wirtschaft/news/wohnen--wwf--vermieter-sollen-extra-heizkosten-tragen-37320500.html,0,www.stern.de,Wohnen: WWF: Vermieter sollen Extra-Heizkosten tragen,"Noch ist unklar, was die Reform des Heizungsgesetzes für Mieter bedeutet. Denn der CO2-Preis steigt, zugleich sollen Heizungen mit fossilen Brennstoffen weiter betrieben werden können.",https://image.stern.de/37320502/t/nD/v1/w1440/r1.7778/-/18--nhmmzm4ya6v6axs2048jpeg---fe2928cd150a9698.jpg,2026-04-18T04:00:04Z,,"Kopiere den aktuellen Link
Zur Merkliste hinzufügen
Noch ist unklar, was die Reform des Heizungsgesetzes für Mieter bedeutet. Denn der CO2-Preis steigt, zugleich sollen Heizungen mit fossilen Brenn… [+2266 chars]",,de,'Heizkosten'
https://www.tagesspiegel.de/wirtschaft/wohnen-wwf-vermieter-sollen-extra-heizkosten-tragen-15495578.html,https://www.tagesspiegel.de/wirtschaft/wohnen-wwf-vermieter-sollen-extra-heizkosten-tragen-15495578.html,0,www.tagesspiegel.de,Wohnen: WWF: Vermieter sollen Extra-Heizkosten tragen,"Noch ist unklar, was die Reform des Heizungsgesetzes für Mieter bedeutet. Denn der CO2-Preis steigt, zugleich sollen Heizungen mit fossilen Brennstoffen weiter betrieben werden können.",https://www.tagesspiegel.de/images/15495577/alternates/BASE_16_9_W1400/1776484868000/heizkosten.jpeg,2026-04-18T04:01:08Z,,"Vermieter sollten nach Ansicht des WWF künftige Extrakosten durch fossile Heizbrennstoffe gänzlich übernehmen müssen. Das verlangt die Umweltschutzorganisation in einem Forderungspapier, das der Deut… [+2120 chars]",,de,'Heizkosten'
https://www.zeit.de/news/2026-04/18/mutter-und-kinder-bei-auffahrunfall-verletzt,https://www.zeit.de/news/2026-04/18/mutter-und-kinder-bei-auffahrunfall-verletzt,0,www.zeit.de,Unfall: Mutter und Kinder bei Auffahrunfall verletzt,Hier finden Sie Informationen zu dem Thema „Unfall“. Lesen Sie jetzt „Mutter und Kinder bei Auffahrunfall verletzt“.,https://img.zeit.de/news/2026-04/18/mutter-und-kinder-bei-auffahrunfall-verletzt-image-group/wide__1300x731,2026-04-18T09:24:23Z,,"Zwei Kinder, ihre Mutter und ein junger Mann sind bei einem Auffahrunfall in Erfurt verletzt worden. Der 22-Jährige krachte laut Polizei mit seinem Auto auf den vorausfahrenden Wagen der Mutter, als … [+457 chars]",,de,'Kinder'
https://www.stern.de/gesellschaft/regional/niedersachsen-bremen/investitionen--neue-spezialwagen-fuer-katastrophenschutz-in-niedersachsen-37321362.html,https://www.stern.de/gesellschaft/regional/niedersachsen-bremen/investitionen--neue-spezialwagen-fuer-katastrophenschutz-in-niedersachsen-37321362.html,0,www.stern.de,Investitionen: Neue Spezialwagen für Katastrophenschutz in Niedersachsen,"Niedersachsen rüstet für den Katastrophenschutz auf: Neun geländegängige Krankentransportwagen sollen bei Hochwasser, Starkregen und Schnee zum Einsatz kommen. Was die Spezial-Wagen leisten sollen.",https://image.stern.de/37321364/t/qc/v1/w1440/r1.7778/-/18--tvks2nhabkv8axs2048jpeg---5ab04d0dffa3624c.jpg,2026-04-18T11:53:26Z,,"Kopiere den aktuellen Link
Zur Merkliste hinzufügen
Niedersachsen rüstet für den Katastrophenschutz auf: Neun geländegängige Krankentransportwagen sollen bei Hochwasser, Starkregen und Schnee zum E… [+1987 chars]",,de,'Hochwasser'
https://www.zeit.de/news/2026-04/18/gasaustritt-im-unstrut-hainich-kreis-bewohner-evakuiert,https://www.zeit.de/news/2026-04/18/gasaustritt-im-unstrut-hainich-kreis-bewohner-evakuiert,0,www.zeit.de,Notfall: Gasaustritt im Unstrut-Hainich-Kreis - Bewohner evakuiert,Hier finden Sie Informationen zu dem Thema „Notfall“. Lesen Sie jetzt „Gasaustritt im Unstrut-Hainich-Kreis - Bewohner evakuiert“.,https://img.zeit.de/news/2026-04/18/gasaustritt-im-unstrut-hainich-kreis-bewohner-evakuiert-image-group/wide__1300x731,2026-04-18T14:49:13Z,,"Durch Tiefbauarbeiten ist in Nottertal-Heilinger Höhen (Unstrut-Hainich-Kreis) Gas aus einer Leitung ausgetreten. Nach Angaben der Feuerwehr versucht die Baufirma derzeit, die Straße zu öffnen. Demna… [+382 chars]",,de,'Gas'
https://www.bild.de/leben-wissen/energiesparen-mit-diesen-tricks-schnell-und-einfach-geld-sparen-69dfb08993130bd3499d2be6,https://www.bild.de/leben-wissen/energiesparen-mit-diesen-tricks-schnell-und-einfach-geld-sparen-69dfb08993130bd3499d2be6,0,www.bild.de,Mit diesen Tipps sparen Sie Energie - Internetrouter verbrauchen so viel Strom wie ein Kühlschrank,"So senken Haushalte mit Heizen, Strom und Warmwasser spürbar ihre Energiekosten.","https://images.bild.de/69dfb08993130bd3499d2be6/1fe178ebcfa99372108e9a415a6140b8,190368b6?w=1280",2026-04-19T02:42:01Z,,TTS-Player überspringenArtikel weiterlesenDie Energiepreise steigen wieder und viele Haushalte zahlen drauf. Doch es gibt auch eine gute Nachricht: Im eigenen Zuhause steckt großes Sparpotenzial. Wer… [+2821 chars],,de,'Energiekosten'
https://www.zeit.de/news/2026-04/19/entwarnung-nach-gasleck-in-leegebruch,https://www.zeit.de/news/2026-04/19/entwarnung-nach-gasleck-in-leegebruch,0,www.zeit.de,Blaulicht: Entwarnung nach Gasleck in Leegebruch,Hier finden Sie Informationen zu dem Thema „Blaulicht“. Lesen Sie jetzt „Entwarnung nach Gasleck in Leegebruch“.,https://img.zeit.de/news/2026-04/19/entwarnung-nach-gasleck-in-leegebruch-image-group/wide__1300x731,2026-04-19T06:46:31Z,,"Durch ein Leck ist in Leegebruch (Landkreis Oberhavel) Gas ausgetreten. Das Gasleck trat am Volkshaus in der Eichenallee auf, wie ein Sprecher der Leitstelle Nordost mitteilte. Die Feuerwehr sperrte … [+287 chars]",,de,'Gas'
https://www.tagesspiegel.de/wirtschaft/kritik-an-entlastungsmassnahmen-von-schwarz-rot-okonom-fratzscher-fur-energiepauschale-von-300-euro-15498532.html,https://www.tagesspiegel.de/wirtschaft/kritik-an-entlastungsmassnahmen-von-schwarz-rot-okonom-fratzscher-fur-energiepauschale-von-300-euro-15498532.html,0,www.tagesspiegel.de,Kritik an Entlastungsmaßnahmen von Schwarz-Rot : Ökonom Fratzscher für Energiepauschale von 300 Euro,"Von den geplanten Entlastungsmaßnahmen der Bundesregierung hält Ökonom Fratzscher wenig. Es komme nicht nur darauf an, dass der Staat handelt, sondern dass er zielgenau und gerecht handele.",https://www.tagesspiegel.de/images/15498599/alternates/BASE_16_9_W1400/1776609866000/bundespressekonferenz-zum-thema-klimageld-wir-zeigen-dass-es-moeglich-ist-prof-marcel-fratzscher-praesident-des-deut.jpeg,2026-04-19T14:52:21Z,,"Der Präsident des Deutschen Instituts für Wirtschaftsforschung (DIW), Marcel Fratzscher, hat die Entlastungsmaßnahmen der Bundesregierung bei den Energiepreisen als in Teilen ökonomisch ineffizient u… [+2269 chars]",,de,'Energiepauschale'
https://www.zeit.de/news/2026-04/19/polizei-acht-kinder-bei-schusswaffenvorfall-getoetet,https://www.zeit.de/news/2026-04/19/polizei-acht-kinder-bei-schusswaffenvorfall-getoetet,0,www.zeit.de,Notfälle: Polizei: Acht Kinder bei Schusswaffenvorfall getötet,Hier finden Sie Informationen zu dem Thema „Notfälle“. Lesen Sie jetzt „Polizei: Acht Kinder bei Schusswaffenvorfall getötet“.,https://img.zeit.de/administratives/sharing/fallback-image-die-zeit/wide__1300x731,2026-04-19T15:55:23Z,,Bei einem Schusswaffenvorfall in Shreveport im US-Bundesstaat Louisiana sind am Sonntagmorgen (Ortszeit) nach Polizeiangaben acht Kinder getötet worden. Vorläufigen Erkenntnissen zufolge waren die Op… [+131 chars],,de,'Kinder'
https://www.faz.net/aktuell/gesellschaft/kriminalitaet/usa-acht-kinder-zwischen-1-und-14-jahren-bei-gewalttat-getoetet-accg-200747321.html,https://www.faz.net/aktuell/gesellschaft/kriminalitaet/usa-acht-kinder-zwischen-1-und-14-jahren-bei-gewalttat-getoetet-accg-200747321.html,0,www.faz.net,Bundesstaat LOUISIANA: Acht Kinder bei Gewalttat in den USA getötet,Im US-Bundesstaat Louisiana sind nach Angaben der Polizei acht Kinder im Alter von einem und 14 Jahren getötet worden. Ein Mann soll in einem Haus geschossen haben. Weitere Details sind noch nicht bekannt.,https://media0.faz.net/image/w1200h627/4e9eeea5578e/w2611h1364x0y75o/202604/43601.0.1990318753/ein-absperrband-der-polizei.webp,2026-04-19T17:14:56Z,,Bei einem Schusswaffenvorfall in Shreveport im US-Bundesstaat Louisiana sind am Sonntagmorgen (Ortszeit) nach Polizeiangaben acht Kinder getötet worden. Vorläufigen Erkenntnissen zufolge waren die Ge… [+873 chars],,de,'Kinder'
https://www.tagesschau.de/ausland/amerika/shreveport-usa-100.html,https://www.tagesschau.de/ausland/amerika/shreveport-usa-100.html,0,www.tagesschau.de,Acht Kinder bei Gewalttat in den USA getötet,In den USA hat ein Mann laut Polizei acht Kinder getötet. Der Tatverdächtige - offenbar der Vater einiger der Kinder - wurde nach einer Verfolgungsjagd erschossen. Die Hintergründe der Tat sind noch unklar.,https://images.tagesschau.de/image/9cc0cb89-af62-45b7-a5f3-9f5922d538ab/AAABnac5Mf8/AAABnSSvrFg/16x9-big/louisiana-112.jpg?width=1280,2026-04-19T19:36:40Z,,"Stand: 19.04.2026 21:36 Uhr
In den USA hat ein Mann laut Polizei acht Kinder getötet. Der Tatverdächtige - offenbar der Vater einiger der Kinder - wurde nach einer Verfolgungsjagd erschossen. Die Hi… [+1070 chars]",,de,'Kinder'
https://www.zeit.de/news/2026-04/19/feuerwehr-rettet-kinder-aus-brennendem-haus-in-bad-toelz,https://www.zeit.de/news/2026-04/19/feuerwehr-rettet-kinder-aus-brennendem-haus-in-bad-toelz,0,www.zeit.de,Flammen im Erdgeschoss: Feuerwehr rettet Kinder aus brennendem Haus in Bad Tölz,Hier finden Sie Informationen zu dem Thema „Flammen im Erdgeschoss“. Lesen Sie jetzt „Feuerwehr rettet Kinder aus brennendem Haus in Bad Tölz“.,https://img.zeit.de/news/2026-04/19/feuerwehr-rettet-kinder-aus-brennendem-haus-in-bad-toelz-image-group/wide__1300x731,2026-04-19T21:00:42Z,,"Bei einem Brand in einem Mehrfamilienhaus in Bad Tölz sind vier Menschen verletzt worden. Zwei Kinder seien von der Feuerwehr aus einem Dachfenster gerettet worden, andere Bewohner hätten das Gebäude… [+498 chars]",,de,'Kinder'
https://www.zeit.de/news/2026-04/20/louisiana-sieben-opfer-waren-kinder-des-tatverdaechtigen,https://www.zeit.de/news/2026-04/20/louisiana-sieben-opfer-waren-kinder-des-tatverdaechtigen,0,www.zeit.de,Notfälle: Louisiana: Sieben Opfer waren Kinder des Tatverdächtigen,Hier finden Sie Informationen zu dem Thema „Notfälle“. Lesen Sie jetzt „Louisiana: Sieben Opfer waren Kinder des Tatverdächtigen“.,https://img.zeit.de/news/2026-04/20/louisiana-sieben-opfer-waren-kinder-des-tatverdaechtigen-image-group/wide__1300x731,2026-04-19T23:55:01Z,,"Im US-Bundesstaat Louisiana hat ein 31-jähriger Mann nach Polizeiangaben sieben seiner eigenen Kinder erschossen. Zudem tötete er ein weiteres Kind und verletzte drei Menschen teils schwer, wie Poliz… [+642 chars]",,de,'Kinder'
https://www.zeit.de/news/2026-04/20/feuerwerkskoerper-explodiert-zwei-kinder-schwer-verletzt,https://www.zeit.de/news/2026-04/20/feuerwerkskoerper-explodiert-zwei-kinder-schwer-verletzt,0,www.zeit.de,Polizei ermittelt: Feuerwerkskörper explodiert: Zwei Kinder schwer verletzt,Hier finden Sie Informationen zu dem Thema „Polizei ermittelt“. Lesen Sie jetzt „Feuerwerkskörper explodiert: Zwei Kinder schwer verletzt“.,https://img.zeit.de/news/2026-04/20/feuerwerkskoerper-explodiert-zwei-kinder-schwer-verletzt-image-group/wide__1300x731,2026-04-20T03:49:31Z,,"Zwei Kinder sind in Neu Krenzlin im Kreis Ludwigslust-Parchim durch Feuerwerkskörper schwer verletzt worden. Die Polizei wurde am Sonntagnachmittag durch einen Ersthelfer vor Ort informiert, wie ein … [+393 chars]",,de,'Kinder'
https://www.zeit.de/news/2026-04/20/social-media-verbote-fuer-kinder-fachleute-daempfen-erwartung,https://www.zeit.de/news/2026-04/20/social-media-verbote-fuer-kinder-fachleute-daempfen-erwartung,0,www.zeit.de,Expertenkommission: Social-Media-Verbote für Kinder? Fachleute dämpfen Erwartung,Hier finden Sie Informationen zu dem Thema „Expertenkommission“. Lesen Sie jetzt „Social-Media-Verbote für Kinder? Fachleute dämpfen Erwartung“.,https://img.zeit.de/news/2026-04/20/social-media-verbote-fuer-kinder-fachleute-daempfen-erwartung-image-group/wide__1300x731,2026-04-20T06:15:05Z,,"Stundenlanges Chatten, Zocken und Scrollen: Vielen Eltern macht die Internetnutzung ihrer Kinder Sorge. Damit liegen sie nicht falsch, wie die Expertenkommission beim Bundesfamilienministerium jetzt … [+4992 chars]",,de,'Kinder'
https://www.faz.net/aktuell/politik/inland/social-media-und-kinder-wie-besserer-schutz-aussehen-koennte-accg-200747158.html,https://www.faz.net/aktuell/politik/inland/social-media-und-kinder-wie-besserer-schutz-aussehen-koennte-accg-200747158.html,0,www.faz.net,Kinder und Social Media: Wie besserer Schutz aussehen könnte,Die unabhängige Expertenkommission legt ihre Ergebnisse zur Social-Media-Nutzung vor: Große Schwächen sieht sie bei der wirksamen Durchsetzung von Einschränkungen für Kinder.,https://media0.faz.net/image/w1200h627/a75d290854b3/w3000h1567x0y216o/202604/a2a4a844-3bfc-11f1-b022-27ce9837386e/das-handy-fuer-jugendliche-der.webp,2026-04-20T06:17:41Z,,"Die Forderungen nach einem Verbot der Social-Media-Nutzung bis zu einem bestimmten Alter häufen sich, weil selbst kleine Kinder schon stundenlang vor dem Bildschirm sitzen. Nicht nur Bewegungsmangel … [+11508 chars]",,de,'Kinder'
https://www.zeit.de/news/2026-04/20/gewaltverbrechen-2025-leicht-ruecklaeufig-sorge-um-kinder,https://www.zeit.de/news/2026-04/20/gewaltverbrechen-2025-leicht-ruecklaeufig-sorge-um-kinder,0,www.zeit.de,Polizeistatistik: Gewaltverbrechen 2025 leicht rückläufig – Sorge um Kinder,Hier finden Sie Informationen zu dem Thema „Polizeistatistik“. Lesen Sie jetzt „Gewaltverbrechen 2025 leicht rückläufig – Sorge um Kinder“.,https://img.zeit.de/news/2026-04/20/gewaltverbrechen-2025-leicht-ruecklaeufig-sorge-um-kinder-image-group/wide__1300x731,2026-04-20T08:00:07Z,,"Die Polizei hat in Deutschland 2025 bundesweit 2,3 Prozent weniger Gewaltverbrechen registriert als im Jahr zuvor. Sorgen bereitet allerdings die nach wie vor steigende Zahl tatverdächtiger Kinder. D… [+2468 chars]",,de,'Kinder'
