index,url,valid,domain,title,description,image,published,archive,content,quote,language,keyword
https://www.zeit.de/zeit-fuer-unternehmer/2026/01/klimaschutz-eu-verbrenner-aus-elektroauto-nachhaltigkeit,https://www.zeit.de/zeit-fuer-unternehmer/2026/01/klimaschutz-eu-verbrenner-aus-elektroauto-nachhaltigkeit,0,www.zeit.de,Klimaschutz: E-MobilitûÊt rechnet sich ã wenn man es richtig anstellt,"Trotz Aus vom Verbrenner-Aus investieren Logistiker in E-MobilitûÊt. Nicht als Statement, sondern weil es sich rechnet. Die hohen Spritpreise bestûÊrken sie darin.",https://img.zeit.de/zeit-fuer-unternehmer/2026/01/machen-was-sich-rentiert-bild-1/wide__1300x731,2026-05-10T14:09:28Z,,"Ein StahltrûÊger in Knallorange spannt sich û¥ber den Parkplatz der Spedition Rû¥dinger im baden-wû¥rttembergischen StûÊdtchen Krautheim. An den Querstreben hûÊngen antennenartige Arme, groû wie û¥berdimensãÎ [+681 chars]",,de,'Spritpreise'
https://www.zeit.de/news/2026-05/11/diesel-faellt-unter-2-euro,https://www.zeit.de/news/2026-05/11/diesel-faellt-unter-2-euro,0,www.zeit.de,Spritpreise: Diesel fûÊllt unter 2 Euro,Hier finden Sie Informationen zu dem Thema ãSpritpreiseã. Lesen Sie jetzt ãDiesel fûÊllt unter 2 Euroã.,https://img.zeit.de/news/2026-05/11/diesel-faellt-unter-2-euro-image-group/wide__1300x731,2026-05-11T07:42:58Z,,"Zum ersten Mal seit Anfang MûÊrz kostet Diesel im bundesweiten Tagesdurchschnitt wieder weniger als 2 Euro pro Liter. Die Grenze wurde bereits am Freitag minimal mit 1,999 Euro pro Liter unterschritteãÎ [+1894 chars]",,de,'Spritpreise'
https://www.stern.de/wirtschaft/news/spritpreise--diesel-faellt-unter-2-euro-37387072.html,https://www.stern.de/wirtschaft/news/spritpreise--diesel-faellt-unter-2-euro-37387072.html,0,www.stern.de,Spritpreise: Diesel fûÊllt unter 2 Euro,"Schon in den ersten Tagen des Iran-Kriegs war der Kraftstoff û¥ber diese Schwelle gesprungen, nun hat Diesel sie nicht nur unterschritten, sondern nûÊhert sich auch immer stûÊrker dem Preis fû¥r E10.",https://image.stern.de/37387074/t/An/v1/w1440/r1.7778/-/11--sm3ytbwnq7v1axs2048jpeg---1c0fe92440e61a42.jpg,2026-05-11T07:42:58Z,,"Kopiere den aktuellen Link
Zur Merkliste hinzufû¥gen
Schon in den ersten Tagen des Iran-Kriegs war der Kraftstoff û¥ber diese Schwelle gesprungen, nun hat Diesel sie nicht nur unterschritten, sondernãÎ [+2106 chars]",,de,'Spritpreise'
https://www.zeit.de/wirtschaft/2026-05/energiepreise-gas-preis-anstieg-bundesnetzagentur,https://www.zeit.de/wirtschaft/2026-05/energiepreise-gas-preis-anstieg-bundesnetzagentur,0,www.zeit.de,Energiepreise: Bundesnetzagentur rûÊt Gasverbrauchern zur Sparsamkeit,"Die Bundesnetzagentur warnt vor hûÑheren Gaspreisen. Eine Wiederholung der Energiekrise 2022 erwartet die BehûÑrde nicht, mahnt aber einen ô£sorgsamenô¨ Verbrauch an.",https://img.zeit.de/wirtschaft/2026-05/energiepreise-gas-preis-anstieg-bundesnetzagentur-bild/wide__1300x731,2026-05-11T07:43:41Z,,Die Bundesnetzagentur erwartet einen moderaten Anstieg der Gaspreise und ruft Verbraucherinnen und Verbraucher infolgedessen zu Sparsamkeit auf. Wegen des Irankrieges sei eine ErhûÑhung der Gaspreise ãÎ [+2009 chars],,de,'Gas'
https://www.tagesspiegel.de/wirtschaft/spritpreise-diesel-fallt-unter-2-euro-15581720.html,https://www.tagesspiegel.de/wirtschaft/spritpreise-diesel-fallt-unter-2-euro-15581720.html,0,www.tagesspiegel.de,Spritpreise: Diesel fûÊllt unter 2 Euro,"Schon in den ersten Tagen des Iran-Kriegs war der Kraftstoff û¥ber diese Schwelle gesprungen, nun hat Diesel sie nicht nur unterschritten, sondern nûÊhert sich auch immer stûÊrker dem Preis fû¥r E10.",https://www.tagesspiegel.de/images/15581719/alternates/BASE_16_9_W1400/1778485461000/spritpreise.jpeg,2026-05-11T07:44:21Z,,"Zum ersten Mal seit Anfang MûÊrz kostet Diesel im bundesweiten Tagesdurchschnitt wieder weniger als 2 Euro pro Liter. Die Grenze wurde bereits am Freitag minimal mit 1,999 Euro pro Liter unterschritteãÎ [+1946 chars]",,de,'Spritpreise'
https://www.morgenpost.de/wirtschaft/article411964879/tanken-berlin-billig-benzin-diesel-super-spritpreise-heute-aktuell-11-mai.html,https://www.morgenpost.de/wirtschaft/article411964879/tanken-berlin-billig-benzin-diesel-super-spritpreise-heute-aktuell-11-mai.html,0,www.morgenpost.de,Gû¥nstig tanken in Berlin (11. Mai): Die gû¥nstigsten Tankstellen heute,"Die Spritpreise in Berlin erreichen neue HûÑchststûÊnde. Wer beim Tanken sparen will, sollte genau hinschauen ã welche Tipps helfen wirklich?",https://img.sparknews.funkemedien.de/411411200/411411200_1777874028_v16_9_1600.jpeg,2026-05-11T08:51:44Z,,"Die Spritpreise bleiben in Berlin ein Thema und wer nicht aufpasst, zahlt drauf. Doch mit dem richtigen Zeitpunkt und der gû¥nstigsten Tankstelle lûÊsst sich bares Geld sparen. Wo Autofahrerinnen und AãÎ [+2926 chars]",,de,'Spritpreise'
https://www.faz.net/aktuell/reise/seit-25-jahren-unterwegs-mit-sechs-kindern-auf-dem-segelboot-200808274.html,https://www.faz.net/aktuell/reise/seit-25-jahren-unterwegs-mit-sechs-kindern-auf-dem-segelboot-200808274.html,0,www.faz.net,Unter Segeln um die Welt: Seit 25 Jahren auf Reisen,140.000 zurû¥ckgelegte Seemeilen und 100 bereiste LûÊnder: Familie SchwûÑrer aus der Schweiz erkundet seit 25 Jahren auf einem Segelboot die Welt ã mit mittlerweile sechs Kindern und einer Mission.,https://media0.faz.net/image/w1200h627/8097cd5f0be6/w2592h1354x0y279o/202605/218abce8-47a1-11f1-bb40-ba1c78b1c919/auf-diesem-segelboot-bereist.webp,2026-05-11T12:48:21Z,,"Es war ein sonniger Julitag im Jahr 2000, als Dario und Sabine SchwûÑrer an der franzûÑsischen Mittelmeerkû¥ste in See stachen. Auf der Pachamama, einer 15 Meter langen Aluminiumyacht, wollen sie um dieãÎ [+8526 chars]",,de,'Kinder'
https://www.sueddeutsche.de/politik/verschleppung-ukrainischer-kinder-neue-sanktionen-gegen-russland-li.3481959,https://www.sueddeutsche.de/politik/verschleppung-ukrainischer-kinder-neue-sanktionen-gegen-russland-li.3481959,0,www.sueddeutsche.de,Verschleppung ukrainischer Kinder: Neue Sanktionen gegen Russland,,https://www.sueddeutsche.de/szde-assets/img/szde-article-sharing-image-no-teaser-image-fallback.png,2026-05-11T12:48:45Z,,Die Auûenminister der EU-Staaten haben weitere Sanktionen gegen Verantwortliche fû¥r Russlands Programm zur Deportation und Zwangsadoption ukrainischer Kinder beschlossen. Betroffen sind 16 Personen uãÎ [+498 chars],,de,'Kinder'
https://www.stern.de/panorama/kinderschutz--koenigin-silvia--wir-schulden-kindern-mehr-als-mitgefuehl-37388746.html,https://www.stern.de/panorama/kinderschutz--koenigin-silvia--wir-schulden-kindern-mehr-als-mitgefuehl-37388746.html,0,www.stern.de,Kinderschutz: KûÑnigin Silvia: Wir schulden Kindern mehr als Mitgefû¥hl,"Seit Jahrzehnten setzt sie sich fû¥r Kinder ein, die Gewalt erlebt haben. Nun ist Schwedens KûÑnigin Silvia in Berlin - in einer Ansprache auf Deutsch erzûÊhlt sie, was ihr wichtig ist.",https://image.stern.de/37388748/t/4D/v1/w1440/r1.7778/-/11--y5b6q3hkivv7axs2048jpeg---e776c33637dab9ad.jpg,2026-05-11T12:51:15Z,,"Kopiere den aktuellen Link
Zur Merkliste hinzufû¥gen
Seit Jahrzehnten setzt sie sich fû¥r Kinder ein, die Gewalt erlebt haben. Nun ist Schwedens KûÑnigin Silvia in Berlin - in einer Ansprache auf DeutãÎ [+2627 chars]",,de,'Kinder'
https://www.tagesspiegel.de/gesellschaft/panorama/kinderschutz-konigin-silvia-wir-schulden-kindern-mehr-als-mitgefuhl-15583923.html,https://www.tagesspiegel.de/gesellschaft/panorama/kinderschutz-konigin-silvia-wir-schulden-kindern-mehr-als-mitgefuhl-15583923.html,0,www.tagesspiegel.de,Kinderschutz: KûÑnigin Silvia: Wir schulden Kindern mehr als Mitgefû¥hl,"Seit Jahrzehnten setzt sie sich fû¥r Kinder ein, die Gewalt erlebt haben. Nun ist Schwedens KûÑnigin Silvia in Berlin - in einer Ansprache auf Deutsch erzûÊhlt sie, was ihr wichtig ist.",https://www.tagesspiegel.de/images/15583922/alternates/BASE_16_9_W1400/1778503934000/runder-tisch-kinderschutz.jpeg,2026-05-11T12:52:15Z,,"Schwedens KûÑnigin Silvia (82) setzt sich auf einer Fachtagung in Deutschland dafû¥r ein, Kinder besser zu schû¥tzen und ihnen bestmûÑglich zu helfen, wenn sie Gewalt erleben. Seit vielen Jahrzehnten begãÎ [+2474 chars]",,de,'Kinder'
https://www.diepresse.com/23395607/eu-sanktioniert-entfuehrer-ukrainischer-kinder,https://www.diepresse.com/23395607/eu-sanktioniert-entfuehrer-ukrainischer-kinder,0,www.diepresse.com,EU sanktioniert Entfû¥hrer ukrainischer Kinder,Gegen 16 Personen und sieben Organisationen verhûÊngt die EU Sanktionen. Es handelt sich um Verantwortliche fû¥r rechtswidrige Deportationen und Zwangsadoptionen.,https://www.diepresse.com/assets_v2/images/diepresse_nachrichten.png,2026-05-11T12:55:20Z,,"Der Rat der EU-Auûenminister hat am Montag Sanktionen gegen weitere 16 Einzelpersonen und sieben Organisationen beschlossen, die fû¥r die systematische rechtswidrige Deportation und Zwangsadoption ukrãÎ [+5221 chars]",,de,'Kinder'
https://www.tagesspiegel.de/wirtschaft/ansturm-gehabt-wie-verruckt-tankstelle-in-oberfranken-andert-preise-nur-alle-zwei-wochen-15584330.html,https://www.tagesspiegel.de/wirtschaft/ansturm-gehabt-wie-verruckt-tankstelle-in-oberfranken-andert-preise-nur-alle-zwei-wochen-15584330.html,0,www.tagesspiegel.de,ãAnsturm gehabt wie verrû¥cktã : Tankstelle in Oberfranken ûÊndert Preise nur im Zwei-Wochen-Takt,Die ûlkrise infolge des Iran-Krieges lieû die Spritpreise explodieren. Ein Tankstellenbetreiber in Oberfranken aber verweigert sich dem Trend. Dort wird der Preis noch von Hand angepasst.,https://www.tagesspiegel.de/images/15584329/alternates/BASE_16_9_W1400/1778508017000/tankstelle-herbert-brendel.jpeg,2026-05-11T14:00:17Z,,"Der Besitzer einer der wohl ûÊltesten Tankstellen Deutschlands, Herbert Brendel aus dem oberfrûÊnkischen GûÑûweinstein, macht das tûÊgliche Drehen an der Preisschraube nicht mit. Anders als die û¥berwiegeãÎ [+1834 chars]",,de,'Spritpreise'
https://www.tagesspiegel.de/wirtschaft/spritpreise-tankstelle-in-oberfranken-andert-preise-nur-alle-zwei-wochen-15584330.html,https://www.tagesspiegel.de/wirtschaft/spritpreise-tankstelle-in-oberfranken-andert-preise-nur-alle-zwei-wochen-15584330.html,0,www.tagesspiegel.de,Spritpreise: Tankstelle in Oberfranken ûÊndert Preise nur alle zwei Wochen,"WûÊhrend die meisten Tankstellen tûÊglich die Preise ûÊndern, bleibt bei Herbert Brendel alles beim Alten ã und wenn, wird der Preis noch von Hand angepasst.",https://www.tagesspiegel.de/images/15584329/alternates/BASE_16_9_W1400/1778508017000/tankstelle-herbert-brendel.jpeg,2026-05-11T14:00:17Z,,"Der Besitzer einer der wohl ûÊltesten Tankstellen Deutschlands, Herbert Brendel aus dem oberfrûÊnkischen GûÑûweinstein, macht das tûÊgliche Drehen an der Preisschraube nicht mit. Anders als die û¥berwiegeãÎ [+1647 chars]",,de,'Spritpreise'
https://www.zeit.de/news/2026-05/11/tankstelle-in-oberfranken-aendert-preise-nur-alle-zwei-wochen,https://www.zeit.de/news/2026-05/11/tankstelle-in-oberfranken-aendert-preise-nur-alle-zwei-wochen,0,www.zeit.de,Spritpreise: Tankstelle in Oberfranken ûÊndert Preise nur alle zwei Wochen,Hier finden Sie Informationen zu dem Thema ãSpritpreiseã. Lesen Sie jetzt ãTankstelle in Oberfranken ûÊndert Preise nur alle zwei Wochenã.,https://img.zeit.de/news/2026-05/11/tankstelle-in-oberfranken-aendert-preise-nur-alle-zwei-wochen-image-group/wide__1300x731,2026-05-11T14:02:37Z,,"Der Besitzer einer der wohl ûÊltesten Tankstellen Deutschlands, Herbert Brendel aus dem oberfrûÊnkischen GûÑûweinstein, macht das tûÊgliche Drehen an der Preisschraube nicht mit. Anders als die û¥berwiegeãÎ [+1597 chars]",,de,'Spritpreise'
https://www.stern.de/wirtschaft/news/spritpreise--tankstelle-in-oberfranken-aendert-preise-nur-alle-zwei-wochen-37389172.html,https://www.stern.de/wirtschaft/news/spritpreise--tankstelle-in-oberfranken-aendert-preise-nur-alle-zwei-wochen-37389172.html,0,www.stern.de,Spritpreise: Tankstelle in Oberfranken ûÊndert Preise nur alle zwei Wochen,"WûÊhrend die meisten Tankstellen tûÊglich die Preise ûÊndern, bleibt bei Herbert Brendel alles beim Alten ã und wenn, wird der Preis noch von Hand angepasst.",https://image.stern.de/37389174/t/Dw/v2/w1440/r1.7778/-/11--k2ifovifkcv5axs2048jpeg---745543b403da2e6b.jpg,2026-05-11T14:02:37Z,,"Kopiere den aktuellen Link
Zur Merkliste hinzufû¥gen
WûÊhrend die meisten Tankstellen tûÊglich die Preise ûÊndern, bleibt bei Herbert Brendel alles beim Alten und wenn, wird der Preis noch von Hand angãÎ [+1766 chars]",,de,'Spritpreise'
https://www.sueddeutsche.de/wirtschaft/deutschlandtourismus-rekordjahr-spritpreisen-li.3482061,https://www.sueddeutsche.de/wirtschaft/deutschlandtourismus-rekordjahr-spritpreisen-li.3482061,0,www.sueddeutsche.de,Urlaub: Branche erwartet Rekordjahr fû¥r den Deutschlandtourismus,"Die deutsche Tourismusbranche verzeichnet steigende ûbernachtungszahlen im ersten Quartal 2026. Hotels und CampingplûÊtze profitieren von mehr InlandsgûÊsten. Hohe Spritpreise und Iran-Krieg beeinflussen das Reiseverhalten, doch Deutschland bleibt als ReisezielãÎ",https://www.sueddeutsche.de/2026/05/11/d516ba5f-e268-42a7-9f9c-2fea1413118e.jpg?q=60&fm=webp&width=1200&rect=43%2C0%2C3915%2C2202,2026-05-11T14:41:24Z,,Nach ZuwûÊchsen im ersten Quartal rechnet die deutsche Tourismusbranche mit einem Rekordjahrô  trotz der Belastungen durch die hohen Spritpreise infolge des Iran-Kriegs. Die steigenden ûbernachtungszahãÎ [+2012 chars],,de,'Spritpreise'
https://www.focus.de/panorama/fast-immer-der-billigste-tankstellenbetreiber-aendert-preis-nur-alle-zwei-wochen_e71777a3-d5ff-4a32-965b-9497bb51ef8f.html,https://www.focus.de/panorama/fast-immer-der-billigste-tankstellenbetreiber-aendert-preis-nur-alle-zwei-wochen_e71777a3-d5ff-4a32-965b-9497bb51ef8f.html,0,www.focus.de,ãFast immer der Billigsteã: Tankstellenbetreiber ûÊndert Preis nur alle zwei Wochen,An vielen Tankstellen wechseln die Spritpreise im Stundentakt. Bei Herbert Brendel lûÊuft das anders: Hier bleibt der Preis oft bis zu zwei Wochen unverûÊndert.,"https://quadro.burda-forward.de/ctf/90f84dcc-5504-4d17-8b71-54dd534d206c.c525af89-1791-4a7d-9c16-5279ca4822eb.jpg?im=RegionOfInterestCrop=(1200,630),regionOfInterest=(463,215)&hash=81773333b822d9a79e424eb090f289ce17474d50d1602a035c7c7b56a2f712c6",2026-05-11T17:51:00Z,,"Der Betreiber setzt bewusst nicht auf stûÊndige Anpassungen. Wenn der Kraftstoff hier angeliefert ist, dann bekomme ich meinen Preis, mache meinen kleinen marktgerechten Aufschlag und so verkaufe ich ãÎ [+1372 chars]",,de,'Spritpreise'
https://www.zeit.de/arbeit/2026-04/mediennutzung-kinder-smartphone-eltern-tech-branche,https://www.zeit.de/arbeit/2026-04/mediennutzung-kinder-smartphone-eltern-tech-branche,0,www.zeit.de,Mediennutzung von Kindern: ô£Vielen Eltern fehlt einfach der Mut zum Neinô¨,Steve Jobs lieû seine Kinder angeblich nicht ans iPad. Halten Tech-CEOS ihre kleinen Kinder von Technik fern? Wir haben bei drei deutschen Unternehmern nachgefragt.,https://img.zeit.de/arbeit/2026-05/mediennutzung-kinder-smartphone-eltern-tech-branche-bild/wide__1300x731,2026-05-11T18:11:03Z,,Bill Gates erlaubte seinen TûÑchtern erst mit 14 Jahren ein Smartphone und im Silicon Valley schicken Tech-Eltern ihre Kinder angeblich oft auf Waldorfschulen. Nachprû¥fen lassen sich diese Mythen nichãÎ [+563 chars],,de,'Kinder'
https://www.zeit.de/news/2026-05/12/warum-kommen-hamburgs-schwaene-ueberhaupt-ins-winterquartier,https://www.zeit.de/news/2026-05/12/warum-kommen-hamburgs-schwaene-ueberhaupt-ins-winterquartier,0,www.zeit.de,Schwimmende Wahrzeichen: Warum kommen Hamburgs SchwûÊne û¥berhaupt ins Winterquartier?,Hier finden Sie Informationen zu dem Thema ãSchwimmende Wahrzeichenã. Lesen Sie jetzt ãWarum kommen Hamburgs SchwûÊne û¥berhaupt ins Winterquartier?ã.,https://img.zeit.de/news/2026-05/12/warum-kommen-hamburgs-schwaene-ueberhaupt-ins-winterquartier-image-group/wide__1300x731,2026-05-12T03:12:04Z,,"Es ist jedes Jahr wieder ein Spektakel, wenn 90 bis 100 SchwûÊne schnatternd und flû¥gelschlagend ihr Winterquartier verlassen und sich auf der Alster und ihren NebengewûÊssern breit machen. In diesem JãÎ [+4835 chars]",,de,'Winter'
https://orf.at/stories/3429686/,https://orf.at/stories/3429686/,0,orf.at,Fahrt ins Hochwasser: 3.800 Robotaxis zurû¥ckgerufen,,https://orf.at/mojo/1_4_1/storyserver//news/common/images/og-fallback-news.png,2026-05-12T12:43:17Z,,"Der Robotaxibetreiber Waymo ruft 3.800 seiner Fahrzeuge zurû¥ck. Es bestehe das Risiko, dass die Autos mit hoher Geschwindigkeit auf û¥berflutete Straûen fahren, teilte die Tochter des InternetkonzernsãÎ [+721 chars]",,de,'Hochwasser'
https://www.faz.net/aktuell/politik/ausland/diese-kinder-in-kolumbien-wurden-in-den-krieg-exportiert-200798417.html,https://www.faz.net/aktuell/politik/ausland/diese-kinder-in-kolumbien-wurden-in-den-krieg-exportiert-200798417.html,0,www.faz.net,Gewalt in Kolumbien: Wo Kinder in den Krieg ãexportiertã werden,In Kolumbien kûÊmpfen Splittergruppen der frû¥heren Guerilla um das GeschûÊft mit Rauschgift und illegalem Gold. Dafû¥r zwingen sie Kinder an die Waffen ã so wie Sol und Ramû°n.,https://media0.faz.net/image/w1200h627/778b284d46c4/w5551h2900x0y170o/202605/43601.0.2056200546/farc-dissidenten-im-august.webp,2026-05-12T20:38:47Z,,"Sol war elf, als sie rekrutiert wurde. Sie konnte noch nicht richtig lesen, da lernte sie die Taktiken des Guerillakampfes, irgendwo im tiefsten Dschungel, wo genau das war, weiû sie nicht. Solô lerntãÎ [+13945 chars]",,de,'Kinder'
https://www.stern.de/news/oezdemir-sieht-wahl-zum-ministerpraesidenten-als-ermutigung-fuer-kinder-von-migranten-37393552.html,https://www.stern.de/news/oezdemir-sieht-wahl-zum-ministerpraesidenten-als-ermutigung-fuer-kinder-von-migranten-37393552.html,0,www.stern.de,ûzdemir sieht Wahl zum MinisterprûÊsidenten als Ermutigung fû¥r Kinder von Migranten,"Der designierte baden-wû¥rttembergische MinisterprûÊsident Cem ûzdemir (Grû¥ne) sieht seine am Mittwoch bevorstehende Wahl durch den Landtag als Ermutigung fû¥r Kinder mit Migrationshintergrund und aus Arbeiterhaushalten. ""Ich musste immer mal wieder an meine EltãÎ",https://image.stern.de/37393554/t/5x/v1/w1440/r1.7778/-/13--cem-oezdemir---5470f61337c44a04.jpg,2026-05-12T22:20:24Z,,"Kopiere den aktuellen Link
Zur Merkliste hinzufû¥gen
Der designierte baden-wû¥rttembergische MinisterprûÊsident Cem ûzdemir (Grû¥ne) sieht seine am Mittwoch bevorstehende Wahl durch den Landtag als ErmãÎ [+1990 chars]",,de,'Kinder'
https://salzburg.orf.at/stories/3353979/,https://salzburg.orf.at/stories/3353979/,0,salzburg.orf.at,SOS-Kinderdorf: Prozess gegen Ex-Betreuer,Am Mittwoch findet am Landesgericht Salzburg ein Prozess im Zusammenhang mit den Missbrauchsvorwû¥rfen im SOS-Kinderdorf Seekirchen (Flachgau) statt. Ein ehemaliger Betreuer soll û¥ber mehrere Jahre zwei MûÊdchen sexuell missbraucht haben.,https://ibs.orf.at/sbg?image=https%3A%2F%2Foekastatic.orf.at%2Fmims%2F2025%2F41%2F20%2Fcrops%2Fw%3D1200%2Ch%3D627%2Cq%3D75%2F2794148_master_1077920_f022af9f-ac33-4c9a-bb04-ea466a2a16b7.jpg%3Fs%3D03888bad76588c991d22f5eb19abc0f603bd3022,2026-05-13T04:00:00Z,,Im Mittelpunkt des Verfahrens steht ein 58-jûÊhriger ehemaliger Familienhelfer des SOS-Kinderdorfs. Laut Anklage soll er ab 2017 û¥ber mehrere Jahre hinweg zwei damals unmû¥ndige MûÊdchen sexuell missbraãÎ [+737 chars],,de,'Kinder'
https://wien.orf.at/stories/3353989/,https://wien.orf.at/stories/3353989/,0,wien.orf.at,120 Jahre altes Pflegewohnhaus modernisiert,"Das 120 Jahre alte Pflegewohnhaus SchûÑnbrunn der Caritas der ErzdiûÑzese Wien ist nach umfassender Sanierung wieder erûÑffnet worden. Am Standort gibt es jetzt stationûÊre und mobile Pflege, Kinderbetreuung sowie ein BeschûÊftigungsprojekt fû¥r Langzeitarbeitslose.",https://ibs.orf.at/wie?image=https%3A%2F%2Foekastatic.orf.at%2Fmims%2F2026%2F20%2F53%2Fcrops%2Fw%3D1200%2Ch%3D627%2Cq%3D75%2F3035134_master_1174353_downloadmedium.jpg%3Fs%3Dc117ef86312ab029b28b31e9573a554a1cca7881,2026-05-13T04:00:00Z,,"Das GebûÊude, das vor 120 Jahren ursprû¥nglich als Heim fû¥r adelige Pensionistinnen und Pensionisten gebaut wurde, wurde modernisiert und erweitert. Statt Mehrbettzimmer gibt es nun û¥berwiegend EinzelzãÎ [+1183 chars]",,de,'Kinder'
https://www.tagesschau.de/investigativ/russland-lng-100.html,https://www.tagesschau.de/investigativ/russland-lng-100.html,0,www.tagesschau.de,Bundeseigenes Unternehmen - Ein Gas-Deal fû¥r Putins Kriegskasse,"Ein Bundesunternehmen verhandelte 2023 mit einem Putin-Vertrauten û¥ber die Wiederaufnahme von LNG-Lieferungen - das zeigen <em>NDR</em>-Recherchen. Der Kreml gab das GeschûÊft frei, seitdem flieûen Milliarden. Was wusste der damalige Minister Habeck?",https://images.tagesschau.de/image/70637da4-dd41-4823-875c-da36f179538e/AAABmL0X38U/AAABnSSvrFg/16x9-big/lng-russland-100.jpg?width=1280,2026-05-13T05:00:37Z,,"Stand: 13.05.2026 07:00 Uhr
Ein Bundesunternehmen verhandelte 2023 mit einem Putin-Vertrauten û¥ber die Wiederaufnahme von LNG-Lieferungen - das zeigen NDR-Recherchen. Der Kreml gab das GeschûÊft freiãÎ [+8068 chars]",,de,'Gas'
https://www.morgenpost.de/wirtschaft/article411978426/frankreich-deckelt-spritpreise-mit-einem-ueberraschenden-deal.html,https://www.morgenpost.de/wirtschaft/article411978426/frankreich-deckelt-spritpreise-mit-einem-ueberraschenden-deal.html,0,www.morgenpost.de,Frankreich deckelt Spritpreise ã mit einem û¥berraschenden Deal,Die franzûÑsische Regierung drû¥ckt die Benzinpreise ã ohne die Staatsfinanzen zu belasten. WûÊre das auch auf Deutschland û¥bertragbar?,https://img.sparknews.funkemedien.de/411978899/411978899_1778586843_v16_9_1600.jpeg,2026-05-13T08:39:55Z,,"Frankreichs Staatskasse ist leer, das Schatzamt hoch verschuldet. Doch die autofahrende BevûÑlkerung drûÊngt mit aller Kraft auf eine Benzinpreissenkung. Um einen Aufstand zu vermeiden, erweist sich PrãÎ [+3181 chars]",,de,'Spritpreise'
https://www.tagesspiegel.de/wirtschaft/russischer-lng-importe-in-die-eu-erreichen-hochsten-stand-seit-kriegsbeginn-15591590.html,https://www.tagesspiegel.de/wirtschaft/russischer-lng-importe-in-die-eu-erreichen-hochsten-stand-seit-kriegsbeginn-15591590.html,0,www.tagesspiegel.de,Russischer LNG: Importe in die EU erreichen hûÑchsten Stand seit Kriegsbeginn,Brû¥ssel will Gaslieferungen aus Russland bis 2027 beenden. Doch eine neue Studie zeigt: Bei Flû¥ssigerdgas geht die Entwicklung derzeit in die andere Richtung. Einige EU-LûÊnder nehmen besonders groûe Mengen ab.,https://www.tagesspiegel.de/images/15591426/alternates/BASE_16_9_W1400/1778660886000/news-bilder-des-tages-may-27-2021-helsinki-finland-in-an-undated-handout-provided-by-excelerate-energy-shows-the-fsr.jpeg,2026-05-13T08:49:58Z,,Die Einfuhren von russischem Flû¥ssigerdgas (LNG) in die EU haben seit Beginn des russischen Angriffskriegs gegen die Ukraine vor vier Jahren im ersten Quartal einen HûÑchststand erreicht. Die EmpfûÊngeãÎ [+3064 chars],,de,'Gas'
https://www.welt.de/wirtschaft/article6a042d27761b8b46253f05f0/fluessiggas-importe-von-russischem-lng-erreichen-hoechststand-frankreich-ist-groesster-abnehmer.html,https://www.welt.de/wirtschaft/article6a042d27761b8b46253f05f0/fluessiggas-importe-von-russischem-lng-erreichen-hoechststand-frankreich-ist-groesster-abnehmer.html,0,www.welt.de,Importe von russischem LNG erreichen HûÑchststand ãô Frankreich ist grûÑûter Abnehmer,Die EU will eigentlich weg von russischem Gas ã doch die RealitûÊt sieht anders aus. Die Einfuhren haben seit Beginn des Ukraine-Kriegs einen HûÑchststand erreicht. Russland bleibt der zweitgrûÑûte LNG-Lieferant der EU.,https://images.welt.de/6a042d27761b8b46253f05f0/336f18b1574b527d1cb24e97f8844aac/ci16x9-w1200/dpa-com-260430-911-023763-jpg,2026-05-13T09:00:55Z,,Die EU will eigentlich weg von russischem Gas doch die RealitûÊt sieht anders aus. Die Einfuhren haben seit Beginn des Ukraine-Kriegs einen HûÑchststand erreicht. Russland bleibt der zweitgrûÑûte LNG-LiãÎ [+2915 chars],,de,'Gas'
https://www.spektrum.de/news/supernovae-explosionen-es-qualmt-maechtig-in-der-zigarrengalaxie/2317569,https://www.spektrum.de/news/supernovae-explosionen-es-qualmt-maechtig-in-der-zigarrengalaxie/2317569,0,www.spektrum.de,Aktive Galaxien: Ein galaktischer Sturm fegt durch Messier 82: Supernovae heizen Gas auf Millionen Grad auf und treiben Materie heraus.,Ein Sturm fegt durch Messier 82: Supernovae heizen Gas auf Millionen Grad auf und treiben Materie ungeahnt krûÊftig aus der Galaxie hinaus.,https://static.spektrum.de/fm/912/f1920x1080/Composite_of_multi-wavelength_images_of_the_active_galaxy_M82.jpg,2026-05-13T09:06:10Z,,"ô£Einige unserer Modelle von Starburst-Galaxien stammen aus den 1980er-Jahrenô¨Skylar Grayson, Student
Hier konnte nun Abhilfe verschafft werden: Einem internationalen Team um die Astronomin Erinô BoetãÎ [+7064 chars]",,de,'Gas'
