index,url,valid,domain,title,description,image,published,archive,content,quote,language,keyword
https://www.diepresse.com/19209065/schlafen-am-fuss-des-grossglockners,https://www.diepresse.com/19209065/schlafen-am-fuss-des-grossglockners,0,www.diepresse.com,Schlafen am Fuß des Großglockners [premium],"Zuerst den „Big Five“ im Nationalpark Hohe Tauern auf der Spur sein, dann in den Winterschlafmodus gehen. Kann man ausprobieren vom Standort des Gradonna in Kals 
am Großglockner (Osttirol) aus.",https://img.diepresse.com/public/incoming/7ht8tv-DSC_7120g.jpg/alternates/DPR_SOCIAL_MAGAZIN/DSC_7120g.jpg,2025-01-03T10:51:37Z,,"Zuerst den Big Five im Nationalpark Hohe Tauern auf der Spur sein, dann in den Winterschlafmodus gehen. Kann man ausprobieren vom Standort des Gradonna in Kals am Großglockner (Osttirol) aus.
Die Mu… [+1334 chars]",,de,'Winter'
https://www.focus.de/politik/ausland/ohne-russisches-gas-industrie-in-transnistrien-ist-lahmgelegt_id_260605416.html,https://www.focus.de/politik/ausland/ohne-russisches-gas-industrie-in-transnistrien-ist-lahmgelegt_id_260605416.html,0,www.focus.de,Ohne russisches Gas - Industrie in Transnistrien ist lahmgelegt,Die Industrie in der Region Transnistrien ist lahmgelegt. Grund ist das Ende der russischen Gaslieferungen. Nur die Lebensmittelproduktion läuft weiter.,https://p6.focus.de/img/fotos/id_259597302/tiraspol.jpg?im=Crop%3D%280%2C288%2C3465%2C1732%29%3BResize%3D%281200%2C627%29&impolicy=perceptual&quality=mediumHigh&hash=de218014523b78c98d4cf95aaf3eadcf0d53177ee71000d14f24b376c7294aa7,2025-01-03T11:05:54Z,,Die Industrie in der Region Transnistrien ist lahmgelegt. Grund ist das Ende der russischen Gaslieferungen. Nur die Lebensmittelproduktion läuft weiter. Die Blockade russischer Gaslieferungen hat all… [+1907 chars],,de,'Kohle'
https://www.stern.de/gesellschaft/regional/bayern/winterwetter--winter-ist-zurueck--neuschnee-und-glatte-strassen-35351372.html,https://www.stern.de/gesellschaft/regional/bayern/winterwetter--winter-ist-zurueck--neuschnee-und-glatte-strassen-35351372.html,0,www.stern.de,Winterwetter: Winter ist zurück: Neuschnee und glatte Straßen,"Schnee, Eis, Glätte - Der Winter meldet sich zurück. Die Polizei registriert mehrere Unfälle. In den Bergen können sich Wintersportler über beste Bedingungen freuen.",https://image.stern.de/35352502/t/ar/v1/w1440/r1.7778/-/03--hnh22hseg4v1axs2048jpeg---e1b335398fbe90bf.jpg,2025-01-03T11:13:45Z,,"Kopiere den aktuellen Link
Schnee, Eis, Glätte - Der Winter meldet sich zurück. Die Polizei registriert mehrere Unfälle. In den Bergen können sich Wintersportler über beste Bedingungen freuen.
Wint… [+4118 chars]",,de,'Winter'
https://www.zeit.de/news/2025-01/03/maza-abgang-im-winter-sehr-unwahrscheinlich,https://www.zeit.de/news/2025-01/03/maza-abgang-im-winter-sehr-unwahrscheinlich,0,www.zeit.de,Hertha BSC: Maza-Abgang im Winter sehr unwahrscheinlich,Hier finden Sie Informationen zu dem Thema „Hertha BSC“. Lesen Sie jetzt „Maza-Abgang im Winter sehr unwahrscheinlich“.,https://img.zeit.de/news/2025-01/03/maza-abgang-im-winter-sehr-unwahrscheinlich-image-group/wide__1300x731,2025-01-03T11:13:53Z,,"Herthas von vielen Fußball-Clubs umworbener Jungstar Ibrahim Maza wird den Berlinern mit großer Wahrscheinlichkeit auch in der Rückrunde erhalten bleiben. «Wir wissen, was wir an ihm haben. Er weiß, … [+1769 chars]",,de,'Winter'
https://www.stern.de/gesellschaft/regional/berlin-brandenburg/hertha-bsc--maza-abgang-im-winter-sehr-unwahrscheinlich-35352494.html,https://www.stern.de/gesellschaft/regional/berlin-brandenburg/hertha-bsc--maza-abgang-im-winter-sehr-unwahrscheinlich-35352494.html,0,www.stern.de,Hertha BSC: Maza-Abgang im Winter sehr unwahrscheinlich,Ibrahim Maza gehört zu Herthas besten Spielern in einer bislang mauen Saison. Viele Clubs haben Interesse. Sportdirektor Benjamin Weber äußert sich zu einem möglichen Transfer im Winter.,https://image.stern.de/35352496/t/Iz/v1/w1440/r1.7778/-/03--afoy4avftcv8axs2048jpeg---c7848df49f56862e.jpg,2025-01-03T11:13:53Z,https://web.archive.org/web/20250104154146/https://www.stern.de/gesellschaft/regional/berlin-brandenburg/hertha-bsc--maza-abgang-im-winter-sehr-unwahrscheinlich-35352494.html,"Kopiere den aktuellen Link
Ibrahim Maza gehört zu Herthas besten Spielern in einer bislang mauen Saison. Viele Clubs haben Interesse. Sportdirektor Benjamin Weber äußert sich zu einem möglichen Tran… [+1945 chars]",,de,'Winter'
https://www.zeit.de/news/2025-01/03/skigebiete-rechnen-mit-andrang-am-wochenende,https://www.zeit.de/news/2025-01/03/skigebiete-rechnen-mit-andrang-am-wochenende,0,www.zeit.de,Wintersport: Skigebiete rechnen mit Andrang am Wochenende,Hier finden Sie Informationen zu dem Thema „Wintersport“. Lesen Sie jetzt „Skigebiete rechnen mit Andrang am Wochenende“.,https://img.zeit.de/news/2025-01/03/skigebiete-rechnen-mit-andrang-am-wochenende-image-group/wide__1300x731,2025-01-03T11:47:25Z,,"Zum Ausklang der Weihnachtsferien stellen sich Sachsens Skigebiete am Wochenende auf einen erneuten Ansturm an Besuchern ein. Die Pisten werden vielerorts beschneit, doch reicht der Schnee nicht, um … [+1989 chars]",,de,'Schnee'
https://www.diepresse.com/19223618/glatteisgefahr-eisregen-steht-im-grossteil-oesterreichs-bevor,https://www.diepresse.com/19223618/glatteisgefahr-eisregen-steht-im-grossteil-oesterreichs-bevor,0,www.diepresse.com,Glatteisgefahr: Eisregen steht im Großteil Österreichs bevor,"In Vorarlberg, Nordtirol, Salzburg, Ober- und Niederösterreich, sowie in Wien und im Burgenland ist am Sonntag Vorsicht wegen Blitzeises geboten. Am Vormittag setzt Schneefall ein, der in Eisregen übergeht.",https://img.diepresse.com/public/incoming/c7s872-imago-images-0780834213/alternates/DPR_SOCIAL_NACHRICHTEN/imago%20images%200780834213,2025-01-03T12:34:55Z,,"In Vorarlberg, Nordtirol, Salzburg, Ober- und Niederösterreich, sowie in Wien und im Burgenland ist am Sonntag Vorsicht wegen Blitzeises geboten. Am Vormittag setzt Schneefall ein, der in Eisregen üb… [+2419 chars]",,de,'Glatteis'
https://www.zeit.de/news/2025-01/04/experte-hochwasser-wie-2021-haette-heute-fast-gleiche-folgen,https://www.zeit.de/news/2025-01/04/experte-hochwasser-wie-2021-haette-heute-fast-gleiche-folgen,0,www.zeit.de,"""Papier schützt nicht"": Experte: Hochwasser wie 2021 hätte heute fast gleiche Folgen","Hier finden Sie Informationen zu dem Thema „""Papier schützt nicht""“. Lesen Sie jetzt „Experte: Hochwasser wie 2021 hätte heute fast gleiche Folgen“.",https://img.zeit.de/news/2025-01/04/experte-hochwasser-wie-2021-haette-heute-fast-gleiche-folgen-image-group/wide__1300x731,2025-01-04T04:00:39Z,,Mehr als drei Jahre nach der verheerenden Hochwasserkatastrophe wäre Nordrhein-Westfalen bei einem vergleichbaren Ereignis nach Ansicht eines Experten heute kaum besser vorbereitet. «Die Warnsysteme … [+3229 chars],,de,'Hochwasser'
https://www.zeit.de/news/2025-01/04/glaette-in-ganz-deutschland-wetterexperten-warnen-autofahrer,https://www.zeit.de/news/2025-01/04/glaette-in-ganz-deutschland-wetterexperten-warnen-autofahrer,0,www.zeit.de,Winterwetter: Glätte in ganz Deutschland: Wetterexperten warnen Autofahrer,Hier finden Sie Informationen zu dem Thema „Winterwetter“. Lesen Sie jetzt „Glätte in ganz Deutschland: Wetterexperten warnen Autofahrer“.,https://img.zeit.de/news/2025-01/04/glaette-in-ganz-deutschland-wetterexperten-warnen-autofahrer-image-group/wide__1300x731,2025-01-04T04:32:33Z,https://web.archive.org/web/20250104051131/https://www.zeit.de/news/2025-01/04/glaette-in-ganz-deutschland-wetterexperten-warnen-autofahrer,"Autofahrer müssen am Wochenende in Deutschland aufpassen. Am Samstag und Sonntag bestehe durch glatte Straßen ein höheres Unfallrisiko, sagte ein Sprecher des Deutschen Wetterdienstes (DWD). In der N… [+1314 chars]",,de,'Winter'
https://www.welt.de/vermischtes/article255032158/Wintereinbruch-Wetterdienst-warnt-vor-glatten-Strassen.html,https://www.welt.de/vermischtes/article255032158/Wintereinbruch-Wetterdienst-warnt-vor-glatten-Strassen.html,0,www.welt.de,Wetterdienst warnt vor glatten Straßen,Jetzt wird es winterlich: Am Wochenende drohen glatte Straßen durch Schnee und Eisregen. Wetterexperten warnen vor einem erhöhten Unfallrisiko. Schon am Freitag hatte es zahlreiche Glätteunfälle gegeben.,https://img.welt.de/img/vermischtes/mobile255032156/6717932347-ci16x9-w1200/Schnee-in-Bremen-Wetter.jpg,2025-01-04T05:21:10Z,https://web.archive.org/web/20250104063043/http://www.welt.de/vermischtes/article255032158/Wintereinbruch-Wetterdienst-warnt-vor-glatten-Strassen.html,"Autofahrer müssen am Wochenende in Deutschland aufpassen. Schnee und Eisregen können am Samstag und Sonntag für spiegelglatte Straßen sorgen. Dadurch gebe es auch ein höheres Unfallrisiko, warnte ein… [+1255 chars]",,de,'Glatteis'
https://www.welt.de/reise/winter/article255024830/Winter-in-Finnland-Nach-Schlitten-Touren-und-Langlauf-lockt-die-Sauna.html,https://www.welt.de/reise/winter/article255024830/Winter-in-Finnland-Nach-Schlitten-Touren-und-Langlauf-lockt-die-Sauna.html,0,www.welt.de,20 Stunden dunkel – doch der Winter hat seinen Reiz,"Die Temperaturen sinken tief, die Tage sind kurz. Aber wer sich zu einer Winterreise nach Kuusamo in Finnland aufmacht, den erwarten ein breites touristisches Angebot und eine ganz spezielle Atmosphäre. Entschleunigung ist angesagt – nicht nur in der Sauna.",https://img.welt.de/img/reise/nah/mobile255030272/9267936657-ci16x9-w1200/Schneeschuhwanderung-durch-Nationalparks.jpg,2025-01-04T06:49:33Z,,"Die Temperaturen sinken tief, die Tage sind kurz. Aber wer sich zu einer Winterreise nach Kuusamo in Finnland aufmacht, den erwarten ein breites touristisches Angebot und eine ganz spezielle Atmosphä… [+7807 chars]",,de,'Winter'
https://www.zeit.de/news/2025-01/04/winter-im-watt-welche-tiere-der-kaelte-trotzen,https://www.zeit.de/news/2025-01/04/winter-im-watt-welche-tiere-der-kaelte-trotzen,0,www.zeit.de,Natur: Winter im Watt - Welche Tiere der Kälte trotzen,Hier finden Sie Informationen zu dem Thema „Natur“. Lesen Sie jetzt „Winter im Watt - Welche Tiere der Kälte trotzen“.,https://img.zeit.de/news/2025-01/04/winter-im-watt-welche-tiere-der-kaelte-trotzen-image-group/wide__1300x731,2025-01-04T07:00:36Z,,"Am Watt ist es stiller geworden um diese Jahreszeit. Die großen Vogelschwärme des Herbstes sind weg, die des Frühjahrs noch nicht da. In jedem Herbst und jedem Frühjahr rasten nach Angaben der Nation… [+3762 chars]",,de,'Winter'
https://www.zeit.de/news/2025-01/04/dwd-warnt-vor-glatteis-in-baden-wuerttemberg,https://www.zeit.de/news/2025-01/04/dwd-warnt-vor-glatteis-in-baden-wuerttemberg,0,www.zeit.de,Wetter: DWD warnt vor Glatteis in Baden-Württemberg,Hier finden Sie Informationen zu dem Thema „Wetter“. Lesen Sie jetzt „DWD warnt vor Glatteis in Baden-Württemberg“.,https://img.zeit.de/news/2025-01/04/dwd-warnt-vor-glatteis-in-baden-wuerttemberg-image-group/wide__1300x731,2025-01-04T07:51:34Z,,In der Nacht zu Sonntag kann es auf den Straßen im Südwesten glatt werden. Der Deutsche Wetterdienst (DWD) sprach in einer Vorabinformation eine Glatteiswarnung für große Teile des Landes aus. Zu Beg… [+769 chars],,de,'Glatteis'
https://www.stern.de/gesellschaft/regional/baden-wuerttemberg/wetter--dwd-warnt-vor-glatteis-in-baden-wuerttemberg-35354312.html,https://www.stern.de/gesellschaft/regional/baden-wuerttemberg/wetter--dwd-warnt-vor-glatteis-in-baden-wuerttemberg-35354312.html,0,www.stern.de,Wetter: DWD warnt vor Glatteis in Baden-Württemberg,Stuttgart (lsw) - In der Nacht zu Sonntag kann es auf den Straßen im Südwesten glatt werden. Der Deutsche Wetterdienst (DWD) sprach in einer,https://image.stern.de/35354314/t/Cp/v1/w1440/r1.7778/-/04--arlzoasaebv6axs2048jpeg---9559af58b0753fcc.jpg,2025-01-04T07:51:34Z,,"Kopiere den aktuellen Link
Auf den Straßen im Land ist Vorsicht geboten. In der Nacht soll es regnen und sehr kalt werden. Dann bildet sich an vielen Orten Glatteis.
In der Nacht zu Sonntag kann es… [+897 chars]",,de,'Glatteis'
https://www.tagesschau.de/inland/gesellschaft/wetter-glaette-102.html,https://www.tagesschau.de/inland/gesellschaft/wetter-glaette-102.html,0,www.tagesschau.de,Warnung vor gefährlichen Straßenverhältnissen wegen Eis und Schnee,"Schneeschauer und Straßenglätte haben in den vergangenen Stunden zu vielen Verkehrsunfällen geführt. In der kommenden Nacht soll sich die Lage laut Wetterdienst weiter zuspitzen, es drohe ""verbreitet Glatteis"".",https://images.tagesschau.de/image/0f5f990e-f0b0-49a4-9157-89a8c0d12615/AAABlDBmxTg/AAABkZLhkrw/16x9-1280/winter-236.jpg,2025-01-04T08:36:20Z,https://web.archive.org/web/20250104110212/https://www.tagesschau.de/inland/gesellschaft/wetter-glaette-102.html,"Stand: 04.01.2025 09:36 Uhr
Schneeschauer und Straßenglätte haben in den vergangenen Stunden zu vielen Verkehrsunfällen geführt. In der kommenden Nacht soll sich die Lage laut Wetterdienst weiter zu… [+1885 chars]",,de,'Glatteis'
https://www.stern.de/gesellschaft/regional/hessen/wetter--dwd-warnt-vor-glatten-strassen-in-hessen-35354386.html,https://www.stern.de/gesellschaft/regional/hessen/wetter--dwd-warnt-vor-glatten-strassen-in-hessen-35354386.html,0,www.stern.de,Wetter: DWD warnt vor glatten Straßen in Hessen,Offenbach/Main (lhe) - Der Deutsche Wetterdienst warnt vor Glätte auf Hessens Straßen. Nach ruhigem Winterwetter am Samstag zieht in der Nacht zum Sonntag,https://image.stern.de/35354388/t/EX/v1/w1440/r1.7778/-/04--qk42gzumxwv8axs2048jpeg---07ea1dca3c612945.jpg,2025-01-04T09:12:59Z,https://web.archive.org/web/20250105164819/https://www.stern.de/gesellschaft/regional/hessen/wetter--dwd-warnt-vor-glatten-strassen-in-hessen-35354386.html,"Kopiere den aktuellen Link
In der Nacht zum Sonntag soll es regnen und sehr kalt werden. Dann bildet sich an vielen Orten Glatteis.
Der Deutsche Wetterdienst warnt vor Glätte auf Hessens Straßen. N… [+1548 chars]",,de,'Glatteis'
https://www.zeit.de/news/2025-01/04/schnee-und-glatteis-in-rheinland-pfalz-und-im-saarland,https://www.zeit.de/news/2025-01/04/schnee-und-glatteis-in-rheinland-pfalz-und-im-saarland,0,www.zeit.de,Wetter: Schnee und Glatteis in Rheinland-Pfalz und im Saarland,Hier finden Sie Informationen zu dem Thema „Wetter“. Lesen Sie jetzt „Schnee und Glatteis in Rheinland-Pfalz und im Saarland“.,https://img.zeit.de/news/2025-01/04/schnee-und-glatteis-in-rheinland-pfalz-und-im-saarland-image-group/wide__1300x731,2025-01-04T09:35:15Z,,Der Deutsche Wetterdienst (DWD) hat für Rheinland-Pfalz und das Saarland in der Nacht zum Sonntag vor Glatteis gewarnt. Zunächst erwarteter Schnee soll den Meteorologen zufolge in der zweiten Nachthä… [+823 chars],,de,'Schnee'
https://www.stern.de/gesellschaft/regional/rheinland-pfalz-saarland/wetter--schnee-und-glatteis-in-rheinland-pfalz-und-im-saarland-35354414.html,https://www.stern.de/gesellschaft/regional/rheinland-pfalz-saarland/wetter--schnee-und-glatteis-in-rheinland-pfalz-und-im-saarland-35354414.html,0,www.stern.de,Wetter: Schnee und Glatteis in Rheinland-Pfalz und im Saarland,Menschen in Rheinland-Pfalz und im Saarland müssen sich in der Nacht zum Sonntag für Glätte wappnen. Trotzdem erwartet sie ein milder Wochenwechsel.,https://image.stern.de/35354416/t/pr/v1/w1440/r1.7778/-/04--fqpc2cuaftv3axs2048jpeg---e562349b3e17e9fb.jpg,2025-01-04T09:35:15Z,,"Kopiere den aktuellen Link
Menschen in Rheinland-Pfalz und im Saarland müssen sich in der Nacht zum Sonntag für Glätte wappnen. Trotzdem erwartet sie ein milder Wochenwechsel.
Der Deutsche Wetterdi… [+961 chars]",,de,'Glatteis'
https://www.zeit.de/news/2025-01/04/sachsen-winterlich-weiss-skifreude-im-erzgebirge,https://www.zeit.de/news/2025-01/04/sachsen-winterlich-weiss-skifreude-im-erzgebirge,0,www.zeit.de,Wintersport: Sachsen winterlich weiß - Skifreude im Erzgebirge,Hier finden Sie Informationen zu dem Thema „Wintersport“. Lesen Sie jetzt „Sachsen winterlich weiß - Skifreude im Erzgebirge“.,https://img.zeit.de/news/2025-01/04/sachsen-winterlich-weiss-skifreude-im-erzgebirge-image-group/wide__1300x731,2025-01-04T09:36:17Z,,"Zum Ende der Weihnachtsferien zeigt sich Sachsen winterlich weiß. In der Nacht zum Sonnabend habe es überall etwas Schnee gegeben - im Bergland bis zu fünf Zentimeter, informierte der Deutsche Wetter… [+1399 chars]",,de,'Schnee'
https://www.zeit.de/news/2025-01/04/es-schneit-etwas-und-taut-dann-schnell-wieder,https://www.zeit.de/news/2025-01/04/es-schneit-etwas-und-taut-dann-schnell-wieder,0,www.zeit.de,Warten auf Schnee: Es schneit etwas - und taut dann schnell wieder,Hier finden Sie Informationen zu dem Thema „Warten auf Schnee“. Lesen Sie jetzt „Es schneit etwas - und taut dann schnell wieder“.,https://img.zeit.de/news/2025-01/04/es-schneit-etwas-und-taut-dann-schnell-wieder-image-group/wide__1300x731,2025-01-04T10:49:12Z,,"Kinder dürfen in Nordrhein-Westfalen darauf hoffen, in ihrem Garten einen Schneemann bauen zu können. Laut einer Prognose des Deutschen Wetterdienstes (DWD) schneit es in der Nacht zu Sonntag im Flac… [+787 chars]",,de,'Schnee'
https://www.n-tv.de/panorama/Hunderte-Forellen-verenden-auf-Autobahn-article25466890.html,https://www.n-tv.de/panorama/Hunderte-Forellen-verenden-auf-Autobahn-article25466890.html,0,www.n-tv.de,Lkw baut Glatteis-Unfall: Hunderte Forellen verenden auf Autobahn,"Ein Fischtransporter gerät auf der A1 in Niedersachsen ins Schlittern, bleibt quer auf der Fahrbahn stehen und kollidiert mit einem anderen Lkw. Bei dem Zusammenstoß landen Hunderte lebende Forellen auf der Autobahn. Vier Menschen werden verletzt.",https://bilder2.n-tv.de/img/incoming/crop25466889/006132264-cImg_16_9-w1200/500344913.jpg,2025-01-04T11:17:32Z,,"Ein Fischtransporter gerät auf der A1 in Niedersachsen ins Schlittern, bleibt quer auf der Fahrbahn stehen und kollidiert mit einem anderen Lkw. Bei dem Zusammenstoß landen Hunderte lebende Forellen … [+1807 chars]",,de,'Glatteis'
https://www.tagesspiegel.de/gesellschaft/panorama/wintereinbruch-gefahrliche-glatte-in-ganz-deutschland-12960568.html,https://www.tagesspiegel.de/gesellschaft/panorama/wintereinbruch-gefahrliche-glatte-in-ganz-deutschland-12960568.html,0,www.tagesspiegel.de,Wintereinbruch: Gefährliche Glätte in ganz Deutschland,Der Winter ist da. Schnee und Eis sorgen auf Deutschlands Straßen für zahlreiche Verkehrsunfälle. Am Sonntag droht Glatteis im gesamten Bundesgebiet.,https://www.tagesspiegel.de/images/12960892/alternates/BASE_16_9_W1400/1735997856000/schnee-in-hamburg.jpeg,2025-01-04T11:45:17Z,,Der aktuelle Wintereinbruch mit Schneefall und frostigen Temperaturen hat in ganz Deutschland für zahlreiche Verkehrsunfälle und -behinderungen gesorgt. Bislang war vor allem der Norden des Landes be… [+3226 chars],,de,'Glatteis'
https://www.stern.de/gesellschaft/regional/niedersachsen-bremen/gefahr-von-glatteis--warmfront-sorgt-fuer-brisante-wetterlage-in-niedersachsen-35354590.html,https://www.stern.de/gesellschaft/regional/niedersachsen-bremen/gefahr-von-glatteis--warmfront-sorgt-fuer-brisante-wetterlage-in-niedersachsen-35354590.html,0,www.stern.de,Gefahr von Glatteis: Warmfront sorgt für brisante Wetterlage in Niedersachsen,"Hannover (lni) - Schnee, Regen und Gefahr von Glatteis in Niedersachsen und Bremen: Der Deutsche Wetterdienst (DWD) warnt vor einer brisanten Wetterlage.",https://image.stern.de/35354592/t/78/v1/w1440/r1.7778/-/04--ilhb2trhn4v8axs2048jpeg---88c5e6f0b6ab5249.jpg,2025-01-04T11:47:10Z,https://web.archive.org/web/20250104122526/https://www.stern.de/gesellschaft/regional/niedersachsen-bremen/gefahr-von-glatteis--warmfront-sorgt-fuer-brisante-wetterlage-in-niedersachsen-35354590.html,"Kopiere den aktuellen Link
Nach Schnee kommt Regen: In der Nacht zum Sonntag gibt es zunächst Frost, dann steigen die Temperaturen. Die Folge ist Glatteisgefahr.
Schnee, Regen und Gefahr von Glatte… [+1959 chars]",,de,'Glatteis'
https://www.zeit.de/news/2025-01/04/warmfront-sorgt-fuer-brisante-wetterlage-in-niedersachsen,https://www.zeit.de/news/2025-01/04/warmfront-sorgt-fuer-brisante-wetterlage-in-niedersachsen,0,www.zeit.de,Gefahr von Glatteis: Warmfront sorgt für brisante Wetterlage in Niedersachsen,Hier finden Sie Informationen zu dem Thema „Gefahr von Glatteis“. Lesen Sie jetzt „Warmfront sorgt für brisante Wetterlage in Niedersachsen“.,https://img.zeit.de/news/2025-01/04/warmfront-sorgt-fuer-brisante-wetterlage-in-niedersachsen-image-group/wide__1300x731,2025-01-04T11:47:10Z,,"Schnee, Regen und Gefahr von Glatteis in Niedersachsen und Bremen: Der Deutsche Wetterdienst (DWD) warnt vor einer brisanten Wetterlage. Am Samstag ist vor allem im Norden mit einzelnen Schneeschauer… [+1835 chars]",,de,'Glatteis'
https://www.zeit.de/news/2025-01/04/schnee-und-frost-bringen-skifreude-in-hessen,https://www.zeit.de/news/2025-01/04/schnee-und-frost-bringen-skifreude-in-hessen,0,www.zeit.de,Wintersport: Schnee und Frost bringen Skifreude in Hessen,Hier finden Sie Informationen zu dem Thema „Wintersport“. Lesen Sie jetzt „Schnee und Frost bringen Skifreude in Hessen“.,https://img.zeit.de/news/2025-01/04/schnee-und-frost-bringen-skifreude-in-hessen-image-group/wide__1300x731,2025-01-04T12:44:22Z,,Neuschnee und Minusgrade haben Familien und Wintersportler in Hessens Skigebiete gelockt. Im größten Wintersportgebiet des Bundeslandes in Willingen (Landkreis Waldeck-Frankenberg) startete der Skibe… [+1365 chars],,de,'Schnee'
https://www.zeit.de/news/2025-01/04/endlich-schnee-viel-los-in-winterberg-co,https://www.zeit.de/news/2025-01/04/endlich-schnee-viel-los-in-winterberg-co,0,www.zeit.de,Freizeit-Wintersport: Endlich Schnee: Viel los in Winterberg & Co.,Hier finden Sie Informationen zu dem Thema „Freizeit-Wintersport“. Lesen Sie jetzt „Endlich Schnee: Viel los in Winterberg & Co.“.,https://img.zeit.de/news/2025-01/04/endlich-schnee-viel-los-in-winterberg-co-image-group/wide__1300x731,2025-01-04T13:17:49Z,,"Am letzten Weihnachtsferien-Wochenende haben sich in Nordrhein-Westfalen Tausende Menschen auf den Weg gemacht, um Ski zu fahren oder zu rodeln. Eine Sprecherin der Wintersportarena Sauerland sagte, … [+1132 chars]",,de,'Schnee'
https://www.zeit.de/gesellschaft/2025-01/glatteisregen-wetterdienst-warnung-warmfront,https://www.zeit.de/gesellschaft/2025-01/glatteisregen-wetterdienst-warnung-warmfront,0,www.zeit.de,Warmfront: Wetterdienst warnt vor Glatteisregen über Deutschland,"Ausgerechnet eine Warmfront sorgt für Glatteisgefahr in weiten Teilen Deutschlands. Schnee geht in Regen über, in Süddeutschland ist besondere Vorsicht geboten.",https://img.zeit.de/administratives/sharing/fallback-image/wide__1300x731,2025-01-04T13:18:34Z,,"Weite Teile Deutschlands müssen sich ab der Nacht zum Sonntag auf gefrierenden Regen einstellen. Zunächst falle Schnee, dann gehe dieser in gefrierenden Regen über, heißt es in einer Vorhersage des D… [+949 chars]",,de,'Schnee'
https://www.zeit.de/news/2025-01/04/kleineres-hochwasser-im-saarland-erwartet,https://www.zeit.de/news/2025-01/04/kleineres-hochwasser-im-saarland-erwartet,0,www.zeit.de,Wegen Schnee und Glatteisregen: Kleineres Hochwasser im Saarland erwartet,Hier finden Sie Informationen zu dem Thema „Wegen Schnee und Glatteisregen“. Lesen Sie jetzt „Kleineres Hochwasser im Saarland erwartet“.,https://img.zeit.de/news/2025-01/04/kleineres-hochwasser-im-saarland-erwartet-image-group/wide__1300x731,2025-01-04T13:32:50Z,,"Die Hochwassermeldezentrale Saarland hat vor einem kleineren, zweijährlichen Hochwasser in dem Bundesland gewarnt. Auch Meldestufen sollen dabei überschritten werden, wie die Behörde mitteilte. 
Weg… [+1132 chars]",,de,'Glatteis'
https://www.stern.de/panorama/wintereinbruch--gefaehrliche-glaette-in-ganz-deutschland-35354586.html,https://www.stern.de/panorama/wintereinbruch--gefaehrliche-glaette-in-ganz-deutschland-35354586.html,0,www.stern.de,Wintereinbruch: Gefährliche Glätte in ganz Deutschland,Der Winter ist da. Schnee und Eis sorgen auf Deutschlands Straßen für zahlreiche Verkehrsunfälle. Am Sonntag droht Glatteis im gesamten Bundesgebiet.,https://image.stern.de/35354722/t/Sx/v1/w1440/r1.7778/-/04--gdw5mdv4jpv10axs2048jpeg---0bb515888bb316ad.jpg,2025-01-04T13:35:54Z,,"Kopiere den aktuellen Link
Der Winter ist da. Schnee und Eis sorgen auf Deutschlands Straßen für zahlreiche Verkehrsunfälle. Am Sonntag droht Glatteis im gesamten Bundesgebiet.
Der aktuelle Wintere… [+1967 chars]",,de,'Schnee'
https://www.zeit.de/news/2025-01/04/fraport-warnt-vor-moeglichen-flugausfaellen-in-frankfurt,https://www.zeit.de/news/2025-01/04/fraport-warnt-vor-moeglichen-flugausfaellen-in-frankfurt,0,www.zeit.de,Schnee und Eisregen: Fraport warnt vor möglichen Flugausfällen in Frankfurt,Hier finden Sie Informationen zu dem Thema „Schnee und Eisregen“. Lesen Sie jetzt „Fraport warnt vor möglichen Flugausfällen in Frankfurt“.,https://img.zeit.de/news/2025-01/04/fraport-warnt-vor-moeglichen-flugausfaellen-in-frankfurt-image-group/wide__1300x731,2025-01-04T14:07:39Z,,Wegen der vom Deutschen Wetterdienst vorhergesagten Schneefälle und des gefrierenden Regens müssen Reisende am Frankfurter Flughafen am Sonntag mit Flugausfällen und Verzögerungen rechnen. Besonders … [+742 chars],,de,'Schnee'
