index,url,valid,domain,title,description,image,published,archive,content,quote,language,keyword
https://www.bild.de/regional/berlin/blackout-in-berlin-keine-heizung-jetzt-drohen-wasserrohre-zu-platzen-695bb85ffb77630dac2781e5,https://www.bild.de/regional/berlin/blackout-in-berlin-keine-heizung-jetzt-drohen-wasserrohre-zu-platzen-695bb85ffb77630dac2781e5,0,www.bild.de,Nach dem Blackout in Berlin - Keine Heizung! Jetzt drohen die Rohre zu platzen,Der Stromausfall im Südwesten Berlins führte in vielen Tausend Haushalten auch zum Ausfall der Heizung. Das kann gefährlich werden.,"https://images.bild.de/695bb85ffb77630dac2781e5/378ca3e75f8706fc8114abf88523b816,45646656?w=1280",2026-01-05T18:11:20Z,,"Berlin Der Stromausfall im Südwesten Berlins führte in vielen Tausend Haushalten auch zum Ausfall der Heizung. Eine Gefahr für die Leitungen in den Häusern! 
Denn: Bei dem aktuellen Dauerfrost (nach… [+1833 chars]",,de,'Blackout'
https://www.bild.de/news/inland/berlin-stromausfall-experten-kaempfen-gegen-kaelte-695bc92ab0086aa64be6f6cf,https://www.bild.de/news/inland/berlin-stromausfall-experten-kaempfen-gegen-kaelte-695bc92ab0086aa64be6f6cf,0,www.bild.de,Berlin Blackout - An dieser Baustelle wird das Licht angeknipst,Mehr als 30.000 Haushalte in Berlin ohne Strom nach Anschlag auf das Stromnetz. Rettungsteam arbeitet rund um die Uhr.,"https://images.bild.de/695bc92ab0086aa64be6f6cf/6c63915713ab2c799854be83459f649a,b77aa63a?w=1280",2026-01-06T03:51:52Z,,"Berlin In ihren Händen ruhen die Hoffnungen zehntausender frierender und bibbernder Berliner. Mehr als drei Dutzend Experten, Bauarbeiter und Techniker arbeiten in drei Schichten rund um die Uhr im K… [+2704 chars]",,de,'Blackout'
https://www.morgenpost.de/berlin/article410857178/blackout-des-regierenden-buergermeisters-kai-wegner.html,https://www.morgenpost.de/berlin/article410857178/blackout-des-regierenden-buergermeisters-kai-wegner.html,0,www.morgenpost.de,Blackout des Regierenden Bürgermeisters Kai Wegner,"Der Stromausfall vom Wochenende zeigt, wie schlecht Berlin beim Katastrophenschutz aufgestellt ist.",https://img.sparknews.funkemedien.de/410855722/410855722_1767632869_v16_9_1600.jpeg,2026-01-06T05:30:00Z,,"Liebe Leserin, lieber Leser,
die Monteure der Stromnetz Berlin arbeiten derzeit unter widrigsten Bedingungen bei Bodenfrost und Schnee, eine Gasleitung liegt auch noch im Weg. Einsatzkräfte des THW … [+5091 chars]",,de,'Blackout'
https://www.stern.de/gesundheit/psychologie/gesichtserkennung--warum-die-gen-z-probleme-mit-alten-gesichtern-hat-37010544.html,https://www.stern.de/gesundheit/psychologie/gesichtserkennung--warum-die-gen-z-probleme-mit-alten-gesichtern-hat-37010544.html,0,www.stern.de,Gesichter erkennen: Für die Gen Z sind die Boomer ein blinder Fleck,"Die Gen Z und Gesichtserkennung? Ein Problem. Die jungen Erwachsenen erkennen zwar ihresgleichen wieder, aber schwächeln, wenn es um die Gesichter ältere Menschen geht.",https://image.stern.de/37012140/t/oE/v5/w1440/r1.7778/-/gesichtserkennung-der-gen-z.jpg,2026-01-07T08:22:00Z,,"Zugang zu stern+statt 11,96 
 nur 1  
<ul><li>Alles von stern+ mit erstklassigen Inhalten von GEO und Capital</li><li>4 Wochen testen, dann 2,99  je Woche</li><li>jederzeit kündbar</li></ul>",,de,'ältere Menschen'
https://www.bild.de/news/wetter/winter-dreht-auf-deutschland-zittert-vor-sturmtief-elli-695e73ae39f407efbce2d6e0,https://www.bild.de/news/wetter/winter-dreht-auf-deutschland-zittert-vor-sturmtief-elli-695e73ae39f407efbce2d6e0,0,www.bild.de,Winter dreht auf - Deutschland zittert vor Sturmtief Elli,Der Winter dreht jetzt richtig auf! Sturmtief Elli bringt Schneechaos und Glatteis nach Deutschland.,"https://images.bild.de/695e73ae39f407efbce2d6e0/45b0cc463869749640c683acba9f5e8b,339f1ee2?w=1280",2026-01-07T15:17:24Z,,"Wer in den nächsten Tagen zu den Nordseeinseln reisen will, sollte genau hinschauen: Kräftiger Ostwind kann den Fährverkehr empfindlich stören. Reedereien warnen vor Ausfällen und Einschränkungen, be… [+840 chars]",,de,'Winter'
https://www.zeit.de/news/2026-01/07/schnee-sturm-unterrichtsausfall-wie-geht-es-weiter,https://www.zeit.de/news/2026-01/07/schnee-sturm-unterrichtsausfall-wie-geht-es-weiter,0,www.zeit.de,"Winterwetter in Niedersachsen: Schnee, Sturm, Unterrichtsausfall – Wie geht es weiter?","Hier finden Sie Informationen zu dem Thema „Winterwetter in Niedersachsen“. Lesen Sie jetzt „Schnee, Sturm, Unterrichtsausfall – Wie geht es weiter?“.",https://img.zeit.de/news/2026-01/07/schnee-sturm-unterrichtsausfall-wie-geht-es-weiter-image-group/wide__1300x731,2026-01-07T15:23:12Z,,Das Winterwetter sorgt in Niedersachsen und Bremen für viele Herausforderungen und das wird erst mal so bleiben. Wegen anhaltender Schneefälle und glatter Straßen fällt mancherorts der reguläre Schul… [+3622 chars],,de,'Schnee'
https://www.stern.de/gesellschaft/regional/niedersachsen-bremen/winterwetter-in-niedersachsen--schnee--sturm--unterrichtsausfall---wie-geht-es-weiter--37019292.html,https://www.stern.de/gesellschaft/regional/niedersachsen-bremen/winterwetter-in-niedersachsen--schnee--sturm--unterrichtsausfall---wie-geht-es-weiter--37019292.html,0,www.stern.de,"Winterwetter in Niedersachsen: Schnee, Sturm, Unterrichtsausfall – Wie geht es weiter?","Schulausfall und Zugverspätungen, aber auch prachtvolle weiße Landschaften und Schlittenfahrten – das Winterwetter prägt das Leben in Niedersachsen und Bremen. Und es soll noch turbulenter werden.",https://image.stern.de/37019294/t/Ur/v1/w1440/r1.7778/-/07--2pawhwhop5v3axs2048jpeg---4600eec6a4711d07.jpg,2026-01-07T15:23:12Z,,"Kopiere den aktuellen Link
Zur Merkliste hinzufügen
Schulausfall und Zugverspätungen, aber auch prachtvolle weiße Landschaften und Schlittenfahrten das Winterwetter prägt das Leben in Niedersachsen… [+4093 chars]",,de,'Schnee'
https://www.bild.de/politik/inland/hamburgs-friedhoefe-schliessen-beerdigungen-abgesagt-695e727e9c2c98991fda38fe,https://www.bild.de/politik/inland/hamburgs-friedhoefe-schliessen-beerdigungen-abgesagt-695e727e9c2c98991fda38fe,0,www.bild.de,Wegen Schnee-Chaos - Erste Stadt sagt Beerdigungen ab,"Schnee-Chaos stoppt Beisetzungen in Hamburg: 33 Beerdigungen betroffen, Friedhöfe bis Montag geschlossen.","https://images.bild.de/695e727e9c2c98991fda38fe/aef95a8ce84717bd0f76ee67d3286bfb,659355f1?w=1280",2026-01-07T15:26:35Z,,Hamburg Schlimme Nachricht für viele Trauernde: Die Millionen-Metropole Hamburg muss auf den meisten Friedhöfen der Stadt die Beerdigungen absagen! Betroffen ist nach BILD-Informationen auch der ries… [+1622 chars],,de,'Schnee'
https://www.bild.de/leben-wissen/mein-recht-verbraucherportal/darf-mein-chef-mich-bei-lebensgefahr-zur-arbeit-zwingen-695e4c664d1d5f581eeae617,https://www.bild.de/leben-wissen/mein-recht-verbraucherportal/darf-mein-chef-mich-bei-lebensgefahr-zur-arbeit-zwingen-695e4c664d1d5f581eeae617,0,www.bild.de,"Glatteis, Schnee, Sturm - Muss ich auch bei Lebensgefahr zur Arbeit gehen?","Schneesturm, Glatteis, Extremwetter: Deutschland steuert auf gefährliche Tage zu. Am Freitag wird es lebensbedrohlich. Meteorologen schlagen Alarm.","https://images.bild.de/695e4c664d1d5f581eeae617/5bcb39901a8dd25035c87595b245c196,e660b4f7?w=1280",2026-01-07T15:30:14Z,,"Deutschland steht vor gefährlichen Wintertagen. Ein massiver Schneesturm bringt Sturm, Eisregen und starken Schneefall eine explosive Mischung, vor der Meteorologen eindringlich warnen. Vor allem am … [+342 chars]",,de,'Schnee'
