index,url,valid,domain,title,description,image,published,archive,content,quote,language,keyword
https://www.sueddeutsche.de/bayern/bayern-kinderbetreuung-baykibig-tagesmuetter-kosten-geld-streichung-li.3513404,https://www.sueddeutsche.de/bayern/bayern-kinderbetreuung-baykibig-tagesmuetter-kosten-geld-streichung-li.3513404,0,www.sueddeutsche.de,Kinderbetreuung: Großtagespflegen bangen um ihre Zukunft,"Tagesmütter bieten eine familienähnliche, flexible Kinderbetreuung an, die manche Eltern sehr zu schätzen wissen. Durch die Reform des Bayerischen Kinderbetreuungsgesetzes aber fällt für sie eine wichtige Förderung weg.",https://www.sueddeutsche.de/2022/06/20/2ab0c8de-d902-42b8-a515-c90109da540a.jpeg?q=60&fm=webp&width=1200&rect=0%2C113%2C1200%2C675,2026-07-09T14:31:30Z,,"Bislang wird die Kindertagespflege analog zu anderen Kindertageseinrichtungen über das BayKiBig gefördert. Für Kinder, die aufgrund von Behinderungen oder Sprachschwierigkeiten besonders intensiv bet… [+1856 chars]",,de,'Kinder'
https://www.sueddeutsche.de/projekte/artikel/gesellschaft/behinderung-inklusion-kinderwunsch-leihmutterschaft-e730545/,https://www.sueddeutsche.de/projekte/artikel/gesellschaft/behinderung-inklusion-kinderwunsch-leihmutterschaft-e730545/,0,www.sueddeutsche.de,Leihmutterschaft: Wunschkind ohne Eltern,"Wegen einer Behinderung kann Svenja Steinke keine Kinder bekommen – und beauftragt eine Leihmutteragentur in Ghana. Als sie das Kind schließlich im Arm hält, der Schock: Sie darf ihre Tochter nicht mit nach Deutschland nehmen.","https://www.sueddeutsche.de/projekte/artikel/gesellschaft/behinderung-inklusion-kinderwunsch-leihmutterschaft-e730545/3fb35ff6a646ca3dc47ea6ff6d7de6250cec3a2ef73b66517f333655f589265a_w2400_h1256_r718,0,3072,1608_q70_ro90.jpg",2026-07-09T15:00:00Z,,"Der Facebook-Post der ghanaischen Leihmutteragentur Afrigha Surrogacy zeigt drei Polaroid-Fotos, darauf ein schlafendes Neugeborenes, eingewickelt in ein weißes Tuch, „Baby Tilda“. Dazu ein paar Zeil… [+2 chars]",,de,'Kinder'
https://www.faz.net/aktuell/gesellschaft/kriminalitaet/block-prozess-jonathan-c-sieht-sich-als-opfer-201015411.html,https://www.faz.net/aktuell/gesellschaft/kriminalitaet/block-prozess-jonathan-c-sieht-sich-als-opfer-201015411.html,0,www.faz.net,"Mutmaßlicher Entführer: „Ich bin dumm, dass ich darauf reingefallen bin“",Im Block-Prozess sagt das frühere Model Jonathan G. abermals aus. Er fühle sich als Opfer – und er will den Vater der beiden entführten Kinder nicht geschlagen haben.,https://media0.faz.net/image/w1200h627/d7ef07592713/w1975h1031x0y143o/202607/43601.0.2316969467/der-mutmassliche-tatbeteiligte.webp,2026-07-09T15:02:05Z,,"Im Fall Block fühlt sich einer der mutmaßlichen Entführer eigenen Worten zufolge ausgenutzt. Ich fühle mich als Opfer, sagte der 35 Jahre alte Zeuge Jonathan G., der früher als Model und Fitnesstrain… [+3408 chars]",,de,'Kinder'
https://www.bild.de/leben-wissen/reisen/familienurlaub-ohne-stress-so-gelingt-das-reisen-mit-kindern-649adf4699aa777d69474d20,https://www.bild.de/leben-wissen/reisen/familienurlaub-ohne-stress-so-gelingt-das-reisen-mit-kindern-649adf4699aa777d69474d20,0,www.bild.de,Reisen mit Kindern - So wird Ihr Familienurlaub zum Genuss für alle,Ein Familienurlaub erfordert oft mehr Planung als gewöhnlich. Mit den richtigen Tipps wird aber Ihre Reise mit Kindern stressfrei – und für alle zum Genuss.,"https://images.bild.de/649adf4699aa777d69474d20/e9c35d89fb8848e2675948d321ba1dad,96cf4b05?w=1280",2026-07-09T15:03:02Z,,TTS-Player überspringenArtikel weiterlesenEndlich Urlaub doch für viele Eltern bedeutet das alles andere als pure Entspannung. Auch am schönsten Ort der Welt wollen Kinder beschäftigt und unterhalten… [+4827 chars],,de,'Kinder'
https://www.faz.net/aktuell/politik/ausland/eu-parlament-ebnet-weg-fuer-freiwillige-chatkontrolle-201013880.html,https://www.faz.net/aktuell/politik/ausland/eu-parlament-ebnet-weg-fuer-freiwillige-chatkontrolle-201013880.html,0,www.faz.net,EU-Parlament: Neuer Anlauf für Verlängerung der Chatkontrolle,Aktuell dürfen Anbieter von Chatdiensten nicht nach Missbrauchsdarstellungen von Kindern suchen. Diese Gesetzeslücke soll wieder geschlossen werden.,https://media0.faz.net/image/w1200h627/f5a7991d5f0c/w4552h2378x0y91o/202607/43601.0.2317580175/eine-hessische.webp,2026-07-09T15:19:34Z,,"Das Europäische Parlament hat am Donnerstag einen neuen Versuch unternommen, um es Anbietern von Messengerdiensten weiter zu gestatten, dass sie unverschlüsselte private Kommunikation auf Missbrauchs… [+4135 chars]",,de,'Kinder'
https://www1.wdr.de/nrw/rheinland/bonn/steinmeier-steinkohle-haus-der-geschichte-100.html,https://www1.wdr.de/nrw/rheinland/bonn/steinmeier-steinkohle-haus-der-geschichte-100.html,0,www1.wdr.de,Bundespräsident Steinmeier übergibt Haus der Geschichte letzte Kohle,Bundespräsident Steinmeier hat dem Bonner Haus der Geschichte das letzte in Deutschland geförderte Stück Steinkohle übergeben. Der sieben Kilo schwere Brocken war 2018 in der Zeche Prosper-Haniel in Bottrop gefördert worden.,https://images.tagesschau.de/image/4aa27b21-d1a7-4b53-b7bc-3048bfba31e6/AAABn0eBpEo/AAABnSSvrFg/16x9-big/steinmeier-1446.jpg?width=1280,2026-07-09T15:24:55Z,,"Stand: 09.07.2026 17:24 Uhr
Bundespräsident Steinmeier hat dem Bonner Haus der Geschichte das letzte in Deutschland geförderte Stück Steinkohle übergeben. Der sieben Kilo schwere Brocken war 2018 in… [+3640 chars]",,de,'Kohle'
https://www.bild.de/leben-wissen/haustiere/experten-warnen-darum-sollten-kinder-nie-mit-hunden-allein-sein-6a4f8e2bfe4170d03593b7a4,https://www.bild.de/leben-wissen/haustiere/experten-warnen-darum-sollten-kinder-nie-mit-hunden-allein-sein-6a4f8e2bfe4170d03593b7a4,0,www.bild.de,Das sagen Experten - Warum Kinder nie mit Hunden allein sein sollten,"Viele Beißvorfälle mit Hunden entstehen im Alltag. Experten erklären, welche Warnsignale Eltern kennen sollten und warum Aufsicht so wichtig ist.","https://images.bild.de/6a4f8e2bfe4170d03593b7a4/13b21cd13d0fb88ba382b03ccf765f75,6266d892?w=1280",2026-07-09T15:46:38Z,,TTS-Player überspringenArtikel weiterlesenDer Tod der vierjährigen Matilda aus Sachsen-Anhalt erschüttert derzeit ganz Deutschland. Das Mädchen wurde in der Wohnung seiner Familie von einem Pitbull t… [+3142 chars],,de,'Kinder'
"https://www.gamestar.de/artikel/bildschirmzeit-kinder-erwachsene-studie-smartphones,3456091.html","https://www.gamestar.de/artikel/bildschirmzeit-kinder-erwachsene-studie-smartphones,3456091.html",0,www.gamestar.de,Smartphones - Die Bildschirmzeit von Kindern wird seit Jahren diskutiert – eine neue Studie nimmt jetzt die Handy-Nutzung der Eltern in den Fokus,"Nicht nur die Bildschirmzeit der Kinder kann sich negativ auswirken, auch die der Eltern kann Folgen haben.",https://images.cgames.de/images/gamestar/293/eltern-smartphone-bild-jacob-lund-auf-adobe-stock_6428392.jpg,2026-07-09T15:52:00Z,,"Die Handynutzung der Eltern kann sich auch auf die Kinder auswirken. (Bild: Jacob Lund auf Adobe Stock)
In den vergangenen Jahren wurde verstärkt hinterfragt, welche negativen Auswirkungen eine häuf… [+2171 chars]",,de,'Kinder'
https://www.faz.net/aktuell/wirtschaft/unternehmen/squishy-dumplings-der-neue-spielzeug-trend-fuer-kinder-200955695.html,https://www.faz.net/aktuell/wirtschaft/unternehmen/squishy-dumplings-der-neue-spielzeug-trend-fuer-kinder-200955695.html,0,www.faz.net,Trend-Spielzeug: Der nächste Labubu,„Squishy Dumplings“ sorgen derzeit für leuchtende Augen bei Kindern und Jugendlichen. Warum junge Menschen jetzt verrückt nach den kleinen Kunststoffteigtaschen sind.,https://media0.faz.net/image/w1200h627/13b9026a70c0/w7008h3661x0y505o/202606/43601.0.2255962712/quetschen-und-sammeln.webp,2026-07-09T15:54:07Z,,"Es gibt Produkte, die keiner braucht und trotzdem jeder haben will. Im Spielzeugregal zeigt sich das ganz besonders: Plötzlich suchen Kinder überall nach kleinen Monstern mit spitzen Ohren, tauschen … [+4652 chars]",,de,'Kinder'
https://www.zeit.de/news/2026-07/10/kinder-sichern-unfallstelle-ab-und-weisen-feuerwehr-den-weg,https://www.zeit.de/news/2026-07/10/kinder-sichern-unfallstelle-ab-und-weisen-feuerwehr-den-weg,0,www.zeit.de,Verkehr: Kinder sichern Unfallstelle ab und weisen Feuerwehr den Weg,Hier finden Sie Informationen zu dem Thema „Verkehr“. Lesen Sie jetzt „Kinder sichern Unfallstelle ab und weisen Feuerwehr den Weg“.,https://img.zeit.de/news/2026-07/10/kinder-sichern-unfallstelle-ab-und-weisen-feuerwehr-den-weg-image-group/wide__1300x731,2026-07-10T05:23:20Z,,Zwei zwölfjährige Jungen haben nach einem Verkehrsunfall vorbildlich reagiert und die Unfallstelle abgesichert. Ein 74 Jahre alter Rollerfahrer war bei Furth im Wald (Landkreis Cham) von der Fahrbahn… [+1092 chars],,de,'Kinder'
https://www.golem.de/sonstiges/zustimmung/auswahl.html?from=https://www.golem.de/news/heizungsgesetz-gas-und-oelheizungen-werden-hinter-buerokratie-versteckt-2607-210736.html&referer=https://t.co/665d7961c6,https://www.golem.de/sonstiges/zustimmung/auswahl.html?from=https://www.golem.de/news/heizungsgesetz-gas-und-oelheizungen-werden-hinter-buerokratie-versteckt-2607-210736.html&referer=https://t.co/665d7961c6,0,www.golem.de,Heizungsgesetz: Gas- und Ölheizungen werden hinter Bürokratie versteckt,"Der Einbau neuer Gasheizungen wird wieder erlaubt, aber für Mieter wie Vermieter könnte es kompliziert werden. (Energiewende, Politik)",,2026-07-10T07:58:02Z,,"Besuchen Sie Golem.de wie gewohnt mit Werbung und Tracking,
 indem Sie der Nutzung aller Cookies zustimmen.
 Details zum Tracking finden Sie im Privacy Center.
Skript wurde nicht geladen. Informat… [+607 chars]",,de,'Gas'
https://www.iphone-ticker.de/kinderschutz-apple-verlangt-zusaetzliche-angaben-von-app-entwicklern-281234/,https://www.iphone-ticker.de/kinderschutz-apple-verlangt-zusaetzliche-angaben-von-app-entwicklern-281234/,0,www.iphone-ticker.de,Kinderschutz: Apple verlangt zusätzliche Angaben von App-Entwicklern,"Apple nimmt im Zusammenhang mit den für iOS 27, iPadOS 27 und macOS 27 angekündigten erweiterten Kinderschutzfunktionen auch die App-Entwickler stärker in die Pflicht. Diese müssen im Zusammenhang mit einer App-Veröffentlichung künftig konkreter darauf eingeh…",https://images.ifun.de/wp-content/uploads/2026/06/apple-kinder-feature.jpg,2026-07-10T09:59:54Z,,"Apple nimmt im Zusammenhang mit den für iOS 27, iPadOS 27 und macOS 27 angekündigten erweiterten Kinderschutzfunktionen auch die App-Entwickler stärker in die Pflicht. Diese müssen im Zusammenhang mi… [+1845 chars]",,de,'Kinder'
https://www.focus.de/panorama/welt/wissen-nicht-wer-die-rechtsnachfolger-waeren-stadt-sucht-nach-erben-um-flussufer-sicherer-zu-machen_1e60287f-393c-4b89-ac8d-c1932792b998.html,https://www.focus.de/panorama/welt/wissen-nicht-wer-die-rechtsnachfolger-waeren-stadt-sucht-nach-erben-um-flussufer-sicherer-zu-machen_1e60287f-393c-4b89-ac8d-c1932792b998.html,0,www.focus.de,"„Wissen nicht, wer die Rechtsnachfolger wären”: Stadt sucht nach Erben, um Flussufer sicherer zu machen",Die belgische Stadt Verviers möchte den Hochwasserschutz verbessern und muss dafür alle Grundstücke an einer Flusspromenade aufkaufen. Ein Grundstück bereitet allerdings Probleme.,"https://quadro.burda-forward.de/ctf/95c43342-80df-4999-9094-155bdac5eae3.418f15c0-1517-42b6-9d38-533514f8c02b.jpg?im=RegionOfInterestCrop=(1200,630),regionOfInterest=(969,991)&hash=b70b537434f04794096eba82dac63858f1048001f7d5a2f69510b387319163c8",2026-07-10T10:01:00Z,,"Seit der Flutkatastrophe im Juli 2021 verfolgt die belgische Stadt Verviers einen Plan. Sie will alle Gebäude an der Promenade des Récollets aufkaufen, abreißen und das Flussufer widerstandsfähiger g… [+2328 chars]",,de,'Hochwasser'
https://www.horizont.net/medien/nachrichten/milliardenstrafe-droht-eu-kommissioninstagram-und-facebook-bergen-zu-grosse-suchtrisiken-235042,https://www.horizont.net/medien/nachrichten/milliardenstrafe-droht-eu-kommissioninstagram-und-facebook-bergen-zu-grosse-suchtrisiken-235042,0,www.horizont.net,Milliardenstrafe droht: EU-Kommission: Instagram und Facebook bergen zu große Suchtrisiken,Wie gefährlich sind Instagram und Facebook für Kinder und Jugendliche? EU-Prüfer erheben nach zweijährigen Ermittlungen Vorwürfe gegen den Meta-Konzern. Dies könnte weitreichende Konsequenzen haben.,https://www.horizont.net/news/media/50/Faceboo-un-Instagra-stelle-ein-Gefah-f-Kinde-da-499265.jpeg,2026-07-10T10:14:00Z,,Wie gefährlich sind Instagram und Facebook für Kinder und Jugendliche? EU-Prüfer erheben nach zweijährigen Ermittlungen Vorwürfe gegen den Meta-Konzern. Dies könnte weitreichende Konsequenzen haben.,,,
https://www.bild.de/politik/wegen-suchtrisiken-fuer-jugendliche-eu-fordert-umbau-von-instagram-und-facebook-6a50c3da43b7fd5185004ee5,https://www.bild.de/politik/wegen-suchtrisiken-fuer-jugendliche-eu-fordert-umbau-von-instagram-und-facebook-6a50c3da43b7fd5185004ee5,0,www.bild.de,Wegen Suchtrisiken für Jugendliche - EU fordert Umbau von Instagram und Facebook,"EU prüft Suchtgefahr für Kinder bei Meta-Apps, dem Konzern drohen Milliardensanktionen.","https://images.bild.de/6a50c3da43b7fd5185004ee5/a7cdcc15cee1da0cbb57d8c5fa890220,b2a53445?w=1280",2026-07-10T10:27:03Z,,"TTS-Player überspringenArtikel weiterlesenBrüssel Endlos scrollen, automatisch startende Videos, ständige Benachrichtigungen: Genau diese Funktionen bringen Facebook und Instagram jetzt massiv unter … [+2008 chars]",,de,'Kinder'
https://www.nzz.ch/wirtschaft/die-eu-kommission-sieht-bei-instagram-und-facebook-eine-zu-grosse-suchtgefahr-reagiert-zuckerberg-nicht-droht-eine-hohe-strafe-ld.10014986,https://www.nzz.ch/wirtschaft/die-eu-kommission-sieht-bei-instagram-und-facebook-eine-zu-grosse-suchtgefahr-reagiert-zuckerberg-nicht-droht-eine-hohe-strafe-ld.10014986,0,www.nzz.ch,"Die EU-Kommission sieht bei Instagram und Facebook eine zu grosse Suchtgefahr – reagiert Zuckerberg nicht, droht eine hohe Strafe",Wie gefährlich sind Instagram und Facebook für Kinder und Jugendliche? EU-Prüfer erheben nach zweijährigen Ermittlungen Vorwürfe gegen den Meta-Konzern.,"https://img-msp-prod.nzz.ch/2026/02/02/4fd0581a-99cf-45cd-8378-23adcdd59d85.jpg?width=1200&height=674&fit=bounds&quality=75&auto=webp&crop=5000,2812,x0,y260&wmark=nzz",2026-07-10T10:34:38Z,,"Wie gefährlich sind Instagram und Facebook für Kinder und Jugendliche? EU-Prüfer erheben nach zweijährigen Ermittlungen Vorwürfe gegen den Meta-Konzern.
10.07.2026, 12.34 Uhr
Zusammenfassung
Wie g… [+3973 chars]",,de,'Kinder'
https://taz.de/Tagebuch-aus-der-Ukraine/!6192880/,https://taz.de/Tagebuch-aus-der-Ukraine/!6192880/,0,taz.de,Tagebuch aus der Ukraine: Eine Misswahl? Für Kinder? Im Krieg?,"In Ternopil gibt es Talentwettbewerbe, um Mädchen zur „Mini-Miss Ukraine“ zu küren. Doch die Kinder stellen dort auch soziale Projekte vor.",https://taz.de/picture/8586021/1200/imago329127081.jpeg,2026-07-10T10:51:00Z,,"In Ternopil gibt es Talentwettbewerbe, um Mädchen zur „Mini-Miss Ukraine“ zu küren. Doch die Kinder stellen dort auch soziale Projekte vor. mehr...",,de,'Kinder'
https://www.tagesspiegel.de/wirtschaft/meta-konzern-droht-milliardenstrafe-eu-sieht-bei-instagram-und-facebook-zu-hohe-suchtgefahr-15826955.html,https://www.tagesspiegel.de/wirtschaft/meta-konzern-droht-milliardenstrafe-eu-sieht-bei-instagram-und-facebook-zu-hohe-suchtgefahr-15826955.html,0,www.tagesspiegel.de,Meta-Konzern droht Milliardenstrafe: EU sieht bei Instagram und Facebook zu hohe Suchtgefahr,Wie gefährlich sind Instagram und Facebook für Kinder und Jugendliche? EU-Prüfer erheben nach zweijährigen Ermittlungen Vorwürfe gegen Meta. Das könnte weitreichende Konsequenzen haben.,https://www.tagesspiegel.de/images/15827013/alternates/BASE_16_9_W1400/1783680519000/social-media-altersgrenzen.jpeg,2026-07-10T10:54:27Z,,Instagram und Facebook bergen nach vorläufigen Ergebnissen einer EU-Untersuchung zu große Suchtgefahren für Kinder und Jugendliche. Die Europäische Kommission sieht Risiken unter anderem durch stark … [+5182 chars],,de,'Kinder'
https://www.welt.de/regionales/niedersachsen/article6a50a9585ee5db799e970c58/acht-verletzte-bei-unfall-in-brockzetel-mazda-fahrer-in-lebensgefahr.html,https://www.welt.de/regionales/niedersachsen/article6a50a9585ee5db799e970c58/acht-verletzte-bei-unfall-in-brockzetel-mazda-fahrer-in-lebensgefahr.html,0,www.welt.de,Acht Verletzte bei Unfall in Brockzetel: Mazda-Fahrer in Lebensgefahr,"In Brockzetel kollidierten zwei Autos an einer Kreuzung. Mehrere Erwachsene und Kinder wurden verletzt, ein Mann kam per Hubschrauber ins Krankenhaus.",https://images.welt.de/6a50a9585ee5db799e970c58/07d96d72baa6f83e9c6eef33d36f5bdd/ci16x9-w1200/dpa-com-260709-935-1468848-jpg,2026-07-10T10:56:24Z,,Dein News-Update für Aurich am 10. Juli 2026Bei einem Verkehrsunfall zwischen zwei Autos in Brockzetel sind acht Menschen verletzt worden einer davon schwebt in Lebensgefahr. Der Unfall habe sich ere… [+3847 chars],,de,'Kinder'
https://de.catholicnewsagency.com/news/25059/umwelt-bischof-lohmann-fordert-die-notwendigen-anpassungen-an-den-klimawandel,https://de.catholicnewsagency.com/news/25059/umwelt-bischof-lohmann-fordert-die-notwendigen-anpassungen-an-den-klimawandel,0,de.catholicnewsagency.com,Umwelt-Bischof Lohmann fordert „die notwendigen Anpassungen an den Klimawandel“,"Der Münsteraner Weihbischof Rolf Lohmann hat angesichts der zuletzt sehr hohen Temperaturen in weiten Teilen von Europa gefordert: „Wir müssen dringend die notwendigen Anpassungen an den Klimawandel vornehmen!“
„Besonders Kinder, Schwangere und ältere Mensche…",https://de.catholicnewsagency.com/image/bm46122_1763936851.jpg?w=1150&jpg,2026-07-10T11:00:00Z,,"Redaktion -
 Freitag, 10. Juli 2026, 13:00 Uhr.
Der Münsteraner Weihbischof Rolf Lohmann hat angesichts der zuletzt sehr hohen Temperaturen in weiten Teilen von Europa gefordert: Wir müssen dringen… [+1494 chars]",,de,'Kinder'
https://www.welt.de/politik/ausland/article6a50c5b8c13a557858aa0ad2/soziale-medien-instagram-und-facebook-machen-kinder-laut-bericht-suechtig-eu-fordert-konsequenzen.html,https://www.welt.de/politik/ausland/article6a50c5b8c13a557858aa0ad2/soziale-medien-instagram-und-facebook-machen-kinder-laut-bericht-suechtig-eu-fordert-konsequenzen.html,0,www.welt.de,Instagram und Facebook machen Kinder laut Bericht süchtig – EU fordert Konsequenzen,Facebook und Instagram könnten Kinder und Jugendliche zu leicht abhängig machen – zu diesem Schluss kommt ein EU-Bericht. Der Konzern Meta muss nun reagieren. Der Bericht könnte die Debatte um Verbote weiter anheizen.,https://images.welt.de/6a50c5b8c13a557858aa0ad2/171bf52d4aead59f7352d114647cf003/ci16x9-w1200/dpa-com-260707-935-1463751-jpg,2026-07-10T11:01:58Z,,Facebook und Instagram könnten Kinder und Jugendliche zu leicht abhängig machen zu diesem Schluss kommt ein EU-Bericht. Der Konzern Meta muss nun reagieren. Der Bericht könnte die Debatte um Verbote … [+4883 chars],,de,'Kinder'
https://taz.de/Kunst-gegen-Kaelte/!6191101/,https://taz.de/Kunst-gegen-Kaelte/!6191101/,0,taz.de,Kunst gegen Kälte: Wo Schlingensief die Suppe gereicht hat,"Ein paar Stunden im Warmen, dazu ein schräges Konzert: In Hamburg wurde mit einem Buch an die „Mission“ erinnert und ihre ganz eigene Straßensozialarbeit.",https://taz.de/picture/8601788/1200/9042808.jpeg,2026-07-10T11:10:00Z,,"Ein paar Stunden im Warmen, dazu ein schräges Konzert: In Hamburg wurde mit einem Buch an die „Mission“ erinnert und ihre ganz eigene Straßensozialarbeit. mehr...",,de,'Kälte'
https://www.tagesschau.de/wirtschaft/verbraucher/heizen-gebaeudemodernisierungsgesetz-foerderung-100.html,https://www.tagesschau.de/wirtschaft/verbraucher/heizen-gebaeudemodernisierungsgesetz-foerderung-100.html,0,www.tagesschau.de,Neue Regeln für Wärmepumpe und Gas: Was sich beim Heizen ändert,Der Einbau einer Erdgas-Heizung in Neubauten ist künftig wieder möglich - wobei Experten vor den Kosten warnen. Und der Staat zahlt weniger Förderung für den Umstieg auf Wärmepumpen. Ein Überblick.,https://images.tagesschau.de/image/2cdfe5bc-c7ce-4c52-9335-c89282c12c74/AAABn0tnEMw/AAABnSSvrFg/16x9-big/waermepumpe-254.jpg?width=1280,2026-07-10T16:53:16Z,,"Stand: 10.07.2026 18:53 Uhr
Der Einbau einer Erdgas-Heizung in Neubauten ist künftig wieder möglich - wobei Experten vor den Kosten warnen. Und der Staat zahlt weniger Förderung für den Umstieg auf … [+7567 chars]",,de,'Gas'
https://www.faz.net/aktuell/politik/ausland/kuba-zweiter-landesweiter-blackout-in-nur-einer-woche-accg-201019902.html,https://www.faz.net/aktuell/politik/ausland/kuba-zweiter-landesweiter-blackout-in-nur-einer-woche-accg-201019902.html,0,www.faz.net,Blackout: Zweiter Stromausfall in einer Woche legt Kuba lahm,Kuba kämpft seit Jahren mit einer schweren Energiekrise. Das US-Ölembargo und die zunehmend marode Infrastruktur verschärfen die Lage.,https://media0.faz.net/image/w1200h627/86858957648a/w6144h3210x0y443o/202607/43601.0.2308160263/havanna-menschen-sitzen.webp,2026-07-11T00:22:38Z,,"Zum zweiten Mal innerhalb von nur vier Tagen ist es auf Kuba zu einem erneuten inselweiten Blackout gekommen. Wie das Energieministerium mitteilte, wurden die Notfallprotokolle zur Wiederherstellung … [+1133 chars]",,de,'Blackout'
https://www.sueddeutsche.de/panorama/kuba-stromausfall-energiekrise-us-sanktionen-li.3514192,https://www.sueddeutsche.de/panorama/kuba-stromausfall-energiekrise-us-sanktionen-li.3514192,0,www.sueddeutsche.de,Karibikstaat: Zweiter Blackout auf Kuba in einer Woche,Seit Jahren kämpft Kuba  mit einer schweren Energiekrise. Das Ölembargo der Trump-Regierung und die zunehmend marode Infrastruktur verschärfen die Lage.,https://www.sueddeutsche.de/2026/07/07/67ad9e48-f688-4ce8-ba60-0abd23e02285.jpg?q=60&fm=webp&width=1200&rect=0%2C107%2C2048%2C1152,2026-07-11T02:35:03Z,,"Der Zusammenbruch ereignete sich inmitten einer kritischen Energiekrise, unter der das Land bereits schwer zu leiden hat, schrieb Granma, die offizielle Zeitung der Kommunistischen Partei Kubas, auf … [+736 chars]",,de,'Blackout'
https://www.zeit.de/familie/2026-07/sommerferien-urlaub-reise-finanzielle-schwierigkeiten-familie,https://www.zeit.de/familie/2026-07/sommerferien-urlaub-reise-finanzielle-schwierigkeiten-familie,0,www.zeit.de,Sommerferien ohne Urlaub: Die Kinder lieben unseren Nicht-Urlaub,"Jeder Fünfte in Deutschland hat kein Geld, um mit den Kindern in die Ferien zu fahren. So wie unser Autor. Dafür weiß er, wie man unvergesslichen Urlaub zu Hause macht.",https://img.zeit.de/familie/2026-07/sommerferien-urlaub-reise-finanzielle-schwierigkeiten-familie-bild/wide__1300x731,2026-07-11T07:18:10Z,,"Dieser Artikel ist Teil von ZEIT am Wochenende, Ausgabe 28/2026. 
Direkt gegenüber meiner
Wohnung ist ein TUI-Reisebüro. Wenn ich meinen Sohn zur Schule begleite, kommen
wir daran vorbei. »Da würd… [+367 chars]",,de,'Kinder'
https://www.diepresse.com/36688363/zweiter-inselweiter-blackout-auf-kuba-in-einer-woche,https://www.diepresse.com/36688363/zweiter-inselweiter-blackout-auf-kuba-in-einer-woche,0,www.diepresse.com,Zweiter inselweiter Blackout auf Kuba in einer Woche,Aufgrund der maroden Infrastruktur und eines von den USA seit Monaten verhängten Ölembargos leidet die sozialistische Karibikinsel unter einer schweren Energiekrise.,https://img.diepresse.com/public/incoming/lqwwti-cuba-us-sanctions-energy/alternates/WEBP_WIDE_1200/CUBA-US-SANCTIONS-ENERGY,2026-07-11T08:33:25Z,,"Die Presse auf Google als bevorzugte Nachrichtenquelle hinzufügen.
 Zum zweiten Mal innerhalb von nur vier Tagen ist es auf Kuba zu einem inselweiten Blackout gekommen. Wie das Energieministerium mi… [+1203 chars]",,de,'Blackout'
https://orf.at/stories/3435919/,https://orf.at/stories/3435919/,0,orf.at,Zweiter inselweiter Blackout auf Kuba in einer Woche,,https://orf.at/mojo/1_4_1/storyserver//news/common/images/og-fallback-news.png,2026-07-11T09:25:20Z,,"Zum zweiten Mal innerhalb von nur vier Tagen ist es heute auf Kuba zu einem inselweiten Blackout gekommen. Wie das Energieministerium mitteilte, wurden die Notfallprotokolle zur Wiederherstellung der… [+633 chars]",,de,'Blackout'
https://stadt-bremerhaven.de/eu-studie-social-media-drueckt-bei-jugendlichen-auf-die-stimmung/,https://stadt-bremerhaven.de/eu-studie-social-media-drueckt-bei-jugendlichen-auf-die-stimmung/,0,stadt-bremerhaven.de,EU-Studie: Social Media drückt bei Jugendlichen auf die Stimmung,"In Brüssel kam die Sondergruppe für Kindersicherheit im Internet neulich zusammen. Die Experten bereiten nun einen Bericht für EU-Präsidentin Ursula von der Leyen vor, der Mitte Juli übergeben wird. Ziel ist eine Verschärfung der Regeln, um Minderjährige im N…",https://stadt-bremerhaven.de/wp-content/uploads/2025/07/Social-Media-Kid.jpg,2026-07-11T13:30:22Z,,"In Brüssel kam die Sondergruppe für Kindersicherheit im Internet neulich zusammen. Die Experten bereiten nun einen Bericht für EU-Präsidentin Ursula von der Leyen vor, der Mitte Juli übergeben wird.… [+2106 chars]",,de,'Kinder'
https://www.zeit.de/news/2026-07/11/hsv-spass-fuer-kinder-statt-hartes-training,https://www.zeit.de/news/2026-07/11/hsv-spass-fuer-kinder-statt-hartes-training,0,www.zeit.de,Fußball-Bundesliga: HSV: Spaß für Kinder statt hartes Training,Hier finden Sie Informationen zu dem Thema „Fußball-Bundesliga“. Lesen Sie jetzt „HSV: Spaß für Kinder statt hartes Training“.,https://img.zeit.de/news/2026-07/11/hsv-spass-fuer-kinder-statt-hartes-training-image-group/wide__1300x731,2026-07-11T14:20:12Z,,Das erste Trainingslager des Hamburger SV in der Vorbereitung auf die neue Saison in der Fußball-Bundesliga endete ungewöhnlich. Statt eine letzte Übungseinheit vor der Abreise aus dem dänischen Hels… [+1272 chars],,de,'Kinder'
