index,url,valid,domain,title,description,image,published,archive,content,quote,language,keyword
https://www.nzz.ch/feuilleton/rassentrennung-ein-londoner-theater-will-abende-ohne-weisse-besucher-ld.1820207,https://www.nzz.ch/feuilleton/rassentrennung-ein-londoner-theater-will-abende-ohne-weisse-besucher-ld.1820207,0,www.nzz.ch,"Rassentrennung im Theater: Eine Londoner Bühne plant «Black Out Nights», bei denen Weisse nicht willkommen sind. Premierminister Rishi Sunak kritisiert das als besorgniserregend",Bei zwei Vorstellungen von Jeremy O. Harris' Stück «Slave Play» in London müssen weisse Besucher draussen bleiben. Schwarze Gäste sollen die Aufführung frei vom «weissen Blick» erfahren.,"https://img.nzz.ch/2024/03/01/17880b1c-50a7-4950-8933-834a1c1af4fe.jpeg?width=1200&height=675&fit=bound&quality=75&auto=webp&crop=6864,3861,x0,y52&wmark=nzz",2024-03-01T16:55:31Z,,"Nur für People of Colour: Jeremy O. Harris Theaterstück «Slave Play» handelt von gemischtrassigen Paaren, die Phantasien aus der Sklavenzeit ausleben.
Das Noël Coward Theatre ist eines dieser alten,… [+4008 chars]",,de,'Black Out'
https://www.bild.de/sport/fussball/fussball/0-1-pleite-in-halle-zwei-ex-dresdner-schiessen-dynamo-ab-87372836.bild.html,https://www.bild.de/sport/fussball/fussball/0-1-pleite-in-halle-zwei-ex-dresdner-schiessen-dynamo-ab-87372836.bild.html,0,www.bild.de,0:1-Pleite beim Halleschen FC - Zwei Ex-Dresdner schießen Dynamo ab,Nächster Blackout für Drittligist Dynamo Dresden im Kampf um den Zweitliga-Aufstieg: Im Derby beim Halleschen FC gab´s nach schwachem Auftritt eine verdiente 0:1-Pleite.Foto: Getty Images for DFB,"https://images.bild.de/65e321aea8331c4d5cf4e0d9/95cd1095e5e7f6d3191d193c9966dac8,a25acdf8?w=1280",2024-03-02T14:57:32Z,,"Nächster Blackout für Drittligist Dynamo Dresden im Kampf um den Zweitliga-Aufstieg: Im Derby beim Halleschen FC gab´s nach schwachem Auftritt eine verdiente 0:1-Pleite.
Bei den personell gebeutelte… [+2665 chars]",,de,'Blackout'
https://www.diepresse.com/18232778/warum-schmerzen-bei-einem-wetterwechsel-die-gelenke,https://www.diepresse.com/18232778/warum-schmerzen-bei-einem-wetterwechsel-die-gelenke,0,www.diepresse.com,Warum schmerzen bei einem Wetterwechsel die Gelenke?,"Kälte nimmt der Gelenkflüssigkeit ihre Funktion als „Stoßdämpfer“. Muskeln, Sehnen und Gelenke verspannen und verfestigen sich.",https://img.diepresse.com/public/incoming/2kx2mm-imago-images-0298888787/alternates/DPR_SOCIAL_NACHRICHTEN/imago%20images%200298888787,2024-03-02T15:45:00Z,,"Kälte nimmt der Gelenkflüssigkeit ihre Funktion als Stoßdämpfer. Muskeln, Sehnen und Gelenke verspannen und verfestigen sich.
Wenn sich der ausklingende Winter anfühlt wie früher der April, nehmen d… [+3207 chars]",,de,'Kälte'
https://kaernten.orf.at/stories/3247258/,https://kaernten.orf.at/stories/3247258/,0,kaernten.orf.at,Vorzeitiges Ende der Wintersaison,"Das Skigebiet Dreiländereck steht wie berichtet vor der Insolvenz. Zu wenig Schnee und das milde Wetter sorgen auch in anderen kleinen Skigebieten für Probleme. Im Bodental sind die Lifte wegen Schneemangels schon seit zwei Wochen außer Betrieb, die Simonhöhe…",https://ibs.orf.at/ktn?image=https%3A%2F%2Foekastatic.orf.at%2Fmims%2F2024%2F09%2F99%2Fcrops%2Fw%3D1200%2Ch%3D627%2Cq%3D75%2F2126218_master_804299_a5_probleme_fuer_kleine_schigebiete_00_01_15_04.jpg%3Fs%3D136af8bf700ffcbb0e61536fb6d837474ef3996b,2024-03-02T16:02:35Z,,Das Bodental im Winter. Im kleinen Skigebiet in den Karawanken haben Generationen von Mädchen und Buben das Skifahren erlernt. Auch heuer hätte Walter Mamedof mit seinem Team bis 17. März noch etlich… [+2137 chars],,de,'Winter'
https://www.diepresse.com/18236479/der-winter-war-zu-kurz-was-die-gartenprofis-nun-empfehlen,https://www.diepresse.com/18236479/der-winter-war-zu-kurz-was-die-gartenprofis-nun-empfehlen,0,www.diepresse.com,Der Winter war zu kurz: Was die Gartenprofis nun empfehlen [premium],"Wenn die Forsythien blühen, gehören die Rosen geschnitten, auch wenn es gerade einmal Anfang März und bis zur gesichert frostfreien Zeit noch sehr lang hin ist.",https://img.diepresse.com/public/incoming/15igw6-kein-Titel/alternates/DPR_SOCIAL_MAGAZIN_PAID/%28kein%20Titel%29,2024-03-02T18:26:53Z,,"Wenn die Forsythien blühen, gehören die Rosen geschnitten, auch wenn es gerade einmal Anfang März und bis zur gesichert frostfreien Zeit noch sehr lang hin ist.
Der Winter war zu kurz, finden die Hü… [+1009 chars]",,de,'Winter'
https://www.sueddeutsche.de/sport/darmstadt-augsburg-0-6-bundesliga-1.6415250,https://www.sueddeutsche.de/sport/darmstadt-augsburg-0-6-bundesliga-1.6415250,0,www.sueddeutsche.de,"Darmstadts 0:6: ""Fehler hier, Fehler dort, Blackout hier und da""","Darmstadt 98 erlebt gegen Augsburg ein Fiasko. Nach 29 Minuten steht es bereits 0:5, das 0:6 sehen viele der bereits abgewanderten Fans nicht mehr. Der Präsident sagt: ""Das war heute katastrophal.""",https://www.sueddeutsche.de/image/sz.1.6415251/1200x675?v=1709405274,2024-03-02T19:30:33Z,,"Es passiert in der Bundesliga nicht oft, dass die ersten Zuschauer Mitte der ersten Halbzeit das Stadion verlassen - am Darmstädter Böllenfalltor war es am Samstag so. Und man konnte es ihnen keinesf… [+3866 chars]",,de,'Blackout'
https://www.n-tv.de/politik/20-58-Zwei-Kinder-unter-den-Toten-nach-russischem-Angriff-auf-Wohnhaus-in-Odessa--article24778254.html,https://www.n-tv.de/politik/20-58-Zwei-Kinder-unter-den-Toten-nach-russischem-Angriff-auf-Wohnhaus-in-Odessa--article24778254.html,0,www.n-tv.de,Ukraine-Krieg im Liveticker: +++ 20:58 Zwei Kinder unter den Toten nach russischem Angriff auf Wohnhaus in Odessa +++,Lesen Sie alle aktuellen Entwicklungen und Nachrichten über den russischen Angriffskrieg auf die Ukraine im Liveticker von ntv.de.,https://bilder2.n-tv.de/img/incoming/crop23332537/9041326157-cImg_16_9-w1200/Liveticker1-grau-1-Kopie.jpg,2024-03-02T23:35:28Z,,Die Zahl der Toten bei einem russischen Drohnenangriff auf ein Wohnhaus in der Hafenstadt Odessa ist auf acht gestiegen. Unter den Todesopfern sind auch zwei Kinder. Das teilte der ukrainische staatl… [+33781 chars],,de,'Kinder'
https://www.faz.net/aktuell/sport/wintersport/olympische-winter-spiele-und-nachhaltigkeit-lift-ins-nirgendwo-19557326.html,https://www.faz.net/aktuell/sport/wintersport/olympische-winter-spiele-und-nachhaltigkeit-lift-ins-nirgendwo-19557326.html,0,www.faz.net,Geisterdörfer als Olympiaerbe: Lift ins Nirgendwo,Geisterdörfer als Olympiaerbe? Das war gestern. Bei den Winterspielen 2026 in Norditalien soll alles viel nachhaltiger werden. Wer's glaubt.,https://media0.faz.net/ppmedia/aktuell/sport/2732076995/1.9557590/facebook_teaser/reise-in-die-vergangenheit-der.jpg,2024-03-03T07:12:16Z,,"Kennen Sie den? Sitzen ein Ski-Weltmeister und eine Alpenschützerin im Sessellift und fahren nirgendwo hin. Ach, kennen Sie schon. Klar, kam im Fernsehen diese Woche. Felix Neureuther auf den Spuren … [+1127 chars]",,de,'Winter'
https://nachbelichtet.com/die-pv-saison-2024-hat-begonnen-unsere-pv-ertraege-im-januar-und-februar,https://nachbelichtet.com/die-pv-saison-2024-hat-begonnen-unsere-pv-ertraege-im-januar-und-februar,0,nachbelichtet.com,Die PV-Saison 2024 hat begonnen – Unsere PV-Erträge im Januar und Februar,"Die Erträge einer Photovoltaikanlage sind im Winter naturgemäß gering. Nun startet die PV-Saison wieder und das sind unsere Erträge im Januar und Februar 2024.
Quelle",https://nachbelichtet.com/wp-content/uploads/2024/03/pv-ertrag-jan-feb24-nachbelichtet.jpg,2024-03-03T07:31:14Z,,"Ab diesem Jahr möchte ich euch regelmäßig einen Einblick in die Erträge unserer PV-Anlage geben. Ich zeige euch, welche Leistung unsere Anlage jeden Monat produziert, was wir verbrauchen, wie groß de… [+3630 chars]",,de,'Winter'
