index,url,valid,domain,title,description,image,published,archive,content,quote,language,keyword
https://www.sueddeutsche.de/projekte/artikel/wirtschaft/generation-z-arbeitszeit-iab-e919900/,https://www.sueddeutsche.de/projekte/artikel/wirtschaft/generation-z-arbeitszeit-iab-e919900/,0,www.sueddeutsche.de,Arbeitszeit: Ist die Gen Z wirklich faul?,"Die jungen Menschen haben keinen Bock auf Arbeit, heißt es oft. Doch stimmt das? Eine Datenauswertung zeigt, ob ältere Generationen tatsächlich fleißiger waren.","https://www.sueddeutsche.de/projekte/artikel/wirtschaft/generation-z-arbeitszeit-iab-e919900/be61b5095ec5a0495065b8bc9c56b34d8d8db206db4ca1627b09d143c67be6c3_w2400_h1256_r146,0,2880,1507_oszplus_q70.jpg",2024-02-01T02:00:00Z,,"Wenn junge Menschen von ""Work-Life-Balance"" reden, also von einem Gleichgewicht aus Berufs- und Privatleben, dann soll der „Work“-Anteil so klein wie möglich sein.",,de,'ältere Menschen'
https://www.zeit.de/news/2024-02/01/zahl-der-unfaelle-steigt-leicht-mehr-verunglueckte-kinder,https://www.zeit.de/news/2024-02/01/zahl-der-unfaelle-steigt-leicht-mehr-verunglueckte-kinder,0,www.zeit.de,Verkehr: Zahl der Unfälle steigt leicht - Mehr verunglückte Kinder,Hier finden Sie Informationen zu dem Thema „Verkehr“. Lesen Sie jetzt „Zahl der Unfälle steigt leicht - Mehr verunglückte Kinder“.,https://img.zeit.de/news/2024-02/01/zahl-der-unfaelle-steigt-leicht-mehr-verunglueckte-kinder-image-group/wide__1300x731,2024-02-01T04:45:13Z,,"Die Zahl der Verkehrsunfälle in Hamburg ist im vergangenen Jahr leicht gestiegen. Das geht aus der Senatsantwort auf eine schriftliche Kleine Anfrage der CDU in der Bürgerschaft hervor, die allerding… [+3507 chars]",,de,'Kinder'
https://www.zeit.de/news/2024-02/02/deutsche-kleinkinder-mehr-breitbandantibiotika-als-daenische,https://www.zeit.de/news/2024-02/02/deutsche-kleinkinder-mehr-breitbandantibiotika-als-daenische,0,www.zeit.de,Kinder: Deutsche Kleinkinder: Mehr Breitbandantibiotika als dänische,Hier finden Sie Informationen zu dem Thema „Kinder“. Lesen Sie jetzt „Deutsche Kleinkinder: Mehr Breitbandantibiotika als dänische“.,https://img.zeit.de/news/2024-02/02/deutsche-kleinkinder-mehr-breitbandantibiotika-als-daenische-image-group/wide__1300x731,2024-02-02T06:18:56Z,,"Rund 40 Prozent der Kleinkinder in Deutschland werden mit Breitbandantibiotika behandelt, wenn sie zum ersten Mal ambulante Antibiotika erhalten. Im Vergleich dazu beträgt dieser Anteil in Dänemark n… [+4813 chars]",,de,'Kinder'
https://www.focus.de/finanzen/news/anhaltend-hoehere-gaspreise-biden-dreht-ploetzlich-den-gashahn-zu-was-das-fuer-deutschland-bedeutet_id_259632935.html,https://www.focus.de/finanzen/news/anhaltend-hoehere-gaspreise-biden-dreht-ploetzlich-den-gashahn-zu-was-das-fuer-deutschland-bedeutet_id_259632935.html,0,www.focus.de,"„Anhaltend höhere Gaspreise"" - Biden dreht plötzlich den Gashahn zu – was das für Deutschland bedeutet",Die USA haben neue Exporte von Flüssiggas (LNG) vorerst auf Eis gelegt. Deutschland setzt stark auf die LNG-Lieferungen aus den Staaten. Das Wirtschaftsministerium beobachte „die Lage genau“. Auf Verbraucher und Unternehmen könnten höhere Gaspreise zukommen.V…,https://p6.focus.de/img/regional/niedersachsen/id_259510842/das-mit-verfluessigtem-erdgas-beladene-tankschiff-maria-energy-hinten-liegt-am-schwimmenden-lng-terminal..jpg?im=Crop%3D%280%2C170%2C2048%2C1024%29%3BResize%3D%281200%2C627%29&impolicy=perceptual&quality=mediumHigh&hash=bd969c4f85b2f8906de8c258f5046a880cd2fb84cf9555ac1c24d40f17f37633,2024-02-02T14:41:12Z,,Die USA haben geplante Exportegenehmigungen von Flüssiggas (LNG) vorerst auf Eis gelegt. Deutschland setzt stark auf die LNG-Lieferungen aus den Staaten. Das Wirtschaftsministerium beobachte die Lage… [+5571 chars],,de,'Energiekosten'
https://www.welt.de/wirtschaft/article249892570/Gastronomie-Das-steckt-hinter-den-kraeftigen-Preiserhoehungen.html,https://www.welt.de/wirtschaft/article249892570/Gastronomie-Das-steckt-hinter-den-kraeftigen-Preiserhoehungen.html,0,www.welt.de,Restaurants erhöhen ihre Preise deutlich – nicht nur für Essen,Restaurants und Gasthöfe haben im Januar die Erhöhung der Mehrwertsteuer auf Speisen zum größten Teil weitergegeben. Gleichzeitig sind auch Getränke spürbar teurer geworden – obwohl die Steuer hier unverändert geblieben ist. Die Erklärung dafür überrascht.,https://img.welt.de/img/wirtschaft/mobile249892572/7941357207-ci16x9-w1200/Chef-Preparing-Food-For-Customers.jpg,2024-02-03T01:01:33Z,,"Die Gastronomie hat im Januar die Preise merklich erhöht. Fürs Essen verlangen die Restaurants in Deutschland im Durchschnitt fast zehn Prozent mehr, zeigt eine aktuelle Auswertung des Datenanbieters… [+4055 chars]",,de,'Gas'
https://www.zeit.de/news/2024-02/03/mehrwertsteuersenkung-bei-gas-koennte-ende-maerz-auslaufen,https://www.zeit.de/news/2024-02/03/mehrwertsteuersenkung-bei-gas-koennte-ende-maerz-auslaufen,0,www.zeit.de,Energie: Mehrwertsteuersenkung bei Gas könnte Ende März auslaufen,Hier finden Sie Informationen zu dem Thema „Energie“. Lesen Sie jetzt „Mehrwertsteuersenkung bei Gas könnte Ende März auslaufen“.,https://img.zeit.de/news/2024-02/03/mehrwertsteuersenkung-bei-gas-koennte-ende-maerz-auslaufen-image-group/wide__1300x731,2024-02-03T04:46:33Z,,"Verbraucher können darauf hoffen, dass die Mehrwertsteuersenkung bei Gas doch erst Ende März ausläuft - und nicht Ende Februar. Aus der SPD kamen vor dem Hintergrund von Verhandlungen zwischen Bundes… [+5049 chars]",,de,'Gas'
https://www.nzz.ch/branded-content/sponsored-content/wenn-die-sattelschlepper-ins-autofreie-dorf-einfahren-ld.1775687,https://www.nzz.ch/branded-content/sponsored-content/wenn-die-sattelschlepper-ins-autofreie-dorf-einfahren-ld.1775687,0,www.nzz.ch,SPONSORED CONTENT - Wenn die Sattelschlepper ins autofreie Dorf einfahren,"Jedes Festival – egal, wo auf der Welt es stattfindet – bringt seine Herausforderungen mit sich. Schneefall zum Beispiel kann in Zermatt auch Bauchweh verursachen – zumindest bei den Veranstaltern des Zermatt Unplugged.","https://img.nzz.ch/2024/01/24/030388fd-d340-4abf-b202-487c2be6cce4.jpeg?width=1200&height=675&fit=bound&quality=75&auto=webp&crop=1500,844,x0,y156&wmark=nzz",2024-02-03T23:05:00Z,,"Das Festivalzelt mit der Hauptbühne des Zermatt Unplugged ist das grösste Rundzelt der Schweiz: 2351 Zuschauer haben darin Platz.
Dieser Inhalt wurde von NZZ Content Creation im Auftrag von Zermatt … [+8902 chars]",,de,'Schnee'
https://www.zeit.de/politik/2024-02/wassernotstand-katalonien-duerre-spanien-nachrichtenpodcast,https://www.zeit.de/politik/2024-02/wassernotstand-katalonien-duerre-spanien-nachrichtenpodcast,0,www.zeit.de,Wassernotstand in Katalonien: Hitze und Dürre mitten im spanischen Winter,Wegen anhaltender Wasserknappheit hat die katalanische Regierung den Notstand ausgerufen. Und: Wie steht es um den Geisel-Deal zwischen Israel und der Hamas?,https://img.zeit.de/politik/2017-09/illu-podcast-news/wide__8ed8a6__1300x731,2024-02-04T04:55:11Z,,Wegen anhaltender Wasserknappheit in Katalonien hat die spanische Regionalregierung den Notstand ausgerufen. Rund sechs Millionen Menschen sind seit Freitag von den Einschränkungen beim Wasserverbrau… [+2618 chars],,de,'Winter'
https://www.stern.de/gesellschaft/regional/mecklenburg-vorpommern/gas--spezialschiff-fuer-ruegener-lng-terminal-unterwegs-34427204.html,https://www.stern.de/gesellschaft/regional/mecklenburg-vorpommern/gas--spezialschiff-fuer-ruegener-lng-terminal-unterwegs-34427204.html,0,www.stern.de,Gas: Spezialschiff für Rügener LNG-Terminal unterwegs,Noch in diesem Winter soll das Rügener LNG-Terminal bereit sein. Kern der Anlage sollen zwei Spezialschiffe sein. Eines davon kam jüngst in Europa an. Direkt nach Mukran geht es aber nicht.,https://image.stern.de/6681672/t/31/v5/w1440/r1.7778/-/video-fallback-image.jpg,2024-02-04T07:31:45Z,,"Noch in diesem Winter soll das Rügener LNG-Terminal bereit sein. Kern der Anlage sollen zwei Spezialschiffe sein. Eines davon kam jüngst in Europa an. Direkt nach Mukran geht es aber nicht.
Ein für … [+2639 chars]",,de,'Gas'
https://www.transfermarkt.de/top-elf-der-wintertransfers-mit-boey-amp-elmas-premier-league-kaufte-nur-4-der-30-teuersten/view/news/433418,https://www.transfermarkt.de/top-elf-der-wintertransfers-mit-boey-amp-elmas-premier-league-kaufte-nur-4-der-30-teuersten/view/news/433418,0,www.transfermarkt.de,Top-Elf der teuersten Wintertransfers mit Boey vom FC Bayern – England spart,"Wenn nur vier der weltweit 30 teuersten Wintertransfers von Premier-League-Vereinen getätigt wurden, dann war es keine normale Transferperiode. 2023 waren Englands Top-Klubs noch für 26...",https://tmssl.akamaized.net/images/foto/big/sacha-boey-fc-bayern-2024-1706888492-128375.jpg?lm=1706888521,2024-02-04T08:20:04Z,,"Kostspieligste Wechsel der Welt 
Wenn nur vier der weltweit 30 teuersten Wintertransfers von Premier-League-Vereinen getätigt wurden, dann war es keine normale Transferperiode. 2023 waren Englands T… [+5836 chars]",,de,'Winter'
https://www.tagesspiegel.de/berlin/naturschutz-contra-verkehrssicherheit-streit-um-winterdienst-auf-berlins-radwegen-11147035.html,https://www.tagesspiegel.de/berlin/naturschutz-contra-verkehrssicherheit-streit-um-winterdienst-auf-berlins-radwegen-11147035.html,0,www.tagesspiegel.de,Naturschutz contra Verkehrssicherheit: Streit um Winterdienst auf Berlins Radwegen,"Wenn es geschneit hat, bleiben Radwege oft glatt. Laut BSR hilft nur Salz, aber das ist verboten. Der Senat kündigt ein Konzept für Verbesserungen an.",https://www.tagesspiegel.de/images/schlecht-geraumter-berliner-radwegen-mit-schnee/alternates/BASE_16_9_W1400/schlecht-geraeumter-berliner-radwegen-mit-schnee.jpeg,2024-02-04T09:16:28Z,,"Auf eines ist Verlass im Berliner Winter: Wenn Schnee fällt, hält er sich auf vielen Radwegen besonders gut. Während Hauptstraßen zügig geräumt und aufgetaut werden, bleiben Radwege glatt. Darüber, w… [+89 chars]",,de,'Winter'
https://www.telepolis.de/features/Russisches-Gas-Oesterreichs-heimliche-Liebe-in-Zeiten-des-Krieges-9618247.html,https://www.telepolis.de/features/Russisches-Gas-Oesterreichs-heimliche-Liebe-in-Zeiten-des-Krieges-9618247.html,0,www.telepolis.de,Russisches Gas: Österreichs heimliche Liebe in Zeiten des Krieges,"Trotz Sanktionen und Krieg: Österreichs Bindung an russisches Gas bleibt stark. Die Energiepolitik ist umstritten. Was wird, wenn die Verträge auslaufen?",https://heise.cloudimg.io/bound/1200x1200/q85.png-lossy-85.webp-lossy-85.foil1/_www-heise-de_/imgs/18/4/5/3/6/9/5/9/Denys_Shmyhal_met_with_Austrian_Chancellor_Nehammer_in_Kyiv_20220409__8_-139db1b7177d0b2a.jpeg,2024-02-05T08:00:00Z,,"Österreichs Kanzler Karl Nehammer (2. v. l.) auf einer Pressekonferenz im April 2022 in Kiew. Archivbild: Cabinet of Ministers of Ukraine / CC BY 4.0
Trotz Sanktionen und Krieg: Österreichs Bindung … [+5319 chars]",,de,'Gas'
https://www.zeit.de/wirtschaft/2024-02/bundesregierung-gaskraftwerke-wasserstoff-strategie,https://www.zeit.de/wirtschaft/2024-02/bundesregierung-gaskraftwerke-wasserstoff-strategie,0,www.zeit.de,Erdgas und Wasserstoff: Bundesregierung einigt sich auf Strategie zum Bau neuer Kraftwerke,Mit Gas sollen sie starten und später auf Wasserstoff umgestellt werden: Die Ampelregierung hat nach langem Ringen einen Kompromiss zum Bau neuer Kraftwerke gefunden.,https://img.zeit.de/wirtschaft/2024-02/bundesregierung-gaskraftwerke-wasserstoff-strategie-bild/wide__1300x731,2024-02-05T10:09:26Z,,"Bundeskanzler Olaf Scholz (SPD), Bundeswirtschaftsminister Robert Habeck 
(Grüne) und Bundesfinanzminister Christian Lindner (FDP) haben sich auf eine Strategie zum Bau neuer wasserstofffähiger Gask… [+1664 chars]",,de,'Gas'
https://www.tagesschau.de/inland/kraftwerksstrategie-regierung-100.html,https://www.tagesschau.de/inland/kraftwerksstrategie-regierung-100.html,0,www.tagesschau.de,Bundesregierung einigt sich auf Kraftwerksstrategie,"Es war ein langes Ringen in der Ampelkoalition, nun steht ein Plan: Die Bundesregierung hat sich auf eine Strategie zum Bau neuer wasserstofffähiger Gaskraftwerke in Deutschland geeinigt.",https://images.tagesschau.de/image/e33def5a-94ac-4579-a7a3-1458b83105d0/AAABjXjrYbE/AAABibBxqrQ/16x9-1280/habeck-lindner-scholz-106.jpg,2024-02-05T10:27:00Z,,"Stand: 05.02.2024 11:27 Uhr
Es war ein langes Ringen in der Ampelkoalition, nun steht ein Plan: Die Bundesregierung hat sich auf eine Strategie zum Bau neuer wasserstofffähiger Gaskraftwerke in Deut… [+2281 chars]",,de,'Gas'
https://www.stern.de/gesellschaft/buergergeld--alleinerziehende-mutter-verzichtet-darauf---aus-stolz-34399456.html,https://www.stern.de/gesellschaft/buergergeld--alleinerziehende-mutter-verzichtet-darauf---aus-stolz-34399456.html,0,www.stern.de,"Bürgergeld: Alleinerziehende Mutter verzichtet aus Stolz auf Bürgergeld: ""Arbeit lohnt sich immer""","Die Leipzigerin Madelaine Böckler arbeitet 35 Stunden in der Woche und zieht allein drei Kinder groß. Das Kindergeld reicht ihr nicht, aber auf Bürgergeld verzichtet sie. Warum?",https://image.stern.de/34401938/t/7_/v2/w1440/r1.7778/-/madelaine-kinderarmut.jpg,2024-02-05T15:29:00Z,,"Frau Böckler, wann begann Ihr Tag heute? Um fünf klingelte mein Wecker, so wie jeden Werktag, um 6.50 Uhr bin ich zur Arbeit gefahren, davor habe ich die Kinder geweckt. Ich arbeite 35 Stunden pro Wo… [+1113 chars]",,de,'Kinder'
https://www.nzz.ch/schweiz/trotz-shaqiri-offensive-warum-es-bei-den-ski-profis-keine-kinder-von-migranten-gibt-ld.1777466,https://www.nzz.ch/schweiz/trotz-shaqiri-offensive-warum-es-bei-den-ski-profis-keine-kinder-von-migranten-gibt-ld.1777466,0,www.nzz.ch,Trotz Shaqiri-Offensive: Warum es bei den Ski-Profis keine Kinder von Migranten gibt,"Die Skipisten sind voll – mit Schweizer Familien und wohlsituierten ausländischen Touristen. Secondos fehlen. Aus ökonomischer Sicht sind sie ein nicht zustande gekommenes Geschäft. Einer der Ersten, die dies erkannt haben, war der damalige Aroser Tourismusdi…","https://img.nzz.ch/2024/01/23/007932f9-6eb8-48fb-9d2a-c1777ec2af72.jpeg?width=768&height=432&fit=bound&quality=75&auto=webp&crop=768,432,x0,y8",2024-02-05T16:00:00Z,,"Skifahren darf er aus vertraglichen Gründen nicht: Xherdan Shaqiri beim Schlitteln.
Slaven Dujakovic. So heisst ein ehemals hoffnungsvolles Talent des Österreichischen Skiverbandes. Längst hat der S… [+11879 chars]",,de,'Kinder'
https://www.focus.de/finanzen/boerse/hoerspielbox-fuer-kinder-tonies-bald-in-australien-und-neuseeland-umsatz-uebertrifft-prognose_id_259641676.html,https://www.focus.de/finanzen/boerse/hoerspielbox-fuer-kinder-tonies-bald-in-australien-und-neuseeland-umsatz-uebertrifft-prognose_id_259641676.html,0,www.focus.de,Hörspielbox für Kinder - Tonies bald in Australien und Neuseeland – Umsatz übertrifft Prognose,Die Hörspielboxen von Tonies gibt es bald auch Australien und Neuseeland. Zudem kann das Unternehmen steigende Umsatzzahlen vorzeigen – und übertrifft sogar die Prognose.,https://p6.focus.de/img/fotos/id_259641835/imago0152119504h.jpg?im=Crop%3D%280%2C408%2C3265%2C1632%29%3BResize%3D%281200%2C627%29&impolicy=perceptual&quality=mediumHigh&hash=1beb2791f5d3d87c9339734e6b799b835a51055d5214c94fef69fe446d430f39,2024-02-05T16:06:37Z,,"Die Hörspielboxen von Tonies gibt es bald auch Australien und Neuseeland. Zudem kann das Unternehmen steigende Umsatzzahlen vorzeigen und übertrifft sogar die Prognose.Das Unternehmen Tonies, Herstel… [+1558 chars]",,de,'Kinder'
https://www.focus.de/kaufberatung/deals_angebote/jako-o-schliesst-die-pforten-grosser-goodbye-sale-bei-bekanntem-baby-und-kinderausstatter-mit-40-prozent-rabatt_id_259641851.html,https://www.focus.de/kaufberatung/deals_angebote/jako-o-schliesst-die-pforten-grosser-goodbye-sale-bei-bekanntem-baby-und-kinderausstatter-mit-40-prozent-rabatt_id_259641851.html,0,www.focus.de,JAKO-O schließt die Pforten - Großer Goodbye SALE! bei bekanntem Baby- und Kinderausstatter mit 40 Prozent Rabatt,"JAKO-O läutet mit seinem Goodbye SALE! die letzte Verkaufsphase ein. Bevor der Online-Shop am 29. Februar 2024 seine Pforten schließt, räumt JAKO-O seine Lagerbestände mit beeindruckenden Nachlässen von 40 Prozent auf eine Auswahl an Produkten. Schnell sein l…",https://p6.focus.de/img/fotos/id_259641856/jako-o-sale.png?im=Crop%3D%2815%2C23%2C1115%2C558%29%3BResize%3D%281200%2C627%29&impolicy=perceptual&quality=mediumHigh&hash=4cb8e826b995f87200b02d5021e5219ccdeb8fd65a5de9999c2ea1223178d603,2024-02-05T16:10:20Z,,"<ul><li>
Kommentare</li><li>
E-Mail</li><li>
Teilen</li><li>
Mehr</li><li>
Twitter</li><li>
Drucken</li><li>
Feedback</li><li>
Fehler meldenSie haben einen Fehler gefunden?
Bitte markieren S… [+2723 chars]",,de,'Kinder'
https://www.tagesspiegel.de/internationales/ukraine-invasion-tag-712-sorge-um-die-entfuhrten-ukrainischen-kinder-wachst-11164645.html,https://www.tagesspiegel.de/internationales/ukraine-invasion-tag-712-sorge-um-die-entfuhrten-ukrainischen-kinder-wachst-11164645.html,0,www.tagesspiegel.de,Ukraine-Invasion Tag 712: Sorge um die entführten ukrainischen Kinder wächst,Selenskyj erwägt Ablösung führender Vertreter von Staat und Militär. Polen bereitet sich laut Minister auf drohenden Krieg mit Russland vor. Der Nachrichtenüberlick am Abend.,https://www.tagesspiegel.de/images/ukraine-krieg-kiew98/alternates/BASE_16_9_W1400/ukraine-krieg---kiew.jpeg,2024-02-05T16:17:06Z,,Nach Schätzungen der ukrainischen Behörden wurden seit Kriegsbeginn etwa 20.000 Kinder nach Russland verschleppt. Aus diesem Grund hatte der Internationale Strafgerichtshof in Den Haag im März vergan… [+6753 chars],,de,'Kinder'
https://www.sueddeutsche.de/muenchen/muenchen-kita-foerderung-kommentar-1.6344396,https://www.sueddeutsche.de/muenchen/muenchen-kita-foerderung-kommentar-1.6344396,0,www.sueddeutsche.de,Kinderbetreuung: Echte Hilfe für Familien,"Das neue Fördersystem der Stadt wird nichts besser machen, im besten Fall wird es die Situation so, wie sie jetzt ist, sichern. Das ist wichtig.",https://www.sueddeutsche.de/image/sz.1.6344404/1200x675?v=1707150332,2024-02-05T16:25:40Z,,"5. Februar 2024, 17:25 Uhr
Begehrt: Plätze, an denen sich Kinder unter Aufsicht austoben können.
(Foto: Peter Kneffel/dpa)
Warum günstige Kita-Gebühren kein Geschenk sind und die Stadt alles tun s… [+690 chars]",,de,'Kinder'
https://www.zeit.de/news/2024-02/05/mit-gas-betriebener-lkw-verunglueckt-behinderungen-auf-a1,https://www.zeit.de/news/2024-02/05/mit-gas-betriebener-lkw-verunglueckt-behinderungen-auf-a1,0,www.zeit.de,Unfälle: Mit Gas betriebener Lkw verunglückt: Behinderungen auf A1,Hier finden Sie Informationen zu dem Thema „Unfälle“. Lesen Sie jetzt „Mit Gas betriebener Lkw verunglückt: Behinderungen auf A1“.,https://img.zeit.de/news/2024-02/05/mit-gas-betriebener-lkw-verunglueckt-behinderungen-auf-a1-image-group/wide__1300x731,2024-02-05T16:59:28Z,,Die Bergung eines auf der Autobahn 1 zwischen Posthausen und Oyten umgekippten Sattelzuges hat am Montagnachmittag zu erheblichen Behinderungen im Verkehr geführt. Der mit Gas betriebene Lkw lag schr… [+558 chars],,de,'Gas'
https://www.stern.de/gesellschaft/regional/niedersachsen-bremen/energieversorger--ewe-erhoeht-strom--und-gaspreise-34433604.html,https://www.stern.de/gesellschaft/regional/niedersachsen-bremen/energieversorger--ewe-erhoeht-strom--und-gaspreise-34433604.html,0,www.stern.de,Energieversorger: EWE erhöht Strom- und Gaspreise,"Der Oldenburger Versorger EWE erhöht die Strom- und Gaspreise. Zum 1. April hebe man für Kundinnen und Kunden in der Grundversorgung die Preise an, kündigte das Unternehmen am Dienstag an. Betroffen seien insgesamt 210.000 Strom- und 105.000 Gaskundinnen und …",https://image.stern.de/34433606/t/z0/v1/w1440/r1.7778/-/06--urnnewsmldpacom2009010124020699889457v3w800h600l640t289r1920b1142jpeg---e92ef36de7ecfbe1.jpg,2024-02-06T11:57:30Z,,"Der Oldenburger Versorger EWE erhöht die Strom- und Gaspreise. Zum 1. April hebe man für Kundinnen und Kunden in der Grundversorgung die Preise an, kündigte das Unternehmen am Dienstag an. Betroffen … [+2160 chars]",,de,'Gas'
https://www.zeit.de/news/2024-02/06/ewe-erhoeht-strom-und-gaspreise,https://www.zeit.de/news/2024-02/06/ewe-erhoeht-strom-und-gaspreise,0,www.zeit.de,Energieversorger: EWE erhöht Strom- und Gaspreise,Hier finden Sie Informationen zu dem Thema „Energieversorger“. Lesen Sie jetzt „EWE erhöht Strom- und Gaspreise“.,https://img.zeit.de/news/2024-02/06/ewe-erhoeht-strom-und-gaspreise-image-group/wide__1300x731,2024-02-06T11:57:30Z,,"Der Oldenburger Versorger EWE erhöht die Strom- und Gaspreise. Zum 1. April hebe man für Kundinnen und Kunden in der Grundversorgung die Preise an, kündigte das Unternehmen am Dienstag an. Betroffen … [+2193 chars]",,de,'Gas'
https://www.sueddeutsche.de/wirtschaft/kraftwerksstrategie-habeck-klimaschutz-gaskraftwerke-1.6344643,https://www.sueddeutsche.de/wirtschaft/kraftwerksstrategie-habeck-klimaschutz-gaskraftwerke-1.6344643,0,www.sueddeutsche.de,Kraftwerksstrategie: Für den Klimaschutz wenig gewonnen,"Immerhin, die Bundesregierung hat endlich einen Plan, wie die Sicherheitsreserve in einem Stromsystem ohne Kohle funktionieren soll. Aber die Ampel konzentriert sich zu einseitig auf Gas.",https://www.sueddeutsche.de/image/sz.1.5560364/1200x675?v=1707222817,2024-02-06T12:15:32Z,,"Immerhin, die Bundesregierung hat endlich einen Plan, wie das Stromsystem ohne Kohle funktionieren soll. Aber die Ampel konzentriert sich zu einseitig auf Gas. Die gute Nachricht vorweg: Es tut sich … [+494 chars]",,de,'Gas'
https://www.focus.de/immobilien/wohnen/ehepaar-heizt-mit-waermepumpe-versorger-verlangt-trotzdem-geld-fuers-gas_id_259644358.html,https://www.focus.de/immobilien/wohnen/ehepaar-heizt-mit-waermepumpe-versorger-verlangt-trotzdem-geld-fuers-gas_id_259644358.html,0,www.focus.de,Wochenlanger Streit - Ehepaar heizt mit Wärmepumpe – Versorger verlangt trotzdem Geld fürs Gas,"Ein Ehepaar aus Haselünne in Niedersachsen musste bei diesen Briefen mehrfach hinsehen: Denn obwohl es seit vergangenem Jahr mit einer Wärmepumpe heizt und der Gasanschluss stillgelegt ist, schickte der Versorger weiterhin Rechnungen für das Gas.",https://p6.focus.de/img/auto/elektroauto/news/id_259644356/rentnerpaar-wechselt-auf-waermepumpe-ewe-will-trotzdem-weiter-geld-fuers-gas.jpg?im=Crop%3D%280%2C45%2C1440%2C720%29%3BResize%3D%281200%2C627%29&impolicy=perceptual&quality=mediumHigh&hash=6ba94c131d6749156bce47e9f36f632422218111340d8bf42566040b08b5c3a7,2024-02-06T12:50:42Z,,"Ein Ehepaar aus Haselünne in Niedersachsen musste bei diesen Briefen mehrfach hinsehen: Denn obwohl es seit vergangenem Jahr mit einer Wärmepumpe heizt und der Gasanschluss stillgelegt ist, schickte … [+4524 chars]",,de,'Gas'
https://www.bild.de/regional/dresden/dresden-aktuell/er-toetete-eine-frau-todesschleuser-redet-sich-raus-87045500.bild.html,https://www.bild.de/regional/dresden/dresden-aktuell/er-toetete-eine-frau-todesschleuser-redet-sich-raus-87045500.bild.html,0,www.bild.de,Frau stirbt bei Unfall - Todes-Schleuser redet sich vor Gericht raus,"Dresden – Keine Reue kein Geständnis. Todesschleuser Gasan P. (23) fuhr eine Frau tot, verletzte sechs Menschen.","https://images.bild.de/65c0f18722c3637e12eea1a9/2c4bb821349fdb52f6d7dd8ade58923a,276d24ee?w=1280",2024-02-06T14:32:06Z,,"Dresden Keine Reue, kein Geständnis. Im Transporter von Schleuser Gasan P. (23) starb die Türkin Zöhre A. (44), als der Aserbaidschaner vor der Polizei flüchtete. Sechs Menschen wurden verletzt. Aber… [+1573 chars]",,de,'Gas'
https://www.zeit.de/news/2024-02/06/industriegase-konzern-linde-bleibt-auf-gewinnspur,https://www.zeit.de/news/2024-02/06/industriegase-konzern-linde-bleibt-auf-gewinnspur,0,www.zeit.de,Gas: Industriegase-Konzern Linde bleibt auf Gewinnspur,Hier finden Sie Informationen zu dem Thema „Gas“. Lesen Sie jetzt „Industriegase-Konzern Linde bleibt auf Gewinnspur“.,https://img.zeit.de/news/2024-02/06/industriegase-konzern-linde-bleibt-auf-gewinnspur-image-group/wide__1300x731,2024-02-06T14:44:07Z,,"Der Industriegase-Konzern Linde will nach einem Gewinnplus 2023 auch im laufenden Jahr mehr verdienen. Der um Sondereffekte bereinigte Gewinn je Aktie soll 2024 auf 15,25 bis 15,65 US-Dollar zulegen,… [+2352 chars]",,de,'Gas'
https://www.dw.com/de/was-ist-co2-abscheidung-und-speicherung-ccs/a-68154016,https://www.dw.com/de/was-ist-co2-abscheidung-und-speicherung-ccs/a-68154016,0,www.dw.com,Was ist CO2-Abscheidung und -speicherung (CCS)?,"Kohlendioxid, chemisch CO2, ist als Treibhausgas für den Klimawandel verantwortlich. Es kann aus der Atmosphäre entfernt und gelagert werden - aber das ist nicht billig. Wie funktioniert das Abscheiden von CO2 genau? Kohlendioxid (CO2) ist ein natürlicher und…",https://static.dw.com/image/68048978_6.jpg,2024-02-06T15:24:00Z,,"Kohlendioxid (CO2) ist ein natürlicher und wichtiger Bestandteil der Erdatmosphäre. Aber mit etwa 422 Teilen pro Million oder 0,04 Prozent
ist seine Konzentration heute mehr als doppelt so hoch wie … [+4932 chars]",,de,'Kohle'
https://www.zeit.de/news/2024-02/06/linke-schlaegt-heizkostenfonds-fuer-mieter-vor,https://www.zeit.de/news/2024-02/06/linke-schlaegt-heizkostenfonds-fuer-mieter-vor,0,www.zeit.de,Berlin: Linke schlägt Heizkostenfonds für Mieter vor,Hier finden Sie Informationen zu dem Thema „Berlin“. Lesen Sie jetzt „Linke schlägt Heizkostenfonds für Mieter vor“.,https://img.zeit.de/news/2024-02/06/linke-schlaegt-heizkostenfonds-fuer-mieter-vor-image-group/wide__1300x731,2024-02-06T15:26:35Z,,"Die Linksfraktion im Berliner Abgeordnetenhaus schlägt einen Fonds des Landes vor, um Haushalten mit sehr hohen Nachzahlungsforderungen für Warmwasser und Heizung zu helfen. Ein Heizkostenfonds könne… [+2485 chars]",,de,'Heizkosten'
