index,url,valid,domain,title,description,image,published,archive,content,quote,language,keyword
https://www.zeit.de/news/2025-01/08/bsh-warnt-vor-sturmflut-im-norden,https://www.zeit.de/news/2025-01/08/bsh-warnt-vor-sturmflut-im-norden,0,www.zeit.de,Hochwasser: BSH warnt vor Sturmflut im Norden,Hier finden Sie Informationen zu dem Thema „Hochwasser“. Lesen Sie jetzt „BSH warnt vor Sturmflut im Norden“.,https://img.zeit.de/news/2025-01/08/bsh-warnt-vor-sturmflut-im-norden-image-group/wide__1300x731,2025-01-08T03:18:20Z,,Das Bundesamt für Seeschifffahrt und Hydrographie (BSH) warnt vor einer Sturmflut an der Nordseeküste und an der Hamburger Elbe. Am Morgen werde an mehreren Pegeln der Elbe in Hamburg ein Pegelstand … [+910 chars],,de,'Hochwasser'
https://www.nzz.ch/meinung/die-renaissance-der-kernenergie-ld.1861744,https://www.nzz.ch/meinung/die-renaissance-der-kernenergie-ld.1861744,0,www.nzz.ch,GASTKOMMENTAR - Die Renaissance der Kernenergie,"Seit der Energiewende von 2011 wird die Kernkraft in der Schweiz oft als «Technologie von gestern» abgetan. Doch die globale Entwicklung erzählt eine andere Geschichte. Die Blackout-Initiative wird dem Volk die Möglichkeit geben, über die Kernenergie erneut a…","https://img.nzz.ch/2024/12/06/7b3e175c-f1ba-45fa-8633-eac9410864a0.jpeg?width=1200&height=675&fit=bounds&quality=75&auto=webp&crop=7680,4320,x0,y0&wmark=nzz",2025-01-08T04:30:00Z,http://archive.md/20250108115638/https://www.nzz.ch/meinung/die-renaissance-der-kernenergie-ld.1861744,"Die Axpo hat kürzlich angekündigt, Beznau 1 noch bis 2033 in Betrieb zu lassen.
Im Ausland, insbesondere in den USA, hat sich eine regelrechte Renaissance der Kernenergie entfaltet. Bereits letztes … [+5213 chars]",,de,'Blackout'
https://www.zeit.de/news/2025-01/08/winterliches-wetter-in-berlin-und-brandenburg,https://www.zeit.de/news/2025-01/08/winterliches-wetter-in-berlin-und-brandenburg,0,www.zeit.de,Wetter: Winterliches Wetter in Berlin und Brandenburg,Hier finden Sie Informationen zu dem Thema „Wetter“. Lesen Sie jetzt „Winterliches Wetter in Berlin und Brandenburg“.,https://img.zeit.de/news/2025-01/08/winterliches-wetter-in-berlin-und-brandenburg-image-group/wide__1300x731,2025-01-08T05:47:15Z,,"Der Mittwoch bringt wechselhaftes Wetter nach Berlin und Brandenburg. Am Vormittag sind noch kurze Schneeschauer möglich, ab Mittag zeigt sich zeitweise die Sonne, teilte der Deutsche Wetterdienst (D… [+1046 chars]",,de,'Winter'
https://www.stern.de/gesellschaft/regional/bayern/wetter--es-wird-waermer--aber-nicht-weniger-glatt-35362538.html,https://www.stern.de/gesellschaft/regional/bayern/wetter--es-wird-waermer--aber-nicht-weniger-glatt-35362538.html,0,www.stern.de,"Wetter: Es wird wärmer, aber nicht weniger glatt","Eine Warmfront zieht über Bayern. Tagsüber liegen die Temperaturen zwar meist über null Grad, Glättegefahr besteht bei Schnee und gefrierendem Regen aber trotzdem.",https://image.stern.de/35362540/t/hQ/v1/w1440/r1.7778/-/08--dh6w7bil7tv5axs2048jpeg---c40afef3d12ab98f.jpg,2025-01-08T06:39:29Z,,"Kopiere den aktuellen Link
Eine Warmfront zieht über Bayern. Tagsüber liegen die Temperaturen zwar meist über null Grad, Glättegefahr besteht bei Schnee und gefrierendem Regen aber trotzdem.
Trotz … [+2411 chars]",,de,'Glatteis'
https://www.zeit.de/news/2025-01/08/schnee-und-glaettegefahr-in-rheinland-pfalz-und-saarland,https://www.zeit.de/news/2025-01/08/schnee-und-glaettegefahr-in-rheinland-pfalz-und-saarland,0,www.zeit.de,Wetter: Schnee und Glättegefahr in Rheinland-Pfalz und Saarland,Hier finden Sie Informationen zu dem Thema „Wetter“. Lesen Sie jetzt „Schnee und Glättegefahr in Rheinland-Pfalz und Saarland“.,https://img.zeit.de/news/2025-01/08/schnee-und-glaettegefahr-in-rheinland-pfalz-und-saarland-image-group/wide__1300x731,2025-01-08T07:43:22Z,,"In Rheinland-Pfalz und dem Saarland kommt es in den nächsten Tagen zu Schneefällen und Glätte auf den Straßen. Wie der Deutsche Wetterdienst (DWD) mitteilte, weiten sich am Mittwoch von Süden her Sch… [+566 chars]",,de,'Schnee'
https://www.stern.de/gesellschaft/regional/hessen/wetter--weiterhin-glaette-in-hessen-erwartet-35362636.html,https://www.stern.de/gesellschaft/regional/hessen/wetter--weiterhin-glaette-in-hessen-erwartet-35362636.html,0,www.stern.de,Wetter: Weiterhin Glätte in Hessen erwartet,Offenbach/Main (lhe) - Die Menschen in Hessen müssen sich weiterhin auf Glatteis einstellen. Die Meteorologen des Deutschen Wetterdiensts (DWD) in,https://image.stern.de/35362638/t/y_/v1/w1440/r1.7778/-/08--uvuiful5wav3axs2048jpeg---9187c0c2659fb780.jpg,2025-01-08T07:55:01Z,,"Kopiere den aktuellen Link
Schnee und Regen sorgen in den kommenden Tagen für Glatteis auf den Straßen Hessens. Im Süden wird es teils windig.
Die Menschen in Hessen müssen sich weiterhin auf Glatt… [+1336 chars]",,de,'Glatteis'
https://www.zeit.de/news/2025-01/08/unfaelle-wegen-glatteis-in-nrw-polizei-warnt,https://www.zeit.de/news/2025-01/08/unfaelle-wegen-glatteis-in-nrw-polizei-warnt,0,www.zeit.de,Wetter: Unfälle wegen Glatteis in NRW - Polizei warnt,Hier finden Sie Informationen zu dem Thema „Wetter“. Lesen Sie jetzt „Unfälle wegen Glatteis in NRW - Polizei warnt“.,https://img.zeit.de/news/2025-01/08/unfaelle-wegen-glatteis-in-nrw-polizei-warnt-image-group/wide__1300x731,2025-01-08T08:21:45Z,,"Wegen Glatteis hat es in einigen Teilen von Nordrhein-Westfalen Verkehrsunfälle gegeben. In Köln verzeichnete die Polizei am Vormittag acht Unfälle. Ein Mann überschlug sich, als er mit einem E-Scoot… [+1955 chars]",,de,'Glatteis'
https://www.bild.de/regional/bayern/gefahr-von-glatteis-in-bayern-warmfront-bringt-neuschnee-und-regen-677e22677e327551e938de67,https://www.bild.de/regional/bayern/gefahr-von-glatteis-in-bayern-warmfront-bringt-neuschnee-und-regen-677e22677e327551e938de67,0,www.bild.de,"Wetter in Bayern - Es wird wärmer, bleibt aber glatt","Trotz einer Warmfront bleibt die Glatteis-Gefahr in Bayern bestehen, mit Neuschnee, Regen und Orkanböen auf der Zugspitze erwartet.","https://images.bild.de/677e22677e327551e938de67/2eab39b631ec2472756263e269335e49,944ef47e?w=1280",2025-01-08T09:01:01Z,,"München Wärme ja, aber keine Entwarnung auf der Straßen.
Trotz einer Warmfront müssen sich die Menschen in Bayern weiterhin auf Glatteis einstellen. Der Deutsche Wetterdienst (DWD) erwartet tagsüber… [+2037 chars]",,de,'Glatteis'
https://www.zeit.de/news/2025-01/08/glatteis-in-hessen-toedlicher-unfall-auf-a7,https://www.zeit.de/news/2025-01/08/glatteis-in-hessen-toedlicher-unfall-auf-a7,0,www.zeit.de,Wetter: Glatteis in Hessen - Tödlicher Unfall auf A7,Hier finden Sie Informationen zu dem Thema „Wetter“. Lesen Sie jetzt „Glatteis in Hessen - Tödlicher Unfall auf A7“.,https://img.zeit.de/news/2025-01/08/glatteis-in-hessen-toedlicher-unfall-auf-a7-image-group/wide__1300x731,2025-01-08T09:17:48Z,,"Auf winterglatter Fahrbahn hat es in Nord- und Mittelhessen mehrere Unfälle gegeben. Dabei kam ein Mensch ums Leben. Wie die Polizei mitteilte, ereignete sich der tödliche Unfall auf der A7 bei Felsb… [+1791 chars]",,de,'Glatteis'
https://www.focus.de/panorama/wetter-im-ticker-glatteis-in-weiten-teilen-deutschlands-toedlicher-unfall-auf-a7-polizei-warnt_id_54933749.html,https://www.focus.de/panorama/wetter-im-ticker-glatteis-in-weiten-teilen-deutschlands-toedlicher-unfall-auf-a7-polizei-warnt_id_54933749.html,0,www.focus.de,+++ Wetter im Ticker +++ - Glatteis in weiten Teilen Deutschlands: Tödlicher Unfall auf A7 - Polizei warnt,Auf glatten Straßen in Nord- und Mittelhessen ist es zu mehreren Unfällen gekommen. Ein Sprinterfahrer hat bei einem Zusammenstoß mit einem Lkw tödliche Verletzungen erlitten. Alle Wetter-Entwicklungen im Ticker.,https://p6.focus.de/img/regional/hessen/id_260609183/auf-schnee-und-eisglatten-strassen-ist-es-in-einigen-regionen-hessens-zu-unfaellen-gekommen.-meist-blieb-es-bei-blechschaeden..jpg?im=Crop%3D%280%2C170%2C2048%2C1024%29%3BResize%3D%281200%2C627%29&impolicy=perceptual&quality=mediumHigh&hash=e81e25988f4028063ad3e12d634899d73a0b3cec9d1deb6e02053ee57f2e9522,2025-01-08T09:49:09Z,,Auf glatten Straßen in Nord- und Mittelhessen ist es zu mehreren Unfällen gekommen. Ein Sprinterfahrer hat bei einem Zusammenstoß mit einem Lkw tödliche Verletzungen erlitten. Alle Wetter-Entwicklung… [+8525 chars],,de,'Glatteis'
https://www.focus.de/panorama/welt/schueler-frieren-bei-arktischen-temperaturen-im-klassenzimmer-eltern-greifen-stadt-an_5f614525-6f72-4c9b-9d22-96e91aca8ae7.html,https://www.focus.de/panorama/welt/schueler-frieren-bei-arktischen-temperaturen-im-klassenzimmer-eltern-greifen-stadt-an_5f614525-6f72-4c9b-9d22-96e91aca8ae7.html,0,www.focus.de,"Unterricht in Winterjacke - Schüler frieren bei „arktischen Temperaturen“ im Klassenzimmer, Eltern greifen Stadt an",Nach den Ferien fiel die Heizung am Luitpold-Gymnasium in München aus. Die Schüler mussten sich mit Winterkleidung vor der „arktischen“ Kälte schützen.,https://quadro.burda-forward.de/ctf/0b9161fb-1db0-4040-bd5d-48a834f1304d.9fd1b53e-80fc-4782-ae3e-34dd69e692b9.jpg?im=RegionOfInterestCrop%3D%281200%2C630%29%2CregionOfInterest%3D%28634%2C603%29&hash=bbfaffdab926a65a3d1f37fada9fb802674d46fdd5c1a8086b7481ea17b5ed22,2025-01-08T10:32:00Z,,"Nach den Weihnachtsferien fiel nach Informationen der tz die Heizung im Luitpold-Gymnasium in München aus. Schüler mussten am Dienstag mit Winterkleidung im Unterricht sitzen, um sich vor der Kälte z… [+2801 chars]",,de,'Winter'
https://www.zeit.de/news/2025-01/08/bus-rutscht-30-meter-abhang-hinunter,https://www.zeit.de/news/2025-01/08/bus-rutscht-30-meter-abhang-hinunter,0,www.zeit.de,Glatteis: Bus rutscht 30 Meter Abhang hinunter,Hier finden Sie Informationen zu dem Thema „Glatteis“. Lesen Sie jetzt „Bus rutscht 30 Meter Abhang hinunter“.,https://img.zeit.de/news/2025-01/08/bus-rutscht-30-meter-abhang-hinunter-image-group/wide__1300x731,2025-01-08T10:38:21Z,,"Ein Linienbus ist rund 30 Meter einen Abhang bei Aitern (Kreis Lörrach) hinuntergerutscht. Erst ein Baum habe den Bus gestoppt, teilte die Polizei mit. Der 60 Jahre alte Busfahrer erlitt den Angaben … [+249 chars]",,de,'Glatteis'
https://www.zeit.de/news/2025-01/08/schnee-und-regen-bei-temperaturen-bis-14-grad,https://www.zeit.de/news/2025-01/08/schnee-und-regen-bei-temperaturen-bis-14-grad,0,www.zeit.de,Wettervorhersage: Schnee und Regen bei Temperaturen bis 14 Grad,Hier finden Sie Informationen zu dem Thema „Wettervorhersage“. Lesen Sie jetzt „Schnee und Regen bei Temperaturen bis 14 Grad“.,https://img.zeit.de/news/2025-01/08/schnee-und-regen-bei-temperaturen-bis-14-grad-image-group/wide__1300x731,2025-01-08T10:39:37Z,,Deutschland ist beim Wetter in den kommenden Tagen zweigeteilt. Im Norden steht vor allem Schnee ins Haus. Am Donnerstag legt sich laut dem Deutschen Wetterdienst (DWD) eine Luftmassengrenze quer übe… [+2018 chars],,de,'Glatteis'
https://www.zeit.de/2025/01/fernwaerme-hamburg-umwelt-klimaschutz-waermewende,https://www.zeit.de/2025/01/fernwaerme-hamburg-umwelt-klimaschutz-waermewende,0,www.zeit.de,Fernwärme in Hamburg: Jetzt beginnt die heiße Phase,In Hamburg werden viele allein durch ihre Heizung zu Klimasündern. Ein Großteil der Fernwärme wird noch mit Kohle erzeugt. Das soll sich nun ändern.,https://img.zeit.de/hamburg/2024-12/fernwaerme-hamburg-teaser/wide__1300x731,2025-01-08T10:58:12Z,http://archive.md/20241231132459/https://www.zeit.de/2025/01/fernwaerme-hamburg-umwelt-klimaschutz-waermewende,"Fernwärme in Hamburg klingt dieses Wort immer ein wenig nach Hoffnung. Nach einer besseren Zukunft. 1842 hatte der Große Brand weite Teile der Innenstadt zerstört, mehr als 50 Menschen starben und me… [+682 chars]",,de,'Kohle'
https://www.zeit.de/news/2025-01/08/pegelstaende-steigen-hochwasser-moeglich,https://www.zeit.de/news/2025-01/08/pegelstaende-steigen-hochwasser-moeglich,0,www.zeit.de,Regen und Schnee: Pegelstände steigen - Hochwasser möglich,Hier finden Sie Informationen zu dem Thema „Regen und Schnee“. Lesen Sie jetzt „Pegelstände steigen - Hochwasser möglich“.,https://img.zeit.de/news/2025-01/08/pegelstaende-steigen-hochwasser-moeglich-image-group/wide__1300x731,2025-01-08T11:24:48Z,,"Wegen der angekündigten Niederschläge sollen die Wasserstände an Mosel, Saar und Sauer ab heute Nachmittag wieder steigen. Das teilte die Hochwasser-Vorhersagezentrale des Landesamtes für Umwelt Rhei… [+1177 chars]",,de,'Hochwasser'
https://www.zeit.de/news/2025-01/08/autofahrerin-bei-glatteis-kollision-schwer-verletzt,https://www.zeit.de/news/2025-01/08/autofahrerin-bei-glatteis-kollision-schwer-verletzt,0,www.zeit.de,Im Landkreis Osnabrück: Autofahrerin bei Glatteis-Kollision schwer verletzt,Hier finden Sie Informationen zu dem Thema „Im Landkreis Osnabrück“. Lesen Sie jetzt „Autofahrerin bei Glatteis-Kollision schwer verletzt“.,https://img.zeit.de/news/2025-01/08/autofahrerin-bei-glatteis-kollision-schwer-verletzt-image-group/wide__1300x731,2025-01-08T11:53:58Z,,Auf eisglatter Straße ist eine Autofahrerin im Landkreis Osnabrück am Morgen mit ihrem Wagen ins Schleudern geraten und schwer verletzt worden. Die 22-Jährige verlor nach Polizeiangaben bei Eggermühl… [+462 chars],,de,'Glatteis'
https://www.bild.de/news/inland/winter-chaos-auf-deutschen-strassen-unfaelle-und-glatteis-seit-dem-morgen-677e4a561cbffb4ab965f5f5,https://www.bild.de/news/inland/winter-chaos-auf-deutschen-strassen-unfaelle-und-glatteis-seit-dem-morgen-677e4a561cbffb4ab965f5f5,0,www.bild.de,Schneewalze in Deutschland - Dauer-Glätte sorgt für Unfall-Chaos,"Autofahrer müssen sich fast jeden Tag auf eine neue Gefahr einstellen. Am Mittwoch ist es wieder Glatteis, das für etliche Unfälle sorgt.","https://images.bild.de/677e4a561cbffb4ab965f5f5/c6e81455e66f209cb6370453698e80cd,38f81bc7?w=1280",2025-01-08T12:50:23Z,,"Bad Oldesloe Seit Tagen herrscht Winter-Chaos auf deutschen Straßen. Sturm, Glatteis, Schnee Autofahrer müssen sich jeden Tag auf meist gefährliche Verhältnisse einstellen. Am Mittwoch ist es ein Tem… [+2395 chars]",,de,'Glatteis'
https://www.zeit.de/news/2025-01/08/brasilianische-pflegekraefte-in-sachsen-das-erste-mal-schnee,https://www.zeit.de/news/2025-01/08/brasilianische-pflegekraefte-in-sachsen-das-erste-mal-schnee,0,www.zeit.de,Ausländisches Pflegepersonal: Brasilianische Pflegekräfte in Sachsen: Das erste Mal Schnee,Hier finden Sie Informationen zu dem Thema „Ausländisches Pflegepersonal“. Lesen Sie jetzt „Brasilianische Pflegekräfte in Sachsen: Das erste Mal Schnee“.,https://img.zeit.de/news/2025-01/08/brasilianische-pflegekraefte-in-sachsen-das-erste-mal-schnee-image-group/wide__1300x731,2025-01-08T13:35:20Z,,Sachsen setzt bei der Betreuung Pflegebedürftiger künftig verstärkt auf ausländisches Personal. Denn in den kommenden zehn Jahren benötigt der Freistaat angesichts der demografischen Entwicklung zusä… [+3434 chars],,de,'Schnee'
https://www.tagesspiegel.de/berlin/berliner-wirtschaft/knapp-100000-nachforderungen-in-berlin-jeder-vierte-mieter-von-landeseigenen-wohnungen-muss-heizkosten-nachzahlen-12981172.html,https://www.tagesspiegel.de/berlin/berliner-wirtschaft/knapp-100000-nachforderungen-in-berlin-jeder-vierte-mieter-von-landeseigenen-wohnungen-muss-heizkosten-nachzahlen-12981172.html,0,www.tagesspiegel.de,Knapp 100.000 Nachforderungen in Berlin: Jeder vierte Mieter von landeseigenen Wohnungen muss Heizkosten nachzahlen,Für das Abrechnungsjahr 2023 haben die Berliner landeseigenen Wohnungsunternehmen viele Zahlungsnachforderungen für Heizkosten verschickt. Die Linke fordert einen Unterstützungsfonds.,https://www.tagesspiegel.de/images/10935730/alternates/BASE_16_9_W1400/1702654470000/430650256.jpeg,2025-01-08T14:02:55Z,http://archive.md/20250109191430/https://www.tagesspiegel.de/berlin/berliner-wirtschaft/knapp-100000-nachforderungen-in-berlin-jeder-vierte-mieter-von-landeseigenen-wohnungen-muss-heizkosten-nachzahlen-12981172.html,"Gut ein Viertel der Haushalte, die bei landeseigenen Wohnungsunternehmen mieten, muss für das Abrechnungsjahr 2023 Heizkosten nachzahlen. Das geht aus der noch unveröffentlichten Antwort des Staatsse… [+157 chars]",,de,'Heizkosten'
https://www.tagesspiegel.de/berlin/heizkosten-in-berlin-knapp-100000-nachforderungen-bei-den-landeseigenen-vermietern-12981172.html,https://www.tagesspiegel.de/berlin/heizkosten-in-berlin-knapp-100000-nachforderungen-bei-den-landeseigenen-vermietern-12981172.html,0,www.tagesspiegel.de,Heizkosten in Berlin: Knapp 100.000 Nachforderungen bei den landeseigenen Vermietern,Für das Abrechnungsjahr 2023 haben die Berliner landeseigenen Wohnungsunternehmen viele Zahlungsnachforderungen für Heizkosten verschickt. Die Linke fordert einen Unterstützungsfonds.,https://www.tagesspiegel.de/images/10935730/alternates/BASE_16_9_W1400/1702654470000/430650256.jpeg,2025-01-08T14:02:55Z,,"Gut ein Viertel der Haushalte, die bei landeseigenen Wohnungsunternehmen mieten, muss für das Abrechnungsjahr 2023 Heizkosten nachzahlen. Das geht aus der noch unveröffentlichten Antwort des Staatsse… [+157 chars]",,de,'Heizkosten'
https://www.zeit.de/news/2025-01/08/mehrere-unfaelle-wegen-schnee-und-glaette-in-hoehenlagen,https://www.zeit.de/news/2025-01/08/mehrere-unfaelle-wegen-schnee-und-glaette-in-hoehenlagen,0,www.zeit.de,Schnee und Unfälle: Mehrere Unfälle wegen Schnee und Glätte in Höhenlagen,Hier finden Sie Informationen zu dem Thema „Schnee und Unfälle“. Lesen Sie jetzt „Mehrere Unfälle wegen Schnee und Glätte in Höhenlagen“.,https://img.zeit.de/news/2025-01/08/mehrere-unfaelle-wegen-schnee-und-glaette-in-hoehenlagen-image-group/wide__1300x731,2025-01-08T17:16:03Z,,"Schnee und glatte Straßen führen in den Höhenlagen von Hunsrück und Eifel teils zu erheblichen Behinderungen im Verkehr. Es gebe mehrere Unfälle auf winterglatten Straßen, die bisher alle glimpflich … [+440 chars]",,de,'Schnee'
https://www.zeit.de/news/2025-01/09/schnee-und-glaette-in-berlin-und-brandenburg,https://www.zeit.de/news/2025-01/09/schnee-und-glaette-in-berlin-und-brandenburg,0,www.zeit.de,Wetter: Schnee und Glätte in Berlin und Brandenburg,Hier finden Sie Informationen zu dem Thema „Wetter“. Lesen Sie jetzt „Schnee und Glätte in Berlin und Brandenburg“.,https://img.zeit.de/news/2025-01/09/schnee-und-glaette-in-berlin-und-brandenburg-image-group/wide__1300x731,2025-01-09T05:30:31Z,,"Die Menschen in Berlin und Brandenburg müssen sich am Donnerstag auf Schnee und gebietsweise Glätte einstellen. Während das Wetter im Süden der Region zunächst eher regnerisch bleibt, ist nach Angabe… [+526 chars]",,de,'Schnee'
https://www.zeit.de/news/2025-01/09/wintereinbruch-sorgt-fuer-unfaelle-in-nordrhein-westfalen,https://www.zeit.de/news/2025-01/09/wintereinbruch-sorgt-fuer-unfaelle-in-nordrhein-westfalen,0,www.zeit.de,Schnee und Glätte: Wintereinbruch sorgt für Unfälle in Nordrhein-Westfalen,Hier finden Sie Informationen zu dem Thema „Schnee und Glätte“. Lesen Sie jetzt „Wintereinbruch sorgt für Unfälle in Nordrhein-Westfalen“.,https://img.zeit.de/news/2025-01/09/wintereinbruch-sorgt-fuer-unfaelle-in-nordrhein-westfalen-image-group/wide__1300x731,2025-01-09T06:49:38Z,,"Schnee und Glätte haben für mehrere Unfälle mit Verletzten in Nordrhein-Westfalen gesorgt. Das teilten die verschiedenen Polizei-Leitstellen mit. 
In Bestwig (im Hochsauerlandkreis) sei am Mittwocha… [+1329 chars]",,de,'Schnee'
https://www.zeit.de/news/2025-01/09/dwd-weiter-viel-schnee-in-nrw-glaette-bis-freitag,https://www.zeit.de/news/2025-01/09/dwd-weiter-viel-schnee-in-nrw-glaette-bis-freitag,0,www.zeit.de,Wetter: DWD: Weiter viel Schnee in NRW - Glätte bis Freitag,Hier finden Sie Informationen zu dem Thema „Wetter“. Lesen Sie jetzt „DWD: Weiter viel Schnee in NRW - Glätte bis Freitag“.,https://img.zeit.de/news/2025-01/09/dwd-weiter-viel-schnee-in-nrw-glaette-bis-freitag-image-group/wide__1300x731,2025-01-09T08:40:10Z,,"Weiterer Schneefall und abkühlender Straßenbelag kann in Teilen Nordrhein-Westfalens bis Freitagmorgen zu Glatteis führen. Der Schnee sei seit der Nacht in Aachen, Köln, im Bergischen Land und auch i… [+497 chars]",,de,'Schnee'
https://www.stern.de/gesellschaft/regional/nordrhein-westfalen/wetter--dwd--weiter-viel-schnee-in-nrw---glaette-bis-freitag-35365858.html,https://www.stern.de/gesellschaft/regional/nordrhein-westfalen/wetter--dwd--weiter-viel-schnee-in-nrw---glaette-bis-freitag-35365858.html,0,www.stern.de,Wetter: DWD: Weiter viel Schnee in NRW - Glätte bis Freitag,Das Winterwetter in Nordrhein-Westfalen dauert an: In Teilen des Landes kann es laut Wetterdienst DWD bis Freitagfrüh auf den Straßen glatt bleiben oder werden.,https://image.stern.de/35365860/t/Si/v1/w1440/r1.7778/-/09--3fabpzacwov9axs2048jpeg---96b76e3275cfc52e.jpg,2025-01-09T08:40:10Z,,"Kopiere den aktuellen Link
Das Winterwetter in Nordrhein-Westfalen dauert an: In Teilen des Landes kann es laut Wetterdienst DWD bis Freitagfrüh auf den Straßen glatt bleiben oder werden.
Weiterer … [+647 chars]",,de,'Winter'
https://www.n-tv.de/panorama/Wintereinbruch-sorgt-fuer-Dutzende-Unfaelle-Schwerverletzte-in-NRW-article25476633.html,https://www.n-tv.de/panorama/Wintereinbruch-sorgt-fuer-Dutzende-Unfaelle-Schwerverletzte-in-NRW-article25476633.html,0,www.n-tv.de,Glatte Straßen nach Schneefall: Wintereinbruch sorgt für Dutzende Unfälle - Schwerverletzte in NRW,"Der Winter ist zurück in Deutschland. Teils heftiger Schneefall führt zu glatten Straßen, auf denen es gleich zigfach zu Unfällen kommt. Mehrere Menschen werden verletzt. Die Schadenssumme ist wohl sechsstellig.",https://bilder2.n-tv.de/img/incoming/crop25476605/9161321950-cImg_16_9-w1200/epi-224547595-IMAGO-SP-imago-st-0108-21440002-0792568621.jpg,2025-01-09T09:02:29Z,,"Der Winter ist zurück in Deutschland. Teils heftiger Schneefall führt zu glatten Straßen, auf denen es gleich zigfach zu Unfällen kommt. Mehrere Menschen werden verletzt. Die Schadenssumme ist wohl s… [+4093 chars]",,de,'Winter'
https://www.zeit.de/news/2025-01/09/kaltes-winterwetter-zum-wochenende,https://www.zeit.de/news/2025-01/09/kaltes-winterwetter-zum-wochenende,0,www.zeit.de,Wetteraussichten: Kaltes Winterwetter zum Wochenende,Hier finden Sie Informationen zu dem Thema „Wetteraussichten“. Lesen Sie jetzt „Kaltes Winterwetter zum Wochenende“.,https://img.zeit.de/news/2025-01/09/kaltes-winterwetter-zum-wochenende-image-group/wide__1300x731,2025-01-09T09:45:15Z,,"Nach Schnee und Regen bleibt es kalt in Deutschland - oft aber auch trocken. Kamen am Donnerstagmorgen bereits bis zu 10 Zentimeter Neuschnee in den westdeutschen Mittelgebirgen zusammen, dürfte das … [+1314 chars]",,de,'Schnee'
https://www.focus.de/politik/ausland/republik-moldau-winter-am-dnister-ohne-russisches-gas_26b7b1fb-d43e-43da-afcc-1288be7b956e.html,https://www.focus.de/politik/ausland/republik-moldau-winter-am-dnister-ohne-russisches-gas_26b7b1fb-d43e-43da-afcc-1288be7b956e.html,0,www.focus.de,Ausland - Republik Moldau: Winter am Dnister ohne russisches Gas,Am 1. Januar hat Russland die Gaslieferungen an die Republik Moldau eingestellt. Die russisch kontrollierte separatistische Region Transnistrien und die benachbarten Dörfer bleiben in der Kälte.,https://quadro.burda-forward.de/ctf/089a45cd-192e-49c3-b86c-5e5bb95f0c00.b52613ef-3360-4488-9ba6-b3d140ac9054.png?im=Resize%3D%281200%2C630%29&hash=5a8f1cbf2813e6f38a9bca7b16f22dd341708c0ff0e53eedacd487f419ae9ec4,2025-01-09T10:01:38Z,,Es ist kalt in den ersten Tagen des Jahres 2025 in der Republik Moldau. In den Nächten liegen die Temperaturen um den Gefrierpunkt. An den Tagen steigen sie bei Sonnenschein etwas an. An diesem 7. Ja… [+5765 chars],,de,'Winter'
https://www.stern.de/gesellschaft/regional/bayern/verkehr-in-bayern--mindestens-sechs-verletzte-bei-glaette-unfaellen-35365270.html,https://www.stern.de/gesellschaft/regional/bayern/verkehr-in-bayern--mindestens-sechs-verletzte-bei-glaette-unfaellen-35365270.html,0,www.stern.de,Verkehr in Bayern: Mindestens sechs Verletzte bei Glätte-Unfällen,Bayreuth/Regensburg (lby) - Glatteis und Schnee haben in Teilen Bayerns erneut zu Unfällen geführt. Im Landkreis Bayreuth kam es am Mittwochabend,https://image.stern.de/35366176/t/6O/v1/w1440/r1.7778/-/09--qml6grjofmv5axs2048jpeg---97bca6e9f011f1f3.jpg,2025-01-09T10:07:41Z,,"Kopiere den aktuellen Link
Auf glatten Straßen haben einige Autofahrer in Bayern die Kontrolle verloren. Und es geht weiter mit den rutschigen Straßenverhältnissen.
Glatteis und Schnee haben in Tei… [+2007 chars]",,de,'Glatteis'
https://www.stern.de/gesellschaft/regional/nordrhein-westfalen/schnee-und-glaette--schnee-sorgt-fuer-mehrere-unfaelle---glatteis-bis-freitag-35365858.html,https://www.stern.de/gesellschaft/regional/nordrhein-westfalen/schnee-und-glaette--schnee-sorgt-fuer-mehrere-unfaelle---glatteis-bis-freitag-35365858.html,0,www.stern.de,Schnee und Glätte: Schnee sorgt für mehrere Unfälle - Glatteis bis Freitag,Auf glatten Straßen in Nordrhein-Westfalen hat es einige Unfälle gegeben. Mancherorts hatten Polizei und Räumfahrzeuge viel zu tun. Bis Freitagfrüh könnte es glatt und frostig bleiben.,https://image.stern.de/35366426/t/lT/v1/w1440/r1.7778/-/09--6rismb7ni5v3axs2048jpeg---3a25026158d909a2.jpg,2025-01-09T10:41:55Z,,"Kopiere den aktuellen Link
Auf glatten Straßen in Nordrhein-Westfalen hat es einige Unfälle gegeben. Mancherorts hatten Polizei und Räumfahrzeuge viel zu tun. Bis Freitagfrüh könnte es glatt und fro… [+3106 chars]",,de,'Glatteis'
