index,url,valid,domain,title,description,image,published,archive,content,quote,language,keyword
https://www.stern.de/politik/deutschland/winterklausur-in-kloster-seeon--csu-setzt-auf-rueckkehr-der-atomkraft-in-deutschland-37002580.html,https://www.stern.de/politik/deutschland/winterklausur-in-kloster-seeon--csu-setzt-auf-rueckkehr-der-atomkraft-in-deutschland-37002580.html,0,www.stern.de,Winterklausur in Kloster Seeon: CSU setzt auf Rückkehr der Atomkraft in Deutschland,"Am 6. Januar startet in Kloster Seeon für die CSU das politische Jahr. Erwartet wird in Oberbayern auch Kanzler Merz. Auf der Agenda findet sich zudem ein Thema, welches das Land schon lange spaltet.",https://image.stern.de/37002582/t/R1/v1/w1440/r1.7778/-/01--i2wzuzvp3gv21axs2048jpeg---56b9501a59066749.jpg,2026-01-01T03:00:28Z,,"Kopiere den aktuellen Link
Zur Merkliste hinzufügen
Am 6. Januar startet in Kloster Seeon für die CSU das politische Jahr. Erwartet wird in Oberbayern auch Kanzler Merz. Auf der Agenda findet sich … [+4206 chars]",,de,'Winter'
https://www.zeit.de/news/2026-01/01/csu-setzt-auf-rueckkehr-der-atomkraft-in-deutschland,https://www.zeit.de/news/2026-01/01/csu-setzt-auf-rueckkehr-der-atomkraft-in-deutschland,0,www.zeit.de,Winterklausur in Kloster Seeon: CSU setzt auf Rückkehr der Atomkraft in Deutschland,Hier finden Sie Informationen zu dem Thema „Winterklausur in Kloster Seeon“. Lesen Sie jetzt „CSU setzt auf Rückkehr der Atomkraft in Deutschland“.,https://img.zeit.de/news/2026-01/01/csu-setzt-auf-rueckkehr-der-atomkraft-in-deutschland-image-group/wide__1300x731,2026-01-01T03:00:28Z,,Zur Sicherstellung der Energieversorgung setzt die CSU im Bundestag trotz Atomausstiegs auf eine Rückkehr der Kernenergie in Deutschland und den Bau von Mini-Kernkraftwerken. Konkret fordern die Chri… [+3986 chars],,de,'Winter'
https://www.tagesspiegel.de/politik/winterklausur-in-kloster-seeon-csu-setzt-auf-ruckkehr-der-atomkraft-in-deutschland-15092611.html,https://www.tagesspiegel.de/politik/winterklausur-in-kloster-seeon-csu-setzt-auf-ruckkehr-der-atomkraft-in-deutschland-15092611.html,0,www.tagesspiegel.de,Winterklausur in Kloster Seeon: CSU setzt auf Rückkehr der Atomkraft in Deutschland,"Am 6. Januar startet in Kloster Seeon für die CSU das politische Jahr. Erwartet wird in Oberbayern auch Kanzler Merz. Auf der Agenda findet sich zudem ein Thema, welches das Land schon lange spaltet.",https://www.tagesspiegel.de/images/15092610/alternates/BASE_16_9_W1400/1767236562000/sprengung-der-kuhlturme-des-kernkraftwerks-gundremmingen.jpeg,2026-01-01T03:02:42Z,,Zur Sicherstellung der Energieversorgung setzt die CSU im Bundestag trotz Atomausstiegs auf eine Rückkehr der Kernenergie in Deutschland und den Bau von Mini-Kernkraftwerken. Konkret fordern die Chri… [+4035 chars],,de,'Winter'
https://www.zeit.de/news/2026-01/01/das-neue-jahr-startet-mit-sonne-schnee-und-wind,https://www.zeit.de/news/2026-01/01/das-neue-jahr-startet-mit-sonne-schnee-und-wind,0,www.zeit.de,"Wetter in Bayern: Das neue Jahr startet mit Sonne, Schnee und Wind","Hier finden Sie Informationen zu dem Thema „Wetter in Bayern“. Lesen Sie jetzt „Das neue Jahr startet mit Sonne, Schnee und Wind“.",https://img.zeit.de/news/2026-01/01/das-neue-jahr-startet-mit-sonne-schnee-und-wind-image-group/wide__1300x731,2026-01-01T05:13:02Z,,"Zum Start ins neue Jahr zeigt sich das Wetter in Bayern zweigeteilt: An den Alpen und im Alpenvorland gibt es Sonne, im restlichen Freistaat fällt gebietsweise sogar Schnee. Anfangs gebe es an den ös… [+894 chars]",,de,'Schnee'
https://www.kino-zeit.de/news-features/themen-specials/fuer-den-tag-danach-katerkino,https://www.kino-zeit.de/news-features/themen-specials/fuer-den-tag-danach-katerkino,0,www.kino-zeit.de,Für den Tag danach: Katerkino,"Themen

 

 
 




 
 Prime Video / Metropol / Croco Film

 
 Deep Cover / Voyage of the Rock Aliens / Gib Gas – Ich will Spaß

 
 





Der Kopf brummt, die Zeit will vertrieben werden? Schon zum zweiten Mal schlägt die Kino-Zeit-Redaktion einige ihrer li…",https://www.kino-zeit.de/sites/default/files/styles/grosse_klickstrecke_940x530_/public/2025-12/kino-zeit-vorlage-1_0.png?itok=8fvpKMYt,2026-01-01T08:00:00Z,,"Die Liebesparade (1929)
Immer gut fürs Gemüt: Musik. Ernst LubitschDie Liebesparade gilt als erstes richtiges Hollywood-Filmmusical, das keine Nummernrevue ist, sondern die Songs in die Narration ei… [+1604 chars]",,de,'Gas'
https://www.stern.de/gesellschaft/regional/hamburg-schleswig-holstein/fussball-bundesliga--fc-st--pauli-verpflichtet-japanischen-nationalspieler-37003110.html,https://www.stern.de/gesellschaft/regional/hamburg-schleswig-holstein/fussball-bundesliga--fc-st--pauli-verpflichtet-japanischen-nationalspieler-37003110.html,0,www.stern.de,Fußball-Bundesliga: FC St. Pauli verpflichtet japanischen Nationalspieler,Hamburg (lno) - Fußball-Bundesligist FC St. Pauli hat den ersten Winter-Neuzugang verpflichtet. Die Hamburger verstärkten sich mit dem japanischen,https://image.stern.de/37003112/t/LD/v1/w1440/r1.7778/-/01--yy3sp2quedv3axs2048jpeg---7edf72101ed21cd9.jpg,2026-01-01T08:50:22Z,,"Kopiere den aktuellen Link
Zur Merkliste hinzufügen
Die Hamburger präsentieren ihren ersten Winter-Transfer. Aus Japan wechselt der Nationalspieler Tomoya Ando in die Hansestadt.
Fußball-Bundeslig… [+1053 chars]",,de,'Winter'
https://www.telepolis.de/article/Leapfrogging-Wenn-Entwicklungslaender-Deutschland-ueberholen-11123447.html,https://www.telepolis.de/article/Leapfrogging-Wenn-Entwicklungslaender-Deutschland-ueberholen-11123447.html,0,www.telepolis.de,Leapfrogging: Wenn Entwicklungsländer Deutschland überholen,China übersprang die Verbrenner-Ära und dominiert jetzt E-Autos. Afrika macht es nach – mit Solar statt Kohle und ohne Fehler des Westens.,https://heise.cloudimg.io/bound/1200x1200/q85.png-lossy-85.webp-lossy-85.foil1/_www-heise-de_/imgs/18/5/0/0/0/6/7/9/bockspringen-01-135c053e048797e0.png,2026-01-01T09:00:00Z,,"Leapfrogging, engl. für ""Bockspringen""
China übersprang die Verbrenner-Ära und dominiert jetzt E-Autos. Afrika macht es nach mit Solar statt Kohle und ohne Fehler des Westens.
Über viele Jahre hatt… [+5528 chars]",,de,'Kohle'
https://www.bild.de/sport/fussball/fc-st-pauli-transfer-perfekt-st-pauli-holt-japan-nationalspieler-69563685f6fc544dba9b91cc,https://www.bild.de/sport/fussball/fc-st-pauli-transfer-perfekt-st-pauli-holt-japan-nationalspieler-69563685f6fc544dba9b91cc,0,www.bild.de,Winter-Transfer fix! - St. Pauli holt Japan-Nationalspieler,Blitzstart im neuen Jahr! Der FC St. Pauli verpflichtet den japanischen Nationalspieler Tomoya Andō (26).,"https://images.bild.de/69563685f6fc544dba9b91cc/184daf56d9b7cd0f9abe5e71f6579007,65002297?w=1280",2026-01-01T09:12:55Z,,"Blitzstart im neuen Jahr! Der FC St. Pauli verpflichtet den japanischen Nationalspieler Tomoya And (26). BILD hatte bereits vor gut zwei Wochen darüber berichtet, dass der Japaner kommen soll. Der In… [+1828 chars]",,de,'Winter'
https://www.focus.de/panorama/welt/tijl-41-zahlt-8800-euro-fuer-10-tage-in-thailand-unsere-urlaube-werden-sorgfaeltig-geplant_133b12fb-36c1-483b-8235-2c6f97c87245.html,https://www.focus.de/panorama/welt/tijl-41-zahlt-8800-euro-fuer-10-tage-in-thailand-unsere-urlaube-werden-sorgfaeltig-geplant_133b12fb-36c1-483b-8235-2c6f97c87245.html,0,www.focus.de,"Tijl (41) zahlt 8800 Euro für 10 Tage in Thailand: ""Unsere Urlaube werden sorgfältig geplant""",Eine Familie aus Belgien investiert in Urlaube. Dabei tauschen sie auch den Winter gegen die warme Sonne – als Nächstes geht es nach Thailand.,https://quadro.burda-forward.de/ctf/046eeb0a-3f05-4761-9d43-3522bbc23de1.ad204f28-4079-4357-9387-7755bb322c4f.png?im=RegionOfInterestCrop%3D%281200%2C630%29%2CregionOfInterest%3D%281205%2C1055%29&hash=7e747a913173316cf9c25011fc6c690ef63091294950c1a8b301d701734e8a16,2026-01-01T09:27:03Z,,"Manche Menschen investieren ihr Geld in Autos oder gehen gerne ins Restaurant Tijl De Bock (41) reist mit Frau und seinen zwei Kindern gerne. ""Wir gehen nicht jeden Monat in teure Restaurants, fahren… [+1796 chars]",,de,'Winter'
https://snipz.de/2026/stylische-barfulker-beanie-muetze/,https://snipz.de/2026/stylische-barfulker-beanie-muetze/,0,snipz.de,"Doppelpack Stylische BARFULKER Beanie Mützen für nur 7,99€","Mit der BARFULKER Beanie Mütze seid ihr warm und stylisch durch den Winter unterwegs. Aktuell gibt es die Beanie im Doppelpacj für nur 7,99€ inkl. Prime-Versand bei Amazon. Legt dazu einfach zwei der Mützen in den Warenkorb, an der Kasse werden dann automatis…",https://gadgetwelt.de/wp-content/uploads/2026/01/b0dhcqn727-1.jpg,2026-01-01T09:42:06Z,,"Gadgetwelt.de ist ein Portal zum Thema Gadgets, China-Gadgets und Onlineshopping in China.
Wir versorgen euch seit 2010 täglich mit News zu Gadgets, Produkten aus aller Welt und alles rund um China … [+7 chars]",,de,'Winter'
https://sport.orf.at/stories/3149485/,https://sport.orf.at/stories/3149485/,0,sport.orf.at,Jahr im Zeichen von Olympia und Fußball-WM,Olympische Winterspiele vor der Haustür und eine Fußball-WM mit rot-weiß-roter Beteiligung in Übersee: Das Sportjahr 2026 hat nicht nur aus heimischer Sicht zwei absolute Höhepunkte zu bieten.,https://ibs.orf.at/sport?image=https%3A%2F%2Fassets.orf.at%2Fmims%2F2025%2F01%2F68%2Fcrops%2Fw%3D1200%2Ch%3D630%2Cq%3D75%2F2882614_master_1113568_jahresrueckblick_2025_vorschau_2026_ap.jpg%3Fs%3Dedb15898505c48d7803a97516ddbf5c72d735a10,2026-01-01T10:14:21Z,,"Die österreichischen Wintersportler hoffen in Mailand und Cortina dAmpezzo (6. bis 22. Februar) auf viele Medaillen unter den Ringen, im Sommer peilt das ÖFB-Nationalteam der Männer beim Großturnier … [+5044 chars]",,de,'Winter'
https://taz.de/Neue-Gesetze-und-Verordnungen/!6142003/,https://taz.de/Neue-Gesetze-und-Verordnungen/!6142003/,0,taz.de,Neue Gesetze und Verordnungen: Was sich mit dem Jahreswechsel so alles geändert hat,"Mindestlohn und CO2-Preis steigen. Das Deutschlandticket wird teurer, ebenso das Tanken und Heizen mit Öl und Gas. Welche Änderungen gelten 2026?",https://taz.de/picture/8159018/1200/39995946.jpeg,2026-01-01T10:29:00Z,,"Mindestlohn und CO2-Preis steigen. Das Deutschlandticket wird teurer, ebenso das Tanken und Heizen mit Öl und Gas. Welche Änderungen gelten 2026? mehr...",,de,'Gas'
https://www.bild.de/news/wetter/unwetterwarnung-heftiger-wintersturm-trifft-deutschland-69550b21a75a88580a6dc6cd,https://www.bild.de/news/wetter/unwetterwarnung-heftiger-wintersturm-trifft-deutschland-69550b21a75a88580a6dc6cd,0,www.bild.de,Unwetterwarnung - Heftiger Wintersturm trifft Deutschland,"Hamburg – Schluss mit Winter-Spaß, jetzt kommt der Winter-Sturm! Die Wetterdienste warnen an Neujahr vor Unwetter mit Orkanböen und starken Schneeverwehu...","https://images.bild.de/69550b21a75a88580a6dc6cd/6364f1e921bfcd89442137cc48c3fad9,ebe04a99?w=1280",2026-01-01T10:46:17Z,,"Hamburg Schluss mit Winter-Spaß, jetzt kommt der Winter-Sturm! Die Wetterdienste warnen an Neujahr vor Unwetter mit Orkanböen und starken Schneeverwehungen in Deutschland.
Der Seewetterdienst Hambur… [+2273 chars]",,de,'Winter'
https://www.stern.de/gesellschaft/regional/niedersachsen-bremen/koalitionsstreit--lies--ohne-gas-wird-es-nicht-gehen-37004376.html,https://www.stern.de/gesellschaft/regional/niedersachsen-bremen/koalitionsstreit--lies--ohne-gas-wird-es-nicht-gehen-37004376.html,0,www.stern.de,Koalitionsstreit: Lies: Ohne Gas wird es nicht gehen,"Zoff in der Landesregierung: Während die Grünen bei den geplanten Gasbohrungen vor Borkum vor Schäden für Natur und Klima warnen, hält Regierungschef Lies die Nutzung von Gas für unumgänglich.",https://image.stern.de/37004378/t/7E/v1/w1440/r1.7778/-/02--xuzhtvd2kmv8axs2048jpeg---f3056ce5efe28198.jpg,2026-01-02T04:30:05Z,,"Kopiere den aktuellen Link
Zur Merkliste hinzufügen
Zoff in der Landesregierung: Während die Grünen bei den geplanten Gasbohrungen vor Borkum vor Schäden für Natur und Klima warnen, hält Regierungs… [+2438 chars]",,de,'Gas'
https://www.zeit.de/news/2026-01/02/lies-ohne-gas-wird-es-nicht-gehen,https://www.zeit.de/news/2026-01/02/lies-ohne-gas-wird-es-nicht-gehen,0,www.zeit.de,Koalitionsstreit: Lies: Ohne Gas wird es nicht gehen,Hier finden Sie Informationen zu dem Thema „Koalitionsstreit“. Lesen Sie jetzt „Lies: Ohne Gas wird es nicht gehen“.,https://img.zeit.de/news/2026-01/02/lies-ohne-gas-wird-es-nicht-gehen-image-group/wide__1300x731,2026-01-02T04:30:05Z,,"Bei der Gasförderung auf See sind SPD und Grüne in Niedersachsens Landesregierung weiter auf Konfrontationskurs. «Es ist offensichtlich, dass wir bei der Gasförderung unterschiedlicher Auffassung sin… [+2230 chars]",,de,'Gas'
https://www.zeit.de/news/2026-01/02/schnee-sturm-gewitter-winter-zeigt-muskeln,https://www.zeit.de/news/2026-01/02/schnee-sturm-gewitter-winter-zeigt-muskeln,0,www.zeit.de,"DWD-Prognose: Schnee, Sturm, Gewitter: Winter zeigt Muskeln","Hier finden Sie Informationen zu dem Thema „DWD-Prognose“. Lesen Sie jetzt „Schnee, Sturm, Gewitter: Winter zeigt Muskeln“.",https://img.zeit.de/news/2026-01/02/schnee-sturm-gewitter-winter-zeigt-muskeln-image-group/wide__1300x731,2026-01-02T04:58:02Z,,"Schnee, Sturm und sogar Gewitter: Der Winter zeigt in Baden-Württemberg am Freitag seine raue Seite. Nach Angaben des Deutschen Wetterdienstes (DWD) wird es wechselnd bis stark bewölkt mit Schnee- od… [+808 chars]",,de,'Winter'
https://salzburg.orf.at/radio/stories/3336193/,https://salzburg.orf.at/radio/stories/3336193/,0,salzburg.orf.at,Viele nicht auf mögliches Blackout vorbereitet,"Cyberangriffe, die ein Blackout – also einen längeren flächendeckenden Energieausfall -verursachen könnten, sind mittlerweile ein zentrales Risiko für den funktionierenden Alltag eines Staates. Hierzulande ist man noch nicht sonderlich gut auf eine solche Gef…",https://ibs.orf.at/sbg?image=https%3A%2F%2Foekastatic.orf.at%2Fmims%2F2025%2F18%2F66%2Fcrops%2Fw%3D1200%2Ch%3D627%2Cq%3D75%2F2607377_master_1000966_strom3.jpg%3Fs%3D145e684981d9cad127c6a525181c30a3ca55fe6e,2026-01-02T06:00:00Z,,"Energieversorgung, Krankenhäuser, Wasser- und Abwassersysteme die Infrastruktur im Land ist vielfältig und dadurch auch vielfältig verwundbar, sagt die Präsidentin der Universität der Bundeswehr Münc… [+1770 chars]",,de,'Blackout'
https://www.zeit.de/news/2026-01/02/schnee-glaette-und-wind-hessen-erwartet-winterliche-tage,https://www.zeit.de/news/2026-01/02/schnee-glaette-und-wind-hessen-erwartet-winterliche-tage,0,www.zeit.de,"Vorhersage: Schnee, Glätte und Wind – Hessen erwartet winterliche Tage","Hier finden Sie Informationen zu dem Thema „Vorhersage“. Lesen Sie jetzt „Schnee, Glätte und Wind – Hessen erwartet winterliche Tage“.",https://img.zeit.de/news/2026-01/02/schnee-glaette-und-wind-hessen-erwartet-winterliche-tage-image-group/wide__1300x731,2026-01-02T06:20:32Z,,"In Hessen müssen sich die Menschen auf Schnee, Wind und glatte Straßen einstellen. Für Freitag sagt der Deutsche Wetterdienst (DWD) Frost sowie teilweise Schneeschauer und Glätte vorher. In der Nordh… [+1109 chars]",,de,'Schnee'
https://www.zeit.de/news/2026-01/02/schnee-in-hamburg-stadtreinigung-im-einsatz,https://www.zeit.de/news/2026-01/02/schnee-in-hamburg-stadtreinigung-im-einsatz,0,www.zeit.de,Wetter: Schnee in Hamburg - Stadtreinigung im Einsatz,Hier finden Sie Informationen zu dem Thema „Wetter“. Lesen Sie jetzt „Schnee in Hamburg - Stadtreinigung im Einsatz“.,https://img.zeit.de/news/2026-01/02/schnee-in-hamburg-stadtreinigung-im-einsatz-image-group/wide__1300x731,2026-01-02T06:28:46Z,,"Schnee in Hamburg: Seit den frühen Morgenstunden ist der Winterdienst der Stadtreinigung Hamburg mit rund 125 Fahrzeugen im Einsatz. 
Gestreut werde auf wichtigen Hauptverkehrsstraßen und Strecken m… [+247 chars]",,de,'Schnee'
https://www.zeit.de/news/2026-01/02/schnee-und-glaette-zum-wochenende-in-nrw,https://www.zeit.de/news/2026-01/02/schnee-und-glaette-zum-wochenende-in-nrw,0,www.zeit.de,Frostige Temperaturen: Schnee und Glätte zum Wochenende in NRW,Hier finden Sie Informationen zu dem Thema „Frostige Temperaturen“. Lesen Sie jetzt „Schnee und Glätte zum Wochenende in NRW“.,https://img.zeit.de/news/2026-01/02/schnee-und-glaette-zum-wochenende-in-nrw-image-group/wide__1300x731,2026-01-02T06:35:59Z,,Das Winterwetter hat Nordrhein-Westfalen auch zum Wochenende fest im Griff. Laut Vorhersage des Deutschen Wetterdienstes (DWD) soll es auch in den kommenden Tagen kalt und glatt bleiben. Am Freitag l… [+610 chars],,de,'Schnee'
https://www.zeit.de/news/2026-01/02/schneeschauer-und-frost-wochenende-bleibt-winterlich,https://www.zeit.de/news/2026-01/02/schneeschauer-und-frost-wochenende-bleibt-winterlich,0,www.zeit.de,Vorhersage: Schneeschauer und Frost – Wochenende bleibt winterlich,Hier finden Sie Informationen zu dem Thema „Vorhersage“. Lesen Sie jetzt „Schneeschauer und Frost – Wochenende bleibt winterlich“.,https://img.zeit.de/news/2026-01/02/schneeschauer-und-frost-wochenende-bleibt-winterlich-image-group/wide__1300x731,2026-01-02T06:39:26Z,,"Es bleibt winterlich in Rheinland-Pfalz und im Saarland. Die Menschen müssen sich auch am Wochenende auf Schnee, Wind und glatte Straßen einstellen. 
Für Freitag sagt der Deutsche Wetterdienst (DWD)… [+1042 chars]",,de,'Schnee'
https://www.zeit.de/news/2026-01/02/hochwasser-und-schnee-im-norden-keine-groesseren-schaeden,https://www.zeit.de/news/2026-01/02/hochwasser-und-schnee-im-norden-keine-groesseren-schaeden,0,www.zeit.de,Wetter: Hochwasser und Schnee im Norden - keine größeren Schäden,Hier finden Sie Informationen zu dem Thema „Wetter“. Lesen Sie jetzt „Hochwasser und Schnee im Norden - keine größeren Schäden“.,https://img.zeit.de/news/2026-01/02/hochwasser-und-schnee-im-norden-keine-groesseren-schaeden-image-group/wide__1300x731,2026-01-02T07:16:57Z,,"Im Norden Deutschlands haben Hochwasser und Sturmflut in der Nacht auf Freitag zunächst keine größeren Schäden verursacht. In Niedersachsen, Schleswig-Holstein und Hamburg verzeichneten die Lagezentr… [+1885 chars]",,de,'Hochwasser'
https://www.zeit.de/news/2026-01/02/sturm-schnee-und-glaette-erwartet,https://www.zeit.de/news/2026-01/02/sturm-schnee-und-glaette-erwartet,0,www.zeit.de,"Wetter: Sturm, Schnee und Glätte erwartet","Hier finden Sie Informationen zu dem Thema „Wetter“. Lesen Sie jetzt „Sturm, Schnee und Glätte erwartet“.",https://img.zeit.de/news/2026-01/02/sturm-schnee-und-glaette-erwartet-image-group/wide__1300x731,2026-01-02T07:23:15Z,,"Sachsen, Sachsen-Anhalt und Thüringen geraten unter den Einfluss eines kräftigen Sturmtiefs. Nach Angaben des Deutschen Wetterdienstes (DWD) strömt kalte Meeresluft in die drei Bundesländer. 
Verbre… [+854 chars]",,de,'Schnee'
https://www.zeit.de/news/2026-01/02/erste-ski-und-rodellifte-im-harz-laufen,https://www.zeit.de/news/2026-01/02/erste-ski-und-rodellifte-im-harz-laufen,0,www.zeit.de,Genügend Schnee: Erste Ski- und Rodellifte im Harz laufen,Hier finden Sie Informationen zu dem Thema „Genügend Schnee“. Lesen Sie jetzt „Erste Ski- und Rodellifte im Harz laufen“.,https://img.zeit.de/news/2026-01/02/erste-ski-und-rodellifte-im-harz-laufen-image-group/wide__1300x731,2026-01-02T08:15:18Z,,"Die ersten Ski- und Rodellifte im Harz haben den Betrieb aufgenommen. Rodler kommen in Torfhaus sowie in Braunlage an der Rathauswiese auf ihre Kosten; Skifahrer nur in Braunlage, wie die Betreiber m… [+976 chars]",,de,'Schnee'
https://www.zeit.de/news/2026-01/02/winterwetter-mit-wind-und-schnee-in-mv,https://www.zeit.de/news/2026-01/02/winterwetter-mit-wind-und-schnee-in-mv,0,www.zeit.de,Wetter: Winterwetter mit Wind und Schnee in MV,Hier finden Sie Informationen zu dem Thema „Wetter“. Lesen Sie jetzt „Winterwetter mit Wind und Schnee in MV“.,https://img.zeit.de/news/2026-01/02/winterwetter-mit-wind-und-schnee-in-mv-image-group/wide__1300x731,2026-01-02T10:18:06Z,,"Schneefall in Teilen des Landes und kräftiger Wind haben den ersten Arbeitstag des neuen Jahres begleitet. An einige Orten musste die Feuerwehr ausrücken, um umgestürzte Bäume von der Straße zu räume… [+1042 chars]",,de,'Winter'
https://www.zeit.de/news/2026-01/02/erste-langlauf-loipe-im-thueringer-wald,https://www.zeit.de/news/2026-01/02/erste-langlauf-loipe-im-thueringer-wald,0,www.zeit.de,Winter im Thüringer Wald: Erste Langlauf-Loipe im Thüringer Wald,Hier finden Sie Informationen zu dem Thema „Winter im Thüringer Wald“. Lesen Sie jetzt „Erste Langlauf-Loipe im Thüringer Wald“.,https://img.zeit.de/news/2026-01/02/erste-langlauf-loipe-im-thueringer-wald-image-group/wide__1300x731,2026-01-02T10:27:20Z,,"Die Wintersportbedingungen im Thüringer Wald werden besser. Die erste Langlaufloipe mit rund acht Kilometern Länge ist bei Oberhof gespurt worden, wie aus Angaben des Regionalverbunds Thüringer Wald … [+756 chars]",,de,'Schnee'
https://www.morgenpost.de/politik/article410816239/heizen-heizung-energie-tanken-preis-kosten-co2-preis-gestiegen.html,https://www.morgenpost.de/politik/article410816239/heizen-heizung-energie-tanken-preis-kosten-co2-preis-gestiegen.html,0,www.morgenpost.de,Höherer CO2-Preis ist da: Wird Heizen und Tanken jetzt teurer,Zum Jahreswechsel ist der CO2-Preis einmal mehr gestiegen. Auswirkungen hat das unter anderem auf Heizkosten und die Preise an den Tankstellen.,https://img.sparknews.funkemedien.de/405823056/405823056_1708771550_v16_9_1600.jpeg,2026-01-02T13:46:35Z,,"Das neue Jahr ist da und mit ihm auch ein höherer CO2-Preis in den Bereichen Wohnen und Verkehr. So lief es seit 2021, als der Preis in Deutschland eingeführt wurde, in jedem Jahr. Zum Jahreswechsel … [+6873 chars]",,de,'Heizkosten'
https://www.faz.net/aktuell/wirtschaft/klima-nachhaltigkeit/energieverbrauch-photovoltaik-waechst-aber-insgesamt-stagniert-oekostrom-110813002.html,https://www.faz.net/aktuell/wirtschaft/klima-nachhaltigkeit/energieverbrauch-photovoltaik-waechst-aber-insgesamt-stagniert-oekostrom-110813002.html,0,www.faz.net,"Energieverbrauch: Photovoltaik wächst, aber insgesamt stagniert Ökostrom","Öl, Gas und Kohle machen fast 80 Prozent des Primärenergieverbrauchs aus. Und die Emissionen gehen nicht zurück.",https://media0.faz.net/image/w1200h627/3a6ea1c56810/w3000h1567x0y225o/202612/43601.0.1621484093/ein-mitarbeiter-eines-solar.webp,2026-01-02T14:35:03Z,,"Die fossilen Energieträger dominieren weiterhin den Primärenergieverbrauch in Deutschland. Damit ist der Gesamteinsatz einschließlich der Elektrizität, der Wärme, der Kraftstoffe oder der Kunststoffp… [+3008 chars]",,de,'Kohle'
https://www.n-tv.de/panorama/Der-Winter-ist-da-und-er-will-es-richtig-wissen-id30196922.html,https://www.n-tv.de/panorama/Der-Winter-ist-da-und-er-will-es-richtig-wissen-id30196922.html,0,www.n-tv.de,"Zweistellige Minusgrade: ""Der Winter ist da, und er will es richtig wissen""","Zu Beginn des neuen Jahres hält der Winter Einzug in weiten Teilen Deutschlands. Kräftiger Schneefall, Glätte und außergewöhnlich niedrige Temperaturen sorgen für ein winterliches Wochenende. ntv-Meteorologe Oliver Scheel erklärt im Interview, was genau auf u…",https://www.n-tv.de/img/30196932/1767360478/Img_16_9/1200/Wintereinbruch-in-Essen-NUR-FUeR-REDAKTIONELLE-ZWECKE-EDITORIAL-USE-ONLY-Spaziergaenger-mit-Regenschirm-im-Essener-Stadtgarten-am-Freitag-dem-02-Januar-2026-Wintereinbruch-in-Essen.jpg,2026-01-02T15:13:00Z,,"Zu Beginn des neuen Jahres hält der Winter Einzug in weiten Teilen Deutschlands. Kräftiger Schneefall, Glätte und außergewöhnlich niedrige Temperaturen sorgen für ein winterliches Wochenende. ntv-Met… [+3499 chars]",,de,'Schnee'
https://www.zeit.de/wirtschaft/2026-01/strom-energie-photovoltaik-solar-braunkohle,https://www.zeit.de/wirtschaft/2026-01/strom-energie-photovoltaik-solar-braunkohle,0,www.zeit.de,Stromerzeugung: Solarkraftwerke in Deutschland erzeugen erstmals mehr Strom als Kohle,"Photovoltaikanlagen haben im vergangenen Jahr rund 87 Terawattstunden Strom geliefert. Der Anteil der Kohle am deutschen Strommix fiel dagegen auf 22,4 Prozent.",https://img.zeit.de/wirtschaft/2026-01/strom-energie-photovoltaik-solar-braunkohle-bild/wide__1300x731,2026-01-02T17:42:36Z,,Die Solarkraftwerke in Deutschland haben im vergangenen Jahr erstmals mehr Strom als Braunkraftkohlewerke geliefert. Das geht aus einer Auswertung des Fraunhofer-Instituts für Solar Energiesysteme (F… [+947 chars],,de,'Kohle'
https://www.faz.net/aktuell/wirtschaft/rwe-chef-erwartet-sinkende-strom-und-gaspreise-accg-200404931.html,https://www.faz.net/aktuell/wirtschaft/rwe-chef-erwartet-sinkende-strom-und-gaspreise-accg-200404931.html,0,www.faz.net,Energiekosten: RWE-Chef erwartet sinkende Strom- und Gaspreise,Staatliche Zuschüsse und wachsendes Angebot dämpfen laut Markus Krebber die Energiepreise. Bei der Gasversorgung im Winter sieht der Chef des Energiekonzerns langfristig Risiken.,https://media0.faz.net/image/w1200h627/fcc3bea093e0/w3000h1567x0y111o/202503/43601.0.917413544/markus-krebber.webp,2026-01-03T04:28:30Z,,"Der Chef des Energiekonzerns RWE, Markus Krebber, rechnet mit sinkenden Preisen bei Strom und Gas. Die Großhandelspreise beim Strom seien stabil, sagte Krebber der Rheinischen Post. Da der Staat die … [+1654 chars]",,de,'Winter'
