index,url,valid,domain,title,description,image,published,archive,content,quote,language,keyword
https://www.kino-zeit.de/film-kritiken-trailer-streaming/nord,https://www.kino-zeit.de/film-kritiken-trailer-streaming/nord,0,www.kino-zeit.de,Nord,"Film

 
 
 




 
 Alamode Filmverleih

 
 Nord

 




Schneeblindheit und Depressionen – ein bezaubernd schräger Off-Road-Movie aus Norwegen
Gerade jetzt zur Winterzeit haben die Liftwärter in den Skigebieten wieder alle Hände voll zu tun, um schnee- und …",,2024-06-14T16:41:04Z,,Man mag es kaum glauben und doch ist es wahr: Früher war der dicke Jomar (Anders Baasmo Christiansen) einmal ein erfolgreicher Skirennläufer. Doch nach einem Unfall ist sein Leben gründlich aus der B… [+2694 chars],,de,'Schnee'
https://burgenland.orf.at/stories/3261236/,https://burgenland.orf.at/stories/3261236/,0,burgenland.orf.at,Mobile Teams nehmen Hochwasserschäden auf,"Nach dem extremen Hochwasser der vergangenen Tage geht es nun darum, dass der Schaden festgestellt wird und die vom Land angekündigten Soforthilfen möglichst schnell verteilt werden können. Freitagfrüh wurden die mobilen Teams zur Schadensfeststellung ausgesc…",https://ibs.orf.at/bgl?image=https%3A%2F%2Foekastatic.orf.at%2Fmims%2F2024%2F24%2F86%2Fcrops%2Fw%3D1200%2Ch%3D627%2Cq%3D75%2F2243589_master_852286_240614_bh_schadensmelder_hochwasser_00_00_47_17.jpg%3Fs%3De873c3ea42f136d9e988bf44a269bddbce964fd0,2024-06-14T17:00:00Z,,"Mehr als 2.000 Schadensfälle aus den Bezirken Mattersburg, Oberwart, Güssing und Jennersdorf wurden bis dato an den Landeskrisenstab gemeldet mehr dazu in Schon über 2.000 Schadensmeldungen. Knapp 27… [+3040 chars]",,de,'Hochwasser'
https://www.n-tv.de/politik/23-07-Russland-meldet-Angriff-auf-Gas-Umschlagplatz-in-Kursk--article25016358.html,https://www.n-tv.de/politik/23-07-Russland-meldet-Angriff-auf-Gas-Umschlagplatz-in-Kursk--article25016358.html,0,www.n-tv.de,Ukraine-Krieg im Liveticker: +++ 23:07 Russland meldet Angriff auf Gas-Umschlagplatz in Kursk +++,Lesen Sie alle aktuellen Entwicklungen und Nachrichten über den russischen Angriffskrieg auf die Ukraine im Liveticker von ntv.de.,https://bilder2.n-tv.de/img/incoming/crop23332537/9041326157-cImg_16_9-w1200/Liveticker1-grau-1-Kopie.jpg,2024-06-14T18:30:00Z,,"Die Ukraine beschießt nach russischen Angaben einen Umschlagplatz für russische Gasexporte in Russland. Der Gouverneur der Region Kursk, Alexej Smirnow, teilt auf Telegram mit, die Ukraine habe mehre… [+42357 chars]",,de,'Gas'
https://vorarlberg.orf.at/stories/3261007/,https://vorarlberg.orf.at/stories/3261007/,0,vorarlberg.orf.at,Silvretta-Hochalpenstraße seit heute wieder offen,"Seit heute Morgen, 8.00 Uhr, ist die Silvretta-Hochalpenstraße zwischen Partenen im Montafon und Galtür im Paznauntal wieder geöffnet. Nach wochenlanger Schnee- und Felsräumung und Arbeiten am Fahrbahnbelag wird die Wintersperre um 8.00 Uhr aufgehoben. Die be…",https://ibs.orf.at/vbg?image=https%3A%2F%2Foekastatic.orf.at%2Fmims%2F2024%2F24%2F98%2Fcrops%2Fw%3D1200%2Ch%3D627%2Cq%3D75%2F2241257_master_851298_silvretta-hochalpenstrasse-christoph-schoech-5_1.jpg%3Fs%3D2502f86c443d783b5a10f02c0b84ad65c2a61d0c,2024-06-15T06:34:20Z,,Mitte Juni werden die Schranken in Partenen und Galtür wieder geöffnet und die Route für den öffentlichen Verkehr freigegeben. Die bei Ausflüglerinnen und Ausflüglern beliebte Passroute schlängelt si… [+1753 chars],,de,'Schnee'
https://www.stern.de/gesellschaft/regional/hessen/schifffahrt--diemeltalsperre-feiert-100-jaehriges-jubilaeum-34800458.html,https://www.stern.de/gesellschaft/regional/hessen/schifffahrt--diemeltalsperre-feiert-100-jaehriges-jubilaeum-34800458.html,0,www.stern.de,Schifffahrt: Diemeltalsperre feiert 100-jähriges Jubiläum,Das Bauwerk aus der Kaiserzeit reguliert den Wasserstand der Weser sowie des Mittellandkanals und bietet Schutz vor Hochwasser. Außerdem ist es ein beliebtes Ziel von Ausflüglern.,https://image.stern.de/34800460/t/nO/v1/w1440/r1.7778/-/15--urnnewsmldpacom2009010124061599405403v3w800h600l1530t417r2369b1549jpeg---559608eee076635e.jpg,2024-06-15T06:36:55Z,,"Das Bauwerk aus der Kaiserzeit reguliert den Wasserstand der Weser sowie des Mittellandkanals und bietet Schutz vor Hochwasser. Außerdem ist es ein beliebtes Ziel von Ausflüglern.
Die Diemeltalsperr… [+2374 chars]",,de,'Hochwasser'
https://www.faz.net/aktuell/das-beste-von-faz-plus/wohnungsnot-warum-eltern-fuer-die-eigenen-kinder-ausziehen-19781213.html,https://www.faz.net/aktuell/das-beste-von-faz-plus/wohnungsnot-warum-eltern-fuer-die-eigenen-kinder-ausziehen-19781213.html,0,www.faz.net,Das Beste lesen mit FAZ+: Wählerwanderung und Auszug für die Kinder,Mit unserem Angebot FAZ+ erhalten Sie jeden Monat Zugriff auf mehr als 1000 exklusive Beiträge auf FAZ.NET. Unter anderem auf diese beliebtesten Stücke der Woche.,https://media0.faz.net/ppmedia/aktuell/1676532390/1.9781190/facebook_teaser/in-berlin-tobt-der-kampf-um.jpg,2024-06-15T06:45:42Z,,"Liebe Leserin, lieber Leser, das war eine spannende Recherche mehrerer Kollegen aus unserer Wirtschaftsredaktion, die eine Facette einer derzeit etwas verrückt erscheinenden Welt beleuchtet. Denn Fac… [+4219 chars]",,de,'Kinder'
https://www.zeit.de/news/2024-06/15/angriff-auf-kinder-in-grevesmuehlen,https://www.zeit.de/news/2024-06/15/angriff-auf-kinder-in-grevesmuehlen,0,www.zeit.de,Polizei ermittelt: Angriff auf Kinder in Grevesmühlen,Hier finden Sie Informationen zu dem Thema „Polizei ermittelt“. Lesen Sie jetzt „Angriff auf Kinder: Pegel spricht von rassistischem Motiv“.,https://img.zeit.de/news/2024-06/15/angriff-auf-kinder-in-grevesmuehlen-image-group/wide__1300x731,2024-06-15T09:16:50Z,,Ein Mädchen und ihr Vater sind von einer Gruppe junger Leute in Grevesmühlen (Landkreis Nordwestmecklenburg) leicht verletzt worden. Nach ersten Erkenntnissen waren das achtjährige ghanaische Mädchen… [+861 chars],,de,'Kinder'
https://www.faz.net/aktuell/gesellschaft/kriminalitaet/mutmasslich-rassistischer-angriff-auf-zwei-ghanaische-maedchen-19791319.html,https://www.faz.net/aktuell/gesellschaft/kriminalitaet/mutmasslich-rassistischer-angriff-auf-zwei-ghanaische-maedchen-19791319.html,0,www.faz.net,Mutmaßlich rassistischer Angriff auf zwei ghanaische Mädchen,Eine Gruppe junger Leute soll zwei ghanaische Mädchen in Grevesmühlen attackiert haben. Der Vater und eines der Kinder werden leicht verletzt. Innenminister Pegel verurteilt die Attacke scharf.,https://media1.faz.net/ppmedia/aktuell/gesellschaft/2773208624/1.9791327/facebook_teaser/als-die-polizei-vor-ort.jpg,2024-06-15T10:10:06Z,,Nach Polizeiangaben wurden bei dem Vorfall am Freitagabend gegen 19.30 Uhr ein achtjähriges Mädchen und sein Vater leicht verletzt. Beide wurden mit einem Rettungswagen in ein Krankenhaus gebracht. W… [+872 chars],,de,'Kinder'
https://www.tagesschau.de/inland/gesellschaft/familienbegleiterinnen-osnabrueck-100.html,https://www.tagesschau.de/inland/gesellschaft/familienbegleiterinnen-osnabrueck-100.html,0,www.tagesschau.de,Wie Familienbegleiterinnen in Osnabrück Kindern und Eltern helfen,"Kinder und ihre Familien können durchs soziale Raster fallen, wenn beispielsweise Sprachkenntnisse fehlen. Damit das nicht passiert, kommen in Osnabrück Familienbegleiterinnen zur Hilfe. Mit Erfolg. Von Britta Nareyka.",https://images.tagesschau.de/image/f6dc84bd-5f2a-4110-a963-0b0d953a6449/AAABkAv-fas/AAABjwnlFvA/16x9-1280/familienbegleiterin-hausbesuch-100.jpg,2024-06-15T10:14:50Z,,"Stand: 15.06.2024 12:14 Uhr
Kinder und ihre Familien können durchs soziale Raster fallen, wenn beispielsweise Sprachkenntnisse fehlen. Damit das nicht passiert, kommen in Osnabrück Familienbegleiter… [+4853 chars]",,de,'Kinder'
https://www.zeit.de/news/2024-06/15/pegel-verurteilt-rassistische-attacke-auf-kinder-scharf,https://www.zeit.de/news/2024-06/15/pegel-verurteilt-rassistische-attacke-auf-kinder-scharf,0,www.zeit.de,Mecklenburg-Vorpommern: Pegel verurteilt rassistische Attacke auf Kinder scharf,"Hier finden Sie Informationen zu dem Thema „Mecklenburg-Vorpommern“. Lesen Sie jetzt „Angriff auf Mädchen - Minister: ""rassistisches Motiv""“.",https://img.zeit.de/news/2024-06/15/pegel-verurteilt-rassistische-attacke-auf-kinder-scharf-image-group/wide__1300x731,2024-06-15T10:31:48Z,,Bei einem mutmaßlich rassistischen Angriff in Grevesmühlen (Mecklenburg-Vorpommern) hat eine Gruppe junger Leute ein Mädchen und seinen Vater leicht verletzt. Landesinnenminister Christian Pegel (SPD… [+1069 chars],,de,'Kinder'
"https://www.ndr.de/nachrichten/mecklenburg-vorpommern/Rassistische-Attacke-in-Grevesmuehlen-Jugendliche-verletzen-Achtjaehrige,rassismus290.html","https://www.ndr.de/nachrichten/mecklenburg-vorpommern/Rassistische-Attacke-in-Grevesmuehlen-Jugendliche-verletzen-Achtjaehrige,rassismus290.html",0,www.ndr.de,Zwei ghanaischen Mädchen in Mecklenburg-Vorpommern angegriffen,"In Grevesmühlen in Mecklenburg-Vorpommern hat eine Gruppe Jugendlicher zwei ghanaische Mädchen offenbar rassistisch beleidigt, attackiert und verletzt. Die einschreitenden Eltern der Kinder wurden ebenfalls angegriffen.",https://images.tagesschau.de/image/dc13267f-b7a4-4012-aa0b-f048437b930e/AAABhw7Vc3Q/AAABjwnlFvA/16x9-1280/polizei-255.jpg,2024-06-15T11:00:31Z,,"Stand: 15.06.2024 13:00 Uhr
In Grevesmühlen soll am Freitagabend eine Gruppe von rund 20 Jugendlichen zwei Mädchen aus Ghana angegriffen und beleidigt haben. Laut Polizei trat einer der Täter einem … [+2611 chars]",,de,'Kinder'
https://www.bild.de/regional/bayern/hochwasserschutzmauer-2013-versprochen-warum-saufen-wir-trotzdem-ab-66604ed35cdd04521e658894,https://www.bild.de/regional/bayern/hochwasserschutzmauer-2013-versprochen-warum-saufen-wir-trotzdem-ab-66604ed35cdd04521e658894,0,www.bild.de,Nach Hochwasser in Straubing - Wann kommt endlich unsere Schutzmauer?,"Die Anwohner von Straubing wollen, dass nach dem schweren Hochwasser das politische Versprechen von 2013 für eine Schutzmauer endlich eingelöst wird.","https://images.bild.de/66604ed35cdd04521e658894/97e6ab4ccbe1f2fc1a0e7687fde83a30,517cb42a?w=1280",2024-06-15T14:35:24Z,,"Straubing (Bayern) Mit Sandsäcken, Eimern und Pumpen kämpfte Daniel Todut (37) verzweifelt gegen die Fluten! Er wohnt direkt an der Donau. Das Wasser nahm sich erst seinen Garten und strömte dann una… [+2853 chars]",,de,'Hochwasser'
https://www.zeit.de/wissen/geschichte/2024-06/maya-menschenopfer-studie-zwillinge-gott-mexiko,https://www.zeit.de/wissen/geschichte/2024-06/maya-menschenopfer-studie-zwillinge-gott-mexiko,0,www.zeit.de,Maya: Kinderherzen für die Götter,Die Maya töteten kleine Kinder in grausamen Opferriten. Neue Genanalysen zeigen: Erstaunlich oft starben männliche Zwillinge. Und die Genome der Toten verraten noch mehr.,https://img.zeit.de/wissen/geschichte/2024-06/maya-menschenopfer-studie-zwillinge-gott-mexiko-bild-1/wide__1300x731,2024-06-15T15:56:10Z,,"Inhalt
Auf einer Seite lesen
 Inhalt
<ol><li>Seite 1Kinderherzen für die Götter
</li><li>Seite 2Eineiige Zwillinge wie in der Sage</li></ol>
""Dass einem kleinen Kind das pochende Herz aus der Br… [+4891 chars]",,de,'Kinder'
https://www.maclife.de/news/haste-keine-kohle-denk-halt-selbst-mac-life-100124093.html,https://www.maclife.de/news/haste-keine-kohle-denk-halt-selbst-mac-life-100124093.html,0,www.maclife.de,Haste keine Kohle? Denk halt selbst!,KI soll zur Cashcow für die verschiedensten Technologien werden. Basteln die Unternehmen gerade an einer neuen Zweiklassengesellschaft? (Weiterlesen),https://www.maclife.de/media/maclife/styles/tec_frontend_opengraph/public/images/editors/2024_24/image-124093--4612295.jpeg?itok=HyjDvMos,2024-06-15T17:39:11Z,,"Wie lassen sich heute eigentlich Computer verkaufen?
Das ist eine durchaus berechtigte Frage. Denn immerhin ist der Markt mehr als gesättigt. Ob Unternehmen, Organisationen, Universitäten, Schulen u… [+707 chars]",,de,'Kohle'
https://www.zeit.de/news/2024-06/15/schwesig-entsetzt-ueber-angriff-auf-kinder-in-grevesmuehlen,https://www.zeit.de/news/2024-06/15/schwesig-entsetzt-ueber-angriff-auf-kinder-in-grevesmuehlen,0,www.zeit.de,Ministerpräsidentin: Schwesig entsetzt über Angriff auf Kinder in Grevesmühlen,Hier finden Sie Informationen zu dem Thema „Ministerpräsidentin“. Lesen Sie jetzt „Schwesig entsetzt über Angriff auf Kinder in Grevesmühlen“.,https://img.zeit.de/news/2024-06/15/schwesig-entsetzt-ueber-angriff-auf-kinder-in-grevesmuehlen-image-group/wide__1300x731,2024-06-15T19:07:47Z,,"Mecklenburg-Vorpommerns Ministerpräsidentin Manuela Schwesig (SPD) hat sich entsetzt über den mutmaßlich rassistischen Angriff auf zwei ghanaische Kinder in Grevesmühlen gezeigt. ""Das verletzte Mädch… [+1151 chars]",,de,'Kinder'
https://www.kicker.de/sosa-nach-kroaten-debakel-das-war-ein-blackout-1032279/video,https://www.kicker.de/sosa-nach-kroaten-debakel-das-war-ein-blackout-1032279/video,0,www.kicker.de,"Sosa nach Kroaten-Debakel: ""Das war ein Blackout""","Video: Nach der 0:3 Niederlage gegen Spanien gab sich Kroatiens Borna Sosa enttäuscht. Der Ex-Stuttgarter wurde in der Partie nicht eingesetzt, fordert aber trotzdem von seinen Mannschaftskollegen mehr Fokus für die nächsten Spiele, die Stimmung lobte er alle…",https://derivates.kicker.de/image/upload/c_crop%2Cx_0%2Cy_193%2Cw_3500%2Ch_1969/w_1200%2Cq_auto/v1/2024/06/15/2a952048-cde5-494f-81ed-9554464b8715.jpeg,2024-06-15T20:29:36Z,,"Werbung und Tracking: Um dir relevante Inhalte und personalisierte Werbung anzubieten, setzen wir Cookies und andere Technologien ein. Damit messen wir, wie und womit du unsere Angebote nutzt. Diese … [+1979 chars]",,de,'Blackout'
https://www.zeit.de/gesellschaft/schule/2024-06/handynutzung-schulen-verbot-smartphone-sucht-jugendliche-bildschirmzeit,https://www.zeit.de/gesellschaft/schule/2024-06/handynutzung-schulen-verbot-smartphone-sucht-jugendliche-bildschirmzeit,0,www.zeit.de,Handynutzung in Schulen: Nehmt den Schülern die Handys weg!,Smartphones müssen endlich aus Schulen verbannt werden. Zum Schutz der Kinder. Doch für ein Verbot braucht es Lehrkräfte mit Autorität – und die richtigen Gesetze.,https://img.zeit.de/gesellschaft/schule/2024-06/handynutzung-schulen-verbot-smartphone-sucht-jugendliche-bildschirmzeit-bild/wide__1300x731,2024-06-16T04:25:57Z,,"Kinder verbringen zu viel Zeit am Smartphone. Nicht alle Kinder, aber zu viele. Auch Erwachsene sind süchtig, der Autor dieses Kommentars eingeschlossen. Aber Erwachsene tun viele Dinge, die sie mit … [+420 chars]",,de,'Kinder'
https://steiermark.orf.at/stories/3261337/,https://steiermark.orf.at/stories/3261337/,0,steiermark.orf.at,Wasserrettung trainiert für den Ernstfall,"Dass ruhige Bäche zu reißenden Flüssen werden können, haben die vergangenen Wochen in der Steiermark einmal mehr gezeigt. Die Wasserrettung probt am Sonntag in der Salza für den Ernstfall: Es gilt eine lebende Person aus dem Hochwasser führenden Fluss zu rett…",https://ibs.orf.at/stm?image=https%3A%2F%2Foekastatic.orf.at%2Fmims%2F2019%2F24%2F89%2Fcrops%2Fw%3D1200%2Ch%3D627%2Cq%3D75%2F179777_master_46189_bade.jpg%3Fs%3D34bfb768271402ff2abdfa11204de6a964cc3c60,2024-06-16T05:30:00Z,,"Der Campingplatz Wildalpen ist Ausgangspunkt der Übung. Rund ein Drittel der 120 steirischen Strömungsretter wird in die reißende Salza springen, um eine Person aus dem Fluss zu retten. Dabei müssen … [+1419 chars]",,de,'Hochwasser'
https://www.n-tv.de/politik/Russland-hat-so-viele-Kraftwerke-in-der-Ukraine-zerstoert-dass-die-Haelfte-der-Stromproduktion-ausgefallen-ist-Fuer-den-Winter-sollen-Frankenstein-Einheiten-helfen-article25015701.html,https://www.n-tv.de/politik/Russland-hat-so-viele-Kraftwerke-in-der-Ukraine-zerstoert-dass-die-Haelfte-der-Stromproduktion-ausgefallen-ist-Fuer-den-Winter-sollen-Frankenstein-Einheiten-helfen-article25015701.html,0,www.n-tv.de,"Stromnot durch russische Raketen: Für den Winter baut die Ukraine ""Frankenstein-Einheiten""","Russland hat so viele Kraftwerke in der Ukraine zerstört, dass die Hälfte der Stromproduktion ausgefallen ist. Das ist schon jetzt schwierig, im Sommer - im Winter könnte es katastrophal werden. Deshalb muss improvisiert werden.",https://bilder4.n-tv.de/img/incoming/crop25015807/6391328407-cImg_16_9-w1200/460776070.jpg,2024-06-16T06:32:44Z,,"Russland hat so viele Kraftwerke in der Ukraine zerstört, dass die Hälfte der Stromproduktion ausgefallen ist. Das ist schon jetzt schwierig, im Sommer - im Winter könnte es katastrophal werden. Dmyt… [+12368 chars]",,de,'Winter'
https://www.faz.net/aktuell/wirtschaft/lisa-paus-die-jugend-entzieht-uns-das-vertrauen-19791466.html,https://www.faz.net/aktuell/wirtschaft/lisa-paus-die-jugend-entzieht-uns-das-vertrauen-19791466.html,0,www.faz.net,Die Jugend entzieht uns das Vertrauen,Warum wir dringend einen weiterentwickelten Generationenvertrag brauchen. Ein Gastbeitrag der Bundesfamilienministerin.,https://media1.faz.net/ppmedia/aktuell/politik/1812906549/1.9647705/facebook_teaser/lisa-paus-buendnis-90-die.jpg,2024-06-16T08:25:21Z,,"Dass sich das Potenzial für rechtsextremistische Einstellungen in der jungen Generation verstärkt, ist besorgniserregend, und entspricht leider einer Entwicklung in allen Altersgruppen. Auch wählen j… [+13286 chars]",,de,'Gas'
https://www.stern.de/sport/motorsport-klassiker--die-bittere-le-mans-premiere-fuer-mick-schumacher-34801996.html,https://www.stern.de/sport/motorsport-klassiker--die-bittere-le-mans-premiere-fuer-mick-schumacher-34801996.html,0,www.stern.de,Motorsport-Klassiker: Die bittere Le-Mans-Premiere für Mick Schumacher,"So sollte es nicht enden. Statt mit den Teamkollegen weiter Gas zu geben, saß Mick Schumacher schon wieder im Flieger. Ein Motordefekt stoppte beide Alpines. Es gab aber auch Positives.",https://image.stern.de/34801998/t/Ci/v4/w1440/r1.7778/-/16--urnnewsmldpacom2009010124061299363797v4w800h600l529t715r1670b1481jpeg---25771dd5c3e06afc.jpg,2024-06-16T08:44:39Z,,"So sollte es nicht enden. Statt mit den Teamkollegen weiter Gas zu geben, saß Mick Schumacher schon wieder im Flieger. Ein Motordefekt stoppte beide Alpines. Es gab aber auch Positives.
Während der … [+3563 chars]",,de,'Gas'
https://www.zeit.de/2024/26/simone-sommerland-kinderlieder-musik-konzert-saengerin,https://www.zeit.de/2024/26/simone-sommerland-kinderlieder-musik-konzert-saengerin,0,www.zeit.de,Simone Sommerland: Wer ist die erfolgreichste Musikerin im ganzen Land?,"Mit Hits wie ""Aram sam sam"" und ""Hatschi, Hatschi"" bricht Simone Sommerland alle Chart-Rekorde. Kinder geraten in Ekstase. Eltern, na ja. Das Geheimnis? Eher ein Versehen",https://img.zeit.de/2024/26/simone-sommerland-musikerin-kinder-teaser/wide__1300x731,2024-06-16T10:04:29Z,,"Die erfolgreichste Musikerin Deutschlands aller Zeiten hopst auf die Bühne des Eurogress Aachen, in der Hand ein roter Luftballon. Draußen ist es noch Tag, in der Konzerthalle schon Nacht.
""Seid ihr… [+560 chars]",,de,'Kinder'
https://www.zeit.de/gesellschaft/2024-06/angriff-mecklenburg-vorpommern-rassistische-gewalt,https://www.zeit.de/gesellschaft/2024-06/angriff-mecklenburg-vorpommern-rassistische-gewalt,0,www.zeit.de,Rassismus: Offenbar rassistische Gesänge und Angriff bei Fest nahe Stettin,Nach dem Angriff auf zwei Kinder aus Ghana hat es in Mecklenburg-Vorpommern einen neuen Vorfall gegeben. Laut Polizei wurde nach rassistischem Gesang ein Mann attackiert.,https://img.zeit.de/gesellschaft/2024-06/angriff-mecklenburg-vorpommern-rassistische-gewalt-bild/wide__1300x731,2024-06-16T10:51:21Z,,Bei einer Auseinandersetzung wegen rassistischer Parolen auf einer Festwiese im mecklenburg-vorpommerischen Penkun ist ein Mann von mehreren Personen angegriffen worden. Zeugen zufolge hatten mehrere… [+1762 chars],,de,'Kinder'
https://www.welt.de/wissenschaft/plus252051872/Unwetter-Nie-war-die-Welt-sicherer-vor-Wetterextremen.html,https://www.welt.de/wissenschaft/plus252051872/Unwetter-Nie-war-die-Welt-sicherer-vor-Wetterextremen.html,0,www.welt.de,Nie war die Welt sicherer vor Wetterextremen,"Stürme, Fluten, Kälte, Dürre: Die Zahl der Toten durch Wetterextreme ist seit dem 19. Jahrhundert drastisch zurückgegangen – und das trotz eines gestiegenen Klima-Risikos. Warum selbst in armen Ländern wie Bangladesch die Menschen heute sicherer sind als früh…",https://img.welt.de/img/wissenschaft/mobile252054662/6531355287-ci16x9-w1200-fnov-fpotl-fpi157750653/Kombo-Bojanowski-Pakistan.jpg,2024-06-16T10:54:13Z,,"Die WELT als ePaper: Die vollständige Ausgabe steht Ihnen bereits am Vorabend zur Verfügung so sind Sie immer hochaktuell informiert. Weitere Informationen: http://epaper.welt.de 
 Der Kurz-Link die… [+49 chars]",,de,'Kälte'
https://www.bild.de/sport/fussball/zu-geizig-so-verpennt-drittligist-1-fc-saarbruecken-gute-transfers-666ec3c89b20f8498330fc55,https://www.bild.de/sport/fussball/zu-geizig-so-verpennt-drittligist-1-fc-saarbruecken-gute-transfers-666ec3c89b20f8498330fc55,0,www.bild.de,Trotz Pokal-Kohle zu geizig? - So verpennt Saarbrücken die guten Transfers,Zehn Abgänge hat Drittligist 1. FC Saarbrücken in dieser Transferperiode schon zu verzeichnen. Fünf Neue sind erst da – und die Konkurrenz kauft eifrig ein!,"https://images.bild.de/666ec3c89b20f8498330fc55/47cdae7aad54ac05e8441fbf806ad3d3,b628656b?w=1280",2024-06-16T13:22:18Z,,"Der 1. FC Saarbrücken will in der kommenden Saison endlich den Aufstieg in die 2. Liga schaffen. Aber während die Konkurrenz hochkarätige Verpflichtungen tätigt, geht es bei den Saarländern bemerkens… [+186 chars]",,de,'Kohle'
https://www.pcgames.de/Spiele-Thema-239104/Specials/aktuell-die-besten-Action-Adventures-2024-einkaufsfuehrer-kaufen-1449556/,https://www.pcgames.de/Spiele-Thema-239104/Specials/aktuell-die-besten-Action-Adventures-2024-einkaufsfuehrer-kaufen-1449556/,0,www.pcgames.de,Einkaufsführer 2024: Die besten Action-Adventures für PC und aktuelle Konsolen,"Göttliche Action, riesige Welten, fesselnde Geschichten: Wir stellen euch zehn erstklassige Action-Adventures für PC, Xbox Series S/X, PS5 und Switch vor, die eure Kohle und eure Zeit wirklich wert sind.",https://www.pcgames.de/screenshots/original/2021/06/GodofWar-PCGAMES-PS4-Special-038-pc-games_artwork2.jpg,2024-06-16T14:12:00Z,,"Eines ist sicher, seit es Videospiele gibt: Der Wunsch nach immer neuen, immer großartigeren Action-Adventures reißt einfach nicht ab. Jahr für Jahr versuchen sich die Entwicklerstudios gegenseitig z… [+6382 chars]",,de,'Kohle'
https://www.horizont.net/marketing/nachrichten/exklusivstudie-haribo-erobert-spitzenposition-unter-deutschlands-werbelieblingen-zurueck-220616,https://www.horizont.net/marketing/nachrichten/exklusivstudie-haribo-erobert-spitzenposition-unter-deutschlands-werbelieblingen-zurueck-220616,0,www.horizont.net,Exklusivstudie: Haribo erobert Spitzenposition unter Deutschlands Werbelieblingen zurück,Im Winter verlor Haribo seine Vormachtstellung unter Deutschlands Werbelieblingen an Amazon und rutschte sogar aus den Top 10. Doch die Wachablösung in der Weihnachtszeit war nur vorübergehend. Jetzt erobert Haribo den Thron zurück.,https://www.horizont.net/news/media/45/Haribo-Goldbren-441958.jpeg,2024-06-16T22:53:00Z,,Im Winter verlor Haribo seine Vormachtstellung unter Deutschlands Werbelieblingen an Amazon und rutschte sogar aus den Top 10. Doch die Wachablösung in der Weihnachtszeit war nur vorübergehend. Jetzt… [+420 chars],,de,'Winter'
https://www.zeit.de/politik/deutschland/2024-06/verbaende-druck-verbot-werbung-suessigkeiten-lebensmittel,https://www.zeit.de/politik/deutschland/2024-06/verbaende-druck-verbot-werbung-suessigkeiten-lebensmittel,0,www.zeit.de,Ernährung: Verbände machen Druck bei Werbeverbot für ungesunde Lebensmittel,"Um Kinder zu schützen, soll TV-Reklame für Süßigkeiten und Snacks zu bestimmten Uhrzeiten verboten werden. Zuletzt stockte das Vorhaben. Die FDP hatte es kritisiert.",https://img.zeit.de/politik/deutschland/2024-06/verbaende-druck-verbot-werbung-suessigkeiten-lebensmittel-bild/wide__1300x731,2024-06-17T05:36:41Z,,"Kinder sollen so schnell wie möglich vor Werbung für ungesunde Lebensmittel geschützt werden. Das fordert ein Bündnis von 35 Organisationen aus Medizin, Wissenschaft sowie Verbraucher- und Kinderschu… [+2296 chars]",,de,'Kinder'
https://www.focus.de/panorama/nach-kritik-britischer-fussballfans-em-spielort-gelsenkirchen-wie-sich-die-ruhrpott-stadt-gegen-armutszuwanderer-wehrt_id_260055942.html,https://www.focus.de/panorama/nach-kritik-britischer-fussballfans-em-spielort-gelsenkirchen-wie-sich-die-ruhrpott-stadt-gegen-armutszuwanderer-wehrt_id_260055942.html,0,www.focus.de,Nach Kritik britischer Fußballfans - EM-Spielort Gelsenkirchen: So wehrt sich die Ruhrpott-Stadt gegen Armutszuwanderer,"Ist die „Drecksloch“-Kritik an Gelsenkirchen berechtigt? Nach dem Kohle-Aus erlebte die Stadt eine Abwanderungswelle. Folgen: Wohnungsleerstand, Verwahrlosung, Armutszuwanderung. FOCUS online schaute sich vor einiger Zeit um. Geändert hat sich wenig.Von FOCUS…",https://p6.focus.de/img/fotos/id_180451371/kastn.png?im=Crop%3D%28322%2C0%2C3690%2C1845%29%3BResize%3D%281200%2C627%29&impolicy=perceptual&quality=mediumHigh&hash=255777fb6c86f350eb7d81d61c09e515a7bf612e000c93f3335011c26903ce4a,2024-06-17T09:31:09Z,,"<ul><li>
Kommentare</li><li>
E-Mail</li><li>
Teilen</li><li>
Mehr</li><li>
Twitter</li><li>
Drucken</li><li>
Feedback</li><li>
Fehler meldenSie haben einen Fehler gefunden?
Bitte markieren S… [+13450 chars]",,de,'Kohle'
