index,url,valid,domain,title,description,image,published,archive,content,quote,language,keyword
https://taz.de/Sorge-um-Gasvorraete/!6152907/,https://taz.de/Sorge-um-Gasvorraete/!6152907/,0,taz.de,Sorge um Gasvorräte: Der nächste Winter könnte teuer werden,"Die Gasspeicher leeren sich. Weil sich die Preisstruktur auf dem Markt verändert hat, haben Händler kein Interesse an einer schnellen Wiederbefüllung.",https://taz.de/picture/8240505/1200/Gasspeicher-Deutschland.jpeg,2026-02-10T18:38:00Z,,"Die Gasspeicher leeren sich. Weil sich die Preisstruktur auf dem Markt verändert hat, haben Händler kein Interesse an einer schnellen Wiederbefüllung. mehr...",,de,'Winter'
https://www.stern.de/gesellschaft/sauna--hausverbot-fuer-alle-schwaetzer--fluesterer-und-rumraschler--37099486.html,https://www.stern.de/gesellschaft/sauna--hausverbot-fuer-alle-schwaetzer--fluesterer-und-rumraschler--37099486.html,0,www.stern.de,Humor: Schnauze! Wir brauchen dringend ein knallhartes Sauna-Gesetz,"Winter! Herrlich, jetzt in der Sauna zu entspannen. Geht nur leider nicht. Wegen der Menschen und ihrer verdammten Geräusche. Höchste Zeit für drakonische Sauna-Vorschriften.",https://image.stern.de/37099490/t/Ga/v2/w1440/r1.7778/-/sauna-symbolfoto.jpg,2026-02-10T19:18:00Z,,"Kopiere den aktuellen Link
Zur Merkliste hinzufügen
Winter! Herrlich, jetzt in der Sauna zu entspannen. Geht nur leider nicht. Wegen der Menschen und ihrer verdammten Geräusche. Höchste Zeit für dr… [+4257 chars]",,de,'Winter'
https://www.bild.de/sport/fussball/mainz-05-darum-hofft-becker-auf-den-sieg-der-conference-league-698b62609501f81648ced72a,https://www.bild.de/sport/fussball/mainz-05-darum-hofft-becker-auf-den-sieg-der-conference-league-698b62609501f81648ced72a,0,www.bild.de,Mainzer Neu-Stürmer spricht - Darum hofft Becker auf Conference-League-Sieg,"Er ist der 4. Neue in Mainz und kommt wie die anderen Winter-Einkäufe Tietz, Silas und Posch mit viel Bundesliga-Erfahrung. Hier spricht Sheraldo Becker.","https://images.bild.de/698b62609501f81648ced72a/c94a7c4311917797657e0417fb4ca063,3af3616c?w=1280",2026-02-10T20:20:10Z,,"TTS-Player überspringenArtikel weiterlesenEr ist der vierte Neue in Mainz und kommt wie die anderen Winter-Einkäufe Phillip Tietz (28), Silas (27) und Stefan Posch (28) mit viel Bundesliga-Erfahrung:… [+2437 chars]",,de,'Winter'
https://www.focus.de/sport/olympische-winterspiele/zdf-experte-wird-bei-deutschem-olympia-drama-emotional_df831357-74cb-4ef0-93ae-df9d478cc03e.html,https://www.focus.de/sport/olympische-winterspiele/zdf-experte-wird-bei-deutschem-olympia-drama-emotional_df831357-74cb-4ef0-93ae-df9d478cc03e.html,0,www.focus.de,ZDF-Experte wird bei deutschem Olympia-Drama emotional,Was für Emotionen – und das parallel und leider mit unterschiedlichem Finale. An Tag drei der Olympischen Winterspiele wurden zeitgleich zwei Wettkämpfe für die deutschen Fans zu Nervenkrimis.,https://quadro.burda-forward.de/ctf/40d3d6df-a184-44ea-a8de-e9159d69dbef.40ca5286-69ae-4475-865b-deab575408de.jpg?im=RegionOfInterestCrop%3D%281200%2C630%29%2CregionOfInterest%3D%281812%2C1129%29&hash=e30acef2ed03434c05bd6ef259907ac490927bb04182fa9fcbc6024c0e69aefb,2026-02-10T20:50:00Z,,Die ZDF-Kommentatoren spielten atemlos Pingpong. Denn innerhalb weniger Minuten entwickelten sich bei den Olympischen Winterspielen in Cortina d'Ampezzo und im knapp 50 Kilometer entfernten Antholz z… [+4402 chars],,de,'Winter'
https://www.welt.de/vermischtes/article698b97e1830250c46b919125/estland-eroeffnet-20-kilometer-lange-eisstrasse-fuer-autos-ueber-zugefrorenes-meer.html,https://www.welt.de/vermischtes/article698b97e1830250c46b919125/estland-eroeffnet-20-kilometer-lange-eisstrasse-fuer-autos-ueber-zugefrorenes-meer.html,0,www.welt.de,Estland eröffnet 20 Kilometer lange „Eisstraße“ für Autos über zugefrorenes Meer,"Weil der Fährverkehr zwischen zweier Inseln durch das Winterwetter eingeschränkt ist, macht Estland aus der Not eine Tugend. Nun kann man mit dem Auto über das zugefrorene Meer fahren",https://images.welt.de/698b97e1830250c46b919125/1dfe4631e94fabda04e0b1c5d73e649f-master/ci16x9-w1200/apdpa-32b8940016804ca8-jpg,2026-02-10T20:55:50Z,,"Weil der Fährverkehr zwischen zweier Inseln durch das Winterwetter eingeschränkt ist, macht Estland aus der Not eine Tugend. Nun kann man mit dem Auto über das zugefrorene Meer fahrenWegen der frosti… [+2749 chars]",,de,'Winter'
https://www.stern.de/wirtschaft/news/klimaschutz--studie--weniger-rueckhalt-fuer-die-energiewende-37125616.html,https://www.stern.de/wirtschaft/news/klimaschutz--studie--weniger-rueckhalt-fuer-die-energiewende-37125616.html,0,www.stern.de,Klimaschutz: Studie: Weniger Rückhalt für die Energiewende,Fossile Energieträger wie Kohle und Gas sollen in Deutschland schrittweise durch erneuerbare Energien ersetzt werden - für mehr Klimaschutz. Doch in der Bevölkerung gibt es Skepsis.,https://image.stern.de/37125618/t/sy/v1/w1440/r1.7778/-/11--f3o4eqiu5wv7axs2048jpeg---f5b63e677ea55fca.jpg,2026-02-11T03:00:36Z,,"Kopiere den aktuellen Link
Zur Merkliste hinzufügen
Fossile Energieträger wie Kohle und Gas sollen in Deutschland schrittweise durch erneuerbare Energien ersetzt werden - für mehr Klimaschutz. Doch… [+2397 chars]",,de,'Gas'
https://www.stern.de/gesellschaft/regional/bayern/wetter-in-bayern--regen-und-milde-temperaturen---ueberschwemmungsgefahr-37125824.html,https://www.stern.de/gesellschaft/regional/bayern/wetter-in-bayern--regen-und-milde-temperaturen---ueberschwemmungsgefahr-37125824.html,0,www.stern.de,Wetter in Bayern: Regen und milde Temperaturen - Überschwemmungsgefahr,München (lby) - Nach dem Schnee der letzten Wochen kommt nun das Tauwetter. Laut dem Deutschen Wetterdienst (DWD) soll es heute in ganz Bayern regnen.,https://image.stern.de/37125826/t/ow/v1/w1440/r1.7778/-/11--6mrv45p5h2v7axs2048jpeg---43d856ea15915e8f.jpg,2026-02-11T06:09:46Z,,"Kopiere den aktuellen Link
Zur Merkliste hinzufügen
Tauwetter und Regen bestimmen das Wetter in Bayern. Die Behörden warnen besonders im Norden vor Hochwasser und Überschwemmungen.
Nach dem Schnee… [+1059 chars]",,de,'Schnee'
https://www.stern.de/gesellschaft/regional/baden-wuerttemberg/prognose--unwetterwarnung--dauerregen-und-hochwassergefahr-im-land-37125888.html,https://www.stern.de/gesellschaft/regional/baden-wuerttemberg/prognose--unwetterwarnung--dauerregen-und-hochwassergefahr-im-land-37125888.html,0,www.stern.de,Prognose: Unwetterwarnung: Dauerregen und Hochwassergefahr im Land,"Nicht nur für Fasnet-Fans heißt es nun: Regenjacke statt Sonnenbrille. Kaum Sonne, dafür viel Wind und noch mehr Regen. Und die Schneeschmelze kann an manchen Orten zur Gefahr werden.",https://image.stern.de/37125890/t/Dm/v1/w1440/r1.7778/-/11--rx6oaun732v3axs2048jpeg---5056b28cc636058f.jpg,2026-02-11T07:01:21Z,,"Kopiere den aktuellen Link
Zur Merkliste hinzufügen
Nicht nur für Fasnet-Fans heißt es nun: Regenjacke statt Sonnenbrille. Kaum Sonne, dafür viel Wind und noch mehr Regen. Und die Schneeschmelze ka… [+1909 chars]",,de,'Schnee'
https://www.sueddeutsche.de/bayern/bayern-wetter-regen-li.3385668,https://www.sueddeutsche.de/bayern/bayern-wetter-regen-li.3385668,0,www.sueddeutsche.de,Wetter in Bayern: Regen und milde Temperaturen – Überschwemmungsgefahr,Tauwetter und Regen bestimmen das Wetter im Freistaat. Die Behörden warnen besonders im Norden vor Hochwasser und Überschwemmungen.,https://www.sueddeutsche.de/2026/02/11/22198785-210e-4de6-bb0e-fe4badbca37e.jpg?q=60&fm=webp&width=1200&rect=0%2C209%2C4000%2C2250,2026-02-11T07:31:22Z,,"Von Aschaffenburg bis Berchtesgaden: Das Bayern-Team der SZ ist im gesamten Freistaat für Sie unterwegs. Hier entlang, wenn Sie Geschichten, News und Hintergründe direkt aufs Handy bekommen möchten.… [+772 chars]",,de,'Hochwasser'
https://www.sueddeutsche.de/bayern/bayern-wetter-regen-hochwasser-franken-li.3385668,https://www.sueddeutsche.de/bayern/bayern-wetter-regen-hochwasser-franken-li.3385668,0,www.sueddeutsche.de,Hochwassergefahr in Bayern: Schneeschmelze und Regen lassen in Franken die Wasserstände steigen,Tauwetter und Regen bestimmen das Wetter im Freistaat. Die Behörden warnen besonders im Norden vor Hochwasser und Überschwemmungen.,https://www.sueddeutsche.de/2025/09/22/f95620ac-5649-470c-ab1d-86d5c46bd7e6.jpg?q=60&fm=webp&width=1200&rect=0%2C206%2C4000%2C2250,2026-02-11T10:09:00Z,,Mit dem Tauwetter steigen die Wasserstände der Bäche und Flüsse damit steigt auch die Überflutungsgefahr. Vor allem in Franken sind mittlerweile einige Wiesen und Straßen überschwemmt. Der Regen tut … [+1758 chars],,de,'Schnee'
https://www.bild.de/sport/olympia/monatsgehaelter-unserer-olympia-stars-enthuellt-gold-helden-liegen-zwischen-9-000-18-000-euro-top-verdiener-kriegt-1-16-mio-698c1fcc332510962831e153,https://www.bild.de/sport/olympia/monatsgehaelter-unserer-olympia-stars-enthuellt-gold-helden-liegen-zwischen-9-000-18-000-euro-top-verdiener-kriegt-1-16-mio-698c1fcc332510962831e153,0,www.bild.de,"Top-Verdiener kriegt 1,16 Mio. - Monatsgehälter unserer Olympia-Stars enthüllt","So groß war das Geld-Gefälle im deutschen Olympia-Team noch nie! So viel Kohle kommt durch Förderung, Preisgeld und Sponsoren zusammen.","https://images.bild.de/698c1fcc332510962831e153/640467febe6217a5909c2c3b610bd3ab,c647c4d1?w=1280",2026-02-11T11:00:42Z,,Durch die Eishockey-Profis aus der NHL sind gleich sieben Gehaltsmillionäre bei den Winterspielen dabei. Von solchen Einnahmen können die meisten deutschen Olympia-Teilnehmer nur träumen. Die Mehrhei… [+233 chars],,de,'Kohle'
https://salzburg.orf.at/stories/3341506/,https://salzburg.orf.at/stories/3341506/,0,salzburg.orf.at,Hundewelpen in Schimmel und Kot entdeckt,"Zu einem extremen Fall von Vernachlässigung von Tieren ist es in Oberndorf (Flachgau) gekommen. In einer Wohnungen wurden hier mehrere Hundwelpen. Laut dem Lochener Tierschutzverein Pfotenhilfe lagen sie in Urin, Kot und waren stark von Parasiten befallen.",https://ibs.orf.at/sbg?image=https%3A%2F%2Foekastatic.orf.at%2Fmims%2F2026%2F07%2F40%2Fcrops%2Fw%3D1200%2Ch%3D627%2Cq%3D75%2F2930542_master_1132640_hund1.jpg%3Fs%3Defb8aff9a4deb69dae6ab7f9b5ba8623330260b7,2026-02-11T11:02:34Z,,"Die Welpen seien bei ihrem Fund laut der Tierschutzorganisation in einer stinkenden, verschimmelten Ecke in der Wohnung eingepfercht gewesen. Zudem seien sie in ihrem eigenen Kot und Urin gelegen und… [+875 chars]",,de,'Schimmel'
https://www.zeit.de/news/2026-02/12/hochwasser-in-teilen-bayerns-erwartet,https://www.zeit.de/news/2026-02/12/hochwasser-in-teilen-bayerns-erwartet,0,www.zeit.de,Wetter: Hochwasser in Teilen Bayerns erwartet,Hier finden Sie Informationen zu dem Thema „Wetter“. Lesen Sie jetzt „Hochwasser in Teilen Bayerns erwartet“.,https://img.zeit.de/news/2026-02/12/hochwasser-in-teilen-bayerns-erwartet-image-group/wide__1300x731,2026-02-11T23:43:19Z,,Für einen Teil von Bayern wird weiterhin mit Hochwasser gerechnet. Wegen der bereits gefallenen Niederschläge und des Tauwetters seien die Wasserstände in den Oberläufen der Fließgewässer bereits deu… [+1114 chars],,de,'Hochwasser'
https://www.zeit.de/news/2026-02/12/schneespass-und-schlagloecher-winter-hinterlaesst-spuren,https://www.zeit.de/news/2026-02/12/schneespass-und-schlagloecher-winter-hinterlaesst-spuren,0,www.zeit.de,Auswirkungen des Winters: Schneespaß und Schlaglöcher - Winter hinterlässt Spuren,Hier finden Sie Informationen zu dem Thema „Auswirkungen des Winters“. Lesen Sie jetzt „Schneespaß und Schlaglöcher - Winter hinterlässt Spuren“.,https://img.zeit.de/news/2026-02/12/schneespass-und-schlagloecher-winter-hinterlaesst-spuren-image-group/wide__1300x731,2026-02-12T04:30:06Z,,"Schnee, Frost und Glätte bestimmen seit mehreren Wochen das Wetter in Niedersachsen. Bis zu 20 Zentimeter Schnee bedeckten das Bundesland zwischenzeitlich, wie der Deutsche Wetterdienst mitteilte. Au… [+5258 chars]",,de,'Winter'
https://www.sueddeutsche.de/bayern/bayern-wetter-regen-hochwasser-li.3386300,https://www.sueddeutsche.de/bayern/bayern-wetter-regen-hochwasser-li.3386300,0,www.sueddeutsche.de,Tauwetter kombiniert mit Regen: Hochwasser in Teilen Bayerns erwartet,"Der Pegel Rötz an der Schwarzach in der Oberpfalz soll schon in der Nacht die Meldestufe 1 erreichen und überschreiten. Auch im Unterlauf der Murach steige der Pegel kontinuierlich an, meldet das Wasserwirtschaftsamt Weiden.",https://www.sueddeutsche.de/2026/02/12/b15120a8-8b44-432f-aca4-e50fed0b1f65.jpg?q=60&fm=webp&width=1200&rect=0%2C209%2C4000%2C2250,2026-02-12T07:38:42Z,,"Von Aschaffenburg bis Berchtesgaden: Das Bayern-Team der SZ ist im gesamten Freistaat für Sie unterwegs. Hier entlang, wenn Sie Geschichten, News und Hintergründe direkt aufs Handy bekommen möchten.… [+733 chars]",,de,'Hochwasser'
https://www.tagesspiegel.de/potsdam/brandenburg/gestiegener-wasserstand-an-der-oder-in-frankfurt-besteht-hochwassergefahr-15243211.html,https://www.tagesspiegel.de/potsdam/brandenburg/gestiegener-wasserstand-an-der-oder-in-frankfurt-besteht-hochwassergefahr-15243211.html,0,www.tagesspiegel.de,"Brüchiges Eis, steigender Wasserstand: Hochwassergefahr in Frankfurt (Oder)",Auf der Oder wächst die Gefahr von plötzlichen Wasserstands-Anstiegen. Für Frankfurt (Oder) gibt es eine Hochwasserwarnung.,https://www.tagesspiegel.de/images/15243210/alternates/BASE_16_9_W1400/1770886300000/eis-auf-der-oder.jpeg,2026-02-12T08:51:40Z,,"In Frankfurt (Oder) besteht Hochwassergefahr. Da die Eisdecke auf der Oder brüchig wird und es zu Verschiebungen kam, stieg der Wasserstand stark. Am Morgen lag er bei über 4 Metern. Das Landesamt fü… [+740 chars]",,de,'Hochwasser'
https://www.zeit.de/news/2026-02/12/schnee-und-glatteis-am-rosenmontag-moeglich,https://www.zeit.de/news/2026-02/12/schnee-und-glatteis-am-rosenmontag-moeglich,0,www.zeit.de,Wettervorhersage: Schnee und Glatteis am Rosenmontag möglich,Hier finden Sie Informationen zu dem Thema „Wettervorhersage“. Lesen Sie jetzt „Schnee und Glatteis am Rosenmontag möglich“.,https://img.zeit.de/news/2026-02/12/schnee-und-glatteis-am-rosenmontag-moeglich-image-group/wide__1300x731,2026-02-12T12:02:17Z,,Ausgerechnet zum Karnevals-Höhepunkt wird es winterlich: Am Rosenmontag erwartet der Deutsche Wetterdienst (DWD) morgens gebietsweise etwas Schnee bis in tiefere Lagen. Wo mildere Luft den Schnee in … [+1926 chars],,de,'Glatteis'
https://www.bild.de/leben-wissen/wohnen-living/so-viel-spart-eine-waermepumpe-langfristig-698dafa762ee8b267c15ca5a,https://www.bild.de/leben-wissen/wohnen-living/so-viel-spart-eine-waermepumpe-langfristig-698dafa762ee8b267c15ca5a,0,www.bild.de,Vergleich mit Öl und Gas - So viel spart eine Wärmepumpe langfristig,"Eine neue Heizung kostet erst einmal viel Geld. Auf lange Sicht kann sich eine Wärmepumpe im Vergleich zu Öl oder Gas lohnen, wie aktuelle Zahlen zeigen.","https://images.bild.de/698dafa762ee8b267c15ca5a/2f90baf2a9d4d5bc990ea94b506df97f,935e5f65?w=1280",2026-02-12T12:19:18Z,,"TTS-Player überspringenArtikel weiterlesenEine neue Heizung kostet erst einmal viel Geld. Doch auf lange Sicht kann sie ein echtes Sparwunder sein, wie aktuelle Zahlen zeigen.
Steigende Energiepreis… [+2335 chars]",,de,'Gas'
https://www.stern.de/gesellschaft/regional/rheinland-pfalz-saarland/ueberschwemmungen--koblenz-schuetzt-sich-vor-hochwasser---keine-extremlage-37132806.html,https://www.stern.de/gesellschaft/regional/rheinland-pfalz-saarland/ueberschwemmungen--koblenz-schuetzt-sich-vor-hochwasser---keine-extremlage-37132806.html,0,www.stern.de,Überschwemmungen: Koblenz schützt sich vor Hochwasser - keine Extremlage,Koblenz (lrs) - Angesichts steigender Wasserstände von Rhein und Mosel hat die Feuerwehr Koblenz einen Teilaufbau einer mobilen Hochwasserschutzwand am,https://image.stern.de/37132808/t/w5/v1/w1440/r1.7778/-/12--oedwnwsscxv8axs2048jpeg---95e52688b556f682.jpg,2026-02-12T18:40:45Z,,"Kopiere den aktuellen Link
Zur Merkliste hinzufügen
Steigende Pegelstände an Rhein und Mosel - in Koblenz wird ein Teil einer Schutzwand errichtet. Manche Autofahrer sollten handeln.
Angesichts st… [+754 chars]",,de,'Hochwasser'
https://www.zeit.de/news/2026-02/13/dwd-kaelte-und-glaette-kehren-nach-nrw-zurueck,https://www.zeit.de/news/2026-02/13/dwd-kaelte-und-glaette-kehren-nach-nrw-zurueck,0,www.zeit.de,Glatte Straßen: DWD: Kälte und Glätte kehren nach NRW zurück,Hier finden Sie Informationen zu dem Thema „Glatte Straßen“. Lesen Sie jetzt „DWD: Kälte und Glätte kehren nach NRW zurück“.,https://img.zeit.de/news/2026-02/13/dwd-kaelte-und-glaette-kehren-nach-nrw-zurueck-image-group/wide__1300x731,2026-02-13T04:50:13Z,,Die Temperaturen fallen in Nordrhein-Westfalen nach zwei wärmeren Tagen wieder stark ab. Dies geht aus Prognosen des Deutschen Wetterdienstes (DWD) hervor. Der Freitag bleibt demnach zunächst verregn… [+850 chars],,de,'Glatteis'
https://www.stern.de/gesellschaft/regional/bayern/wetter--ueberschwemmungen-drohen---hochwasserlage-bleibt-angespannt-37133464.html,https://www.stern.de/gesellschaft/regional/bayern/wetter--ueberschwemmungen-drohen---hochwasserlage-bleibt-angespannt-37133464.html,0,www.stern.de,Wetter: Überschwemmungen drohen – Hochwasserlage bleibt angespannt,"München (lby) - Tauwetter, Dauerregen, Sturm: Es bleibt ungemütlich in Bayern. Vor allem in Nordbayern gibt es Überschwemmungen: Die markante",https://image.stern.de/37133466/t/4W/v1/w1440/r1.7778/-/13--ury6grwk7dv2axs2048jpeg---efd145931102e59d.jpg,2026-02-13T05:09:02Z,,"Kopiere den aktuellen Link
Zur Merkliste hinzufügen
Regen, Hochwasser, glatte Straßen: Die Faschingsferien starten in Bayern ungemütlich. Was der Wetterdienst vorhersagt.
Tauwetter, Dauerregen, St… [+1870 chars]",,de,'Hochwasser'
https://www.zeit.de/news/2026-02/13/dauerfrost-und-glaette-winter-in-mv-bleibt-hartnaeckig,https://www.zeit.de/news/2026-02/13/dauerfrost-und-glaette-winter-in-mv-bleibt-hartnaeckig,0,www.zeit.de,Wetter: Dauerfrost und Glätte – Winter in MV bleibt hartnäckig,Hier finden Sie Informationen zu dem Thema „Wetter“. Lesen Sie jetzt „Dauerfrost und Glätte – Winter in MV bleibt hartnäckig“.,https://img.zeit.de/news/2026-02/13/dauerfrost-und-glaette-winter-in-mv-bleibt-hartnaeckig-image-group/wide__1300x731,2026-02-13T06:28:51Z,,"Das graue und winterliche Wetter in Mecklenburg-Vorpommern hält auch am Wochenende an. Nach Angaben des Deutschen Wetterdienstes (DWD) bleibt es am Freitag dicht bewölkt, zeitweise fällt leichter Sch… [+1322 chars]",,de,'Winter'
https://www.tagesspiegel.de/potsdam/brandenburg/hochwasser-in-brandenburg-alarmstufe-eins-in-pritzwalk--warnung-fur-frankfurt-oder-15247100.html,https://www.tagesspiegel.de/potsdam/brandenburg/hochwasser-in-brandenburg-alarmstufe-eins-in-pritzwalk--warnung-fur-frankfurt-oder-15247100.html,0,www.tagesspiegel.de,Hochwasser in Brandenburg: Alarmstufe eins in Pritzwalk – Warnung für Frankfurt (Oder),Seit Mittwochabend gibt es für Frankfurt (Oder) eine Hochwasserwarnung. An einem Pegel im Kreis Prignitz wurde die erste Alarmstufe erreicht.,https://www.tagesspiegel.de/images/15247111/alternates/BASE_16_9_W1400/1770971427000/hochwassergefahr-am-deutsch-polnischen-grenzfluss-oder.jpeg,2026-02-13T08:55:14Z,,Am Pegel Pritzwalk Hainholz (Lankreis Prignitz) an der Dömnitz ist laut dem Hochwassermeldezentrum des Landes Brandenburg der Wasserstand über den Richtwert der Alarmstufe eins gestiegen. Im Laufe de… [+795 chars],,de,'Hochwasser'
https://www.stern.de/gesellschaft/regional/hessen/wetter--regen-und-tauwetter-lassen-flusspegel-in-hessen-steigen-37134554.html,https://www.stern.de/gesellschaft/regional/hessen/wetter--regen-und-tauwetter-lassen-flusspegel-in-hessen-steigen-37134554.html,0,www.stern.de,Wetter: Regen und Tauwetter lassen Flusspegel in Hessen steigen,Gießen/Wiesbaden (lhe) - Ergiebige Regenfälle und abschmelzender Schnee haben Flüsse und Bäche in einigen Regionen Hessens anschwellen lassen. Derzeit sei,https://image.stern.de/37134556/t/vV/v1/w1440/r1.7778/-/13--2tc66ylviyv11axs2048jpeg---978b775783363fb8.jpg,2026-02-13T11:31:15Z,,"Kopiere den aktuellen Link
Zur Merkliste hinzufügen
Regen und schmelzender Schnee haben in einigen hessischen Regionen für Hochwasser gesorgt. Mancherorts wurden auch Straßen überflutet.
Ergiebige… [+1609 chars]",,de,'Hochwasser'
https://www.faz.net/aktuell/wirtschaft/mehr-wirtschaft/eu-kauft-noch-immer-russisches-lng-accg-200536963.html,https://www.faz.net/aktuell/wirtschaft/mehr-wirtschaft/eu-kauft-noch-immer-russisches-lng-accg-200536963.html,0,www.faz.net,Milliarden für Moskau: Wieviel russisches LNG die EU-Länder noch immer kaufen,Erst in etwa eineinhalb Jahren darf per Verordnung kein Gas aus Russland mehr in die EU importiert werden. Bislang kommt es noch via Tanker und auch via Pipeline – das beschert Moskau Milliarden.,https://media0.faz.net/image/w1200h627/708f2c2007e1/w4000h2090x0y80o/202602/43601.0.1767080623/ein-schiff-mit-fluessigerdgas.webp,2026-02-13T13:14:22Z,,"Die EU hat im vergangenen Jahr Flüssigerdgas aus Russland im Wert von rund 7,4 Milliarden Euro importiert. Das sind rund drei Prozent weniger als 2024 (rund 7,6 Milliarden), wie aus Daten der EU-Stat… [+2836 chars]",,de,'Kohle'
https://www.stern.de/gesellschaft/regional/berlin-brandenburg/nach-hoeheren-wasserstaenden--wasserpegel-in-frankfurt--oder--und-prignitz-gesunken-37135128.html,https://www.stern.de/gesellschaft/regional/berlin-brandenburg/nach-hoeheren-wasserstaenden--wasserpegel-in-frankfurt--oder--und-prignitz-gesunken-37135128.html,0,www.stern.de,Nach höheren Wasserständen: Wasserpegel in Frankfurt (Oder) und Prignitz gesunken,"Eisflächen, die sich im Winter untereinander schieben, können Hochwasser verursachen. In einigen Flüssen in Brandenburg stieg zuletzt der Wasserstand an. Nun scheint es sich zu entspannen.",https://image.stern.de/37135130/t/aW/v1/w1440/r1.7778/-/13--pwyjfejonuv3axs2048jpeg---03ab699247460b5b.jpg,2026-02-13T13:31:52Z,,"Kopiere den aktuellen Link
Zur Merkliste hinzufügen
Eisflächen, die sich im Winter untereinander schieben, können Hochwasser verursachen. In einigen Flüssen in Brandenburg stieg zuletzt der Wassers… [+1069 chars]",,de,'Hochwasser'
https://www.zeit.de/news/2026-02/13/wissenswertes-zum-riesenschneemann-jakob,https://www.zeit.de/news/2026-02/13/wissenswertes-zum-riesenschneemann-jakob,0,www.zeit.de,"Winter: So groß ist XXL-Schneemann ""Jakob"" in diesem Jahr","Hier finden Sie Informationen zu dem Thema „Winter“. Lesen Sie jetzt „So groß ist XXL-Schneemann ""Jakob"" in diesem Jahr“.",https://img.zeit.de/news/2026-02/13/wissenswertes-zum-riesenschneemann-jakob-image-group/wide__1300x731,2026-02-13T15:14:28Z,,Er ist wieder da: Riesenschneemann «Jakob» begrüßt auch in diesem Winter Gäste und Ausflügler im Fichtelgebirge. Freiwillige Helfer haben den XXL-Schneemann in Bischofsgrün im Landkreis Bayreuth geba… [+2651 chars],,de,'Winter'
https://www.zeit.de/news/2026-02/14/winterwetter-koennte-mehr-touristen-nach-mv-locken,https://www.zeit.de/news/2026-02/14/winterwetter-koennte-mehr-touristen-nach-mv-locken,0,www.zeit.de,Tourismus: Winterwetter könnte mehr Touristen nach MV locken,Hier finden Sie Informationen zu dem Thema „Tourismus“. Lesen Sie jetzt „Winterwetter könnte mehr Touristen nach MV locken“.,https://img.zeit.de/news/2026-02/14/winterwetter-koennte-mehr-touristen-nach-mv-locken-image-group/wide__1300x731,2026-02-14T04:00:10Z,,"Das Winterwetter zieht derzeit viele Menschen in den Norden. Gerade an der Ostseeküste meldeten einzelne Häuser mehr Gäste als üblich, sagte der Präsident des Deutschen Hotel- und Gaststättenverbande… [+2012 chars]",,de,'Winter'
https://www.stern.de/gesellschaft/regional/mecklenburg-vorpommern/tourismus--winterwetter-koennte-mehr-touristen-nach-mv-locken-37136412.html,https://www.stern.de/gesellschaft/regional/mecklenburg-vorpommern/tourismus--winterwetter-koennte-mehr-touristen-nach-mv-locken-37136412.html,0,www.stern.de,Tourismus: Winterwetter könnte mehr Touristen nach MV locken,"Ein Spaziergang auf der zugefrorenen Ostsee, ein von Eis umschlossener Leuchtturm: Die extreme Kälte hat in diesem Jahr für eine ganz besondere Küstenkulisse gesorgt. Zieht das auch mehr Gäste an?",https://image.stern.de/37136414/t/mQ/v1/w1440/r1.7778/-/14--zueiwzn6agv7axs2048jpeg---1fe87664c5493da5.jpg,2026-02-14T04:00:10Z,,"Kopiere den aktuellen Link
Zur Merkliste hinzufügen
Ein Spaziergang auf der zugefrorenen Ostsee, ein von Eis umschlossener Leuchtturm: Die extreme Kälte hat in diesem Jahr für eine ganz besondere K… [+2224 chars]",,de,'Kälte'
https://www.nzz.ch/zuerich/als-zuerich-eine-schlittelstadt-war-ld.1920205,https://www.nzz.ch/zuerich/als-zuerich-eine-schlittelstadt-war-ld.1920205,0,www.nzz.ch,Als «die Bobs funkensprühend über das Römerhofpflaster wegstoben»: Zürich war vor hundert Jahren eine Schlittelstadt,Der Dolder bewarb Zürich als Wintersportort. Erst das Automobil bereitete dem Schlittelspass ein Ende.,"https://img.nzz.ch/2026/02/11/4edd2577-0bd4-4001-a1a5-50dfe9fb2b85.jpg?width=1200&height=674&fit=bounds&quality=75&auto=webp&crop=3330,1873,x1338,y1039&wmark=nzz",2026-02-14T04:05:00Z,,"Wer vor 1880 geboren wurde, konnte in seinem Leben ohne weiteres fünfmal eine «Seegfrorni» des Zürichsees erleben. Wenn die Eisfläche zur Begehung freigegeben wurde, erfasste die Menschen ein Freuden… [+8075 chars]",,de,'Winter'
