index,url,valid,domain,title,description,image,published,archive,content,quote,language,keyword
https://www.stern.de/gesellschaft/regional/rheinland-pfalz-saarland/umwelt-und-klima--saarland-uebernimmt-vorsitz-der-umweltministerkonferenz-35347034.html,https://www.stern.de/gesellschaft/regional/rheinland-pfalz-saarland/umwelt-und-klima--saarland-uebernimmt-vorsitz-der-umweltministerkonferenz-35347034.html,0,www.stern.de,Umwelt und Klima: Saarland übernimmt Vorsitz der Umweltministerkonferenz,Wald und Hochwasserschutz stärken - das wollen die Umweltminister der Länder. Dazu fordern sie mehr Geld vom Bund. Das Saarland wird nun öfter zu hören sein.,https://image.stern.de/35347036/t/6J/v1/w1440/r1.7778/-/01--grh4n7x355v12axs2048jpeg---ffb0d7882cf7cef3.jpg,2025-01-01T02:35:36Z,,"Kopiere den aktuellen Link
Wald und Hochwasserschutz stärken - das wollen die Umweltminister der Länder. Dazu fordern sie mehr Geld vom Bund. Das Saarland wird nun öfter zu hören sein.
Mit Jahresbe… [+1071 chars]",,de,'Hochwasser'
https://www.zeit.de/politik/ausland/2025-01/russisches-erdgas-ukraine-erdgastransit-europa,https://www.zeit.de/politik/ausland/2025-01/russisches-erdgas-ukraine-erdgastransit-europa,0,www.zeit.de,Russisches Erdgas: Ukraine stoppt Erdgastransit Richtung Europa,Der russische Konzern Gazprom kann sein Gas nicht länger durch die Ukraine pumpen. Das Land hat den Transitvertrag nicht verlängert.,https://img.zeit.de/wirtschaft/2025-01/ukraine-stoppt-erdgastransit-richtung-europa-gazprom-bild-2/wide__1300x731,2025-01-01T06:59:14Z,,"Die Ukraine hat die Durchleitung von russischem Gas in
Richtung Europa wie angekündigt eingestellt, um Russland von
weiteren Einkünften abzuschneiden. Der
Transitvertrag mit Gazprom wurde nicht ve… [+1207 chars]",,de,'Gas'
https://www.zeit.de/news/2025-01/01/schneeschauer-in-rheinland-pfalz-und-im-saarland,https://www.zeit.de/news/2025-01/01/schneeschauer-in-rheinland-pfalz-und-im-saarland,0,www.zeit.de,Wetter: Schneeschauer in Rheinland-Pfalz und im Saarland,Hier finden Sie Informationen zu dem Thema „Wetter“. Lesen Sie jetzt „Schneeschauer in Rheinland-Pfalz und im Saarland“.,https://img.zeit.de/news/2025-01/01/schneeschauer-in-rheinland-pfalz-und-im-saarland-image-group/wide__1300x731,2025-01-01T10:34:51Z,,Regnerisches Wetter mit teilweise Schnee in höheren Lagen wird in Rheinland-Pfalz und im Saarland erwartet. Die Temperaturen steigen am Donnerstag nach Angaben des Deutschen Wetterdienstes (DWD) im T… [+318 chars],,de,'Schnee'
https://www.bild.de/regional/rheinland-pfalz/stromausfall-im-westerwald-40-000-haushalte-haben-keinen-strom-677509c45d60421cc75042cf,https://www.bild.de/regional/rheinland-pfalz/stromausfall-im-westerwald-40-000-haushalte-haben-keinen-strom-677509c45d60421cc75042cf,0,www.bild.de,Aktuell großflächiger Stromausfall - Blackout im Westerwald,Blackout im Westerwald! Seit 4.45 Uhr herrscht großflächiger Stromausfall.,"https://images.bild.de/677509c45d60421cc75042cf/ed6a24da357d71481bd31e3239cd10a1,c011837b?w=1280",2025-01-01T10:46:18Z,http://archive.md/20250101151956/https://www.bild.de/regional/rheinland-pfalz/stromausfall-im-westerwald-40-000-haushalte-haben-keinen-strom-677509c45d60421cc75042cf,"Westerburg (Rheinland-Pfalz) Blackout im Westerwald! Seit 4.45 Uhr herrscht großflächiger Stromausfall.
Im gesamten oberen Westerwald in Rheinland-Pfalz gebe es derzeit keinen Strom, so die Polizei.… [+1118 chars]",,de,'Blackout'
https://www.zeit.de/news/2025-01/01/das-neue-jahr-startet-stuermisch-regen-und-schnee-in-sicht,https://www.zeit.de/news/2025-01/01/das-neue-jahr-startet-stuermisch-regen-und-schnee-in-sicht,0,www.zeit.de,Wetterausblick in NRW: Das neue Jahr startet stürmisch - Regen und Schnee in Sicht,Hier finden Sie Informationen zu dem Thema „Wetterausblick in NRW“. Lesen Sie jetzt „Das neue Jahr startet stürmisch - Regen und Schnee in Sicht“.,https://img.zeit.de/news/2025-01/01/das-neue-jahr-startet-stuermisch-regen-und-schnee-in-sicht-image-group/wide__1300x731,2025-01-01T11:36:57Z,,Zu Beginn des Jahres 2025 müssen sich die Menschen in Nordrhein-Westfalen auf windiges Wetter einstellen. Den gesamten Neujahrstag sei verbreitet mit Sturmböen zwischen 60 und 80 Stundenkilometern zu… [+1059 chars],,de,'Schnee'
https://www.zeit.de/news/2025-01/01/nach-sonne-an-neujahr-folgen-regen-und-schnee-in-bayern,https://www.zeit.de/news/2025-01/01/nach-sonne-an-neujahr-folgen-regen-und-schnee-in-bayern,0,www.zeit.de,Wettervorhersage: Nach Sonne an Neujahr folgen Regen und Schnee in Bayern,Hier finden Sie Informationen zu dem Thema „Wettervorhersage“. Lesen Sie jetzt „Nach Sonne an Neujahr folgen Regen und Schnee in Bayern“.,https://img.zeit.de/news/2025-01/01/nach-sonne-an-neujahr-folgen-regen-und-schnee-in-bayern-image-group/wide__1300x731,2025-01-01T14:13:51Z,,"Nach einem meist sonnigen Neujahrstag werden in Bayern an den nächsten Tagen Schnee und Regen erwartet. In der Nacht zu Donnerstag werde es zunächst noch klar sein, sagte ein Sprecher des Deutschen W… [+792 chars]",,de,'Schnee'
https://www.focus.de/regional/wetter/sprung-ueber-nacht-ungewoehnlich-sowas-sagt-meteorologe-ueber-deutsches-winter-wetter-habe-ich-noch-nie-gesehen_32fbee17-3a59-4d5a-9deb-dd80bfd7894c.html,https://www.focus.de/regional/wetter/sprung-ueber-nacht-ungewoehnlich-sowas-sagt-meteorologe-ueber-deutsches-winter-wetter-habe-ich-noch-nie-gesehen_32fbee17-3a59-4d5a-9deb-dd80bfd7894c.html,0,www.focus.de,"„Sprung über Nacht ungewöhnlich“ - „Sowas“, sagt Meteorologe über deutsches Winter-Wetter, „habe ich noch nie gesehen“","Wird Deutschland zum Start des neuen Jahres gleich mal schockgefrostet? Eine unerwartete Prognose sorgt nun für Aufsehen. Ein Meteorologe gibt seine Überraschung zu,",https://quadro.burda-forward.de/ctf/e4907a41-0962-4974-8a46-4c02a28b72f6.d727ea85-35d6-4f1c-9271-92955439de0f.png?im=RegionOfInterestCrop%3D%281200%2C630%29%2CregionOfInterest%3D%28917%2C412%29&hash=1cc4af45f55f751c03814bf279c061aea1bd8c461855867aa9ec11fa1807a478,2025-01-01T14:15:00Z,,"Das neue Jahr 2025 ist erst wenige Stunden alt. Zuvor feierten die Menschen in Deutschland noch eine rauschende Silvesternacht.
Nun sorgt eine Wetter-Prognose durchaus für Aufsehen unter Meteorologe… [+2297 chars]",,de,'Winter'
https://www.zeit.de/news/2025-01/02/schnee-regen-und-glaette-in-nrw-erwartet,https://www.zeit.de/news/2025-01/02/schnee-regen-und-glaette-in-nrw-erwartet,0,www.zeit.de,"Wetter: Schnee, Regen und Glätte in NRW erwartet","Hier finden Sie Informationen zu dem Thema „Wetter“. Lesen Sie jetzt „Schnee, Regen und Glätte in NRW erwartet“.",https://img.zeit.de/news/2025-01/02/schnee-regen-und-glaette-in-nrw-erwartet-image-group/wide__1300x731,2025-01-02T05:58:30Z,https://web.archive.org/web/20250104104226/https://www.zeit.de/news/2025-01/02/schnee-regen-und-glaette-in-nrw-erwartet,"Eine Mischung aus Schnee und Regen erwartet die Menschen in Nordrhein-Westfalen auf dem Weg zum ersten Wochenende des Jahres. Am Vormittag schneit es oberhalb von 200 bis 300 Metern, wie der Deutsche… [+1123 chars]",,de,'Schnee'
https://www.stern.de/gesellschaft/regional/nordrhein-westfalen/wetter--schnee--regen-und-glaette-in-nrw-erwartet-35348874.html,https://www.stern.de/gesellschaft/regional/nordrhein-westfalen/wetter--schnee--regen-und-glaette-in-nrw-erwartet-35348874.html,0,www.stern.de,"Wetter: Schnee, Regen und Glätte in NRW erwartet",Essen (lnw) - Eine Mischung aus Schnee und Regen erwartet die Menschen in Nordrhein-Westfalen auf dem Weg zum ersten Wochenende des Jahres. Am Vormittag,https://image.stern.de/35348876/t/S8/v1/w1440/r1.7778/-/02--v6rkcqhi4vv8axs2048jpeg---705c4b50a5261f05.jpg,2025-01-02T05:58:30Z,,"Kopiere den aktuellen Link
Das neue Jahr bringt einen Mix aus Schnee und Regen nach Nordrhein-Westfalen. Dabei kann es glatt werden, sagt der Deutsche Wetterdienst voraus.
Eine Mischung aus Schnee … [+1257 chars]",,de,'Glatteis'
https://www.stern.de/gesellschaft/regional/hessen/ausblick--winterwetter-in-hessen---meteorologen-warnen-vor-glaette-35348898.html,https://www.stern.de/gesellschaft/regional/hessen/ausblick--winterwetter-in-hessen---meteorologen-warnen-vor-glaette-35348898.html,0,www.stern.de,Ausblick: Winterwetter in Hessen - Meteorologen warnen vor Glätte,Offenbach/Main (lhe) - In Hessen wird das Wetter zum Wochenende winterlich: Wind und Regen werden von Schnee und Frost abgelöst. Der Deutsche Wetterdienst,https://image.stern.de/35348900/t/zg/v1/w1440/r1.7778/-/02--7k764xcxl5v3axs2048jpeg---93b59a55265e700a.jpg,2025-01-02T06:01:54Z,https://web.archive.org/web/20250104042838/https://www.stern.de/gesellschaft/regional/hessen/ausblick--winterwetter-in-hessen---meteorologen-warnen-vor-glaette-35348898.html,"Kopiere den aktuellen Link
Zum Wochenende fallen die Temperaturen in Hessen. Meteorologen erwarten Regen, Schnee und Frost. Auf den Straßen kann es glatt werden.
In Hessen wird das Wetter zum Woche… [+766 chars]",,de,'Winter'
https://www.zeit.de/news/2025-01/02/winterwetter-in-hessen-meteorologen-warnen-vor-glaette,https://www.zeit.de/news/2025-01/02/winterwetter-in-hessen-meteorologen-warnen-vor-glaette,0,www.zeit.de,Ausblick: Winterwetter in Hessen - Meteorologen warnen vor Glätte,Hier finden Sie Informationen zu dem Thema „Ausblick“. Lesen Sie jetzt „Winterwetter in Hessen - Meteorologen warnen vor Glätte“.,https://img.zeit.de/news/2025-01/02/winterwetter-in-hessen-meteorologen-warnen-vor-glaette-image-group/wide__1300x731,2025-01-02T06:01:54Z,,"In Hessen wird das Wetter zum Wochenende winterlich: Wind und Regen werden von Schnee und Frost abgelöst. Der Deutsche Wetterdienst (DWD) in Offenbach am Main warnt vor Glätte. 
Heute ist der Himmel… [+642 chars]",,de,'Glatteis'
https://www.zeit.de/news/2025-01/02/kaltfront-bringt-schnee-und-regen,https://www.zeit.de/news/2025-01/02/kaltfront-bringt-schnee-und-regen,0,www.zeit.de,Wetterausblick: Kaltfront bringt Schnee und Regen,Hier finden Sie Informationen zu dem Thema „Wetterausblick“. Lesen Sie jetzt „Kaltfront bringt Schnee und Regen“.,https://img.zeit.de/news/2025-01/02/kaltfront-bringt-schnee-und-regen-image-group/wide__1300x731,2025-01-02T06:23:16Z,https://web.archive.org/web/20250103152604/https://www.zeit.de/news/2025-01/02/kaltfront-bringt-schnee-und-regen,Der Deutsche Wetterdienst (DWD) meldet für Rheinland-Pfalz und das Saarland bis zum Wochenende wechselhaftes Wetter. Heute bringt eine Kaltfront Regen und Schnee bei Temperaturen zwischen 3 und 6 Gra… [+675 chars],,de,'Schnee'
https://www.zeit.de/news/2025-01/02/glaettegefahr-bei-schnee-und-frost-im-suedwesten,https://www.zeit.de/news/2025-01/02/glaettegefahr-bei-schnee-und-frost-im-suedwesten,0,www.zeit.de,Winterwetter: Glättegefahr bei Schnee und Frost im Südwesten,Hier finden Sie Informationen zu dem Thema „Winterwetter“. Lesen Sie jetzt „Glättegefahr bei Schnee und Frost im Südwesten“.,https://img.zeit.de/news/2025-01/02/glaettegefahr-bei-schnee-und-frost-im-suedwesten-image-group/wide__1300x731,2025-01-02T07:56:59Z,,"Im Südwesten besteht wegen überfrierender Nässe und Schneematsch die Gefahr von Glätte auf den Straßen. Im Laufe des Tages kommt es zu Regen und Schneefall, wie der Deutsche Wetterdienst (DWD) aus St… [+664 chars]",,de,'Winter'
https://www.zeit.de/news/2025-01/02/dwd-schnee-und-glaette-in-oestlichen-bundeslaendern-erwartet,https://www.zeit.de/news/2025-01/02/dwd-schnee-und-glaette-in-oestlichen-bundeslaendern-erwartet,0,www.zeit.de,Wetter: DWD: Schnee und Glätte in östlichen Bundesländern erwartet,Hier finden Sie Informationen zu dem Thema „Wetter“. Lesen Sie jetzt „DWD: Schnee und Glätte in östlichen Bundesländern erwartet“.,https://img.zeit.de/news/2025-01/02/dwd-schnee-und-glaette-in-oestlichen-bundeslaendern-erwartet-image-group/wide__1300x731,2025-01-02T10:18:36Z,https://web.archive.org/web/20250104104906/https://www.zeit.de/news/2025-01/02/dwd-schnee-und-glaette-in-oestlichen-bundeslaendern-erwartet,Frühaufsteher können sich am Samstag nach Angaben des Deutschen Wetterdienstes (DWD) selbst in den Tieflagen mehrerer ostdeutscher Bundesländer auf eine leichte Schneedecke freuen. Grund für die wint… [+908 chars],,de,'Schnee'
https://www.bild.de/news/wetter/wetter-kaltfront-trifft-deutschland-schnee-frost-und-glaette-67763120c059a7065063928c,https://www.bild.de/news/wetter/wetter-kaltfront-trifft-deutschland-schnee-frost-und-glaette-67763120c059a7065063928c,0,www.bild.de,"Achtung, Schnee und Glatteis - Jetzt kommt das Rutsch-Wetter","Deutschland erwartet eine Kaltfront mit Schnee, Frost und Glättegefahr, besonders in Bayern, Baden-Württemberg und Hessen. Nun kommt das Rutsch-Wetter.","https://images.bild.de/67763120c059a7065063928c/ef4a7cee4abccace52738480bee516a9,11703567?w=1280",2025-01-02T10:25:36Z,https://web.archive.org/web/20250102160104/https://www.bild.de/news/wetter/wetter-kaltfront-trifft-deutschland-schnee-frost-und-glaette-67763120c059a7065063928c,"Erst der Sturm, jetzt der Winter! Eine Kaltfront lässt die Temperaturen in Richtung Gefrierpunkt sinken. Dazu Schneeregen und Schnee. 
Am Freitag lockert es laut Deutschem Wetterdienst zunächst etwa… [+2775 chars]",,de,'Glatteis'
https://www.brigitte.de/familie/teenager-sprueche---5-45-uhr--der-teenager-weckdienst-ist-eroeffnet---13757256.html,https://www.brigitte.de/familie/teenager-sprueche---5-45-uhr--der-teenager-weckdienst-ist-eroeffnet---13757256.html,0,www.brigitte.de,"Teenagerperlen: Sprüche für Eltern, bei denen die Pubertät eingezogen ist","Teenager können unberechenbar sein – Stimmungsschwankungen, Türknallen und provokative Sprüche inklusive. So ziemlich alle Eltern mit pubertierenden Kindern können da mitreden. Diese Sprüche zeigen herrlich ehrlich die Wahrheit.",https://image.brigitte.de/13757240/t/f1/v1/w1440/r1.7778/-/teenager-teaser.jpg,2025-01-02T10:52:00Z,,"Ja, so ein Kind im Teenageralter hat einfach seinen eigenen Kopf und das ist auch gut so, schließlich wollen wir ja alle, dass unsere Kinder ihren eigenen Weg gehen. Manche Entscheidungen und Aktione… [+21895 chars]",,de,'Black Out'
https://www.zeit.de/news/2025-01/02/schnee-und-glaette-erste-unfaelle-in-oberfranken,https://www.zeit.de/news/2025-01/02/schnee-und-glaette-erste-unfaelle-in-oberfranken,0,www.zeit.de,Winterwetter: Schnee und Glätte - erste Unfälle in Oberfranken,Hier finden Sie Informationen zu dem Thema „Winterwetter“. Lesen Sie jetzt „Schnee und Glätte - erste Unfälle in Oberfranken“.,https://img.zeit.de/news/2025-01/02/schnee-und-glaette-erste-unfaelle-in-oberfranken-image-group/wide__1300x731,2025-01-02T11:44:52Z,https://web.archive.org/web/20250102183237/https://www.zeit.de/news/2025-01/02/schnee-und-glaette-erste-unfaelle-in-oberfranken,In Oberfranken ist es bei Schneefall zu ersten Unfällen gekommen. Ein Polizeisprecher berichtete von einem Unfall mit Verletzten aufgrund der Witterungsverhältnisse im Fichtelgebirge bei Bischofsgrün… [+943 chars],,de,'Schnee'
https://www.focus.de/earth/report/umweltschutz-und-bekaempfung-des-klimawandels-7-fortschritte-im-jahr-2024-die-hoffnung-machen_id_260586333.html,https://www.focus.de/earth/report/umweltschutz-und-bekaempfung-des-klimawandels-7-fortschritte-im-jahr-2024-die-hoffnung-machen_id_260586333.html,0,www.focus.de,"Kohle-Aus und Sonne-Boom - Sieben bahnbrechende Klima-Trends, die Hoffnung machen","Auch, wenn es angesichts der Ereignisse in diesem Jahr nicht so wirken mag: 2024 lieferte einige Durchbrüche fürs Klima, die Sie vielleicht verpasst haben.Von FOCUS-online-Redakteurin Stefanie Haas",https://p6.focus.de/img/fotos/id_260469794/ns18350291-ngsppamz-andre-dib-21092022-dji-0089-1-.jpg?im=Crop%3D%280%2C577%2C3465%2C1731%29%3BResize%3D%281200%2C627%29&impolicy=perceptual&quality=mediumHigh&hash=a1d0a563bae210518f64d6fd090299693a88b906efaa12862a309f27753dc69f,2025-01-02T12:46:16Z,https://web.archive.org/web/20250102133759/https://www.focus.de/earth/report/umweltschutz-und-bekaempfung-des-klimawandels-7-fortschritte-im-jahr-2024-die-hoffnung-machen_id_260586333.html,"Auch, wenn es angesichts der Ereignisse in diesem Jahr nicht so wirken mag: 2024 lieferte einige Durchbrüche fürs Klima, die Sie vielleicht verpasst haben.Hand aufs Herz: Es ist schwer geworden, den … [+8204 chars]",,de,'Kohle'
https://www.tagesschau.de/wirtschaft/erneuerbare-energien-strom-100.html,https://www.tagesschau.de/wirtschaft/erneuerbare-energien-strom-100.html,0,www.tagesschau.de,2024 so viel Strom aus Erneuerbaren wie noch nie,"Der Strom in Deutschland war 2024 offenbar so sauber wie noch nie: Mehr als 62 Prozent stammten laut Fraunhofer Institut aus Erneuerbaren. Zugleich gab es mehr Stromimporte, um das Minus beim Kohlestrom zu kompensieren.",https://images.tagesschau.de/image/62355e41-5211-4f0d-857c-22b91f60d0a4/AAABlCc7iY0/AAABkZLhkrw/16x9-1280/windrad-142.jpg,2025-01-02T13:53:13Z,http://archive.md/20250102182547/https://www.tagesschau.de/wirtschaft/erneuerbare-energien-strom-100.html,"Stand: 02.01.2025 14:53 Uhr
Der Strom in Deutschland war 2024 offenbar so sauber wie noch nie: Mehr als 62 Prozent stammten laut Fraunhofer Institut aus Erneuerbaren. Zugleich gab es mehr Stromimpor… [+2116 chars]",,de,'Kohle'
https://www.zeit.de/news/2025-01/02/vorfreude-auf-eishockey-fest-alle-momente-geniessen,https://www.zeit.de/news/2025-01/02/vorfreude-auf-eishockey-fest-alle-momente-geniessen,0,www.zeit.de,"Winter Game der DEL: Vorfreude auf Eishockey-Fest: ""Alle Momente genießen""","Hier finden Sie Informationen zu dem Thema „Winter Game der DEL“. Lesen Sie jetzt „Vorfreude auf Eishockey-Fest: ""Alle Momente genießen""“.",https://img.zeit.de/news/2025-01/02/vorfreude-auf-eishockey-fest-alle-momente-geniessen-image-group/wide__1300x731,2025-01-02T13:54:31Z,,Die Vorfreude auf das Winter Game der Deutschen Eishockey Liga (DEL) im Fußballstadion von Eintracht Frankfurt steigt bei den Verantwortlichen und Spielern der Löwen Frankfurt und Adler Mannheim. «Je… [+938 chars],,de,'Winter'
https://www.n-tv.de/wirtschaft/Fehlendes-Gas-bringt-Moldau-und-Transnistrien-in-Bedraengnis-article25463597.html,https://www.n-tv.de/wirtschaft/Fehlendes-Gas-bringt-Moldau-und-Transnistrien-in-Bedraengnis-article25463597.html,0,www.n-tv.de,Macht Moskau Druck?: Fehlendes Gas bringt Moldau und Transnistrien in Bedrängnis,Seit 1. Januar fließt kein russisches Gas mehr durch die Ukraine nach Westeuropa. Das bekommen auch Moldau und das abtrünnige Transnistrien zu spüren. Im ersten Fall könnte politisches Kalkül Moskaus eine Rolle spielen. Der Kreml pocht auf die Begleichung von…,https://bilder1.n-tv.de/img/incoming/crop25463608/4251325257-cImg_16_9-w1200/480922093.jpg,2025-01-02T15:02:57Z,,Seit 1. Januar fließt kein russisches Gas mehr durch die Ukraine nach Westeuropa. Das bekommen auch Moldau und das abtrünnige Transnistrien zu spüren. Im ersten Fall könnte politisches Kalkül Moskaus… [+3182 chars],,de,'Kohle'
https://www.focus.de/earth/analyse/ueberraschende-daten-deutschlands-strombilanz-fuer-2024-und-ploetzlich-sind-wir-import-meister_id_260603799.html,https://www.focus.de/earth/analyse/ueberraschende-daten-deutschlands-strombilanz-fuer-2024-und-ploetzlich-sind-wir-import-meister_id_260603799.html,0,www.focus.de,Überraschende Daten - Deutschlands Strombilanz für 2024: Und plötzlich sind wir Import-Meister,"Das Ende der Kohle-Ära: Deutschlands Strom ist so sauber wie nie - gleichzeitig erreichen die Strom-Importe aus dem Ausland neue Höchststände. Doch dass muss gar nichts Schlimmes sein, wie neue Daten zeigen. Was die Strombilanz für 2024 sonst noch verrät.Von …",https://p6.focus.de/img/regional/baden-wuerttemberg/id_260601919/solarenergie-boomt-im-land.-die-windkraft-stockt..jpg?im=Crop%3D%280%2C170%2C2048%2C1024%29%3BResize%3D%281200%2C627%29&impolicy=perceptual&quality=mediumHigh&hash=a47c0e924c459e707461af70c7455b7682f5d962fbad0d9fd9bb22dfec12ba0a,2025-01-02T15:27:07Z,https://web.archive.org/web/20250102174736/https://www.focus.de/earth/analyse/ueberraschende-daten-deutschlands-strombilanz-fuer-2024-und-ploetzlich-sind-wir-import-meister_id_260603799.html,"<ul><li>
Kommentare</li><li>
E-Mail</li><li>
Teilen</li><li>
Mehr</li><li>
Twitter</li><li>
Drucken</li><li>
Feedback</li><li>
Fehler meldenSie haben einen Fehler gefunden?
Bitte markieren S… [+12715 chars]",,de,'Kohle'
https://www.zeit.de/news/2025-01/02/wintertourismus-im-harz-es-schneit-wie-wild,https://www.zeit.de/news/2025-01/02/wintertourismus-im-harz-es-schneit-wie-wild,0,www.zeit.de,"Winterurlaub: Wintertourismus im Harz - ""Es schneit wie wild""","Hier finden Sie Informationen zu dem Thema „Winterurlaub“. Lesen Sie jetzt „Wintertourismus im Harz - ""Es schneit wie wild""“.",https://img.zeit.de/news/2025-01/02/wintertourismus-im-harz-es-schneit-wie-wild-image-group/wide__1300x731,2025-01-02T15:54:19Z,,"Der Oberharz rüstet sich für den Wintersportbetrieb. «Es schneit wie wild, selbst bis in die Talstation», sagte der Betriebsleiter der Wurmbergseilbahn, Fabian Brockschmidt. «Wir sind in den Startlöc… [+994 chars]",,de,'Winter'
https://www.nzz.ch/international/hybrider-krieg-moskaus-energiekrise-in-der-moldau-ld.1864559,https://www.nzz.ch/international/hybrider-krieg-moskaus-energiekrise-in-der-moldau-ld.1864559,0,www.nzz.ch,Jetzt wird es in den Wohnungen kalt: Die Moldau bekommt Russlands hybride Kriegsführung zu spüren,"Seit dem 1. Januar erhält die Moldau kein Gas mehr aus Russland. Das trifft zwar die prorussischen Separatisten in Transnistrien am stärksten, bringt aber auch die Regierung in Chisinau in Bedrängnis.","https://img.nzz.ch/2025/01/02/57783a2e-929b-477e-9f82-90103304175e.jpeg?width=1200&height=674&fit=bounds&quality=75&auto=webp&crop=4500,2531,x0,y786&wmark=nzz",2025-01-02T16:10:29Z,http://archive.md/20250102173352/https://www.nzz.ch/international/hybrider-krieg-moskaus-energiekrise-in-der-moldau-ld.1864559,"In Städten wie Comrat in der autonomen Region Gagausien ist es nicht nur draussen Winter, sondern auch in den Wohnungen kalt.
Für die Menschen in Transnistrien hat das neue Jahr äusserst ungemütlich… [+6070 chars]",,de,'Gas'
https://www.diepresse.com/19221560/wie-man-sich-einst-die-welt-von-2025-vorstellte,https://www.diepresse.com/19221560/wie-man-sich-einst-die-welt-von-2025-vorstellte,0,www.diepresse.com,Wie man sich einst die Welt von 2025 vorstellte [premium],"Ein englischer Erfinder sagte vor 100 Jahren Radiowecker, Mobiltelefone und Windparks erstaunlich präzise voraus. Andere lagen eher daneben – mit Babys aus dem Labor, Essen aus Kohle und Todesstrafe für Bierbesitz.",https://img.diepresse.com/public/incoming/mjg2pv-Stadt-der-Zukunft/alternates/DPR_SOCIAL_MAGAZIN/Stadt%20der%20Zukunft,2025-01-02T16:54:32Z,http://archive.md/20250102170934/https://www.diepresse.com/19221560/wie-man-sich-einst-die-welt-von-2025-vorstellte,"Ein englischer Erfinder sagte vor 100Jahren Radiowecker, Mobiltelefone und Windparks erstaunlich präzise voraus. Andere lagen eher daneben mit Babys aus dem Labor, Essen aus Kohle und Todesstrafe für… [+820 chars]",,de,'Kohle'
https://www.zeit.de/news/2025-01/02/vorfreude-vor-eishockey-fest-im-frankfurter-fussballstadion,https://www.zeit.de/news/2025-01/02/vorfreude-vor-eishockey-fest-im-frankfurter-fussballstadion,0,www.zeit.de,"DEL Winter Game: ""Vorfreude"" vor Eishockey-Fest im Frankfurter Fußballstadion","Hier finden Sie Informationen zu dem Thema „DEL Winter Game“. Lesen Sie jetzt „""Vorfreude"" vor Eishockey-Fest im Frankfurter Fußballstadion“.",https://img.zeit.de/news/2025-01/02/vorfreude-vor-eishockey-fest-im-frankfurter-fussballstadion-image-group/wide__1300x731,2025-01-02T16:57:30Z,,"Eishockey-Spektakel statt Fußball-Bundesliga, Puck statt Ball, Löwen statt Eintracht - am Wochenende herrscht in der Frankfurter Arena ausnahmsweise mal Eiszeit. Die Löwen Frankfurt empfangen die Adl… [+2374 chars]",,de,'Winter'
https://www.stern.de/gesellschaft/regional/bayern/winterwetter--schnee-und-glaette-in-bayern---unfall-mit-intercity-zug-35351372.html,https://www.stern.de/gesellschaft/regional/bayern/winterwetter--schnee-und-glaette-in-bayern---unfall-mit-intercity-zug-35351372.html,0,www.stern.de,Winterwetter: Schnee und Glätte in Bayern - Unfall mit Intercity-Zug,Der Winter ist da - und zeigt in Teilen Bayerns nicht nur seine schönen Seiten. Die Polizei registriert mehrere Unfälle. Auch die Bahnstrecke München-Salzburg ist betroffen.,https://image.stern.de/35351374/t/TC/v1/w1440/r1.7778/-/03--dfvgrsiglrv1axs2048jpeg---61485c10146f1b1a.jpg,2025-01-03T03:34:59Z,,"Kopiere den aktuellen Link
Der Winter ist da - und zeigt in Teilen Bayerns nicht nur seine schönen Seiten. Die Polizei registriert mehrere Unfälle. Auch die Bahnstrecke München-Salzburg ist betroffe… [+2619 chars]",,de,'Winter'
https://www.zeit.de/news/2025-01/03/schnee-und-glaette-in-bayern-unfall-mit-intercity-zug,https://www.zeit.de/news/2025-01/03/schnee-und-glaette-in-bayern-unfall-mit-intercity-zug,0,www.zeit.de,Winterwetter: Schnee und Glätte in Bayern - Unfall mit Intercity-Zug,Hier finden Sie Informationen zu dem Thema „Winterwetter“. Lesen Sie jetzt „Schnee und Glätte in Bayern - Unfall mit Intercity-Zug“.,https://img.zeit.de/news/2025-01/03/schnee-und-glaette-in-bayern-unfall-mit-intercity-zug-image-group/wide__1300x731,2025-01-03T03:34:59Z,,Auf glatten Straßen hat es in Teilen Bayerns Unfälle gegeben. Nach einem Zusammenstoß zwischen einem Intercity-Zug und einem Auto musste die Bahnstrecke München-Salzburg für mehrere Stunden gesperrt … [+2456 chars],,de,'Schnee'
