index,url,valid,domain,title,description,image,published,archive,content,quote,language,keyword
https://www.faz.net/aktuell/wissen/medizin-ernaehrung/studie-wie-die-smartphone-nutzung-von-eltern-kindern-schadet-110459249.html,https://www.faz.net/aktuell/wissen/medizin-ernaehrung/studie-wie-die-smartphone-nutzung-von-eltern-kindern-schadet-110459249.html,0,www.faz.net,Neue Studie: So schadet die Smartphone-Nutzung von Eltern den Kindern,"Nicht nur Kinder sollten weniger auf Bildschirme schauen – auch Eltern. Eine neue Studie zeigt detailliert auf, wie die elterliche Smartphone-Nutzung die Entwicklung beeinträchtigen kann.",https://media0.faz.net/ppmedia/aktuell/2674050141/1.10459302/facebook_teaser_fplus/das-kind-will-naehe-und-wird.jpg,2025-05-06T14:02:58Z,http://archive.md/20250507130710/https://www.faz.net/aktuell/wissen/medizin-ernaehrung/studie-wie-die-smartphone-nutzung-von-eltern-kindern-schadet-110459249.html,"Dass Smartphones und Tablets kein geeignetes Spielzeug für Kleinkinder sind, ist inzwischen bekannt: Zu viel Zeit am Bildschirm kann etwa der Entwicklung von Kommunikation, Feinmotorik und sozialen F… [+100 chars]",,de,'Kinder'
https://www.tagesschau.de/ausland/europa/eu-russisches-gas-100.html,https://www.tagesschau.de/ausland/europa/eu-russisches-gas-100.html,0,www.tagesschau.de,EU-Kommission plant Verbot aller russischen Gasimporte,Anders als bei Einfuhren von Öl oder Kohle gibt es für russische Gasimporte in die EU noch keine Beschränkungen. Das will die EU-Kommission schnell ändern - und die Importe bis Ende 2027 sogar komplett verbieten.,https://images.tagesschau.de/image/61c4046d-9020-43d4-9d7c-57d188bfd8ec/AAABlqXvMFs/AAABkZLhkrw/16x9-1280/russland-lng-schiff-100.jpg,2025-05-06T14:27:14Z,https://web.archive.org/web/20250506151100/https://www.tagesschau.de/ausland/europa/eu-russisches-gas-100.html,"Stand: 06.05.2025 16:27 Uhr
Anders als bei Einfuhren von Öl oder Kohle gibt es für russische Gasimporte in die EU noch keine Beschränkungen. Das will die EU-Kommission schnell ändern - und die Impor… [+3722 chars]",,de,'Kohle'
https://www.zeit.de/news/2025-05/07/chatgpt-macher-kinder-sollten-weiter-fremdsprachen-lernen,https://www.zeit.de/news/2025-05/07/chatgpt-macher-kinder-sollten-weiter-fremdsprachen-lernen,0,www.zeit.de,OMR in Hamburg: ChatGPT-Macher: Kinder sollten weiter Fremdsprachen lernen,Hier finden Sie Informationen zu dem Thema „OMR in Hamburg“. Lesen Sie jetzt „ChatGPT-Macher: Kinder sollten weiter Fremdsprachen lernen“.,https://img.zeit.de/news/2025-05/07/chatgpt-macher-kinder-sollten-weiter-fremdsprachen-lernen-image-group/wide__1300x731,2025-05-07T03:30:39Z,,"ChatGPT-Produktchef Nicholas Turley (30) ist davon überzeugt, dass intelligente Chatbots das Lernen von Fremdsprachen für Kinder nicht ersetzen sollten. «Die KI kann dir helfen, die Sprache zu lernen… [+1192 chars]",,de,'Kinder'
https://www.zeit.de/zeit-magazin/2025/18/alter-kinder-volljaehrig-verantwortung-pruefers-toechter,https://www.zeit.de/zeit-magazin/2025/18/alter-kinder-volljaehrig-verantwortung-pruefers-toechter,0,www.zeit.de,"Alter der Kinder: ""Du musst dir keine Sorgen machen""","Wenn die Kinder größer werden, wird der Einfluss der Eltern immer kleiner. Nur ihre Sorgen leider nicht. Das kann zur Belastung werden.",https://img.zeit.de/zeit-magazin/2025-04/alter-kinder-volljaehrig-verantwortung-pruefers-toechter-bild/wide__1300x731,2025-05-07T03:31:05Z,http://archive.md/20250508152958/https://www.zeit.de/zeit-magazin/2025/18/alter-kinder-volljaehrig-verantwortung-pruefers-toechter,"Greta ist 18 geworden. Und es ist ein bisschen merkwürdig, wenn Bekannte einem die Hand auf die Schulter legen und sagen, man habe jetzt ""ein weiteres Kind durchgebracht"". Wodurch eigentlich? Greta m… [+567 chars]",,de,'Kinder'
https://www.diepresse.com/19651572/gefaehrliches-spiel-mit-dem-feuer,https://www.diepresse.com/19651572/gefaehrliches-spiel-mit-dem-feuer,0,www.diepresse.com,Gefährliches Spiel mit dem Feuer [premium],Der großflächige Blackout in Spanien ist Ausfluss einer unverantwortlichen Energiepolitik.,https://img.diepresse.com/public/incoming/isyvxn-SPAIN-ENERGYOUTAGES/alternates/DPR_SOCIAL_MEINUNG/SPAIN-ENERGYOUTAGES,2025-05-07T04:30:00Z,http://archive.md/20250507134915/https://www.diepresse.com/19651572/gefaehrliches-spiel-mit-dem-feuer,"Der großflächige Blackout in Spanien ist Ausfluss einer unverantwortlichen Energiepolitik.
Jetzt haben wir also wohl den ersten Solar-Netzcrash samt anschließendem stundenlangen Blackout erlebt. Im … [+453 chars]",,de,'Blackout'
https://www.tagesspiegel.de/gesellschaft/psychologe-louis-lewitan-im-gesprach-manchmal-spricht-schweigen-lauter-als-jedes-wort-13640989.html,https://www.tagesspiegel.de/gesellschaft/psychologe-louis-lewitan-im-gesprach-manchmal-spricht-schweigen-lauter-als-jedes-wort-13640989.html,0,www.tagesspiegel.de,Psychologe Louis Lewitan im Gespräch: „Manchmal spricht Schweigen lauter als jedes Wort“,"Kälte und Unbehagen in den Familien der Täter und Mitläufer, Alkohol zur Betäubung: Lewitan befragte 100 Deutsche für sein Buch „Der blinde Fleck“ über den Umgang mit der Nazizeit.",https://www.tagesspiegel.de/images/13648441/alternates/BASE_16_9_W1400/1746537661000/hitler-greets-young-hitler-youth-conscripts-guarding-the-reich-chancellery-on-april-20-1945-the-da.jpeg,2025-05-07T07:34:50Z,http://archive.md/20250507080956/https://www.tagesspiegel.de/gesellschaft/psychologe-louis-lewitan-im-gesprach-manchmal-spricht-schweigen-lauter-als-jedes-wort-13640989.html,"Herr Lewitan, Sie haben zusammen mit Ihrem Mitautor Stephan Lebert für Ihr Buch Der blinde Fleck rund 100 Deutsche dazu befragt, wie in ihren Familien mit dem Nationalsozialismus umgegangen wurde. Wo… [+381 chars]",,de,'Kälte'
https://www.diepresse.com/19655281/voest-chef-eibensteiner-fordert-dringend-hilfe-bei-energiekosten,https://www.diepresse.com/19655281/voest-chef-eibensteiner-fordert-dringend-hilfe-bei-energiekosten,0,www.diepresse.com,Voest-Chef Eibensteiner fordert dringend Hilfe bei Energiekosten,"Österreichs größter Stahlerzeuger, die Voestalpine, fordert eine sofortige Verlängerung der Strompreiskompensation. Dass die Politik das Instrument bisher nicht verlängert hat, stößt bei Voest-Chef Herbert Eibensteiner auf völliges Unverständnis.",https://img.diepresse.com/public/incoming/a62fxn-kein-Titel/alternates/DPR_SOCIAL_NACHRICHTEN/kein%20Titel,2025-05-07T08:19:29Z,https://web.archive.org/web/20250508042412/https://www.diepresse.com/19655281/voest-chef-eibensteiner-fordert-dringend-hilfe-bei-energiekosten,"Österreichs größter Stahlerzeuger, die Voestalpine, fordert eine sofortige Verlängerung der Strompreiskompensation. Dass die Politik das Instrument bisher nicht verlängert hat, stößt bei Voest-Chef H… [+3607 chars]",,de,'Energiekosten'
https://www.bild.de/sport/mehr-sport/ex-skispringer-roland-rokita-gewinnt-fetten-kohle-preis-681b15e36255e217f6c1f675,https://www.bild.de/sport/mehr-sport/ex-skispringer-roland-rokita-gewinnt-fetten-kohle-preis-681b15e36255e217f6c1f675,0,www.bild.de,Starker Poker-Auftritt - Ex-Skispringer landet fetten Kohle-Gewinn,Seine Talente liegen nicht nur im Sport... In seinen früheren Jahren segelte der Österreicher Roland Rokita (29) reihenweise die Ski...,"https://images.bild.de/681b15e36255e217f6c1f675/9daae0daec62740e11c240930e78b376-landscape,7fb82875?w=1280",2025-05-07T09:21:19Z,https://web.archive.org/web/20250508031028/https://www.bild.de/sport/mehr-sport/ex-skispringer-roland-rokita-gewinnt-fetten-kohle-preis-681b15e36255e217f6c1f675,"Seine Talente liegen nicht nur im Sport...
In seinen früheren Jahren segelte der Österreicher Roland Rokita (29) reihenweise die Skisprungschanzen in seinem Heimatland herunter, war sogar im Nationa… [+2053 chars]",,de,'Kohle'
https://www.golem.de/sonstiges/zustimmung/auswahl.html?from=https://www.golem.de/news/zertifizierung-fuer-energieeffizienz-energy-star-soll-abgeschafft-werden-2505-195981.html&referer=https://t.co/c2b3e570ce,https://www.golem.de/sonstiges/zustimmung/auswahl.html?from=https://www.golem.de/news/zertifizierung-fuer-energieeffizienz-energy-star-soll-abgeschafft-werden-2505-195981.html&referer=https://t.co/c2b3e570ce,0,www.golem.de,Zertifizierung für Energieeffizienz: Energy Star soll abgeschafft werden,"Der Energy Star hilft, jährlich 40 Milliarden US-Dollar an Energiekosten einzusparen. US-Unternehmen und -Handelsorganisationen fordern dessen Erhalt. (Umweltschutz, GreenIT)",,2025-05-07T10:15:01Z,,"Besuchen Sie Golem.de wie gewohnt mit Werbung und Tracking,
 indem Sie der Nutzung aller Cookies zustimmen.
 Details zum Tracking finden Sie im Privacy Center.
Skript wurde nicht geladen. Informat… [+607 chars]",,de,'Energiekosten'
https://www.stern.de/news/umfrage--1-8-millionen-menschen-haben-wegen-hoher-heizkosten-im-winter-gefroren-35701874.html,https://www.stern.de/news/umfrage--1-8-millionen-menschen-haben-wegen-hoher-heizkosten-im-winter-gefroren-35701874.html,0,www.stern.de,"Umfrage: 1,8 Millionen Menschen haben wegen hoher Heizkosten im Winter gefroren","In Deutschland haben einer Umfrage zufolge 1,8 Millionen Menschen (drei Prozent) im vergangenen Winter so stark Heizkosten gespart, dass sie regelmäßig gefroren haben. Besonders häufig waren Menschen mit Gasheizung davon betroffen, wie das Heidelberger Vergle…",https://image.stern.de/35701876/t/ia/v1/w1440/r1.7778/-/07--heizkoerper---eb8c41f51b04b04b.jpg,2025-05-07T10:58:45Z,https://web.archive.org/web/20250509020750/https://www.stern.de/news/umfrage--1-8-millionen-menschen-haben-wegen-hoher-heizkosten-im-winter-gefroren-35701874.html,"Kopiere den aktuellen Link
Zur Merkliste hinzufügen
In Deutschland haben einer Umfrage zufolge 1,8 Millionen Menschen (drei Prozent) im vergangenen Winter so stark Heizkosten gespart, dass sie rege… [+875 chars]",,de,'Heizkosten'
https://www.n-tv.de/auto/Kein-einziger-Offroad-Reifen-kann-ueberzeugen-article25751190.html,https://www.n-tv.de/auto/Kein-einziger-Offroad-Reifen-kann-ueberzeugen-article25751190.html,0,www.n-tv.de,All-Terrain-Reifen im ADAC-Test: Kein einziger Offroad-Reifen kann überzeugen,"Der ADAC hat acht All-Terrain-Reifen einem Vergleichstest unterzogen und zusätzlich einem Pkw-Ganzjahresreifen mit Schneeflockensymbol gegenübergestellt. Das Ergebnis fällt für die AT-Reifen ernüchternd aus: Keiner der Geländereifen erreicht die Note ""gut"".",https://www.n-tv.de/img/incoming/crop25747482/6541329292-cImg_16_9-w1200/Der-ADAC-hat-acht-Offroad-Reifen-unter-die-Lupe-genommen.jpg,2025-05-07T11:01:41Z,https://web.archive.org/web/20250507141006/https://www.n-tv.de/auto/Kein-einziger-Offroad-Reifen-kann-ueberzeugen-article25751190.html,Der ADAC hat acht All-Terrain-Reifen einem Vergleichstest unterzogen und zusätzlich einem Pkw-Ganzjahresreifen mit Schneeflockensymbol gegenübergestellt. Das Ergebnis fällt für die AT-Reifen ernüchte… [+2424 chars],,de,'Schnee'
https://www.zeit.de/gesellschaft/2025-05/sexueller-missbrauch-vergewaltigung-kinder-verbrechen-videopodcast,https://www.zeit.de/gesellschaft/2025-05/sexueller-missbrauch-vergewaltigung-kinder-verbrechen-videopodcast,0,www.zeit.de,"Sexueller Missbrauch: ""Nicht nur die Opfer sind Kinder, sondern auch die mutmaßlichen Täter""",Der 13-jährige Jan soll vergewaltigt worden sein – von seinen Mannschaftskameraden aus dem Handballverein. Wie konnte es zu dieser Tat unter Kindern kommen?,https://img.zeit.de/gesellschaft/2025-05/sexueller-missbrauch-vergewaltigung-kinder-verbrechen-videopodcast-foto/wide__1300x731,2025-05-07T11:29:50Z,http://archive.md/20250507113519/https://www.zeit.de/gesellschaft/2025-05/sexueller-missbrauch-vergewaltigung-kinder-verbrechen-videopodcast,Sommer 2023: Die Kinder des Hamburger Handballvereins freuen sich auf das Trainingslager in Dänemark so auch Jan*. Doch am Abend des dritten Tages entwickelt sich die Reise für ihn zu einem Albtraum.… [+367 chars],,de,'Kinder'
https://www.perlentaucher.de/buecherschau/2025-05-07.html,https://www.perlentaucher.de/buecherschau/2025-05-07.html,0,www.perlentaucher.de,BÜCHERSCHAU DES TAGES: Das tut den Knochen gut,"Die FAZ lässt sich von Charles Nodiers romantischem Räuber Jean Sbogar den Kopf verdrehen. Außerdem besucht sie mit Chantal Ackermann ""Eine Familie in Brüssel"", in deren emotionaler Kälte nur die Wärme kleiner Dinge bleibt. Dlf ist beeindruckt von Lizzie Doro…",https://www.perlentaucher.de/cdata/buecherschau-twitterbild/7733.png,2025-05-07T12:00:00Z,,"Perlentaucher-Fakten
108089
Rezensionsnotizen
65725
Bücher
37343
Buchautoren
Bücherschau des Tages
Das tut den Knochen gut
Notizen zu den Buchkritiken des Tages aus FAZ, FR, NZZ, SZ, taz, Ze… [+721 chars]",,de,'Kälte'
https://www.welt.de/wirtschaft/plus256072096/Energiewende-Einfach-durchhalten-Die-bemerkenswerte-Stille-nach-dem-Spanien-Blackout.html,https://www.welt.de/wirtschaft/plus256072096/Energiewende-Einfach-durchhalten-Die-bemerkenswerte-Stille-nach-dem-Spanien-Blackout.html,0,www.welt.de,Einfach durchhalten? Die bemerkenswerte Stille nach dem Spanien-Blackout,Der Blackout in Spanien wirft auch ein Schlaglicht auf die Verletzlichkeit des deutschen Netzes. Durch die hohen Schwankungen beim Öko-Strom könnte es auch hier zu Ausfällen kommen. Doch in der Debatte ist es schnell ruhig geworden – oder es wird zur Zuversic…,https://img.welt.de/img/wirtschaft/mobile256077078/5537932247-ci16x9-w1200-fnov-fpotl-fpi157750653/Image-664e12941e258259cdd32bc5.jpg,2025-05-07T12:31:27Z,https://web.archive.org/web/20250507172301/https://www.welt.de/wirtschaft/plus256072096/Energiewende-Einfach-durchhalten-Die-bemerkenswerte-Stille-nach-dem-Spanien-Blackout.html,Der Blackout in Spanien wirft auch ein Schlaglicht auf die Verletzlichkeit des deutschen Netzes. Durch die hohen Schwankungen beim Öko-Strom könnte es auch hier zu Ausfällen kommen. Doch in der Debat… [+71 chars],,de,'Blackout'
https://www.focus.de/immobilien/netzdienlichkeit-deutschland-auf-blackout-kurs-nur-so-retten-wir-unsere-stromversorgung_68ad18fb-2258-40de-b041-a7d4f00537da.html,https://www.focus.de/immobilien/netzdienlichkeit-deutschland-auf-blackout-kurs-nur-so-retten-wir-unsere-stromversorgung_68ad18fb-2258-40de-b041-a7d4f00537da.html,0,www.focus.de,Netzdienlichkeit: Deutschland auf Blackout-Kurs: Nur so retten wir unsere Stromversorgung,"Die Politik setzt auf publikumstaugliche Solar-Anlagen und Windkraft. Doch das eigentliche Rückgrat der Energiewende – Speicher, Netze, Steuerung – blieb weitgehend unmodernisiert. Die Folgen sind ein überlastetes Netz und ein steigendes Risiko für Stromausfä…",https://quadro.burda-forward.de/ctf/56902749-14f7-4fe2-aade-dee188c25ca7.eeb50aee-c5fb-4f07-8c6f-033c2b60f2ff.jpeg?im=RegionOfInterestCrop%3D%281200%2C630%29%2CregionOfInterest%3D%28693%2C390%29&hash=ba3d43ca42f86bcd8168e773f8e031ebba619c47b62abebbebbda493d8227f36,2025-05-07T14:11:58Z,,"Deutschland rühmt sich für seine Vorreiterrolle in der Energiewende doch die Realität sieht düster aus. Der Anteil erneuerbarer Energien am Bruttoendenergieverbrauch (Strom, Wärme und Mobilität) lieg… [+9101 chars]",,de,'Blackout'
https://www.tagesspiegel.de/themenspeziale/bildungundforschung/freie-universitat-fur-alle-viele-moglichkeiten-neues-zu-lernen-13647649.html,https://www.tagesspiegel.de/themenspeziale/bildungundforschung/freie-universitat-fur-alle-viele-moglichkeiten-neues-zu-lernen-13647649.html,0,www.tagesspiegel.de,"Freie Universität für alle: Viele Möglichkeiten, Neues zu lernen","Viele Möglichkeiten, Neues zu lernen: Workshops im Botanischen Garten Berlin besuchen, nach der Arbeit Vorlesungen hören oder als Gast an der Uni studieren.",https://www.tagesspiegel.de/images/13647622/alternates/BASE_16_9_W1400/1746533798000/16-botanischer-garten-wasserfall-c-christiane-patic.jpeg,2025-05-07T14:25:01Z,,"Auch über das Studienangebot hinaus hat die Freie Universität viel zu bieten.
 Ab in die Botanik! 
Ob Nature Journaling, Kräutergärtnern oder Heilpflanzen für Kinder: Die neuen Führungen und Worksh… [+3372 chars]",,de,'ältere Menschen'
https://www.zeit.de/news/2025-05/07/14-kinder-bei-schulbusunfall-leicht-verletzt,https://www.zeit.de/news/2025-05/07/14-kinder-bei-schulbusunfall-leicht-verletzt,0,www.zeit.de,Busunfall nach Bremsmanöver: 14 Kinder bei Schulbusunfall leicht verletzt,Hier finden Sie Informationen zu dem Thema „Busunfall nach Bremsmanöver“. Lesen Sie jetzt „14 Kinder bei Schulbusunfall leicht verletzt“.,https://img.zeit.de/news/2025-05/07/14-kinder-bei-schulbusunfall-leicht-verletzt-image-group/wide__1300x731,2025-05-07T14:25:43Z,,Bei einem Schulbusunfall nahe Schwerin sind mindestens 14 Grundschulkinder leicht verletzt worden. Der mit über 27 Kinder einer dritten Klasse besetzte Bus sei gegen 13.40 Uhr auf dem Rückweg vom Sch… [+704 chars],,de,'Kinder'
https://science.orf.at/stories/3230127/,https://science.orf.at/stories/3230127/,0,science.orf.at,Mehr Hitzewellen für junge Generationen,"Im Jahr 2020 geborene Menschen werden mit deutlich höherer Wahrscheinlichkeit extreme Hitzewellen erleben als ältere. Selbst wenn die Erderwärmung auf 1,5 Grad Celsius über dem vorindustriellen Niveau gehalten werden könnte, werden etwa 52 Prozent der heute F…",https://ibs.orf.at/science?image=https%3A%2F%2Ftubestatic.orf.at%2Fmims%2F2021%2F28%2F03%2Fcrops%2Fw%3D1200%2Ch%3D627%2Cq%3D75%2F1004430_master_354103_993211_opener_349783_hitzewelle_kanada_usa_r.jpg%3Fs%3Dc4b5a51e4771c8c84fd5515fdf967c5b255f521a,2025-05-07T15:00:00Z,,"Im Zuge der Klimaerwärmung kommt es laut der soeben im Fachjournal Nature erschienenen Studie messbar zu mehr und heftigeren Extremwetterereignissen. Einflüsse des Menschen wurden bei Hitzewellen, Fl… [+3056 chars]",,de,'ältere Menschen'
https://steiermark.orf.at/stories/3304354/,https://steiermark.orf.at/stories/3304354/,0,steiermark.orf.at,KAGes-Klimaprojekt mit Preis ausgezeichnet,Die KAGes darf sich über einen Preis für eine klimafreundliche Anlage freuen. Ausgezeichnet wurde die neue Wärme-Kälte-Kopplungsanlage am Landeskrankenhaus Graz. Dabei wird vorhandene Abwärme des Spitals zur Erzeugung von Energie genutzt.,https://ibs.orf.at/stm?image=https%3A%2F%2Foekastatic.orf.at%2Fmims%2F2025%2F19%2F02%2Fcrops%2Fw%3D1200%2Ch%3D627%2Cq%3D75%2F2615862_master_1004502_neue_waerme-kaelte-anlage_am_lkh_univ._klinikum_1__c_kages.jpg%3Fs%3D485867f2da3b28b37a0b7b1d03ec5f6746eb38e8,2025-05-07T15:19:00Z,,"In Krankenhäusern besteht das ganze Jahr über ein großer Bedarf an Kälte und an Wärme. OP-Bereiche und medizintechnische Großgeräte müssen, unabhängig von der Jahreszeit, gekühlt werden, während die … [+1663 chars]",,de,'Kälte'
https://www.n-tv.de/wissen/Kindergeneration-wird-Klimafolgen-am-staerksten-spueren-article25752482.html,https://www.n-tv.de/wissen/Kindergeneration-wird-Klimafolgen-am-staerksten-spueren-article25752482.html,0,www.n-tv.de,Risiko extremer Hitzewellen: Kindergeneration wird Klimafolgen am stärksten spüren,Menschen im Rentenalter werden wenig von den schweren Folgen des Klimawandels mitbekommen - im Vergleich zu heutigen Kindern. Laut einer neuen Studie wird selbst im günstigsten Fall ein Großteil der seit 2020 Geborenen beispiellose Hitzewellen erleben. Und es…,https://www.n-tv.de/img/incoming/crop25752743/4761328357-cImg_16_9-w1200/458821771.jpg,2025-05-07T15:23:23Z,https://web.archive.org/web/20250508023928/https://www.n-tv.de/wissen/Kindergeneration-wird-Klimafolgen-am-staerksten-spueren-article25752482.html,Menschen im Rentenalter werden wenig von den schweren Folgen des Klimawandels mitbekommen - im Vergleich zu heutigen Kindern. Laut einer neuen Studie wird selbst im günstigsten Fall ein Großteil der … [+3578 chars],,de,'Kinder'
https://stadt-bremerhaven.de/scalable-capital-kuendigt-depots-fuer-kinder-an/,https://stadt-bremerhaven.de/scalable-capital-kuendigt-depots-fuer-kinder-an/,0,stadt-bremerhaven.de,Scalable Capital kündigt Depots für Kinder an,"Scalable Capital, ein Neobroker und Konkurrent von beispielsweise Trade Republic, hat für den Sommer 2025 die Einführung von Kinder-Depots angekündigt. Diese sollen Familien dabei helfen, sich auf die durch die neue Bundesregierung in Aussicht gestellte Frühs…",https://stadt-bremerhaven.de/wp-content/uploads/2023/01/scalable_.jpg,2025-05-07T15:30:26Z,,"Scalable Capital, ein Neobroker und Konkurrent von beispielsweise Trade Republic, hat für den Sommer 2025 die Einführung von Kinder-Depots angekündigt. Diese sollen Familien dabei helfen, sich auf di… [+1261 chars]",,de,'Kinder'
https://kaernten.orf.at/stories/3304423/,https://kaernten.orf.at/stories/3304423/,0,kaernten.orf.at,Betrugsmasche lebt wieder auf,"Die Polizei warnt erneut vor Telefonbetrügern. In den vergangenen Tagen sei es wieder vermehrt zu solchen Betrugsanrufen gekommen. Dabei geben sich die Anrufer als Polizisten aus. Vor allem ältere Menschen sollen auf der Hut sein, so die echte Polizei am Mitt…",https://ibs.orf.at/ktn?image=https%3A%2F%2Foekastatic.orf.at%2Fmims%2F2025%2F08%2F57%2Fcrops%2Fw%3D1200%2Ch%3D627%2Cq%3D75%2F2525224_master_967357_sicherheitsgipfel_18.2.25_orf_0941_00_00_00_00.jpg%3Fs%3D94609820b3aa381fce9d3612b5c834a4c4948494,2025-05-07T15:39:13Z,https://web.archive.org/web/20250509051334/https://kaernten.orf.at/stories/3304423/,"Seit Jahren wird vor solchen Telefonbetrügern gewarnt, dennoch finden sie immer noch Opfer. Vorwiegend ältere Personen fallen auf die Anrufer herein, die sich als Polizisten ausgeben und sagen, dass … [+901 chars]",,de,'ältere Menschen'
https://www.dw.com/de/ende-des-zweiten-weltkriegs-sie-h%C3%A4ngten-ihre-kinder/a-72307368,https://www.dw.com/de/ende-des-zweiten-weltkriegs-sie-h%C3%A4ngten-ihre-kinder/a-72307368,0,www.dw.com,"Ende des Zweiten Weltkriegs: ""Sie hängten ihre Kinder!""","George Leitmann (99) hat als US-Soldat geholfen, Deutschland vom Nationalsozialismus zu befreien. 80 Jahre nach Kriegsende warnt er vor der Rückkehr des Faschismus.",https://static.dw.com/image/72312350_6.jpg,2025-05-07T15:56:00Z,,"Als George Leitmann zum ersten Mal nach Deutschland kommt, ist er 19 Jahre alt. Es ist Frühjahr 1945, nicht lange vor dem Kriegsende in Europa. An allen Fronten rücken US-Soldaten, britische Soldaten… [+9014 chars]",,de,'Kinder'
https://www.bild.de/sport/mehr-sport/boxen-weltmeisterin-nina-meinke-verteidigt-titel-gegen-daniela-bermudez-681b2877916ea53a5173d03b,https://www.bild.de/sport/mehr-sport/boxen-weltmeisterin-nina-meinke-verteidigt-titel-gegen-daniela-bermudez-681b2877916ea53a5173d03b,0,www.bild.de,Rückkampf nach Blutschlacht - Box-Weltmeisterin macht Blackout-Training,Profi-Boxerin Nina Meinke verteidigt ihren IBF-WM-Titel im Federgewicht Samstag in Rostock gegen Daniela Bermudez aus Argentinien.,"https://images.bild.de/681b2877916ea53a5173d03b/0de63be1d6f79c26a2599de7554a66f3,e564a56b?w=1280",2025-05-07T16:14:03Z,,"Es war eine Blutschlacht!
Ende September holte sich Profi-Boxerin Nina Meinke (32) in Hamburg gegen die beinharte Argentinierin Daniela Bermudez (35) die IBF-Weltmeisterschaft im Federgewicht (57,2 … [+2580 chars]",,de,'Blackout'
https://www.jungewelt.de/artikel/499591.ein-fest-mit-tränen-in-den-augen.html,https://www.jungewelt.de/artikel/499591.ein-fest-mit-tränen-in-den-augen.html,0,www.jungewelt.de,Kommentar: Ein Fest mit Tränen in den Augen,Gastkommentar des russischen Botschafters Sergej J. Netschajew zum 80. Jahrestag des Sieges im Großen Vaterländischen Krieg und der Befreiung Deutschlands und Europas vom Nazismus.,https://www.jungewelt.de/img/1100/208518.jpg,2025-05-07T17:37:24Z,,Am 9. Mai wird in unserem Land der 80. Jahrestag des Sieges im Großen Vaterländischen Krieg und der Befreiung Deutschlands und Europas vom Nazismus gefeiert. Für alle Völker der ehemaligen Sowjetunio… [+6174 chars],,de,'Gas'
https://www.stern.de/familie/schimmel-im-schlafzimmer--so-handeln-sie-schnell-und-richtig--34333828.html,https://www.stern.de/familie/schimmel-im-schlafzimmer--so-handeln-sie-schnell-und-richtig--34333828.html,0,www.stern.de,Tipps zur Vorbeugung: Schimmel im Schlafzimmer: Mit diesen Methoden können Sie ihn bekämpfen,"Wer mit Schimmel im Schlafzimmer zu kämpfen hat, sollte schnell reagieren. Wir verraten, welche Methoden dabei helfen können, ihn wirksam zu bekämpfen und ihm vorzubeugen.",https://image.stern.de/34333830/t/jG/v3/w1440/r1.7778/-/schimmel-im-schlafzimmer.jpg,2025-05-08T05:29:00Z,https://web.archive.org/web/20250508064141/https://www.stern.de/familie/schimmel-im-schlafzimmer--so-handeln-sie-schnell-und-richtig--34333828.html,"Kopiere den aktuellen Link
Zur Merkliste hinzufügen
Wer mit Schimmel im Schlafzimmer zu kämpfen hat, sollte schnell reagieren. Wir verraten, welche Methoden dabei helfen können, ihn wirksam zu bekä… [+6208 chars]",,de,'Schimmel'
https://www.sueddeutsche.de/muenchen/zweiter-weltkrieg-ende-muenchen-schule-li.3222700,https://www.sueddeutsche.de/muenchen/zweiter-weltkrieg-ende-muenchen-schule-li.3222700,0,www.sueddeutsche.de,80 Jahre Kriegsende: Zeitreise im Klassenzimmer,"Vor 80 Jahren endete der Zweite Weltkrieg, gerade für Kinder und Jugendliche liegt das weit zurück. Wie Schülerinnen und Schülern vermittelt wird, was der Krieg und dessen Ende für die Menschen damals bedeutete.",https://www.sueddeutsche.de/2025/05/06/28519883-3e98-4afc-96af-229eca2c6731.jpeg?q=60&fm=webp&width=1200&rect=0%2C206%2C4000%2C2250,2025-05-08T09:32:37Z,https://web.archive.org/web/20250508094848/https://www.sueddeutsche.de/muenchen/zweiter-weltkrieg-ende-muenchen-schule-li.3222700,"Vor 80 Jahren endete der Zweite Weltkrieg, vor 80 Jahren wurde Deutschland befreit. So lang ist das her, so weit liegt das zurück, gerade für Kinder und Jugendliche. Und so sehen es viele Schulen in … [+5871 chars]",,de,'ältere Menschen'
