index,url,valid,domain,title,description,image,published,archive,content,quote,language,keyword
https://www.n-tv.de/panorama/Geschmack-der-Heimat-geliefert-von-einer-Drohne-article24980752.html,https://www.n-tv.de/panorama/Geschmack-der-Heimat-geliefert-von-einer-Drohne-article24980752.html,0,www.n-tv.de,"Borschtsch im Schützengraben: Geschmack der Heimat, geliefert von einer Drohne","Eines der schlimmsten Probleme in einem Schützengraben ist ganz sicher der Hunger. Aber auch Kälte, Einsamkeit und die Angst, dass man vergessen wird an diesem schrecklichsten aller Orte. Gegen dieses Gefühl versucht die Ukrainerin Olga Belenko anzukämpfen: S…",https://bilder1.n-tv.de/img/incoming/crop24988320/2891329776-cImg_16_9-w1200/OlgaBorscht-06-002-.jpg,2024-06-04T16:32:52Z,,"Eines der schlimmsten Probleme in einem Schützengraben ist ganz sicher der Hunger. Aber auch Kälte, Einsamkeit und die Angst, dass man vergessen wird an diesem schrecklichsten aller Orte. Gegen diese… [+5909 chars]",,de,'Kälte'
https://www.tagesschau.de/inland/hochwasser-passau-102.html,https://www.tagesschau.de/inland/hochwasser-passau-102.html,0,www.tagesschau.de,Passau versinkt im Hochwasser,Zwar kennt man sich in Passau mit Hochwassern aus - durch die bayerische Stadt fließen drei Flüsse. Doch in diesem Jahr ist die Lage sehr angespannt. Und auch in anderen Teilen Bayerns sind die Pegel entlang der Donau weiter hoch.,https://images.tagesschau.de/image/9e2ef122-1dbb-41f1-8a6f-57101e9f82dc/AAABj-QU3W8/AAABjwnlFvA/16x9-1280/passau-122.jpg,2024-06-04T16:38:30Z,,"Stand: 04.06.2024 18:38 Uhr
Zwar kennt man sich in Passau mit Hochwassern aus - durch die bayerische Stadt fließen drei Flüsse. Doch in diesem Jahr ist die Lage sehr angespannt. Und auch in anderen … [+4124 chars]",,de,'Hochwasser'
https://rivva.de/333292780,https://rivva.de/333292780,0,rivva.de,Kommentar zum Hochwasser: Gummistiefel-Politik statt Klimaschutz – tagesschau.de,,,2024-06-04T16:40:02Z,,"Rivva ist auf die freiwillige Leser:innenfinanzierung angewiesen. Deine Spende hilft, das Projekt in Schuss zu halten, zu verbessern, auszubauen.
Bitte lest dazu meinen Blogeintrag mit den Hintergrü… [+24 chars]",,de,'Hochwasser'
https://www.faz.net/aktuell/rhein-main/frankfurt/fussball-em-das-sind-die-plaene-fuer-die-fanzone-in-frankfurt-19765220.html,https://www.faz.net/aktuell/rhein-main/frankfurt/fussball-em-das-sind-die-plaene-fuer-die-fanzone-in-frankfurt-19765220.html,0,www.faz.net,Fußball-EM in Frankfurt: Vorbereitungen laufen auf Hochtouren,Die EM-Gastgeberstadt Frankfurt wirft sich das Gewand für das Fußballturnier über. Bei den Vorbereitungen drohte wegen des Hochwassers ein Rückbau der Fanzone.,https://media1.faz.net/ppmedia/aktuell/2054311821/1.9765219/facebook_teaser/grosses-kino-am-mainufer-die.jpg,2024-06-04T16:40:08Z,,In der Wirklichkeit der EM-Vorbereitungen ist alles etwas beschwerlicher: Da schlagen irgendwelche Chaoten in der Nacht schon einmal eine Glastür des erst am Vortag in Millimeterarbeit vom Westhafen … [+4859 chars],,de,'Hochwasser'
https://www.faz.net/aktuell/rhein-main/aktuelle-nachrichten-aus-frankfurt-hessen-motorradfahrer-in-gudensberg-toedlich-verunglueckt-faz-19735361.html,https://www.faz.net/aktuell/rhein-main/aktuelle-nachrichten-aus-frankfurt-hessen-motorradfahrer-in-gudensberg-toedlich-verunglueckt-faz-19735361.html,0,www.faz.net,Aktuelle Nachrichten aus Frankfurt und Rhein-Main | FAZ,Tarifstreit bei privaten Busfahrern vor Lösung +++ Noch kein abschließendes Votum des Landes zu Teilschließung von Mathilden-Hospital +++ Über 500 Kilogramm Kokain in Frankfurt und Dietzenbach entdeckt +++ Hochwasser am Rhein soll am Dienstag Höchststand erre…,https://media1.faz.net/ppmedia/aktuell/gesellschaft/1386652612/1.9700929/facebook_teaser/ein-blaulicht-leuchtet-auf-dem.jpg,2024-06-04T16:45:30Z,,"Wiesbaden/Büdingen. Wie sich das Hessische Gesundheitsministerium zur geplanten Teilschließung des Mathilden-Hospitals in Büdingen stellt, ist weiter offen. Wie eine Sprecherin der F.A.Z. mitteilte, … [+1697 chars]",,de,'Hochwasser'
https://www.faz.net/aktuell/gesellschaft/ungluecke/hochwasser-in-passau-donau-erreicht-am-dienstag-pegel-von-fast-zehn-metern-19764663.html,https://www.faz.net/aktuell/gesellschaft/ungluecke/hochwasser-in-passau-donau-erreicht-am-dienstag-pegel-von-fast-zehn-metern-19764663.html,0,www.faz.net,Hochwasser in Passau: „Es ist eine Katastrophe“,"In Passau erreicht die Donau am Dienstag einen Pegel von fast zehn Metern. Das ist weniger als beim Jahrhunderthochwasser 2013 – aber mehr, als viele in den betroffenen Stadtteilen erwartet haben.",https://media0.faz.net/ppmedia/aktuell/gesellschaft/1956728458/1.9764660/facebook_teaser/in-passau-teile-der-altstadt.jpg,2024-06-04T16:50:09Z,,"In einer dieser Gassen steht Stephan Terletzki und blickt auf das matschbraune Flusswasser, das alles bedeckt. Die Promenade ist längst verschwunden, es ragen nur noch Baumkronen und Verkehrsschilder… [+5513 chars]",,de,'Hochwasser'
https://www.zeit.de/sport/2024-06/wdr-umfrage-fussball-rassismus-nationalmannschaft,https://www.zeit.de/sport/2024-06/wdr-umfrage-fussball-rassismus-nationalmannschaft,0,www.zeit.de,"WDR-Umfrage: ""Meine Kinder machen Rassismus-Erfahrungen wie ich vor 40 Jahren""","Jeder Fünfte will eine ""weißere"" Nationalmannschaft. Die Empörung über die Frage geht am Problem vorbei, sagen Experten und Betroffene. Was stattdessen getan werden muss.",https://img.zeit.de/sport/2024-06/wdr-umfrage-fussball-rassismus-nationalmannschaft-teaser/wide__1300x731,2024-06-04T17:01:48Z,,"In einer Umfrage des WDR wünschten sich ein Fünftel der Befragten ""mehr weiße Spieler in der Nationalmannschaft"". Was nun? Ein Gespräch mit Otto Addo, ehemaliger deutsch-ghanaischer Fußballprofispiel… [+580 chars]",,de,'Kinder'
https://www.tagesspiegel.de/berlin/hochwasser-in-suddeutschland-auch-helfer-aus-berlin-und-brandenburg-stehen-bereit--aber-werden-sie-gebraucht-11766554.html,https://www.tagesspiegel.de/berlin/hochwasser-in-suddeutschland-auch-helfer-aus-berlin-und-brandenburg-stehen-bereit--aber-werden-sie-gebraucht-11766554.html,0,www.tagesspiegel.de,Hochwasser in Süddeutschland: Auch Helfer aus Berlin und Brandenburg stehen bereit – aber werden sie gebraucht?,In Berlin und Brandenburg bereiten sich Hilfsorganisationen auf einen möglichen Einsatz in den Hochwassergebieten vor. Ihre Unterstützung wurde bisher allerdings noch nicht angefordert.,https://www.tagesspiegel.de/images/hochwasser-in-bayern-passau10/alternates/BASE_16_9_W1400/hochwasser-in-bayern---passau.jpeg,2024-06-04T17:01:52Z,,"Obwohl ihre Hilfe noch nicht angefordert wurde, sind Helfer aus Berlin und Brandenburg vorbereitet. Für den Fall, dass sie ihre Kollegen in den Hochwassergebieten in Bayern und Baden-Württemberg unte… [+2719 chars]",,de,'Hochwasser'
https://www.stern.de/panorama/wetter/hochwasser---das-schlimmste-ist--wenn-der-eigene-kamerad-verunglueckt--34765432.html,https://www.stern.de/panorama/wetter/hochwasser---das-schlimmste-ist--wenn-der-eigene-kamerad-verunglueckt--34765432.html,0,www.stern.de,"Landesfeuerwehrverband Bayern: Kampf gegen das Hochwasser: ""Das Schlimmste ist, wenn der eigene Kamerad verunglückt""","Zehntausende Einsatzkräfte sind beim Hochwasser in Bayern im Einsatz. Extremsituationen sind für sie keine Ausnahme, sie gehören zum Alltag. Fredi Weiß ist seit mehr als 40 Jahren bei der Feuerwehr und weiß was passiert, wenn der Pegel steigt.",https://image.stern.de/34765434/t/GO/v2/w1440/r1.7778/-/feuerwehr-hochwasser.jpg,2024-06-04T17:38:00Z,,"Zehntausende Einsatzkräfte sind beim Hochwasser in Bayern im Einsatz. Extremsituationen sind für sie keine Ausnahme, sie gehören zum Alltag. Fredi Weiß ist seit mehr als 40 Jahren bei der Feuerwehr u… [+7226 chars]",,de,'Hochwasser'
https://www.jungewelt.de/artikel/476684.klimakatastrophe-nach-dem-hochwasser.html,https://www.jungewelt.de/artikel/476684.klimakatastrophe-nach-dem-hochwasser.html,0,www.jungewelt.de,Klimakatastrophe: Nach dem Hochwasser,"Die Flutschäden in Süddeutschland sind enorm, aber für Bundesregierung kein Grund, den Klimaschutz endlich ernst zu nehmen.",https://www.jungewelt.de/img/1100/195675.jpg,2024-06-04T17:39:31Z,,Langsam beruhigt sich das Wetter etwas. Die Menschen in den süddeutschen Überschwemmungsgebieten können aufatmen und sich ans Aufräumen machen. Die Hochwasserwelle schiebt sich die Donau abwärts und … [+3740 chars],,de,'Hochwasser'
https://www.stern.de/panorama/hochwasser--wie-gefaehrdet-ist-die-eigene-nachbarschaft--34763830.html,https://www.stern.de/panorama/hochwasser--wie-gefaehrdet-ist-die-eigene-nachbarschaft--34763830.html,0,www.stern.de,Hochwasser in Süddeutschland: Hochwasser: Wie gefährdet ist die eigene Nachbarschaft?,2024 ist schon jetzt das Jahr der Jahrhunderthochwasser: In mehreren Bundesländern regnete es so stark wie noch nie. Damit steigt auch das Risiko selbst zum Betroffenen zu werden.,https://image.stern.de/34763832/t/ls/v5/w1440/r1.7778/-/hochwasser-karte-bild-1.jpg,2024-06-04T17:50:00Z,,"2024 ist schon jetzt das Jahr der Jahrhunderthochwasser: Im Januar in Niedersachsen, im Mai im Saarland und aktuell in Bayern regnete es teilweise so stark wie noch nie. Die Überschwemmungen beschrän… [+3182 chars]",,de,'Hochwasser'
https://www.stern.de/gesellschaft/regional/bayern/hochwasser--landkreis-neu-ulm-hebt-katastrophenfall-auf-34769832.html,https://www.stern.de/gesellschaft/regional/bayern/hochwasser--landkreis-neu-ulm-hebt-katastrophenfall-auf-34769832.html,0,www.stern.de,Hochwasser: Landkreis Neu-Ulm hebt Katastrophenfall auf,"Nach dem oberbayerischen Landkreis Rosenheim hat auch der Landkreis Neu-Ulm in Schwaben den Katastrophenfall wieder aufgehoben. ""Es liegen anstrengende Tage hinter uns"", sagte Landrätin Eva Treu (CSU) am Dienstagabend. ""Ich bin froh, dass wir den Katastrophen…",https://image.stern.de/34769834/t/hn/v1/w1440/r1.7778/-/04--urnnewsmldpacom2009010124060499276392v3w800h600l640t425r1920b1278jpeg---294e82dce53b1606.jpg,2024-06-04T17:56:58Z,,"Nach dem oberbayerischen Landkreis Rosenheim hat auch der Landkreis Neu-Ulm in Schwaben den Katastrophenfall wieder aufgehoben. ""Es liegen anstrengende Tage hinter uns"", sagte Landrätin Eva Treu (CSU… [+629 chars]",,de,'Hochwasser'
https://orf.at/stories/3359670/,https://orf.at/stories/3359670/,0,orf.at,Pegel in Oberösterreich gehen leicht zurück,"Insbesondere in Oberösterreich ist die Hochwasserlage den ganzen Tag über angespannt gewesen – in Linz trat die Donau über die Ufer, Straßen wurden gesperrt. Am späten Nachmittag begannen die Pegel in Linz, Achleiten und Mauthausen etwas zu sinken, um die Mit…",https://ibs.orf.at/news?image=https%3A%2F%2Fassets.orf.at%2Fmims%2F2024%2F23%2F37%2Fcrops%2Fw%3D1200%2Ch%3D630%2Cq%3D75%2F2230302_master_846737_oesterreich_hochwasser_diabend_a.jpg%3Fs%3D49b361a7edc64ab8f27bd51476dc4fceec6df7fd,2024-06-04T18:30:28Z,,"Dienstagnachmittag war der Pegelstand in Linz vorübergehend bei 7,12 Metern gelegen danach wurde vom Hydrographischen Dienst Oberösterreich kein höherer Wert mehr ausgewiesen, vielmehr ging der Pegel… [+6247 chars]",,de,'Hochwasser'
https://www.stern.de/gesellschaft/regional/bayern/unwetter--hochwasserlage-in-bayern-bleibt-teils-angespannt--ddrei-tote-34769654.html,https://www.stern.de/gesellschaft/regional/bayern/unwetter--hochwasserlage-in-bayern-bleibt-teils-angespannt--ddrei-tote-34769654.html,0,www.stern.de,Unwetter: Hochwasserlage in Bayern bleibt teils angespannt: Ddrei Tote,"In einigen bayerischen Hochwassergebieten wird schon aufgeräumt, entlang der unteren Donau bleibt die Lage aber angespannt. Es gibt drei Todesopfer - und noch immer werden Menschen vermisst.",https://image.stern.de/34769656/t/U7/v2/w1440/r1.7778/-/04--urnnewsmldpacom2009010124060499273995v3w800h600l640t417r1920b1252jpeg---8687d4c75b1d4839.jpg,2024-06-04T19:02:12Z,,"In einigen bayerischen Hochwassergebieten wird schon aufgeräumt, entlang der unteren Donau bleibt die Lage aber angespannt. Es gibt drei Todesopfer - und noch immer werden Menschen vermisst.
Beim Ho… [+8154 chars]",,de,'Hochwasser'
https://www.stern.de/gesellschaft/regional/bayern/hochwasser--scheitel-an-donau-und-inn-in-passau-ueberschritten-34769950.html,https://www.stern.de/gesellschaft/regional/bayern/hochwasser--scheitel-an-donau-und-inn-in-passau-ueberschritten-34769950.html,0,www.stern.de,Hochwasser: Scheitel an Donau und Inn in Passau überschritten,"Passau - In der Stadt Passau im Südosten Deutschlands ist der Scheitel der Flüsse Donau und Inn erreicht - die Wasserstände fallen leicht, wie die Stadt",https://image.stern.de/34769952/t/Ik/v1/w1440/r1.7778/-/04--urnnewsmldpacom2009010124060499277231v3w800h600l640t424r1920b1273jpeg---1a912472e1a8a8e8.jpg,2024-06-04T19:17:12Z,,"Kleines Aufatmen in der Dreiflüssestadt Passau: Die erwarteten Höchststände an Donau und Inn wurden erreicht - ganz langsam sinken die Wasserstände.
In der Stadt Passau im Südosten Deutschlands ist … [+1353 chars]",,de,'Hochwasser'
https://www.sueddeutsche.de/panorama/hochwasser-rettung-frau-flut-baum-schwaben-bayern-lux.9vuocpnrbn7i3uPCZieifu,https://www.sueddeutsche.de/panorama/hochwasser-rettung-frau-flut-baum-schwaben-bayern-lux.9vuocpnrbn7i3uPCZieifu,0,www.sueddeutsche.de,Flut in Schwaben: Frau nach 62 Stunden aus Baum gerettet,Die 32-Jährige wurde im Wald bei Neu-Ulm von dem Hochwasser überrascht. Sie rettete sich auf einen Baum – und wurde dort nach zweieinhalb Tagen entdeckt.,https://www.sueddeutsche.de/2024/06/04/75586308-9920-4dee-8690-51471fc28242.jpeg?q=60&fm=webp&width=1200&rect=undefined%2Cundefined%2Cundefined%2Cundefined,2024-06-04T19:21:57Z,,"Sie war seit der Nacht zum Sonntag im überfluteten Silberwald bei Neu-Ulm vermisst worden. Die Frau sei weitgehend unverletzt, teilten die Einsatzkräfte mit. Die geschwächte und dehydrierte 32-Jährig… [+808 chars]",,de,'Hochwasser'
https://www.stern.de/panorama/wetter/unwetter-ticker--pegel-an-donau-und-inn-sinken-34758674.html,https://www.stern.de/panorama/wetter/unwetter-ticker--pegel-an-donau-und-inn-sinken-34758674.html,0,www.stern.de,Hochwasser in Süddeutschland: Frau nach 52 Stunden aus Baum gerettet – Pegel an Donau und Inn sinken,Tausende Helfer sind in den Hochwassergebieten weiter im Einsatz. Fünf Todesopfer wurden bislang geborgen. Die Lage in Rheinland-Pfalz entspannt sich. Die Nachrichten aus dem Unwetter-Gebiet im stern-Ticker.,https://image.stern.de/34768716/t/za/v2/w1440/r1.7778/-/unwetter-passau.jpg,2024-06-04T19:28:00Z,,"04.06.2024, 21:28
 53 Min.
Tausende Helfer sind in den Hochwassergebieten weiter im Einsatz. Fünf Todesopfer wurden bislang geborgen. Die Lage in Rheinland-Pfalz entspannt sich. Die Nachrichten aus… [+94228 chars]",,de,'Hochwasser'
https://www.faz.net/aktuell/gesellschaft/hochwasser-liveticker-leichter-pegel-rueckgang-in-passau-faz-19757987.html,https://www.faz.net/aktuell/gesellschaft/hochwasser-liveticker-leichter-pegel-rueckgang-in-passau-faz-19757987.html,0,www.faz.net,Hochwasser-Liveblog: Leichter Pegel-Rückgang in Passau,Passau ruft den Katastrophenfall aus +++ Hochwasserlage an der Donau spitzt sich zu +++ Markus Söder verspricht mindestens 100 Millionen Euro an Hilfen für Betroffene +++ alle Entwicklungen im Liveblog.,https://media1.faz.net/ppmedia/aktuell/politik/399786989/1.9765631/facebook_teaser/zwei-maedchen-knien-auf-dem.jpg,2024-06-04T19:50:45Z,,"In der Stadt Passau im Südosten Deutschlands ist der Scheitel der Flüsse Donau und Inn erreicht die Wasserstände fallen leicht, wie die Stadt am Dienstagabend mitteilte. Die Donau habe den vorhergesa… [+998 chars]",,de,'Hochwasser'
https://www.faz.net/aktuell/gesellschaft/hochwasser-liveticker-lage-in-regensburg-bleibt-kritisch-faz-19757987.html,https://www.faz.net/aktuell/gesellschaft/hochwasser-liveticker-lage-in-regensburg-bleibt-kritisch-faz-19757987.html,0,www.faz.net,Hochwasser-Liveblog: Lage in Regensburg bleibt kritisch,Leichter Pegel-Rückgang in Passau +++ Frau harrt mehr als 52 Stunden in Baumkrone aus +++ Markus Söder verspricht mindestens 100 Millionen Euro an Hilfen +++ alle Entwicklungen im Liveblog.,https://media0.faz.net/ppmedia/aktuell/gesellschaft/4018832181/1.9765994/facebook_teaser/schutzwand-gegen-die-fluten-in.jpg,2024-06-05T06:15:58Z,,"In der Stadt Passau im Südosten Deutschlands ist der Scheitel der Flüsse Donau und Inn erreicht die Wasserstände fallen leicht, wie die Stadt am Dienstagabend mitteilte. Die Donau habe den vorhergesa… [+998 chars]",,de,'Hochwasser'
https://www.stern.de/gesellschaft/regional/bayern/notfall--suche-nach-vermisstem-feuerwehrmann-geht-weiter-34770994.html,https://www.stern.de/gesellschaft/regional/bayern/notfall--suche-nach-vermisstem-feuerwehrmann-geht-weiter-34770994.html,0,www.stern.de,Notfall: Suche nach vermisstem Feuerwehrmann geht weiter,"Die Suche nach einem im Hochwasser-Einsatz vermissten Feuerwehrmann in Schwaben geht nach Angaben der Polizei auch am Mittwoch weiter. Der 22-Jährige sei bisher nicht gefunden worden, sagte ein Polizeisprecher in Kempten. Polizeikräfte sollten am Mittwoch an …",https://image.stern.de/6681672/t/31/v5/w1440/r1.7778/-/video-fallback-image.jpg,2024-06-05T07:35:03Z,,"Die Suche nach einem im Hochwasser-Einsatz vermissten Feuerwehrmann in Schwaben geht nach Angaben der Polizei auch am Mittwoch weiter. Der 22-Jährige sei bisher nicht gefunden worden, sagte ein Poliz… [+854 chars]",,de,'Hochwasser'
https://www.zeit.de/video/2024-06/6354301570112/hochwasser-passau-ruft-katastrophenfall-aus,https://www.zeit.de/video/2024-06/6354301570112/hochwasser-passau-ruft-katastrophenfall-aus,0,www.zeit.de,Hochwasser: Passau ruft Katastrophenfall aus,"Aufgrund der Hochwasserlage in Süddeutschland sind Teile der Stadt Passau überflutet worden. Die Schäden seien jedoch relativ gering, heißt es vom Wasserwirtschaftsamt.",https://img.zeit.de/video/2024-06/6354301570112-still/wide__1300x731,2024-06-05T07:47:12Z,,"Schließen
Hier können Sie interessante Artikel speichern, um sie später zu lesen und wiederzufinden.
Sie haben bereits ein Konto?
 Hier anmelden.",,de,'Hochwasser'
https://www.stern.de/panorama/wetter/unwetter-ticker--suche-nach-vermisstem-feuerwehrmann-wird-fortgesetzt-34758674.html,https://www.stern.de/panorama/wetter/unwetter-ticker--suche-nach-vermisstem-feuerwehrmann-wird-fortgesetzt-34758674.html,0,www.stern.de,"Hochwasser in Süddeutschland: Suche nach vermisstem Feuerwehrmann wird fortgesetzt, die Lage bleibt kritisch",Der Regen hat nachgelassen. Doch noch gibt es keine Entwarnung bei den verheerenden Überschwemmungen in Süddeutschland. Besonders an der Donau steht das Wasser hoch. Die Nachrichten aus dem Unwetter-Gebiet im stern-Ticker.,https://image.stern.de/34771234/t/WO/v3/w1440/r1.7778/-/dlrg-wasserrettung.jpg,2024-06-05T08:34:00Z,,"05.06.2024, 10:34
 55 Min.
Der Regen hat nachgelassen. Doch noch gibt es keine Entwarnung bei den verheerenden Überschwemmungen in Süddeutschland. Besonders an der Donau steht das Wasser hoch. Die … [+96543 chars]",,de,'Hochwasser'
https://www.stern.de/gesellschaft/regional/bayern/hochwasser--experten--burg-falkenstein-erheblich-beschaedigt-34771254.html,https://www.stern.de/gesellschaft/regional/bayern/hochwasser--experten--burg-falkenstein-erheblich-beschaedigt-34771254.html,0,www.stern.de,Hochwasser: Experten: Burg Falkenstein erheblich beschädigt,"Die Burg Falkenstein im oberbayerischen Flintsbach ist durch den anhaltenden Starkregen laut Experten in einem erheblichen Umfang beschädigt worden. Zu diesem Ergebnis kamen ein Statiker und ein Architekt, die sich den Schaden an der teilweise abgerutschten B…",https://image.stern.de/34771256/t/AY/v1/w1440/r1.7778/-/05--urnnewsmldpacom2009010124060599282596v2w800h600l391t121r2474b1322jpeg---d02b467f2d1c8fe3.jpg,2024-06-05T08:34:02Z,,Die Burg Falkenstein im oberbayerischen Flintsbach ist durch den anhaltenden Starkregen laut Experten in einem erheblichen Umfang beschädigt worden. Zu diesem Ergebnis kamen ein Statiker und ein Arch… [+1684 chars],,de,'Hochwasser'
https://www.faz.net/aktuell/politik/inland/hochwasser-wenn-der-klimawandel-schneller-ist-als-die-lernfortschritte-19764878.html,https://www.faz.net/aktuell/politik/inland/hochwasser-wenn-der-klimawandel-schneller-ist-als-die-lernfortschritte-19764878.html,0,www.faz.net,Kommentar zum Hochwasser: Zu langsame Lernfortschritte,"Wenn wirksame Maßnahmen gegen Fluten ausbleiben, droht eine weitere Desillusionierung der Bürger. Auch wenn das Präventionsbewusstsein bei vielen Ländern vorhanden ist, wird beim Hochwasserschutz noch einiges versäumt.",https://media0.faz.net/ppmedia/aktuell/gesellschaft/76965289/1.9764876/facebook_teaser/im-bayerischen-offingen.jpg,2024-06-05T08:42:47Z,,"Zentren industrieller Produktion liegen historisch bedingt häufig in fruchtbaren Flussauen. Wetter und Klima sind nicht dasselbe es gibt aber keine ernsthaften wissenschaftlichen Zweifel daran, dass … [+3991 chars]",,de,'Hochwasser'
https://www.stern.de/gesellschaft/regional/bayern/hochwasser--aiwanger--flutpolder-haetten-in-situation-nicht-geholfen-34771428.html,https://www.stern.de/gesellschaft/regional/bayern/hochwasser--aiwanger--flutpolder-haetten-in-situation-nicht-geholfen-34771428.html,0,www.stern.de,Hochwasser: Aiwanger: Flutpolder hätten in Situation nicht geholfen,"Bayerns Wirtschaftsminister Hubert Aiwanger (Freie Wähler) glaubt nicht, dass mehr Flutpolder in der aktuellen Hochwasserkrise geholfen hätten. Gäbe es jetzt schon mehr Polder an der Donau, wären die aktuell wohl gar nicht eingesetzt worden, sagte er dem Hörf…",https://image.stern.de/34771430/t/Fh/v1/w1440/r1.7778/-/05--urnnewsmldpacom2009010124060599283053v3w800h600l640t424r1920b1273jpeg---144bd151e7f73124.jpg,2024-06-05T09:08:54Z,,"Bayerns Wirtschaftsminister Hubert Aiwanger (Freie Wähler) glaubt nicht, dass mehr Flutpolder in der aktuellen Hochwasserkrise geholfen hätten. Gäbe es jetzt schon mehr Polder an der Donau, wären die… [+1357 chars]",,de,'Hochwasser'
https://www.stern.de/panorama/wissen/klimawandel-anpassung--diese-strategien-haben-bund-und-laender-34763846.html,https://www.stern.de/panorama/wissen/klimawandel-anpassung--diese-strategien-haben-bund-und-laender-34763846.html,0,www.stern.de,Klimawandel-Anpassung: (K)ein Plan für Hochwasser und Hitze? Mit diesen Strategien wollen sich die Bundesländer wappnen,Dieses Jahr will die Ampel-Regierung ihr Klimaanpassungsgesetz verabschieden. Strategien dafür haben Länder und Kommunen aber schon seit Langem. Haben sie auch etwas gebracht? Eine Bestandsaufnahme.,https://image.stern.de/34769160/t/bP/v1/w1440/r1.7778/-/klimawandel.jpg,2024-06-05T09:12:00Z,,"Es ist noch gar nicht so lange her, dass Bäche zu reißenden Flüssen, Straßen zu schlammigen Pfaden, Wohnhäuser zu Ruinen wurden. 2021 ereignete sich im Ahrtal eine Katastrophe, wie sie Deutschland no… [+7994 chars]",,de,'Hochwasser'
https://www.stern.de/panorama/hochwasser--wasserstaende-sinken-teils--lage-bleibt-gespannt-34770234.html,https://www.stern.de/panorama/hochwasser--wasserstaende-sinken-teils--lage-bleibt-gespannt-34770234.html,0,www.stern.de,"Hochwasser: Wasserstände sinken teils, Lage bleibt gespannt","In einigen Hochwassergebieten in Süddeutschland entschärft sich die Lage, an der unteren Donau bleibt sie gespannt. Normalität herrscht noch lange nicht, auch wenn das Wasser teils langsam abfließt.",https://image.stern.de/34770440/t/Js/v2/w1440/r1.7778/-/05--urnnewsmldpacom2009010124060599279810v3w800h600l975t658r2183b1472jpeg---344efdaf029c3ba3.jpg,2024-06-05T09:16:11Z,,"In einigen Hochwassergebieten in Süddeutschland entschärft sich die Lage, an der unteren Donau bleibt sie gespannt. Normalität herrscht noch lange nicht, auch wenn das Wasser teils langsam abfließt.… [+3700 chars]",,de,'Hochwasser'
https://www.stern.de/gesellschaft/regional/sachsen/hochwasser--johanniter-bauen-katastrophenschutz-in-sachsen-aus-34771506.html,https://www.stern.de/gesellschaft/regional/sachsen/hochwasser--johanniter-bauen-katastrophenschutz-in-sachsen-aus-34771506.html,0,www.stern.de,Hochwasser: Johanniter bauen Katastrophenschutz in Sachsen aus,"Leipzig/Heidenau (sn) - Die Johanniter bauen ihren Katastrophenschutz in Sachsen aus. Wie die Hilfsorganisation am Mittwoch in Leipzig mitteilte, soll das",https://image.stern.de/34771528/t/oq/v1/w1440/r1.7778/-/05--urnnewsmldpacom2009010124060599283322v4w800h600l640t425r1920b1278jpeg---ab1402c4c7f9b975.jpg,2024-06-05T09:28:38Z,,"In Zeiten des Klimawandels häufen sich Naturkatastrophen. Darauf sollte jedes Land gut vorbereitet sein.
Die Johanniter bauen ihren Katastrophenschutz in Sachsen aus. Wie die Hilfsorganisation am Mi… [+1965 chars]",,de,'Hochwasser'
https://www.stern.de/gesellschaft/regional/baden-wuerttemberg/hilfsorganisationen--drk-sachsen-unterstuetzt-flutgebiete-in-baden-wuerttemberg-34771516.html,https://www.stern.de/gesellschaft/regional/baden-wuerttemberg/hilfsorganisationen--drk-sachsen-unterstuetzt-flutgebiete-in-baden-wuerttemberg-34771516.html,0,www.stern.de,Hilfsorganisationen: DRK Sachsen unterstützt Flutgebiete in Baden-Württemberg,"Das Deutsche Rote Kreuz Sachsen unterstützt Flutgebiete in Baden-Württemberg. Am Mittwoch seien 86 Bautrocknern nach Rudersberg (Rems-Murr-Kreis) in eines der vom Hochwasser betroffenen Flutgebiete geschickt worden, wie das DRK Sachsen mitteilte.",https://image.stern.de/34771518/t/kN/v1/w1440/r1.7778/-/05--urnnewsmldpacom2009010124060599283406v3w800h600l640t425r1920b1278jpeg---1f73812a26a8a0cb.jpg,2024-06-05T09:33:24Z,,Das Deutsche Rote Kreuz Sachsen unterstützt Flutgebiete in Baden-Württemberg. Am Mittwoch seien 86 Bautrocknern nach Rudersberg (Rems-Murr-Kreis) in eines der vom Hochwasser betroffenen Flutgebiete g… [+438 chars],,de,'Hochwasser'
