index,url,valid,domain,title,description,image,published,archive,content,quote,language,keyword
https://www.tagesspiegel.de/sport/olympische-winterspiele-so-aufgeregt-auch-shiffrin-fiebert-vonns-abfahrt-entgegen-15229383.html,https://www.tagesspiegel.de/sport/olympische-winterspiele-so-aufgeregt-auch-shiffrin-fiebert-vonns-abfahrt-entgegen-15229383.html,0,www.tagesspiegel.de,Olympische Winterspiele: „So aufgeregt“: Auch Shiffrin fiebert Vonns Abfahrt entgegen,Bei Olympia sind die Augen am Sonntag auf US-Skistar Lindsey Vonn gerichtet. Auch Teamkollegin Mikaela Shiffrin ist gespannt - und spricht über ihr persönliches Programm für die Spiele.,https://www.tagesspiegel.de/images/15229382/alternates/BASE_16_9_W1400/1770484828000/olympische-winterspiele-2026.jpeg,2026-02-07T17:20:29Z,,"Auch Ski-Star Mikaela Shiffrin blickt mit großer Spannung auf die Olympia-Abfahrt ihrer US-Teamkollegin Lindsey Vonn. Ich bin so aufgeregt, das zu sehen, sagte die langjährige Alpin-Dominatorin vor d… [+1882 chars]",,de,'Winter'
https://www.zeit.de/news/2026-02/07/keine-medaille-fuer-deutsche-springerinnen-stroem-holt-gold,https://www.zeit.de/news/2026-02/07/keine-medaille-fuer-deutsche-springerinnen-stroem-holt-gold,0,www.zeit.de,Olympische Winterspiele: Keine Medaille für deutsche Springerinnen - Stroem holt Gold,Hier finden Sie Informationen zu dem Thema „Olympische Winterspiele“. Lesen Sie jetzt „Keine Medaille für deutsche Springerinnen - Stroem holt Gold“.,https://img.zeit.de/news/2026-02/07/keine-medaille-fuer-deutsche-springerinnen-stroem-holt-gold-image-group/wide__1300x731,2026-02-07T19:49:39Z,,Enttäuschung statt Medaillenjubel: Die Skispringerinnen haben das erhoffte erste Edelmetall für Deutschland bei den Olympischen Winterspielen verfehlt. Selina Freitag steigerte sich im zweiten Durchg… [+2775 chars],,de,'Winter'
https://www.stern.de/sport/olympische-winterspiele--keine-medaille-fuer-deutsche-springerinnen---stroem-holt-gold-37116558.html,https://www.stern.de/sport/olympische-winterspiele--keine-medaille-fuer-deutsche-springerinnen---stroem-holt-gold-37116558.html,0,www.stern.de,Olympische Winterspiele: Keine Medaille für deutsche Springerinnen - Stroem holt Gold,Das hatten sich die deutschen Skispringerinnen anders vorgestellt. Im Kampf um die Podestplätze sind sie chancenlos. Der erhoffte Eröffnungsfeier-Schub für Fahnenträgerin Katharina Schmid bleibt aus.,https://image.stern.de/37116560/t/Mf/v1/w1440/r1.7778/-/07--rs4s7e6gqwv3axs2048jpeg---7f92ddeeabbf36c4.jpg,2026-02-07T19:49:39Z,,"Kopiere den aktuellen Link
Zur Merkliste hinzufügen
Das hatten sich die deutschen Skispringerinnen anders vorgestellt. Im Kampf um die Podestplätze sind sie chancenlos. Der erhoffte Eröffnungsfeier… [+2990 chars]",,de,'Winter'
https://www.faz.net/aktuell/politik/ukraine/familie-moskaljow-flucht-vor-putin-wegen-ukraine-zeichnung-110831131.html,https://www.faz.net/aktuell/politik/ukraine/familie-moskaljow-flucht-vor-putin-wegen-ukraine-zeichnung-110831131.html,0,www.faz.net,Russische Kriegsgegner: Wenn eine Kinderzeichnung das Leben umstürzt,Die Familie Moskaljow ist vor Verfolgung aus Russland geflohen. Sie hoffte auf Aufnahme in Deutschland. Dann geriet sie in die Mühlen der deutschen Innenpolitik.,https://media0.faz.net/image/w1200h627/38f34ad806c5/w1280h668x0y254o/202602/171f0362-70cb-4f0a-ac5c-74e9016974c9/bild-des-anstosses-zeichnung.webp,2026-02-07T19:55:24Z,,"Die Zeichnung, mit der alles anfing, hat Marija Moskaljowa auch jetzt in der Fremde noch. Auf einer blau-gelben Flagge steht Ruhm der Ukraine!, daneben hält eine Mutter ein kleines Kind an der Hand. … [+11029 chars]",,de,'Kinder'
https://www.freitag.de/autoren/saskia-hoedl/eltern-am-limit-erschoepfung-liegt-nicht-an-den-kindern,https://www.freitag.de/autoren/saskia-hoedl/eltern-am-limit-erschoepfung-liegt-nicht-an-den-kindern,0,www.freitag.de,Eltern am Limit: Erschöpfung liegt nicht an den Kindern,"Für viele Familien gehört eine tiefe Erschöpfung zur Normalität. Früh aufstehen, Job, Haushalt, Kinder – doch das System ignoriert die Gesundheit von Eltern. Das muss aufhören „Chronischer Stress ist einer der Hauptfaktoren für einen gestörten Schlaf“, steht …",https://www.freitag.de/autoren/saskia-hoedl/eltern-am-limit-erschoepfung-liegt-nicht-an-den-kindern/@@images/image/great,2026-02-08T03:00:00Z,,"„Chronischer Stress ist einer der Hauptfaktoren für einen gestörten Schlaf“, steht in einem Artikel darüber, wie sehr es der Gesundheit schadet, zu wenig zu schlafen. „Die haben wohl keine Kinder“, d… [+7851 chars]",,de,'Kinder'
https://www.bild.de/leben-wissen/winter-depression-verschenken-sie-ein-bisschen-freundlichkeit-697b760bf0e62064809de504,https://www.bild.de/leben-wissen/winter-depression-verschenken-sie-ein-bisschen-freundlichkeit-697b760bf0e62064809de504,0,www.bild.de,Gegen den Winterblues - 20 kleine Glücks-Tipps für kalte Tage,"Die dunkle Jahreszeit hat uns fest im Griff. Die Tage sind kurz, das Licht verschwunden – und bei vielen hat der Winterblues eingesetzt. Das hilft dagegen.","https://images.bild.de/697b760bf0e62064809de504/faf5f3b756789641c9020d88926f7293,71a132f6?w=1280",2026-02-08T03:27:48Z,,"TTS-Player überspringenArtikel weiterlesenSeit Wochen sind die Tage kurz, das Licht verschwunden und bei vielen hat der Winterblues eingesetzt. Gerade jetzt kann jeder ein bisschen Freundlichkeit geb… [+2868 chars]",,de,'Kinder'
https://www.welt.de/geschichte/article6912f26b559017d781cd5f43/ausstellung-die-jugendlocke-war-in-mode-so-lebten-kinder-in-aegypten-unter-den-pharaonen.html,https://www.welt.de/geschichte/article6912f26b559017d781cd5f43/ausstellung-die-jugendlocke-war-in-mode-so-lebten-kinder-in-aegypten-unter-den-pharaonen.html,0,www.welt.de,Die „Jugendlocke“ war in Mode – So lebten Mädchen und Jungen einst unter den Pharaonen,"Vieles war ähnlich wie heute, doch manches eben ganz anders: Eine Schau in München widmet sich dem Aufwachsen von Kindern im Alten Ägypten. Wie ihr Alltag aussah und warum sie immer nackt dargestellt wurden.",https://images.welt.de/6912f26b559017d781cd5f43/8142538f0cd3d75f81b01f78f40dd05f-master/ci16x9-w1200/11-ostrakon-mit-2-kindern-c-smb-agyptisches-museum-papyrussammlung-sandra-steiss-jpg,2026-02-08T06:06:18Z,,"Vieles war ähnlich wie heute, doch manches eben ganz anders: Eine Schau in München widmet sich dem Aufwachsen von Kindern im Alten Ägypten. Wie ihr Alltag aussah und warum sie immer nackt dargestellt… [+4508 chars]",,de,'Kinder'
https://www.stern.de/panorama/obdachlosigkeit--wie-kann-man-wohnungslosen-helfen---37107426.html,https://www.stern.de/panorama/obdachlosigkeit--wie-kann-man-wohnungslosen-helfen---37107426.html,0,www.stern.de,"Hilfe in der Kälte: Wie kann ich erkennen, ob ein Obdachloser erfriert?",Obdachlosigkeit kann in diesen Tagen und Nächten lebensgefährlich sein: Wie hilft man wohnungslosen Menschen bei eisigen Temparaturen? Eine Hamburger Expertin weiß Rat.,https://image.stern.de/37107464/t/qw/v8/w1440/r1.7778/-/symbolfoto-obdachlosigkeit.jpg,2026-02-08T07:24:00Z,,"Kopiere den aktuellen Link
Zur Merkliste hinzufügen
Obdachlosigkeit kann in diesen Tagen und Nächten lebensgefährlich sein: Wie hilft man wohnungslosen Menschen bei eisigen Temparaturen? Eine Hambu… [+3449 chars]",,de,'Kälte'
https://www.morgenpost.de/bezirke/steglitz-zehlendorf/article411124834/obdachlose-im-steglitzer-kreisel-so-viel-normalitaet-wie-moeglich.html,https://www.morgenpost.de/bezirke/steglitz-zehlendorf/article411124834/obdachlose-im-steglitzer-kreisel-so-viel-normalitaet-wie-moeglich.html,0,www.morgenpost.de,Obdachlose im Steglitzer Kreisel: So viel Normalität wie möglich,Im Fuß des Hochhauses ist in diesem Winter eine Notunterkunft mit 36 Betten entstanden. Waren die Ängste im Vorfeld berechtigt?,https://img.sparknews.funkemedien.de/411124842/411124842_1770298398_v16_9_1600.jpeg,2026-02-08T08:00:00Z,,"Auf einem Bett ist die Zudecke so akkurat gefaltet, dass es wie im Hotel aussieht. Ist es frei? Wartet es auf den nächsten Gast? Nein, da ist nur jemand sehr ordentlich und will es schön haben, sagt … [+7436 chars]",,de,'Winter'
https://www.zeit.de/news/2026-02/08/kinderrueckgang-diese-ideen-sollen-thueringens-kitas-helfen,https://www.zeit.de/news/2026-02/08/kinderrueckgang-diese-ideen-sollen-thueringens-kitas-helfen,0,www.zeit.de,Demografischer Wandel: Kinderrückgang: Diese Ideen sollen Thüringens Kitas helfen,Hier finden Sie Informationen zu dem Thema „Demografischer Wandel“. Lesen Sie jetzt „Kinderrückgang: Diese Ideen sollen Thüringens Kitas helfen“.,https://img.zeit.de/news/2026-02/08/kinderrueckgang-diese-ideen-sollen-thueringens-kitas-helfen-image-group/wide__1300x731,2026-02-08T09:00:14Z,,"Geburtenschwache Jahrgänge bringen Kindergärten in Thüringen teils in Bedrängnis: Plätze bleiben frei, weniger Geld steht zur Verfügung. Nun wollen Thüringens Bildungsminister Christian Tischner (CDU… [+4614 chars]",,de,'Gas'
https://www.stern.de/gesellschaft/regional/thueringen/demografischer-wandel--kinderrueckgang--diese-ideen-sollen-thueringens-kitas-helfen-37117154.html,https://www.stern.de/gesellschaft/regional/thueringen/demografischer-wandel--kinderrueckgang--diese-ideen-sollen-thueringens-kitas-helfen-37117154.html,0,www.stern.de,Demografischer Wandel: Kinderrückgang: Diese Ideen sollen Thüringens Kitas helfen,"Fusionsprämien, Filialmodelle, mehr Geld pro Kind und Sockelfinanzierung: Thüringens Politik sucht Wege gegen das Kita-Sterben. Im Fokus stehen vor allem kleinere Einrichtungen.",https://image.stern.de/37117156/t/S9/v1/w1440/r1.7778/-/08--h2frja4qfav9axs2048jpeg---b3d6a499846b24fc.jpg,2026-02-08T09:00:14Z,,"Kopiere den aktuellen Link
Zur Merkliste hinzufügen
Fusionsprämien, Filialmodelle, mehr Geld pro Kind und Sockelfinanzierung: Thüringens Politik sucht Wege gegen das Kita-Sterben. Im Fokus stehen v… [+4807 chars]",,de,'Gas'
https://www.bild.de/politik/ausland-und-internationales/orban-erklaert-ukraine-zum-feind-69883207232ff4d8d7ff03b3,https://www.bild.de/politik/ausland-und-internationales/orban-erklaert-ukraine-zum-feind-69883207232ff4d8d7ff03b3,0,www.bild.de,Putin wird’s freuen - Orbán erklärt Ukraine zum „Feind“,"Wer fordert, dass Ungarn auf russisches Gas verzichte, sei „kein Gegner, sondern Feind“.","https://images.bild.de/69883207232ff4d8d7ff03b3/9965bded1030552a1554b830de970170,c084e839?w=1280",2026-02-08T09:08:59Z,,TTS-Player überspringenArtikel weiterlesenBudapest  In Ungarn läuft der spannendste Wahlkampf seit Jahren. Jetzt verschärft Premier Viktor Orbán erneut seinen Ton gegenüber seinem Nachbarland: Die Uk… [+2271 chars],,de,'Gas'
https://www.diepresse.com/20532986/endlager-fuer-emissionen-wo-oesterreich-sein-co2-vergraben-kann,https://www.diepresse.com/20532986/endlager-fuer-emissionen-wo-oesterreich-sein-co2-vergraben-kann,0,www.diepresse.com,Endlager für Emissionen: Wo Österreich sein CO2 vergraben kann [premium],"Österreichs Regierung will die CO2-Speicherung in alten Öl- und Gasfeldern erlauben. Doch das Gesetz alleine wird nicht reichen. Was fehlt, sind designierte Lagerstätten, Pipelines und ein paar offene Worte.",https://img.diepresse.com/public/incoming/i07y8g-2023-11-30t120715z1717445410rc2ph4a0lvs9rtrmadp3climate-un-carbon-capturejpg/alternates/DPR_SOCIAL_MAGAZIN/2023-11-30T120715Z_1717445410_RC2PH4A0LVS9_RTRMADP_3_CLIMATE-UN-CARBON-CAPTURE.JPG,2026-02-08T09:56:45Z,,"Das Thema war gut versteckt in der 112 Seiten langen Industriestrategie, die ÖVP, SPÖ und Neos zu Jahresbeginn präsentiert haben. Auf gerade einmal acht Zeilen verspricht die Koalition den Industrieb… [+6349 chars]",,de,'Gas'
https://www.welt.de/wirtschaft/article698872192dc88ba237f45626/marode-strassen-adac-rechnet-mit-milliardenschaeden-durch-wintereinbruch.html,https://www.welt.de/wirtschaft/article698872192dc88ba237f45626/marode-strassen-adac-rechnet-mit-milliardenschaeden-durch-wintereinbruch.html,0,www.welt.de,ADAC rechnet mit Milliardenschäden durch Wintereinbruch,"Tauwetter, Frost, Schnee – der ständige Wetterwechsel setzt Deutschlands Straßen massiv zu. Der ADAC warnt vor Schäden in Milliardenhöhe, vor allem auf kommunalen Fahrbahnen, und fordert ein langfristiges Sanierungsprogramm gegen die wachsende Zahl an Schlagl…",https://images.welt.de/698872192dc88ba237f45626/543a575eda5e155d3fc5d18eb1b504a0/ci16x9-w1200/dpa-com-20090101-260204-911-009295-jpg,2026-02-08T11:34:54Z,,"Tauwetter, Frost, Schnee der ständige Wetterwechsel setzt Deutschlands Straßen massiv zu. Der ADAC warnt vor Schäden in Milliardenhöhe, vor allem auf kommunalen Fahrbahnen, und fordert ein langfristi… [+1957 chars]",,de,'Winter'
https://www.sueddeutsche.de/politik/in-gaza-machen-schulen-wieder-auf-li.3380503,https://www.sueddeutsche.de/politik/in-gaza-machen-schulen-wieder-auf-li.3380503,0,www.sueddeutsche.de,"Schulen in Gaza: Es fehlt an allem, nur nicht an Hoffnung","Im Gazastreifen unterrichten Lehrer in Zelten, da Schulen zerstört sind. Trotz fehlender Materialien und traumatischer Erlebnisse zeigen Kinder Begeisterung fürs Lernen. UNICEF eröffnet temporäre Lernräume.",https://www.sueddeutsche.de/2026/02/08/65e6088f-aaae-4694-8904-1a4b9060a1fe.jpg?q=60&fm=webp&width=1200&rect=0%2C0%2C1280%2C720,2026-02-08T11:36:24Z,,"Zwei Jahre lang gab es keinen richtigen Schulunterricht, höchstens ein paar Onlinekurse, für die wenigen, die einen Computer hatten und Zugang zum Internet. Zwei Jahre bombardierte die israelische Ar… [+6303 chars]",,de,'Winter'
https://www.stern.de/news/lage-in-spanien-und-portugal-entspannt-sich-nach-durchzug-von-sturmtief--marta--37116108.html,https://www.stern.de/news/lage-in-spanien-und-portugal-entspannt-sich-nach-durchzug-von-sturmtief--marta--37116108.html,0,www.stern.de,"Lage in Spanien und Portugal entspannt sich nach Durchzug von Sturmtief ""Marta""","Nach dem Durchzug des Sturmtiefs ""Marta"" hat sich die Lage auf der Iberischen Halbinsel etwas entspannt. Nur in wenigen spanischen Provinzen galt am Sonntag noch die zweithöchste Warnstufe orange. Mancherorts würden noch stärkere Winde, Regen und Schnee erwar…",https://image.stern.de/37117596/t/ya/v1/w1440/r1.7778/-/08--ueberfluteter-spielplatz-in-c%C3%B3rdoba-in-andalusien---f29b415fe3699bb1.jpg,2026-02-08T12:30:20Z,,"Kopiere den aktuellen Link
Zur Merkliste hinzufügen
Nach dem Durchzug des Sturmtiefs ""Marta"" hat sich die Lage auf der Iberischen Halbinsel etwas entspannt. Nur in wenigen spanischen Provinzen galt… [+2582 chars]",,de,'Schnee'
https://www.stern.de/gesellschaft/regional/mecklenburg-vorpommern/eis-auf-der-ostsee--eis-vor-ruegener-lng-terminal---gastanker-muss-weiter-warten-37117604.html,https://www.stern.de/gesellschaft/regional/mecklenburg-vorpommern/eis-auf-der-ostsee--eis-vor-ruegener-lng-terminal---gastanker-muss-weiter-warten-37117604.html,0,www.stern.de,Eis auf der Ostsee: Eis vor Rügener LNG-Terminal - Gastanker muss weiter warten,"Eis behindert die Anfahrt von Gastankern zum Rügener LNG-Terminal. Wann die Schiffe wieder anlegen können, hängt von der Räumung der Fahrrinne ab. Gibt es eine Prognose?",https://image.stern.de/37117606/t/0l/v1/w1440/r1.7778/-/08--tm7ffkhcosv4axs2048jpeg---a88179dcb7a10f03.jpg,2026-02-08T12:42:49Z,,"Kopiere den aktuellen Link
Zur Merkliste hinzufügen
Eis behindert die Anfahrt von Gastankern zum Rügener LNG-Terminal. Wann die Schiffe wieder anlegen können, hängt von der Räumung der Fahrrinne ab… [+2071 chars]",,de,'Gas'
https://www.zeit.de/news/2026-02/08/eis-vor-ruegener-lng-terminal-gastanker-muss-weiter-warten,https://www.zeit.de/news/2026-02/08/eis-vor-ruegener-lng-terminal-gastanker-muss-weiter-warten,0,www.zeit.de,Eis auf der Ostsee: Eis vor Rügener LNG-Terminal - Gastanker muss weiter warten,Hier finden Sie Informationen zu dem Thema „Eis auf der Ostsee“. Lesen Sie jetzt „Eis vor Rügener LNG-Terminal - Gastanker muss weiter warten“.,https://img.zeit.de/news/2026-02/08/eis-vor-ruegener-lng-terminal-gastanker-muss-weiter-warten-image-group/wide__1300x731,2026-02-08T12:42:49Z,,"Der Betreiber des Rügener LNG-Terminals rechnet wegen der Eislage erst im Laufe der neuen Woche damit, dass ein schon länger wartender Gastanker das Terminal anlaufen kann. «Für die Ein- und Ausfahrt… [+1886 chars]",,de,'Gas'
https://www.golem.de/sonstiges/zustimmung/auswahl.html?from=https://www.golem.de/news/eisregen-mobilfunknetz-trotzt-noch-dem-harten-winter-2602-205140.html&referer=https://t.co/34d159f951,https://www.golem.de/sonstiges/zustimmung/auswahl.html?from=https://www.golem.de/news/eisregen-mobilfunknetz-trotzt-noch-dem-harten-winter-2602-205140.html&referer=https://t.co/34d159f951,0,www.golem.de,Eisregen: Mobilfunknetz trotzt noch dem harten Winter,"Trotz regionalem Eisregen bleibt das Mobilfunk-Netz noch stabil. Doch eine dicke Klareisschicht wäre ein Mobilfunkkiller. (Mobilfunk, Telekom)",,2026-02-08T12:46:02Z,,"Besuchen Sie Golem.de wie gewohnt mit Werbung und Tracking,
 indem Sie der Nutzung aller Cookies zustimmen.
 Details zum Tracking finden Sie im Privacy Center.
Skript wurde nicht geladen. Informat… [+607 chars]",,de,'Winter'
https://www.faz.net/aktuell/reise/pistensicherheit-weniger-skiunfaell-aber-weiter-riskant-accg-110831736.html,https://www.faz.net/aktuell/reise/pistensicherheit-weniger-skiunfaell-aber-weiter-riskant-accg-110831736.html,0,www.faz.net,Pistensicherheit: Es bleibt ein Risikosport,Sicher auf die Piste: Die Zahl der Skiunfälle geht zwar seit Jahren zurück. Doch überfüllte Pisten könnte den Wintersport bald wieder riskanter machen.,https://media0.faz.net/image/w1200h627/986ed21ed1d8/w2000h1045x0y195o/022026/1.10831717/rettung-naht-oft-mit-dem.webp,2026-02-08T12:50:50Z,,Die schlechte Nachricht zuerst: Skifahren ist ein sogenannter Risikosport. Im Weltcup hat das zuletzt auch die schweizerische Skirennläuferin Lara Gut-Behrami einmal mehr erfahren müssen. Im Training… [+4443 chars],,de,'Winter'
https://www.sueddeutsche.de/sport/olympia-2026-heute-live-tv-stream-langlauf-medaillen-li.3366137,https://www.sueddeutsche.de/sport/olympia-2026-heute-live-tv-stream-langlauf-medaillen-li.3366137,0,www.sueddeutsche.de,"Ski nordisch bei den Winterspielen 2026: Skispringen, Langlaufen und Kombination – der Olympia-Zeitplan","Die Wettbewerbe für Langlauf, Skispringen und die Nordische Kombination finden bei den Winterspielen 2026 im Val di Fiemme statt. Ein Überblick über den Zeitplan.",https://www.sueddeutsche.de/2025/12/23/69ed71b9-99db-4192-952f-9bd8757d271d.jpg?q=60&fm=webp&width=1200&rect=0%2C209%2C4000%2C2250,2026-02-08T12:56:00Z,,"Im Val di Fiemme werden die nordischen Ski-Disziplinen bei den Olympischen Winterspielen 2026 in Italien ausgetragen. Die Skispringerinnen und Skispringer treten auf der Schanze in Predazzo an, die L… [+7416 chars]",,de,'Winter'
https://www.stern.de/sport/finale-in-montreux--sabine-winter-gewinnt-top-16-turnier-im-tischtennis-37117734.html,https://www.stern.de/sport/finale-in-montreux--sabine-winter-gewinnt-top-16-turnier-im-tischtennis-37117734.html,0,www.stern.de,Finale in Montreux: Sabine Winter gewinnt Top-16-Turnier im Tischtennis,Schon im vergangenen Jahr stieg Sabine Winter zur besten Tischtennis-Spielerin Europas auf. Jetzt hat sie auch ihren bislang bedeutendsten Titel im Einzel in der Hand.,https://image.stern.de/37117736/t/jm/v1/w1440/r1.7778/-/08--at7gylaamfv8axs2048jpeg---a82cbb424328fed1.jpg,2026-02-08T13:42:14Z,,"Kopiere den aktuellen Link
Zur Merkliste hinzufügen
Schon im vergangenen Jahr stieg Sabine Winter zur besten Tischtennis-Spielerin Europas auf. Jetzt hat sie auch ihren bislang bedeutendsten Titel … [+700 chars]",,de,'Winter'
https://www.n-tv.de/wirtschaft/Trump-hat-Europa-mit-LNG-Lieferungen-in-der-Hand-id30333285.html,https://www.n-tv.de/wirtschaft/Trump-hat-Europa-mit-LNG-Lieferungen-in-der-Hand-id30333285.html,0,www.n-tv.de,Treten die USA auf die Gas-Bremse?: Trump hat Europa mit LNG-Lieferungen in der Hand,Vor dem Ukraine-Krieg hing Europa an Moskaus Energie-Tropf. Derselbe fatale Fehler wiederholt sich nun mit den USA: Durch US-Flüssiggas-Exporte hat Donald Trump ein massives Druckmittel in seinem Wirtschaftskrieg gegen Europa.,https://www.n-tv.de/img/30333355/1770386502/Img_16_9/1200/US-LNG-unloaded-at-Revithoussa-terminal-near-Athens-LNG-tanker-BRITISH-MENTOR-which-departed-from-Sabine-Pass-in-the-USA-unloads-US-liquefied-natural-gas-at-the-Revithoussa-terminal-near-Athens-Greece-is-emerging-as-a-major-regional-hub-for-US-LNG-as-the-EU-plans-to-phase-out-Russian-LNG-flows-by-2027.jpg,2026-02-08T13:51:10Z,,"Die EU bezieht den Großteil der LNG-Lieferungen aus den USA. (Foto: IMAGO/Nicolas Koutsokostas)
Vor dem Ukraine-Krieg hing Europa an Moskaus Energie-Tropf. Derselbe fatale Fehler wiederholt sich nun… [+6708 chars]",,de,'Gas'
https://www.welt.de/vermischtes/article698891d6088305faf4ff6ce4/seit-mehr-als-einer-woche-eis-blockiert-ruegener-lng-terminal-gastanker-muss-weiter-warten.html,https://www.welt.de/vermischtes/article698891d6088305faf4ff6ce4/seit-mehr-als-einer-woche-eis-blockiert-ruegener-lng-terminal-gastanker-muss-weiter-warten.html,0,www.welt.de,Eis blockiert Rügener LNG-Terminal – Gastanker muss weiter warten,Die langen kalten Temperaturen setzen jetzt auch dem LNG-Terminal auf Rügen zu. Eis behindert derzeit die Anfahrt von Gastankern zu dem Terminal. Ein Schiff wartet bereits seit Längerem.,https://images.welt.de/698891d6088305faf4ff6ce4/4a8fb0d2e543d551d0384acee0324efa-master/ci16x9-w1200/dpa-com-20090101-260206-911-018339-jpg,2026-02-08T14:01:05Z,,Die langen kalten Temperaturen setzen jetzt auch dem LNG-Terminal auf Rügen zu. Eis behindert derzeit die Anfahrt von Gastankern zu dem Terminal. Ein Schiff wartet bereits seit Längerem.Der Betreiber… [+2025 chars],,de,'Gas'
https://www.welt.de/politik/deutschland/article69884bc3088305faf4ff681a/heizen-droht-gasmangel-im-frostwinter-so-reagiert-schwarz-rot-auf-die-attacke-der-gruenen.html,https://www.welt.de/politik/deutschland/article69884bc3088305faf4ff681a/heizen-droht-gasmangel-im-frostwinter-so-reagiert-schwarz-rot-auf-die-attacke-der-gruenen.html,0,www.welt.de,Droht Gasmangel im Frostwinter? So reagiert Schwarz-Rot auf die Attacke der Grünen,Die Grünen wollen Wirtschaftsministerin Reiche (CDU) wegen niedriger Gasspeicher-Füllstände in den Energie-Ausschuss zitieren. Union und SPD weisen die Kritik zurück – auch unter Bezug auf Reiches Vorgänger Habeck. Für die AfD macht sich mit der Ökopartei der…,https://images.welt.de/69884bc3088305faf4ff681a/334f76143cee0e1d0f48b38c1c592b08/ci16x9-w1200/573706325-jpg,2026-02-08T14:32:34Z,,Die Grünen wollen Wirtschaftsministerin Reiche (CDU) wegen niedriger Gasspeicher-Füllstände in den Energie-Ausschuss zitieren. Union und SPD weisen die Kritik zurück  auch unter Bezug auf Reiches Vor… [+6875 chars],,de,'Gas'
https://www.n-tv.de/politik/Sachsen-Anhalts-Ministerpraesident-wirft-Bas-Ausreden-vor-id30340068.html,https://www.n-tv.de/politik/Sachsen-Anhalts-Ministerpraesident-wirft-Bas-Ausreden-vor-id30340068.html,0,www.n-tv.de,Arbeitspflicht für Bürgergeld: Sachsen-Anhalts Ministerpräsident wirft Bas Ausreden vor,"Sachsen-Anhalts Ministerpräsident Schulze fordert eine Arbeitspflicht für Bürgergeldempfänger. Wer Leistungen empfange, könne auch Laub fegen und Schnee schippen. Eine Sprecherin von Bundesarbeitsministerin Bas warnt dagegen vor Kosten und Bürokratie.",https://www.n-tv.de/img/30340070/1770599626/Img_16_9/1200/Baerbel-Bas-SPD-Co-Vorsitzende-der-SPD-und-Bundesministerin-fuer-Arbeit-und-Soziales-spricht-bei-einem-Statement-zum-Abschluss-der-Jahresauftaktklausur-des-SPD-Parteivorstands-im-Willy-Brandt-Haus.jpg,2026-02-09T00:18:53Z,,"Arbeitspflicht für BürgergeldSachsen-Anhalts Ministerpräsident wirft Bas Ausreden vor
Eine Arbeitspflicht zu organisieren, sei zu viel Aufwand, heißt es aus dem Ministerium von Bärbel Bas. (Foto: pi… [+2276 chars]",,de,'Winter'
https://www.stern.de/wirtschaft/news/schnee-und-eis--schlitten--ski--streusalz---winterwetter-leert-die-regale-37118460.html,https://www.stern.de/wirtschaft/news/schnee-und-eis--schlitten--ski--streusalz---winterwetter-leert-die-regale-37118460.html,0,www.stern.de,"Schnee und Eis: Schlitten, Ski, Streusalz – Winterwetter leert die Regale","Stuttgart/Düsseldorf - Das Winterwetter der vergangenen Wochen hat in Deutschland den Verkauf von Produkten wie Rodeln, Schlittschuhen und Ski deutlich",https://image.stern.de/37118462/t/bY/v1/w1440/r1.7778/-/09--otsujktu62v9axs2048jpeg---ec860bd385397966.jpg,2026-02-09T03:00:06Z,,"Kopiere den aktuellen Link
Zur Merkliste hinzufügen
Ob Sportladen oder Baumarkt: Schnee und Eis kurbeln deutlich die Nachfrage im Handel an. Welche Produkte besonders gefragt sind.
Das Winterwette… [+2322 chars]",,de,'Schnee'
https://www.tagesspiegel.de/wirtschaft/schnee-und-eis-schlitten-ski-streusalz--winterwetter-leert-die-regale-15231499.html,https://www.tagesspiegel.de/wirtschaft/schnee-und-eis-schlitten-ski-streusalz--winterwetter-leert-die-regale-15231499.html,0,www.tagesspiegel.de,"Schnee und Eis: Schlitten, Ski, Streusalz – Winterwetter leert die Regale",Ob Sportladen oder Baumarkt: Schnee und Eis kurbeln deutlich die Nachfrage im Handel an. Welche Produkte besonders gefragt sind.,https://www.tagesspiegel.de/images/15231498/alternates/BASE_16_9_W1400/1770606133000/schlitten.jpeg,2026-02-09T03:02:13Z,,"Das Winterwetter der vergangenen Wochen hat in Deutschland den Verkauf von Produkten wie Rodeln, Schlittschuhen und Ski deutlich befeuert. Das ergab eine Umfrage der Deutschen Presse-Agentur.
In die… [+2232 chars]",,de,'Winter'
