index,url,valid,domain,title,description,image,published,archive,content,quote,language,keyword
https://www.stern.de/politik/deutschland/winterklausur-in-kloster-seeon--csu-setzt-auf-rueckkehr-der-atomkraft-in-deutschland-37002580.html,https://www.stern.de/politik/deutschland/winterklausur-in-kloster-seeon--csu-setzt-auf-rueckkehr-der-atomkraft-in-deutschland-37002580.html,0,www.stern.de,Winterklausur in Kloster Seeon: CSU setzt auf Rückkehr der Atomkraft in Deutschland,"Am 6. Januar startet in Kloster Seeon für die CSU das politische Jahr. Erwartet wird in Oberbayern auch Kanzler Merz. Auf der Agenda findet sich zudem ein Thema, welches das Land schon lange spaltet.",https://image.stern.de/37002582/t/R1/v1/w1440/r1.7778/-/01--i2wzuzvp3gv21axs2048jpeg---56b9501a59066749.jpg,2026-01-01T03:00:28Z,,"Kopiere den aktuellen Link
Zur Merkliste hinzufügen
Am 6. Januar startet in Kloster Seeon für die CSU das politische Jahr. Erwartet wird in Oberbayern auch Kanzler Merz. Auf der Agenda findet sich … [+4206 chars]",,de,'Winter'
https://www.zeit.de/news/2026-01/01/csu-setzt-auf-rueckkehr-der-atomkraft-in-deutschland,https://www.zeit.de/news/2026-01/01/csu-setzt-auf-rueckkehr-der-atomkraft-in-deutschland,0,www.zeit.de,Winterklausur in Kloster Seeon: CSU setzt auf Rückkehr der Atomkraft in Deutschland,Hier finden Sie Informationen zu dem Thema „Winterklausur in Kloster Seeon“. Lesen Sie jetzt „CSU setzt auf Rückkehr der Atomkraft in Deutschland“.,https://img.zeit.de/news/2026-01/01/csu-setzt-auf-rueckkehr-der-atomkraft-in-deutschland-image-group/wide__1300x731,2026-01-01T03:00:28Z,,Zur Sicherstellung der Energieversorgung setzt die CSU im Bundestag trotz Atomausstiegs auf eine Rückkehr der Kernenergie in Deutschland und den Bau von Mini-Kernkraftwerken. Konkret fordern die Chri… [+3986 chars],,de,'Winter'
https://www.tagesspiegel.de/politik/winterklausur-in-kloster-seeon-csu-setzt-auf-ruckkehr-der-atomkraft-in-deutschland-15092611.html,https://www.tagesspiegel.de/politik/winterklausur-in-kloster-seeon-csu-setzt-auf-ruckkehr-der-atomkraft-in-deutschland-15092611.html,0,www.tagesspiegel.de,Winterklausur in Kloster Seeon: CSU setzt auf Rückkehr der Atomkraft in Deutschland,"Am 6. Januar startet in Kloster Seeon für die CSU das politische Jahr. Erwartet wird in Oberbayern auch Kanzler Merz. Auf der Agenda findet sich zudem ein Thema, welches das Land schon lange spaltet.",https://www.tagesspiegel.de/images/15092610/alternates/BASE_16_9_W1400/1767236562000/sprengung-der-kuhlturme-des-kernkraftwerks-gundremmingen.jpeg,2026-01-01T03:02:42Z,,Zur Sicherstellung der Energieversorgung setzt die CSU im Bundestag trotz Atomausstiegs auf eine Rückkehr der Kernenergie in Deutschland und den Bau von Mini-Kernkraftwerken. Konkret fordern die Chri… [+4035 chars],,de,'Winter'
https://www.zeit.de/news/2026-01/01/das-neue-jahr-startet-mit-sonne-schnee-und-wind,https://www.zeit.de/news/2026-01/01/das-neue-jahr-startet-mit-sonne-schnee-und-wind,0,www.zeit.de,"Wetter in Bayern: Das neue Jahr startet mit Sonne, Schnee und Wind","Hier finden Sie Informationen zu dem Thema „Wetter in Bayern“. Lesen Sie jetzt „Das neue Jahr startet mit Sonne, Schnee und Wind“.",https://img.zeit.de/news/2026-01/01/das-neue-jahr-startet-mit-sonne-schnee-und-wind-image-group/wide__1300x731,2026-01-01T05:13:02Z,,"Zum Start ins neue Jahr zeigt sich das Wetter in Bayern zweigeteilt: An den Alpen und im Alpenvorland gibt es Sonne, im restlichen Freistaat fällt gebietsweise sogar Schnee. Anfangs gebe es an den ös… [+894 chars]",,de,'Schnee'
https://www.kino-zeit.de/news-features/themen-specials/fuer-den-tag-danach-katerkino,https://www.kino-zeit.de/news-features/themen-specials/fuer-den-tag-danach-katerkino,0,www.kino-zeit.de,Für den Tag danach: Katerkino,"Themen

 

 
 




 
 Prime Video / Metropol / Croco Film

 
 Deep Cover / Voyage of the Rock Aliens / Gib Gas – Ich will Spaß

 
 





Der Kopf brummt, die Zeit will vertrieben werden? Schon zum zweiten Mal schlägt die Kino-Zeit-Redaktion einige ihrer li…",https://www.kino-zeit.de/sites/default/files/styles/grosse_klickstrecke_940x530_/public/2025-12/kino-zeit-vorlage-1_0.png?itok=8fvpKMYt,2026-01-01T08:00:00Z,,"Die Liebesparade (1929)
Immer gut fürs Gemüt: Musik. Ernst LubitschDie Liebesparade gilt als erstes richtiges Hollywood-Filmmusical, das keine Nummernrevue ist, sondern die Songs in die Narration ei… [+1604 chars]",,de,'Gas'
https://www.stern.de/gesellschaft/regional/hamburg-schleswig-holstein/fussball-bundesliga--fc-st--pauli-verpflichtet-japanischen-nationalspieler-37003110.html,https://www.stern.de/gesellschaft/regional/hamburg-schleswig-holstein/fussball-bundesliga--fc-st--pauli-verpflichtet-japanischen-nationalspieler-37003110.html,0,www.stern.de,Fußball-Bundesliga: FC St. Pauli verpflichtet japanischen Nationalspieler,Hamburg (lno) - Fußball-Bundesligist FC St. Pauli hat den ersten Winter-Neuzugang verpflichtet. Die Hamburger verstärkten sich mit dem japanischen,https://image.stern.de/37003112/t/LD/v1/w1440/r1.7778/-/01--yy3sp2quedv3axs2048jpeg---7edf72101ed21cd9.jpg,2026-01-01T08:50:22Z,,"Kopiere den aktuellen Link
Zur Merkliste hinzufügen
Die Hamburger präsentieren ihren ersten Winter-Transfer. Aus Japan wechselt der Nationalspieler Tomoya Ando in die Hansestadt.
Fußball-Bundeslig… [+1053 chars]",,de,'Winter'
https://www.telepolis.de/article/Leapfrogging-Wenn-Entwicklungslaender-Deutschland-ueberholen-11123447.html,https://www.telepolis.de/article/Leapfrogging-Wenn-Entwicklungslaender-Deutschland-ueberholen-11123447.html,0,www.telepolis.de,Leapfrogging: Wenn Entwicklungsländer Deutschland überholen,China übersprang die Verbrenner-Ära und dominiert jetzt E-Autos. Afrika macht es nach – mit Solar statt Kohle und ohne Fehler des Westens.,https://heise.cloudimg.io/bound/1200x1200/q85.png-lossy-85.webp-lossy-85.foil1/_www-heise-de_/imgs/18/5/0/0/0/6/7/9/bockspringen-01-135c053e048797e0.png,2026-01-01T09:00:00Z,,"Leapfrogging, engl. für ""Bockspringen""
China übersprang die Verbrenner-Ära und dominiert jetzt E-Autos. Afrika macht es nach mit Solar statt Kohle und ohne Fehler des Westens.
Über viele Jahre hatt… [+5528 chars]",,de,'Kohle'
https://www.bild.de/sport/fussball/fc-st-pauli-transfer-perfekt-st-pauli-holt-japan-nationalspieler-69563685f6fc544dba9b91cc,https://www.bild.de/sport/fussball/fc-st-pauli-transfer-perfekt-st-pauli-holt-japan-nationalspieler-69563685f6fc544dba9b91cc,0,www.bild.de,Winter-Transfer fix! - St. Pauli holt Japan-Nationalspieler,Blitzstart im neuen Jahr! Der FC St. Pauli verpflichtet den japanischen Nationalspieler Tomoya Andō (26).,"https://images.bild.de/69563685f6fc544dba9b91cc/184daf56d9b7cd0f9abe5e71f6579007,65002297?w=1280",2026-01-01T09:12:55Z,,"Blitzstart im neuen Jahr! Der FC St. Pauli verpflichtet den japanischen Nationalspieler Tomoya And (26). BILD hatte bereits vor gut zwei Wochen darüber berichtet, dass der Japaner kommen soll. Der In… [+1828 chars]",,de,'Winter'
https://www.focus.de/panorama/welt/tijl-41-zahlt-8800-euro-fuer-10-tage-in-thailand-unsere-urlaube-werden-sorgfaeltig-geplant_133b12fb-36c1-483b-8235-2c6f97c87245.html,https://www.focus.de/panorama/welt/tijl-41-zahlt-8800-euro-fuer-10-tage-in-thailand-unsere-urlaube-werden-sorgfaeltig-geplant_133b12fb-36c1-483b-8235-2c6f97c87245.html,0,www.focus.de,"Tijl (41) zahlt 8800 Euro für 10 Tage in Thailand: ""Unsere Urlaube werden sorgfältig geplant""",Eine Familie aus Belgien investiert in Urlaube. Dabei tauschen sie auch den Winter gegen die warme Sonne – als Nächstes geht es nach Thailand.,https://quadro.burda-forward.de/ctf/046eeb0a-3f05-4761-9d43-3522bbc23de1.ad204f28-4079-4357-9387-7755bb322c4f.png?im=RegionOfInterestCrop%3D%281200%2C630%29%2CregionOfInterest%3D%281205%2C1055%29&hash=7e747a913173316cf9c25011fc6c690ef63091294950c1a8b301d701734e8a16,2026-01-01T09:27:03Z,,"Manche Menschen investieren ihr Geld in Autos oder gehen gerne ins Restaurant Tijl De Bock (41) reist mit Frau und seinen zwei Kindern gerne. ""Wir gehen nicht jeden Monat in teure Restaurants, fahren… [+1796 chars]",,de,'Winter'
https://snipz.de/2026/stylische-barfulker-beanie-muetze/,https://snipz.de/2026/stylische-barfulker-beanie-muetze/,0,snipz.de,"Doppelpack Stylische BARFULKER Beanie Mützen für nur 7,99€","Mit der BARFULKER Beanie Mütze seid ihr warm und stylisch durch den Winter unterwegs. Aktuell gibt es die Beanie im Doppelpacj für nur 7,99€ inkl. Prime-Versand bei Amazon. Legt dazu einfach zwei der Mützen in den Warenkorb, an der Kasse werden dann automatis…",https://gadgetwelt.de/wp-content/uploads/2026/01/b0dhcqn727-1.jpg,2026-01-01T09:42:06Z,,"Gadgetwelt.de ist ein Portal zum Thema Gadgets, China-Gadgets und Onlineshopping in China.
Wir versorgen euch seit 2010 täglich mit News zu Gadgets, Produkten aus aller Welt und alles rund um China … [+7 chars]",,de,'Winter'
https://sport.orf.at/stories/3149485/,https://sport.orf.at/stories/3149485/,0,sport.orf.at,Jahr im Zeichen von Olympia und Fußball-WM,Olympische Winterspiele vor der Haustür und eine Fußball-WM mit rot-weiß-roter Beteiligung in Übersee: Das Sportjahr 2026 hat nicht nur aus heimischer Sicht zwei absolute Höhepunkte zu bieten.,https://ibs.orf.at/sport?image=https%3A%2F%2Fassets.orf.at%2Fmims%2F2025%2F01%2F68%2Fcrops%2Fw%3D1200%2Ch%3D630%2Cq%3D75%2F2882614_master_1113568_jahresrueckblick_2025_vorschau_2026_ap.jpg%3Fs%3Dedb15898505c48d7803a97516ddbf5c72d735a10,2026-01-01T10:14:21Z,,"Die österreichischen Wintersportler hoffen in Mailand und Cortina dAmpezzo (6. bis 22. Februar) auf viele Medaillen unter den Ringen, im Sommer peilt das ÖFB-Nationalteam der Männer beim Großturnier … [+5044 chars]",,de,'Winter'
https://taz.de/Neue-Gesetze-und-Verordnungen/!6142003/,https://taz.de/Neue-Gesetze-und-Verordnungen/!6142003/,0,taz.de,Neue Gesetze und Verordnungen: Was sich mit dem Jahreswechsel so alles geändert hat,"Mindestlohn und CO2-Preis steigen. Das Deutschlandticket wird teurer, ebenso das Tanken und Heizen mit Öl und Gas. Welche Änderungen gelten 2026?",https://taz.de/picture/8159018/1200/39995946.jpeg,2026-01-01T10:29:00Z,,"Mindestlohn und CO2-Preis steigen. Das Deutschlandticket wird teurer, ebenso das Tanken und Heizen mit Öl und Gas. Welche Änderungen gelten 2026? mehr...",,de,'Gas'
https://www.bild.de/news/wetter/unwetterwarnung-heftiger-wintersturm-trifft-deutschland-69550b21a75a88580a6dc6cd,https://www.bild.de/news/wetter/unwetterwarnung-heftiger-wintersturm-trifft-deutschland-69550b21a75a88580a6dc6cd,0,www.bild.de,Unwetterwarnung - Heftiger Wintersturm trifft Deutschland,"Hamburg – Schluss mit Winter-Spaß, jetzt kommt der Winter-Sturm! Die Wetterdienste warnen an Neujahr vor Unwetter mit Orkanböen und starken Schneeverwehu...","https://images.bild.de/69550b21a75a88580a6dc6cd/6364f1e921bfcd89442137cc48c3fad9,ebe04a99?w=1280",2026-01-01T10:46:17Z,,"Hamburg Schluss mit Winter-Spaß, jetzt kommt der Winter-Sturm! Die Wetterdienste warnen an Neujahr vor Unwetter mit Orkanböen und starken Schneeverwehungen in Deutschland.
Der Seewetterdienst Hambur… [+2273 chars]",,de,'Winter'
https://www.zeit.de/news/2026-01/02/lies-ohne-gas-wird-es-nicht-gehen,https://www.zeit.de/news/2026-01/02/lies-ohne-gas-wird-es-nicht-gehen,0,www.zeit.de,Koalitionsstreit: Lies: Ohne Gas wird es nicht gehen,Hier finden Sie Informationen zu dem Thema „Koalitionsstreit“. Lesen Sie jetzt „Lies: Ohne Gas wird es nicht gehen“.,https://img.zeit.de/news/2026-01/02/lies-ohne-gas-wird-es-nicht-gehen-image-group/wide__1300x731,2026-01-02T04:30:05Z,,"Bei der Gasförderung auf See sind SPD und Grüne in Niedersachsens Landesregierung weiter auf Konfrontationskurs. «Es ist offensichtlich, dass wir bei der Gasförderung unterschiedlicher Auffassung sin… [+2230 chars]",,de,'Gas'
https://www.stern.de/gesellschaft/regional/niedersachsen-bremen/koalitionsstreit--lies--ohne-gas-wird-es-nicht-gehen-37004376.html,https://www.stern.de/gesellschaft/regional/niedersachsen-bremen/koalitionsstreit--lies--ohne-gas-wird-es-nicht-gehen-37004376.html,0,www.stern.de,Koalitionsstreit: Lies: Ohne Gas wird es nicht gehen,"Zoff in der Landesregierung: Während die Grünen bei den geplanten Gasbohrungen vor Borkum vor Schäden für Natur und Klima warnen, hält Regierungschef Lies die Nutzung von Gas für unumgänglich.",https://image.stern.de/37004378/t/7E/v1/w1440/r1.7778/-/02--xuzhtvd2kmv8axs2048jpeg---f3056ce5efe28198.jpg,2026-01-02T04:30:05Z,,"Kopiere den aktuellen Link
Zur Merkliste hinzufügen
Zoff in der Landesregierung: Während die Grünen bei den geplanten Gasbohrungen vor Borkum vor Schäden für Natur und Klima warnen, hält Regierungs… [+2438 chars]",,de,'Gas'
https://salzburg.orf.at/radio/stories/3336193/,https://salzburg.orf.at/radio/stories/3336193/,0,salzburg.orf.at,Viele nicht auf mögliches Blackout vorbereitet,"Cyberangriffe, die ein Blackout – also einen längeren flächendeckenden Energieausfall -verursachen könnten, sind mittlerweile ein zentrales Risiko für den funktionierenden Alltag eines Staates. Hierzulande ist man noch nicht sonderlich gut auf eine solche Gef…",https://ibs.orf.at/sbg?image=https%3A%2F%2Foekastatic.orf.at%2Fmims%2F2025%2F18%2F66%2Fcrops%2Fw%3D1200%2Ch%3D627%2Cq%3D75%2F2607377_master_1000966_strom3.jpg%3Fs%3D145e684981d9cad127c6a525181c30a3ca55fe6e,2026-01-02T06:00:00Z,,"Energieversorgung, Krankenhäuser, Wasser- und Abwassersysteme die Infrastruktur im Land ist vielfältig und dadurch auch vielfältig verwundbar, sagt die Präsidentin der Universität der Bundeswehr Münc… [+1770 chars]",,de,'Blackout'
https://www.zeit.de/news/2026-01/02/schnee-in-hamburg-stadtreinigung-im-einsatz,https://www.zeit.de/news/2026-01/02/schnee-in-hamburg-stadtreinigung-im-einsatz,0,www.zeit.de,Wetter: Schnee in Hamburg - Stadtreinigung im Einsatz,Hier finden Sie Informationen zu dem Thema „Wetter“. Lesen Sie jetzt „Schnee in Hamburg - Stadtreinigung im Einsatz“.,https://img.zeit.de/news/2026-01/02/schnee-in-hamburg-stadtreinigung-im-einsatz-image-group/wide__1300x731,2026-01-02T06:28:46Z,,"Schnee in Hamburg: Seit den frühen Morgenstunden ist der Winterdienst der Stadtreinigung Hamburg mit rund 125 Fahrzeugen im Einsatz. 
Gestreut werde auf wichtigen Hauptverkehrsstraßen und Strecken m… [+247 chars]",,de,'Schnee'
https://www.zeit.de/news/2026-01/02/schneeschauer-und-frost-wochenende-bleibt-winterlich,https://www.zeit.de/news/2026-01/02/schneeschauer-und-frost-wochenende-bleibt-winterlich,0,www.zeit.de,Vorhersage: Schneeschauer und Frost – Wochenende bleibt winterlich,Hier finden Sie Informationen zu dem Thema „Vorhersage“. Lesen Sie jetzt „Schneeschauer und Frost – Wochenende bleibt winterlich“.,https://img.zeit.de/news/2026-01/02/schneeschauer-und-frost-wochenende-bleibt-winterlich-image-group/wide__1300x731,2026-01-02T06:39:26Z,,"Es bleibt winterlich in Rheinland-Pfalz und im Saarland. Die Menschen müssen sich auch am Wochenende auf Schnee, Wind und glatte Straßen einstellen. 
Für Freitag sagt der Deutsche Wetterdienst (DWD)… [+1042 chars]",,de,'Schnee'
https://www.zeit.de/news/2026-01/02/sturm-schnee-und-glaette-erwartet,https://www.zeit.de/news/2026-01/02/sturm-schnee-und-glaette-erwartet,0,www.zeit.de,"Wetter: Sturm, Schnee und Glätte erwartet","Hier finden Sie Informationen zu dem Thema „Wetter“. Lesen Sie jetzt „Sturm, Schnee und Glätte erwartet“.",https://img.zeit.de/news/2026-01/02/sturm-schnee-und-glaette-erwartet-image-group/wide__1300x731,2026-01-02T07:23:15Z,,"Sachsen, Sachsen-Anhalt und Thüringen geraten unter den Einfluss eines kräftigen Sturmtiefs. Nach Angaben des Deutschen Wetterdienstes (DWD) strömt kalte Meeresluft in die drei Bundesländer. 
Verbre… [+854 chars]",,de,'Schnee'
https://www.zeit.de/news/2026-01/02/erste-ski-und-rodellifte-im-harz-laufen,https://www.zeit.de/news/2026-01/02/erste-ski-und-rodellifte-im-harz-laufen,0,www.zeit.de,Genügend Schnee: Erste Ski- und Rodellifte im Harz laufen,Hier finden Sie Informationen zu dem Thema „Genügend Schnee“. Lesen Sie jetzt „Erste Ski- und Rodellifte im Harz laufen“.,https://img.zeit.de/news/2026-01/02/erste-ski-und-rodellifte-im-harz-laufen-image-group/wide__1300x731,2026-01-02T08:15:18Z,,"Die ersten Ski- und Rodellifte im Harz haben den Betrieb aufgenommen. Rodler kommen in Torfhaus sowie in Braunlage an der Rathauswiese auf ihre Kosten; Skifahrer nur in Braunlage, wie die Betreiber m… [+976 chars]",,de,'Schnee'
https://www.zeit.de/news/2026-01/02/erste-langlauf-loipe-im-thueringer-wald,https://www.zeit.de/news/2026-01/02/erste-langlauf-loipe-im-thueringer-wald,0,www.zeit.de,Winter im Thüringer Wald: Erste Langlauf-Loipe im Thüringer Wald,Hier finden Sie Informationen zu dem Thema „Winter im Thüringer Wald“. Lesen Sie jetzt „Erste Langlauf-Loipe im Thüringer Wald“.,https://img.zeit.de/news/2026-01/02/erste-langlauf-loipe-im-thueringer-wald-image-group/wide__1300x731,2026-01-02T10:27:20Z,,"Die Wintersportbedingungen im Thüringer Wald werden besser. Die erste Langlaufloipe mit rund acht Kilometern Länge ist bei Oberhof gespurt worden, wie aus Angaben des Regionalverbunds Thüringer Wald … [+756 chars]",,de,'Schnee'
https://www.faz.net/aktuell/wirtschaft/klima-nachhaltigkeit/energieverbrauch-photovoltaik-waechst-aber-insgesamt-stagniert-oekostrom-110813002.html,https://www.faz.net/aktuell/wirtschaft/klima-nachhaltigkeit/energieverbrauch-photovoltaik-waechst-aber-insgesamt-stagniert-oekostrom-110813002.html,0,www.faz.net,"Energieverbrauch: Photovoltaik wächst, aber insgesamt stagniert Ökostrom","Öl, Gas und Kohle machen fast 80 Prozent des Primärenergieverbrauchs aus. Und die Emissionen gehen nicht zurück.",https://media0.faz.net/image/w1200h627/3a6ea1c56810/w3000h1567x0y225o/202612/43601.0.1621484093/ein-mitarbeiter-eines-solar.webp,2026-01-02T14:35:03Z,,"Die fossilen Energieträger dominieren weiterhin den Primärenergieverbrauch in Deutschland. Damit ist der Gesamteinsatz einschließlich der Elektrizität, der Wärme, der Kraftstoffe oder der Kunststoffp… [+3008 chars]",,de,'Kohle'
https://www.zeit.de/wirtschaft/2026-01/strom-energie-photovoltaik-solar-braunkohle,https://www.zeit.de/wirtschaft/2026-01/strom-energie-photovoltaik-solar-braunkohle,0,www.zeit.de,Stromerzeugung: Solarkraftwerke in Deutschland erzeugen erstmals mehr Strom als Kohle,"Photovoltaikanlagen haben im vergangenen Jahr rund 87 Terawattstunden Strom geliefert. Der Anteil der Kohle am deutschen Strommix fiel dagegen auf 22,4 Prozent.",https://img.zeit.de/wirtschaft/2026-01/strom-energie-photovoltaik-solar-braunkohle-bild/wide__1300x731,2026-01-02T17:42:36Z,,Die Solarkraftwerke in Deutschland haben im vergangenen Jahr erstmals mehr Strom als Braunkraftkohlewerke geliefert. Das geht aus einer Auswertung des Fraunhofer-Instituts für Solar Energiesysteme (F… [+947 chars],,de,'Kohle'
https://www.zeit.de/news/2026-01/03/schnee-frost-und-sturm-in-hamburg-und-schleswig-holstein,https://www.zeit.de/news/2026-01/03/schnee-frost-und-sturm-in-hamburg-und-schleswig-holstein,0,www.zeit.de,"Winter im Norden: Schnee, Frost und Sturm in Hamburg und Schleswig-Holstein","Hier finden Sie Informationen zu dem Thema „Winter im Norden“. Lesen Sie jetzt „Schnee, Frost und Sturm in Hamburg und Schleswig-Holstein“.",https://img.zeit.de/news/2026-01/03/schnee-frost-und-sturm-in-hamburg-und-schleswig-holstein-image-group/wide__1300x731,2026-01-03T11:08:02Z,,"Eine kalte polare Luftmasse sorgt am Wochenende in Hamburg und Schleswig-Holstein für winterliches Wetter mit Schnee, Frost, Glätte und teils stürmischem Wind. Am Rande eines Tiefs über der Ostsee st… [+3494 chars]",,de,'Winter'
https://www.welt.de/regionales/hamburg/article69593e74666ac1993e7cc5d1/wintereinbruch-im-norden-laenger-anhaltender-frost-ist-inzwischen-eher-ungewoehnlich.html,https://www.welt.de/regionales/hamburg/article69593e74666ac1993e7cc5d1/wintereinbruch-im-norden-laenger-anhaltender-frost-ist-inzwischen-eher-ungewoehnlich.html,0,www.welt.de,„Länger anhaltender Frost ist inzwischen eher ungewöhnlich“,"Schnee, Frost und glatte Straßen prägen das Wochenende in Norddeutschland. Während Winterdienste im Dauereinsatz sind, genießen viele Menschen den Winter beim Rodeln und Spazierengehen.",https://images.welt.de/69593e74666ac1993e7cc5d1/d5d3881b046ad8ad9de9a2ac376760d5-master/ci16x9-w1200/dpa-com-20090101-260103-911-011678-jpg,2026-01-03T16:21:54Z,,"Schnee, Frost und glatte Straßen prägen das Wochenende in Norddeutschland. Während Winterdienste im Dauereinsatz sind, genießen viele Menschen den Winter beim Rodeln und Spazierengehen.Der Winter hat… [+3476 chars]",,de,'ältere Menschen'
https://www.bild.de/leben-wissen/wohnen-living/heizkosten-sparen-wie-heizen-sie-im-winter-am-effektivsten-677bd0d5a68e5554d05ad56d,https://www.bild.de/leben-wissen/wohnen-living/heizkosten-sparen-wie-heizen-sie-im-winter-am-effektivsten-677bd0d5a68e5554d05ad56d,0,www.bild.de,Heizkosten sparen - Wie heizt man im Winter am effektivsten?,"Die Heizungen werden aufgedreht. Aber wie heizt man richtig? Wie Sie effektiv heizen, um Kosten zu sparen, erfahren Sie hier.","https://images.bild.de/677bd0d5a68e5554d05ad56d/e5bc02f73d353c7adb89f464c4a94c08,8185d6ef?w=1280",2026-01-03T22:02:13Z,,"TTS-Player überspringenArtikel weiterlesenDie Temperaturen sinken wieder und bei den meisten laufen die Heizungen bereits auf Hochtouren.
Das kann jedoch schnell die Heizkosten in die Höhe treiben. … [+5455 chars]",,de,'Heizkosten'
https://www.tagesspiegel.de/gesellschaft/panorama/stromausfall-dramatische-folgen-nach-anschlag-auf-stromnetz-in-berlin-15099993.html,https://www.tagesspiegel.de/gesellschaft/panorama/stromausfall-dramatische-folgen-nach-anschlag-auf-stromnetz-in-berlin-15099993.html,0,www.tagesspiegel.de,Stromausfall: Dramatische Folgen nach Anschlag auf Stromnetz in Berlin,"Dunkelheit, Kälte, kein Netz: Nach einem Anschlag auf die Berliner Stromversorgung kämpfen Zehntausende Menschen mit dem Ausnahmezustand. Wie Helfer und Nachbarn jetzt über sich hinauswachsen.",https://www.tagesspiegel.de/images/15101885/alternates/BASE_16_9_W1400/1767540392000/stromausfall-berlin.jpeg,2026-01-04T02:14:26Z,,"Zehntausende Menschen mitten im Winter ohne Strom, Heizung und warmes Essen, verbreitet Dunkelheit und ein Großeinsatz von Polizei und Rettungskräften: Der Anschlag auf die Berliner Stromversorgung v… [+5516 chars]",,de,'Kälte'
https://www.stern.de/gesellschaft/regional/baden-wuerttemberg/lebensmittelkontrolle--kot-und-schimmel---was-ein-lebensmittelkontrolleur-sieht-37008432.html,https://www.stern.de/gesellschaft/regional/baden-wuerttemberg/lebensmittelkontrolle--kot-und-schimmel---was-ein-lebensmittelkontrolleur-sieht-37008432.html,0,www.stern.de,Lebensmittelkontrolle: Kot und Schimmel – was ein Lebensmittelkontrolleur sieht,"Ein Blick in die Küche zeigt manchmal, was Gäste nie sehen sollen: Mäusekot auf Fensterbänken, Keime in Blumenerde und Gastronomen in der Bredouille. Ein Stuttgarter Lebensmittelkontrolleur erzählt.",https://image.stern.de/37008434/t/Cb/v1/w1440/r1.7778/-/04--v5vyxmmiv7v4axs2048jpeg---4788fc74269a68e3.jpg,2026-01-04T04:00:08Z,,"Kopiere den aktuellen Link
Zur Merkliste hinzufügen
Ein Blick in die Küche zeigt manchmal, was Gäste nie sehen sollen: Mäusekot auf Fensterbänken, Keime in Blumenerde und Gastronomen in der Bredoui… [+5833 chars]",,de,'Gas'
https://www.zeit.de/news/2026-01/05/schnee-glatteis-regen-winterwetter-im-suedwesten,https://www.zeit.de/news/2026-01/05/schnee-glatteis-regen-winterwetter-im-suedwesten,0,www.zeit.de,"Vorhersage: Schnee, Glatteis, Regen: Winterwetter im Südwesten","Hier finden Sie Informationen zu dem Thema „Vorhersage“. Lesen Sie jetzt „Schnee, Glatteis, Regen: Winterwetter im Südwesten“.",https://img.zeit.de/news/2026-01/05/schnee-glatteis-regen-winterwetter-im-suedwesten-image-group/wide__1300x731,2026-01-05T06:06:38Z,,"Zum Start in die neue Woche können sich die Menschen in Rheinland-Pfalz und im Saarland auf Schneeschauer und Glätte einstellen. Wie der Deutsche Wetterdienst (DWD) mitteilte, gibt es am Nachmittag l… [+664 chars]",,de,'Glatteis'
https://www.bild.de/regional/berlin/berliner-blackout-gebiet-polizisten-verhindern-einbruch-695b6badc83d5f8e0659c983,https://www.bild.de/regional/berlin/berliner-blackout-gebiet-polizisten-verhindern-einbruch-695b6badc83d5f8e0659c983,0,www.bild.de,Im Blackout-Gebiet - Polizisten verhindern Einbruch in Berlin,Sie wollten die Notlage der Menschen im vom Stromausfall betroffenen Südwesten Berlins ausnutzen. Doch ein aufmerksamer Passant rief die Polizei.,"https://images.bild.de/695b6badc83d5f8e0659c983/7b49c67c699b931da0c9a58f1a40c8ec,88db291f?w=1280",2026-01-05T17:47:48Z,,Berlin Sie wollten die Notlage der Menschen im vom Stromausfall betroffenen Südwesten Berlins ausnutzen. Doch ein aufmerksamer Passant und Beamte der 23. Hundertschaft der Bereitschaftspolizei machte… [+1285 chars],,de,'Blackout'
https://www.morgenpost.de/wirtschaft/article410854839/komplett-getroffen-das-heisst-der-blackout-fuer-unternehmen.html,https://www.morgenpost.de/wirtschaft/article410854839/komplett-getroffen-das-heisst-der-blackout-fuer-unternehmen.html,0,www.morgenpost.de,„Komplett getroffen“: Das heißt der Blackout für Unternehmen,"Der Berliner Stromausfall trifft auch Unternehmen hart. Daraus sollten Firmen vor allem eine Lehre ziehen, sagen Verbände.",https://img.sparknews.funkemedien.de/410840833/410840833_1767470193_v16_9_1600.jpeg,2026-01-05T17:59:45Z,,"Das Goerzwerk in Lichterfelde ist am Montag nicht per Festnetz erreichbar. Wir sind von dem Stromausfall komplett getroffen, erklärt Sprecherin Anusch Guyenz am Handy. Seit Montag laufen drei Notstro… [+6766 chars]",,de,'Blackout'
