index,url,valid,domain,title,description,image,published,archive,content,quote,language,keyword
https://www.focus.de/politik/ausland/irans-supertanker-huge-entkommt-der-us-blockade-mit-302-millionen-litern-rohoel_0649d804-2c5f-410b-a737-b27bc62fae6c.html,https://www.focus.de/politik/ausland/irans-supertanker-huge-entkommt-der-us-blockade-mit-302-millionen-litern-rohoel_0649d804-2c5f-410b-a737-b27bc62fae6c.html,0,www.focus.de,Irans Supertanker ãHugeã entkommt der USãBlockade mit 302 Millionen Litern RohûÑl,Ein iranischer Supertanker mit rund 302 Millionen Liter RohûÑl im Wert von 220 Millionen Dollar entkommt der USãBlockade.,"https://quadro.burda-forward.de/ctf/187bc9e5-59bd-445b-9a0a-beedf4ee148d.64a7f5cf-23e6-4b10-835f-66b6b911fda0.jpeg?im=RegionOfInterestCrop=(1200,630),regionOfInterest=(396,1167)&hash=60132b763f661e4a089811e7f335ed2abfb20fa61e47c8f060809808c9ed7613",2026-05-05T05:18:00Z,,"Das Schiff Huge, ein Supertanker der National Iranian Tanker Company, hat die USBlockade umgangen und mehr als 302 Millionen Liter RohûÑl in den AsienPazifikRaum gebracht. Der Wert der Ladung liegt beãÎ [+1934 chars]",,de,'RohûÑl'
https://www.faz.net/aktuell/rhein-main/frankfurt/organisierte-klimakriminalitaet-illegaler-handel-mit-kaeltemitteln-blueht-accg-200794893.html,https://www.faz.net/aktuell/rhein-main/frankfurt/organisierte-klimakriminalitaet-illegaler-handel-mit-kaeltemitteln-blueht-accg-200794893.html,0,www.faz.net,KlimakriminalitûÊt: HûÊlfte aller KûÊltemittel kommt aus illegalen Quellen,"Synthetische KûÊltemittel kommen û¥berall zum Einsatz, sind aber Klimakiller. Die EU will sie reduzieren, doch ihre Auflagen haben einen riesigen Schwarzmarkt entstehen lassen. BehûÑrden bekommen ihn nicht unter Kontrolle.",https://media0.faz.net/image/w1200h627/26087189679f/w5000h2612x0y360o/202605/0eb71fd4-afc3-4610-b552-37cef6da931a/kuehlt-die-eiscreme-erwaermt.webp,2026-05-05T08:39:24Z,,"Es ist ein Schwarzmarkt, auf dem sich die unterschiedlichsten Kunden bedienen: Metzger und Restaurants, die fû¥r ihre Kû¥hlanlagen gû¥nstige KûÊltemittel kaufen wollen. Oder Kfz-WerkstûÊtten, die KlimaanlãÎ [+6089 chars]",,de,'KûÊlte'
https://www.sueddeutsche.de/wirtschaft/schweiz-inflation-benzin-iran-krieg-li.3478822,https://www.sueddeutsche.de/wirtschaft/schweiz-inflation-benzin-iran-krieg-li.3478822,0,www.sueddeutsche.de,Energiepreise: Inflation in der Schweiz verdoppelt sich,Grund sind die durch den Krieg in Nahen Osten gestiegenen Spritpreise. Dennoch ist die Lage im Nachbarland besser als in Deutschland.,https://www.sueddeutsche.de/2026/05/05/0b6c98dc-60b1-4598-99c4-2dda3a69ca09.jpg?q=60&fm=webp&width=1200&rect=0%2C209%2C4000%2C2250,2026-05-05T11:24:57Z,,"Die Inflationsrate in der Schweiz hat sich im April verdoppelt und den hûÑchsten Stand seit fast eineinhalb Jahren erreicht. Grund dafû¥r war ein starker Preisanstieg bei Benzin, ausgelûÑst durch den KoãÎ [+749 chars]",,de,'Spritpreise'
https://www.bild.de/politik/inland/zoff-um-tankrabatt-kommt-die-entlastung-wirklich-bei-autofahrern-an-69f9ac64472693c1c1ff2450,https://www.bild.de/politik/inland/zoff-um-tankrabatt-kommt-die-entlastung-wirklich-bei-autofahrern-an-69f9ac64472693c1c1ff2450,0,www.bild.de,Riesen-Zoff um den Tankrabatt - Kommt die Entlastung wirklich bei Autofahrern an?,Der groûe Tankrabatt sollte Autofahrer aufatmen lassen ã doch jetzt gibtãs Zoff um die Spritpreise!,"https://images.bild.de/69f9ac64472693c1c1ff2450/93f69b8944d8087de294ca81ea3622e2,b676af29?w=1280",2026-05-05T11:53:22Z,,TTS-Player û¥berspringenArtikel weiterlesenBerlin Der groûe Tankrabatt sollte Autofahrer aufatmen lassen doch jetzt gibts Zoff um die Spritpreise! Neue Zahlen legen nahe: An den ZapfsûÊulen kommt offenãÎ [+3147 chars],,de,'Spritpreise'
https://www.stern.de/news/spritpreise--mineraloelkonzerne-geben-tankrabatt-bislang-nur-teilweise-weiter-37370792.html,https://www.stern.de/news/spritpreise--mineraloelkonzerne-geben-tankrabatt-bislang-nur-teilweise-weiter-37370792.html,0,www.stern.de,Spritpreise: MineralûÑlkonzerne geben Tankrabatt bislang nur teilweise weiter,Der seit dem 1. Mai geltende sogenannte Tankrabatt der Bundesregierung in HûÑhe von 17 Cent kommt bislang nur teilweise bei Autofahrerinnen und -fahrern an. Der Automobilclub ADAC schlussfolgerte am Dienstag mit Blick auf die Tagesdurchschnittspreise von BenziãÎ,https://image.stern.de/37370794/t/b9/v1/w1440/r1.7778/-/05--tanksaeule-an-der-autobahn-bei-muenster---091e1336ecc8d2fb.jpg,2026-05-05T12:38:31Z,,"Kopiere den aktuellen Link
Zur Merkliste hinzufû¥gen
Der seit dem 1. Mai geltende sogenannte Tankrabatt der Bundesregierung in HûÑhe von 17 Cent kommt bislang nur teilweise bei Autofahrerinnen und -fãÎ [+2852 chars]",,de,'Spritpreise'
https://taz.de/Angst-vor-Blackouts/!6176418/,https://taz.de/Angst-vor-Blackouts/!6176418/,0,taz.de,Angst vor Blackouts: EU verbannt Solaranlagen-Technik aus China,Blackout durch Photovoltaik aus Fernost? Die EU-Kommission stoppt die FûÑrderung fû¥r sogenannte Wechselrichter. Die Branche ist û¥berrascht.,https://taz.de/picture/8419583/1200/27119571.jpeg,2026-05-05T12:47:00Z,,Blackout durch Photovoltaik aus Fernost? Die EU-Kommission stoppt die FûÑrderung fû¥r sogenannte Wechselrichter. Die Branche ist û¥berrascht. mehr...,,de,'Blackout'
https://www.welt.de/politik/deutschland/article69f9ef1ac764528c1ad20920/milliarden-entlastung-reiche-legt-neuen-entwurf-fuer-heizgesetz-vor-kein-betriebsverbot-mehr-fuer-oel-und-gasheizungen.html,https://www.welt.de/politik/deutschland/article69f9ef1ac764528c1ad20920/milliarden-entlastung-reiche-legt-neuen-entwurf-fuer-heizgesetz-vor-kein-betriebsverbot-mehr-fuer-oel-und-gasheizungen.html,0,www.welt.de,Reiche legt neuen Entwurf fû¥r Heizgesetz vor ã Kein Betriebsverbot mehr fû¥r ûl- und Gasheizungen,Das Heizungsgesetz der Ampelregierung soll ersetzt werden. Nun wurden Details zum neuen Gesetzentwurf aus dem Ministerium von Katherina Reiche bekannt. Es enthûÊlt weitreichende ûnderungen fû¥r die Bû¥rger.,https://images.welt.de/69f9ef1ac764528c1ad20920/f1eb0d0a2003e11a85b2f1d09c050d75-master/ci16x9-w1200/dpa-com-260504-911-019065-jpg,2026-05-05T14:38:46Z,,Das Heizungsgesetz der Ampelregierung soll ersetzt werden. Nun wurden Details zum neuen Gesetzentwurf aus dem Ministerium von Katherina Reiche bekannt. Es enthûÊlt weitreichende ûnderungen fû¥r die Bû¥rãÎ [+5835 chars],,de,'Gas'
https://www.stern.de/panorama/suedafrika--krokodil-per-heli-ausgeflogen---mit-59-jaehrigem-im-bauch--37371216.html,https://www.stern.de/panorama/suedafrika--krokodil-per-heli-ausgeflogen---mit-59-jaehrigem-im-bauch--37371216.html,0,www.stern.de,Mann vermisst: Krokodil per Helikopter ausgeflogen ã mit 59-JûÊhrigem im Bauch?,Nach einem Hochwasser in Sû¥dafrika wird ein Hotelmanager vermisst. BehûÑrden verdûÊchtigen ein Krokodil. Zur Prû¥fung fliegen sie das Reptil aus ã und finden Erschreckendes.,https://image.stern.de/37371342/t/Ae/v4/w1440/r1.7778/-/krokodil.png,2026-05-05T16:40:00Z,,"Zugang zu stern+statt 11,96ô 
 nur 1ô  
<ul><li>Alles von stern+ mit erstklassigen Inhalten von GEO und Capital</li><li>4 Wochen testen, dann 2,99ô  je Woche</li><li>jederzeit kû¥ndbar</li></ul>",,de,'Hochwasser'
https://www.bild.de/leben-wissen/digital/digitaler-blackout-stoerung-legt-zahlreiche-de-webseiten-lahm-69fa7498c764528c1ad213c0,https://www.bild.de/leben-wissen/digital/digitaler-blackout-stoerung-legt-zahlreiche-de-webseiten-lahm-69fa7498c764528c1ad213c0,0,www.bild.de,Digitaler Blackout - StûÑrung legt etliche .de-Webseiten lahm,Denic bestûÊtigt nûÊchtliche StûÑrung: Viele .de-Seiten kurz nicht erreichbar. Ursache wird geprû¥ft.,"https://images.bild.de/69fa7498c764528c1ad213c0/f174f09410eff2c4019879df5e48638f,9dc8d921?w=1280",2026-05-05T23:04:30Z,,TTS-Player û¥berspringenArtikel weiterlesenBerlin In der Nacht konnten zahlreiche Websites mit der Endung .de zeitweise nicht aufgerufen werden. Der Grund: eine StûÑrung im DNS-Service zur AuflûÑsung voãÎ [+498 chars],,de,'Blackout'
https://www.stern.de/gesellschaft/regional/bayern/preise--vbw-index--fast-alle-rohstoffe-verteuern-sich-erheblich-37372380.html,https://www.stern.de/gesellschaft/regional/bayern/preise--vbw-index--fast-alle-rohstoffe-verteuern-sich-erheblich-37372380.html,0,www.stern.de,Preise: vbw-Index: Fast alle Rohstoffe verteuern sich erheblich,"Fû¥r Bayerns leidgeprû¥fte Industrie bedeutet der Iran-Krieg eine weitere Hiobsbotschaft, da die Energiekosten steigen. Doch teurer werden keineswegs nur ûl und Gas.",https://image.stern.de/37372382/t/O5/v1/w1440/r1.7778/-/06--a2bxpbasm7v13axs2048jpeg---03034b278f959260.jpg,2026-05-06T03:00:17Z,,"Kopiere den aktuellen Link
Zur Merkliste hinzufû¥gen
Fû¥r Bayerns leidgeprû¥fte Industrie bedeutet der Iran-Krieg eine weitere Hiobsbotschaft, da die Energiekosten steigen. Doch teurer werden keinesweãÎ [+1475 chars]",,de,'RohûÑl'
https://www.bild.de/news/inland/stoerung-darum-ging-gestern-abend-das-internet-nicht-mehr-69fac9c9cd4a28c47001d51a,https://www.bild.de/news/inland/stoerung-darum-ging-gestern-abend-das-internet-nicht-mehr-69fac9c9cd4a28c47001d51a,0,www.bild.de,Digitaler Blackout - Darum ging gestern Abend das Internet nicht mehr,Eine heftige StûÑrung bei einem Dienstleister legte in der Nacht groûe Teile des deutschen Internets lahm. Zahlreiche Internetseiten waren nicht erreichbar.,"https://images.bild.de/69fac9c9cd4a28c47001d51a/e3471005c87153b072990568fec3e806,a7c23741?w=1280",2026-05-06T05:57:40Z,,TTS-Player û¥berspringenArtikel weiterlesenFrankfurt Eine heftige StûÑrung bei einem Dienstleister legte in der Nacht groûe Teile des deutschen Internets lahm. In der Nacht konnten zahlreiche Nutzer plãÎ [+1529 chars],,de,'Blackout'
https://www.telepolis.de/article/Oberlandesgericht-Duesseldorf-stoppt-Untersuchung-des-Kraftstoffgrosshandels-11280362.html,https://www.telepolis.de/article/Oberlandesgericht-Duesseldorf-stoppt-Untersuchung-des-Kraftstoffgrosshandels-11280362.html,0,www.telepolis.de,Oberlandesgericht Dû¥sseldorf stoppt Untersuchung des Kraftstoffgroûhandels,"Das Kartellamt verdûÊchtigt Preisdienste, die Spritpreise zu manipulieren ã doch ein Gericht hat die Ermittlungen vorerst gestoppt.",https://heise.cloudimg.io/bound/1200x1200/q85.png-lossy-85.webp-lossy-85.foil1/_www-heise-de_/imgs/18/5/0/7/5/5/7/3/kanister-kartell-f2-91db36026f66133e.jpg,2026-05-06T06:00:00Z,,"Das Kartellamt verdûÊchtigt Preisdienste, die Spritpreise zu manipulieren doch ein Gericht hat die Ermittlungen vorerst gestoppt.
Das Bundeskartellamt argwûÑhnte schon lange, dass bei der PreisfindungãÎ [+5824 chars]",,de,'Spritpreise'
https://www.focus.de/politik/ausland/supertanker-huge-entkommt-trumps-blockade-mit-302-millionen-litern-rohoel_0649d804-2c5f-410b-a737-b27bc62fae6c.html,https://www.focus.de/politik/ausland/supertanker-huge-entkommt-trumps-blockade-mit-302-millionen-litern-rohoel_0649d804-2c5f-410b-a737-b27bc62fae6c.html,0,www.focus.de,Supertanker ãHugeã entkommt Trumps Blockade mit 302 Millionen Litern RohûÑl,Ein iranischer Supertanker mit rund 302 Millionen Liter RohûÑl im Wert von 220 Millionen Dollar entkommt der USãBlockade.,"https://quadro.burda-forward.de/ctf/187bc9e5-59bd-445b-9a0a-beedf4ee148d.64a7f5cf-23e6-4b10-835f-66b6b911fda0.jpeg?im=RegionOfInterestCrop=(1200,630),regionOfInterest=(396,1167)&hash=60132b763f661e4a089811e7f335ed2abfb20fa61e47c8f060809808c9ed7613",2026-05-06T06:08:00Z,,"Das Schiff Huge, ein Supertanker der National Iranian Tanker Company, hat die USBlockade umgangen und mehr als 302 Millionen Liter RohûÑl in den AsienPazifikRaum gebracht. Der Wert der Ladung liegt beãÎ [+1934 chars]",,de,'RohûÑl'
https://www.morgenpost.de/wirtschaft/article411892711/tanken-berlin-billig-benzin-diesel-super-spritpreise-heute-aktuell-6-mai.html,https://www.morgenpost.de/wirtschaft/article411892711/tanken-berlin-billig-benzin-diesel-super-spritpreise-heute-aktuell-6-mai.html,0,www.morgenpost.de,Gû¥nstig tanken in Berlin (6. Mai): Die gû¥nstigsten Tankstellen heute,"Die Spritpreise in Berlin erreichen neue HûÑchststûÊnde. Wer beim Tanken sparen will, sollte genau hinschauen ã welche Tipps helfen wirklich?",https://img.sparknews.funkemedien.de/411411200/411411200_1777874028_v16_9_1600.jpeg,2026-05-06T08:12:52Z,,"Die Spritpreise in Deutschland haben ein Rekordhoch erreicht,: Berliner Autofahrerinnen und Autofahrer dû¥rften aktuell also weniger Freude mit ihrem Auto haben. Umso wichtiger ist es, den richtigen MãÎ [+2896 chars]",,de,'Spritpreise'
"https://www.gamestar.de/artikel/spanien-massnahmen-blackout,3452381.html","https://www.gamestar.de/artikel/spanien-massnahmen-blackout,3452381.html",0,www.gamestar.de,Energie - 589 Prozent mehr Speicher: Vor einem Jahr fiel in ganz Spanien der Strom aus. Seitdem hat das Land seine Hausaufgaben gemacht,Nach dem verheerenden Blackout im letztem Jahr hat Spanien schnell reagiert und gleich in mehreren Bereichen nachgebessert.,https://images.cgames.de/images/gamestar/293/teaser-spanien-ende-der-kohle-gs_6370516.jpg,2026-05-06T08:26:00Z,,"Spanien hat nach dem Blackout mehrere Maûnahmen ergriffen, um das Stromnetz abzusichern. (Bildquelle: Unsplash, Joey Harris und Adobe Firefly, generative KI)
Der Stromausfall im Frû¥hjahr des Jahres ãÎ [+3868 chars]",,de,'Blackout'
https://www.zeit.de/wirtschaft/2026-05/heizungsgesetz-fossile-energie-wohnen-heizkosten-faq,https://www.zeit.de/wirtschaft/2026-05/heizungsgesetz-fossile-energie-wohnen-heizkosten-faq,0,www.zeit.de,Heizungsgesetz: Das sind die wichtigsten ûnderungen fû¥r Hausbesitzer und Mieter,"Monatelang hat die Regierung ums neue Heizungsgesetz gerungen, nun liegt ein Entwurf vor. Die Gasheizung ist wieder erlaubt ã wûÊre aber die teuerste LûÑsung.",https://img.zeit.de/wirtschaft/2026-05/heizungsgesetz-fossile-energie-wohnen-heizkosten-faq-3/wide__1300x731,2026-05-06T09:32:28Z,,"Schlieûen
Artikelzusammenfassung
Schwarz-Rot plant, das umstrittene Habeck'sche Heizungsgesetz abzuschaffen und den Einbau von ûl- und Gasheizungen wieder zu ermûÑglichen. Allerdings sollen klimafreãÎ [+651 chars]",,de,'Heizkosten'
https://www.stern.de/news/spritpreise-im-wochenvergleich-niedriger---aber-nicht-um-hoehe-des-tankrabatts-37373924.html,https://www.stern.de/news/spritpreise-im-wochenvergleich-niedriger---aber-nicht-um-hoehe-des-tankrabatts-37373924.html,0,www.stern.de,Spritpreise im Wochenvergleich niedriger - aber nicht um HûÑhe des Tankrabatts,"Die Spritpreise an den deutschen Tankstellen sind in den vergangen sieben Tagen laut ADAC zwar gesunken - aber nicht um den Betrag des sogenannten Tankrabatts. Der Preis fû¥r einen Liter Super E10 betrug am Dienstag im Tagesdurchschnitt 2,025 Euro pro Liter unãÎ",https://image.stern.de/37373926/t/Hp/v1/w1440/r1.7778/-/06--preise-an-berliner-tankstelle-am-24-april---f02bf7e259ba10c9.jpg,2026-05-06T10:17:42Z,,"Kopiere den aktuellen Link
Zur Merkliste hinzufû¥gen
Die Spritpreise an den deutschen Tankstellen sind in den vergangen sieben Tagen laut ADAC zwar gesunken - aber nicht um den Betrag des sogenannteãÎ [+1845 chars]",,de,'Spritpreise'
https://www.sueddeutsche.de/politik/bundesregierung-liveblog-merz-tankrabatt-zdf-sendung-wirkung-entlastung-autofahrer-li.3477387,https://www.sueddeutsche.de/politik/bundesregierung-liveblog-merz-tankrabatt-zdf-sendung-wirkung-entlastung-autofahrer-li.3477387,0,www.sueddeutsche.de,Bundespolitik: Merz: Tankrabatt funktioniert ãso leidlichã,Der Kanzler rechtfertigt in einer ZDF-Sendung den Tankrabatt wegen der gestiegenen Spritpreise. Die Wirkung zur Entlastung der Autofahrer schûÊtzt er vorerst zurû¥ckhaltend ein.,https://www.sueddeutsche.de/2025/12/17/41b92fd7-d0fe-4f90-b896-9b0e576422b4.jpg?q=60&fm=webp&width=1200&rect=0%2C101%2C1920%2C1080,2026-05-06T13:43:33Z,,Bei Gas- und ûlheizungen soll bis 2040 die Nutzung von mindestens 60 Prozent klimafreundlichen Brennstoffen wie Biomethan oder synthetischer Treibstoff vorgeschrieben werden. Dies geht aus dem EntwurãÎ [+1890 chars],,de,'Spritpreise'
https://tirol.orf.at/stories/3353108/,https://tirol.orf.at/stories/3353108/,0,tirol.orf.at,Hochwasserschutz fû¥r 900 Personen,"Das Hochwasserschutzprojekt in den Gemeinden St. Ulrich am Pillersee und Waidring (Bezirk Kitzbû¥hel) ist abgeschlossen. Durch 16 Einzelmaûnahmen und Investitionen von rund 9,4 Millionen Euro werden nun 110 GebûÊude und 900 Bewohner vor Hochwasser geschû¥tzt.",https://ibs.orf.at/tir?image=https%3A%2F%2Foekastatic.orf.at%2Fmims%2F2022%2F34%2F36%2Fcrops%2Fw%3D1200%2Ch%3D627%2Cq%3D75%2F1465009_master_530436_fruehling_im_pillerseetal_c_ringler_fullres_32.jpg%3Fs%3De84b01f22e9e0d3a903a3d74c6671f083865e336,2026-05-06T15:38:57Z,,"Fû¥r unsere Gemeinden ist die Fertigstellung dieses Hochwasserschutzprojekts ein ganz wesentlicher Schritt, betonten Martin Mitterer, Bû¥rgermeister der Gemeinde St. Ulrich am Pillersee und Georg HochfãÎ [+3078 chars]",,de,'Hochwasser'
https://www.zeit.de/politik/deutschland/2026-05/hohe-spritpreise-tankrabatt-friedrich-merz-irankrieg-zdf-interview-was-nun,https://www.zeit.de/politik/deutschland/2026-05/hohe-spritpreise-tankrabatt-friedrich-merz-irankrieg-zdf-interview-was-nun,0,www.zeit.de,Hohe Spritpreise: Friedrich Merz nicht vollends mit Wirkung des Tankrabatts zufrieden,"ô£Er funktioniert so leidlichô¨, urteilt Kanzler Merz im ZDF û¥ber den von der Bundesregierung eingefû¥hrten Tankrabatt. Der CDU-Chef verteidigt die Regel aber gegen Kritik.",https://img.zeit.de/politik/2026-05/hohe-spritpreise-tankrabatt-friedrich-merz-irankrieg-zdf-interview-was-nun-bild/wide__1300x731,2026-05-06T16:07:44Z,,"Bundeskanzler Friedrich Merz (CDU) hat sich zurû¥ckhaltend û¥ber die Wirkung des Tankrabatts geûÊuûert. ô£Er funktioniert so leidlichô¨, sagte der Kanzler in der ZDF-Sendungô Was nun, Herr Merz?ô Einige 
TãÎ [+765 chars]",,de,'Spritpreise'
https://www.zeit.de/news/2026-05/07/kinder-kontrollieren-autofahrer-in-sachsen,https://www.zeit.de/news/2026-05/07/kinder-kontrollieren-autofahrer-in-sachsen,0,www.zeit.de,Verkehr: Kinder kontrollieren Autofahrer in Sachsen,Hier finden Sie Informationen zu dem Thema ãVerkehrã. Lesen Sie jetzt ãKinder kontrollieren Autofahrer in Sachsenã.,https://img.zeit.de/news/2026-05/07/kinder-kontrollieren-autofahrer-in-sachsen-image-group/wide__1300x731,2026-05-07T06:16:36Z,,Bei landesweiten Verkehrskontrollen im Bereich von Schulen in Sachsen war fast jedes zehnte Auto zu schnell unterwegs. Dies ist die Bilanz des sûÊchsischen Innenministeriums zur zweiwûÑchigen VerkehrssãÎ [+546 chars],,de,'Kinder'
https://www.zeit.de/news/2026-05/07/nahostkrieg-treibt-spritpreise-aber-weniger-stark-als-2022,https://www.zeit.de/news/2026-05/07/nahostkrieg-treibt-spritpreise-aber-weniger-stark-als-2022,0,www.zeit.de,Folgen des Kriegs: Nahostkrieg treibt Spritpreise ã aber weniger stark als 2022,Hier finden Sie Informationen zu dem Thema ãFolgen des Kriegsã. Lesen Sie jetzt ãNahostkrieg treibt Spritpreise ã aber weniger stark als 2022ã.,https://img.zeit.de/news/2026-05/07/nahostkrieg-treibt-spritpreise-aber-weniger-stark-als-2022-image-group/wide__1300x731,2026-05-07T06:48:49Z,,Die Preisanstiege bei Energie wegen des Iran-Kriegs sind ûÊhnlich stark wie in frû¥heren ûl- und Weltwirtschaftskrisen - aber weniger heftig als im Ukraine-Krieg 2022. Das zeigen Daten des StatistischeãÎ [+1646 chars],,de,'Spritpreise'
https://www.stern.de/wirtschaft/news/folgen-des-kriegs--nahostkrieg-treibt-spritpreise---aber-weniger-stark-als-2022-37376512.html,https://www.stern.de/wirtschaft/news/folgen-des-kriegs--nahostkrieg-treibt-spritpreise---aber-weniger-stark-als-2022-37376512.html,0,www.stern.de,Folgen des Kriegs: Nahostkrieg treibt Spritpreise ã aber weniger stark als 2022,Autofahrer bekommen die Folgen des Iran-Kriegs an den Tankstellen zu spû¥ren. Neue Daten zeigen krûÊftige Preisanstiege. Der historische Vergleich zeigt aber noch hûÑhere Sprû¥nge in frû¥heren Krisen.,https://image.stern.de/37376514/t/_U/v1/w1440/r1.7778/-/07--2qbfjofuemv3axs2048jpeg---82f204d81fcdaffd.jpg,2026-05-07T06:48:49Z,,"Kopiere den aktuellen Link
Zur Merkliste hinzufû¥gen
Autofahrer bekommen die Folgen des Iran-Kriegs an den Tankstellen zu spû¥ren. Neue Daten zeigen krûÊftige Preisanstiege. Der historische Vergleich ãÎ [+1858 chars]",,de,'Spritpreise'
https://www.tagesspiegel.de/wirtschaft/folgen-des-kriegs-nahostkrieg-treibt-spritpreise--aber-weniger-stark-als-2022-15567667.html,https://www.tagesspiegel.de/wirtschaft/folgen-des-kriegs-nahostkrieg-treibt-spritpreise--aber-weniger-stark-als-2022-15567667.html,0,www.tagesspiegel.de,Folgen des Kriegs: Nahostkrieg treibt Spritpreise ã aber weniger stark als 2022,Autofahrer bekommen die Folgen des Iran-Kriegs an den Tankstellen zu spû¥ren. Neue Daten zeigen krûÊftige Preisanstiege. Der historische Vergleich zeigt aber noch hûÑhere Sprû¥nge in frû¥heren Krisen.,https://www.tagesspiegel.de/images/15567666/alternates/BASE_16_9_W1400/1778136593000/hohe-spritpreise.jpeg,2026-05-07T06:49:53Z,,Die Preisanstiege bei Energie wegen des Iran-Kriegs sind ûÊhnlich stark wie in frû¥heren ûl- und Weltwirtschaftskrisen - aber weniger heftig als im Ukraine-Krieg 2022. Das zeigen Daten des StatistischeãÎ [+1700 chars],,de,'Spritpreise'
https://www.stern.de/gesellschaft/regional/sachsen/verhaeltnis-lohn-zu-preis--ifo-institut--last-durch-spritpreise-nicht-ungewoehnlich-hoch-37376586.html,https://www.stern.de/gesellschaft/regional/sachsen/verhaeltnis-lohn-zu-preis--ifo-institut--last-durch-spritpreise-nicht-ungewoehnlich-hoch-37376586.html,0,www.stern.de,VerhûÊltnis Lohn zu Preis: Ifo-Institut: Last durch Spritpreise nicht ungewûÑhnlich hoch,Der Iran-Konflikt hat die Preise fû¥r Diesel und Benzin zwischenzeitlich explodieren lassen. Fû¥r einen Liter Benzin musste ein durchschnittlicher Arbeitnehmer im April fû¥nf Minuten arbeiten.,https://image.stern.de/37376588/t/ws/v1/w1440/r1.7778/-/07--ug2ette3xav8axs2048jpeg---0e6b63b983a5c70d.jpg,2026-05-07T07:06:44Z,,"Kopiere den aktuellen Link
Zur Merkliste hinzufû¥gen
Der Iran-Konflikt hat die Preise fû¥r Diesel und Benzin zwischenzeitlich explodieren lassen. Fû¥r einen Liter Benzin musste ein durchschnittlicher ãÎ [+1369 chars]",,de,'Spritpreise'
https://www.zeit.de/news/2026-05/07/ifo-institut-last-durch-spritpreise-nicht-ungewoehnlich-hoch,https://www.zeit.de/news/2026-05/07/ifo-institut-last-durch-spritpreise-nicht-ungewoehnlich-hoch,0,www.zeit.de,VerhûÊltnis Lohn zu Preis: Ifo-Institut: Last durch Spritpreise nicht ungewûÑhnlich hoch,Hier finden Sie Informationen zu dem Thema ãVerhûÊltnis Lohn zu Preisã. Lesen Sie jetzt ãIfo-Institut: Last durch Spritpreise nicht ungewûÑhnlich hochã.,https://img.zeit.de/news/2026-05/07/ifo-institut-last-durch-spritpreise-nicht-ungewoehnlich-hoch-image-group/wide__1300x731,2026-05-07T07:06:44Z,,Die gestiegenen Preise fû¥r Benzin und Diesel belasten Arbeitnehmer nach Ansicht von Experten des Dresdner Ifo-Instituts nicht mehr als in vergangenen Jahren. Grund dafû¥r sind die stetig gestiegenen LãÎ [+1163 chars],,de,'Spritpreise'
https://www.tagesschau.de/wirtschaft/finanzen/iran-krieg-wind-solar-boerse-100.html,https://www.tagesschau.de/wirtschaft/finanzen/iran-krieg-wind-solar-boerse-100.html,0,www.tagesschau.de,Wie der Iran-Krieg den Erneuerbaren zum Boom verhilft,"Die AbhûÊngigkeit von Gas und ûl ist kostspielig. Mit Hochdruck versuchen Staaten, den Ausbau Erneuerbarer Energien voranzutreiben. Das gibt grû¥nen Aktien an der BûÑrse mûÊchtig Rû¥ckenwind. Trump dû¥rfte das nicht gefallen. Von Angela GûÑpfert.",https://images.tagesschau.de/image/66eada61-d312-4a80-b398-cae89b00e5c8/AAABnfc7tIs/AAABnSSvrFg/16x9-big/windkraft-226.jpg?width=1280,2026-05-07T09:18:11Z,,"Stand: 07.05.2026 11:18 Uhr
Die AbhûÊngigkeit von Gas und ûl ist kostspielig. Mit Hochdruck versuchen Staaten, den Ausbau Erneuerbarer Energien voranzutreiben. Das gibt grû¥nen Aktien an der BûÑrse mûÊcãÎ [+5152 chars]",,de,'Gas'
https://www.n-tv.de/wirtschaft/Spritpreise-steigen-durch-Iran-Krieg-weniger-stark-als-2022-id30795768.html,https://www.n-tv.de/wirtschaft/Spritpreise-steigen-durch-Iran-Krieg-weniger-stark-als-2022-id30795768.html,0,www.n-tv.de,Kriegsausbrû¥che im Vergleich: Spritpreise steigen weniger stark als 2022,"Seit Beginn des Krieges im Nahen Osten belasten hohe Preise fû¥r Kraftstoffe viele Autofahrer in Deutschland. Zu Beginn des Ukraine-Krieges war der Preisanstieg jedoch noch stûÊrker. Statistiker erklûÊren, woran das liegt.",https://www.n-tv.de/img/30795378/1778149184/Img_16_9/1200/Hohe-Spritpreise-an-den-Tankstellen-belasten-Autofahrer-in-Deutschland.jpg,2026-05-07T09:56:55Z,,"Autofahrer bekommen die Folgen des Iran-Kriegs durch hohe Kraftstoffpreise zu spû¥ren. 
Seit Beginn des Krieges im Nahen Osten belasten hohe Preise fû¥r Kraftstoffe viele Autofahrer in Deutschland. ZuãÎ [+1996 chars]",,de,'Spritpreise'
