index,url,valid,domain,title,description,image,published,archive,content,quote,language,keyword
https://www.zeit.de/news/2026-01/09/winter-hat-norden-im-griff-schneefrei-an-schulen,https://www.zeit.de/news/2026-01/09/winter-hat-norden-im-griff-schneefrei-an-schulen,0,www.zeit.de,Winter in Norddeutschland: Winter hat Norden im Griff – Schneefrei an Schulen,Hier finden Sie Informationen zu dem Thema „Winter in Norddeutschland“. Lesen Sie jetzt „Winter hat Norden im Griff – Schneefrei an Schulen“.,https://img.zeit.de/news/2026-01/09/winter-hat-norden-im-griff-schneefrei-an-schulen-image-group/wide__1300x731,2026-01-09T02:30:08Z,,Der Winter hat den Norden fest im Griff und dürfte mit Neuschnee und Sturmböen noch für weitere Behinderungen sorgen. Wegen des heranziehenden Sturmtiefs «Elli» gilt ab dem Morgen eine Unwetterwarnun… [+5275 chars],,de,'Winter'
https://www.zeit.de/news/2026-01/09/war-es-gas-ermittlungen-nach-explosion-mit-drei-toten,https://www.zeit.de/news/2026-01/09/war-es-gas-ermittlungen-nach-explosion-mit-drei-toten,0,www.zeit.de,Großeinsatz in Albstadt: War es Gas? Ermittlungen nach Explosion mit drei Toten,Hier finden Sie Informationen zu dem Thema „Großeinsatz in Albstadt“. Lesen Sie jetzt „War es Gas? Ermittlungen nach Explosion mit drei Toten“.,https://img.zeit.de/news/2026-01/09/war-es-gas-ermittlungen-nach-explosion-mit-drei-toten-image-group/wide__1300x731,2026-01-09T03:00:21Z,,War es ein Gasleck oder löste etwas anderes die verheerende Explosion in Albstadt aus? Nach dem Einsturz eines Wohnhauses versuchen die Ermittler die Ursache für den Tod einer jungen Familie zu finde… [+1743 chars],,de,'Gas'
https://www.zeit.de/news/2026-01/09/fruehlingsgefuehle-im-winter-mehr-verletzte-fuechse,https://www.zeit.de/news/2026-01/09/fruehlingsgefuehle-im-winter-mehr-verletzte-fuechse,0,www.zeit.de,Tiere: Frühlingsgefühle im Winter – mehr verletzte Füchse,Hier finden Sie Informationen zu dem Thema „Tiere“. Lesen Sie jetzt „Frühlingsgefühle im Winter – mehr verletzte Füchse“.,https://img.zeit.de/news/2026-01/09/fruehlingsgefuehle-im-winter-mehr-verletzte-fuechse-image-group/wide__1300x731,2026-01-09T04:00:13Z,,Bei Experten häufen sich aktuell Anrufe zu verletzten oder humpelnden Füchsen in der Hauptstadt. Der Rotfuchs befindet sich dem Beratungsservice von Wildtiernah Berlin zufolge mitten in der Ranzzeit … [+1102 chars],,de,'Winter'
https://www.zeit.de/news/2026-01/09/sturmtief-bringt-viel-schnee-und-starken-wind,https://www.zeit.de/news/2026-01/09/sturmtief-bringt-viel-schnee-und-starken-wind,0,www.zeit.de,Wetter: Sturmtief bringt viel Schnee und starken Wind,Hier finden Sie Informationen zu dem Thema „Wetter“. Lesen Sie jetzt „Sturmtief bringt viel Schnee und starken Wind“.,https://img.zeit.de/news/2026-01/09/sturmtief-bringt-viel-schnee-und-starken-wind-image-group/wide__1300x731,2026-01-09T04:47:31Z,,Das Sturmtief «Elli» verschärft das Winterwetter in Niedersachsen und Bremen. Seit dem frühen Morgen gibt es an der Küste Windböen und stürmische Böen mit Geschwindigkeiten zwischen 55 und 65 Kilomet… [+783 chars],,de,'Schnee'
https://www.zeit.de/news/2026-01/09/kaelte-naechte-bvg-will-bahnhoefe-nicht-als-bleibe-oeffnen,https://www.zeit.de/news/2026-01/09/kaelte-naechte-bvg-will-bahnhoefe-nicht-als-bleibe-oeffnen,0,www.zeit.de,Obdachlose: Kälte-Nächte: BVG will Bahnhöfe nicht als Bleibe öffnen,Hier finden Sie Informationen zu dem Thema „Obdachlose“. Lesen Sie jetzt „Kälte-Nächte: BVG will Bahnhöfe nicht als Bleibe öffnen“.,https://img.zeit.de/news/2026-01/09/kaelte-naechte-bvg-will-bahnhoefe-nicht-als-bleibe-oeffnen-image-group/wide__1300x731,2026-01-09T04:49:42Z,,Trotz angekündigten Minustemperaturen wollen die Berliner Verkehrsbetriebe (BVG) aktuell ihre Bahnhöfe nicht als Bleibe für Obdachlose öffnen. «Aus Sicherheitsgründen können wir keine Bahnhöfe als Bl… [+857 chars],,de,'Kälte'
https://www.zeit.de/news/2026-01/09/das-kalte-winterwetter-belastet-die-tierheime-im-norden,https://www.zeit.de/news/2026-01/09/das-kalte-winterwetter-belastet-die-tierheime-im-norden,0,www.zeit.de,Tierschutz: Das kalte Winterwetter belastet die Tierheime im Norden,Hier finden Sie Informationen zu dem Thema „Tierschutz“. Lesen Sie jetzt „Das kalte Winterwetter belastet die Tierheime im Norden“.,https://img.zeit.de/news/2026-01/09/das-kalte-winterwetter-belastet-die-tierheime-im-norden-image-group/wide__1300x731,2026-01-09T05:00:04Z,,"Das Winterwetter macht auch den Tierheimen im Norden zu schaffen. Das ergab eine stichprobenartige Anfrage der Deutschen Presse-Agentur bei Tierheimen in Hamburg und Schleswig-Holstein.
«Wir blicken… [+4028 chars]",,de,'Energiekosten'
https://www.zeit.de/news/2026-01/09/zugvoegel-weichen-dem-schnee-kurzfristig-aus,https://www.zeit.de/news/2026-01/09/zugvoegel-weichen-dem-schnee-kurzfristig-aus,0,www.zeit.de,Wintereinbruch: Zugvögel weichen dem Schnee kurzfristig aus,Hier finden Sie Informationen zu dem Thema „Wintereinbruch“. Lesen Sie jetzt „Zugvögel weichen dem Schnee kurzfristig aus“.,https://img.zeit.de/news/2026-01/09/zugvoegel-weichen-dem-schnee-kurzfristig-aus-image-group/wide__1300x731,2026-01-09T05:00:09Z,,Schnee und Frost setzen den Zugvögeln in Schleswig-Holstein zu und treiben sie weiter. Wegen des Klimawandels und der damit verbundenen milderen Temperaturen fliegen etwa Gänse seit den 2000er Jahren… [+1922 chars],,de,'Winter'
https://www.zeit.de/politik/2026-01/obdachlosigkeit-kaelte-mitternachtsbus-diakonie-hamburg-nachrichtenpodcast,https://www.zeit.de/politik/2026-01/obdachlosigkeit-kaelte-mitternachtsbus-diakonie-hamburg-nachrichtenpodcast,0,www.zeit.de,Obdachlosigkeit bei Kälte: Wenn die Kälte lebensgefährlich wird,"In der Kälte von Sturmtief Elli bleibt zu Hause, wer kann. Doch was ist mit den Menschen, die kein Zuhause haben? Und: Mercosur-Freihandelsabkommen auf der Zielgeraden",https://img.zeit.de/politik/2017-09/illu-podcast-news/wide__8ed8a6__1300x731,2026-01-09T05:02:44Z,,"Das Sturmtief Elli fegt durch die Bundesrepublik, in einigen Regionen wurden in der Nacht zu Freitag Minusgrade im zweistelligen Bereich erwartet. In Hamburg, Bremen und Teilen Niedersachsens bleiben… [+1793 chars]",,de,'Kälte'
https://www.zeit.de/news/2026-01/09/hamburger-winterdienst-wir-kaempfen-dagegen-an,https://www.zeit.de/news/2026-01/09/hamburger-winterdienst-wir-kaempfen-dagegen-an,0,www.zeit.de,"Winter in Norddeutschland: Hamburger Winterdienst: ""Wir kämpfen dagegen an!""","Hier finden Sie Informationen zu dem Thema „Winter in Norddeutschland“. Lesen Sie jetzt „Hamburger Winterdienst: ""Wir kämpfen dagegen an!""“.",https://img.zeit.de/news/2026-01/09/hamburger-winterdienst-wir-kaempfen-dagegen-an-image-group/wide__1300x731,2026-01-09T05:12:51Z,,Der Kampf gegen die Schneemassen in Hamburg ist bereits gestartet - obwohl die erst gegen 7.00 Uhr erwartet werden. Die Hamburger Stadtreinigung ist seit 2.00 Uhr mit 728 Einsatzkräften in der Hanses… [+1995 chars],,de,'Winter'
https://www.zeit.de/news/2026-01/09/stromversorgung-im-suedwesten-berlins-weiter-stabil,https://www.zeit.de/news/2026-01/09/stromversorgung-im-suedwesten-berlins-weiter-stabil,0,www.zeit.de,Nach tagelangem Blackout: Stromversorgung im Südwesten Berlins weiter stabil,Hier finden Sie Informationen zu dem Thema „Nach tagelangem Blackout“. Lesen Sie jetzt „Stromversorgung im Südwesten Berlins weiter stabil“.,https://img.zeit.de/news/2026-01/09/stromversorgung-im-suedwesten-berlins-weiter-stabil-image-group/wide__1300x731,2026-01-09T07:28:42Z,,"Auch am zweiten Tag nach der Wiederherstellung der Stromversorgung im Berliner Südwesten gibt es nach Angaben von Stromnetz Berlin keine Probleme. «Die Technik funktioniert einwandfrei», sagte Sprech… [+785 chars]",,de,'Blackout'
https://www.bild.de/leben-wissen/so-nutzen-sie-den-winter-modus-ihrer-fenster-gegen-die-heizkostenfalle-69527d00f6fc544dba9b6868,https://www.bild.de/leben-wissen/so-nutzen-sie-den-winter-modus-ihrer-fenster-gegen-die-heizkostenfalle-69527d00f6fc544dba9b6868,0,www.bild.de,Heizkosten und Nerven sparen - So versetzen Sie Ihre Fenster in den Winter-Modus,"Viele wissen nicht, dass einige Fenster einen eingebauten Modus für eisige Winter-Temperaturen haben. Diesen einzustellen, ist eigentlich ganz einfach.","https://images.bild.de/69527d00f6fc544dba9b6868/5866c6b2603cadb8ef8a0765f89ac7cd,c52394e?w=1280",2026-01-09T09:15:50Z,,"TTS-Player überspringenArtikel weiterlesenDie Temperaturen draußen sind eisig, die Fenster geschlossen, und doch müssen Sie die Heizung auf voller Leistung laufen lassen, damit es einigermaßen warm i… [+1823 chars]",,de,'Heizkosten'
https://www.golem.de/sonstiges/zustimmung/auswahl.html?from=https://www.golem.de/news/blackout-internet-im-iran-ausgefallen-2601-204007.html&referer=https://t.co/e9b3df2f6f,https://www.golem.de/sonstiges/zustimmung/auswahl.html?from=https://www.golem.de/news/blackout-internet-im-iran-ausgefallen-2601-204007.html&referer=https://t.co/e9b3df2f6f,0,www.golem.de,Blackout: Internet im Iran ausgefallen,"Der Großteil von Irans Internet ist ausgefallen. Die Abschaltung fällt zeitlich mit landesweiten Protesten zusammen. (Zensur, Internet)",,2026-01-09T12:00:01Z,,"Besuchen Sie Golem.de wie gewohnt mit Werbung und Tracking,
 indem Sie der Nutzung aller Cookies zustimmen.
 Details zum Tracking finden Sie im Privacy Center.
Skript wurde nicht geladen. Informat… [+607 chars]",,de,'Blackout'
https://laut.de/News/Watch-Out!-26-Newcomerinnen-fuer-2026-09-01-2026-21536,https://laut.de/News/Watch-Out!-26-Newcomerinnen-fuer-2026-09-01-2026-21536,0,laut.de,Watch Out!: 26 Newcomer*innen für 2026,"Breakup-Pop à la Lana Del Rey, Cinema-Connaisseure, dazu Retro-Soul, NDW-Punk, Black Metal, Shoegaze und Rap: Wir sind bereit für 2026.",https://laut.de/News/Watch-Out!-26-Newcomerinnen-fuer-2026-09-01-2026-21536/watch-out-26-newcomerinnen-fuer-2026-248327.jpg,2026-01-09T12:09:35Z,,"Breakup-Pop à la Lana Del Rey, Cinema-Connaisseure, dazu Retro-Soul, NDW-Punk, Black Metal, Shoegaze und Rap: Wir sind bereit für 2026.
Konstanz (laut) - Der Nostalgie wurde genug Reichweite eingerä… [+1170 chars]",,de,'Black Out'
https://www.faz.net/aktuell/spiele/news-quiz/quiz-des-tages-testen-sie-ihr-wissen-heute-welches-sturmtief-bringt-schnee-und-glatteis-nach-deutschland-faz-200423546.html,https://www.faz.net/aktuell/spiele/news-quiz/quiz-des-tages-testen-sie-ihr-wissen-heute-welches-sturmtief-bringt-schnee-und-glatteis-nach-deutschland-faz-200423546.html,0,www.faz.net,News-Quiz vom 9. Januar: Welches Sturmtief bringt Schnee und Glatteis nach Deutschland?,Quiz des Tages ► Wie gut haben Sie die News von heute verfolgt? Beantworten Sie 5 Fragen & messen Sie sich mit anderen Lesern beim FAZ Wissenstest!,https://media0.faz.net/image/w1200h627/412abac9c8df/w1600h836x300y32o/202303/1.8722454/wer-behaelt-in-der-aktuellen.webp,2026-01-09T12:35:39Z,,"09.01.2026, 13:35Lesezeit: 1 Min.
Wie gut haben Sie die Nachrichten am heutigen Freitag verfolgt? Beantworten Sie fünf Fragen, und vergleichen Sie Ihr Wissen mit anderen Lesern!",,de,'Schnee'
https://www.zeit.de/news/2026-01/09/blackout-in-berlin-wegner-bleibt-in-der-kritik,https://www.zeit.de/news/2026-01/09/blackout-in-berlin-wegner-bleibt-in-der-kritik,0,www.zeit.de,Stromausfall: Blackout in Berlin - Wegner bleibt in der Kritik,Hier finden Sie Informationen zu dem Thema „Stromausfall“. Lesen Sie jetzt „Blackout in Berlin - Wegner bleibt in der Kritik“.,https://img.zeit.de/news/2026-01/09/blackout-in-berlin-wegner-bleibt-in-der-kritik-image-group/wide__1300x731,2026-01-09T12:58:10Z,,Auch am zweiten Tag nach dem Ende des längsten Stromausfalls in Berlin nach dem Zweiten Weltkrieg hat es nach Angaben von Stromnetz Berlin keine Probleme gegeben. «Die Technik funktioniert einwandfre… [+3379 chars],,de,'Blackout'
https://www.zeit.de/news/2026-01/09/philippi-ruft-zu-mehr-aufmerksamkeit-fuer-obdachlose-auf,https://www.zeit.de/news/2026-01/09/philippi-ruft-zu-mehr-aufmerksamkeit-fuer-obdachlose-auf,0,www.zeit.de,Winterwetter: Philippi ruft zu mehr Aufmerksamkeit für Obdachlose auf,Hier finden Sie Informationen zu dem Thema „Winterwetter“. Lesen Sie jetzt „Philippi ruft zu mehr Aufmerksamkeit für Obdachlose auf“.,https://img.zeit.de/news/2026-01/09/philippi-ruft-zu-mehr-aufmerksamkeit-fuer-obdachlose-auf-image-group/wide__1300x731,2026-01-09T13:41:43Z,,"Niedersachsens Sozialminister Andreas Philippi hat eine ökumenische Essensausgabe in Hannover besucht und dabei aufgerufen, Obdachlose nicht zu übersehen. «Die letzten Wintertage waren eine große Her… [+556 chars]",,de,'ältere Menschen'
https://www.zeit.de/news/2026-01/09/zwischenfazit-zu-sturmtief-elli-in-hamburg,https://www.zeit.de/news/2026-01/09/zwischenfazit-zu-sturmtief-elli-in-hamburg,0,www.zeit.de,"Schnee und Eis: Zwischenfazit zu Sturmtief ""Elli"" in Hamburg","Hier finden Sie Informationen zu dem Thema „Schnee und Eis“. Lesen Sie jetzt „Zwischenfazit zu Sturmtief ""Elli"" in Hamburg“.",https://img.zeit.de/news/2026-01/09/zwischenfazit-zu-sturmtief-elli-in-hamburg-image-group/wide__1300x731,2026-01-09T13:53:56Z,,Trotz Sturmtiefs «Elli» verzeichnet die Polizei Hamburg keine auffällige Verkehrslage in der Stadt. Neben Verkehrsbehinderungen durch zwei festgefahrene Lastwagen auf der A7 gab es wenige Glätte-Unfä… [+372 chars],,de,'Schnee'
https://www.zeit.de/news/2026-01/09/notquartier-fuer-wohnungslose-in-halle-oeffnet,https://www.zeit.de/news/2026-01/09/notquartier-fuer-wohnungslose-in-halle-oeffnet,0,www.zeit.de,Hilfe bei Kälte: Notquartier für Wohnungslose in Halle öffnet,Hier finden Sie Informationen zu dem Thema „Hilfe bei Kälte“. Lesen Sie jetzt „Notquartier für Wohnungslose in Halle öffnet“.,https://img.zeit.de/news/2026-01/09/notquartier-fuer-wohnungslose-in-halle-oeffnet-image-group/wide__1300x731,2026-01-09T14:01:54Z,,"Wohnungslose Menschen in Halle finden in den kommenden Tagen rund um die Uhr Schutz vor den eisigen Temperaturen. Im «Haus der Wohnhilfe» sei am Samstag, Sonntag und Montag ein Notquartier geöffnet, … [+383 chars]",,de,'Kälte'
https://www.zeit.de/news/2026-01/09/notaufnahmen-fuer-glatteis-und-schneeunfaelle-geruestet,https://www.zeit.de/news/2026-01/09/notaufnahmen-fuer-glatteis-und-schneeunfaelle-geruestet,0,www.zeit.de,Krankenhäuser: Notaufnahmen für Glatteis- und Schneeunfälle gerüstet,Hier finden Sie Informationen zu dem Thema „Krankenhäuser“. Lesen Sie jetzt „Notaufnahmen für Glatteis- und Schneeunfälle gerüstet“.,https://img.zeit.de/news/2026-01/09/notaufnahmen-fuer-glatteis-und-schneeunfaelle-geruestet-image-group/wide__1300x731,2026-01-09T14:47:11Z,,"Die Notaufnahmen in Niedersachsen und Bremen sehen sich gut gewappnet für mögliche Glätteunfälle. In der Medizinischen Hochschule Hannover (MHH) seien genug Ärzte und Pflegekräfte vor Ort, um auf ein… [+1375 chars]",,de,'Glatteis'
https://www.zeit.de/news/2026-01/09/winter-wetter-bremst-handballer-aus,https://www.zeit.de/news/2026-01/09/winter-wetter-bremst-handballer-aus,0,www.zeit.de,EM-Vorbereitung: Winter-Wetter bremst Handballer aus,Hier finden Sie Informationen zu dem Thema „EM-Vorbereitung“. Lesen Sie jetzt „Winter-Wetter bremst Handballer aus“.,https://img.zeit.de/news/2026-01/09/winter-wetter-bremst-handballer-aus-image-group/wide__1300x731,2026-01-09T14:48:16Z,,"Deutschlands Handballer sind auf der Rückreise vom EM-Test in Kroatien durch das Winter-Wetter vorerst ausgebremst worden. Weil sich der Abflug aus Zagreb um mehr als eine Stunde verzögert, werde der… [+1232 chars]",,de,'Winter'
https://www.zeit.de/news/2026-01/09/snacks-und-decken-ins-auto-tipps-fuer-winter-fahrten,https://www.zeit.de/news/2026-01/09/snacks-und-decken-ins-auto-tipps-fuer-winter-fahrten,0,www.zeit.de,Autofahrt im Winter: Snacks und Decken ins Auto: Tipps für Winter-Fahrten,Hier finden Sie Informationen zu dem Thema „Autofahrt im Winter“. Lesen Sie jetzt „Snacks und Decken ins Auto: Tipps für Winter-Fahrten“.,https://img.zeit.de/news/2026-01/09/snacks-und-decken-ins-auto-tipps-fuer-winter-fahrten-image-group/wide__1300x731,2026-01-09T15:06:16Z,,"Autofahrer sollten im Winter vorsichtshalber stets Decken, Nahrungsmittel und Getränke im Wagen haben. «Bei längeren Urlaubsfahrten lohnt es sich, eine Thermoskanne mit heißem Tee einzupacken», teilt… [+1181 chars]",,de,'Winter'
https://www.zeit.de/news/2026-01/09/gas-austritt-an-heidelberger-schule,https://www.zeit.de/news/2026-01/09/gas-austritt-an-heidelberger-schule,0,www.zeit.de,Schüler in Sicherheit: Gas-Austritt an Heidelberger Schule,Hier finden Sie Informationen zu dem Thema „Schüler in Sicherheit“. Lesen Sie jetzt „Gas-Austritt an Heidelberger Schule“.,https://img.zeit.de/news/2026-01/09/gas-austritt-an-heidelberger-schule-image-group/wide__1300x731,2026-01-09T15:57:01Z,,"In Heidelberg ist es wegen eines Gasaustritts an einer Schule zu einem größeren Einsatz der Feuerwehr gekommen. Verletzte gebe es keine, sagte ein Polizeisprecher. Die Schüler der betroffenen HPC Int… [+293 chars]",,de,'Gas'
https://www.zeit.de/news/2026-01/09/wintersturm-elli-feuerwehr-pinneberg-zieht-ruhige-bilanz,https://www.zeit.de/news/2026-01/09/wintersturm-elli-feuerwehr-pinneberg-zieht-ruhige-bilanz,0,www.zeit.de,"Schnee in Hamburg: Wintersturm ""Elli"" – Feuerwehr Pinneberg zieht ruhige Bilanz","Hier finden Sie Informationen zu dem Thema „Schnee in Hamburg“. Lesen Sie jetzt „Wintersturm ""Elli"" – Feuerwehr Pinneberg zieht ruhige Bilanz“.",https://img.zeit.de/news/2026-01/09/wintersturm-elli-feuerwehr-pinneberg-zieht-ruhige-bilanz-image-group/wide__1300x731,2026-01-09T16:22:53Z,,Nach dem Abflauen des Wintersturms «Elli» ziehen die Feuerwehren im Kreis Pinneberg eine entspannte erste Bilanz. Der Deutsche Wetterdienst hob am Freitagnachmittag die Unwetterwarnung vor Schneeverw… [+675 chars],,de,'Schnee'
https://www.bild.de/news/ausland/aufregung-bei-urlaubern-bali-touristen-sollen-kontostand-offenlegen-69610c350e8ad021f5546ee0,https://www.bild.de/news/ausland/aufregung-bei-urlaubern-bali-touristen-sollen-kontostand-offenlegen-69610c350e8ad021f5546ee0,0,www.bild.de,Traumstrand nur mit Kohle - Bali-Touristen sollen Kontostand offenlegen,"Bali plant, verstärkt zahlungskräftige Urlauber zu empfangen, um Umwelt und Kultur zu schützen. Im Visier: die Kontostände der Touristen.","https://images.bild.de/69610c350e8ad021f5546ee0/88c9ad187e3b5c5cb6dd21b5ec3cc584,c53b154e?w=1280",2026-01-09T17:24:51Z,,"Bali Dürfen bald nur noch Reiche zum Traumstrand auf die Insel?
Der Tourismus-Hotspot Bali (Indonesien) will Urlauber künftig nur noch auf die beliebte Ferieninsel lassen, wenn sie zuvor ihren Konto… [+1531 chars]",,de,'Kohle'
https://www.zeit.de/news/2026-01/09/sturmtief-bringt-schnee-unfaelle-und-unterrichtsausfaelle,https://www.zeit.de/news/2026-01/09/sturmtief-bringt-schnee-unfaelle-und-unterrichtsausfaelle,0,www.zeit.de,"Winterwetter: Sturmtief bringt Schnee, Unfälle und Unterrichtsausfall","Hier finden Sie Informationen zu dem Thema „Winterwetter“. Lesen Sie jetzt „Sturmtief bringt Schnee, Unfälle und Unterrichtsausfall“.",https://img.zeit.de/news/2026-01/09/sturmtief-bringt-schnee-unfaelle-und-unterrichtsausfaelle-image-group/wide__1300x731,2026-01-09T18:51:15Z,,Sturmtief «Elli» hat in Thüringen mit viel Schnee und Eisglätte für Verkehrsbehinderungen und leere Klassenzimmer gesorgt. Busse und Bahnen waren teils nur eingeschränkt unterwegs und auf den Straßen… [+3386 chars],,de,'Winter'
https://www.zeit.de/news/2026-01/09/meteorologe-der-meiste-schnee-im-norden-ist-durch,https://www.zeit.de/news/2026-01/09/meteorologe-der-meiste-schnee-im-norden-ist-durch,0,www.zeit.de,Winterwetter: Meteorologe: Der meiste Schnee im Norden ist durch,Hier finden Sie Informationen zu dem Thema „Winterwetter“. Lesen Sie jetzt „Meteorologe: Der meiste Schnee im Norden ist durch“.,https://img.zeit.de/news/2026-01/09/meteorologe-der-meiste-schnee-im-norden-ist-durch-image-group/wide__1300x731,2026-01-09T19:51:57Z,,"Der Deutsche Wetterdienst (DWD) rechnet für Norddeutschland nicht mehr mit großem Schneefall. In Schleswig-Holstein, Hamburg und Mecklenburg-Vorpommern könne es zwar im Laufe des Samstags noch einzel… [+664 chars]",,de,'Schnee'
https://www.zeit.de/news/2026-01/10/das-kostet-skifahren-und-rodeln-in-diesem-winter-im-harz,https://www.zeit.de/news/2026-01/10/das-kostet-skifahren-und-rodeln-in-diesem-winter-im-harz,0,www.zeit.de,Schneevergnügen: Das kostet Skifahren und Rodeln in diesem Winter im Harz,Hier finden Sie Informationen zu dem Thema „Schneevergnügen“. Lesen Sie jetzt „Das kostet Skifahren und Rodeln in diesem Winter im Harz“.,https://img.zeit.de/news/2026-01/10/das-kostet-skifahren-und-rodeln-in-diesem-winter-im-harz-image-group/wide__1300x731,2026-01-10T05:00:06Z,,"Nachdem einige Skigebiete im Harz am Freitag wegen Wind und Wetter geschlossen hatten, wollen die meisten am Wochenende öffnen. Was ist wo möglich - wie viel es kostet es?
Einen der günstigsten Skip… [+2828 chars]",,de,'Winter'
https://www.tagesschau.de/inland/gesellschaft/wintersturm-elli-bahn-102.html,https://www.tagesschau.de/inland/gesellschaft/wintersturm-elli-bahn-102.html,0,www.tagesschau.de,"Wintersturm ""Elli"": Fernverkehr soll wieder rollen - Schnee im Süden",Die Schneelage im Norden Deutschlands entspannt sich langsam: Ab dem Morgen sollen erste Fernverkehrszüge wieder rollen. Nach dem Norden ist allerdings der Süden dran - der Schnee wird nun hier erwartet.,https://images.tagesschau.de/image/46d7e2b0-b66a-4828-8721-3c6dfe6c60af/AAABm6ZYo1Y/AAABmyZE0EA/16x9-big/ice-schnee-104.jpg?width=1280,2026-01-10T05:42:11Z,,"Stand: 10.01.2026 06:42 Uhr
Die Schneelage im Norden Deutschlands entspannt sich langsam: Ab dem Morgen sollen erste Fernverkehrszüge wieder rollen. Nach dem Norden ist allerdings der Süden dran - d… [+3677 chars]",,de,'Schnee'
https://www.faz.net/aktuell/rhein-main/wirtschaft/was-der-geplante-industriestrompreis-bringt-accg-200412892.html,https://www.faz.net/aktuell/rhein-main/wirtschaft/was-der-geplante-industriestrompreis-bringt-accg-200412892.html,0,www.faz.net,Energiekosten: Was der Industriestrompreis bringt,Einen Strompreis von fünf Cent hat die Bundesregierung energieintensiven Unternehmen in Aussicht gestellt. Doch die Rechnung geht nicht auf.,https://media0.faz.net/image/w1200h627/580d9f4be1bd/w5426h2835x0y108o/202501/43601.0.776977312/energieintensiv-die.webp,2026-01-10T09:11:35Z,,Schon fast ein Schildbürgerstreich: Mit diesen Worten kommentiert Hans Bohnen den von der Bundesregierung geplanten Industriestrompreis. Bohnen ist Geschäftsführer des Darmstädter Chemieunternehmens … [+8148 chars],,de,'Energiekosten'
https://www.zeit.de/gesundheit/2026-01/effekte-kaelte-vorerkrankung-herz-schutz-sterblichkeit,https://www.zeit.de/gesundheit/2026-01/effekte-kaelte-vorerkrankung-herz-schutz-sterblichkeit,0,www.zeit.de,Effekte von Kälte: Draußen Minusgrade und plötzlich wird die Brust eng,Kardiologen wissen: An kalten Tagen steigt das Risiko für Herzinfarkte. Was das autonome Nervensystem damit zu tun hat – und wer jetzt besonders aufpassen sollte.,https://img.zeit.de/gesundheit/2026-01/effekte-kaelte-vorerkrankung-herz-schutz-sterblichkeit-bild/wide__1300x731,2026-01-10T09:22:45Z,,"Schließen
Artikelzusammenfassung
Kardiologen und Notfallmediziner beobachten, dass Kälte das Herz-Kreislauf-System belastet und zu Gesundheitsproblemen führen kann. Studien zeigen, dass die meisten… [+639 chars]",,de,'Kälte'
https://www.zeit.de/news/2026-01/10/56-einsaetze-in-wilhelmshaven-und-friesland-wegen-schnee,https://www.zeit.de/news/2026-01/10/56-einsaetze-in-wilhelmshaven-und-friesland-wegen-schnee,0,www.zeit.de,Schneesturm: 56 Einsätze in Wilhelmshaven und Friesland wegen Schnee,Hier finden Sie Informationen zu dem Thema „Schneesturm“. Lesen Sie jetzt „56 Einsätze in Wilhelmshaven und Friesland wegen Schnee“.,https://img.zeit.de/news/2026-01/10/56-einsaetze-in-wilhelmshaven-und-friesland-wegen-schnee-image-group/wide__1300x731,2026-01-10T10:22:04Z,,"Schneeverwehungen haben in Wilhelmshaven und im Landkreis Friesland für 56 Einsätze gesorgt. Zahlreiche Straßen waren zeitweise blockiert, da Autos und Lastwagen feststeckten oder quer auf der Fahrba… [+591 chars]",,de,'Schnee'
https://www.golem.de/sonstiges/zustimmung/auswahl.html?from=https://www.golem.de/news/beamtenbund-warnt-blackouts-jederzeit-an-anderen-orten-moeglich-2601-204033.html&referer=https://t.co/a47edd8683,https://www.golem.de/sonstiges/zustimmung/auswahl.html?from=https://www.golem.de/news/beamtenbund-warnt-blackouts-jederzeit-an-anderen-orten-moeglich-2601-204033.html&referer=https://t.co/a47edd8683,0,www.golem.de,"Beamtenbund warnt: Blackouts ""jederzeit an anderen Orten"" möglich","Ein Blackout wie in Berlin kann jederzeit wieder passieren - auch in anderen Städten. Beamtenbund und Polizei warnen vor Sicherheitslücken. (Blackout, Berlin)",,2026-01-10T10:45:02Z,,"Besuchen Sie Golem.de wie gewohnt mit Werbung und Tracking,
 indem Sie der Nutzung aller Cookies zustimmen.
 Details zum Tracking finden Sie im Privacy Center.
Skript wurde nicht geladen. Informat… [+607 chars]",,de,'Blackout'
