index,url,valid,domain,title,description,image,published,archive,content,quote,language,keyword
https://www.tagesspiegel.de/internationales/erderwarmung-un-chef-warnt-todliche-fahrlassigkeit-beim-klimaschutz-14769398.html,https://www.tagesspiegel.de/internationales/erderwarmung-un-chef-warnt-todliche-fahrlassigkeit-beim-klimaschutz-14769398.html,0,www.tagesspiegel.de,Erderwärmung: UN-Chef warnt: „Tödliche Fahrlässigkeit“ beim Klimaschutz,"Milliarden Steuergelder stützen Kohle, Öl und Gas, obwohl es günstige und klimafreundliche Alternativen gibt. Der UN-Chef prangert „moralisches Versagen“ an – und mahnt zu radikalen Schritten.",https://www.tagesspiegel.de/images/14775626/alternates/BASE_16_9_W1400/1762440981000/weltklimakonferenz-cop30.jpeg,2025-11-06T03:32:39Z,,"Zehn Jahre nach dem als historisch gefeierten Pariser Klimaabkommen ist die Staatengemeinschaft aus Sicht von UN-Generalsekretär António Guterres daran gescheitert, die Erderwärmung unter dem wichtig… [+2506 chars]",,de,'Kohle'
https://www.stern.de/gesellschaft/regional/bayern/knochenbrueche--mann-bei-werkstattunfall-von-auto-eingeklemmt-und-verletzt-36193908.html,https://www.stern.de/gesellschaft/regional/bayern/knochenbrueche--mann-bei-werkstattunfall-von-auto-eingeklemmt-und-verletzt-36193908.html,0,www.stern.de,Knochenbrüche: Mann bei Werkstattunfall von Auto eingeklemmt und verletzt,Ein Routinevorgang endet in einem schweren Unfall: In einer Rosenheimer Autowerkstatt gibt ein 19-Jähriger plötzlich Gas und fährt in Richtung seines Kollegen. Wie konnte es dazu kommen?,https://image.stern.de/36193910/t/89/v1/w1440/r1.7778/-/06--cshgik22rgv6axs2048jpeg---94f5646c38e1be18.jpg,2025-11-06T06:53:08Z,,"Kopiere den aktuellen Link
Zur Merkliste hinzufügen
Ein Routinevorgang endet in einem schweren Unfall: In einer Rosenheimer Autowerkstatt gibt ein 19-Jähriger plötzlich Gas und fährt in Richtung se… [+840 chars]",,de,'Gas'
https://www.zeit.de/politik/ausland/2025-11/us-einwanderungsbehoerde-ice-kindergarten-einsatz-kritik,https://www.zeit.de/politik/ausland/2025-11/us-einwanderungsbehoerde-ice-kindergarten-einsatz-kritik,0,www.zeit.de,US-Einwanderungsbehörde: Kritik am ICE-Einsatz im Kindergarten in Chicago,Beamte der US-Einwanderungsbehörde ICE haben in Chicago eine kolumbianische Kindergärtnerin vor den Augen der Kinder festgenommen. Der Einsatz stößt auf deutliche Kritik.,https://img.zeit.de/administratives/sharing/fallback-image-die-zeit/wide__1300x731,2025-11-06T07:45:49Z,,Die Festnahme einer kolumbianischen Kindergärtnerin an ihrem Arbeitsplatz durch Beamte der US-Einwanderungsbehörde (ICE) in Chicago hat in den USA für Kritik gesorgt. In einem Video des Vorfalls ist … [+3033 chars],,de,'Kinder'
https://www.telepolis.de/article/Wer-kontrolliert-kuenftig-das-Gas-im-Mittelmeer-Tuerkei-oder-Griechenland-10975368.html,https://www.telepolis.de/article/Wer-kontrolliert-kuenftig-das-Gas-im-Mittelmeer-Tuerkei-oder-Griechenland-10975368.html,0,www.telepolis.de,Wer kontrolliert künftig das Gas im Mittelmeer – Türkei oder Griechenland?,Libyens Parlament verweigert die Ratifizierung des türkischen Abkommens. Athen nutzt die Chance und baut seinen Einfluss aus.,https://heise.cloudimg.io/bound/1200x1200/q85.png-lossy-85.webp-lossy-85.foil1/_www-heise-de_/imgs/18/4/9/6/8/5/6/2/Zwischenablage-1-0daf3ae765891c17.jpeg,2025-11-06T09:00:00Z,,"Türkisches Tiefbohrschiff. Foto: aydngvn, shutterstock
Libyens Parlament verweigert die Ratifizierung des türkischen Abkommens. Athen nutzt die Chance und baut seinen Einfluss aus.
Das türkisch-lib… [+5589 chars]",,de,'Gas'
https://wien.orf.at/stories/3328846/,https://wien.orf.at/stories/3328846/,0,wien.orf.at,Mit Windkraft raus aus Gas,Künftig sollen alle Wiener Haushalte mit Ökostrom versorgt werden. Möglich machen soll das der Kauf von ImWind durch Wien Energie. Das hat die Stadt heute bekanntgegeben. Mit dem Kauf von ImWind soll Wien der Ausstieg aus der Gas-Abhängigkeit gelingen.,https://ibs.orf.at/wie?image=https%3A%2F%2Foekastatic.orf.at%2Fmims%2F2025%2F02%2F63%2Fcrops%2Fw%3D1200%2Ch%3D627%2Cq%3D75%2F2476511_master_947763_windpark.jpg%3Fs%3D63cf64abd08ac2c55773167fd2b530aee95db2be,2025-11-06T11:00:00Z,,"Nachdem die zuständige Wettbewerbsbehörde zugestimmt hatte, erwarb Wien Energie nun alle Anteile des heimischen Wind- und Solarkraftpioniers ImWind. Damit erweiterte Wien das Ökostrom-Portfolio des s… [+1440 chars]",,de,'Gas'
https://www.stern.de/digital/technik/balkonkraftwerk-im-winter--was-bringt-das-wirklich---35313936.html,https://www.stern.de/digital/technik/balkonkraftwerk-im-winter--was-bringt-das-wirklich---35313936.html,0,www.stern.de,Solarstrom trotz wenig Sonne: Das Balkonkraftwerk im Winter betreiben: Was bringt das wirklich?,Ist ein Balkonkraftwerk im Winter sinnvoll? In der dunklen Jahreszeit klingt das zunächst paradox – doch die Energieausbeute kann überraschend hoch ausfallen.,https://image.stern.de/35313938/t/Yo/v1/w1440/r1.7778/-/balkonkraftwerk-im-winter.jpg,2025-11-06T15:05:00Z,,"Kopiere den aktuellen Link
Zur Merkliste hinzufügen
Ist ein Balkonkraftwerk im Winter sinnvoll? In der dunklen Jahreszeit klingt das zunächst paradox doch die Energieausbeute kann überraschend hoch… [+6566 chars]",,de,'Winter'
https://www.zeit.de/news/2025-11/06/bundestag-beschliesst-entlastung-von-gaskunden,https://www.zeit.de/news/2025-11/06/bundestag-beschliesst-entlastung-von-gaskunden,0,www.zeit.de,Energiepreise: Bundestag beschließt Entlastung von Gaskunden,Hier finden Sie Informationen zu dem Thema „Energiepreise“. Lesen Sie jetzt „Bundestag beschließt Entlastung von Gaskunden“.,https://img.zeit.de/news/2025-11/06/bundestag-beschliesst-entlastung-von-gaskunden-image-group/wide__1300x731,2025-11-06T15:32:23Z,,Der Bundestag hat die Gaskunden in Deutschland von der Gasspeicherumlage befreit. Mit der vom Parlament beschlossenen Gesetzesänderung übernimmt ab dem kommenden Jahr der Bund die Kosten von derzeit … [+1563 chars],,de,'Gas'
https://www.bild.de/leben-wissen/wohnen-living/gaskosten-sparen-mit-diesen-tipps-heizen-sie-richtig-guenstig-690c82e2b035f3184cc83e90,https://www.bild.de/leben-wissen/wohnen-living/gaskosten-sparen-mit-diesen-tipps-heizen-sie-richtig-guenstig-690c82e2b035f3184cc83e90,0,www.bild.de,Richtig heizen & Gas sparen - Wie heize ich am sparsamsten mit Gas?,"Die steigenden Gaspreise machen sich in vielen Haushalten deutlich bemerkbar. Hier sind einige hilfreiche Tipps, um Heizkosten zu senken und Gas zu sparen.","https://images.bild.de/690c82e2b035f3184cc83e90/16d7ccb81a7ec6ad50fbd084d040f38c,5d32d482?w=1280",2025-11-06T16:18:50Z,,"Die steigenden Gaspreise machen sich in vielen Haushalten deutlich bemerkbar. Grund genug, den eigenen Verbrauch einmal genauer unter die Lupe zu nehmen. 
Dabei braucht es keine aufwendige Modernisi… [+3652 chars]",,de,'Heizkosten'
https://www.tagesschau.de/inland/innenpolitik/bundestag-energiepreise-100.html,https://www.tagesschau.de/inland/innenpolitik/bundestag-energiepreise-100.html,0,www.tagesschau.de,Bundestag beschließt Ende der Gasspeicherumlage,"Seit Deutschland kein billiges Gas mehr aus Russland kauft, sind die Preise dramatisch gestiegen. Der Bundestag hat nun eine Gesetzesänderung beschlossen, wodurch die Kosten auch für die Verbraucher und Unternehmen sinken sollen.",https://images.tagesschau.de/image/e06da574-fc4b-4a87-aca5-bf27670efb91/AAABleBZ9CI/AAABmgWmh8Q/16x9-big/klimageld-energiepreise-emissionshandel-100.jpg?width=1280,2025-11-06T17:24:36Z,,"Stand: 06.11.2025 18:24 Uhr
Seit Deutschland kein billiges Gas mehr aus Russland kauft, sind die Preise dramatisch gestiegen. Der Bundestag hat nun eine Gesetzesänderung beschlossen, wodurch die Kos… [+2188 chars]",,de,'Gas'
https://t3n.de/news/co2-im-meeresboden-norwegen-ccs-1713903/,https://t3n.de/news/co2-im-meeresboden-norwegen-ccs-1713903/,0,t3n.de,Für weniger CO2-Emissionen: Norwegen wendet sich umstrittener Technologie zu,Norwegen glänzt gern als Vorbild bei Elektroautos und Wasserkraft. Doch nach dem Verkauf von Öl und Gas setzt es jetzt auch auf das umstrittene CCS.weiterlesen auf t3n.de,https://cdn.t3n.de/news/wp-content/uploads/2021/05/norwegen.jpg?class=content,2025-11-06T17:30:00Z,,"Tief unter der Nordsee soll die europäische Fossilindustrie ihre Sünden begraben. Dafür macht Norwegen den Europäer:innen ein Angebot: Mit Carbon Capture and Storage (CCS) fossiles CO loswerden.
Den… [+6938 chars]",,de,'Gas'
https://www.faz.net/aktuell/wirtschaft/co2-speicherung-erlaubnis-fuer-ccs-ist-ist-kein-geschaeftsmodell-110767600.html,https://www.faz.net/aktuell/wirtschaft/co2-speicherung-erlaubnis-fuer-ccs-ist-ist-kein-geschaeftsmodell-110767600.html,0,www.faz.net,CCS-Gesetz: Endlich ist der Weg für den Kohlendioxid-Export frei,"Kohlendioxid einzufangen, unterirdisch zu speichern oder ins Ausland zu exportieren, ist künftig legal. Damit das überarbeitete CCS-Gesetz wirkt, sind allerdings noch einige Hürden zu überwinden.",https://media0.faz.net/ppmedia/w1200/aktuell/gesellschaft/502178977/1.10767678/facebook_teaser/funktioniert-schon-co2.jpg.webp,2025-11-06T18:37:57Z,,"Gute Politik ist dazu in der Lage, sich selbst zu korrigieren, wenn sich Instrumente als unwirksam erweisen. Insofern handelt es sich um einen Akt der Vernunft, dass die unterirdische Speicherung und… [+4364 chars]",,de,'Kohle'
https://www.zeit.de/wirtschaft/2025-11/co2-speicherung-unterirdisch-gesetz-deutschland-bundestag-verabschiedet,https://www.zeit.de/wirtschaft/2025-11/co2-speicherung-unterirdisch-gesetz-deutschland-bundestag-verabschiedet,0,www.zeit.de,Carbon Capture and Storage: Bundestag macht Weg für unterirdische CO₂-Speicherung frei,Kohlendioxid-Emissionen sollen in Deutschland künftig unter dem Meeresboden verpresst werden dürfen. Der Bundestag hat die dafür notwendige Gesetzesänderung beschlossen.,https://img.zeit.de/wirtschaft/2025-11/bundestag-co2-speicherung-bild/wide__1300x731,2025-11-06T18:47:47Z,,"Der Bundestag hat den Weg für die unterirdische Speicherung von Kohlendioxid (CO) in Deutschland freigemacht. Das mit der Mehrheit von CDU, CSU und SPD beschlossene Gesetz soll unter anderem den Aufb… [+2056 chars]",,de,'Kohle'
https://www.tagesschau.de/inland/umwelt-co2-speicherung-bundestag-100.html,https://www.tagesschau.de/inland/umwelt-co2-speicherung-bundestag-100.html,0,www.tagesschau.de,Bundestag macht Weg für unterirdische CO2-Speicherung frei,In manchen Industriezweigen gilt der Ausstoß von Kohlendioxid als schwer vermeidbar. Künftig soll das klimaschädliche Gas deshalb unterirdisch gespeichert werden dürfen. Klimaschützer kritisieren die Entscheidung.,https://images.tagesschau.de/image/763eb18d-af8a-4719-b105-277091dd71ca/AAABmlp_Gsw/AAABmgWmh8Q/16x9-big/co2-speicherung-102.jpg?width=1280,2025-11-06T18:50:23Z,,"Stand: 06.11.2025 19:50 Uhr
In manchen Industriezweigen gilt der Ausstoß von Kohlendioxid als schwer vermeidbar. Künftig soll das klimaschädliche Gas deshalb unterirdisch gespeichert werden dürfen. … [+2612 chars]",,de,'Gas'
https://www.stern.de/gesellschaft/regional/sachsen/energieversorgung--fuer-wen-wird-strom-und-gas-in-ostdeutschland-guenstiger--36197664.html,https://www.stern.de/gesellschaft/regional/sachsen/energieversorgung--fuer-wen-wird-strom-und-gas-in-ostdeutschland-guenstiger--36197664.html,0,www.stern.de,Energieversorgung: Für wen wird Strom und Gas in Ostdeutschland günstiger?,"Mehrere ostdeutsche Energieversorger senken ab 2026 ihre Preise, andere wollen noch folgen. Wer kann sich über geringere Kosten freuen? Und wie viel können Kundinnen und Kunden sparen? Ein Überblick.",https://image.stern.de/36197666/t/-i/v1/w1440/r1.7778/-/07--sqo4liqjbiv6axs2048jpeg---a8bf7830e14f6764.jpg,2025-11-07T04:00:20Z,,"Kopiere den aktuellen Link
Zur Merkliste hinzufügen
Mehrere ostdeutsche Energieversorger senken ab 2026 ihre Preise, andere wollen noch folgen. Wer kann sich über geringere Kosten freuen? Und wie v… [+3796 chars]",,de,'Heizkosten'
https://www.zeit.de/news/2025-11/07/vorhang-auf-und-staunen-weihnachtsmaerchen-in-mv,https://www.zeit.de/news/2025-11/07/vorhang-auf-und-staunen-weihnachtsmaerchen-in-mv,0,www.zeit.de,Theater für Kinder: Vorhang auf und staunen: Weihnachtsmärchen in MV,Hier finden Sie Informationen zu dem Thema „Theater für Kinder“. Lesen Sie jetzt „Vorhang auf und staunen: Weihnachtsmärchen in MV“.,https://img.zeit.de/news/2025-11/07/vorhang-auf-und-staunen-weihnachtsmaerchen-in-mv-image-group/wide__1300x731,2025-11-07T06:00:17Z,,"Drei Wochen vor der Adventszeit beginnt in den ersten Theatern im Land schon die Zeit der Weihnachtsmärchen. Als erstes startet dieses Jahr das Rostocker Volkstheater, wo sich am Samstag (11.00 Uhr) … [+2942 chars]",,de,'Kinder'
https://www.bild.de/leben-wissen/wohnen-living/so-entlueften-sie-ihre-heizung-richtig-690b076a0580923d09987ba5,https://www.bild.de/leben-wissen/wohnen-living/so-entlueften-sie-ihre-heizung-richtig-690b076a0580923d09987ba5,0,www.bild.de,Richtig heizen - So entlüften Sie ihre Heizung richtig,Luft im Heizsystem? Entlüften Sie selbst und sparen Sie Heizkosten mit einfachen Schritten und einem Entlüftungsschlüssel.,"https://images.bild.de/690b076a0580923d09987ba5/89f80b27234786e58cec098f2bb105d8,a6d86b6d?w=1280",2025-11-07T07:14:29Z,,"Kaum sinken die Temperaturen, drehen Millionen Deutsche ihre Heizkörper auf doch oft bleibt es trotzdem kalt in der Bude. Der Grund: Luft in der Leitung! Wer jetzt nicht entlüftet, heizt ins Leere.
… [+2347 chars]",,de,'Heizkosten'
https://www.bild.de/news/wetter/wetterexperte-temperaturen-fallen-am-wochenende-um-bis-zu-15-grad-6902163e8ef09a6aa251cc59,https://www.bild.de/news/wetter/wetterexperte-temperaturen-fallen-am-wochenende-um-bis-zu-15-grad-6902163e8ef09a6aa251cc59,0,www.bild.de,Regen und Kälte am Wochenende - Och Nööö-vember!,"Winterjacke statt Übergangsmantel, Schal statt Sonnenbrille – Deutschland droht der Kälteschock! Davor warnt ein Meteorologe.","https://images.bild.de/6902163e8ef09a6aa251cc59/f3bf0c09809b1f81951297f74d868e3c,6b0527fe?w=1280",2025-11-07T09:56:14Z,,Schal und Winterjacke rausholen Deutschland droht der Kälteschock! Die Temperaturen sollen am Wochenende um bis zu 15 Grad abrauschen. Ein abruptes Ende des herbstlichen Wohlfühlwetters der vergangen… [+2172 chars],,de,'Schnee'
https://orf.at/stories/3410793/,https://orf.at/stories/3410793/,0,orf.at,Handysucht erfasst ältere Generation,"Smartphonesucht ist längst nicht mehr nur ein Thema bei Kindern und Jugendlichen. Auch Menschen im Pensionsalter hängen zunehmend am Touchscreen. In Studien ist das Phänomen noch nicht erfasst, Beratungsstellen verzeichneten allerdings seit einigen Jahren ver…",https://ibs.orf.at/news?image=https%3A%2F%2Fassets.orf.at%2Fmims%2F2025%2F45%2F91%2Fcrops%2Fw%3D1200%2Ch%3D630%2Cq%3D75%2F2825596_master_1090691_handysucht_senioren_gy.jpg%3Fs%3Dba8067c215c35e1ba2192418899b206f6a685a1e,2025-11-07T09:57:55Z,,"Auch wenn die Generation 60 plus nicht zu den Digital Natives zählt, also zu jenen Menschen, die mit Handy und Internet aufgewachsen sind, sind viele bereits seit Jahren als Nutzerinnen und Nutzer da… [+3541 chars]",,de,'ältere Menschen'
https://www.tagesspiegel.de/wissen/wie-ein-tourengeher-in-den-alpen-um-sein-leben-kampfte-14757626.html,https://www.tagesspiegel.de/wissen/wie-ein-tourengeher-in-den-alpen-um-sein-leben-kampfte-14757626.html,0,www.tagesspiegel.de,Gefangen im Schneesturm: Wie ein Tourengeher in den Alpen plötzlich um sein Leben kämpfte,"Tommaso Piccioli sagt, er habe die Hölle kennengelernt – im Schneesturm, als seine Gruppe sich verirrte. Sieben Menschen starben. Er überlebte. Was hat ihn gerettet?",https://www.tagesspiegel.de/images/14780639/alternates/BASE_16_9_W1400/1762514225000/adobestock-242977356.jpeg,2025-11-07T10:28:28Z,,"Am Vorabend der Katastrophe isst Tommaso Piccioli, so wird er sich später erinnern, in der gut beheizten Berghütte noch drei Teller Suppe. Als einige Mitglieder der Skigruppe seinen Hunger bemerken, … [+13215 chars]",,de,'Schnee'
https://www.stern.de/panorama/bekommen-wir-winterwetter--unsere-live-karten-zeigen-es-36202774.html,https://www.stern.de/panorama/bekommen-wir-winterwetter--unsere-live-karten-zeigen-es-36202774.html,0,www.stern.de,Vorhersagen: Bekommen wir demnächst Winterwetter? Unsere Live-Karten zeigen es,"Bekommen wir Winterwetter? Zumindest sind die Temperaturen teils bereits einstellig. Wie die Vorhersagen für Ihre Regionen sind, sehen Sie auf unseren Live-Karten.",https://image.stern.de/36202740/t/sk/v1/w1440/r1.7778/-/wann-kommt-winterwetter-wintereinbruch.jpg,2025-11-07T11:00:00Z,,"Kopiere den aktuellen Link
Zur Merkliste hinzufügen
Bekommen wir Winterwetter? Zumindest sind die Temperaturen teils bereits einstellig. Wie die Vorhersagen für Ihre Regionen sind, sehen Sie auf un… [+1730 chars]",,de,'Winter'
https://www.zeit.de/news/2025-11/07/bobpiloten-friedrich-und-nolte-von-olympia-bahn-ueberzeugt,https://www.zeit.de/news/2025-11/07/bobpiloten-friedrich-und-nolte-von-olympia-bahn-ueberzeugt,0,www.zeit.de,Winterspiele in Cortina: Bobpiloten Friedrich und Nolte von Olympia-Bahn überzeugt,Hier finden Sie Informationen zu dem Thema „Winterspiele in Cortina“. Lesen Sie jetzt „Bobpiloten Friedrich und Nolte von Olympia-Bahn überzeugt“.,https://img.zeit.de/news/2025-11/07/bobpiloten-friedrich-und-nolte-von-olympia-bahn-ueberzeugt-image-group/wide__1300x731,2025-11-07T12:49:29Z,,Nach der ersten Begutachtung der viel diskutierten neuen Olympia-Bahn in Cortina d'Ampezzo zeigen sich die Bob-Olympiasieger von Peking 2022 sehr positiv gestimmt. «Natürlich ringsherum alles noch Ba… [+2075 chars],,de,'Winter'
https://www.zeit.de/news/2025-11/07/dank-alarm-des-arbeitgebers-ueberlebt-32-jaehriger-vergiftung,https://www.zeit.de/news/2025-11/07/dank-alarm-des-arbeitgebers-ueberlebt-32-jaehriger-vergiftung,0,www.zeit.de,Kohlenmonoxid-Gefahr: Dank Alarm des Arbeitgebers überlebt 32-Jähriger Vergiftung,Hier finden Sie Informationen zu dem Thema „Kohlenmonoxid-Gefahr“. Lesen Sie jetzt „Dank Alarm des Arbeitgebers überlebt 32-Jähriger Vergiftung“.,https://img.zeit.de/news/2025-11/07/dank-alarm-des-arbeitgebers-ueberlebt-32-jaehriger-vergiftung-image-group/wide__1300x731,2025-11-07T13:39:59Z,,"Dass sein Fernbleiben von der Arbeit auffiel, hat möglicherweise einem 32-Jährigen in Oberfranken das Leben gerettet: Sein Arbeitgeber war besorgt, weil er nicht zur Arbeit erschienen war. Fast zeitg… [+1222 chars]",,de,'Kohle'
https://www.bild.de/unterhaltung/stars-und-leute/viveca-sten-darum-erscheinen-ihre-thriller-nie-im-sommer-690dcfa20166cd59ef997def,https://www.bild.de/unterhaltung/stars-und-leute/viveca-sten-darum-erscheinen-ihre-thriller-nie-im-sommer-690dcfa20166cd59ef997def,0,www.bild.de,Bestseller-Autorin Viveca Sten - Darum erscheinen ihre Thriller nie im Sommer,"Viveca Sten veröffentlicht „Lügennebel“, ein packender Thriller um einen mysteriösen Tod im Schnee.","https://images.bild.de/690dcfa20166cd59ef997def/80445f5e8a7a59f85facb7192a376498,2fe8c45a?w=1280",2025-11-07T15:45:42Z,,"Stockholm Ihre Schweden-Thriller sind größere Exportschlager als Knäckebrot. Während ihre Mord im Mittsommer-Reihe seit 2014 erfolgreich im ZDF läuft, verfilmte Streaming-Gigant Netflix Die Åre-Morde… [+2939 chars]",,de,'Schnee'
https://www.morgenpost.de/panorama/article410399254/wetter-dwd-hitzewelle-extremwinter-prognose-vorhersage.html,https://www.morgenpost.de/panorama/article410399254/wetter-dwd-hitzewelle-extremwinter-prognose-vorhersage.html,0,www.morgenpost.de,"Hitzewelle oder Extremwinter? DWD-Experte erklärt, was auf uns zukommt","Der Winter hat kaum begonnen, schon wird spekuliert: Wird er viel zu warm oder eisig kalt? Ein Experte erklärt, was bisher absehbar ist.",https://img.sparknews.funkemedien.de/407749234/407749234_1732386149_v16_9_1600.jpeg,2025-11-07T15:48:05Z,,Hitzewelle im November oder Droht ein Jahrhundertwinter? widersprüchliche Schlagzeilen wie diese sorgen zurzeit für Verwirrung. Wie glaubhaft und zuverlässig sind solche Vorhersagen über mehrere Woch… [+2834 chars],,de,'Schnee'
https://www.zeit.de/news/2025-11/08/kommunen-sehen-sich-fuer-winter-obdachlosenhilfe-gut-geruestet,https://www.zeit.de/news/2025-11/08/kommunen-sehen-sich-fuer-winter-obdachlosenhilfe-gut-geruestet,0,www.zeit.de,Hilfsangebote: Kommunen sehen sich für Winter-Obdachlosenhilfe gut gerüstet,Hier finden Sie Informationen zu dem Thema „Hilfsangebote“. Lesen Sie jetzt „Kommunen sehen sich für Winter-Obdachlosenhilfe gut gerüstet“.,https://img.zeit.de/news/2025-11/08/kommunen-sehen-sich-fuer-winter-obdachlosenhilfe-gut-geruestet-image-group/wide__1300x731,2025-11-08T03:30:10Z,,"Die Thüringer Kommunen sehen sich mit Blick auf die Obdachlosenhilfe im Winter gut gerüstet. «Derzeit reichen die vorhandenen Kapazitäten aus, diese sind aber fast komplett ausgelastet», fasst Sprech… [+3749 chars]",,de,'Winter'
https://www.stern.de/gesellschaft/regional/bayern/bergsport--beim-start-in-die-wintersaison-ist-vorsicht-geboten-36228998.html,https://www.stern.de/gesellschaft/regional/bayern/bergsport--beim-start-in-die-wintersaison-ist-vorsicht-geboten-36228998.html,0,www.stern.de,Bergsport: Beim Start in die Wintersaison ist Vorsicht geboten,"Anfang November endet die sommerliche Bergsaison, es kommt die Zeit der Winterwanderer, Skitourengeher und Skifahrer. Einen täglichen Lawinenlagebericht gibt es in Bayern mangels Schnee noch nicht.",https://image.stern.de/36229000/t/KO/v1/w1440/r1.7778/-/08--hvof3ubdl5v5axs2048jpeg---413441f42be4bfd0.jpg,2025-11-08T04:45:06Z,,"Kopiere den aktuellen Link
Zur Merkliste hinzufügen
Anfang November endet die sommerliche Bergsaison, es kommt die Zeit der Winterwanderer, Skitourengeher und Skifahrer. Einen täglichen Lawinenlage… [+2766 chars]",,de,'Schnee'
https://www.zeit.de/news/2025-11/08/beim-start-in-die-wintersaison-ist-vorsicht-geboten,https://www.zeit.de/news/2025-11/08/beim-start-in-die-wintersaison-ist-vorsicht-geboten,0,www.zeit.de,Bergsport: Beim Start in die Wintersaison ist Vorsicht geboten,Hier finden Sie Informationen zu dem Thema „Bergsport“. Lesen Sie jetzt „Beim Start in die Wintersaison ist Vorsicht geboten“.,https://img.zeit.de/news/2025-11/08/beim-start-in-die-wintersaison-ist-vorsicht-geboten-image-group/wide__1300x731,2025-11-08T04:45:06Z,,"Die Temperaturen sinken, die Tage werden kürzer. Bei Sonnenschein locken die Berge dennoch viele Freizeitsportler an. Aus Sicht des Deutschen Alpenvereins (DAV) ist gerade die Zeit des Wechsels von H… [+2183 chars]",,de,'Winter'
https://www.zeit.de/news/2025-11/08/dezember-hoch-wintertourismus-in-schleswig-holstein-waechst,https://www.zeit.de/news/2025-11/08/dezember-hoch-wintertourismus-in-schleswig-holstein-waechst,0,www.zeit.de,Urlaub im Norden: Dezember-Hoch – Wintertourismus in Schleswig-Holstein wächst,Hier finden Sie Informationen zu dem Thema „Urlaub im Norden“. Lesen Sie jetzt „Dezember-Hoch – Wintertourismus in Schleswig-Holstein wächst“.,https://img.zeit.de/news/2025-11/08/dezember-hoch-wintertourismus-in-schleswig-holstein-waechst-image-group/wide__1300x731,2025-11-08T05:00:11Z,,"Sommer, Sonne, volle Strände so stellen sich viele den Urlaub in Schleswig-Holstein vor. Doch auch im Winter zieht Deutschlands nördlichstes Bundesland zahlreiche Besucher an. Zwar gelten Juni, Juli … [+1770 chars]",,de,'Winter'
https://www.stern.de/gesellschaft/regional/sachsen/verkehr--glatteisunfaelle-im-erzgebirge-36238950.html,https://www.stern.de/gesellschaft/regional/sachsen/verkehr--glatteisunfaelle-im-erzgebirge-36238950.html,0,www.stern.de,Verkehr: Glatteisunfälle im Erzgebirge,Schwarzenberg (sn) - Glatteis hat im Erzgebirge zu mehreren Verkehrsunfällen geführt. Laut Polizei gerieten am Freitagnachmittag bei Schwarzenberg mehrere,https://image.stern.de/36238952/t/rr/v1/w1440/r1.7778/-/08--3mhoa7vuhov11axs2048jpeg---cd84ff7f3c637a82.jpg,2025-11-08T11:57:16Z,,"Kopiere den aktuellen Link
Zur Merkliste hinzufügen
Plötzliches Glatteis führt im Erzgebirge zu mehreren Unfällen.
Glatteis hat im Erzgebirge zu mehreren Verkehrsunfällen geführt. Laut Polizei ger… [+813 chars]",,de,'Glatteis'
https://www.zeit.de/news/2025-11/08/glatteisunfaelle-im-erzgebirge,https://www.zeit.de/news/2025-11/08/glatteisunfaelle-im-erzgebirge,0,www.zeit.de,Verkehr: Glatteisunfälle im Erzgebirge,Hier finden Sie Informationen zu dem Thema „Verkehr“. Lesen Sie jetzt „Glatteisunfälle im Erzgebirge“.,https://img.zeit.de/news/2025-11/08/glatteisunfaelle-im-erzgebirge-image-group/wide__1300x731,2025-11-08T11:57:16Z,,"Glatteis hat im Erzgebirge zu mehreren Verkehrsunfällen geführt. Laut Polizei gerieten am Freitagnachmittag bei Schwarzenberg mehrere Autos ins Rutschen. Das Glatteis habe sich plötzlich gebildet.
Z… [+735 chars]",,de,'Glatteis'
https://www.zeit.de/news/2025-11/08/raubueberfall-auf-kinder-sek-durchsucht-wohnung-in-berlin,https://www.zeit.de/news/2025-11/08/raubueberfall-auf-kinder-sek-durchsucht-wohnung-in-berlin,0,www.zeit.de,Kriminalität: Raubüberfall auf Kinder - SEK durchsucht Wohnung in Berlin,Hier finden Sie Informationen zu dem Thema „Kriminalität“. Lesen Sie jetzt „Raubüberfall auf Kinder - SEK durchsucht Wohnung in Berlin“.,https://img.zeit.de/news/2025-11/08/raubueberfall-auf-kinder-sek-durchsucht-wohnung-in-berlin-image-group/wide__1300x731,2025-11-08T14:16:41Z,,Nach einem Raubüberfall auf drei Kinder in Berlin-Friedrichshain ist die Polizei zu einer Wohnungsdurchsuchung ausgerückt. Ein Spezialeinsatzkommando (SEK) durchsuchte laut Polizei am Freitag die Woh… [+658 chars],,de,'Kinder'
