index,url,valid,domain,title,description,image,published,archive,content,quote,language,keyword
https://www.tagesspiegel.de/berlin/ein-halbes-jahr-nach-dem-blackout-wegner-verfolgt-das-tennis-gate-bis-heute-15779485.html,https://www.tagesspiegel.de/berlin/ein-halbes-jahr-nach-dem-blackout-wegner-verfolgt-das-tennis-gate-bis-heute-15779485.html,0,www.tagesspiegel.de,Ein halbes Jahr nach dem Blackout: Wegner verfolgt das „Tennis-Gate“ bis heute,Tennis statt Krisenmanagement? Seit einem halben Jahr steht Berlins Regierender Bürgermeister deswegen in der Kritik. Ist dazu alles gesagt?,https://www.tagesspiegel.de/images/15779484/alternates/BASE_16_9_W1400/1782874977000/parteitag-cdu-berlin.jpeg,2026-07-01T03:02:57Z,,Für das Image von Berlins Regierendem Bürgermeister Kai Wegner war der 3. Januar ein Einschnitt  ein halbes Jahr ist der Beginn des großen Stromausfalls in Berlin her. Bis dahin hätte kaum jemand bez… [+6113 chars],,de,'Blackout'
https://www.zeit.de/mobilitaet/2026-06/ende-tankrabatt-bundesregierung-benzinpreise-sprit,https://www.zeit.de/mobilitaet/2026-06/ende-tankrabatt-bundesregierung-benzinpreise-sprit,0,www.zeit.de,Ende des Tankrabatts: Tanke für nichts,"Die Bundesregierung hat deutschen Autofahrern über den Tankrabatt zwei Monate lang günstigere Spritpreise beschert. Warum bloß? Gut, dass damit endlich Schluss ist.",https://img.zeit.de/wirtschaft/2026-06/ende-tankrabatt-bundesregierung-benzinpreise-sprit-bild-2/wide__1300x731,2026-07-01T03:27:24Z,,"Wenn Sie an diesem Mittwoch tanken
gehen und sich ärgern, weil der Liter
Benzin oder Diesel wieder deutlich teurer ist, atmen Sie erst einmal tief
durch. Ja, es wird erst mal teurer, der
Tankraba… [+671 chars]",,de,'Spritpreise'
https://www.faz.net/aktuell/politik/ausland/ursula-von-der-leyen-in-baku-menschenrechte-in-aserbaidschan-accg-200982219.html,https://www.faz.net/aktuell/politik/ausland/ursula-von-der-leyen-in-baku-menschenrechte-in-aserbaidschan-accg-200982219.html,0,www.faz.net,Von der Leyen bei Alijew: Die Gefangenen in Baku melden sich zu Wort,"Vor von der Leyens Aserbaidschan-Besuch mahnen Aktivisten: Die EU dürfe nicht nur Gas kaufen, sie müsse sich auch für politische Häftlinge einsetzen.",https://media0.faz.net/image/w1200h627/b6cc7c845497/w1960h1024x0y131o/202309/43600.0.2075015514/die-eu-sieht-aserbaidschan-als.webp,2026-07-01T04:13:09Z,,"Vor der Reise der EU-Kommissionspräsidentin nach Aserbaidschan an diesem Mittwoch mehren sich die Stimmen von politischen Gefangenen des Regimes von Machthaber Ilham Alijew, die Ursula von der Leyen … [+4181 chars]",,de,'Gas'
https://www.telepolis.de/article/Europas-Gasspeicher-Niedrigster-Fuellstand-seit-15-Jahren-droht-11349825.html,https://www.telepolis.de/article/Europas-Gasspeicher-Niedrigster-Fuellstand-seit-15-Jahren-droht-11349825.html,0,www.telepolis.de,Europas Gasspeicher: Niedrigster Füllstand seit 15 Jahren droht,Die EU könnte mit nur 76 Prozent Speicherfüllung in den Winter starten – so wenig wie seit 2011 nicht. Höhere Heizkosten werden wahrscheinlicher.,https://heise.cloudimg.io/bound/1200x1200/q85.png-lossy-85.webp-lossy-85.foil1/_www-heise-de_/imgs/18/5/1/0/9/3/1/4/shutterstock_2750226223-144f71ea16d7c1cd.jpg,2026-07-01T04:30:00Z,,"Der Füllstand von Europas Gasspeichern könnten zu Beginn der Heizsaison einen historisch niedrigen Wert erreichen.
(Bild: muratart / Shutterstock.com)
Die EU könnte mit nur 76 Prozent Speicherfüllu… [+2930 chars]",,de,'Heizkosten'
https://www.morgenpost.de/politik/article412436296/zukunft-der-spritpreise-drei-szenarien-wie-es-im-iran-krieg-weitergeht.html,https://www.morgenpost.de/politik/article412436296/zukunft-der-spritpreise-drei-szenarien-wie-es-im-iran-krieg-weitergeht.html,0,www.morgenpost.de,"Zukunft der Spritpreise: Drei Szenarien, wie es im Iran-Krieg weitergeht",Hält das amerikanisch-iranische Rahmenabkommen – oder platzt es? Wie sich die Entwicklung am Golf auf unsere Wirtschaft auswirken könnte.,https://img.sparknews.funkemedien.de/412436835/412436835_1782880371_v16_9_1600.jpeg,2026-07-01T04:32:49Z,,"Nach der Unterzeichnung des amerikanisch-iranischen Rahmenabkommens Mitte Juni keimte Hoffnung auf, dass die Weltwirtschaft wieder auf Trab kommt. Eine verlängerte Waffenruhe, die Wiederöffnung der f… [+6727 chars]",,de,'Spritpreise'
https://www.tagesspiegel.de/wirtschaft/anstieg-nicht-gerechtfertigt-der-tankrabatt-ist-geschichte--und-die-spritpreise-schiessen-hoch-15779640.html,https://www.tagesspiegel.de/wirtschaft/anstieg-nicht-gerechtfertigt-der-tankrabatt-ist-geschichte--und-die-spritpreise-schiessen-hoch-15779640.html,0,www.tagesspiegel.de,„Anstieg nicht gerechtfertigt“: Der Tankrabatt ist Geschichte – und die Spritpreise schießen hoch,Seit Mitternacht ist die Steuerermäßigung vorbei. Punkt 12 Uhr zogen die Preise an den Tankstellen noch einmal abrupt an. Kritik kommt vom ADAC und dem Kartellamt.,https://www.tagesspiegel.de/images/15779807/alternates/BASE_16_9_W1400/1782886583000/tanken.jpeg,2026-07-01T04:56:38Z,,Der Tankrabatt ist vorbei: Am ersten Tag nach dem Auslaufen sind die Preise für Benzin und Diesel am Mittwoch an den Zapfsäulen kräftig gestiegen. Auswertungen des Automobilclubs ADAC zufolge verteue… [+4074 chars],,de,'Spritpreise'
https://www.faz.net/aktuell/wirtschaft/unternehmen/business-liveticker-baywa-erhaelt-mehr-zeit-zur-sanierung-faz-200452404.html,https://www.faz.net/aktuell/wirtschaft/unternehmen/business-liveticker-baywa-erhaelt-mehr-zeit-zur-sanierung-faz-200452404.html,0,www.faz.net,Business-Ticker: Baywa erhält mehr Zeit zur Sanierung,Spritpreise schon vor Ende des Tankrabatts gestiegen +++ Wegen KI: Rechenzentren tragen bereits zu 20 Prozent des Stromverbrauchs bei +++ Ungarns Haushaltsloch wird größer +++ Neuigkeiten im Unternehmen-Liveblog.,https://media0.faz.net/image/w1200h627/95d1ab503f49/w5562h2906x0y111o/202603/43601.0.1899611949/wichtig-fuer-die.webp,2026-07-01T05:16:05Z,,Der Adidas-Rivale Nike sieht trotz eines Geschäfts-Schubs durch die Fußball-WM insgesamt eine trübe Stimmung am Sportartikel-Markt. Unsere Kunden sind rund um die Welt unter Druck und das bekomme man… [+1871 chars],,de,'Spritpreise'
https://www.zeit.de/arbeit/2026-06/highperformer-arbeit-karriere-arbeitszeit-arbeitnehmerschutz-regelungen,https://www.zeit.de/arbeit/2026-06/highperformer-arbeit-karriere-arbeitszeit-arbeitnehmerschutz-regelungen,0,www.zeit.de,"Highperformer: »Vielleicht liegt es daran, dass ich auf einem Bauernhof aufwuchs«","Sie arbeiten immer mehr, als sie müssten. Managen Job, Promotion, Kinder. Und gleichen Überstunden nicht aus. Highperformer erzählen, wie sie ihr Pensum locker schaffen.",https://img.zeit.de/arbeit/2026-06/highperformer-job-auslastung-karriere-familie-kinder-bild/wide__1300x731,2026-07-01T05:42:06Z,,"Es gibt die, die Dienst nach Vorschrift machen also genau so viel arbeiten, wie sie müssen. Und dann sind da noch die anderen: Für sie ist eine Arbeitswoche mit 60 Stunden normal. Sie sind trotzdem n… [+334 chars]",,de,'Kinder'
https://www.zeit.de/news/2026-07/01/reden-hilft-bei-zeugnissorgen-nummer-gegen-kummer,https://www.zeit.de/news/2026-07/01/reden-hilft-bei-zeugnissorgen-nummer-gegen-kummer,0,www.zeit.de,Kinder- und Jugendtelefon: Reden hilft bei Zeugnissorgen - Nummer gegen Kummer,Hier finden Sie Informationen zu dem Thema „Kinder- und Jugendtelefon“. Lesen Sie jetzt „Reden hilft bei Zeugnissorgen - Nummer gegen Kummer“.,https://img.zeit.de/news/2026-07/01/reden-hilft-bei-zeugnissorgen-nummer-gegen-kummer-image-group/wide__1300x731,2026-07-01T06:44:17Z,,"Am Freitag ist in Schleswig-Holstein der letzte Schultag vor den Sommerferien. Doch nicht alle Kinder und Jugendlichen können unbeschwert in die schulfreien Wochen starten, denn davor steht die Zeugn… [+2456 chars]",,de,'Kinder'
https://www.zeit.de/news/2026-07/01/anlage-flutet-hallen-mit-gas-mitarbeiter-verlassen-gebaeude,https://www.zeit.de/news/2026-07/01/anlage-flutet-hallen-mit-gas-mitarbeiter-verlassen-gebaeude,0,www.zeit.de,Großeinsatz: Anlage flutet Hallen mit Gas - Mitarbeiter verlassen Gebäude,Hier finden Sie Informationen zu dem Thema „Großeinsatz“. Lesen Sie jetzt „Anlage flutet Hallen mit Gas - Mitarbeiter verlassen Gebäude“.,https://img.zeit.de/news/2026-07/01/anlage-flutet-hallen-mit-gas-mitarbeiter-verlassen-gebaeude-image-group/wide__1300x731,2026-07-01T06:46:02Z,,Drei Hallen eines Industriebetriebes sind in Dörfles-Esbach (Landkreis Coburg) mit rund fünf Tonnen Kohlenstoffdioxid geflutet worden. Bei Arbeiten an einer Maschine hatte sich am Dienstag Qualm entw… [+370 chars],,de,'Gas'
https://www.faz.net/aktuell/gesellschaft/menschen/geburtenrate-in-deutschland-2025-tief-wie-vor-20-jahren-accg-200986289.html,https://www.faz.net/aktuell/gesellschaft/menschen/geburtenrate-in-deutschland-2025-tief-wie-vor-20-jahren-accg-200986289.html,0,www.faz.net,"1,32 Kinder je Frau: Geburtenrate ist weiter gesunken","Im vergangenen Jahr lag die Geburtenrate so niedrig wie seit 20 Jahren nicht mehr. Etwa 650.000 Kinder kamen in Deutschland zur Welt. Aber es gibt ein Bundesland, in dem die Zahl der Geburten pro Frau gestiegen ist.",https://media0.faz.net/image/w1200h627/27acf2d02ee3/w4355h2275x0y168o/202606/43601.0.2265253920/duisburg-ein-kind-spielt-bei.webp,2026-07-01T07:26:20Z,,"Die Geburtenrate ist erneut gesunken. Sie war 2025 mit 1,32 Kindern je Frau um 2,7 Prozent niedriger als im Vorjahr (1,35 Kinder je Frau), wie das Statistische Bundesamt am Mittwoch in Wiesbaden mitt… [+1711 chars]",,de,'Kinder'
https://www.zeit.de/feuilleton/literatur/2026-06/kinderbuch-bestenliste-jugendbuch-buecher-empfehlung-juli-2026,https://www.zeit.de/feuilleton/literatur/2026-06/kinderbuch-bestenliste-jugendbuch-buecher-empfehlung-juli-2026,0,www.zeit.de,Kinderbuch-Bestenliste: Die Kinder- und Jugendbuch-Bestenliste der ZEIT für Juli,"Wurm frisst Dino, Feministin trägt Hidschab, und ein Vater wird zum Eisbär: die fünf besten Kinder- und Jugendbücher des Monats.",https://img.zeit.de/feuilleton/literatur/2026-06/kinderbuch-bestenliste-jugendbuch-buehcer-empfehlung-juli-2026-bild-6/wide__1300x731,2026-07-01T08:19:28Z,,"Über die fünf Bücher dieser monatlichen Bestenliste stimmen 20 Redakteurinnen und Redakteure der ZEIT ab. Die aktuellen Titel stellt Katrin Hörnlein hier vor.
Platz 1
Martin Muser: LeimboyCarlsen V… [+974 chars]",,de,'Kinder'
https://www.tagesschau.de/inland/gesellschaft/geburtenrate-sinkt-100.html,https://www.tagesschau.de/inland/gesellschaft/geburtenrate-sinkt-100.html,0,www.tagesschau.de,Statistisches Bundesamt: So wenig Geburten wie zuletzt 1997,"Die Geburtenrate ist laut Statistischem Bundesamt auf den tiefsten Wert seit fast 30 Jahren gefallen - auf 1,32 Kinder pro Frau. In beinahe allen Bundesländern wurden 2025 weniger Kinder geboren als im Vorjahr.",https://images.tagesschau.de/image/41acf62f-b6dd-4e41-807a-42ab00288d46/AAABnxyVgoM/AAABnSSvrFg/16x9-big/neugeborenes-116.jpg?width=1280,2026-07-01T08:51:16Z,,"Stand: 01.07.2026 10:51 Uhr
Die Geburtenrate ist laut Statistischem Bundesamt auf den tiefsten Wert seit fast 30 Jahren gefallen - auf 1,32 Kinder pro Frau. In beinahe allen Bundesländern wurden 202… [+2405 chars]",,de,'Kinder'
https://www.tagesspiegel.de/gesellschaft/medien/hyperscaler-microsoft-plant-nachsten-grossen-ki-serverstandort-in-nrw-15780792.html,https://www.tagesspiegel.de/gesellschaft/medien/hyperscaler-microsoft-plant-nachsten-grossen-ki-serverstandort-in-nrw-15780792.html,0,www.tagesspiegel.de,Hyperscaler: Microsoft plant nächsten großen KI-Serverstandort in NRW,Die Tage des Kohle-Abbaus im Rheinischen Revier sind gezählt - und dann? Hohe Investitionen in neue Serverstandorte für KI-Anwendungen stimmen zumindest etwas hoffnungsfroh. Doch es gibt auch Skepsis.,https://www.tagesspiegel.de/images/15781625/alternates/BASE_16_9_W1400/1782905300000/microsoft-deutschlandchefin-agnes-heftberger.jpeg,2026-07-01T09:04:14Z,,"Der US-Technologiekonzern Microsoft erhöht seine milliardenschweren Investitionen in KI-Rechenzentren in NRW. Wie das Unternehmen mitteilte, möchte es einen weiteren Server-Standort in Grevenbroich a… [+5595 chars]",,de,'Kohle'
https://www.zeit.de/wirtschaft/2026-07/tankrabatt-ende-spritpreise-adac-12-uhr-regel-gxe,https://www.zeit.de/wirtschaft/2026-07/tankrabatt-ende-spritpreise-adac-12-uhr-regel-gxe,0,www.zeit.de,Tankrabatt: Spritpreise steigen nach Tankrabatt-Ende stark an,Nach dem Ende des Tankrabatts hat ein Liter Diesel über 15 Cent mehr als am Vortag gekostet. Umwelt- und Sozialverbände begrüßten das Auslaufen und fordern Alternativen.,https://img.zeit.de/wirtschaft/2026-07/tankrabatt-ende-spritpreise-adac-12-uhr-regel-foto-1/wide__1300x731,2026-07-01T09:10:27Z,,"Die Spritpreise sind mit dem Ende des Tankrabatts stark gestiegen. Wie der Allgemeine Deutsche Automobil-Club (ADAC) mitteilte, war Superbenzin der Sorte E10 um 8 Uhr am Morgen 13,4 Cent teurer als z… [+3843 chars]",,de,'Spritpreise'
https://www.tagesschau.de/wirtschaft/weltwirtschaft/stahlindustrie-krise-zoelle-100.html,https://www.tagesschau.de/wirtschaft/weltwirtschaft/stahlindustrie-krise-zoelle-100.html,0,www.tagesschau.de,Warum Stahlaktien trotz Dauerkrise so gut laufen,Hohe Energiekosten und wachsende Konkurrenz: Die Stahlindustrie ist in der Dauerkrise. Hinzu kommen neue US-Zölle auf europäischen Stahl. Trotzdem glänzten Stahlaktien zuletzt mit steigenden Kursen. Von Stefan Wolff.,https://images.tagesschau.de/image/2c526f8e-eae0-4b28-a0a1-515f2fd5258b/AAABnxyOF2k/AAABnSSvrFg/16x9-big/stahl-226.jpg?width=1280,2026-07-01T09:18:12Z,,"Stand: 01.07.2026 11:18 Uhr
Hohe Energiekosten und wachsende Konkurrenz: Die Stahlindustrie ist in der Dauerkrise. Hinzu kommen neue US-Zölle auf europäischen Stahl. Trotzdem glänzten Stahlaktien zu… [+2838 chars]",,de,'Energiekosten'
https://www.welt.de/wirtschaft/article6a44e58df027d323739636bf/adac-auswertung-ende-des-tankrabatts-spritpreise-steigen-deutlich-an.html,https://www.welt.de/wirtschaft/article6a44e58df027d323739636bf/adac-auswertung-ende-des-tankrabatts-spritpreise-steigen-deutlich-an.html,0,www.welt.de,Ende des Tankrabatts – Spritpreise steigen deutlich an,"Nach dem Auslaufen des Tankrabatts ziehen die Preise kräftig an. Super E10 liegt laut ADAC am Morgen rund 13 Cent, Diesel mehr als 15 Cent höher als am Vortag.",https://images.welt.de/6a44e58df027d323739636bf/44e15212571df69f486978d210ec1ad7-master/ci16x9-w1200/dpa-com-260701-935-1449719-jpg,2026-07-01T11:07:02Z,,"Nach dem Auslaufen des Tankrabatts ziehen die Preise kräftig an. Super E10 liegt laut ADAC am Morgen rund 13 Cent, Diesel mehr als 15 Cent höher als am Vortag.Die Spritpreise sind mit dem Ende des Ta… [+2331 chars]",,de,'Spritpreise'
https://www.zeit.de/news/2026-07/01/erster-mittagssprung-nach-tankrabatt-faellt-eher-klein-aus,https://www.zeit.de/news/2026-07/01/erster-mittagssprung-nach-tankrabatt-faellt-eher-klein-aus,0,www.zeit.de,Mobilitätskosten: Spritpreise ziehen mit dem Ende des Tankrabatts kräftig an,Hier finden Sie Informationen zu dem Thema „Mobilitätskosten“. Lesen Sie jetzt „Spritpreise ziehen mit dem Ende des Tankrabatts kräftig an“.,https://img.zeit.de/news/2026-07/01/erster-mittagssprung-nach-tankrabatt-faellt-eher-klein-aus-image-group/wide__1300x731,2026-07-01T11:36:44Z,,"Die Spritpreise sind mit dem Ende des Tankrabatts stark gestiegen. Am Mittwochmorgen war Superbenzin der Sorte E10 um 13,4 Cent teurer als zur gleichen Zeit am Dienstag, wie der ADAC mitteilt. Bei Di… [+3188 chars]",,de,'Spritpreise'
https://www.zeit.de/news/2026-07/01/mehr-e-scooter-unfaelle-polizei-startet-praeventionskampagne,https://www.zeit.de/news/2026-07/01/mehr-e-scooter-unfaelle-polizei-startet-praeventionskampagne,0,www.zeit.de,Kinder auf E-Rollern: Mehr E-Scooter-Unfälle – Polizei startet Präventionskampagne,Hier finden Sie Informationen zu dem Thema „Kinder auf E-Rollern“. Lesen Sie jetzt „Mehr E-Scooter-Unfälle – Polizei startet Präventionskampagne“.,https://img.zeit.de/news/2026-07/01/mehr-e-scooter-unfaelle-polizei-startet-praeventionskampagne-image-group/wide__1300x731,2026-07-01T11:44:23Z,,Anlässlich der deutlich gestiegenen Zahl von E-Scooter-Unfällen startet das Polizeipräsidium Südhessen zu Beginn des Heinerfestes eine Präventionskampagne. Unter dem Motto «E-Scooter? Nur mit Plan. R… [+538 chars],,de,'Kinder'
https://www.sueddeutsche.de/wirtschaft/spritpreise-deutschland-wegfall-tankrabatt-li.3508684,https://www.sueddeutsche.de/wirtschaft/spritpreise-deutschland-wegfall-tankrabatt-li.3508684,0,www.sueddeutsche.de,Ende des Tankrabatts: Spritpreise ziehen kräftig an,"Seit diesem Mittwoch ist die Steuerermäßigung an den Zapfsäulen ausgelaufen. Die Preise steigen stark, der befürchtete Rekord-Sprung zur Mittagszeit bleibt aber aus.",https://www.sueddeutsche.de/2026/07/01/f986aea2-82e5-4026-8e08-ecfab06955f7.jpg?q=60&fm=webp&width=1200&rect=0%2C134%2C2574%2C1448,2026-07-01T12:01:23Z,,"Am Mittag stiegen die Preise für E10 im bundesweiten Durchschnitt auf 2,15 Euro pro Liter an, bei Diesel auf 2,11 Euro. Der seit der Einführung der 12-Uhr-Regel typische Mittagssprung fiel allerdings… [+1637 chars]",,de,'Spritpreise'
https://www.tagesschau.de/wirtschaft/verbraucher/spritpreise-tankrabatt-steuererleichterung-100.html,https://www.tagesschau.de/wirtschaft/verbraucher/spritpreise-tankrabatt-steuererleichterung-100.html,0,www.tagesschau.de,Spritpreise ziehen mit dem Ende des Tankrabatts kräftig an,Die Spritpreise an den deutschen Tankstellen sind mit Auslaufen des Tankrabatts massiv angestiegen. Sowohl Super E10 als auch Diesel kosten am Mittag im bundesweiten Schnitt wieder deutlich über zwei Euro pro Liter.,https://images.tagesschau.de/image/fc315c26-ee2d-45d2-a126-af72784f29e8/AAABnx15FUo/AAABnSSvrFg/16x9-big/tanken-186.jpg?width=1280,2026-07-01T12:59:42Z,,"Stand: 01.07.2026 14:59 Uhr
Die Spritpreise an den deutschen Tankstellen sind mit Auslaufen des Tankrabatts massiv angestiegen. Sowohl Super E10 als auch Diesel kosten am Mittag im bundesweiten Schn… [+5234 chars]",,de,'Spritpreise'
https://www.n-tv.de/wirtschaft/Spritpreise-ziehen-zu-stark-und-zu-frueh-an-id31036100.html,https://www.n-tv.de/wirtschaft/Spritpreise-ziehen-zu-stark-und-zu-frueh-an-id31036100.html,0,www.n-tv.de,"Experte analysiert: Spritpreise ziehen ""zu stark und zu früh an""",Die steuerliche Schonfrist an den Zapfsäulen ist vorbei. Zur Mittagszeit steigen die Preise stark. Ist der aktuelle Sprung gerechtfertigt? IW-Ökonom Puls hat seine Zweifel.,https://www.n-tv.de/img/31030358/1782817468/Img_16_9/1200/Das-Ende-des-Tankrabatts-wird-sich-an-den-Tankstellen-bemerkbar-machen.jpg,2026-07-01T13:29:00Z,,"Bis sich die Preise an den Zapfsäulen wieder normalisieren, wird laut dem IW-Ökonomen Puls noch einige Zeit vergehen. 
Die steuerliche Schonfrist an den Zapfsäulen ist vorbei. Zur Mittagszeit steige… [+3769 chars]",,de,'Spritpreise'
https://taz.de/Nach-dem-Tankrabatt-Ende-Spritpreise-steigen-massiv/!6192643/,https://taz.de/Nach-dem-Tankrabatt-Ende-Spritpreise-steigen-massiv/!6192643/,0,taz.de,Nach Tankrabatt-Aus: Spritpreise steigen massiv,Mineralölkonzerne erhöhen Preise nach Auslaufen des Tankrabatts über Gebühr. Verbraucherschutzchefin Pop spricht von Abzocke.,https://taz.de/picture/8583813/1200/Tankrabatt.jpeg,2026-07-01T14:45:00Z,,Mineralölkonzerne erhöhen Preise nach Auslaufen des Tankrabatts über Gebühr. Verbraucherschutzchefin Pop spricht von Abzocke. mehr...,,de,'Spritpreise'
https://www.tagesschau.de/investigativ/anklage-nordstream-ukraine-russland-100.html,https://www.tagesschau.de/investigativ/anklage-nordstream-ukraine-russland-100.html,0,www.tagesschau.de,Gas-Pipelines: Erste Anklage gegen mutmaßlichen Nord-Stream-Saboteur,"Der Generalbundesanwalt hat im Fall der gesprengten Nord-Stream-Pipelines Anklage gegen einen Ukrainer erhoben.<em> </em>Laut<em> ARD</em>, SZ und Zeit soll sich der Ex-Soldat in abgehörten Telefonaten selbst belastet haben. Er wird in Hamburg vor Gericht ste…",https://images.tagesschau.de/image/0e41e889-1ee5-4db1-bf6e-24fe40ddb0af/AAABleyXnow/AAABnSSvrFg/16x9-big/nordstream-leck-101.jpg?width=1280,2026-07-01T15:00:28Z,,"Stand: 01.07.2026 17:00 Uhr
Der Generalbundesanwalt hat im Fall der gesprengten Nord-Stream-Pipelines Anklage gegen einen Ukrainer erhoben.Laut ARD, SZ und Zeit soll sich der Ex-Soldat in abgehörten… [+2493 chars]",,de,'Gas'
https://www.focus.de/kultur/stars/kohle-war-da-aber-kein-erfolg-nino-de-angelo-bekommt-millionen-gage-nach-vertragsfehler_c71bccf0-3a4e-4fd9-9c4e-228b5c21b583.html,https://www.focus.de/kultur/stars/kohle-war-da-aber-kein-erfolg-nino-de-angelo-bekommt-millionen-gage-nach-vertragsfehler_c71bccf0-3a4e-4fd9-9c4e-228b5c21b583.html,0,www.focus.de,"„Kohle war da, aber kein Erfolg”: Nino de Angelo bekommt Millionen-Gage nach Vertragsfehler","Zu Beginn seiner Karriere wurde Nino de Angelo mit dem schnellen Geld beglückt. Einige seiner Millionen beruhten damals auf einem Vertragsfehler, wie der Sänger nun verrät.","https://quadro.burda-forward.de/ctf/c5019b78-f344-4e0e-97f9-64c08367e01a.8a656e76-c525-4b4d-ae83-56b5c9d6d93a.jpg?im=RegionOfInterestCrop=(1200,630),regionOfInterest=(2522,863)&hash=8eeae1c7a311679800a6f091eb1e2d8df750e0c47c5f4da3f3ee943264db3e67",2026-07-01T15:35:00Z,,"In der MDR-Sendung MDR um 4: Gäste zum Kaffee wurde de Angelo auf seine schönste Gage angesprochen. Da musste der 62-Jährige nicht lange überlegen und landete im Jahr 1984, als sein Hit Jenseits von … [+1488 chars]",,de,'Kohle'
"https://www.gamestar.de/artikel/gasgrill-kohlegrill-alternative-weber-pelletgrill-tipp-bbq-empfehlung-sommer-2026,3448768.html","https://www.gamestar.de/artikel/gasgrill-kohlegrill-alternative-weber-pelletgrill-tipp-bbq-empfehlung-sommer-2026,3448768.html",0,www.gamestar.de,"Deals: Halt, Stop! - Bevor ihr einen Gasgrill kauft, solltet ihr diese Art von Grill mal kennenlernen! [Anzeige]","Gasgrill, Kohlegrill, Weber-Grill? Für mich kommt 2026 nichts mehr davon in Frage, denn ich habe mittlerweile eine ganz neue und andere Art von Grill entdeckt, die in meinen Augen sogar besser als der ganze Rest ist.",https://images.cgames.de/images/gamestar/293/activa-smoker-grill-xxl-el-paso-i-pellet-smoker-inkl-automatischer-pelletzuführung-thermometer-gasgrill-weber-grill-kohle_6404427.jpg,2026-07-01T18:15:00Z,,"Grillt ihr mit Gas oder Kohle? Eine neue Art von Grill benutzt weder noch. Und nein, ich meine natürlich keinen Elektrogrill.
Im Grunde genommen gibt es drei Arten von Grills: Gas, Kohle oder Elektr… [+5892 chars]",,de,'Kohle'
https://www.tagesschau.de/ausland/europa/polen-spritpreise-100.html,https://www.tagesschau.de/ausland/europa/polen-spritpreise-100.html,0,www.tagesschau.de,In Polen explodieren nach Ende der Preisbremse die Spritpreise,"Die Kraftstoffpreise sind in Polen über Nacht sprungartig angestiegen. Ähnlich wie in Deutschland lief im Juni ein Programm aus, das die Spritpreise begrenzte. Nun steht die Regierung massiv in der Kritik. Von Palina Milling.",https://images.tagesschau.de/image/6c37d72a-9ba7-4f78-9fc4-67b5f7361f2d/AAABnx8uTGQ/AAABnSSvrFg/16x9-big/tankstelle-polen-104.jpg?width=1280,2026-07-01T19:35:55Z,,"Stand: 01.07.2026 21:35 Uhr
Die Kraftstoffpreise sind in Polen über Nacht sprungartig angestiegen. Ähnlich wie in Deutschland lief im Juni ein Programm aus, das die Spritpreise begrenzte. Nun steht … [+2608 chars]",,de,'Spritpreise'
https://www.zeit.de/news/2026-07/02/kinder-drehen-tiktok-video-auf-bahngleisen,https://www.zeit.de/news/2026-07/02/kinder-drehen-tiktok-video-auf-bahngleisen,0,www.zeit.de,Polizeieinsatz: Kinder drehen TikTok-Video auf Bahngleisen,Hier finden Sie Informationen zu dem Thema „Polizeieinsatz“. Lesen Sie jetzt „Kinder drehen TikTok-Video auf Bahngleisen“.,https://img.zeit.de/news/2026-07/02/kinder-drehen-tiktok-video-auf-bahngleisen-image-group/wide__1300x731,2026-07-02T07:08:16Z,,Zwei Mädchen haben auf Bahngleisen in Amberg in der Oberpfalz Videoaufnahmen für TikTok gemacht und damit einen Polizeieinsatz ausgelöst. Der Streckenabschnitt sei für etwa 15 Minuten gesperrt worden… [+265 chars],,de,'Kinder'
https://www.zeit.de/news/2026-07/02/spritpreise-super-im-tagesschnitt-wieder-ueber-2-euro,https://www.zeit.de/news/2026-07/02/spritpreise-super-im-tagesschnitt-wieder-ueber-2-euro,0,www.zeit.de,Autokosten: Spritpreise: Super im Tagesschnitt wieder über 2 Euro,Hier finden Sie Informationen zu dem Thema „Autokosten“. Lesen Sie jetzt „Spritpreise: Super im Tagesschnitt wieder über 2 Euro“.,https://img.zeit.de/news/2026-07/02/spritpreise-super-im-tagesschnitt-wieder-ueber-2-euro-image-group/wide__1300x731,2026-07-02T08:21:34Z,,Zum ersten Mal seit Mai hat Superbenzin der Sorte E10 im bundesweiten Tagesschnitt wieder mehr als 2 Euro gekostet. Am Mittwoch - direkt nach dem Ende des Tankrabatts - schlug ein Liter des Kraftstof… [+1255 chars],,de,'Spritpreise'
https://www.tagesspiegel.de/wirtschaft/autokosten-spritpreise-super-im-tagesschnitt-wieder-uber-2-euro-15785539.html,https://www.tagesspiegel.de/wirtschaft/autokosten-spritpreise-super-im-tagesschnitt-wieder-uber-2-euro-15785539.html,0,www.tagesspiegel.de,Autokosten: Spritpreise: Super im Tagesschnitt wieder über 2 Euro,Das Ende des Tankrabatts hat die Preise steigen lassen - Diesel bleibt dennoch unter der emotional aufgeladenen Marke.,https://www.tagesspiegel.de/images/15785538/alternates/BASE_16_9_W1400/1782980558000/entwicklungen-spritpreise-nach-ende-tankrabatt.jpeg,2026-07-02T08:22:38Z,,Zum ersten Mal seit Mai hat Superbenzin der Sorte E10 im bundesweiten Tagesschnitt wieder mehr als 2 Euro gekostet. Am Mittwoch - direkt nach dem Ende des Tankrabatts - schlug ein Liter des Kraftstof… [+1311 chars],,de,'Spritpreise'
