index,url,valid,domain,title,description,image,published,archive,content,quote,language,keyword
https://www.faz.net/aktuell/gesellschaft/menschen/wie-unsere-autorin-den-blackout-in-lissabon-erlebte-110448837.html,https://www.faz.net/aktuell/gesellschaft/menschen/wie-unsere-autorin-den-blackout-in-lissabon-erlebte-110448837.html,0,www.faz.net,Wie unsere Autorin den Blackout in Lissabon erlebte,Millionen ­Menschen waren Anfang der Woche von einem massiven Stromausfall auf der iberischen Halbinsel betroffen. Unsere Autorin saß in Portugal fest – und stellte sich auf eine Nacht im Freien ein.,https://media0.faz.net/ppmedia/aktuell/106872506/1.10448836/facebook_teaser/als-es-am-vergangenen-montag.jpg,2025-05-01T06:21:03Z,https://web.archive.org/web/20250501063506/https://www.faz.net/aktuell/gesellschaft/menschen/wie-unsere-autorin-den-blackout-in-lissabon-erlebte-110448837.html,"Als es dunkel wurde, hatte ich gerade eine Metrofahrkarte gelöst. Es war Montag, 11.33 Uhr, und ich wollte zu einem Markt im Westen Lissabons fahren, noch mal ein bisschen Atmosphäre genießen, bevor … [+5997 chars]",,de,'Blackout'
https://www.welt.de/wirtschaft/plus256042880/Blackout-So-sind-die-Deutschen-auf-das-Spanien-Szenario-vorbereitet.html,https://www.welt.de/wirtschaft/plus256042880/Blackout-So-sind-die-Deutschen-auf-das-Spanien-Szenario-vorbereitet.html,0,www.welt.de,Nach dem Mega-Blackout – So sind die Deutschen auf das Spanien-Szenario vorbereitet,"Ein Blackout wie in Spanien ist auch in Deutschland nicht völlig ausgeschlossen. Wie gut die Deutschen darauf vorbereitet wären, zeigt jetzt eine Verivox-Umfrage. Auch nach dem Vertrauen in die Behörden bei einem solchen Fall wurde gefragt.",https://img.welt.de/img/wirtschaft/mobile256043440/1037938277-ci16x9-w1200-fnov-fpotl-fpi157750653/Mass-Electrical-Outage-Spain.jpg,2025-05-01T07:31:08Z,http://archive.md/20250501083052/https://www.welt.de/wirtschaft/plus256042880/Blackout-So-sind-die-Deutschen-auf-das-Spanien-Szenario-vorbereitet.html,"Nach dem Mega-Blackout in Spanien und Portugal ist das Stromnetz wieder stabil. Grundsätzlich sein ein großflächiger Stromausfall auch in Deutschland möglich, erklärt Energieexperte Frank Umbach.
Ei… [+237 chars]",,de,'Blackout'
https://www.faz.net/aktuell/karriere-hochschule/klassenzimmer/ueberlassen-schueler-chatgpt-und-co-das-denken-schwaechen-sie-ihre-gehirne-110432277.html,https://www.faz.net/aktuell/karriere-hochschule/klassenzimmer/ueberlassen-schueler-chatgpt-und-co-das-denken-schwaechen-sie-ihre-gehirne-110432277.html,0,www.faz.net,Lernen mit KI: Chancen und Herausforderungen für Deutschlands Schulen,"Überlassen Kinder und Jugendliche ChatGPT und Co. das Denken, schwächen sie ihre Gehirne. Das dürfen Schulen nicht zulassen. Forscher haben erste Ergebnisse vorgelegt, wann KI den Lernerfolg erhöht – sie sind ermutigend.",https://media0.faz.net/ppmedia/aktuell/gesellschaft/1477537642/1.10449410/facebook_teaser/viele-kinder-und-jugendliche.jpg,2025-05-01T07:56:20Z,http://archive.md/20250501080150/https://www.faz.net/aktuell/karriere-hochschule/klassenzimmer/ueberlassen-schueler-chatgpt-und-co-das-denken-schwaechen-sie-ihre-gehirne-110432277.html,"Künstliche Intelligenz hat in den Schulen Einzug gehalten, auch wenn manche Lehrkräfte das noch nicht wahrhaben wollen. Die Bandbreite ist freilich groß. Wenige Lehrer setzen KI schon ganz offensiv i… [+4358 chars]",,de,'Kinder'
https://www.welt.de/sport/basketball/video256045010/Video-Highlights-ALBA-BERLIN-SYNTAINICS-MBC-Basketball-Bundesliga.html,https://www.welt.de/sport/basketball/video256045010/Video-Highlights-ALBA-BERLIN-SYNTAINICS-MBC-Basketball-Bundesliga.html,0,www.welt.de,Souveräne Leistung – Alba Berlin lässt gegen Weißenfels nichts anbrennen,"Alba Berlin gibt auf der Zielgeraden der BBL-Saison nochmal richtig Gas. Das ist auch unbedingt nötig, wenn der Vizemeister die Playoffs erreichen will. Gegen den Syntainics MBC holt Alba einen überzeugenden Sieg. Die Highlights im Video.",https://img.welt.de/img/sport/basketball/mobile256045268/6077939717-ci16x9-w1200/DEU-DFL-2-FBL-Hertha-BSC-Training.jpg,2025-05-01T08:31:10Z,https://web.archive.org/web/20250502042820/https://www.welt.de/sport/basketball/video256045010/Video-Highlights-ALBA-BERLIN-SYNTAINICS-MBC-Basketball-Bundesliga.html,"Alba Berlin gibt auf der Zielgeraden der BBL-Saison nochmal richtig Gas. Das ist auch unbedingt nötig, wenn der Vizemeister die Playoffs erreichen will. Gegen den Syntainics MBC holt Alba einen überz… [+148 chars]",,de,'Gas'
https://www.n-tv.de/politik/Rohstoffdeal-steht-das-ist-bisher-darueber-bekannt-article25739754.html,https://www.n-tv.de/politik/Rohstoffdeal-steht-das-ist-bisher-darueber-bekannt-article25739754.html,0,www.n-tv.de,USA und Ukraine schließen Pakt: Rohstoffdeal steht - das ist bisher darüber bekannt,"Seltene Erden, Graphit, Lithium, Kohle - die Ukraine verfügt über immense Bodenschätze. Die USA verschaffen sich mit dem nun geschlossenen Deal Zugriff auf diese Rohstoffe. Doch auch die Ukraine profitiert - sowohl sicherheitspolitisch als auch wirtschaftlich.",https://www.n-tv.de/img/incoming/crop25739765/3411329972-cImg_16_9-w1200/6b614e294152f6a958e628fdfcbd62a0.jpg,2025-05-01T10:12:12Z,https://web.archive.org/web/20250501110028/https://www.n-tv.de/politik/Rohstoffdeal-steht-das-ist-bisher-darueber-bekannt-article25739754.html,Nach wochenlangen Verhandlungen haben die USA und die Ukraine ein Abkommen über den Abbau ukrainischer Rohstoffe und den Wiederaufbau des vom Krieg zerstörten Landes unterzeichnet. Sicherheitsgaranti… [+6094 chars],,de,'Kohle'
https://www.faz.net/aktuell/wissen/computer-mathematik/durchschnittlich-2-1-geburten-pro-frau-reichen-manchmal-nicht-110446769.html,https://www.faz.net/aktuell/wissen/computer-mathematik/durchschnittlich-2-1-geburten-pro-frau-reichen-manchmal-nicht-110446769.html,0,www.faz.net,"Durchschnittlich 2,1 Kinder reichen nicht überall","Frauen müssen möglicherweise mehr Kinder bekommen als bisher gedacht, damit die Menschheit nicht ausstirbt. Das haben Forscher aus Japan berechnet. Ihre Modellierung zeigt außerden, wie fatal es ist, wenn zu wenige Mädchen geboren werden.",https://media0.faz.net/ppmedia/aktuell/wissen/computer-mathematik/1122710208/1.10446798/facebook_teaser_fplus/davon-gibt-es-in-zukunft-immer.jpg,2025-05-01T11:20:33Z,https://web.archive.org/web/20250501112836/https://www.faz.net/aktuell/wissen/computer-mathematik/durchschnittlich-2-1-geburten-pro-frau-reichen-manchmal-nicht-110446769.html,"Auch wer es mit Zahlen nicht so hat, dürfte dieser schon einmal begegnet sein, wo immer über die Entwicklung der Weltbevölkerung berichtet wurde: 2,1. Es ist der Wert einer Größe, welche die Demograp… [+419 chars]",,de,'Kinder'
https://www.faz.net/aktuell/feuilleton/lissabon-der-grosse-blackout-am-flughafen-110449605.html,https://www.faz.net/aktuell/feuilleton/lissabon-der-grosse-blackout-am-flughafen-110449605.html,0,www.faz.net,Im Herz der Finsternis,"Maximales Pech, minimaler Trost: Am Flughafen von Lissabon sind wir in den schlimmsten Blackout der jüngeren Geschichte geraten – und erlebten doch Momente der Erleuchtung.",https://media0.faz.net/ppmedia/aktuell/170122313/1.10449602/facebook_teaser/nichts-geht-mehr-der-flughafen.jpg,2025-05-01T12:50:14Z,https://web.archive.org/web/20250501140822/https://www.faz.net/aktuell/feuilleton/lissabon-der-grosse-blackout-am-flughafen-110449605.html,"Plötzlich blieben die Gondeln stehen, die gerade noch über das Lissaboner Weltausstellungsgelände von 1998 geschwebt waren, und wir erkannten nicht das Menetekel, sondern machten dummen Witze. Doch d… [+10097 chars]",,de,'Blackout'
https://taz.de/Energieversorgung-bei-Stromausfall/!6082379/,https://taz.de/Energieversorgung-bei-Stromausfall/!6082379/,0,taz.de,Energieversorgung bei Stromausfall: Mit Solarstrom dem Blackout trotzen,Immer mehr Photovoltaikanlagen werden technisch für den Inselbetrieb ausgelegt. Altanlagen hingegen laufen bei Stromausfall nicht unbedingt.,https://taz.de/picture/7676559/1200/37740240-1.jpeg,2025-05-01T13:54:00Z,https://web.archive.org/web/20250502043146/https://taz.de/Energieversorgung-bei-Stromausfall/!6082379/,Immer mehr Photovoltaikanlagen werden technisch für den Inselbetrieb ausgelegt. Altanlagen hingegen laufen bei Stromausfall nicht unbedingt. mehr...,,de,'Blackout'
https://www.morgenpost.de/berlin/article408911750/polizei-berlin-ekel-essen-verpflegung-schimmel-kaese-polizisten-1-mai.html,https://www.morgenpost.de/berlin/article408911750/polizei-berlin-ekel-essen-verpflegung-schimmel-kaese-polizisten-1-mai.html,0,www.morgenpost.de,Schimmel-Käse? Polizisten erhalten am 1. Mai teilweise Ekel-Essen,Ausgerechnet vor dem schweren Einsatz am 1. Mai haben einige Beamte offenbar vergammeltes Essen bekommen. Und das nicht zum ersten Mal.,https://img.sparknews.funkemedien.de/408906803/408906803_1746033762_v16_9_1600.jpeg,2025-05-01T14:15:04Z,,"Berlin. Ausgerechnet vor dem schweren Einsatz am 1. Mai haben einige Beamte offenbar vergammeltes Essen bekommen. Und das nicht zum ersten Mal.
Zum 1. Mai ist offenbar verdorbene Nahrung an einige B… [+1300 chars]",,de,'Schimmel'
https://www.stern.de/gesellschaft/verschwoerungserzaehlungen--fake-news--wie-holen-wir-onkel-otto-da-raus--35667714.html,https://www.stern.de/gesellschaft/verschwoerungserzaehlungen--fake-news--wie-holen-wir-onkel-otto-da-raus--35667714.html,0,www.stern.de,Radikalisierte Menschen 50+: Wie hole ich Onkel Otto aus seiner Filterblase?,"Gerade ältere Menschen verheddern sich häufig in Verschwörungserzählungen und Telegram-Gruppen. Eine Expertin erklärt, warum – und wie man den Onkel da wieder rausbekommt.",https://image.stern.de/35667730/t/ZY/v3/w1440/r1.7778/-/verschwoerungserzaehlungen-radikalisierung-alte-menschen.jpg,2025-05-02T05:48:00Z,https://web.archive.org/web/20250502084157/https://www.stern.de/gesellschaft/verschwoerungserzaehlungen--fake-news--wie-holen-wir-onkel-otto-da-raus--35667714.html,"Kopiere den aktuellen Link
Zur Merkliste hinzufügen
Frau Pohl, was kann ich tun, wenn mein Onkel Fakenews über WhatsApp weiterleitet?Es gibt da verschiedene Strategien. Wenn jemand noch nicht allzu… [+14058 chars]",,de,'ältere Menschen'
https://futurezone.at/digital-life/bitcoin-mining-verlustgeschaeft-energiekosten/403037292,https://futurezone.at/digital-life/bitcoin-mining-verlustgeschaeft-energiekosten/403037292,0,futurezone.at,Deshalb ist Bitcoin-Mining jetzt ein Verlustgeschäft,"Für kleine Bitcoin-Hersteller übersteigen die Energiekosten mittlerweile den Wert der Coins, die sie dafür bekommen.",https://image.futurezone.at/images/facebook/8662954/46-205108359.jpg,2025-05-02T07:44:41Z,https://web.archive.org/web/20250502114941/https://futurezone.at/digital-life/bitcoin-mining-verlustgeschaeft-energiekosten/403037292,"Für kleine Bitcoin-Hersteller übersteigen die Energiekosten mittlerweile den Wert der Coins, die sie dafür bekommen.",,de,'Energiekosten'
https://www.bild.de/sport/fussball/zwischen-pokal-und-3-liga-kaelte-schock-fuer-profis-von-hansa-rostock-6813f4c710132913ef604519,https://www.bild.de/sport/fussball/zwischen-pokal-und-3-liga-kaelte-schock-fuer-profis-von-hansa-rostock-6813f4c710132913ef604519,0,www.bild.de,Zwischen Pokal und 3. Liga - Kälte-Schock für Hansa-Profis,Nach dem Pokalsieg bei FC Schönberg bereitet sich Hansa Rostock intensiv auf die wichtige Drittliga-Auswärtspartie gegen Sandhausen vor.,"https://images.bild.de/6813f4c710132913ef604519/b894c738a6659b0264eb515059f1eb5f,89637231?w=1280",2025-05-02T08:48:12Z,https://web.archive.org/web/20250502101949/https://www.bild.de/sport/fussball/zwischen-pokal-und-3-liga-kaelte-schock-fuer-profis-von-hansa-rostock-6813f4c710132913ef604519,"Im Saisonfinale muss auch der Körper mitspielen! Nach dem Halbfinale des MV-Landespokals ist vor der wichtigen Drittliga-Auswärtspartie in Sandhausen.
Hansa Rostock hat genau 48 Stunden Zeit, um zu … [+1697 chars]",,de,'Kälte'
https://www.zeit.de/familie/2025-05/kinder-luegen-moritz-daum-psychologie-familienrat,https://www.zeit.de/familie/2025-05/kinder-luegen-moritz-daum-psychologie-familienrat,0,www.zeit.de,"Kinder und Lügen: ""Kinder lügen oft aus einer Not heraus""","Wenn Kinder lügen, ist das nicht unbedingt schlimm, sagt der Entwicklungspsychologe Moritz Daum. Eltern sollten aber verstehen, warum ihr Kind nicht die Wahrheit sagt.",https://img.zeit.de/familie/2025-04/kinder-luegen-moritz-daum-psychologie/wide__1300x731,2025-05-02T09:54:06Z,http://archive.md/20250502100056/https://www.zeit.de/familie/2025-05/kinder-luegen-moritz-daum-psychologie-familienrat,"Dieser Artikel ist Teil von ZEIT am Wochenende, Ausgabe 18/2025.
""Ich hab' schon Zähne geputzt"", ""Ich habe Bauchweh"", ""Das Buch ist wirklich ganz toll, Oma"": Kinder lügen aus ganz unterschiedlichen … [+799 chars]",,de,'Kinder'
https://www.zeit.de/wirtschaft/2025-04/luxus-lebensmittel-erdbeere-erewhon-preis-japan,https://www.zeit.de/wirtschaft/2025-04/luxus-lebensmittel-erdbeere-erewhon-preis-japan,0,www.zeit.de,"Luxuslebensmittel: ""Wir behandeln die Erdbeeren wie unsere Kinder""",Eine Erdbeerfarmerin aus Japan exportiert ihre Früchte in die USA – und verkauft sie dort für 20 US-Dollar das Stück. Ist das noch Genuss oder schon pure Dekadenz?,https://img.zeit.de/wirtschaft/2025-04/luxus-erdbeere-japan-usa-bild-2/wide__1300x731,2025-05-02T10:13:01Z,http://archive.md/20250502103510/https://www.zeit.de/wirtschaft/2025-04/luxus-lebensmittel-erdbeere-erewhon-preis-japan,"Dieser Artikel ist Teil von ZEIT am Wochenende, Ausgabe 18/2025.
20 US-Dollar für eine einzige Erdbeere: Die 28-jährige Farmerin Julia Suzuki hat sich gemeinsam mit ihrem Partner Taiki Ito in der ja… [+380 chars]",,de,'Kinder'
https://www.faz.net/aktuell/wirtschaft/blackout-in-spanien-versorgungssicherheit-muss-an-erster-stelle-stehen-110449947.html,https://www.faz.net/aktuell/wirtschaft/blackout-in-spanien-versorgungssicherheit-muss-an-erster-stelle-stehen-110449947.html,0,www.faz.net,Den Blackout verhindern: Lebenselixier Strom,Aus den großflächigen Stromausfällen in Spanien und Portugal kann Deutschland einiges lernen. Allen voran: Die Versorgungssicherheit ist gegenüber der Bezahlbarkeit und der Umweltverträglichkeit zu priorisieren.,https://media0.faz.net/ppmedia/aktuell/wirtschaft/699311913/1.10449952/facebook_teaser_fplus/monteure-erneuern-eine-110-kv.jpg,2025-05-02T10:50:26Z,http://archive.md/20250502125329/https://www.faz.net/aktuell/wirtschaft/blackout-in-spanien-versorgungssicherheit-muss-an-erster-stelle-stehen-110449947.html,"Wie angewiesen die moderne Gesellschaft auf den unablässigen Strom der Elektrizität ist, dürfte vielen Bewohnern Madrids, Lissabons und anderer urbaner Zentren auf der Iberischen Halbinsel erst am Mo… [+570 chars]",,de,'Blackout'
https://www.zeit.de/news/2025-05/02/sieben-verletzte-bei-unfall-kinder-nicht-richtig-gesichert,https://www.zeit.de/news/2025-05/02/sieben-verletzte-bei-unfall-kinder-nicht-richtig-gesichert,0,www.zeit.de,Schwerer Auffahrunfall: Sieben Verletzte bei Unfall – Kinder nicht richtig gesichert,Hier finden Sie Informationen zu dem Thema „Schwerer Auffahrunfall“. Lesen Sie jetzt „Sieben Verletzte bei Unfall – Kinder nicht richtig gesichert“.,https://img.zeit.de/news/2025-05/02/sieben-verletzte-bei-unfall-kinder-nicht-richtig-gesichert-image-group/wide__1300x731,2025-05-02T10:52:49Z,https://web.archive.org/web/20250503033331/https://www.zeit.de/news/2025-05/02/sieben-verletzte-bei-unfall-kinder-nicht-richtig-gesichert,Bei einem Auffahrunfall auf der Autobahn 7 in Schwaben sind sieben Menschen leicht verletzt worden - darunter Kinder im Alter zwischen sechs Monaten und sechs Jahren. Zwei der drei Kinder seien währe… [+1172 chars],,de,'Kinder'
https://www.zeit.de/politik/2025-04/holocaust-ueberlebende-geschichte-nachrichtenpodcast,https://www.zeit.de/politik/2025-04/holocaust-ueberlebende-geschichte-nachrichtenpodcast,0,www.zeit.de,"Holocaustüberlebende: ""Ich bete jeden Tag, dass man mich nicht wieder wegjagt""","Sie waren Kinder, als der Holocaust ihr Leben veränderte. Heute sind sie die letzten Zeitzeugen. Drei Überlebende erzählen über ihr Leben, ihre Angst und ihre Hoffnung.",https://img.zeit.de/politik/2025-04/holocaust-ueberlebende-geschichte-nachrichtenpodcast-bild/wide__1300x731,2025-05-02T11:20:36Z,http://archive.md/20250502112752/https://www.zeit.de/politik/2025-04/holocaust-ueberlebende-geschichte-nachrichtenpodcast,"Janine Webber (l.), 92, Pedro Buchwald (m.), 87, und Hélène Gutkowski (r.), 85, erlebten den Holocaust als Kinder.© (l.) Grey Hutton, (m./r.) Ignacio Coló
Vor 80 Jahren endete der Zweite Weltkrieg i… [+1140 chars]",,de,'Kinder'
https://www.zeit.de/zeit-magazin/leben/2025-04/freunde-alter-menschen-ev-besucher-senioren-einsamkeit,https://www.zeit.de/zeit-magazin/leben/2025-04/freunde-alter-menschen-ev-besucher-senioren-einsamkeit,0,www.zeit.de,Freunde alter Menschen e.V.: Alle so allein hier,"Ein Verein vermittelt junge Besuchspartner an ältere Menschen, die sich einsam fühlen. Aber wer hilft dabei eigentlich wem?",https://img.zeit.de/zeit-magazin/2025-04/freunde-alter-menschen-ev-besucher-senioren-einsamkeit-04/wide__1300x731,2025-05-02T11:24:11Z,http://archive.md/20250502112836/https://www.zeit.de/zeit-magazin/leben/2025-04/freunde-alter-menschen-ev-besucher-senioren-einsamkeit,"Dieser Artikel ist Teil von ZEIT am Wochenende, Ausgabe 18/2025.
Frau Lämmel macht nicht auf. Justus Heyen wartet vor dem Hauseingang eines siebenstöckigen Gebäudes in Berlin-Kreuzberg. Noch mal drü… [+583 chars]",,de,'ältere Menschen'
https://www.sueddeutsche.de/wirtschaft/katherina-reiche-wirtschaftsministerium-berlin-li.3243526,https://www.sueddeutsche.de/wirtschaft/katherina-reiche-wirtschaftsministerium-berlin-li.3243526,0,www.sueddeutsche.de,Wirtschaftsministerium: Was Katherina Reiche erwartet,"Die neue Wirtschaftsministerin soll den Standort wieder stark machen und dafür unter anderem die Energiekosten senken. Dabei hat sie wenig Spielraum, weil ihr Haus ganze Abteilungen abgeben muss.",https://www.sueddeutsche.de/2025/05/02/a9e7454c-a468-4656-8a69-5dd4f659cf79.jpeg?q=60&fm=webp&width=1200&rect=0%2C431%2C4000%2C2250,2025-05-02T13:42:37Z,https://web.archive.org/web/20250502151307/https://www.sueddeutsche.de/wirtschaft/katherina-reiche-wirtschaftsministerium-berlin-li.3243526,"Reiche zählt zu den Überraschungen des neuen Bundeskabinetts. Aus der aktiven Politik hatte sich die 51-Jährige schon lange verabschiedet, in Düsseldorf lenkte sie zuletzt die Geschicke des Netzbetre… [+9399 chars]",,de,'Energiekosten'
https://www.bild.de/leben-wissen/auto/auto-verkaufen-so-bekommen-sie-gebrauchtwagen-verkauf-mehr-geld-6810cfe03e4aff02aa6cd104,https://www.bild.de/leben-wissen/auto/auto-verkaufen-so-bekommen-sie-gebrauchtwagen-verkauf-mehr-geld-6810cfe03e4aff02aa6cd104,0,www.bild.de,Mit 5 Tipps zum besten Preis - So holen Sie beim Autoverkauf mehr Kohle raus,"Autokäufer suchen nach Mängeln und versuchen damit, den Preis zu drücken. Das klappt aber nicht, wenn Sie das Auto in einen Tipp-Topp-Zustand versetzen.","https://images.bild.de/6810cfe03e4aff02aa6cd104/560ae283a4c404042480665e2480ec63,1db12252?w=1280",2025-05-02T14:08:02Z,https://web.archive.org/web/20250502142456/http://www.bild.de/leben-wissen/auto/auto-verkaufen-so-bekommen-sie-gebrauchtwagen-verkauf-mehr-geld-6810cfe03e4aff02aa6cd104,"Das alte Auto hat ausgedient, ein neuer Wagen muss her? Die naheliegendste Finanzspritze für die neue Karre ist ein ordentlicher Verkaufspreis für den Gebrauchten.
Potentielle Käufer suchen nach Män… [+342 chars]",,de,'Kohle'
https://www.brigitte.de/aktuell/david-beckham-feiert-50--geburtstag--ehefrau-victoria-gratuliert-mit-suessem-video-13983564.html,https://www.brigitte.de/aktuell/david-beckham-feiert-50--geburtstag--ehefrau-victoria-gratuliert-mit-suessem-video-13983564.html,0,www.brigitte.de,David Beckham feiert 50. Geburtstag: Ehefrau Victoria gratuliert mit süßem Video,David Beckham wird zu seinem 50. Geburtstag gefeiert. Ehefrau Victoria postet ein Instagram-Video. Auch seine Kinder lassen ihn hochleben.,https://image.brigitte.de/13983566/t/zy/v1/w1440/r1.7778/-/02--ehefrau-victoria-gratuliert-mit-suessem-video---1-1---spoton-article-1095851.jpg,2025-05-02T14:22:00Z,https://web.archive.org/web/20250502161905/https://www.brigitte.de/aktuell/david-beckham-feiert-50--geburtstag--ehefrau-victoria-gratuliert-mit-suessem-video-13983564.html,"David Beckham wird zu seinem 50. Geburtstag gefeiert. Ehefrau Victoria postet ein Instagram-Video. Auch seine Kinder lassen ihn hochleben.
David Beckham feiert am 2. Mai seinen 50. Geburtstag. Mit e… [+2478 chars]",,de,'Kinder'
https://www.sueddeutsche.de/wissen/stromausfall-spanien-ursachen-solarenergie-li.3245860,https://www.sueddeutsche.de/wissen/stromausfall-spanien-ursachen-solarenergie-li.3245860,0,www.sueddeutsche.de,Photovoltaik: Hatte der Blackout mit Solaranlagen zu tun – oder mit Oszillationen im Netz?,Zwei mögliche Ursachen für den Stromausfall in Spanien und Portugal werden diskutiert. Was es damit auf sich hat - und was Experten beunruhigt.,https://www.sueddeutsche.de/2025/05/02/dd0bb219-55a8-42e1-b9b4-b4d05278de76.jpeg?q=60&fm=webp&width=1200&rect=0%2C208%2C4000%2C2250,2025-05-02T15:03:56Z,http://archive.md/20250502151322/https://www.sueddeutsche.de/wissen/stromausfall-spanien-ursachen-solarenergie-li.3245860,Zwei Erklärungsansätze werden momentan als Ursache für den Stromausfall in Spanien und Portugal diskutiert. Was es damit auf sich hat.Die Ursache des Stromausfalls in Spanien und Portugal vom Montag … [+247 chars],,de,'Blackout'
https://www.bild.de/leben-wissen/mein-geld-finanzportal/stromausfall-in-suedeuropa-deutsche-kaum-auf-blackout-vorbereitet-681462a412ee6b68d1b80f53,https://www.bild.de/leben-wissen/mein-geld-finanzportal/stromausfall-in-suedeuropa-deutsche-kaum-auf-blackout-vorbereitet-681462a412ee6b68d1b80f53,0,www.bild.de,Kein Vertrauen in Behörden - Blackout-Gefahr! Drei Viertel nicht vorbereitet,"Eine Umfrage zeigt: 73 Prozent der Deutschen sind nicht auf einen Blackout vorbereitet, trotz des Mega-Blackouts in Südeuropa.","https://images.bild.de/681462a412ee6b68d1b80f53/8176812703fb45c802dfcd9b97332adc,59b442c2?w=1280",2025-05-02T15:06:08Z,https://web.archive.org/web/20250502164919/https://www.bild.de/leben-wissen/mein-geld-finanzportal/stromausfall-in-suedeuropa-deutsche-kaum-auf-blackout-vorbereitet-681462a412ee6b68d1b80f53,"Mega-Blackout in Europa! Spanien, Portugal und Frankreich versanken im Chaos: Ampeln fielen aus, Telefonnetze brachen zusammen, Züge standen still sogar lebenswichtige Operationen mussten verschoben … [+371 chars]",,de,'Blackout'
https://www.stern.de/politik/ausland/-horrorhaus--in-spanien--erschreckende-details-ueber-das-martyrium-35688540.html,https://www.stern.de/politik/ausland/-horrorhaus--in-spanien--erschreckende-details-ueber-das-martyrium-35688540.html,0,www.stern.de,“Horrorhaus” in Spanien: Nach ihrer Befreiung sogen die Kinder gierig die frische Luft ein,"Ein deutsches Paar sperrte seine drei Kinder offenbar jahrelang in seinem Haus in Nordspanien ein. Zeichnungen der Kleinen lassen erahnen, welches Martyrium sie durchlebt haben.",https://image.stern.de/35688748/t/j4/v4/w1440/r1.7778/-/spanien-horror-haus.jpg,2025-05-02T15:53:00Z,http://archive.md/20250502164909/https://www.stern.de/politik/ausland/-horrorhaus--in-spanien--erschreckende-details-ueber-das-martyrium-35688540.html,"Kopiere den aktuellen Link
Zur Merkliste hinzufügen
Ein deutsches Paar sperrte seine drei Kinder offenbar jahrelang in seinem Haus in Nordspanien ein. Zeichnungen der Kleinen lassen erahnen, welche… [+505 chars]",,de,'Kinder'
https://www.jungewelt.de/artikel/499230.spanien-blackout-durch-profitgier.html,https://www.jungewelt.de/artikel/499230.spanien-blackout-durch-profitgier.html,0,www.jungewelt.de,Spanien: Blackout durch Profitgier,Sparmaßnahmen der Energiekonzerne sollen die Ursache des Stomausfalls auf der Iberischen Halbinsel am Montag gewesen sein. Die linke Opposition in Spanien und Portugal fordert nun die Verstaatlichung dieser Unternehmen.,https://www.jungewelt.de/img/1100/208338.jpg,2025-05-02T17:40:37Z,http://archive.md/20250504044307/https://www.jungewelt.de/artikel/499230.spanien-blackout-durch-profitgier.html,"Nach dem Megablackout von Wochenbeginn ist das Stromnetz in Spanien wiederhergestellt. Jetzt streiten sich Verantwortliche und Parteien darüber, worin die Ursache für den Stromausfall liegt, der die … [+6147 chars]",,de,'Blackout'
https://taz.de/Blackout-ohne-Folgen/!6081514/,https://taz.de/Blackout-ohne-Folgen/!6081514/,0,taz.de,Blackout ohne Folgen?: Mehr Alarm geht nicht,Spätestens nach dem Blackout im Süden Europas sollte Katastrophenhilfe kein Orchideenthema mehr sein. Deutschland setzt aber bisher auf Volksfeste.,https://taz.de/picture/7677708/1200/38264985-1.jpeg,2025-05-02T17:56:00Z,,Spätestens nach dem Blackout im Süden Europas sollte Katastrophenhilfe kein Orchideenthema mehr sein. Deutschland setzt aber bisher auf Volksfeste. mehr...,,de,'Blackout'
