index,url,valid,domain,title,description,image,published,archive,content,quote,language,keyword
https://www.stern.de/gesellschaft/regional/berlin-brandenburg/unwetterwarnung--glatteis-warnung--gefaehrliche-strassen--teils-keine-schule-37034246.html,https://www.stern.de/gesellschaft/regional/berlin-brandenburg/unwetterwarnung--glatteis-warnung--gefaehrliche-strassen--teils-keine-schule-37034246.html,0,www.stern.de,"Unwetterwarnung: Glatteis-Warnung: Gefährliche Straßen, teils keine Schule","Autofahrer, Fußgänger, Bahn-Pendler aufgepasst: Am Dienstag herrscht hohe Glatteis-Gefahr. Schulen reagieren auf eine Unwetter-Warnung. An einem Ort war es in der Nacht besonders bitterkalt.",https://image.stern.de/37034248/t/aV/v1/w1440/r1.7778/-/12--dmtagkpxgzv8axs2048jpeg---d3b052259d7de0eb.jpg,2026-01-12T15:27:33Z,,"Kopiere den aktuellen Link
Zur Merkliste hinzufügen
Autofahrer, Fußgänger, Bahn-Pendler aufgepasst: Am Dienstag herrscht hohe Glatteis-Gefahr. Schulen reagieren auf eine Unwetter-Warnung. An einem … [+3173 chars]",,de,'Glatteis'
https://www.zeit.de/news/2026-01/12/glatteis-warnung-gefaehrliche-strassen-teils-keine-schule,https://www.zeit.de/news/2026-01/12/glatteis-warnung-gefaehrliche-strassen-teils-keine-schule,0,www.zeit.de,"Unwetterwarnung: Glatteis-Warnung: Gefährliche Straßen, teils keine Schule","Hier finden Sie Informationen zu dem Thema „Unwetterwarnung“. Lesen Sie jetzt „Glatteis-Warnung: Gefährliche Straßen, teils keine Schule“.",https://img.zeit.de/news/2026-01/12/glatteis-warnung-gefaehrliche-strassen-teils-keine-schule-image-group/wide__1300x731,2026-01-12T15:27:33Z,,"Schneefall, Regen, tückisches Glatteis auf den Straßen: Wegen erwarteter Wetter-Extreme müssen Kinder in Brandenburg am Dienstag nicht in die Schule. Der Deutsche Wetterdienst (DWD) warnte, dass es a… [+2706 chars]",,de,'Glatteis'
https://www.faz.net/aktuell/gesellschaft/ungluecke/liveblog-zu-eisregen-und-glatteis-brandenburg-setzt-abermals-praesenzpflicht-an-schulen-aus-faz-200418900.html,https://www.faz.net/aktuell/gesellschaft/ungluecke/liveblog-zu-eisregen-und-glatteis-brandenburg-setzt-abermals-praesenzpflicht-an-schulen-aus-faz-200418900.html,0,www.faz.net,Liveblog zu Eisregen und Glatteis: Brandenburg setzt abermals Präsenzpflicht an Schulen aus,Regionalzug am Bahnhof Glashütte in Sachsen entgleist +++ Frankfurter Flughafen streicht rund 100 Starts und Landungen +++ Verkehrsminister: „Die gefährliche Situation ist noch nicht vorbei“ +++ alle Entwicklungen im Liveblog,https://media0.faz.net/image/w1200h627/2851a52a7331/w3000h1567x0y216o/202601/43601.0.1650105218/die-havel-schneebedeckt-der.webp,2026-01-12T15:28:09Z,,"In Hamburg ist heute nochmal Geduld gefragt: S-Bahn-Fahrgäste müssen wegen Schnee und Glätte weiter auf allen Linien mit Einschränkungen leben. Auch wenn wir auf allen Strecken fahren können, kann es… [+871 chars]",,de,'Glatteis'
https://www.tagesspiegel.de/berlin/unwetterwarnung-glatteis-warnung-gefahrliche-strassen-teils-keine-schule-15129685.html,https://www.tagesspiegel.de/berlin/unwetterwarnung-glatteis-warnung-gefahrliche-strassen-teils-keine-schule-15129685.html,0,www.tagesspiegel.de,"Unwetterwarnung: Glatteis-Warnung: Gefährliche Straßen, teils keine Schule","Autofahrer, Fußgänger, Bahn-Pendler aufgepasst: Am Dienstag herrscht hohe Glatteis-Gefahr. Schulen reagieren auf eine Unwetter-Warnung. An einem Ort war es in der Nacht besonders bitterkalt.",https://www.tagesspiegel.de/images/15129684/alternates/BASE_16_9_W1400/1768231712000/winterwetter-in-sudbrandenburg.jpeg,2026-01-12T15:28:32Z,,"Schneefall, Regen, tückisches Glatteis auf den Straßen: Wegen erwarteter Wetter-Extreme müssen Kinder in Brandenburg am Dienstag nicht in die Schule. Der Deutsche Wetterdienst (DWD) warnte, dass es a… [+2766 chars]",,de,'Glatteis'
https://www.faz.net/aktuell/rhein-main/glatteis-in-hessen-an-vielen-schulen-fiel-der-unterricht-aus-200430951.html,https://www.faz.net/aktuell/rhein-main/glatteis-in-hessen-an-vielen-schulen-fiel-der-unterricht-aus-200430951.html,0,www.faz.net,Winter in Hessen: An 450 Schulen fiel der Unterricht aus,Nach der Glätte-Warnung des Deutschen Wetterdienstes halten sich die Auswirkungen in Grenzen. Am meisten spürten es die Schüler. Aber auch Flüge fielen aus.,https://media0.faz.net/image/w1200h627/87a39088448b/w3000h1567x0y175o/202601/43601.0.1657210647/eingeschneit-in-vielen.webp,2026-01-12T15:38:56Z,,Schnee und Straßenglätte haben am ersten Schultag nach den Winterferien zu Unterrichtsausfall an rund 450 Schulen in Hessen geführt. Der Deutsche Wetterdienst hatte eine Warnstufe ausgerufen und vor … [+1859 chars],,de,'Schnee'
https://www.zeit.de/news/2026-01/12/glatteis-in-hessen-schulausfaelle-nach-den-ferien,https://www.zeit.de/news/2026-01/12/glatteis-in-hessen-schulausfaelle-nach-den-ferien,0,www.zeit.de,Wetter: Glatteis in Hessen – Schulausfälle nach den Ferien,Hier finden Sie Informationen zu dem Thema „Wetter“. Lesen Sie jetzt „Glatteis in Hessen – Schulausfälle nach den Ferien“.,https://img.zeit.de/news/2026-01/12/glatteis-in-hessen-schulausfaelle-nach-den-ferien-image-group/wide__1300x731,2026-01-12T15:39:25Z,,Schnee und Eisglätte haben in Hessen für einen gefährlichen Wochenstart gesorgt. Der Deutsche Wetterdienst hatte eine Warnstufe ausgerufen - es bestehe «Gefahr für Leib und Leben durch plötzlich über… [+4824 chars],,de,'Glatteis'
https://www.zeit.de/news/2026-01/12/dwd-weitet-unwetterwarnung-wegen-glatteis-auf-ganz-mv-aus,https://www.zeit.de/news/2026-01/12/dwd-weitet-unwetterwarnung-wegen-glatteis-auf-ganz-mv-aus,0,www.zeit.de,Wetter: DWD weitet Unwetterwarnung wegen Glatteis auf ganz MV aus,Hier finden Sie Informationen zu dem Thema „Wetter“. Lesen Sie jetzt „DWD weitet Unwetterwarnung wegen Glatteis auf ganz MV aus“.,https://img.zeit.de/news/2026-01/12/dwd-weitet-unwetterwarnung-wegen-glatteis-auf-ganz-mv-aus-image-group/wide__1300x731,2026-01-12T16:08:48Z,,"Der Deutsche Wetterdienst (DWD) hat seine Unwetterwarnung vor Glatteis auf ganz Mecklenburg-Vorpommern ausgeweitet. Zuvor bestand diese nur für den westlichen Landesteil, und es gab eine sogenannte V… [+428 chars]",,de,'Glatteis'
https://www.faz.net/aktuell/rhein-main/kultur/wir-haben-den-umgang-mit-schnee-verlernt-200429985.html,https://www.faz.net/aktuell/rhein-main/kultur/wir-haben-den-umgang-mit-schnee-verlernt-200429985.html,0,www.faz.net,Schnee: Die Hand raushalten würde schon helfen,"Von blöden Bemerkungen der Klimaleugner bis zu Sneakerssocken im Schnee: Warum es gut wäre, dem Winter mit etwas mehr Anpassungsvermögen zu begegnen.",https://media0.faz.net/image/w1200h627/937d155dfefa/w3000h1567x0y216o/202601/43601.0.1657287872/es-waere-sonst-gar-nicht.webp,2026-01-12T18:09:14Z,,"Den Spruch haben Großmütter, bei Älteren auch noch die Mütter oder Väter bei jeder sich bietenden Gelegenheit fallen lassen: Es gibt kein schlechtes Wetter, nur unpassende Kleidung. Nicht, dass diese… [+2153 chars]",,de,'Schnee'
https://www.zeit.de/news/2026-01/13/wegen-glatteis-warnung-ist-vorsicht-geboten,https://www.zeit.de/news/2026-01/13/wegen-glatteis-warnung-ist-vorsicht-geboten,0,www.zeit.de,Unwetterwarnung: Wegen Glatteis-Warnung ist Vorsicht geboten,Hier finden Sie Informationen zu dem Thema „Unwetterwarnung“. Lesen Sie jetzt „Wegen Glatteis-Warnung ist Vorsicht geboten“.,https://img.zeit.de/news/2026-01/13/wegen-glatteis-warnung-ist-vorsicht-geboten-image-group/wide__1300x731,2026-01-13T01:30:04Z,,"Wegen der Glatteis-Warnungen des Deutschen Wetterdienstes (DWD) für die Region Berlin-Brandenburg, die schon ab Montagabend galten, ist auch heute Früh Vorsicht geboten. Straßen und Gehwege können tü… [+1676 chars]",,de,'Glatteis'
https://www.zeit.de/news/2026-01/13/vereinzelt-glatteis-gefahr-im-osten,https://www.zeit.de/news/2026-01/13/vereinzelt-glatteis-gefahr-im-osten,0,www.zeit.de,"Tief ""Gunda"": Vereinzelt Glatteis-Gefahr im Osten","Hier finden Sie Informationen zu dem Thema „Tief ""Gunda""“. Lesen Sie jetzt „Vereinzelt Glatteis-Gefahr im Osten“.",https://img.zeit.de/news/2026-01/13/vereinzelt-glatteis-gefahr-im-osten-image-group/wide__1300x731,2026-01-13T03:30:06Z,,"Nachdem sich die Wetterlage im Westen des Landes wieder beruhigt hat, ist vor allem in Teilen Ostdeutschlands noch Vorsicht wegen Glatteis geboten. Besonders im äußersten Osten und Nordosten besteht … [+2269 chars]",,de,'Glatteis'
https://www.stern.de/gesellschaft/regional/hamburg-schleswig-holstein/tierparks--hagenbeck--tiger-und-bisons-freuen-sich-ueber-den-schnee-37035214.html,https://www.stern.de/gesellschaft/regional/hamburg-schleswig-holstein/tierparks--hagenbeck--tiger-und-bisons-freuen-sich-ueber-den-schnee-37035214.html,0,www.stern.de,Tierparks: Hagenbeck: Tiger und Bisons freuen sich über den Schnee,Das frostige Winterwetter ist für die Zoos im Norden herausfordernd. Der Tierpark Hagenbeck hat wegen der Glätte geschlossen. Einige Tiere müssen angesichts der Temperaturen in die Innengehege.,https://image.stern.de/37035216/t/E6/v1/w1440/r1.7778/-/13--blain634djv3axs2048jpeg---645662ed02fbab3b.jpg,2026-01-13T04:30:07Z,,"Kopiere den aktuellen Link
Zur Merkliste hinzufügen
Das frostige Winterwetter ist für die Zoos im Norden herausfordernd. Der Tierpark Hagenbeck hat wegen der Glätte geschlossen. Einige Tiere müssen… [+3667 chars]",,de,'Heizkosten'
https://www.zeit.de/news/2026-01/13/hagenbeck-tiger-und-bisons-freuen-sich-ueber-den-schnee,https://www.zeit.de/news/2026-01/13/hagenbeck-tiger-und-bisons-freuen-sich-ueber-den-schnee,0,www.zeit.de,Tierparks: Hagenbeck: Tiger und Bisons freuen sich über den Schnee,Hier finden Sie Informationen zu dem Thema „Tierparks“. Lesen Sie jetzt „Hagenbeck: Tiger und Bisons freuen sich über den Schnee“.,https://img.zeit.de/news/2026-01/13/hagenbeck-tiger-und-bisons-freuen-sich-ueber-den-schnee-image-group/wide__1300x731,2026-01-13T04:30:07Z,,Den Tierparks im Norden macht der strenge Winter zu schaffen. Der Tierpark Hagenbeck in Hamburg hat wegen der Glätte durch Eis und Schnee seit vergangenem Freitag seine Pforten schließen müssen. Wann… [+3481 chars],,de,'Schnee'
https://www.zeit.de/news/2026-01/13/glatteis-bremst-pendler-und-sorgt-fuer-unfaelle-in-brandenburg,https://www.zeit.de/news/2026-01/13/glatteis-bremst-pendler-und-sorgt-fuer-unfaelle-in-brandenburg,0,www.zeit.de,Verkehr: Glatteis bremst Pendler und sorgt für Unfälle in Brandenburg,Hier finden Sie Informationen zu dem Thema „Verkehr“. Lesen Sie jetzt „Glatteis bremst Pendler und sorgt für Unfälle in Brandenburg“.,https://img.zeit.de/news/2026-01/13/glatteis-bremst-pendler-und-sorgt-fuer-unfaelle-in-brandenburg-image-group/wide__1300x731,2026-01-13T04:57:16Z,,"Glatte Straßen sorgen für Unfälle in Brandenburg. Bis zum frühen Morgen lag die Unfallzahl im unteren zweistelligen Bereich, wie der Lagedienst der Polizei mitteilte. Zunächst handelte es sich dabei … [+826 chars]",,de,'Glatteis'
https://www.zeit.de/politik/2026-01/friedrich-merz-indien-narendra-modi-nachrichtenpodcast,https://www.zeit.de/politik/2026-01/friedrich-merz-indien-narendra-modi-nachrichtenpodcast,0,www.zeit.de,Friedrich Merz in Indien: Ein neuer Freund in einer neuen Weltordnung?,Bundeskanzler Merz will die Partnerschaft mit Indien vertiefen. Was macht das Land für Deutschland so wichtig? Und: Halten wir nicht mal mehr drei Tage Winter aus?,https://img.zeit.de/politik/2017-09/illu-podcast-news/wide__8ed8a6__1300x731,2026-01-13T05:02:35Z,,Deutschland und Indien sollen bei der Rüstung künftig enger zusammenarbeiten. Darauf haben sich Bundeskanzler Friedrich Merz und Indiens Premierminister Narendra Modi verständigt. Die beiden unterzei… [+2003 chars],,de,'Winter'
https://www.tagesschau.de/wetter/deutschland/glaette-unfaelle-krankenhaeuser-100.html,https://www.tagesschau.de/wetter/deutschland/glaette-unfaelle-krankenhaeuser-100.html,0,www.tagesschau.de,"Krankenhauschef: Notaufnahmen durch Glatteisunfälle ""extrem belastet""","Unfälle durch Glatteis haben in den vergangenen Tagen die Notaufnahmen laut dem Chef der Deutschen Krankenhausgesellschaft ""extrem belastet"". Auch heute muss in einigen Landesteilen noch mit Glätte gerechnet werden.",https://images.tagesschau.de/image/e5cffce1-78ae-4f42-8182-ddc1178b4647/AAABm7XORkM/AAABmyZE0EA/16x9-big/schild-notaufnahme-100.jpg?width=1280,2026-01-13T05:22:33Z,,"Stand: 13.01.2026 06:22 Uhr
Unfälle durch Glatteis haben in den vergangenen Tagen die Notaufnahmen laut dem Chef der Deutschen Krankenhausgesellschaft ""extrem belastet"". Auch heute muss in einigen L… [+1249 chars]",,de,'Glatteis'
https://www.stern.de/gesellschaft/regional/sachsen/glatteis--winterdienst-in-dresden-seit-dem-fruehen-morgen-im-einsatz-37035554.html,https://www.stern.de/gesellschaft/regional/sachsen/glatteis--winterdienst-in-dresden-seit-dem-fruehen-morgen-im-einsatz-37035554.html,0,www.stern.de,Glatteis: Winterdienst in Dresden seit dem frühen Morgen im Einsatz,Dresden (sn) - In Dresden ist der Winterdienst seit den frühen Morgenstunden im Einsatz. Der Sprühregen bei Bodenfrost habe Straßen und Fußwege teils in,https://image.stern.de/37035556/t/ew/v1/w1440/r1.7778/-/13--dprv3naiaav6axs2048jpeg---f9a99e9eedcd451a.jpg,2026-01-13T07:23:31Z,,"Kopiere den aktuellen Link
Zur Merkliste hinzufügen
Sprühregen trifft Bodenfrost und verwandelt viele Straßen in Rutschbahnen. Dresdens Winterdienst rückt mit 42 Streuwagen aus.
In Dresden ist der… [+407 chars]",,de,'Glatteis'
https://www.zeit.de/news/2026-01/13/winterdienst-in-dresden-seit-dem-fruehen-morgen-im-einsatz,https://www.zeit.de/news/2026-01/13/winterdienst-in-dresden-seit-dem-fruehen-morgen-im-einsatz,0,www.zeit.de,Glatteis: Winterdienst in Dresden seit dem frühen Morgen im Einsatz,Hier finden Sie Informationen zu dem Thema „Glatteis“. Lesen Sie jetzt „Winterdienst in Dresden seit dem frühen Morgen im Einsatz“.,https://img.zeit.de/news/2026-01/13/winterdienst-in-dresden-seit-dem-fruehen-morgen-im-einsatz-image-group/wide__1300x731,2026-01-13T07:23:31Z,,"In Dresden ist der Winterdienst seit den frühen Morgenstunden im Einsatz. Der Sprühregen bei Bodenfrost habe Straßen und Fußwege teils in gefährliche Rutschbahnen verwandelt, teilte die Stadt mit. Se… [+266 chars]",,de,'Glatteis'
https://www.zeit.de/news/2026-01/13/wenige-unfaelle-durch-glatteis-am-morgen-in-mv,https://www.zeit.de/news/2026-01/13/wenige-unfaelle-durch-glatteis-am-morgen-in-mv,0,www.zeit.de,Glatteis: Wenige Unfälle durch Glatteis am Morgen in MV,Hier finden Sie Informationen zu dem Thema „Glatteis“. Lesen Sie jetzt „Wenige Unfälle durch Glatteis am Morgen in MV“.,https://img.zeit.de/news/2026-01/13/wenige-unfaelle-durch-glatteis-am-morgen-in-mv-image-group/wide__1300x731,2026-01-13T07:26:31Z,,"Das Blitzeis in der Nacht und am Morgen hat laut Polizei nur zu einzelnen Unfällen geführt. Verletzt wurde nach Angaben der beiden Polizeipräsidien in Rostock und Neubrandenburg dabei niemand. 
Aus … [+648 chars]",,de,'Glatteis'
https://www.stern.de/gesellschaft/regional/mecklenburg-vorpommern/glatteis--wenige-unfaelle-durch-glatteis-am-morgen-in-mv-37035558.html,https://www.stern.de/gesellschaft/regional/mecklenburg-vorpommern/glatteis--wenige-unfaelle-durch-glatteis-am-morgen-in-mv-37035558.html,0,www.stern.de,Glatteis: Wenige Unfälle durch Glatteis am Morgen in MV,Rostock/Neubrandenburg (mv) - Das Blitzeis in der Nacht und am Morgen hat laut Polizei nur zu einzelnen Unfällen geführt. Verletzt wurde nach Angaben der,https://image.stern.de/37035560/t/lb/v1/w1440/r1.7778/-/13--jya5tzm67yv12axs2048jpeg---4663fae64588084e.jpg,2026-01-13T07:26:31Z,,"Kopiere den aktuellen Link
Zur Merkliste hinzufügen
Die Unwetterwarnung wird in MV offenbar beherzigt. Die Polizei meldet nur vereinzelte Unfälle wegen eisglatter Straßen.
Das Blitzeis in der Nach… [+783 chars]",,de,'Glatteis'
https://orf.at/stories/3416972/,https://orf.at/stories/3416972/,0,orf.at,"Unfälle, Flughafen Wien-Schwechat gesperrt","Der gefrierende Regen, der nach dem Westen in der Nacht auf Dienstag auch im Osten eingesetzt hat, verursacht spiegelglatte Straßen und damit erhebliche Behinderungen im Verkehr. Der Flughafen Wien-Schwechat wird aufgrund von Glatteis sogar bis 11.00 Uhr gesp…",https://ibs.orf.at/news?image=https%3A%2F%2Fassets.orf.at%2Fmims%2F2026%2F03%2F02%2Fcrops%2Fw%3D1200%2Ch%3D630%2Cq%3D75%2F2895333_master_1118602_glatteis_verkehr_unfaelle_body02_a.jpg%3Fs%3Dc8f82dff5f19c666d3a03265d9c5f00b9b8368bc,2026-01-13T07:42:54Z,,"Passagieren und Passagierinnen wurde empfohlen, den Status ihres Fluges auf den Websites der Fluglinien zu überprüfen. Ankommende Flüge wurden zu anderen Flughäfen, darunter München, Frankfurt, Köln … [+3733 chars]",,de,'Glatteis'
https://www.welt.de/regionales/hamburg/article6965ece63f5472014dc5f7f0/elbtunnel-wegen-eisplanken-gesperrt-das-wird-uns-auch-tagsueber-beschaeftigen-hamburgs-winter-bleibt-tueckisch.html,https://www.welt.de/regionales/hamburg/article6965ece63f5472014dc5f7f0/elbtunnel-wegen-eisplanken-gesperrt-das-wird-uns-auch-tagsueber-beschaeftigen-hamburgs-winter-bleibt-tueckisch.html,0,www.welt.de,„Das wird uns auch tagsüber beschäftigen“ – Hamburgs Winter bleibt tückisch,"Zwar wird es in Hamburg wärmer, aber auch regnerisch – und das sorgt auf den Straßen für neue Probleme, zum Beispiel am Elbtunnel. Aber auch der schmelzende Schnee bringt für Hausbesitzer Herausforderungen. Eine S-Bahn-Fahrt endet im Chaos.",https://images.welt.de/6965ece63f5472014dc5f7f0/e59792ab2d3464dc444a7ee2d1cca632-master/ci16x9-w1200/dpa-com-20090101-260113-911-003650-jpg,2026-01-13T07:45:18Z,,"Zwar wird es in Hamburg wärmer, aber auch regnerisch und das sorgt auf den Straßen für neue Probleme, zum Beispiel am Elbtunnel. Aber auch der schmelzende Schnee bringt für Hausbesitzer Herausforderu… [+3126 chars]",,de,'Glatteis'
https://www.stern.de/news/glatteis--enspannung-im-westen---im-osten-teils-noch-rutschig-37035598.html,https://www.stern.de/news/glatteis--enspannung-im-westen---im-osten-teils-noch-rutschig-37035598.html,0,www.stern.de,Glatteis: Enspannung im Westen - im Osten teils noch rutschig,"Während sich die Glatteissituation in den westlichen Landesteilen am Dienstag entspannte, gab es im Osten und teils auch noch in Bayern vielfach noch rutschige Straßen und Wege. Nach Angaben des Deutschen Wetterdienstes (DWD) in Offenbach erreichten die Regen…",https://image.stern.de/37035600/t/0m/v1/w1440/r1.7778/-/13--eiszapfen---bff36efddc5ed47b.jpg,2026-01-13T07:48:37Z,,"Kopiere den aktuellen Link
Zur Merkliste hinzufügen
Während sich die Glatteissituation in den westlichen Landesteilen am Dienstag entspannte, gab es im Osten und teils auch noch in Bayern vielfach … [+1820 chars]",,de,'Glatteis'
https://www.sueddeutsche.de/bayern/gunda-eisregen-unfaelle-bayern-bilanz-glaette-li.3367787,https://www.sueddeutsche.de/bayern/gunda-eisregen-unfaelle-bayern-bilanz-glaette-li.3367787,0,www.sueddeutsche.de,Unfälle in Bayern: Bis zu zwei Zentimeter dickes Eis:  Sturmtief „Gunda“ verursacht Verkehrschaos,"Glatteis, Massenkarambolagen, blockierte Straßen: In weiten Teilen Bayerns hatte die Polizei in der Nacht auf Dienstag viel zu tun. Selbst Streufahrzeuge kamen nicht mehr vorwärts.",https://www.sueddeutsche.de/2026/01/13/577cf8ba-a6cc-43bd-b4fa-607189597cf9.jpg?q=60&fm=webp&width=1200&rect=0%2C0%2C2048%2C1152,2026-01-13T07:54:30Z,,"In Niederbayern zählte die Polizei seit Montagabend mindestens 18 Unfälle auf spiegelglatten Straßen. Fünf Menschen seien leicht verletzt worden.
Im oberfränkischen Lichtenfels wurden 13 Menschen be… [+2198 chars]",,de,'Glatteis'
https://www.stern.de/gesellschaft/regional/mecklenburg-vorpommern/glatteis--unwetterwarnung-fuer-westen-des-landes-aufgehoben-37035790.html,https://www.stern.de/gesellschaft/regional/mecklenburg-vorpommern/glatteis--unwetterwarnung-fuer-westen-des-landes-aufgehoben-37035790.html,0,www.stern.de,Glatteis: Unwetterwarnung für Westen des Landes aufgehoben,Schwerin/Stralsund (mv) - Der Deutsche Wetterdienst (DWD) hat seine Unwetterwarnung wegen des Glatteises für den Westteil Mecklenburg-Vorpommerns,https://image.stern.de/37035792/t/Hi/v1/w1440/r1.7778/-/13--gxv3b42jf7v7axs2048jpeg---cd897782e47f4029.jpg,2026-01-13T08:00:41Z,,"Kopiere den aktuellen Link
Zur Merkliste hinzufügen
Trotzdem heißt es vorsichtig bleiben. Eine Warnung vor markanter Glätte gibt es für den Westen des Landes immer noch.
Der Deutsche Wetterdienst … [+331 chars]",,de,'Glatteis'
https://www.zeit.de/news/2026-01/13/unwetterwarnung-fuer-westen-des-landes-aufgehoben,https://www.zeit.de/news/2026-01/13/unwetterwarnung-fuer-westen-des-landes-aufgehoben,0,www.zeit.de,Glatteis: Unwetterwarnung für Westen des Landes aufgehoben,Hier finden Sie Informationen zu dem Thema „Glatteis“. Lesen Sie jetzt „Unwetterwarnung für Westen des Landes aufgehoben“.,https://img.zeit.de/news/2026-01/13/unwetterwarnung-fuer-westen-des-landes-aufgehoben-image-group/wide__1300x731,2026-01-13T08:00:41Z,,Der Deutsche Wetterdienst (DWD) hat seine Unwetterwarnung wegen des Glatteises für den Westteil Mecklenburg-Vorpommerns aufgehoben. Seit 8.00 Uhr gilt nur noch eine amtliche Warnung vor «markanter Gl… [+198 chars],,de,'Glatteis'
https://wien.orf.at/stories/3337570/,https://wien.orf.at/stories/3337570/,0,wien.orf.at,Glatteis sorgt für Verkehrseinschränkungen,Wegen des Glatteises ist auf dem Flughafen Wien der Betrieb vorläufig eingestellt worden. Bis etwa 11.00 Uhr soll die Sperre andauern. Bei den ÖBB gibt es eine Reisewarnung. Nicht dringende Reisen sollen verschoben werden.,https://ibs.orf.at/wie?image=https%3A%2F%2Foekastatic.orf.at%2Fmims%2F2026%2F03%2F13%2Fcrops%2Fw%3D1200%2Ch%3D627%2Cq%3D75%2F2895362_master_1118613_img_1420.jpg%3Fs%3D9f652288c832a74aa8cae3796afa22452be7e0cc,2026-01-13T08:01:48Z,,"Auf dem gesamten Vorfeld am Flughafen Wien, den Rollwegen und den Pisten habe sich eine dicke Eisschicht gebildet, die unmittelbar nach der Enteisung sofort neu gefriert, erläuterte Flughafensprecher… [+1491 chars]",,de,'Glatteis'
https://www.stern.de/gesellschaft/regional/berlin-brandenburg/wetter--glatteis-bremst-verkehr-in-berlin-und-brandenburg-aus-37035538.html,https://www.stern.de/gesellschaft/regional/berlin-brandenburg/wetter--glatteis-bremst-verkehr-in-berlin-und-brandenburg-aus-37035538.html,0,www.stern.de,Wetter: Glatteis bremst Verkehr in Berlin und Brandenburg aus,Berlin/Potsdam (bb) - Glatteis auf den Straßen hat in Berlin und Brandenburg zu Einschränkungen und Unfällen geführt. In Brandenburg lag die Unfallzahl,https://image.stern.de/37036024/t/T6/v1/w1440/r1.7778/-/13--y35tbyefnqv5axs2048jpeg---e3057764a35bb558.jpg,2026-01-13T08:27:25Z,,"Kopiere den aktuellen Link
Zur Merkliste hinzufügen
Laster im Graben, Busverkehr gestoppt: Glatteis sorgt in Berlin und Brandenburg für Einschränkungen.
Glatteis auf den Straßen hat in Berlin und … [+2719 chars]",,de,'Glatteis'
https://www.stern.de/panorama/wetter--glatteis--betrieb-auf-airport-wien-voruebergehend-eingestellt-37036078.html,https://www.stern.de/panorama/wetter--glatteis--betrieb-auf-airport-wien-voruebergehend-eingestellt-37036078.html,0,www.stern.de,Wetter: Glatteis: Betrieb auf Airport Wien vorübergehend eingestellt,"Kaum ist das Glatteis bekämpft, bildet es sich erneut. Auf dem Flughafen von Österreichs Hauptstadt geht wohl bis zum Mittag nichts mehr. Ankommende Flugzeuge werden umgeleitet.",https://image.stern.de/37036080/t/YF/v1/w1440/r1.7778/-/13--cac2w2xpvwv8axs2048jpeg---30d3135348398e04.jpg,2026-01-13T08:34:53Z,,"Kopiere den aktuellen Link
Zur Merkliste hinzufügen
Kaum ist das Glatteis bekämpft, bildet es sich erneut. Auf dem Flughafen von Österreichs Hauptstadt geht wohl bis zum Mittag nichts mehr. Ankomme… [+674 chars]",,de,'Glatteis'
https://www.zeit.de/news/2026-01/13/glatteis-betrieb-auf-airport-wien-voruebergehend-eingestellt,https://www.zeit.de/news/2026-01/13/glatteis-betrieb-auf-airport-wien-voruebergehend-eingestellt,0,www.zeit.de,Wetter: Glatteis: Betrieb auf Airport Wien vorübergehend eingestellt,Hier finden Sie Informationen zu dem Thema „Wetter“. Lesen Sie jetzt „Glatteis: Betrieb auf Airport Wien vorübergehend eingestellt“.,https://img.zeit.de/news/2026-01/13/glatteis-betrieb-auf-airport-wien-voruebergehend-eingestellt-image-group/wide__1300x731,2026-01-13T08:34:53Z,,"Auf dem Flughafen Wien ist der Betrieb witterungsbedingt vorläufig eingestellt worden. «Wir gehen davon aus, dass die Situation jedenfalls noch bis etwa 11.00 Uhr so anhalten wird», teilte ein Sprech… [+481 chars]",,de,'Glatteis'
https://www.tagesspiegel.de/gesellschaft/panorama/wetter-glatteis-betrieb-auf-airport-wien-vorubergehend-eingestellt-15131114.html,https://www.tagesspiegel.de/gesellschaft/panorama/wetter-glatteis-betrieb-auf-airport-wien-vorubergehend-eingestellt-15131114.html,0,www.tagesspiegel.de,Wetter: Glatteis: Betrieb auf Airport Wien vorübergehend eingestellt,"Kaum ist das Glatteis bekämpft, bildet es sich erneut. Auf dem Flughafen von Österreichs Hauptstadt geht wohl bis zum Mittag nichts mehr. Ankommende Flugzeuge werden umgeleitet.",https://www.tagesspiegel.de/images/15131113/alternates/BASE_16_9_W1400/1768293368000/glatteis-auf-dem-wiener-flughafen-fuhrt-zu-problemen.jpeg,2026-01-13T08:36:08Z,,"Auf dem Flughafen Wien ist der Betrieb witterungsbedingt vorläufig eingestellt worden. Wir gehen davon aus, dass die Situation jedenfalls noch bis etwa 11.00 Uhr so anhalten wird, teilte ein Sprecher… [+533 chars]",,de,'Glatteis'
