index,url,valid,domain,title,description,image,published,archive,content,quote,language,keyword
https://science.orf.at/stories/3219101/,https://science.orf.at/stories/3219101/,0,science.orf.at,Sonnblick: Höchstwerte bei Treibhausgasen,Noch nie war die am Sonnblick Observatorium auf 3.100 Metern Seehöhe gemessene Konzentration von klimaschädlichem Kohlendioxid (CO2) und Methan (CH4) so hoch wie aktuell. Das teilte Geosphere Austria am Mittwoch mit. Die beiden Treibhausgase sind die stärkste…,https://ibs.orf.at/science?image=https%3A%2F%2Ftubestatic.orf.at%2Fmojo%2F1_4_1%2Fstoryserver%2Ftube%2Fscience%2Fimages%2Fog-fallback.jpg%3Fs%3D9468ebfda8d575e29237d4fe069891178635d8e1,2023-05-03T11:56:20Z,,"Im April 2023 lag das Monatsmittel der Konzentration von Kohlendioxid bei 425,3 ppm (parts per million Teilchen CO2 pro Millionen Teilchen). Der Wert von Methan lag bei 2,014 ppm. Es ist 25-mal klima… [+4175 chars]",,de,'Schnee'
https://www.diepresse.com/6283252/hoechstwerte-von-klimaschaedlichem-co2-und-methan-am-sonnblick-gemessen,https://www.diepresse.com/6283252/hoechstwerte-von-klimaschaedlichem-co2-und-methan-am-sonnblick-gemessen,0,www.diepresse.com,Höchstwerte von klimaschädlichem CO₂ und Methan am Sonnblick gemessen,"Kohlendioxid (CO₂) trägt zwei Drittel zum Treibhauseffekt bei, Methan 16 Prozent. Letzteres ist sehr viel klimaschädlicher als CO₂, hält sich aber weniger lang in der Atmosphäre.",https://media.diepresse.com/social_diepresse_nachrichten/images/uploads_1200/f/f/4/6283252/EDF4D0A0-EE7F-432A-B04F-7A792E44D830_v0_h.jpg,2023-05-03T12:17:00Z,,"Kohlendioxid (CO) trägt zwei Drittel zum Treibhauseffekt bei, Methan 16 Prozent. Letzteres ist sehr viel klimaschädlicher als CO, hält sich aber weniger lang in der Atmosphäre.
Noch nie war die am S… [+4733 chars]",,de,'Schnee'
https://www.tagesspiegel.de/wirtschaft/gazprom-als-grosster-leidtragender-gasforderung-in-russland-um-zehn-prozent-gesunken-9757103.html,https://www.tagesspiegel.de/wirtschaft/gazprom-als-grosster-leidtragender-gasforderung-in-russland-um-zehn-prozent-gesunken-9757103.html,0,www.tagesspiegel.de,Gazprom als größter Leidtragender: Gasförderung in Russland um zehn Prozent gesunken,"Wie eine russische Tageszeitung berichtet, leidet Russland spürbar darunter, dass Europa weniger Gas kauft. Allein Gazprom verzeichnet demnach einen Produktionsrückgang von 18 Prozent.",https://www.tagesspiegel.de/images/imago0167844359hjpg/alternates/BASE_16_9_W1400/imago0167844359hjpg.jpeg,2023-05-03T12:20:32Z,,Vor dem Hintergrund sinkender Lieferungen nach Europa ist die Gasförderung in Russland Medien zufolge im ersten Quartal 2023um zehn Prozent gesunken. Von Januar bis März seien nur noch 180 Milliarden… [+2127 chars],,de,'Gas'
https://www.tagesspiegel.de/berlin/berliner-wirtschaft/blackout-an-der-berliner-charite-kurzschluss-fuhrte-zu-schliessung-der-rettungsstelle-9756524.html,https://www.tagesspiegel.de/berlin/berliner-wirtschaft/blackout-an-der-berliner-charite-kurzschluss-fuhrte-zu-schliessung-der-rettungsstelle-9756524.html,0,www.tagesspiegel.de,Blackout in der Charité: Kurzschluss führt zu Schließung der Rettungsstelle,Die Notaufnahme der Charité musste in der Nacht zu Mittwoch kurzzeitig schließen. Die Kühlung fiel wegen eines Stromausfalls aus.,https://www.tagesspiegel.de/images/coronavirus-berlin12/alternates/BASE_16_9_W1400/coronavirus---berlin.jpeg,2023-05-03T12:22:56Z,https://web.archive.org/web/20230503143131/https://www.tagesspiegel.de/berlin/berliner-wirtschaft/blackout-an-der-berliner-charite-kurzschluss-fuhrte-zu-schliessung-der-rettungsstelle-9756524.html,"In der Nacht zu Mittwoch ist in der Charité der Strom ausgefallen. Die Feuerwehr war mit einem Großaufgebot an Rettungskräften vor Ort. Der Einsatz dauerte vier Stunden, zeitweise musste die Rettungs… [+2400 chars]",,de,'Blackout'
https://www.tagesspiegel.de/internationales/nach-nord-stream-anschlag-nato-will-unterwasser-infrastruktur-besser-schutzen-9757364.html,https://www.tagesspiegel.de/internationales/nach-nord-stream-anschlag-nato-will-unterwasser-infrastruktur-besser-schutzen-9757364.html,0,www.tagesspiegel.de,Nach Nord-Stream-Anschlag : Nato will Unterwasser-Infrastruktur besser schützen,"Die Nato warnt vor weiteren Sabotageakten. Dabei geht es nicht nur um Gas. Weltweit liegen allein 1,3 Millionen Datenkabel auf dem Meeresgrund.",https://www.tagesspiegel.de/images/gasleck-bei-nord-stream-23/alternates/BASE_16_9_W1400/gasleck-bei-nord-stream-2.jpeg,2023-05-03T12:28:20Z,,Die Nato will nach dem Anschlag auf die Nord-Stream-Pipelines Unterwasser-Pipelines sowie Strom- und Datenkabel auf dem Meeresgrund besser schützen. Der Anschlag auf die Nord-Stream-Pipelines im Sept… [+2525 chars],,de,'Gas'
https://www.morgenpost.de/ratgeber/article238113991/waermepumpe-kosten-gasheizung-vergleich-hausbesitzer.html,https://www.morgenpost.de/ratgeber/article238113991/waermepumpe-kosten-gasheizung-vergleich-hausbesitzer.html,0,www.morgenpost.de,Die Kosten der Wärmewende: Kosten von Wärmepumpe: Vergleich zur Gasheizung überrascht,"Gas- oder Wärmepumpe? Eine neue Analyse deckt auf, welches Heizsystem auf Dauer günstiger ist. Selbst Experten sind von den Ergebnissen überrascht.",https://img.morgenpost.de/img/wirtschaft/crop238182315/5152608954-w820-cv16_9-q85/0dde4a82-deba-11ed-ae46-47d421ede403.jpg,2023-05-03T13:19:00Z,,Berlin. <ul><li>Ab dem Jahr 2024 wird in Deutschland ein stufenweiser Wechsel zu umweltfreundlichen Heizsystemen für Immobilienbesitzer angestrebt</li><li>Die Wirtschaftlichkeit einer Wärmepumpe im F… [+7219 chars],,de,'Gas'
https://www.morgenpost.de/ratgeber/article238235641/waermepumpen-installation-planung-leitfaden.html,https://www.morgenpost.de/ratgeber/article238235641/waermepumpen-installation-planung-leitfaden.html,0,www.morgenpost.de,Wärmewende: So planen und installieren Sie die Wärmepumpe richtig,"Was ist bei der Planung und Installation der Wärmepumpe im Vergleich zur Gas- und Ölheizung zu beachten? Lesen Sie hier, was Eigentümer beachten sollten.",https://img.morgenpost.de/img/incoming/crop238244047/4262604695-w820-cv16_9-q85/c80fbedc-e4d1-11ed-9969-b223e84e6b4a.jpg,2023-05-03T14:22:32Z,,Berlin. Die Nachfrage nach Wärmepumpen für die Heizungssanierung im Gebäudebestand nimmt stark zu. Und mit der bevorstehenden Wärmewende wird sich der Trend zur Wärmepumpe in den nächsten Jahren noch… [+10936 chars],,de,'Gas'
https://www.handelsblatt.com/finanzen/steuern-recht/steuern/erdgas-waerme-soforthilfegesetz-ist-die-besteuerung-der-gas-soforthilfe-systemwidrig-/29116366.html,https://www.handelsblatt.com/finanzen/steuern-recht/steuern/erdgas-waerme-soforthilfegesetz-ist-die-besteuerung-der-gas-soforthilfe-systemwidrig-/29116366.html,0,www.handelsblatt.com,Erdgas-Wärme-Soforthilfegesetz: Ist die Besteuerung der Gas-Soforthilfe systemwidrig?,Im Dezember mussten Bürger mit Gas- oder Fernwärme-Heizung keinen Abschlag zahlen. Manche müssen diese Entlastung allerdings als Einkommen versteuern. Weshalb das problematisch ist.,https://www.handelsblatt.com/images/heizung/29116694/2-format2003.jpg,2023-05-03T14:25:00Z,,Frankfurt Die Bundesregierung brachte wegen der gestiegenen Gaspreise infolge des Ukrainekriegs eine Soforthilfe auf den Weg. Die Kosten für den Dezember-Abschlag übernahm der Bund.Technisch wurde di… [+3974 chars],,de,'Gas'
https://www.zeit.de/news/2023-05/03/zwei-kinder-in-schule-in-berlin-neukoelln-von-mann-verletzt,https://www.zeit.de/news/2023-05/03/zwei-kinder-in-schule-in-berlin-neukoelln-von-mann-verletzt,0,www.zeit.de,Kriminalität: Zwei Kinder in Schule in Berlin-Neukölln von Mann verletzt,,,2023-05-03T15:00:29Z,https://web.archive.org/web/20230504235613/https://www.zeit.de/news/2023-05/03/zwei-kinder-in-schule-in-berlin-neukoelln-von-mann-verletzt,"When browsing with ads:
We collect personal data and also transmit it to third-party providers
 that help us improve and finance our digital content. Some of the information stored on your device, … [+732 chars]",,de,'Kinder'
https://kaernten.orf.at/stories/3205787/,https://kaernten.orf.at/stories/3205787/,0,kaernten.orf.at,Neuer Standort für jahrhundertealtes Haus,"Das vom Schimmel befallene, radonbelastete Bauernhaus aus dem 15. Jahrhundert von Familie Gorgasser soll abgetragen und entlang der Großglocknerstraße wieder aufgebaut werden. Im Gegenzug könnte die Familie am alten Standort ein neues Haus errichten. Noch im …",https://ibs.orf.at/ktn?image=https%3A%2F%2Foekastatic.orf.at%2Fmims%2F2019%2F30%2F83%2Fcrops%2Fw%3D1200%2Ch%3D627%2Cq%3D75%2F235334_master_67583_on-2019-07-24-12h04m14s382.jpg%3Fs%3D8527b76930ca4fc6ffa4c8a0a2a9da3e5acb0f12,2023-05-03T15:07:30Z,,"Er sei sehr erleichtert, dass Bewegung in die Sache komme, aber konkrete Pläne gebe es nach wie vor nicht, sagt Christian Gorgasser, der Besitzer des Hofes in Apriach. Das Bauernhaus ist das älteste … [+1453 chars]",,de,'Schimmel'
https://www.zeit.de/news/2023-05/03/zwei-kinder-auf-schulhof-in-berlin-angegriffen-und-verletzt,https://www.zeit.de/news/2023-05/03/zwei-kinder-auf-schulhof-in-berlin-angegriffen-und-verletzt,0,www.zeit.de,Gewaltdelikt: Zwei Kinder auf Schulhof in Berlin angegriffen und verletzt,,,2023-05-03T15:32:29Z,https://web.archive.org/web/20230504235551/https://www.zeit.de/news/2023-05/03/zwei-kinder-auf-schulhof-in-berlin-angegriffen-und-verletzt,"When browsing with ads:
We collect personal data and also transmit it to third-party providers
 that help us improve and finance our digital content. Some of the information stored on your device, … [+732 chars]",,de,'Kinder'
https://www.welt.de/politik/deutschland/plus245135772/Lauterbachs-Steuergeld-Segen-fuer-die-Krankenhaeuser-unabhaengig-vom-Bedarf.html,https://www.welt.de/politik/deutschland/plus245135772/Lauterbachs-Steuergeld-Segen-fuer-die-Krankenhaeuser-unabhaengig-vom-Bedarf.html,0,www.welt.de,Lauterbachs Steuergeld-Segen für die Krankenhäuser – unabhängig vom Bedarf,Gesundheitsminister Lauterbach (SPD) will Krankenhäusern milliardenschwere Hilfen als Ausgleich für Energiekosten bereitstellen. Allerdings soll das Geld größtenteils pauschal gezahlt werden – ohne Prüfung des Bedarfs. Eine wichtige Lehre aus der Pandemie sch…,https://img.welt.de/img/politik/deutschland/mobile245135762/1121350547-ci16x9-w1200-fnov-fpotl-fpi157750653/BM-Lauterbach-BPK-Cannabis-Gesetzesplaene-2.jpg,2023-05-03T15:56:44Z,https://web.archive.org/web/20230503163842/https://www.welt.de/politik/deutschland/plus245135772/Lauterbachs-Steuergeld-Segen-fuer-die-Krankenhaeuser-unabhaengig-vom-Bedarf.html,"Die WELT als ePaper: Die vollständige Ausgabe steht Ihnen bereits am Vorabend zur Verfügung so sind Sie immer hochaktuell informiert. Weitere Informationen: http://epaper.welt.de 
 Der Kurz-Link die… [+49 chars]",,de,'Energiekosten'
https://www.zeit.de/news/2023-05/03/nach-messerattacke-an-schule-alle-kinder-bei-ihren-eltern,https://www.zeit.de/news/2023-05/03/nach-messerattacke-an-schule-alle-kinder-bei-ihren-eltern,0,www.zeit.de,Kriminalität: Nach Messerattacke an Schule: Alle Kinder bei ihren Eltern,,,2023-05-03T16:31:21Z,https://web.archive.org/web/20230504235605/https://www.zeit.de/news/2023-05/03/nach-messerattacke-an-schule-alle-kinder-bei-ihren-eltern,"When browsing with ads:
We collect personal data and also transmit it to third-party providers
 that help us improve and finance our digital content. Some of the information stored on your device, … [+732 chars]",,de,'Kinder'
https://www.zeit.de/news/2023-05/03/baerbock-appelliert-an-tv-neuendorf-warnt-vor-blackout,https://www.zeit.de/news/2023-05/03/baerbock-appelliert-an-tv-neuendorf-warnt-vor-blackout,0,www.zeit.de,Medien: Baerbock appelliert an TV: Neuendorf warnt vor «Blackout»,,,2023-05-03T17:38:29Z,https://web.archive.org/web/20230504235907/https://www.zeit.de/news/2023-05/03/baerbock-appelliert-an-tv-neuendorf-warnt-vor-blackout,"When browsing with ads:
We collect personal data and also transmit it to third-party providers
 that help us improve and finance our digital content. Some of the information stored on your device, … [+732 chars]",,de,'Blackout'
https://www.horizont.net/medien/nachrichten/rechtevergabe-dfb-chef-bernd-neuendorf-warnt-vor-blackout-bei-frauen-wm-211646,https://www.horizont.net/medien/nachrichten/rechtevergabe-dfb-chef-bernd-neuendorf-warnt-vor-blackout-bei-frauen-wm-211646,0,www.horizont.net,"Rechtevergabe: DFB-Chef Bernd Neuendorf warnt vor ""Blackout"" bei Frauen-WM","Außenministerin Annalena Baerbock (Grüne) setzt in der Debatte um die Vergabe der TV-Rechte für die Fußball-WM der Frauen auf die öffentlich-rechtlichen TV-Sender. ""Das Eine ist die FIFA, an die wir eindringlich appellieren können, das Andere sind die öffentl…",https://www.horizont.net/news/media/41/Bernd-Neuendorf--Annalena-Baerbock--IMAGO-406651.jpeg,2023-05-04T05:42:00Z,https://web.archive.org/web/20230506100120/https://www.horizont.net/medien/nachrichten/rechtevergabe-dfb-chef-bernd-neuendorf-warnt-vor-blackout-bei-frauen-wm-211646,"Außenministerin Annalena Baerbock (Grüne) setzt in der Debatte um die Vergabe der TV-Rechte für die Fußball-WM der Frauen auf die öffentlich-rechtlichen TV-Sender. ""Das Eine ist die FIFA, an die wir … [+1987 chars]",,de,'Blackout'
https://www.welt.de/sport/fussball/video245140346/Eindringlicher-Appell-Baerbock-warnt-vor-TV-Blackout-bei-der-Frauen-WM.html,https://www.welt.de/sport/fussball/video245140346/Eindringlicher-Appell-Baerbock-warnt-vor-TV-Blackout-bei-der-Frauen-WM.html,0,www.welt.de,Baerbock warnt vor TV-Blackout bei der Frauen-WM,Außenministerin Annalena Baerbock hat vor einem TV-Blackout bei der Fußball-Weltmeisterschaft der Frauen gewarnt. Bei einem WM-Kick-off-Event im Auswärtigen Amt in Berlin richtete sie einen „eindringlichen Appell“ an die FIFA und die öffentlich-rechtlichen Se…,https://img.welt.de/img/sport/fussball/mobile245140474/2371356937-ci16x9-w1200/WM-Kick-Off-im-Auswaertigen-Amt.jpg,2023-05-04T07:33:40Z,https://web.archive.org/web/20230504230624/http://www.welt.de/sport/fussball/video245140346/Eindringlicher-Appell-Baerbock-warnt-vor-TV-Blackout-bei-der-Frauen-WM.html,"Die WELT als ePaper: Die vollständige Ausgabe steht Ihnen bereits am Vorabend zur Verfügung so sind Sie immer hochaktuell informiert. Weitere Informationen: http://epaper.welt.de 
 Der Kurz-Link die… [+49 chars]",,de,'Blackout'
https://www.zeit.de/video/2023-05/6326721171112/berlin-mann-verletzt-zwei-kinder-bei-messerangriff-an-schule-schwer,https://www.zeit.de/video/2023-05/6326721171112/berlin-mann-verletzt-zwei-kinder-bei-messerangriff-an-schule-schwer,0,www.zeit.de,Berlin: Mann verletzt zwei Kinder bei Messerangriff an Schule schwer,Die beiden sieben und acht Jahre alten Kinder wurden in ein Krankenhaus gebracht. Der Verdächtige ist in Haft. Hintergründe und das Tatmotiv sind noch nicht bekannt.,,2023-05-04T09:14:02Z,,"When browsing with ads:
We collect personal data and also transmit it to third-party providers
 that help us improve and finance our digital content. Some of the information stored on your device, … [+732 chars]",,de,'Kinder'
https://www.welt.de/sport/article245140260/Frauen-WM-Baerbock-schaltet-sich-in-Diskussion-um-TV-Blackout-ein.html,https://www.welt.de/sport/article245140260/Frauen-WM-Baerbock-schaltet-sich-in-Diskussion-um-TV-Blackout-ein.html,0,www.welt.de,Baerbock schaltet sich in Diskussion um TV-Blackout ein,"Fifa-Präsident Infantino will die TV-Rechte an der Frauen-Fußball-WM nicht an deutsche Sender vergeben, wenn die nicht den geforderten Preis bezahlen. Außenministerin Baerbock setzt nun auf die öffentlich-rechtlichen Sender.",https://img.welt.de/img/sport/mobile245140700/2571354327-ci16x9-w1200/WM-Kick-Off-im-Auswaertigen-Amt.jpg,2023-05-04T10:52:22Z,https://web.archive.org/web/20230506123810/https://www.welt.de/sport/article245140260/Frauen-WM-Baerbock-schaltet-sich-in-Diskussion-um-TV-Blackout-ein.html,"An diesem Donnerstag sind es noch 77 Tage bis zum Beginn der Fußball-WM der Frauen. Folgt man einer repräsentativen Umfrage von Appinio, dann hat zum einen mehr als die Hälfte der Befragten (55 Proze… [+5452 chars]",,de,'Blackout'
https://www.bild.de/sport/fussball/fussball/frauen-wm-blackout-droht-kommentar-der-gierige-gianni-infantino-sollte-sich-scha-83793996.bild.html,https://www.bild.de/sport/fussball/fussball/frauen-wm-blackout-droht-kommentar-der-gierige-gianni-infantino-sollte-sich-scha-83793996.bild.html,0,www.bild.de,BILD-Kommentar zum drohenden WM-Blackout - Der gierige Infantino sollte sich schämen!,Die Frauen-WM wird Stand jetzt nicht im TV zu sehen sein. Fifa-Präsident Gianni Infantino sollte sich schämen – der BILD-Kommentar!,"https://images.bild.de/64537947515eba702eab9427/76a0c1e988522bacc39fc64ec6795520,54d0347a?w=1280",2023-05-04T11:16:15Z,https://web.archive.org/web/20230504134212/https://www.bild.de/sport/fussball/fussball/frauen-wm-blackout-droht-kommentar-der-gierige-gianni-infantino-sollte-sich-scha-83793996.bild.html,"Es ist unfassbar: Stand heute ist die Fußball-WM der Frauen in Australien und Neuseeland tatsächlich nicht im deutschen TV zu sehen. Dabei geht das Turnier schon am 20. Juli los! 
Der Hauptgrund? Di… [+1422 chars]",,de,'Blackout'
https://www.zeit.de/news/2023-05/04/antibiotikasaefte-fuer-kinder-duerfen-importiert-werden,https://www.zeit.de/news/2023-05/04/antibiotikasaefte-fuer-kinder-duerfen-importiert-werden,0,www.zeit.de,Versorgungs Engpass: Antibiotikasäfte für Kinder dürfen importiert werden,,,2023-05-04T13:06:37Z,https://web.archive.org/web/20230504231858/https://www.zeit.de/news/2023-05/04/antibiotikasaefte-fuer-kinder-duerfen-importiert-werden,"When browsing with ads:
We collect personal data and also transmit it to third-party providers
 that help us improve and finance our digital content. Some of the information stored on your device, … [+732 chars]",,de,'Kinder'
https://www.focus.de/sport/fussball/frauen-wm-droht-tv-blackout-jetzt-mischt-sich-baerbock-ein_id_192884755.html,https://www.focus.de/sport/fussball/frauen-wm-droht-tv-blackout-jetzt-mischt-sich-baerbock-ein_id_192884755.html,0,www.focus.de,Fifa verlangt den Sendern zu viel - Frauen-WM droht TV-Blackout - jetzt mischt sich Baerbock ein,Außenministerin Annalena Baerbock hat vor einem möglichen TV-Blackout bei der Frauenfußball-Weltmeisterschaft gewarnt und einen eindringlichen Appell an die FIFA und die öffentlich-rechtlichen Sender gerichtet.,https://p6.focus.de/img/fotos/id_192810908/aussenministerin-annalena-baerbock-tritt-beim-wm-kick-off-im-auswaertigen-amt-selbst-gegen-den-ball.jpg?im=Crop%3D%280%2C404%2C3464%2C1732%29%3BResize%3D%281200%2C627%29&hash=c4f4409c7d9ecbf5b972ad6a8cc7db466b6cc4d3752fecdc8922ad9858e0ada1,2023-05-04T13:28:53Z,,Außenministerin Annalena Baerbock hat vor einem möglichen TV-Blackout bei der Frauenfußball-Weltmeisterschaft gewarnt und einen eindringlichen Appell an die FIFA und die öffentlich-rechtlichen Sender… [+2799 chars],,de,'Blackout'
https://www.faz.net/podcasts/f-a-z-podcast-fruehdenker/f-a-z-fruehdenker-vor-der-kroenung-geht-man-frueh-zu-bett-18870103.html,https://www.faz.net/podcasts/f-a-z-podcast-fruehdenker/f-a-z-fruehdenker-vor-der-kroenung-geht-man-frueh-zu-bett-18870103.html,0,www.faz.net,F.A.Z. Frühdenker: Vor der Krönung geht man früh zu Bett,"Nachdem er Jahrzehnte hat warten müssen, ist es so weit: Charles III. wird gekrönt. Über dem Kreml sind zwei Drohnen abgeschossen worden. Und die Deutschen haben deutlich mehr Gas gespart als erwartet. Der F.A.Z.-Newsletter.",https://media1.faz.net/ppmedia/aktuell/gesellschaft/2434362231/1.8870125/facebook_teaser_fplus/in-england-steigt-die.jpg,2023-05-05T04:01:35Z,https://web.archive.org/web/20230505083901/https://www.faz.net/podcasts/f-a-z-podcast-fruehdenker/f-a-z-fruehdenker-vor-der-kroenung-geht-man-frueh-zu-bett-18870103.html,"F.A.Z. Frühdenker: Vor der Krönung geht man früh zu Bett
F.A.Z. Frühdenker
Vor der Krönung geht man früh zu Bett
Von Tatjana HeidNachdem er Jahrzehnte hat warten müssen, ist es so weit: Charles II… [+222 chars]",,de,'Gas'
https://t3n.de/news/effizient-strom-sparen-darum-kann-sich-ein-notstromsystem-lohnen-1545244/,https://t3n.de/news/effizient-strom-sparen-darum-kann-sich-ein-notstromsystem-lohnen-1545244/,0,t3n.de,Effizient Strom sparen: Darum kann sich ein Notstromsystem lohnen,"Wie der Name schon sagt, sind Notstromsysteme eigentlich als Absicherung für Ausnahmesituationen gedacht. Dabei kann man mit einer gut durchdachten Notstromanlage auch einfach Strom sparen. 
Mit der richtigen Vorbereitung kann man nicht nur einem Blackout vor…",https://t3n.de/news/wp-content/uploads/2023/04/Bluetti-Teaser.jpg,2023-05-05T07:05:23Z,https://web.archive.org/web/20230505093942/https://t3n.de/news/effizient-strom-sparen-darum-kann-sich-ein-notstromsystem-lohnen-1545244/,"Sponsored Post 
Effizient Strom sparen: Darum kann sich ein Notstromsystem lohnen
Wie der Name schon sagt, sind Notstromsysteme eigentlich als Absicherung für Ausnahmesituationen gedacht. Dabei kan… [+3417 chars]",,de,'Blackout'
https://www.zeit.de/politik/deutschland/2023-05/abstammungsrecht-reform-forderung-trans-eltern-nodoption,https://www.zeit.de/politik/deutschland/2023-05/abstammungsrecht-reform-forderung-trans-eltern-nodoption,0,www.zeit.de,Abstammungsrecht: Juristinnenverbände fordern Reform von Gesetzen zur Elternschaft,"Laut vielen Verbänden diskriminiert das Abstammungsrecht Frauen und trans Menschen. Künftig sollen sie ihre Kinder nicht adoptieren müssen, um als deren Eltern zu gelten.",,2023-05-05T09:27:14Z,https://web.archive.org/web/20230505232236/https://www.zeit.de/politik/deutschland/2023-05/abstammungsrecht-reform-forderung-trans-eltern-nodoption,"When browsing with ads:
We collect personal data and also transmit it to third-party providers
 that help us improve and finance our digital content. Some of the information stored on your device, … [+732 chars]",,de,'Kinder'
https://www.zeit.de/news/2023-05/05/sachsen-anhalt-fast-die-haelfte-der-haushalte-heizt-mit-gas,https://www.zeit.de/news/2023-05/05/sachsen-anhalt-fast-die-haelfte-der-haushalte-heizt-mit-gas,0,www.zeit.de,Statistik: Sachsen-Anhalt: Fast die Hälfte der Haushalte heizt mit Gas,,,2023-05-05T10:09:29Z,https://web.archive.org/web/20230505232704/https://www.zeit.de/news/2023-05/05/sachsen-anhalt-fast-die-haelfte-der-haushalte-heizt-mit-gas,"When browsing with ads:
We collect personal data and also transmit it to third-party providers
 that help us improve and finance our digital content. Some of the information stored on your device, … [+732 chars]",,de,'Gas'
https://www.zeit.de/wirtschaft/2023-05/robert-habeck-konzept-industriestrompreis-subventionen,https://www.zeit.de/wirtschaft/2023-05/robert-habeck-konzept-industriestrompreis-subventionen,0,www.zeit.de,Energiekosten: Robert Habeck will Milliardenhilfen für billigeren Industriestrompreis,Mit Staatshilfen will Bundeswirtschaftsminister Habeck den Strompreis für die Industrie senken. Das begründet er mit der Wettbewerbsfähigkeit als Industriestandort.,,2023-05-05T11:14:48Z,http://archive.md/20230505114352/https://www.zeit.de/wirtschaft/2023-05/robert-habeck-konzept-industriestrompreis-subventionen,"When browsing with ads:
We collect personal data and also transmit it to third-party providers
 that help us improve and finance our digital content. Some of the information stored on your device, … [+732 chars]",,de,'Energiekosten'
https://www.focus.de/immobilien/diverses/anstieg-von-57-prozent-politik-warb-fuer-das-energiesparen-jetzt-schimmelt-es-in-berliner-wohnungen_id_192963669.html,https://www.focus.de/immobilien/diverses/anstieg-von-57-prozent-politik-warb-fuer-das-energiesparen-jetzt-schimmelt-es-in-berliner-wohnungen_id_192963669.html,0,www.focus.de,Anstieg von 57 Prozent - Politik warb für das Energiesparen - jetzt schimmelt es in Berliner Wohnungen,"Die Angst vor einem kalten Winter und hohen Energiekosten führte dazu, dass viele Menschen in Deutschland Energie sparten. Doch das hat zumindest in vielen Berliner Wohnungen negative Folgen.",https://p6.focus.de/img/fotos/id_127402616/imago0087540999h.jpg?im=Crop%3D%280%2C408%2C3266%2C1633%29%3BResize%3D%281200%2C627%29&hash=20ec60677d700730e46a5ffe4029c854be47d29614be4ac37a1f0258bcfa3cb7,2023-05-05T13:39:18Z,https://web.archive.org/web/20230505175611/https://www.focus.de/immobilien/diverses/anstieg-von-57-prozent-politik-warb-fuer-das-energiesparen-jetzt-schimmelt-es-in-berliner-wohnungen_id_192963669.html,"Die Angst vor einem kalten Winter und hohen Energiekosten führte dazu, dass viele Menschen in Deutschland Energie sparten. Doch das hat zumindest in vielen Berliner Wohnungen negative Folgen.Bundeswi… [+2159 chars]",,de,'Energiekosten'
https://www.zeit.de/news/2023-05/05/verfuegungen-zur-einfuhr-von-kinder-antibiotika-erlassen,https://www.zeit.de/news/2023-05/05/verfuegungen-zur-einfuhr-von-kinder-antibiotika-erlassen,0,www.zeit.de,Behörden: Verfügungen zur Einfuhr von Kinder-Antibiotika erlassen,,,2023-05-05T13:40:22Z,https://web.archive.org/web/20230505232342/https://www.zeit.de/news/2023-05/05/verfuegungen-zur-einfuhr-von-kinder-antibiotika-erlassen,"When browsing with ads:
We collect personal data and also transmit it to third-party providers
 that help us improve and finance our digital content. Some of the information stored on your device, … [+732 chars]",,de,'Kinder'
