index,url,valid,domain,title,description,image,published,archive,content,quote,language,keyword
https://www.tagesschau.de/wissen/gesundheit/jugendliche-social-media-leopoldina-100.html,https://www.tagesschau.de/wissen/gesundheit/jugendliche-social-media-leopoldina-100.html,0,www.tagesschau.de,"Vorschlag der Leopoldina: ""Keine Social-Media-Accounts für unter 13-Jährige""","Die Nationalakademie Leopoldina hat Maßnahmen vorgelegt, um Kinder und Jugendliche besser vor Auswirkungen von Sozialen Medien zu schützen. So sollen Kinder unter 13 Jahren gar keine Social-Media-Accounts einrichten dürfen.",https://images.tagesschau.de/image/4490cc79-9072-4dd4-a140-7422ea6a411c/AAABmKLbnd8/AAABmKJZ-0g/16x9-big/jugendliche-smartphone-110.jpg?width=1280,2025-08-13T10:02:32Z,http://archive.md/20250813195036/https://www.tagesschau.de/wissen/gesundheit/jugendliche-social-media-leopoldina-100.html,"Stand: 13.08.2025 12:02 Uhr
Die Nationalakademie Leopoldina hat Maßnahmen vorgelegt, um Kinder und Jugendliche besser vor Auswirkungen von Sozialen Medien zu schützen. So sollen Kinder unter 13 Jahr… [+3212 chars]",,de,'Kinder'
https://www.zeit.de/news/2025-08/13/mehr-hilfe-fuer-kinder-aus-suchtbelasteten-familien-geplant,https://www.zeit.de/news/2025-08/13/mehr-hilfe-fuer-kinder-aus-suchtbelasteten-familien-geplant,0,www.zeit.de,Suchtgefahren: Mehr Hilfe für Kinder aus suchtbelasteten Familien geplant,Hier finden Sie Informationen zu dem Thema „Suchtgefahren“. Lesen Sie jetzt „Mehr Hilfe für Kinder aus suchtbelasteten Familien geplant“.,https://img.zeit.de/news/2025-08/13/mehr-hilfe-fuer-kinder-aus-suchtbelasteten-familien-geplant-image-group/wide__1300x731,2025-08-13T13:43:05Z,https://web.archive.org/web/20250822105214/https://www.zeit.de/news/2025-08/13/mehr-hilfe-fuer-kinder-aus-suchtbelasteten-familien-geplant,"Mit neuen Projekten sollen Kinder aus suchtbelasteten und psychisch belasteten Familien in Brandenburg bessere Unterstützung bekommen. Fachkräfte wie Pädagogen, Erzieher oder auch Sporttrainer sollen… [+1991 chars]",,de,'Kinder'
https://www.zeit.de/kultur/musik/2025-08/ethel-cain-willoughby-tucker-i-ll-always-love-you,https://www.zeit.de/kultur/musik/2025-08/ethel-cain-willoughby-tucker-i-ll-always-love-you,0,www.zeit.de,Ethel Cain: Das Land frisst seine Kinder,"Ethel Cain ist Lana Del Rey mit echten Problemen, der Anti-Popstar des Sommers. Sogar einen Skandal hat die Ambient-, Folk- und Gothic-Musikerin schon überstanden.",https://img.zeit.de/kultur/musik/2025-08/ethel-cain-ec-truck/wide__1300x731,2025-08-13T16:32:03Z,,"Schließen
Artikelzusammenfassung
Hayden Silas Anhedönia, besser bekannt als Ethel Cain, erzählt mit ihrem neuen Album eine über mehrere Generationen gespannte Geschichte. Trotz wenig Text in ihrer … [+708 chars]",,de,'Kinder'
https://www.faz.net/aktuell/politik/inland/laender-fordern-vom-bund-sondervermoegen-fuer-marode-polizeidienststellen-110636376.html,https://www.faz.net/aktuell/politik/inland/laender-fordern-vom-bund-sondervermoegen-fuer-marode-polizeidienststellen-110636376.html,0,www.faz.net,Ungeziefer und Schimmel: Länder fordern vom Bund Sondervermögen für marode Polizeidienststellen,Einer Erhebung der Gewerkschaft der Polizei zufolge sind viele Polizeidienststellen in Deutschland in einem schlechten Zustand. Mehrere Bundesländer fordern daher Unterstützung vom Bund.,https://media1.faz.net/ppmedia/w1200/aktuell/gesellschaft/3081856726/1.10636427/facebook_teaser/viele-polizeistellen-in.jpg.webp,2025-08-14T02:52:21Z,,Angesichts des maroden Zustands vieler Polizeiwachen in Deutschland haben mehrere Bundesländer mehr Unterstützung vom Bund bei der Finanzierung der Polizei gefordert etwa in Form eines Sondervermögen… [+1435 chars],,de,'Schimmel'
https://www.zeit.de/news/2025-08/14/neubauer-schliesst-sich-protest-gegen-gasbohrung-an,https://www.zeit.de/news/2025-08/14/neubauer-schliesst-sich-protest-gegen-gasbohrung-an,0,www.zeit.de,Klimaproteste: Neubauer schließt sich Protest gegen Gasbohrung an,Hier finden Sie Informationen zu dem Thema „Klimaproteste“. Lesen Sie jetzt „Neubauer schließt sich Protest gegen Gasbohrung an“.,https://img.zeit.de/news/2025-08/14/neubauer-schliesst-sich-protest-gegen-gasbohrung-an-image-group/wide__1300x731,2025-08-14T03:00:42Z,,Deutschlands bekannteste Klimaaktivistin Luisa Neubauer schließt sich den Protesten gegen Gasbohrungen in Reichling am Ammersee an. Neubauer werde an einer Protestkundgebung der Bewegung Fridays for … [+1018 chars],,de,'Gas'
https://vorarlberg.orf.at/stories/3317637/,https://vorarlberg.orf.at/stories/3317637/,0,vorarlberg.orf.at,Hitzefrei bleibt Entscheidung der Arbeitgeber,"Nach den regenreichen Wochen bringt nun eine Hitzewelle mit über 30 Grad für manche Belastung – besonders für Kinder, ältere und kranke Menschen sowie für Beschäftigte im Freien. Die Gewerkschaft fordert klare gesetzliche Schutzmaßnahmen, aber auch mit einem …",https://ibs.orf.at/vbg?image=https%3A%2F%2Foekastatic.orf.at%2Fmims%2F2024%2F28%2F62%2Fcrops%2Fw%3D1200%2Ch%3D627%2Cq%3D75%2F2278259_master_866862_adobestock_200919047.jpeg%3Fs%3D7b6f0593bcba6a8d84413b7c5f250e74b7d1abcf,2025-08-14T04:06:17Z,https://web.archive.org/web/20250815055951/https://vorarlberg.orf.at/stories/3317637/,"Einer der Berufe, in dem die Hitze derzeit besonders zu spüren ist, ist jener der Spengler. Das merkt auch Tomas Smacar aus Altach, der bei Arbeiten auf dem Dach mit extremen Temperaturen zu kämpfen … [+2442 chars]",,de,'ältere Menschen'
https://www.zeit.de/news/2025-08/14/mehr-als-27-000-kinder-bei-verkehrsunfaellen-verletzt,https://www.zeit.de/news/2025-08/14/mehr-als-27-000-kinder-bei-verkehrsunfaellen-verletzt,0,www.zeit.de,Unfälle: Mehr als 27.000 Kinder bei Verkehrsunfällen verletzt,Hier finden Sie Informationen zu dem Thema „Unfälle“. Lesen Sie jetzt „Mehr als 27.000 Kinder bei Verkehrsunfällen verletzt“.,https://img.zeit.de/news/2025-08/14/mehr-als-27-000-kinder-bei-verkehrsunfaellen-verletzt-image-group/wide__1300x731,2025-08-14T06:58:17Z,https://web.archive.org/web/20250820055006/https://www.zeit.de/news/2025-08/14/mehr-als-27-000-kinder-bei-verkehrsunfaellen-verletzt,Statistisch gesehen alle 19 Minuten ist im vergangenen Jahr ein Kind im Straßenverkehr verletzt worden oder ums Leben gekommen. Insgesamt verunglückten im Jahr 2024 rund 27.260 Kinder unter 15 Jahren… [+1981 chars],,de,'Kinder'
https://www.zeit.de/familie/2025-08/schulangst-eltern-kinder-bildung-stress-spott,https://www.zeit.de/familie/2025-08/schulangst-eltern-kinder-bildung-stress-spott,0,www.zeit.de,"Schulangst: Sobald mein Kind eine Klassenarbeit schrieb, geriet ich in Panik","Wer in der Kindheit unter Schulangst litt, dem begegnet diese später oft noch mal: Wenn die eigenen Kinder in die Schule kommen – und Lernen zum Survivaltraining mutiert.",https://img.zeit.de/familie/2025-07/schulangst-eltern-kinder-bildung-stress/wide__1300x731,2025-08-14T07:15:24Z,https://web.archive.org/web/20250815110027/https://www.zeit.de/familie/2025-08/schulangst-eltern-kinder-bildung-stress-spott,"Ich
hatte schon immer viele Ängste, und als ich Mutter wurde, haben diese sich schnell
vermehrt. Ab dem Zeitpunkt, an dem sich mein Kind in meiner Gebärmutter
eingenistet hat und mit Dingen begonn… [+519 chars]",,de,'Kinder'
https://www.zeit.de/news/2025-08/14/bremse-und-gas-verwechselt-91-jaehriger-bei-unfall-verletzt,https://www.zeit.de/news/2025-08/14/bremse-und-gas-verwechselt-91-jaehriger-bei-unfall-verletzt,0,www.zeit.de,Unfall: Bremse und Gas verwechselt - 91-Jähriger bei Unfall verletzt,Hier finden Sie Informationen zu dem Thema „Unfall“. Lesen Sie jetzt „Bremse und Gas verwechselt - 91-Jähriger bei Unfall verletzt“.,https://img.zeit.de/news/2025-08/14/bremse-und-gas-verwechselt-91-jaehriger-bei-unfall-verletzt-image-group/wide__1300x731,2025-08-14T07:23:29Z,,Ein 91-Jähriger hat in Kernen im Remstal laut der Polizei beim Anfahren die Bremse mit dem Gaspedal verwechselt und ist in der Folge gegen diverse Dinge gefahren. Zunächst stieß er gegen einen Holzza… [+374 chars],,de,'Gas'
https://www.diepresse.com/19981050/hagel-sturm-hochwasser-jeder-vierte-ist-gegen-unwetter-unterversichert,https://www.diepresse.com/19981050/hagel-sturm-hochwasser-jeder-vierte-ist-gegen-unwetter-unterversichert,0,www.diepresse.com,"Hagel, Sturm, Hochwasser: Jeder Vierte ist gegen Unwetter unterversichert [premium]","Unwetter werden immer häufiger, viele Haushalte sind unterversichert. Wie man sich besser schützt.",https://img.diepresse.com/public/incoming/3ayd9p-imago-images-0826560776/alternates/DPR_SOCIAL_MAGAZIN/imago%20images%200826560776,2025-08-14T07:37:13Z,,"Unwetter werden immer häufiger, viele Haushalte sind unterversichert. Wie man sich besser schützt.
Wien. Hagel, Sturm, Hochwasser, Waldbrand nicht nur Hitzewellen nehmen zu, sondern Extremwetterlage… [+792 chars]",,de,'Hochwasser'
https://www.zeit.de/news/2025-08/14/energiebilanz-ein-drittel-weniger-kohlestrom-in-sachsen,https://www.zeit.de/news/2025-08/14/energiebilanz-ein-drittel-weniger-kohlestrom-in-sachsen,0,www.zeit.de,Energie: Energiebilanz: Ein Drittel weniger Kohlestrom in Sachsen,Hier finden Sie Informationen zu dem Thema „Energie“. Lesen Sie jetzt „Energiebilanz: Ein Drittel weniger Kohlestrom in Sachsen“.,https://img.zeit.de/news/2025-08/14/energiebilanz-ein-drittel-weniger-kohlestrom-in-sachsen-image-group/wide__1300x731,2025-08-14T07:50:26Z,,"Die sächsische Bruttostromerzeugung ist 2023 um fast ein Viertel gesunken. Das geht aus der Energiebilanz hervor, die das Statistische Landesamt am Donnerstag veröffentlicht hat. Demnach sank die Str… [+1016 chars]",,de,'Kohle'
https://www.stern.de/gesellschaft/regional/sachsen/energie--energiebilanz--ein-drittel-weniger-kohlestrom-in-sachsen-35972084.html,https://www.stern.de/gesellschaft/regional/sachsen/energie--energiebilanz--ein-drittel-weniger-kohlestrom-in-sachsen-35972084.html,0,www.stern.de,Energie: Energiebilanz: Ein Drittel weniger Kohlestrom in Sachsen,In Sachsen wurde 2023 rund ein Drittel weniger Strom aus Braunkohle erzeugt. Zugelegt haben vor allem die Wind- und Solarstromerzeugung. Auch der Verbrauch ist gesunken - vor allem in der Industrie.,https://image.stern.de/35972086/t/C3/v1/w1440/r1.7778/-/14--hmdym2qce5v13axs2048jpeg---be93610af8b9bb4e.jpg,2025-08-14T07:50:26Z,,"Kopiere den aktuellen Link
Zur Merkliste hinzufügen
In Sachsen wurde 2023 rund ein Drittel weniger Strom aus Braunkohle erzeugt. Zugelegt haben vor allem die Wind- und Solarstromerzeugung. Auch der… [+1230 chars]",,de,'Kohle'
https://www.tagesschau.de/inland/gesellschaft/kinder-verkehr-unfaelle-102.html,https://www.tagesschau.de/inland/gesellschaft/kinder-verkehr-unfaelle-102.html,0,www.tagesschau.de,Statistisches Bundesamt: Mehr Kinder im Straßenverkehr gestorben,"Ob auf dem Fahrrad, zu Fuß oder im Auto der Eltern: Tausende Kinder werden jedes Jahr im Straßenverkehr verletzt - die Zahl der Todesfälle stieg vergangenes Jahr. Besonders der Schulweg stellt laut Statistik ein Risiko dar.",https://images.tagesschau.de/image/37997aa8-1068-461a-a2a6-bda721058177/AAABmKejLDw/AAABmKJZ-0g/16x9-big/kinder-schulweg-100.jpg?width=1280,2025-08-14T08:30:12Z,https://web.archive.org/web/20250814125327/https://www.tagesschau.de/inland/gesellschaft/kinder-verkehr-unfaelle-102.html,"Stand: 14.08.2025 10:30 Uhr
Ob auf dem Fahrrad, zu Fuß oder im Auto der Eltern: Tausende Kinder werden jedes Jahr im Straßenverkehr verletzt - die Zahl der Todesfälle stieg vergangenes Jahr. Besonde… [+2118 chars]",,de,'Kinder'
https://www.zeit.de/news/2025-08/14/auto-rollt-richtung-fussgaengerzone-zwei-kinder-verletzt,https://www.zeit.de/news/2025-08/14/auto-rollt-richtung-fussgaengerzone-zwei-kinder-verletzt,0,www.zeit.de,Handbremse nicht angezogen: Auto rollt Richtung Fußgängerzone: Zwei Kinder verletzt,Hier finden Sie Informationen zu dem Thema „Handbremse nicht angezogen“. Lesen Sie jetzt „Auto rollt Richtung Fußgängerzone: Zwei Kinder verletzt“.,https://img.zeit.de/news/2025-08/14/auto-rollt-richtung-fussgaengerzone-zwei-kinder-verletzt-image-group/wide__1300x731,2025-08-14T08:44:11Z,https://web.archive.org/web/20250820055310/https://www.zeit.de/news/2025-08/14/auto-rollt-richtung-fussgaengerzone-zwei-kinder-verletzt,"Ein Auto ist in Oberbayern in Richtung einer Fußgängerzone gerollt und hat dabei zwei Kinder gestreift und verletzt. Ein 87-Jähriger hatte das Auto zuvor am Straßenrand abgestellt, aber vergessen die… [+564 chars]",,de,'Kinder'
https://www.bild.de/news/inland/schimmel-wasserschaeden-und-maeuse-so-marode-ist-die-deutsche-polizei-689c68ae0fb2e02f820752fe,https://www.bild.de/news/inland/schimmel-wasserschaeden-und-maeuse-so-marode-ist-die-deutsche-polizei-689c68ae0fb2e02f820752fe,0,www.bild.de,"Schimmel, Mäuse, „Todeszone“ - HIER müssen unsere Polizisten arbeiten","Die Fotos, die die Gewerkschaft der Polizei jetzt veröffentlicht, sind schockierend.","https://images.bild.de/689c68ae0fb2e02f820752fe/883291428e65098470d8e6f5ceeca125,c34f55d0?w=1280",2025-08-14T08:45:30Z,http://archive.md/20250814085256/https://www.bild.de/news/inland/schimmel-wasserschaeden-und-maeuse-so-marode-ist-die-deutsche-polizei-689c68ae0fb2e02f820752fe,"Berlin Nein, das ist keine Großbaustelle das sind die Dienststellen der Polizei in Deutschland! Die Fotos, die die Gewerkschaft der Polizei (GdP) jetzt veröffentlicht, sind schockierend: Im Büro stür… [+4369 chars]",,de,'Schimmel'
https://www.sueddeutsche.de/stil/schimmel-mieter-vermieter-li.3287475,https://www.sueddeutsche.de/stil/schimmel-mieter-vermieter-li.3287475,0,www.sueddeutsche.de,Rechtskolumne: Schimmel: Wie oft müssen Mieter lüften?,Schimmelbefall an der Wand ist eklig und ungesund – und sorgt oft für Streit zwischen Mieter und Vermieter. Wer ihn beseitigen muss. Und wie man vorbeugt.,https://www.sueddeutsche.de/2025/08/13/115acf65-83d7-4400-98ac-91aba4da3758.jpg?q=60&fm=webp&width=1200&rect=0%2C209%2C4000%2C2250,2025-08-14T09:49:03Z,https://web.archive.org/web/20250819205002/https://www.sueddeutsche.de/stil/schimmel-mieter-vermieter-li.3287475,"Wer nach den Ursachen sucht, ist auch schnell bei der Frage nach der Verantwortung: Sind es bauliche Mängel wie Wärmebrücken, undichte Dächer oder fehlende Dämmung? Wurde falsch geheizt oder falsch g… [+3557 chars]",,de,'Schimmel'
https://www.zeit.de/news/2025-08/14/kinder-muessen-zeltlager-wegen-dehydrierung-abbrechen,https://www.zeit.de/news/2025-08/14/kinder-muessen-zeltlager-wegen-dehydrierung-abbrechen,0,www.zeit.de,Wetter: Kinder müssen Zeltlager wegen Dehydrierung abbrechen,Hier finden Sie Informationen zu dem Thema „Wetter“. Lesen Sie jetzt „Kinder müssen Zeltlager wegen Dehydrierung abbrechen“.,https://img.zeit.de/news/2025-08/14/kinder-muessen-zeltlager-wegen-dehydrierung-abbrechen-image-group/wide__1300x731,2025-08-14T10:09:11Z,https://web.archive.org/web/20250818105353/https://www.zeit.de/news/2025-08/14/kinder-muessen-zeltlager-wegen-dehydrierung-abbrechen,"Mehr als ein Dutzend Kinder haben im Kreis Heinsberg wegen Dehydrierung ein Zeltlager abbrechen müssen. Betreuer alarmierten den Rettungsdienst, wie ein Sprecher der Feuerwehr im Ort Hückelhoven sagt… [+1269 chars]",,de,'Kinder'
https://www.stern.de/gesellschaft/regional/niedersachsen-bremen/unwetter--knapp-60-menschen-fuer-kampf-gegen-hochwasser-ausgezeichnet-35972904.html,https://www.stern.de/gesellschaft/regional/niedersachsen-bremen/unwetter--knapp-60-menschen-fuer-kampf-gegen-hochwasser-ausgezeichnet-35972904.html,0,www.stern.de,Unwetter: Knapp 60 Menschen für Kampf gegen Hochwasser ausgezeichnet,Vom Deich bis zum Sandsack: Beim Hochwasser 2023/2024 waren die Mitarbeiter des Landes stark gefordert. Umweltminister Meyer ehrt sie nun – und formuliert eine düstere Prognose.,https://image.stern.de/35972906/t/7s/v1/w1440/r1.7778/-/14--mxh4eygs6mv5axs2048jpeg---55efc19e9e654cbe.jpg,2025-08-14T11:06:01Z,https://web.archive.org/web/20250822204630/https://www.stern.de/gesellschaft/regional/niedersachsen-bremen/unwetter--knapp-60-menschen-fuer-kampf-gegen-hochwasser-ausgezeichnet-35972904.html,"Kopiere den aktuellen Link
Zur Merkliste hinzufügen
Vom Deich bis zum Sandsack: Beim Hochwasser 2023/2024 waren die Mitarbeiter des Landes stark gefordert. Umweltminister Meyer ehrt sie nun und for… [+1349 chars]",,de,'Hochwasser'
https://www.zeit.de/news/2025-08/14/knapp-60-menschen-fuer-kampf-gegen-hochwasser-ausgezeichnet,https://www.zeit.de/news/2025-08/14/knapp-60-menschen-fuer-kampf-gegen-hochwasser-ausgezeichnet,0,www.zeit.de,Unwetter: Knapp 60 Menschen für Kampf gegen Hochwasser ausgezeichnet,Hier finden Sie Informationen zu dem Thema „Unwetter“. Lesen Sie jetzt „Knapp 60 Menschen für Kampf gegen Hochwasser ausgezeichnet“.,https://img.zeit.de/news/2025-08/14/knapp-60-menschen-fuer-kampf-gegen-hochwasser-ausgezeichnet-image-group/wide__1300x731,2025-08-14T11:06:01Z,,Mitten in der Sommerhitze hat Niedersachsens Umweltminister Christian Meyer an das Winter-Hochwasser 2023/24 erinnert. Knapp 60 Mitarbeiterinnen und Mitarbeiter des Landesbetriebes für Wasserwirtscha… [+1158 chars],,de,'Hochwasser'
https://www.zeit.de/news/2025-08/14/rund-9-200-kinder-werden-im-saarland-eingeschult,https://www.zeit.de/news/2025-08/14/rund-9-200-kinder-werden-im-saarland-eingeschult,0,www.zeit.de,Bildung: Rund 9.200 Kinder werden im Saarland eingeschult,Hier finden Sie Informationen zu dem Thema „Bildung“. Lesen Sie jetzt „Rund 9.200 Kinder werden im Saarland eingeschult“.,https://img.zeit.de/news/2025-08/14/rund-9-200-kinder-werden-im-saarland-eingeschult-image-group/wide__1300x731,2025-08-14T14:25:15Z,https://web.archive.org/web/20250822105320/https://www.zeit.de/news/2025-08/14/rund-9-200-kinder-werden-im-saarland-eingeschult,Im kommenden Schuljahr werden im Saarland rund 9.200 Kinder eingeschult. Das teilte das saarländische Bildungsministerium mit. Die Zahl aller Schülerinnen und Schüler steigt im kommenden Schuljahr de… [+1556 chars],,de,'Kinder'
https://www.faz.net/aktuell/wirtschaft/klima-nachhaltigkeit/neue-gasumlage-ab-1-oktober-110637715.html,https://www.faz.net/aktuell/wirtschaft/klima-nachhaltigkeit/neue-gasumlage-ab-1-oktober-110637715.html,0,www.faz.net,Neue Umlage: Gas wird zum 1. Oktober teurer,Verbraucher müssen sich im Herbst auf etwas höhere Preise einstellen. Denn dann werden ungewöhnlich hohe Kosten für die Umwandlung von Gassorten umgelegt.,https://media1.faz.net/ppmedia/w1200/aktuell/2569025445/1.10637875/facebook_teaser/gasleitungen-in-lubmin.jpg.webp,2025-08-14T18:04:51Z,https://web.archive.org/web/20250814190730/https://www.faz.net/aktuell/wirtschaft/klima-nachhaltigkeit/neue-gasumlage-ab-1-oktober-110637715.html,"Gasverbraucher müssen sich im Herbst auf höhere Preise einstellen. Vom 1. Oktober an wird eine Konvertierungsumlage von 0,018 Cent je Kilowattstunde erhoben, teilte der Marktgebietsverantwort­liche, … [+2371 chars]",,de,'Gas'
https://www.zeit.de/news/2025-08/14/zwei-kinder-nach-badeunfall-in-schweinfurt-reanimiert,https://www.zeit.de/news/2025-08/14/zwei-kinder-nach-badeunfall-in-schweinfurt-reanimiert,0,www.zeit.de,Notfälle: Zwei Kinder nach Badeunfall in Schweinfurt reanimiert,Hier finden Sie Informationen zu dem Thema „Notfälle“. Lesen Sie jetzt „Zwei Kinder nach Badeunfall in Schweinfurt reanimiert“.,https://img.zeit.de/news/2025-08/14/zwei-kinder-nach-badeunfall-in-schweinfurt-reanimiert-image-group/wide__1300x731,2025-08-14T21:44:58Z,,Zwei Mädchen im Alter von sechs und sieben Jahren sind am Donnerstagabend leblos aus einem Baggersee am südlichen Ortsrand von Schweinfurt geborgen und reanimiert worden. Nach Polizeiangaben waren di… [+589 chars],,de,'Kinder'
https://www.zeit.de/news/2025-08/15/schnieder-will-ein-deutschlandticket-fuer-alle-schueler,https://www.zeit.de/news/2025-08/15/schnieder-will-ein-deutschlandticket-fuer-alle-schueler,0,www.zeit.de,ÖPNV und Kinder: Schnieder will ein Deutschlandticket für alle Schüler,Hier finden Sie Informationen zu dem Thema „ÖPNV und Kinder“. Lesen Sie jetzt „Schnieder will ein Deutschlandticket für alle Schüler“.,https://img.zeit.de/news/2025-08/15/schnieder-will-ein-deutschlandticket-fuer-alle-schueler-image-group/wide__1300x731,2025-08-15T01:35:36Z,,"Der rheinland-pfälzische Oppositionsführer Gordon Schnieder fordert ein Deutschlandticket für alle Schüler. «Wenn ich gerade junge Menschen an die Nutzung des Nahverkehrs gewöhnen will, dann muss ich… [+1510 chars]",,de,'Kinder'
https://www.zeit.de/news/2025-08/15/missbrauch-vorbeugen-so-staerkt-man-sein-kind,https://www.zeit.de/news/2025-08/15/missbrauch-vorbeugen-so-staerkt-man-sein-kind,0,www.zeit.de,Kinder: Missbrauch vorbeugen - so stärkt man sein Kind,Hier finden Sie Informationen zu dem Thema „Kinder“. Lesen Sie jetzt „Missbrauch vorbeugen - so stärkt man sein Kind“.,https://img.zeit.de/news/2025-08/15/missbrauch-vorbeugen-so-staerkt-man-sein-kind-image-group/wide__1300x731,2025-08-15T02:00:50Z,https://web.archive.org/web/20250820022253/https://www.zeit.de/news/2025-08/15/missbrauch-vorbeugen-so-staerkt-man-sein-kind,"Es ist der Alptraum für Eltern: Ein kleines Mädchen wird aus dem Europa-Park-Bad Rulantica von einem Mann in den Wald gelockt und dort mutmaßlich missbraucht. Was soll ein Kind tun, wenn es von einem… [+2246 chars]",,de,'Kinder'
https://www.nzz.ch/feuilleton/kultur-ist-der-schnee-von-morgen-ein-klassisches-musikfestival-als-wirtschaftsfaktor-klosters-music-ld.1897708,https://www.nzz.ch/feuilleton/kultur-ist-der-schnee-von-morgen-ein-klassisches-musikfestival-als-wirtschaftsfaktor-klosters-music-ld.1897708,0,www.nzz.ch,Kultur ist der Schnee von morgen – ein Musikfestival als Wirtschaftsfaktor in der Bergregion,"Das Festival Klosters Music zeigt seit sechs Jahren, wie Hochkultur zum Motor des Tourismus werden kann. Mit international bekannten Künstlern hat sich die private Reihe fest in der Schweizer Festspiellandschaft etabliert.","https://img.nzz.ch/2025/08/14/bbe40824-944a-4ff6-98f5-083d9671626a.jpg?width=1200&height=674&fit=bounds&quality=75&auto=webp&crop=5176,2911,x0,y539&wmark=nzz",2025-08-15T03:30:00Z,http://archive.md/20250815214354/https://www.nzz.ch/feuilleton/kultur-ist-der-schnee-von-morgen-ein-klassisches-musikfestival-als-wirtschaftsfaktor-klosters-music-ld.1897708,"Das Duo Igudesman &amp; Joo bescherte Klosters Music diesen Sommer einen nicht ganz ernst gemeinten «Final Showdown».
Rund um den Schweizer Nationalfeiertag erwacht in dem 4500-Einwohner-Dorf Kloste… [+6487 chars]",,de,'Schnee'
https://www.nzz.ch/schweiz/anschleichen-ausfuehren-abschleichen-so-werden-rechtmaessige-erben-um-ihr-vermoegen-gebracht-ld.1892451,https://www.nzz.ch/schweiz/anschleichen-ausfuehren-abschleichen-so-werden-rechtmaessige-erben-um-ihr-vermoegen-gebracht-ld.1892451,0,www.nzz.ch,"Anschleichen, ausführen, abschleichen – so werden rechtmässige Erben um ihr Vermögen gebracht",Erbschleicherei ist nicht strafbar. Vertrauenspersonen wie Finanzberater oder Pfleger nutzen daher immer wieder ältere und isolierte Menschen aus. Nun prüft der Bund neue Hürden.,"https://img.nzz.ch/2025/07/07/f1dbd458-8b34-4242-a89c-b910ec1220ab.jpeg?width=1200&height=674&fit=bounds&quality=75&auto=webp&crop=4500,2531,x0,y448&wmark=nzz",2025-08-15T03:30:00Z,,"Bei den Tätern handelt es sich oft um Personen, die einen ehrbaren Beruf ausüben.
Im Jahr 2025 dürfte in der Schweiz eine Rekordmarke geknackt werden. Erstmals werden wohl mehr als 100 Milliarden Fr… [+10413 chars]",,de,'ältere Menschen'
https://www.zeit.de/news/2025-08/15/eintritt-frei-fuer-kinder-beim-zootag-eroeffnung-in-wismar,https://www.zeit.de/news/2025-08/15/eintritt-frei-fuer-kinder-beim-zootag-eroeffnung-in-wismar,0,www.zeit.de,Landeszootag: Eintritt frei für Kinder beim Zootag - Eröffnung in Wismar,Hier finden Sie Informationen zu dem Thema „Landeszootag“. Lesen Sie jetzt „Eintritt frei für Kinder beim Zootag - Eröffnung in Wismar“.,https://img.zeit.de/news/2025-08/15/eintritt-frei-fuer-kinder-beim-zootag-eroeffnung-in-wismar-image-group/wide__1300x731,2025-08-15T04:00:39Z,https://web.archive.org/web/20250818110337/https://www.zeit.de/news/2025-08/15/eintritt-frei-fuer-kinder-beim-zootag-eroeffnung-in-wismar,"Nicht mit Exoten, sondern mit direktem Kontakt zu Haustieren wirbt der Tierpark in Wismar um Besucher - am Freitag wird dort der Landeszootag feierlich eröffnet. 
Der 2022 auf dem Zoogelände eingeri… [+2302 chars]",,de,'Kinder'
https://www.zeit.de/news/2025-08/15/grausiger-fund-im-goeppinger-wald-kinder-entdecken-leiche,https://www.zeit.de/news/2025-08/15/grausiger-fund-im-goeppinger-wald-kinder-entdecken-leiche,0,www.zeit.de,Leichenfund: Grausiger Fund im Göppinger Wald: Kinder entdecken Leiche,Hier finden Sie Informationen zu dem Thema „Leichenfund“. Lesen Sie jetzt „Grausiger Fund im Göppinger Wald: Kinder entdecken Leiche“.,https://img.zeit.de/news/2025-08/15/grausiger-fund-im-goeppinger-wald-kinder-entdecken-leiche-image-group/wide__1300x731,2025-08-15T07:16:39Z,,"Etliche Schulkinder haben in einem Wald in Göppingen eine Leiche gefunden. Sie mussten nach dem grausigen Fund von Notfallseelsorgern betreut werden. Wie die Polizei mitteilte, entdeckten die Kinder … [+629 chars]",,de,'Kinder'
