index,url,valid,domain,title,description,image,published,archive,content,quote,language,keyword
https://www.zeit.de/2024/42/abschied-zuhause-heimat-schimmelbefall-entsorgung,https://www.zeit.de/2024/42/abschied-zuhause-heimat-schimmelbefall-entsorgung,0,www.zeit.de,"Abschiede: Tschüss, ihr Geister!","Es gibt chaotische Abschiede und blutige Abschiede, überstürzte und wohldurchdachte. Manchmal kehrt man zurück und merkt: In der Spülmaschine hat der Schimmel übernommen.",https://img.zeit.de/2024/42/abschied-zuhause-heimat-schimmelbefall-teaser/wide__1300x731,2024-10-04T10:00:42Z,https://web.archive.org/web/20241004100834/https://www.zeit.de/2024/42/abschied-zuhause-heimat-schimmelbefall-entsorgung,"Als ich das letzte Mal mein Haus verließ, um einige Monate nach New York zu gehen, tat ich, was ich immer tue, wenn ich mein Haus verlasse. Ich brachte den Müll raus, machte die Spülmaschine an und n… [+558 chars]",,de,'Schimmel'
https://tirol.orf.at/stories/3275891/,https://tirol.orf.at/stories/3275891/,0,tirol.orf.at,Wien mit Zug bald wieder leichter erreichbar,Wien ist nach der Hochwasserkatastrophe im Osten Österreichs ab Donnerstag von Tirol aus mit dem Zug wieder leichter erreichbar. Auf der alten Westbahnstrecke durch den Wienerwald stehen dann wieder zwei Gleise zur Verfügung. Für ÖBB und Westbahn soll es eine…,https://ibs.orf.at/tir?image=https%3A%2F%2Foekastatic.orf.at%2Fmims%2F2023%2F41%2F43%2Fcrops%2Fw%3D1200%2Ch%3D627%2Cq%3D75%2F1971754_master_742243_pa120741.jpg%3Fs%3D077853a60972bc6f2e9aec3fa2c6bd365f05ef61,2024-10-04T11:12:15Z,https://web.archive.org/web/20241004123842/https://tirol.orf.at/stories/3275891/,"Vermurungen sind geräumt und Gleisschäden repariert, hieß es am Freitag von den beiden Bahnunternehmen. Westbahn-Geschäftsführer Thomas Posch spricht auch von einem Schulterschluss in einer nie da ge… [+1190 chars]",,de,'Hochwasser'
https://www.zeit.de/news/2024-10/04/erdrutsche-und-hochwasser-in-bosnien-herzegowina-14-tote,https://www.zeit.de/news/2024-10/04/erdrutsche-und-hochwasser-in-bosnien-herzegowina-14-tote,0,www.zeit.de,Unwetter am Balkan: Erdrutsche und Hochwasser in Bosnien-Herzegowina: 14 Tote,Hier finden Sie Informationen zu dem Thema „Unwetter am Balkan“. Lesen Sie jetzt „Erdrutsche und Hochwasser in Bosnien-Herzegowina: 14 Tote“.,https://img.zeit.de/news/2024-10/04/erdrutsche-und-hochwasser-in-bosnien-herzegowina-14-tote-image-group/wide__1300x731,2024-10-04T11:23:27Z,https://web.archive.org/web/20241004172921/https://www.zeit.de/news/2024-10/04/erdrutsche-und-hochwasser-in-bosnien-herzegowina-14-tote,In Bosnien-Herzegowina sind bei Überschwemmungen und Erdrutschen mindestens 14 Menschen ums Leben gekommen. Das berichtete ein Sprecher der Kantonsregierung Herzegowina-Neretva in Mostar nach Angaben… [+1044 chars],,de,'Hochwasser'
https://www.stern.de/panorama/unwetter-am-balkan--erdrutsche-und-hochwasser-in-bosnien-herzegowina--14-tote-35117872.html,https://www.stern.de/panorama/unwetter-am-balkan--erdrutsche-und-hochwasser-in-bosnien-herzegowina--14-tote-35117872.html,0,www.stern.de,Unwetter am Balkan: Erdrutsche und Hochwasser in Bosnien-Herzegowina: 14 Tote,Starkregen hat die Flüsse in der Umgebung von Mostar anschwellen lassen. Zahlreiche Häuser wurden überschwemmt. Ein Ort wurde von Schlamm bedeckt. Katastrophenschützer suchen nach Vermissten.,https://image.stern.de/35117874/t/rk/v1/w1440/r1.7778/-/04--qq2pyeokllv12axw800h600jpeg---f277c15aa8d6f218.jpg,2024-10-04T11:23:27Z,https://web.archive.org/web/20241004114239/https://www.stern.de/panorama/unwetter-am-balkan--erdrutsche-und-hochwasser-in-bosnien-herzegowina--14-tote-35117872.html,"Starkregen hat die Flüsse in der Umgebung von Mostar anschwellen lassen. Zahlreiche Häuser wurden überschwemmt. Ein Ort wurde von Schlamm bedeckt. Katastrophenschützer suchen nach Vermissten.
In Bos… [+1206 chars]",,de,'Hochwasser'
https://www.tagesspiegel.de/gesellschaft/panorama/unwetter-am-balkan-erdrutsche-und-hochwasser-in-bosnien-herzegowina-14-tote-12483056.html,https://www.tagesspiegel.de/gesellschaft/panorama/unwetter-am-balkan-erdrutsche-und-hochwasser-in-bosnien-herzegowina-14-tote-12483056.html,0,www.tagesspiegel.de,Unwetter am Balkan: Erdrutsche und Hochwasser in Bosnien-Herzegowina: 14 Tote,Starkregen hat die Flüsse in der Umgebung von Mostar anschwellen lassen. Zahlreiche Häuser wurden überschwemmt. Ein Ort wurde von Schlamm bedeckt. Katastrophenschützer suchen nach Vermissten.,https://www.tagesspiegel.de/images/12483053/alternates/BASE_16_9_W1400/1728041071000/hochwasser-in-bosnien-herzegowina.jpeg,2024-10-04T11:24:31Z,https://web.archive.org/web/20241005023118/https://www.tagesspiegel.de/gesellschaft/panorama/unwetter-am-balkan-erdrutsche-und-hochwasser-in-bosnien-herzegowina-14-tote-12483056.html,In Bosnien-Herzegowina sind bei Überschwemmungen und Erdrutschen mindestens 14 Menschen ums Leben gekommen. Das berichtete ein Sprecher der Kantonsregierung Herzegowina-Neretva in Mostar nach Angaben… [+1088 chars],,de,'Hochwasser'
https://www.bild.de/news/ausland/unfall-drei-insassen-von-flut-auto-werden-noch-vermisst-66ffb1a9bed5755b660bfbee,https://www.bild.de/news/ausland/unfall-drei-insassen-von-flut-auto-werden-noch-vermisst-66ffb1a9bed5755b660bfbee,0,www.bild.de,In reißenden Fluss gestürzt - Drei Insassen von Flut-Auto werden noch vermisst,Olomouc (Tschechien) – Bei dem verheerenden Hochwasser sind Mitte September in Tschechien drei Menschen ums Leben gekommen. Acht Personen werden noch immmer vermisst - unter ihnen auch drei Auto-Insassen.,"https://images.bild.de/66ffb1a9bed5755b660bfbee/64b1b9da2b9f1fd651bd8c7d4caf9e6b,40591da2?w=1280",2024-10-04T11:49:33Z,https://web.archive.org/web/20241004134141/https://www.bild.de/news/ausland/unfall-drei-insassen-von-flut-auto-werden-noch-vermisst-66ffb1a9bed5755b660bfbee,"Olomouc (Tschechien)  Bei dem verheerenden Hochwasser sind Mitte September in Tschechien drei Menschen ums Leben gekommen. Acht Personen werden noch immer vermisst. Unter ihnen drei jungen Menschen, … [+2171 chars]",,de,'Hochwasser'
https://www.faz.net/aktuell/gesellschaft/ungluecke/erdrutsche-und-hochwasser-in-bosnien-hercegovina-14-tote-110026487.html,https://www.faz.net/aktuell/gesellschaft/ungluecke/erdrutsche-und-hochwasser-in-bosnien-hercegovina-14-tote-110026487.html,0,www.faz.net,14 Tote bei Erdrutschen und Hochwasser in Bosnien-Hercegovina,Starkregen hat die Flüsse in der Umgebung von Mostar anschwellen lassen. Zahlreiche Häuser wurden überschwemmt. Der Ort Jablanica war zeitweise völlig isoliert.,https://media1.faz.net/ppmedia/aktuell/gesellschaft/3154018266/1.10026497/facebook_teaser/luftaufnahmen-vom-bosnischen.jpg,2024-10-04T12:01:02Z,https://web.archive.org/web/20241004120234/http://www.faz.net/aktuell/gesellschaft/ungluecke/erdrutsche-und-hochwasser-in-bosnien-hercegovina-14-tote-110026487.html,Betroffen ist vor allem das bergige Gebiet etwa 30 Kilometer nördlich der Stadt Mostar. Nach Starkregen waren mehrere Flüsse über die Ufer getreten. So habe es im Ort Jablanica eine Schlammlawine geg… [+1275 chars],,de,'Hochwasser'
https://www.spektrum.de/news/die-antarktis-ergruent-immer-schneller/2235787,https://www.spektrum.de/news/die-antarktis-ergruent-immer-schneller/2235787,0,www.spektrum.de,Klimawandel: Immer mehr Pflanzen wachsen in der Antarktis: Die von ihnen bedeckte Fläche hat sich mehr als verzwölffacht,Der Klimawandel erwärmt auch den kalten Südkontinent. Die Folge: Wie Schimmel breiten sich Moospolster auf der Antarktischen Halbinsel aus. Ihre Fläche hat sich verzwölffacht.,https://static.spektrum.de/fm/912/f1920x1080/GettyImages-687565896.jpg,2024-10-04T13:38:13Z,https://web.archive.org/web/20241004134204/https://www.spektrum.de/news/die-antarktis-ergruent-immer-schneller/2235787,"Die von Pflanzen bedeckte Fläche auf der antarktischen Halbinsel hat sich binnen 35 Jahren mehr als verzwölffacht. Das zeigen Satellitendaten aus den Archiven des Landsat-Programms, die ein Team um T… [+2626 chars]",,de,'Schimmel'
https://www.morgenpost.de/panorama/article407395686/italien-ueberschwemmungen.html,https://www.morgenpost.de/panorama/article407395686/italien-ueberschwemmungen.html,0,www.morgenpost.de,Hochwasser in Italien: Wo die höchste Warnstufe gilt,Dramatische Szenen spielen sich in einigen Gegenden Italiens ab. Menschen müssen evakuiert werden. Was Urlauber jetzt wissen müssen,https://img.sparknews.funkemedien.de/407398040/407398040_1728050624_v16_9_1600.jpeg,2024-10-04T14:03:44Z,https://web.archive.org/web/20241004141728/https://www.morgenpost.de/panorama/article407395686/italien-ueberschwemmungen.html,"Rom. Dramatische Szenen spielen sich in einigen Gegenden Italiens ab. Menschen müssen evakuiert werden. Was Urlauber jetzt wissen müssen
Große Sorge im Urlaubsland Italien. Erneut erschüttern schwer… [+2832 chars]",,de,'Hochwasser'
https://www.diepresse.com/18929706/wie-viel-klimawandel-steckt-im-hochwasser,https://www.diepresse.com/18929706/wie-viel-klimawandel-steckt-im-hochwasser,0,www.diepresse.com,Wie viel Klimawandel steckt im Hochwasser?,"Wer oder was hat Schuld an Starkregen und Hochwasser? Der Klimawandel, die Bodenversiegelung oder hat es das eh immer schon gegeben? Die Attributionsforschung gibt Antworten.",https://img.diepresse.com/public/incoming/9lc33d-kein-Titel/alternates/DPR_PODCAST_AUFGUSS/kein%20Titel,2024-10-04T14:14:58Z,https://web.archive.org/web/20241004172534/https://www.diepresse.com/18929706/wie-viel-klimawandel-steckt-im-hochwasser,"Wer oder was hat Schuld an Starkregen und Hochwasser? Der Klimawandel, die Bodenversiegelung oder hat es das eh immer schon gegeben? Die Attributionsforschung gibt Antworten. 
Hat es das schon immer… [+1721 chars]",,de,'Hochwasser'
https://sport.orf.at/stories/3133153/,https://sport.orf.at/stories/3133153/,0,sport.orf.at,Schimmel in St. Pöltener NV-Arena nach Hochwasser,,https://sport.orf.at/mojo/1_4_1/storyserver//news/common/images/og-fallback-sport.png,2024-10-04T15:19:19Z,,"Nach dem Hochwasser vor drei Wochen hat sich im Stadion des SKN St. Pölten Schimmel ausgebreitet. Betroffen sind wichtige Innenräume, der Rasen und die Tribünen sind in einem guten Zustand. Österreic… [+670 chars]",,de,'Schimmel'
https://noe.orf.at/stories/3275946/,https://noe.orf.at/stories/3275946/,0,noe.orf.at,Schimmelbefall in St. Pöltener NV-Arena,"Nach dem Hochwasser vor drei Wochen hat sich im Fußball-Stadion des SKN St. Pölten Schimmel ausgebreitet. Betroffen sind wichtige Innenräume, Rasen und Tribünen sind in einem guten Zustand. Die Champions-League-Spiele der SKN-Frauen dürften verlegt werden.",https://ibs.orf.at/noe?image=https%3A%2F%2Foekastatic.orf.at%2Fmims%2F2019%2F18%2F98%2Fcrops%2Fw%3D1200%2Ch%3D627%2Cq%3D75%2F141010_master_32798_skn_st._poelten_nv_arena_gepa_pictures3.jpg%3Fs%3Db07284f9b75591f4184dff9dfc80405eb25b580c,2024-10-04T15:28:53Z,https://web.archive.org/web/20241004154922/https://noe.orf.at/stories/3275946/,"Österreichs Frauen-Serienmeister ist nun teilweise auf Herbergssuche. Laut einem Clubsprecher finden zwar die Bundesliga-Spiele weiterhin in der NV-Arena statt, in der Champions League muss aber nach… [+550 chars]",,de,'Hochwasser'
https://www.nzz.ch/panorama/mindestens-18-tote-nach-erdrutschen-und-hochwasser-in-bosnien-herzegowina-ld.1851620,https://www.nzz.ch/panorama/mindestens-18-tote-nach-erdrutschen-und-hochwasser-in-bosnien-herzegowina-ld.1851620,0,www.nzz.ch,Mindestens 18 Tote nach Erdrutschen und Hochwasser in Bosnien-Herzegowina,Starkregen hat die Flüsse in der Umgebung von Mostar anschwellen lassen. Zahlreiche Häuser wurden überschwemmt. Ein Ort wurde von Schlamm bedeckt. Nothelfer suchen nach Vermissten.,"https://img.nzz.ch/2024/10/04/776d2261-9bae-4e18-b995-11a50f94d9e4.jpeg?width=1200&height=675&fit=bounds&quality=75&auto=webp&crop=5900,3319,x0,y0&wmark=nzz",2024-10-04T16:20:31Z,https://web.archive.org/web/20241004172938/https://www.nzz.ch/panorama/mindestens-18-tote-nach-erdrutschen-und-hochwasser-in-bosnien-herzegowina-ld.1851620,"Eine Drohnenaufnahme zeigt den Ort Jablanica, wo es nach starken Niederschlägen eine Schlammlawine gegeben hat.
(dpa) In Bosnien-Herzegowina sind bei Überschwemmungen und Erdrutschen mindestens 18 P… [+1337 chars]",,de,'Hochwasser'
https://noe.orf.at/stories/3275921/,https://noe.orf.at/stories/3275921/,0,noe.orf.at,Dammbruch: Mängel seit 27 Jahren bekannt,"Das Hochwasser hat im Tullnerfeld schwere Schäden verursacht. Grund dafür waren auch mehrere Dammbrüche entlang der Perschling. Dass die Dämme saniert werden müssen, ist seit 27 Jahren bekannt. Trotzdem wurde das Projekt bis heute verzögert.",https://ibs.orf.at/noe?image=https%3A%2F%2Foekastatic.orf.at%2Fmims%2F2024%2F40%2F94%2Fcrops%2Fw%3D1200%2Ch%3D627%2Cq%3D75%2F2376521_master_907494_241004_diskussion_um_perschling_hochwasserschutz_00_00_02_20.jpg%3Fs%3D277700377b2e9464f5d4dcfe85464bd64e1b9023,2024-10-04T17:33:36Z,https://web.archive.org/web/20241004181737/https://noe.orf.at/stories/3275921/,"Das Thema ist mir viel zu heiß, sagt ein Feuerwehrmann, der sich mit der Situation der Dämme über Jahre intensiv beschäftigt hat. Trotzdem will er auch unter Zusicherung der Anonymität nicht über die… [+7100 chars]",,de,'Hochwasser'
https://www.zeit.de/gesellschaft/zeitgeschehen/2024-10/haiti-banden-gewalt-angriff-mindestens-70-tote-pont-sonde,https://www.zeit.de/gesellschaft/zeitgeschehen/2024-10/haiti-banden-gewalt-angriff-mindestens-70-tote-pont-sonde,0,www.zeit.de,Bandengewalt: Mindestens 70 Tote bei Angriffen krimineller Banden in Haiti,"Laut UN-Angaben wurden bei Angriffen bewaffneter Gangs auf Haiti mehr als 70 Menschen getötet, darunter Frauen und Kinder. Die Regierung will entschlossen reagieren.",https://img.zeit.de/politik/ausland/2024-10/70-menschen-haiti-bandenangriff-70-menschen-getoetet-bild/wide__1300x731,2024-10-04T18:17:35Z,,"Bei einem Bandenüberfall auf eine kleine Ortschaft in Haiti sind nach UN-Angaben mindestens 70 Menschen getötet worden. Unter den Toten seien auch Frauen und drei Kinder, teilte das UN-Menschenrechts… [+1602 chars]",,de,'Kinder'
https://www.zeit.de/news/2024-10/05/schwieriger-start-fuer-rsv-impfungen-fuer-kinder-im-norden,https://www.zeit.de/news/2024-10/05/schwieriger-start-fuer-rsv-impfungen-fuer-kinder-im-norden,0,www.zeit.de,Lieferschwierigkeiten: Schwieriger Start für RSV-Impfungen für Kinder im Norden,Hier finden Sie Informationen zu dem Thema „Lieferschwierigkeiten“. Lesen Sie jetzt „Schwieriger Start für RSV-Impfungen für Kinder im Norden“.,https://img.zeit.de/news/2024-10/05/schwieriger-start-fuer-rsv-impfungen-fuer-kinder-im-norden-image-group/wide__1300x731,2024-10-05T03:30:36Z,,Unter Kindern gehören RSV-Infektionen zu den häufigsten Krankheitsgründen. Im Juni empfahl die Ständige Impfkommission (STIKO) für Neugeborene und Säuglinge daher den neuen Impfstoff Nirsevimab - das… [+3215 chars],,de,'Kinder'
https://wien.orf.at/stories/3275953/,https://wien.orf.at/stories/3275953/,0,wien.orf.at,Bisher 200 Anträge auf Hochwasserhilfe,"Nach dem Hochwasser arbeitet die Schadenskommission der Stadt nun die gemeldeten Schäden ab. 200 Anträge auf Entschädigung sind bisher gemeldet worden, 70 davon konnten bereits positiv erledigt werden.",https://ibs.orf.at/wie?image=https%3A%2F%2Foekastatic.orf.at%2Fmims%2F2024%2F38%2F52%2Fcrops%2Fw%3D1200%2Ch%3D627%2Cq%3D75%2F2356759_master_898752_980e3437-1c06-4165-9273-f823499f8716.jpg%3Fs%3D7129d44ff8830d9427338d1f2cff7c343273fdda,2024-10-05T04:00:00Z,https://web.archive.org/web/20241005043602/https://wien.orf.at/stories/3275953/,"Per Online-Formular seien rund 200 Anträge für eine Hilfe durch Hochwasserschäden eingetroffen, heißt es von der Gruppe für Sofortmaßnahmen. Sie leitet die mobile Kommission, die die Schäden begutach… [+1515 chars]",,de,'Hochwasser'
https://www.n-tv.de/panorama/HIV-bei-mehr-als-3300-Menschen-in-Deutschland-diagnostiziert-article25271390.html,https://www.n-tv.de/panorama/HIV-bei-mehr-als-3300-Menschen-in-Deutschland-diagnostiziert-article25271390.html,0,www.n-tv.de,Darunter zwei Dutzend Kinder: HIV bei mehr als 3300 Menschen in Deutschland diagnostiziert,"Im vergangenen Jahr bekommen Tausende Menschen in Deutschland die Diagnose HIV. Am stärksten betroffen sind dabei Männer, die mit Männern schlafen - gefolgt von Drogenkonsumenten. Insgesamt nimmt die Zahl der neu entdeckten Fälle jedoch deutlich ab.",https://bilder2.n-tv.de/img/incoming/crop25271185/9261327347-cImg_16_9-w1200/HIV-Schnelltests-zeigen-an-ob-jemand-das-Virus-in-sich-tragt.jpg,2024-10-05T07:58:25Z,https://web.archive.org/web/20241005080523/https://www.n-tv.de/panorama/HIV-bei-mehr-als-3300-Menschen-in-Deutschland-diagnostiziert-article25271390.html,"Im vergangenen Jahr bekommen Tausende Menschen in Deutschland die Diagnose HIV. Am stärksten betroffen sind dabei Männer, die mit Männern schlafen - gefolgt von Drogenkonsumenten. Insgesamt nimmt die… [+1981 chars]",,de,'Kinder'
https://www.focus.de/immobilien/wohnen/von-der-waermepumpe-zur-katastrophe-energieprojekt-geraet-ausser-kontrolle_id_259983677.html,https://www.focus.de/immobilien/wohnen/von-der-waermepumpe-zur-katastrophe-energieprojekt-geraet-ausser-kontrolle_id_259983677.html,0,www.focus.de,"„Keine Chance, das alles zu durchblicken“ - Nur Ärger mit der Wärmepumpe: Energieprojekt gerät außer Kontrolle","Anton Leitner aus Weßling wollte mit einer Gas-Hybrid-Wärmepumpe sein Haus umweltfreundlicher machen, doch es wurde ein Albtraum.",https://p6.focus.de/img/digital/id_259983673/von-der-waermepumpe-zur-katastrophe-energieprojekt-geraet-ausser-kontrolle.jpg?im=Crop%3D%280%2C49%2C1568%2C784%29%3BResize%3D%281200%2C627%29&impolicy=perceptual&quality=mediumHigh&hash=dc6d9049fa2adfbf5a8db2298632edf244e7982b621f0ba751098dc8a255d5b4,2024-10-05T08:53:02Z,https://web.archive.org/web/20241005093710/https://www.focus.de/immobilien/wohnen/von-der-waermepumpe-zur-katastrophe-energieprojekt-geraet-ausser-kontrolle_id_259983677.html,"Anton Leitner hat sich vorgenommen, sein Haus und das benachbarte Elternhaus umweltfreundlicher zu gestalten. Dazu wollte der 62-jährige Verleger aus Weßling in Bayern Gas-Hybrid-Wärmepumpen installi… [+3545 chars]",,de,'Gas'
https://www.welt.de/kultur/article253694330/ARD-Mehrteiler-Herrhausen-Die-Serie-fuer-die-Boomer-und-ihre-Kinder.html,https://www.welt.de/kultur/article253694330/ARD-Mehrteiler-Herrhausen-Die-Serie-fuer-die-Boomer-und-ihre-Kinder.html,0,www.welt.de,Die Serie für die Boomer und ihre Kinder,"„Herrhausen – Herr des Geldes“ erzählt die Geschichte des legendären Vorstandsprechers der Deutschen Bank, den 1989 die RAF ermordete. Als spektakuläre Geisterbahnfahrt durch alle Themen, die uns heute noch angehen. Vier Stunden, die jeden Beitrags-Euro wert …",https://img.welt.de/img/kultur/mobile253858462/3727931127-ci16x9-w1200/Herrhausen-Herr-des-Geldes-4.jpg,2024-10-05T09:29:14Z,https://web.archive.org/web/20241005105255/https://www.welt.de/kultur/article253694330/ARD-Mehrteiler-Herrhausen-Die-Serie-fuer-die-Boomer-und-ihre-Kinder.html,"Herrhausen Herr des Geldes erzählt die Geschichte des legendären Vorstandsprechers der Deutschen Bank, den 1989 die RAF ermordete. Als spektakuläre Geisterbahnfahrt durch alle Themen, die uns heute n… [+6698 chars]",,de,'Kinder'
https://www.zeit.de/news/2024-10/05/gasvergiftung-in-huette-acht-kinder-und-erwachsene-verletzt,https://www.zeit.de/news/2024-10/05/gasvergiftung-in-huette-acht-kinder-und-erwachsene-verletzt,0,www.zeit.de,Kohlenmonoxid: Gasvergiftung in Hütte: Acht Kinder und Erwachsene verletzt,Hier finden Sie Informationen zu dem Thema „Kohlenmonoxid“. Lesen Sie jetzt „Gasvergiftung in Hütte: Acht Kinder und Erwachsene verletzt“.,https://img.zeit.de/news/2024-10/05/gasvergiftung-in-huette-acht-kinder-und-erwachsene-verletzt-image-group/wide__1300x731,2024-10-05T09:35:28Z,https://web.archive.org/web/20241006154500/https://www.zeit.de/news/2024-10/05/gasvergiftung-in-huette-acht-kinder-und-erwachsene-verletzt,"Beim Betrieb eines Holzkohlegrills in einer Gartenhütte sind am Freitagabend in Bochum acht Menschen vermutlich durch das Gas Kohlenmonoxid verletzt worden, darunter vier Kinder. Die Betroffenen hatt… [+1489 chars]",,de,'Gas'
https://www.stern.de/gesellschaft/regional/nordrhein-westfalen/kohlenmonoxid--gasvergiftung-in-huette--acht-kinder-und-erwachsene-verletzt-35119678.html,https://www.stern.de/gesellschaft/regional/nordrhein-westfalen/kohlenmonoxid--gasvergiftung-in-huette--acht-kinder-und-erwachsene-verletzt-35119678.html,0,www.stern.de,Kohlenmonoxid: Gasvergiftung in Hütte: Acht Kinder und Erwachsene verletzt,Das geruchslose Gas Kohlenmonoxid ist hochgiftig und kann zum Tod führen. Auch der Betrieb eines harmlosen Holzkohlegrills kann es erzeugen. In Bochum gab es deshalb einen Großeinsatz.,https://image.stern.de/35119680/t/vG/v1/w1440/r1.7778/-/05--t72kp6axbcv17axw800h600jpeg---bd287711d2443039.jpg,2024-10-05T09:35:28Z,https://web.archive.org/web/20241005095244/https://www.stern.de/gesellschaft/regional/nordrhein-westfalen/kohlenmonoxid--gasvergiftung-in-huette--acht-kinder-und-erwachsene-verletzt-35119678.html,"Das geruchslose Gas Kohlenmonoxid ist hochgiftig und kann zum Tod führen. Auch der Betrieb eines harmlosen Holzkohlegrills kann es erzeugen. In Bochum gab es deshalb einen Großeinsatz.
Beim Betrieb … [+1077 chars]",,de,'Kinder'
https://kaernten.orf.at/stories/3275034/,https://kaernten.orf.at/stories/3275034/,0,kaernten.orf.at,Unterstützung für Erststudierende,"Für rund 13.000 Studierende hat am 1. Oktober das Wintersemester an der Uni Klagenfurt begonnen. Herausfordernd ist diese Zeit besonders für Menschen, deren Eltern kein Studium abgeschlossen haben, die die ersten Studierenden in ihrer Familie sind. Laut Arbei…",https://ibs.orf.at/ktn?image=https%3A%2F%2Foekastatic.orf.at%2Fmims%2F2024%2F39%2F14%2Fcrops%2Fw%3D1200%2Ch%3D627%2Cq%3D75%2F2363362_master_902014_20240924_kh_cf_studentenwohnungen_00_00_23_21.jpg%3Fs%3Dffd5ffea54eeba335436d8bad782f9aea549b61c,2024-10-05T10:11:52Z,https://web.archive.org/web/20241005122324/https://kaernten.orf.at/stories/3275034/,Wie läuft eine Vorlesung ab? Wo ist der Hörsaal und gehöre ich wirklich hierher? Solche Fragen hängen über den Köpfen vieler Studierender erster Generation. Die Alpen-Adria-Universität Klagenfurt hat… [+2031 chars],,de,'Winter'
https://www.bild.de/regional/ruhrgebiet/bewohner-in-lebensgefahr-kind-mit-schutzmaske-aus-feuerhaus-gerettet-6701032ed8476a4127f47307,https://www.bild.de/regional/ruhrgebiet/bewohner-in-lebensgefahr-kind-mit-schutzmaske-aus-feuerhaus-gerettet-6701032ed8476a4127f47307,0,www.bild.de,Bewohner in Lebensgefahr - Mädchen mit Kinder-Schutzmaske aus Feuerhaus gerettet,"In Gladbeck brach in einem Hausflur Feuer aus, brachte die Bewohner in Lebensgefahr. Ein Mädchen wurde mit einer Brandschutzhaube in Sicherheit gebracht.","https://images.bild.de/6701032ed8476a4127f47307/d85e691d038759b84e81aacc861b5e85,46ccf07d?w=1280",2024-10-05T10:48:59Z,https://web.archive.org/web/20241005105722/https://www.bild.de/regional/ruhrgebiet/bewohner-in-lebensgefahr-kind-mit-schutzmaske-aus-feuerhaus-gerettet-6701032ed8476a4127f47307,Gladbeck Ein schwarz gekleideter Mann trägt in Gladbeck ein Mädchen mit einer Atemschutzmaske aus einem Haus. Die neongelbe Brandschutzhaube der Feuerwehr hat die Kleine vor lebensgefährlichem Rauchg… [+1217 chars],,de,'Kinder'
https://tirol.orf.at/stories/3275993/,https://tirol.orf.at/stories/3275993/,0,tirol.orf.at,Sperre des Hochstein sorgt für Verärgerung,"Neben dem Zettersfeld ist der Hochstein das zweite Skigebiet in Lienz. Doch der Hochstein bleibt in diesem Winter geschlossen, da sich Wartungsarbeiten am alten Doppelsessellift verzögern. Diese Entscheidung sorgt bei Skifahrern und betroffenen Touristikern f…",https://ibs.orf.at/tir?image=https%3A%2F%2Foekastatic.orf.at%2Fmims%2F2024%2F40%2F95%2Fcrops%2Fw%3D1200%2Ch%3D627%2Cq%3D75%2F2376798_master_907595_downloadmedium-1.jpg%3Fs%3Da91e723d1bb1031c3f950c287cd3b163b7d85e02,2024-10-05T11:08:46Z,https://web.archive.org/web/20241005122216/https://tirol.orf.at/stories/3275993/,"Schon seit Jahren wackelt der Winterbetrieb am Hochstein in Lienz. Die hohen Betriebskosten seien mit den wenigen Skifahrern nicht zu begleichen, heißt es. Zudem habe man am Zettersfeld heuer die Ein… [+1958 chars]",,de,'Winter'
https://www.stern.de/digital/technik/sarco-pod---so-funktioniert-die-todeskapsel-fuer-sterbewillige-35100764.html,https://www.stern.de/digital/technik/sarco-pod---so-funktioniert-die-todeskapsel-fuer-sterbewillige-35100764.html,0,www.stern.de,Selbsttötung: Sarco-Pod: Wie funktioniert die Todeskapsel?,"Das ""Sarco-Pod"" soll einen selbstbestimmten Tod ermöglichen. Ihre Besonderheit: Die Kapsel nutzt kein Gift, sondern verwendet Gas für einen schmerzfreien Tod.",https://image.stern.de/35100766/t/vr/v2/w1440/r1.7778/-/der-sarco-pad-wurde-zuvor-in-den-niederlanden-gezeigt.jpg,2024-10-05T11:16:00Z,https://web.archive.org/web/20241005114128/https://www.stern.de/digital/technik/sarco-pod---so-funktioniert-die-todeskapsel-fuer-sterbewillige-35100764.html,"In der Schweiz ist es zu einer ersten Selbsttötung mithilfe des Sarco-Pods gekommen. Das Gerät ist seit Jahren in der Diskussion. Es soll die Möglichkeit bieten, autonom und schmerzfrei aus dem Leben… [+4855 chars]",,de,'Kinder'
