index,url,valid,domain,title,description,image,published,archive,content,quote,language,keyword
https://www.n-tv.de/wirtschaft/Spritpreise-sinken-zweiten-Tag-in-Folge-deutlich-id30699411.html,https://www.n-tv.de/wirtschaft/Spritpreise-sinken-zweiten-Tag-in-Folge-deutlich-id30699411.html,0,www.n-tv.de,Diesel sieben Cent günstiger: Spritpreise sinken zweiten Tag in Folge deutlich,Tanken ist immer noch sehr viel teurer als vor Beginn des Iran-Kriegs. Doch womöglich hat die Trendwende begonnen. Der Ölpreis zeigt allerdings noch keine klare Richtung.,https://www.n-tv.de/img/30699504/1775818475/Img_16_9/1200/Das-neue-Spritgesetz-ist-seit-dem-01-04-2026-in-Kraft-Die-Tankstellen-duerfen-duerfen-nur-noch-einmal-am-Tag-um-12-00-Uhr-die-Preise-erhoehen-erhoehen-Die-Preise-absenken-ist-jedoch-jederzeit-moeglich-moeglich-Wie-hoch-geht-der-Spritpreis-wegen-des-Krieges-im-Iran-Shell-Tankstelle-in-Siegen-Die-aktuellen-Spritpreise-am-Mittag-nach-12-00-Uhr-Erstmals-wurden-die-Preise-nicht-so-stark-angehoben-Die-Preise-haben-schon-lange-deutlich-die-2-Euro-Marke-ueberschritten-ueberschritten-Tankstelle-Spritpreise-am-09-04-2026-in-Siegen-Deutschland.jpg,2026-04-10T09:24:08Z,,"Diesel sieben Cent günstigerSpritpreise sinken zweiten Tag in Folge deutlich
Autofahrer können hoffen. (Foto: IMAGO/Rene Traut)
Tanken ist immer noch sehr viel teurer als vor Beginn des Iran-Kriegs… [+2167 chars]",,de,'Rohöl'
https://www.zeit.de/wirtschaft/2026-04/spritpreise-bundeswirtschaftsministerin-katherina-reiche-uebergewinnsteuer-kritik-spd,https://www.zeit.de/wirtschaft/2026-04/spritpreise-bundeswirtschaftsministerin-katherina-reiche-uebergewinnsteuer-kritik-spd,0,www.zeit.de,"Spritpreise: Reiche lehnt Übergewinnsteuer als ""verfassungsrechtlich fragwürdig"" ab","In der Sprit-Debatte hat die Wirtschaftsministerin Ideen von Finanzminister Lars Klingbeil eine Absage erteilt. Diese seien teuer und ""verfassungsrechtlich fragwürdig"".",https://img.zeit.de/politik/deutschland/2026-04/katharina-reiche-bild/wide__1300x731,2026-04-10T09:40:53Z,,"Bundeswirtschaftsministerin Katherina Reiche (CDU) hat im Streit um mögliche Entlastungen angesichts hoher Spritkreise Kritik an den Vorschlägen der SPD geübt. ""Der Koalitionspartner ist in den letzt… [+657 chars]",,de,'Spritpreise'
https://www.zeit.de/news/2026-04/10/gas-und-oel-auf-dem-rueckzug-beim-heizen-in-neuen-wohngebaeuden,https://www.zeit.de/news/2026-04/10/gas-und-oel-auf-dem-rueckzug-beim-heizen-in-neuen-wohngebaeuden,0,www.zeit.de,Statistik: Gas und Öl auf dem Rückzug beim Heizen in neuen Wohngebäuden,Hier finden Sie Informationen zu dem Thema „Statistik“. Lesen Sie jetzt „Gas und Öl auf dem Rückzug beim Heizen in neuen Wohngebäuden“.,https://img.zeit.de/news/2026-04/10/gas-und-oel-auf-dem-rueckzug-beim-heizen-in-neuen-wohngebaeuden-image-group/wide__1300x731,2026-04-10T09:41:46Z,,Bauherren setzen bei Wohnungsneubauten in Thüringen vor allem auf die Nutzung erneuerbarer Energien zum Heizen. Bei den 780 im vergangenen Jahr neu geplanten Wohngebäuden werden nach Daten des Landes… [+1020 chars],,de,'Gas'
https://www.tagesschau.de/ausland/europa/eu-energie-strasse-hormus-100.html,https://www.tagesschau.de/ausland/europa/eu-energie-strasse-hormus-100.html,0,www.tagesschau.de,Straße von Hormus: EU strebt mehr Unabhängigkeit bei Energie an,"Die Preise für Öl und Gas steigen und steigen. Preisdeckel, eine niedrigere Mehrwertsteuer und E-Auto-Förderungen allein reichen nicht aus, sagen Experten. Der Umstieg auf Erneuerbare Energien muss schneller gelingen. Von Jean-Marie Magro.",https://images.tagesschau.de/image/1a53297c-9d08-429b-8342-d5868cb1575e/AAABnXahuNw/AAABnSSvrFg/16x9-big/orltanker-torm-denise-100.jpg?width=1280,2026-04-10T10:08:02Z,,"Stand: 10.04.2026 12:08 Uhr
Die Preise für Öl und Gas steigen und steigen. Preisdeckel, eine niedrigere Mehrwertsteuer und E-Auto-Förderungen allein reichen nicht aus, sagen Experten. Der Umstieg au… [+3913 chars]",,de,'Gas'
https://www.stern.de/wirtschaft/news/preise--spritpreise-sinken-deutlich---auch-freitag-geht-es-abwaerts-37296236.html,https://www.stern.de/wirtschaft/news/preise--spritpreise-sinken-deutlich---auch-freitag-geht-es-abwaerts-37296236.html,0,www.stern.de,Preise: Spritpreise sinken deutlich - Auch Freitag geht es abwärts,Der gesunkene Ölpreis kommt langsam bei den Autofahrern an. Nach deutlichen Rückgängen am Mittwoch und Donnerstag zeichnet sich auch am Freitag ein Minus ab.,https://image.stern.de/37297422/t/YK/v1/w1440/r1.7778/-/10--j5bynlameuv1axs2048jpeg---450123eca57572ca.jpg,2026-04-10T11:43:34Z,,"Kopiere den aktuellen Link
Zur Merkliste hinzufügen
Der gesunkene Ölpreis kommt langsam bei den Autofahrern an. Nach deutlichen Rückgängen am Mittwoch und Donnerstag zeichnet sich auch am Freitag e… [+2669 chars]",,de,'Rohöl'
https://www.focus.de/immobilien/bundesland-check-so-stark-legen-die-gaspreise-bei-ihnen-zu_790c8867-48df-407d-a0f5-7b1a251870ce.html,https://www.focus.de/immobilien/bundesland-check-so-stark-legen-die-gaspreise-bei-ihnen-zu_790c8867-48df-407d-a0f5-7b1a251870ce.html,0,www.focus.de,Bundesland-Check: So stark legen die Gaspreise bei Ihnen zu,"Gaspreise steigen um bis zu 32 Prozent. Der Bundesland-Vergleich zeigt krasse Unterschiede. Erfahren Sie hier, wie Sie durch einen Wechsel 513 Euro sparen.","https://quadro.burda-forward.de/ctf/667004c9-7ab8-4337-9deb-b92f8fabcee7.a401bef3-2a16-4bd2-97c7-25cfce7e5353.jpg?im=RegionOfInterestCrop=(1200,630),regionOfInterest=(1004,720)&hash=78101efa48b977c9afbcd65419d1a9ce6fc44737a6fb9c1d37a49804d5a65680",2026-04-10T12:51:00Z,,Die Zahlen der neuesten Verivox-Auswertung sind alarmierend: Seit Jahresbeginn müssen Haushalte bundesweit im Schnitt 17 Prozent mehr für Gas bezahlen. Im Januar kosteten 20.000 Kilowattstunden (kWh)… [+2303 chars],,de,'Gas'
https://www.stern.de/wirtschaft/news/streit-um-entlastungen--spritpreise-sinken---zoff-in-koalition-nimmt-zu-37296236.html,https://www.stern.de/wirtschaft/news/streit-um-entlastungen--spritpreise-sinken---zoff-in-koalition-nimmt-zu-37296236.html,0,www.stern.de,Streit um Entlastungen: Spritpreise sinken - Zoff in Koalition nimmt zu,"Trotz sinkender Spritpreise kracht es in der Koalition: Klingbeil fordert Übergewinnsteuer, Reiche setzt auf Pendlerpauschale. Eine Einigung ist bislang nicht in Sicht.",https://image.stern.de/37297860/t/Id/v1/w1440/r1.7778/-/10--ovdqpldu4qv1axs2048jpeg---795fb783b90fc9a1.jpg,2026-04-10T13:15:52Z,,"Kopiere den aktuellen Link
Zur Merkliste hinzufügen
Trotz sinkender Spritpreise kracht es in der Koalition: Klingbeil fordert Übergewinnsteuer, Reiche setzt auf Pendlerpauschale. Eine Einigung ist … [+6124 chars]",,de,'Spritpreise'
https://www.zeit.de/wirtschaft/2026-04/tanken-spritpreise-finanzministerium-mehreinahmen-mehrwertsteuer,https://www.zeit.de/wirtschaft/2026-04/tanken-spritpreise-finanzministerium-mehreinahmen-mehrwertsteuer,0,www.zeit.de,Tanken: Spritpreise bringen laut Finanzministerium nicht mehr Steuereinnahmen,"Für den Staat bedeuten die gestiegenen Benzinpreise keine Mehreinnahmen, heißt es aus dem Finanzministerium. Verbraucher würden schließlich auch weniger tanken.",https://img.zeit.de/politik/deutschland/2026-04/tanken-spritpreise-finanzministerium-mehreinahmen/wide__1300x731,2026-04-10T13:50:21Z,,"Das Bundesfinanzministerium rechnet trotz der deutlich gestiegenen Kraftstoffpreise nicht damit, dass die Einnahmen aus der Mehrwertsteuer ebenfalls steigen. ""Wir gehen weiterhin nicht von Mehreinnah… [+1791 chars]",,de,'Spritpreise'
https://www.tagesschau.de/wirtschaft/verbraucher/spritpreis-update-100.html,https://www.tagesschau.de/wirtschaft/verbraucher/spritpreis-update-100.html,0,www.tagesschau.de,Tankstellen: Spritpreise sinken weiter,"Etwas Entspannung an der Zapfsäule: Der Absturz der Ölpreise kommt langsam bei den Tankstellen an. Die Kraftstoffpreise gehen weiter runter. Experten sehen aber noch ""Luft nach unten"".",https://images.tagesschau.de/image/fcfb9c4a-4214-438b-b01a-1afb020875c3/AAABnXeMULU/AAABnSSvrFg/16x9-big/tankstelle-zapfhahn-102.jpg?width=1280,2026-04-10T14:03:43Z,,"Stand: 10.04.2026 16:03 Uhr
Etwas Entspannung an der Zapfsäule: Der Absturz der Ölpreise kommt langsam bei den Tankstellen an. Die Kraftstoffpreise gehen weiter runter. Experten sehen aber noch ""Luf… [+1774 chars]",,de,'Spritpreise'
https://www.n-tv.de/wirtschaft/Bundesregierung-plant-nun-doch-strategische-Gasreserve-id30700780.html,https://www.n-tv.de/wirtschaft/Bundesregierung-plant-nun-doch-strategische-Gasreserve-id30700780.html,0,www.n-tv.de,Schutz vor neuen Energieschocks: Bundesregierung plant nun doch strategische Gasreserve,"Der Iran-Krieg stürzt die Welt in eine neue Energiekrise. In Deutschland fällt der Preisschock vergleichsweise klein aus, öffnet der Bundesregierung aber dennoch die Augen. Sie möchte nach langem Zögern vorsorglich eine strategische Gasreserve einrichten.",https://www.n-tv.de/img/30700784/1775836049/Img_16_9/1200/Technische-Anlagen-zur-Speicherung-von-Erdgas-in-unterirdischen-Kavernen-stehen-auf-dem-Gelaende-der-Speicherstation-Etzel-ESE-Solche-Erdgasspeicher-dienen-dazu-Erdgas-zwischenzuspeichern-und-Schwankungen-bei-Verbrauch-Importen-und-Entwicklungen-auf-den-internationalen-Energiemaerkten-auszugleichen.jpg,2026-04-10T14:26:44Z,,"Eine Anlage zur Speicherung von Erdgas in unterirdischen Kavernen steht auf dem Gelände der Speicherstation Etzel ESE. (Foto: picture alliance/dpa)
Der Iran-Krieg stürzt die Welt in eine neue Energi… [+3851 chars]",,de,'Gas'
https://www.faz.net/aktuell/feuilleton/musik-und-buehne/konzert/performance-von-maria-kalesnikava-im-berliner-radialsystem-200719304.html,https://www.faz.net/aktuell/feuilleton/musik-und-buehne/konzert/performance-von-maria-kalesnikava-im-berliner-radialsystem-200719304.html,0,www.faz.net,Maria Kalesnikava in Berlin: Die eindeutige Botschaft der mutigen Flötistin,Berliner Performance #freemaria der im Winter aus der Haft entlassenen belarussischen Oppositionelle Maria Kalesnikava im Radialsystem,https://media0.faz.net/image/w1200h627/96387dabf47a/w3543h1851x0y210o/202604/31e9c9b0-34c5-11f1-a9ac-40306b3a26f1/kalesnikava-in-berlin.webp,2026-04-10T17:40:00Z,,"Bühnennebel füllt den weitläufigen Konzertraum im Berliner Radialsystem, in dem die Besucher dicht gedrängt auf dem Boden sitzen. Dann wird es dunkel, sodass man sich voll auf die sanften Klänge der … [+4284 chars]",,de,'Winter'
https://www.zeit.de/news/2026-04/10/gasleck-in-havelberg,https://www.zeit.de/news/2026-04/10/gasleck-in-havelberg,0,www.zeit.de,Notfälle: Gasleck in Havelberg,Hier finden Sie Informationen zu dem Thema „Notfälle“. Lesen Sie jetzt „Gasleck in Havelberg“.,https://img.zeit.de/news/2026-04/10/gasleck-in-havelberg-image-group/wide__1300x731,2026-04-10T21:32:15Z,,"In Havelberg (Landkreis Stendal) ist bei Erdarbeiten eine Gasleitung beschädigt worden. Durch das entstandene Leck trat am Freitagabend Gas aus, wie die Polizei mitteilte. Die Anwohner sollen Fenster… [+989 chars]",,de,'Gas'
https://www.freitag.de/autoren/florian-schmid/aufstand-gegen-die-neoliberale-ordnung-2001-ein-kurzer-sommer-der-revolte,https://www.freitag.de/autoren/florian-schmid/aufstand-gegen-die-neoliberale-ordnung-2001-ein-kurzer-sommer-der-revolte,0,www.freitag.de,Bewegung | Aufstand gegen die neoliberale Ordnung: Als linke Revolte für einen Sommer möglich schien,"Vom Berliner Bankenskandal bis Genua 2001: Vor 25 Jahren schien es, als stünden ein neues 1968 und das Ende des Neoliberalismus bevor. Dann sorgte der 11. September für eine Zäsur, die die Welt bis heute prägt Gegen Ende des Winters 2001 veranstaltete das Ber…",https://www.freitag.de/autoren/florian-schmid/aufstand-gegen-die-neoliberale-ordnung-2001-ein-kurzer-sommer-der-revolte/@@images/image/great,2026-04-11T02:00:00Z,,"Gegen Ende des Winters 2001 veranstaltete das Berliner Wetter ähnliche Kapriolen wie 25 Jahre später. Im Februar gab es klirrende Kälte, Glatteis, Schneeberge – und Wärmerekorde. Turbulent war aber a… [+16952 chars]",,de,'Glatteis'
https://www.zeit.de/news/2026-04/11/spritpreise-ministerpraesident-schulze-fuer-zuegige-entlastung,https://www.zeit.de/news/2026-04/11/spritpreise-ministerpraesident-schulze-fuer-zuegige-entlastung,0,www.zeit.de,Energiepreiskrise: Spritpreise: Ministerpräsident Schulze für zügige Entlastung,Hier finden Sie Informationen zu dem Thema „Energiepreiskrise“. Lesen Sie jetzt „Spritpreise: Ministerpräsident Schulze für zügige Entlastung“.,https://img.zeit.de/news/2026-04/11/spritpreise-ministerpraesident-schulze-fuer-zuegige-entlastung-image-group/wide__1300x731,2026-04-11T03:05:04Z,,Vor dem für Sonntag geplanten Koalitionsausschuss von Union und SPD dringt Sachsen-Anhalts Ministerpräsident Sven Schulze auf schnelle Beschlüsse zum Kampf gegen die hohen Spritpreise. «Wir brauchen … [+1469 chars],,de,'Spritpreise'
https://www.zeit.de/news/2026-04/11/oekonom-erwartet-weiter-hohe-spritpreise,https://www.zeit.de/news/2026-04/11/oekonom-erwartet-weiter-hohe-spritpreise,0,www.zeit.de,Teurer Sprit: Ökonom erwartet weiter hohe Spritpreise,Hier finden Sie Informationen zu dem Thema „Teurer Sprit“. Lesen Sie jetzt „Ökonom erwartet weiter hohe Spritpreise“.,https://img.zeit.de/news/2026-04/11/oekonom-erwartet-weiter-hohe-spritpreise-image-group/wide__1300x731,2026-04-11T11:45:42Z,,"Nach der Waffenruhe im Iran-Krieg erwartet der Ökonom Carsten Brzeski kurzfristig etwas Entlastung an den Tankstellen, warnt jedoch vor anhaltend hohen Preisen und neuen Risiken. «Die Tankpreise gehe… [+2080 chars]",,de,'Spritpreise'
https://www.tagesschau.de/wirtschaft/bauernverband-spritpreise-100.html,https://www.tagesschau.de/wirtschaft/bauernverband-spritpreise-100.html,0,www.tagesschau.de,Bauernverband fordert Unterstützung wegen steigender Spritpreise,Die Landwirtschaft bekommt die hohen Preise für Diesel und Dünger besonders stark zu spüren. Bauernpräsident Rukwied fordert schnelle Unterstützung und warnt: Andernfalls werden am Ende Lebensmittel teurer.,https://images.tagesschau.de/image/2bbd10e4-d0f3-4f48-887c-e4f35fb4a772/AAABnYD1za4/AAABnSSvrFg/16x9-big/traktor-feld-116.jpg?width=1280,2026-04-12T10:06:14Z,,"Stand: 12.04.2026 12:06 Uhr
Die Landwirtschaft bekommt die hohen Preise für Diesel und Dünger besonders stark zu spüren. Bauernpräsident Rukwied fordert schnelle Unterstützung und warnt: Andernfalls… [+2329 chars]",,de,'Spritpreise'
https://www.zeit.de/news/2026-04/12/dampfer-chef-hofft-zur-hauptsaison-auf-sinkende-spritpreise,https://www.zeit.de/news/2026-04/12/dampfer-chef-hofft-zur-hauptsaison-auf-sinkende-spritpreise,0,www.zeit.de,Schifffahrt in Potsdam: Dampfer-Chef hofft zur Hauptsaison auf sinkende Spritpreise,Hier finden Sie Informationen zu dem Thema „Schifffahrt in Potsdam“. Lesen Sie jetzt „Dampfer-Chef hofft zur Hauptsaison auf sinkende Spritpreise“.,https://img.zeit.de/news/2026-04/12/dampfer-chef-hofft-zur-hauptsaison-auf-sinkende-spritpreise-image-group/wide__1300x731,2026-04-12T11:09:41Z,,Zum Start der Hauptsaison für die Potsdamer Ausflugs- und Linienschiffe hofft der Chef der Weissen Flotte auf bald wieder sinkende Spritpreise. «Glücklicherweise haben wir uns vor der Saison eingedec… [+1463 chars],,de,'Spritpreise'
https://www.tagesspiegel.de/berlin/schifffahrt-in-potsdam-dampfer-chef-hofft-zur-hauptsaison-auf-sinkende-spritpreise-15463070.html,https://www.tagesspiegel.de/berlin/schifffahrt-in-potsdam-dampfer-chef-hofft-zur-hauptsaison-auf-sinkende-spritpreise-15463070.html,0,www.tagesspiegel.de,Schifffahrt in Potsdam: Dampfer-Chef hofft zur Hauptsaison auf sinkende Spritpreise,Flottenparade in Potsdam: Von Kohle bis Hybrid – wie das Schifffahrt-Unternehmen Weisse Flotte trotz der Kraftstoff-Krise Kurs hält und warum die Preise für Ausflüge vorerst nicht steigen sollen.,https://www.tagesspiegel.de/images/15463069/alternates/BASE_16_9_W1400/1775992238000/wei-e-flotte-potsdam-startet-in-die-saison-2026.jpeg,2026-04-12T11:10:38Z,,Zum Start der Hauptsaison für die Potsdamer Ausflugs- und Linienschiffe hofft der Chef der Weissen Flotte auf bald wieder sinkende Spritpreise. Glücklicherweise haben wir uns vor der Saison eingedeck… [+1505 chars],,de,'Spritpreise'
https://www.bild.de/politik/inland/spritpreis-um-12-uhr-nur-leicht-gesunken-ein-cent-billiger-als-gestern-69db48400695c741e3c2a747,https://www.bild.de/politik/inland/spritpreis-um-12-uhr-nur-leicht-gesunken-ein-cent-billiger-als-gestern-69db48400695c741e3c2a747,0,www.bild.de,Spritpreis nach 12 Uhr nur leicht gesunken - Ein Cent billiger als gestern!,"ADAC meldet kurze Entspannung am Vormittag, doch ab Mittag ziehen Spritpreise an. Ölpreis bleibt entscheidend.","https://images.bild.de/69db48400695c741e3c2a747/164be7c3ebf174c9b68146c85bf7ce4f,6a92c437?w=1280",2026-04-12T11:31:43Z,,TTS-Player überspringenArtikel weiterlesenBerlin  Nach wie vor schmerzt der Blick auf die Tankstellen-Anzeigen die Spritpreise sind weiter hoch. Aber: Auch am Sonntag gab es eine minimale Entspannung… [+1743 chars],,de,'Spritpreise'
https://www.stern.de/wirtschaft/news/benzin-und-diesel--spritpreise-gehen-weiter-zurueck---hohe-mittagsspruenge-37301416.html,https://www.stern.de/wirtschaft/news/benzin-und-diesel--spritpreise-gehen-weiter-zurueck---hohe-mittagsspruenge-37301416.html,0,www.stern.de,Benzin und Diesel: Spritpreise gehen weiter zurück - Hohe Mittagssprünge,"Die Preise an den Tankstellen sinken weiter, doch die Preissprünge am Mittag sind beachtlich. Der ADAC sieht die Preisgestaltung der Mineralölkonzerne kritisch.",https://image.stern.de/37301418/t/Cl/v1/w1440/r1.7778/-/12--7hjgrjh2ziv7axs2048jpeg---74a78c2674e98146.jpg,2026-04-12T11:51:51Z,,"Kopiere den aktuellen Link
Zur Merkliste hinzufügen
Die Preise an den Tankstellen sinken weiter, doch die Preissprünge am Mittag sind beachtlich. Der ADAC sieht die Preisgestaltung der Mineralölkon… [+1294 chars]",,de,'Spritpreise'
https://www.zeit.de/news/2026-04/12/spritpreise-gehen-weiter-zurueck-hohe-mittagsspruenge,https://www.zeit.de/news/2026-04/12/spritpreise-gehen-weiter-zurueck-hohe-mittagsspruenge,0,www.zeit.de,Benzin und Diesel: Spritpreise gehen weiter zurück - Hohe Mittagssprünge,Hier finden Sie Informationen zu dem Thema „Benzin und Diesel“. Lesen Sie jetzt „Spritpreise gehen weiter zurück - Hohe Mittagssprünge“.,https://img.zeit.de/news/2026-04/12/spritpreise-gehen-weiter-zurueck-hohe-mittagsspruenge-image-group/wide__1300x731,2026-04-12T11:51:51Z,,"Die Spritpreise haben erneut nachgegeben, allerdings weniger als in den Vortagen. Diesel verbilligte sich im bundesweiten Tagesdurchschnitt des Samstags um 1,4 Cent auf 2,301 Euro pro Liter, wie der … [+1118 chars]",,de,'Spritpreise'
https://www.tagesspiegel.de/wirtschaft/benzin-und-diesel-spritpreise-gehen-weiter-zuruck-hohe-mittagssprunge-15463196.html,https://www.tagesspiegel.de/wirtschaft/benzin-und-diesel-spritpreise-gehen-weiter-zuruck-hohe-mittagssprunge-15463196.html,0,www.tagesspiegel.de,Benzin und Diesel: Spritpreise gehen weiter zurück - Hohe Mittagssprünge,"Die Preise an den Tankstellen sinken weiter, doch die Preissprünge am Mittag sind beachtlich. Der ADAC sieht die Preisgestaltung der Mineralölkonzerne kritisch.",https://www.tagesspiegel.de/images/15463195/alternates/BASE_16_9_W1400/1775994794000/spritpreise.jpeg,2026-04-12T11:53:14Z,,"Die Spritpreise haben erneut nachgegeben, allerdings weniger als in den Vortagen. Diesel verbilligte sich im bundesweiten Tagesdurchschnitt des Samstags um 1,4 Cent auf 2,301 Euro pro Liter, wie der … [+1172 chars]",,de,'Spritpreise'
https://www.welt.de/politik/deutschland/article69db8e57246b3860d5024080/benzin-und-diesel-strassenblockaden-in-irland-wegen-hoher-spritpreise-hohe-mittagsspruenge-in-deutschland.html,https://www.welt.de/politik/deutschland/article69db8e57246b3860d5024080/benzin-und-diesel-strassenblockaden-in-irland-wegen-hoher-spritpreise-hohe-mittagsspruenge-in-deutschland.html,0,www.welt.de,Straßenblockaden in Irland wegen hoher Spritpreise – hohe Mittagssprünge in Deutschland,"In Irland wird seit sechs Tagen gegen die hohen Spritpreise demonstriert, die Polizei musste am Sonntag gar Straßenblockaden auflösen. In Deutschland zeigten sich am Sonntag drastische Preissprünge.",https://images.welt.de/69db8e57246b3860d5024080/ec483b676274249a1ca4ca9c25bd46c1/ci16x9-w1200/dpa-com-20090101-260411-99-95865-jpg,2026-04-12T13:35:07Z,,"In Irland wird seit sechs Tagen gegen die hohen Spritpreise demonstriert, die Polizei musste am Sonntag gar Straßenblockaden auflösen. In Deutschland zeigten sich am Sonntag drastische Preissprünge.D… [+3279 chars]",,de,'Spritpreise'
https://www.stern.de/news/union-und-spd-ringen-um-entlastungen---weidel-bietet-merz-zusammenarbeit-an-37298796.html,https://www.stern.de/news/union-und-spd-ringen-um-entlastungen---weidel-bietet-merz-zusammenarbeit-an-37298796.html,0,www.stern.de,Union und SPD ringen um Entlastungen - Weidel bietet Merz Zusammenarbeit an,"Das Ringen der Koalitionsspitzen um eine Entlastung der Bürger von den hohen Energiekosten und gemeinsame Reformvorhaben ist am Wochenende zunächst ohne öffentlich bekannt gewordenes Ergebnis geblieben. Bundeskanzler Friedrich Merz (CDU), die SPD-Vorsitzenden…",https://image.stern.de/37301618/t/T8/v1/w1440/r1.7778/-/12--bas-merz-und-klingbeil-vl-anfang-februar---a641e8541e6cc6b4.jpg,2026-04-12T13:43:49Z,,"Kopiere den aktuellen Link
Zur Merkliste hinzufügen
Das Ringen der Koalitionsspitzen um eine Entlastung der Bürger von den hohen Energiekosten und gemeinsame Reformvorhaben ist am Wochenende zunäch… [+3748 chars]",,de,'Spritpreise'
https://www.sueddeutsche.de/politik/iran-krieg-folgen-regierung-koalition-krisengipfel-villa-borsig-li.3466561,https://www.sueddeutsche.de/politik/iran-krieg-folgen-regierung-koalition-krisengipfel-villa-borsig-li.3466561,0,www.sueddeutsche.de,Bundesregierung: Koalition sucht Auswege aus ihrer Krise,"Am Tegeler See kommen die Spitzen von CDU, CSU und SPD zusammen, um den Streit über die hohen Spritpreise beizulegen und ein Reformpaket auf den Weg zu bringen. Doch bei vielen Fragen liegt man immer noch weit auseinander.",https://www.sueddeutsche.de/2026/04/12/10f7378c-9887-45d0-84b6-e815fccaf8e0.jpg?q=60&fm=webp&width=1200&rect=0%2C209%2C4000%2C2250,2026-04-12T14:08:43Z,,"Am Tegeler See kommen die Spitzen von CDU, CSU und SPD zusammen, um den Streit über die hohen Spritpreise beizulegen und ein Reformpaket auf den Weg zu bringen. Doch bei vielen Fragen liegt man immer… [+67 chars]",,de,'Spritpreise'
https://taz.de/Spritpreise-Libanon-Artemis/!6169925/,https://taz.de/Spritpreise-Libanon-Artemis/!6169925/,0,taz.de,"Spritpreise, Libanon, Artemis: Gott sei Tank!","Die Landraub-Logik der israelischen Regierung, eine Arktisinsel namens „Gefahrenzone“, der Papst im Pornokino. Und sexistische Literaturkritik im ARD.",https://taz.de/picture/8373228/1200/Kueppersbusch-Artemis.jpeg,2026-04-12T14:19:00Z,,"Die Landraub-Logik der israelischen Regierung, eine Arktisinsel namens „Gefahrenzone“, der Papst im Pornokino. Und sexistische Literaturkritik im ARD. mehr...",,de,'Spritpreise'
https://taz.de/Tempolimit/!6169992/,https://taz.de/Tempolimit/!6169992/,0,taz.de,Tempolimit: Langsam fahren ist billig,"Während die Koalition über hohe Spritpreise berät, fordert Greenpeace ein Tempolimit. Das könnte nicht nur den Geldbeutel der Fah­re­r:in­nen schonen.",https://taz.de/picture/8373516/1200/32653587.jpeg,2026-04-12T14:24:00Z,,"Während die Koalition über hohe Spritpreise berät, fordert Greenpeace ein Tempolimit. Das könnte nicht nur den Geldbeutel der Fah­re­r:in­nen schonen. mehr...",,de,'Spritpreise'
https://www.zeit.de/2026/16/kinder-religion-gott-fragen-tod-eltern-regina-laudage-kleeberg,https://www.zeit.de/2026/16/kinder-religion-gott-fragen-tod-eltern-regina-laudage-kleeberg,0,www.zeit.de,"Kinder und Religion: ""Kinder zwingen uns, über Religion nachzudenken""","Oft stellen schon die Kleinsten Fragen nach Himmel, Gott und Gerechtigkeit. Was soll man ihnen antworten? Ein Gespräch mit der Autorin Regina Laudage-Kleeberg",https://img.zeit.de/2026/16/kinder-zwingen-uns-ueber-religion-nachzudenken-bild-1/wide__1300x731,2026-04-12T14:55:34Z,,"DIE ZEIT: Frau Laudage-Kleeberg, wann haben Sie zum ersten Mal gemerkt, dass Kinder Fragen haben, die über die irdische Welt hinausgehen?
Regina Laudage-Kleeberg: Da muss mein Sohn etwa vier Jahre a… [+875 chars]",,de,'Kinder'
https://www.welt.de/politik/deutschland/article69dba6c10695c741e3c2ad7f/klausurtagung-in-cottbus-die-mehrheit-ist-da-afd-fordert-schnelle-entlastung-fuer-autofahrer-und-sendet-signal-an-cdu.html,https://www.welt.de/politik/deutschland/article69dba6c10695c741e3c2ad7f/klausurtagung-in-cottbus-die-mehrheit-ist-da-afd-fordert-schnelle-entlastung-fuer-autofahrer-und-sendet-signal-an-cdu.html,0,www.welt.de,„Die Mehrheit ist da“ – AfD fordert schnelle Entlastung für Autofahrer und sendet Signal an CDU,Die AfD attackiert die Bundesregierung wegen hoher Spritpreise – und fordert drastische Entlastungen für Autofahrer. Alice Weidel wirft Schwarz-Rot Untätigkeit vor und wirbt um eine Zusammenarbeit mit der Union.,https://images.welt.de/69dba6c10695c741e3c2ad7f/dfd89b1d171646dee5456eead235d99f/ci16x9-w1200/dpa-com-20090101-260412-911-013548-jpg,2026-04-12T15:20:51Z,,Die AfD attackiert die Bundesregierung wegen hoher Spritpreise und fordert drastische Entlastungen für Autofahrer. Alice Weidel wirft Schwarz-Rot Untätigkeit vor und wirbt um eine Zusammenarbeit mit … [+4140 chars],,de,'Spritpreise'
