index,url,valid,domain,title,description,image,published,archive,content,quote,language,keyword
https://www.bild.de/leben-wissen/lifestyle/bataclan-als-is-terroristen-ihnen-das-liebste-nahmen-fanden-sie-sich-68f5f3f27e2d7167e63bba8f,https://www.bild.de/leben-wissen/lifestyle/bataclan-als-is-terroristen-ihnen-das-liebste-nahmen-fanden-sie-sich-68f5f3f27e2d7167e63bba8f,0,www.bild.de,Anschlag aufs Bataclan - Zehn Jahre nach dem Terror hat die Liebe gesiegt,Der Deutsche Johannes (52) und die Französin Floriane (37) verloren vor zehn Jahren ihre Partner bei den Anschlägen in Paris. Heute haben sie zwei Kinder.,"https://images.bild.de/68f5f3f27e2d7167e63bba8f/77f314830345c6da9240928c18645faa,af8e96f1?w=1280",2025-11-12T17:28:47Z,,"TTS-Player überspringenArtikel weiterlesenParis/Lyon Vor dem Notausgang des Bataclan pressen sich trotzig ein paar gelbköpfige Löwenzähne durch den rissigen Asphalt. Dort, wo vor zehn Jahren am Vendr… [+11775 chars]",,de,'Kinder'
https://www.n-tv.de/leute/Helene-Fischer-stellt-Tournee-als-Mutter-vor-id30013941.html,https://www.n-tv.de/leute/Helene-Fischer-stellt-Tournee-als-Mutter-vor-id30013941.html,0,www.n-tv.de,"""Es wird ein Riesen-Fest"": Helene Fischer stellt Tournee ""als Mutter"" vor","Dafür, ihr Leben bis in alle Ewigkeit als Hausfrau, Mutter und Sängerin von Kinderliedern zu fristen, ist Helene Fischer nicht gemacht. Deshalb geht sie nächstes Jahr auch wieder auf große Stadion-Tournee. Jetzt verrät sie, was das Publikum erwarten kann.",https://www.n-tv.de/img/30013951/1762962371/Img_16_9/1200/Helene-Fischer-nimmt-an-einem-Fototermin-vor-Beginn-der-Pressekonferenz-zu-ihrer-Tour-2026-teil.jpg,2025-11-12T17:32:10Z,,"""Es wird ein Riesen-Fest""Helene Fischer stellt Tournee ""als Mutter"" vor
Verspricht ihren Fans eine große Party: Helene Fischer. (Foto: picture alliance/dpa)
Dafür, ihr Leben bis in alle Ewigkeit al… [+3091 chars]",,de,'Kinder'
https://www.focus.de/panorama/welt/und-dann-zerreisst-es-christina-block-schock-moment-lenkt-licht-auf-zentrales-thema_c883405e-1f7a-4f0c-9227-e91e4749e5fd.html,https://www.focus.de/panorama/welt/und-dann-zerreisst-es-christina-block-schock-moment-lenkt-licht-auf-zentrales-thema_c883405e-1f7a-4f0c-9227-e91e4749e5fd.html,0,www.focus.de,Dann zerreißt es Christina Block - und der ganze Saal ist gespenstisch still,Ein Beweismittel erschüttert im Gerichtsverfahren gegen Christina Block alle Beteiligten: Audiodateien von der Nacht der Entführung ihrer Kinder offenbaren die Panik der Opfer hautnah. Und lenken so die Aufmerksamkeit auf ein bislang unterrepräsentiertes Them…,https://quadro.burda-forward.de/ctf/87dcb5bc-3d51-48ca-b24f-a5f19f71ea27.de97d050-e628-4452-ba8f-a65fc0b40b5a.jpeg?im=RegionOfInterestCrop%3D%281200%2C630%29%2CregionOfInterest%3D%28939%2C542%29&hash=a2b3dd34e06903c137f6bc4092bdb8abe850ca17181d29ee7473cf9182cf53a3,2025-11-12T17:58:50Z,,"<ul><li>Im Video oben: Im Gericht laufen Tonaufnahmen von der Entführung - Christina Block bricht in Tränen aus</li></ul>Dieser Schrei. Die Panik, die darin zu erkennen ist, wie sich die Stimmbänder … [+4545 chars]",,de,'Kinder'
https://www.jungewelt.de/artikel/512183.kindeswohl-im-kapitalismus-5-6-7-arm-geblieben.html,https://www.jungewelt.de/artikel/512183.kindeswohl-im-kapitalismus-5-6-7-arm-geblieben.html,0,www.jungewelt.de,"Kindeswohl im Kapitalismus: 5, 6, 7 … arm geblieben","UNICEF stellt Report zur Lage der Kinder im Land vor. Bilanz: Jedes siebente Kind ist arm, fast jedes zehnte muss auf Grundlegendes verzichten. Zudem verschärfen sich die Differenzen bei Bildung und Gesundheit.",https://www.jungewelt.de/img/1100/215541.jpg,2025-11-12T18:36:59Z,,"Wie geht es den Kindern hierzulande? Man ahnt es, es geht ihnen schlecht. Schon seit längerem, und es wird schlimmer. Zu diesem Ergebnis kommt der »Bericht zur Lage der Kinder in Deutschland 2025«, d… [+3355 chars]",,de,'Kinder'
https://www.focus.de/gesundheit/ernaehrung/eltern-aufpassen-diese-kinderprodukte-sind-die-reinste-geldverschwendung_8f25d427-3b03-4281-b93a-cfd0e2605a28.html,https://www.focus.de/gesundheit/ernaehrung/eltern-aufpassen-diese-kinderprodukte-sind-die-reinste-geldverschwendung_8f25d427-3b03-4281-b93a-cfd0e2605a28.html,0,www.focus.de,Eltern aufpassen: Diese Kinderprodukte sind die reinste Geldverschwendung,Die Verbraucherzentrale Brandenburg warnt vor unnötigen Kinderlebensmitteln. Ernährungswissenschaftler Uwe Knop erklärt die Hintergründe.,https://quadro.burda-forward.de/ctf/5fc4125e-7ef7-41ca-a4f2-1ecdf923e56b.6cd2da9c-3b37-458f-a40a-faca03038ccd.png?im=RegionOfInterestCrop%3D%281200%2C630%29%2CregionOfInterest%3D%281033%2C457%29&hash=e1ade497c0eba61baec555d1b707a2773426000c6c9163de0f014baed738eea0,2025-11-12T21:51:13Z,,"Die Verbraucherzentrale Brandenburg warnt vor unnötigen Kinderlebensmitteln. Ernährungswissenschaftler Uwe Knop erklärt die Hintergründe und beantwortet die relevanten Fragen:
Worum genau geht es be… [+6242 chars]",,de,'Kinder'
https://www.welt.de/regionales/hamburg/article691505a271dafa6e0afd222b/christina-block-natuerlich-haben-sie-mama-gesagt.html,https://www.welt.de/regionales/hamburg/article691505a271dafa6e0afd222b/christina-block-natuerlich-haben-sie-mama-gesagt.html,0,www.welt.de,„Natürlich haben sie Mama gesagt“,Bis zur Entführung hatte Christina Block zweieinhalb Jahre lang keinen Kontakt mit ihren Kindern. Wie war das Wiedersehen Anfang 2024? Die Angeklagte beantwortet Fragen einer Gutachterin.,https://images.welt.de/691505a271dafa6e0afd222b/f678636f62988d9ecf407cbd91c5ab38-master/ci16x9-w1200/dpa-com-20090101-251112-911-007702-jpg,2025-11-12T22:13:50Z,,Zweieinhalb Jahre hatte Block zu diesem Zeitpunkt bereits keinen Kontakt mehr zu ihren Kindern gehabt. Der in Dänemark lebende Vater hatte den Jungen und das Mädchen nach einem Wochenendbesuch im Som… [+1170 chars],,de,'Kinder'
https://www.tagesspiegel.de/sport/winterspiele-in-cortina-fur-bob-ikone-friedrich-zahlt-nur-das-dritte-gold-double-14825711.html,https://www.tagesspiegel.de/sport/winterspiele-in-cortina-fur-bob-ikone-friedrich-zahlt-nur-das-dritte-gold-double-14825711.html,0,www.tagesspiegel.de,Winterspiele in Cortina: Für Bob-Ikone Friedrich zählt nur das dritte Gold-Double,Die Olympia-Mission in Cortina d'Ampezzo ist kurzfristig in Gefahr geraten. Ein Missgeschick ereilt Friedrich. Auch sein Topsprinter ist aus dem Rennen. Nun ist der Bobpilot wieder in seinem Element.,https://www.tagesspiegel.de/images/14825708/alternates/BASE_16_9_W1400/1763022905000/deutsches-bob-team-testet-olympia-strecke-in-cortina-d-ampezzo.jpeg,2025-11-13T08:35:05Z,,"Die Kurve vier der neu gebauten Olympia-Bahn im Eugenio Monti Sliding Centre ist schon als Scharfrichter in den Fokus gerückt. Trifft man die Einfahrt nicht richtig, wird der Bob an der oberen Holzba… [+3509 chars]",,de,'Winter'
https://www.bild.de/sport/fussball/tuschel-thema-beim-1-fc-koeln-hauen-diese-3-kwasniok-stars-im-winter-ab-69158950418baeaaac0ea5be,https://www.bild.de/sport/fussball/tuschel-thema-beim-1-fc-koeln-hauen-diese-3-kwasniok-stars-im-winter-ab-69158950418baeaaac0ea5be,0,www.bild.de,Tuschel-Thema beim FC - Hauen diese 3 Köln-Stars im Winter ab?,Der starke Saisonstart beim 1. FC Köln hat auch Verlierer! Das große Tuschel-Thema am Geißbockheim: Hauen diese 3 Köln-Stars im Winter ab?,"https://images.bild.de/69158950418baeaaac0ea5be/e8e95761b274a6f39e832e41aa6b663f,35a350b2?w=1280",2025-11-13T09:48:14Z,,"Der starke Saisonstart beim 1. FC Köln hat auch Verlierer!
Der Aufsteiger (Platz 9) ist DAS Überraschungsteam der Liga. Über 20 Transferbewegungen im Sommer haben aber auch dazu geführt, dass der Ko… [+275 chars]",,de,'Winter'
https://www.faz.net/aktuell/wissen/medizin-ernaehrung/saisonale-depression-so-entkommen-sie-der-novemberdepression-110740675.html,https://www.faz.net/aktuell/wissen/medizin-ernaehrung/saisonale-depression-so-entkommen-sie-der-novemberdepression-110740675.html,0,www.faz.net,Trübsinn im November: Wie Sie der Winterdepression entkommen,Depressive Verstimmungen plagen viele Menschen in der dunklen Jahreszeit. Lichttherapien helfen. Aber Sie sollten auch andere Mittel gegen den Trübsinn kennen.,https://media1.faz.net/ppmedia/w1200/aktuell/gesellschaft/2521524902/1.10778665/facebook_teaser/an-trueben-herbst-und.jpg.webp,2025-11-13T10:55:09Z,,"Haben Sie auch ungewöhnlich große Lust auf Süßes? Ist der Nachtisch in der Kantine unwiderstehlich, und löst sich die Tafel Schokolade an einem Abend in Luft auf? Und geht es Ihnen immer so, im Oktob… [+569 chars]",,de,'Winter'
https://www.focus.de/politik/ausland/500-millionen-dollar-waffenpaket-nord-und-baltikstaaten-staerken-ukraine-vor-dem-winter_eca3f51b-8c53-41e1-84f1-2814961c8ba9.html,https://www.focus.de/politik/ausland/500-millionen-dollar-waffenpaket-nord-und-baltikstaaten-staerken-ukraine-vor-dem-winter_eca3f51b-8c53-41e1-84f1-2814961c8ba9.html,0,www.focus.de,500-Millionen-Dollar-Waffenpaket: Nord- und Baltikstaaten stärken Ukraine vor dem Winter,Die Ukraine braucht dringend weitere Waffen für den Abwehrkampf gegen Russland. Nordeuropäische Nato-Staaten geben jetzt Geld für Lieferungen eines anderen Alliierten.,https://quadro.burda-forward.de/ctf/5b98489a-1e22-4af6-9d48-eaf026bf0943.8b22cc71-bf58-49d5-8bf0-f274ed9daf4b.jpeg?im=RegionOfInterestCrop%3D%281200%2C630%29%2CregionOfInterest%3D%28716%2C750%29&hash=171a4fa04b191be1bbc20391ee2b04403e867375fde24fdd26edae69b42a3ea7,2025-11-13T11:12:01Z,,Die nordischen und baltischen Nato-Länder finanzieren gemeinsam neue US-Waffenlieferungen an die von Russland angegriffene Ukraine. Die Lieferung von militärischer Ausrüstung und Munition im Wert von… [+1253 chars],,de,'Winter'
https://www.focus.de/finanzen/eltern-aufgepasst-viele-kinder-gehen-bei-der-fruehstart-rente-zunaechst-leer-aus_b850436b-71f4-435c-b2a1-82d3096cdab4.html,https://www.focus.de/finanzen/eltern-aufgepasst-viele-kinder-gehen-bei-der-fruehstart-rente-zunaechst-leer-aus_b850436b-71f4-435c-b2a1-82d3096cdab4.html,0,www.focus.de,Eltern aufgepasst: Viele Kinder gehen bei der Frühstart-Rente zunächst leer aus,Eigentlich sollten alle Sechs- bis 18-Jährigen ab 2026 das neue Rentenstartgeld bekommen. Jetzt ist erst einmal nur Geld für eine Alterskohorte vorgesehen. Warum nur die Jüngsten profitieren.,https://quadro.burda-forward.de/ctf/26e10286-cb8c-4908-8c9d-582ba57ff3f3.29b9faed-afb5-46bc-9a3c-2ba76c6e27ef.jpeg?im=RegionOfInterestCrop%3D%281200%2C630%29%2CregionOfInterest%3D%28943%2C799%29&hash=61aa4013468192cfb4088ed7960222b80a74b550f5fbe4a21a7e93bf61d10794,2025-11-13T11:43:09Z,,Eigentlich sollten alle Kinder zwischen sechs und 18 Jahren vom neuen Rentenstartgeld profitieren doch nun bekommen es vorerst nur die Jüngsten. Die sogenannte Frühstart-Rente sieht zehn Euro pro Mon… [+1029 chars],,de,'Kinder'
https://taz.de/Evakuierung-ukrainischer-Kinderheime/!6128816/,https://taz.de/Evakuierung-ukrainischer-Kinderheime/!6128816/,0,taz.de,Evakuierung ukrainischer Kinderheime: Zurück nach Hause?,"Viele ukrainische Heime wurden ins Ausland evakuiert, wo Kinder mit Behinderung besser versorgt werden. Doch was, wenn die Ukraine sie zurückwill?",https://taz.de/picture/8053202/1200/39675625.jpeg,2025-11-13T11:51:00Z,,"Viele ukrainische Heime wurden ins Ausland evakuiert, wo Kinder mit Behinderung besser versorgt werden. Doch was, wenn die Ukraine sie zurückwill? mehr...",,de,'Kinder'
https://www.stern.de/gesellschaft/regional/bayern/mehr-als-500-000-euro--profi-clubs-und-amateure-foerdern-gemeinsam-kinderfussball-36341870.html,https://www.stern.de/gesellschaft/regional/bayern/mehr-als-500-000-euro--profi-clubs-und-amateure-foerdern-gemeinsam-kinderfussball-36341870.html,0,www.stern.de,Mehr als 500.000 Euro: Profi-Clubs und Amateure fördern gemeinsam Kinderfußball,Kinderfußball boomt in Bayern. Für die vielen jungen Spielerinnen und Spieler werden auch Trainer benötigt. Der Verband und die Profi-Clubs starten und finanzieren ein gemeinsames Projekt.,https://image.stern.de/36341872/t/54/v1/w1440/r1.7778/-/13--e2qt3hj35pv5axs2048jpeg---e612ff0e007e59c4.jpg,2025-11-13T12:00:16Z,,"Kopiere den aktuellen Link
Zur Merkliste hinzufügen
Kinderfußball boomt in Bayern. Für die vielen jungen Spielerinnen und Spieler werden auch Trainer benötigt. Der Verband und die Profi-Clubs start… [+2202 chars]",,de,'Kinder'
https://kaernten.orf.at/stories/3329901/,https://kaernten.orf.at/stories/3329901/,0,kaernten.orf.at,90.000 Menschen armutsgefährdet,"In der aktuellen Stunde ist am Donnerstag auf Antrag des Team Kärnten die Armut im Land diskutiert worden. 90.000 Menschen gelten als arm oder armutsgefährdet, darunter auch viele Kinder. Die Opposition verlangt mehr Unterstützung, die Regierungsparteien verw…",https://ibs.orf.at/ktn?image=https%3A%2F%2Foekastatic.orf.at%2Fmojo%2F1_4_1%2Fstoryserver%2Foeka%2Fcommon%2Fimages%2Fog-fallback-ktn.png%3Fs%3Dd1ef40bef2ffd65644b4df37900c0e4d80e97249,2025-11-13T12:07:58Z,,"Alleinerziehende, Pensionisten, pflegende Angehörige, Teilzeitbeschäftigte. Armut ist hauptsächlich weiblich. Hier müsse eingegriffen werden mit mehr Übergangspflege und Kinderbetreuung, damit nicht … [+2206 chars]",,de,'Kinder'
https://www.sueddeutsche.de/projekte/artikel/reise/namibia-urlaub-familie-kinder-safari-e331886/,https://www.sueddeutsche.de/projekte/artikel/reise/namibia-urlaub-familie-kinder-safari-e331886/,0,www.sueddeutsche.de,Afrika-Reise mit Kindern: Staunen und nicht gefressen werden,"Sollte man mit Kindern einen Campingtrip in Afrika wagen? Unser Autor hat es in Namibia ausprobiert. Eine Reise durch beeindruckende Landschaften, zu großen und kleinen Tieren – und einem ambivalenten Fazit.","https://www.sueddeutsche.de/projekte/artikel/reise/namibia-urlaub-familie-kinder-safari-e331886/c8baed7850e3b2ec6e08b458f5b0720ea32e935371463ca173cc9e1c77d8084e_w2400_h1256_r758,0,2631,1377_q70.jpg",2025-11-13T12:08:00Z,,"Natürlich ging es schon vor dem Auftakt dieser Reise um wilde Tiere, weil es auf Afrika-Reisen irgendwie meistens um wilde Tiere geht. Auf einer durchaus vertrauenswürdigen Webseite über Ausflüge mit… [+222 chars]",,de,'Kinder'
https://www.stern.de/panorama/wissen/kinderlaehmung--was-der-nachweis-von-polio-wildviren-im-abwasser-bedeutet-36341486.html,https://www.stern.de/panorama/wissen/kinderlaehmung--was-der-nachweis-von-polio-wildviren-im-abwasser-bedeutet-36341486.html,0,www.stern.de,Kinderlähmung: Was der Nachweis von Polio-Wildviren im Abwasser bedeutet,"Eigentlich kommen Polio-Wildviren fast nur noch in Afghanistan und Pakistan vor. In Deutschland gab es für den Erreger, der zu Kinderlähmung führen können, lange keinen Nachweis - bis jetzt.",https://image.stern.de/36342190/t/uw/v1/w1440/r1.7778/-/13--k2jamlvb6sv2axs2048jpeg---141bbf32adb52996.jpg,2025-11-13T13:00:12Z,,"Kopiere den aktuellen Link
Zur Merkliste hinzufügen
Eigentlich kommen Polio-Wildviren fast nur noch in Afghanistan und Pakistan vor. In Deutschland gab es für den Erreger, der zu Kinderlähmung führ… [+5095 chars]",,de,'Kinder'
https://oe3.orf.at/sendungen/stories/3050774/,https://oe3.orf.at/sendungen/stories/3050774/,0,oe3.orf.at,Kindergarten schließen oder weiter kämpfen?,Am Samstag diskutieren Tina Ritschl und Martin Ziniel wieder mit dem ganzen Land und lösen die Dilemmas der Ö3-Gemeinde.,https://tubestatic.orf.at/static/images/site/tube/20251042/vorlage_472_x_600_472_x_600_px_624_x_351_px_624_x_351_px_7.6034730.png,2025-11-13T13:09:00Z,,"Am Samstag diskutieren Tina Ritschl und Martin Ziniel wieder mit dem ganzen Land und lösen die Dilemmas der Ö3-Gemeinde.
1. Dilemma (Magdalena, 36)
Liebe Tina, lieber Martin. Ich betreibe seit 8 Ja… [+3621 chars]",,de,'Kinder'
https://www.n-tv.de/wissen/Wann-eine-Lebensmittelvergiftung-gefaehrlich-wird-id30025730.html,https://www.n-tv.de/wissen/Wann-eine-Lebensmittelvergiftung-gefaehrlich-wird-id30025730.html,0,www.n-tv.de,"""Koch es, schäle es oder lasse es"": Wann eine Lebensmittelvergiftung gefährlich wird",Zwei Kinder und ihre Mutter aus Deutschland sind während eines Besuchs in Istanbul gestorben. Der Vater wird noch auf der Intensivstation behandelt. Als Todesursache stehen Lebensmittelvergiftungen im Raum. Was es zum Thema zu wissen gibt.,https://www.n-tv.de/img/30025735/1763199104/Img_16_9/1200/In-einem-tuerkischen-Stand-fuer-Streetfood-der-von-den-tuerkischen-Behoerden-geschlossen-wurde-steht-noch-ein-Topf-mit-Muscheln-Streetfood-beim-Istanbul-Besuch-koennte-mehreren-Mitgliedern-einer-Familie-aus-Hamburg-das-Leben-gekostet-haben-Nach-dem-Tod-der-drei-und-sechs-Jahre-alten-Kinder-ist-auch-die-Mutter-im-Krankenhaus-gestorben-wie-die-Nachrichtenagentur-DHA-berichtete-Der-Vater-werde-noch-auf-der-Intensivstation-behandelt-Im-Verdacht-steht-eine-Lebensmittelvergiftung-Ob-tatsaechlich-die-verzehrten-Speisen-die-Todesfaelle-verursacht-haben-ist-aber-unklar.jpg,2025-11-15T10:17:31Z,,"Im Gewebe von Muscheln können sich Toxine bilden. (Foto: picture alliance/dpa)
Zwei Kinder und ihre Mutter aus Deutschland sind während eines Besuchs in Istanbul gestorben. Der Vater wird noch auf d… [+3302 chars]",,de,'ältere Menschen'
https://www.tagesspiegel.de/politik/es-geht-nicht-ums-sparen-streeck-fordert-paradigmenwechsel-bei-behandlung-alterer-menschen--und-fuhlt-sich-missverstanden-14849285.html,https://www.tagesspiegel.de/politik/es-geht-nicht-ums-sparen-streeck-fordert-paradigmenwechsel-bei-behandlung-alterer-menschen--und-fuhlt-sich-missverstanden-14849285.html,0,www.tagesspiegel.de,„Es geht nicht ums Sparen“ : Streeck fordert Paradigmenwechsel bei Behandlung älterer Menschen – und fühlt sich missverstanden,"Der CDU-Politiker hat mit seinem Vorstoß, Therapien für Hochbetagte zu hinterfragen, polarisiert. Dabei fühlt sich der Mediziner missverstanden. Der Drogenbeauftragte präzisiert nun seine Aussagen.",https://www.tagesspiegel.de/images/14003078/alternates/BASE_16_9_W1400/1763203830000/hendrick-streeck.jpeg,2025-11-15T11:00:05Z,,Seine Aussagen zur medizinischen Versorgung hochbetagter Menschen hatten eine ethische Debatte ausgelöst und waren teils scharf kritisiert worden. Nun hat der CDU-Gesundheitspolitiker Hendrik Streeck… [+5047 chars],,de,'ältere Menschen'
https://www.n-tv.de/ratgeber/Fuers-Bad-Kleine-Hilfsmittel-gegen-gefaehrliche-Stuerze-id30006112.html,https://www.n-tv.de/ratgeber/Fuers-Bad-Kleine-Hilfsmittel-gegen-gefaehrliche-Stuerze-id30006112.html,0,www.n-tv.de,Im Alter wichtig: Fürs Bad: Kleine Hilfsmittel gegen gefährliche Stürze,"Klebefolien für die Dusche oder einfach ein stabiler Hocker: Es gibt Helferlein, die vor allem ältere Menschen vorm Hinfallen im Bad bewahren können. Darauf sollten Sie achten.",https://www.n-tv.de/img/6876118/1762500728/Img_16_9/1200/Fester-Halt-im-Bad-Haltegriffe-an-Dusche-oder-Badewanne-geben-Sicherheit-und-koennen-helfen-gefaehrliche-Stuerze-zu-vermeiden.jpg,2025-11-15T19:12:21Z,,"Im Alter wichtigFürs Bad: Kleine Hilfsmittel gegen gefährliche Stürze
Fester Halt im Bad: Haltegriffe an Dusche oder Badewanne geben Sicherheit und können helfen, gefährliche Stürze zu vermeiden. 
… [+3244 chars]",,de,'ältere Menschen'
https://www.morgenpost.de/ratgeber-wissen/article410456750/warum-diabetes-typ-1-bei-kleinen-kindern-so-heftig-verlaeuft.html,https://www.morgenpost.de/ratgeber-wissen/article410456750/warum-diabetes-typ-1-bei-kleinen-kindern-so-heftig-verlaeuft.html,0,www.morgenpost.de,Warum Diabetes Typ 1 bei kleinen Kindern so heftig verläuft,"Ein Forschungsteam liefert erstmals eine Erklärung, warum Diabetes Typ 1 bei jungen Menschen oft dramatisch verläuft – und macht Hoffnung.",https://img.sparknews.funkemedien.de/410456722/410456722_1763116133_v16_9_1600.jpeg,2025-11-15T20:50:00Z,,"Wenn Diabetes Typ 1 sehr früh im Leben auftritt, verläuft die Erkrankung oft dramatisch. Eltern berichten von Kindern, die innerhalb weniger Stunden von einem harmlosen Infekt in lebensbedrohliche Si… [+2838 chars]",,de,'ältere Menschen'
