index,url,valid,domain,title,description,image,published,archive,content,quote,language,keyword
https://www.zeit.de/news/2026-02/05/dwd-raet-zur-vorsicht-unwettergefahr-durch-glaette-im-osten,https://www.zeit.de/news/2026-02/05/dwd-raet-zur-vorsicht-unwettergefahr-durch-glaette-im-osten,0,www.zeit.de,Winterwetter: DWD rät zur Vorsicht: Unwettergefahr durch Glätte im Osten,Hier finden Sie Informationen zu dem Thema „Winterwetter“. Lesen Sie jetzt „DWD rät zur Vorsicht: Unwettergefahr durch Glätte im Osten“.,https://img.zeit.de/news/2026-02/05/dwd-raet-zur-vorsicht-unwettergefahr-durch-glaette-im-osten-image-group/wide__1300x731,2026-02-05T04:00:16Z,,Nach reichlich Schnee und Glätte in mehreren Bundesländern müssen sich am Donnerstag besonders die Menschen im Osten Deutschlands auf glatte Wege und Straßen einstellen. Der Deutsche Wetterdienst erw… [+2819 chars],,de,'Glatteis'
https://www.zeit.de/2026/06/rechtsanspruch-ganztag-grundschule-betreuung-plaetze-personal,https://www.zeit.de/2026/06/rechtsanspruch-ganztag-grundschule-betreuung-plaetze-personal,0,www.zeit.de,"Rechtsanspruch auf Ganztag: Garantiert betreut, vielleicht",In einem halben Jahr haben alle Erstklässler Anspruch auf einen Ganztagsplatz. Klappt das? Und was erwartet Eltern und Kinder da? Antworten auf die wichtigsten Fragen,https://img.zeit.de/2026/06/garantiert-betreut-vielleicht-bild-1/wide__1300x731,2026-02-05T04:33:41Z,,"Schließen
Artikelzusammenfassung
Ab dem 1. August 2026 haben Erstklässler in Deutschland einen Rechtsanspruch auf einen Ganztagsplatz in der Grundschule. Während in einigen Bundesländern wie Thürin… [+946 chars]",,de,'Kinder'
https://www.tagesspiegel.de/berlin/sprengung-abraumforderbrucke-bergbau-koloss-gesprengt-ara-im-braunkohlerevier-endet-15220620.html,https://www.tagesspiegel.de/berlin/sprengung-abraumforderbrucke-bergbau-koloss-gesprengt-ara-im-braunkohlerevier-endet-15220620.html,0,www.tagesspiegel.de,Sprengung Abraumförderbrücke: Bergbau-Koloss gesprengt: Ära im Braunkohlerevier endet,Ende eines Kapitals Bergbaugeschichte: Eine legendäre F60-Brücke für den Tagebau ist nach 45 Jahren gesprengt worden. Der Energieerzeuger Leag setzt mit dem Ausstieg aus der Kohle auf neue Projekte.,https://www.tagesspiegel.de/images/15223495/alternates/BASE_16_9_W1400/1770302111000/die-abraumforderbrucke-f60-im-braunkohletagebau-janschwalde.jpeg,2026-02-05T04:46:15Z,,Die mächtige Stahlkonstruktion mit der Abkürzung F60 gilt als Symbol für das Braunkohlerevier Lausitz: Die Arbeitsmaschine im ehemaligen Tagebau Jänschwalde ist am Vormittag gesprengt worden. Damit e… [+3353 chars],,de,'Kohle'
https://www.zeit.de/news/2026-02/05/wetter-in-bayern-zeigt-sich-trist-und-ungemuetlich,https://www.zeit.de/news/2026-02/05/wetter-in-bayern-zeigt-sich-trist-und-ungemuetlich,0,www.zeit.de,Schneeregen: Wetter in Bayern zeigt sich trist und ungemütlich,Hier finden Sie Informationen zu dem Thema „Schneeregen“. Lesen Sie jetzt „Wetter in Bayern zeigt sich trist und ungemütlich“.,https://img.zeit.de/news/2026-02/05/wetter-in-bayern-zeigt-sich-trist-und-ungemuetlich-image-group/wide__1300x731,2026-02-05T05:06:22Z,,Der Donnerstag zeigt sich trist und ungemütlich. Regen und Schneeregen sagt der Deutsche Wetterdienst (DWD) vom Fichtelgebirge über die Oberpfalz bis nach Oberbayern voraus. Autofahrer sollten vor al… [+744 chars],,de,'Glatteis'
https://www.zeit.de/news/2026-02/05/wetterdienst-glatteis-im-osten-sachsen-anhalts-moeglich,https://www.zeit.de/news/2026-02/05/wetterdienst-glatteis-im-osten-sachsen-anhalts-moeglich,0,www.zeit.de,Wetter: Wetterdienst: Glatteis im Osten Sachsen-Anhalts möglich,Hier finden Sie Informationen zu dem Thema „Wetter“. Lesen Sie jetzt „Wetterdienst: Glatteis im Osten Sachsen-Anhalts möglich“.,https://img.zeit.de/news/2026-02/05/wetterdienst-glatteis-im-osten-sachsen-anhalts-moeglich-image-group/wide__1300x731,2026-02-05T05:46:25Z,,Der Deutsche Wetterdienst (DWD) warnt am Morgen vor Glatteis auf Straßen und Gehwegen in den östlichen Landesteilen Sachsen-Anhalts. Grund dafür ist gefrierender Regen. Laut aktueller Wettergefahren-… [+485 chars],,de,'Glatteis'
https://www.zeit.de/news/2026-02/05/weiter-winterwetter-im-nordosten-warnung-vor-glaette,https://www.zeit.de/news/2026-02/05/weiter-winterwetter-im-nordosten-warnung-vor-glaette,0,www.zeit.de,Winter in MV: Weiter Winterwetter im Nordosten - Warnung vor Glätte,Hier finden Sie Informationen zu dem Thema „Winter in MV“. Lesen Sie jetzt „Weiter Winterwetter im Nordosten - Warnung vor Glätte“.,https://img.zeit.de/news/2026-02/05/weiter-winterwetter-im-nordosten-warnung-vor-glaette-image-group/wide__1300x731,2026-02-05T06:09:46Z,,Der Deutsche Wetterdienst (DWD) warnt für Teile von Mecklenburg-Vorpommern vor Glatteis. Demnach kann es im Osten Mecklenburg-Vorpommerns sowie auf Teilen Usedoms zu gefrierendem Regen mit unwetterar… [+1066 chars],,de,'Winter'
https://www.zeit.de/news/2026-02/05/wetterdienst-warnt-vor-glatteis-in-berlin-und-brandenburg,https://www.zeit.de/news/2026-02/05/wetterdienst-warnt-vor-glatteis-in-berlin-und-brandenburg,0,www.zeit.de,Winterwetter: Wetterdienst warnt vor Glatteis in Berlin und Brandenburg,Hier finden Sie Informationen zu dem Thema „Winterwetter“. Lesen Sie jetzt „Wetterdienst warnt vor Glatteis in Berlin und Brandenburg“.,https://img.zeit.de/news/2026-02/05/wetterdienst-warnt-vor-glatteis-in-berlin-und-brandenburg-image-group/wide__1300x731,2026-02-05T06:16:54Z,,"Fußgänger, Rad- und Autofahrer sind in Berlin und Brandenburg wegen neuer Glatteisgefahr zu Vorsicht aufgerufen. Der Deutsche Wetterdienst (DWD) warnt in Berlin vor hoher Glättegefahr durch gefrieren… [+1148 chars]",,de,'Glatteis'
https://www.zeit.de/news/2026-02/05/glatteis-und-regen-erwartet-wetter-bleibt-ungemuetlich,https://www.zeit.de/news/2026-02/05/glatteis-und-regen-erwartet-wetter-bleibt-ungemuetlich,0,www.zeit.de,Wetter: Glatteis und Regen erwartet – Wetter bleibt ungemütlich,Hier finden Sie Informationen zu dem Thema „Wetter“. Lesen Sie jetzt „Glatteis und Regen erwartet – Wetter bleibt ungemütlich“.,https://img.zeit.de/news/2026-02/05/glatteis-und-regen-erwartet-wetter-bleibt-ungemuetlich-image-group/wide__1300x731,2026-02-05T07:14:03Z,,"Die Menschen in Niedersachsen und Bremen müssen sich auch in den kommenden Tagen auf ungemütliches Winterwetter einstellen. Nach Angaben des Deutschen Wetterdienstes (DWD) ist mit Glätte, Schnee und … [+1595 chars]",,de,'Glatteis'
https://www.zeit.de/news/2026-02/05/gefaehrliche-glaette-parks-der-schloesserstiftung-bleiben-zu,https://www.zeit.de/news/2026-02/05/gefaehrliche-glaette-parks-der-schloesserstiftung-bleiben-zu,0,www.zeit.de,Glatteis: Gefährliche Glätte – Parks der Schlösserstiftung bleiben zu,Hier finden Sie Informationen zu dem Thema „Glatteis“. Lesen Sie jetzt „Gefährliche Glätte – Parks der Schlösserstiftung bleiben zu“.,https://img.zeit.de/news/2026-02/05/gefaehrliche-glaette-parks-der-schloesserstiftung-bleiben-zu-image-group/wide__1300x731,2026-02-05T07:35:37Z,,Spazierengehen in Parks der Schlösserstiftung in Potsdam und Berlin ist wegen Eisglätte heute nicht möglich: Die Stiftung Preußischer Schlösser und Gärten Berlin-Brandenburg schließt ihre Anlagen vor… [+313 chars],,de,'Glatteis'
https://www.rbb24.de/panorama/beitrag/2026/01/glatteis-berlin-brandenburg-liveticker.html,https://www.rbb24.de/panorama/beitrag/2026/01/glatteis-berlin-brandenburg-liveticker.html,0,www.rbb24.de,Winterwetter in Berlin: Keine Starts am BER möglich,Vom Flughafen BER in Berlin können wegen des Winterwetters aktuell keine Flugzeuge starten. Auch im Nahverkehr gibt es zahlreiche Einschränkungen und Ausfälle.,https://images.tagesschau.de/image/b61e3471-b12d-4321-9db4-f340c472be47/AAABnCzP4So/AAABmyZE0EA/16x9-big/berlin-winter-ber-100.jpg?width=1280,2026-02-05T08:02:54Z,,"Stand: 05.02.2026 09:02 Uhr
Vom Flughafen BER in Berlin können wegen des Winterwetters aktuell keine Flugzeuge starten. Auch im Nahverkehr gibt es zahlreiche Einschränkungen und Ausfälle.
<ul><li>A… [+80496 chars]",,de,'Winter'
https://www.faz.net/aktuell/reise/auf-winterreise-durch-lappland-accg-110830310.html,https://www.faz.net/aktuell/reise/auf-winterreise-durch-lappland-accg-110830310.html,0,www.faz.net,Lappland im Winter: Im Reich des flüsternden Lichts,"Weisheit der samischen Kultur in überwältigender Naturschönheit: Eine Winterreise durchs norwegische und finnische Lappland führt in eine Welt majestätischer, aber bedrohter Sanftmut.",https://media0.faz.net/image/w1200h627/3d0e18deaa6a/w3000h1567x0y403o/022026/1.10830309/am-kettukoski-unweit-von-inari.webp,2026-02-05T08:15:28Z,,"Anna jubelt: Das ist Kunst! Kunst, die die Natur selbst macht! Polarlichter jagen über den Nachthimmel von Riutula. Wasserfälle aus neongrünem Licht stürzen von oben in die Kiefernwälder. Spiralen, a… [+302 chars]",,de,'Winter'
https://www.zeit.de/news/2026-02/05/region-waren-busse-fahren-wegen-eisregens-nicht,https://www.zeit.de/news/2026-02/05/region-waren-busse-fahren-wegen-eisregens-nicht,0,www.zeit.de,Winter in MV: Region Waren: Busse fahren wegen Eisregens nicht,Hier finden Sie Informationen zu dem Thema „Winter in MV“. Lesen Sie jetzt „Region Waren: Busse fahren wegen Eisregens nicht“.,https://img.zeit.de/news/2026-02/05/region-waren-busse-fahren-wegen-eisregens-nicht-image-group/wide__1300x731,2026-02-05T08:52:33Z,,Wegen Eisregens und Glätte kommt es an der Mecklenburgischen Seenplatte zu Einschränkungen im Busverkehr. Donnerstagfrüh fallen nach Angaben der Mecklenburg-Vorpommerschen Verkehrsgesellschaft (MVVG)… [+466 chars],,de,'Winter'
https://www.zeit.de/news/2026-02/05/dwd-unwetterwarnung-aufgehoben-glaette-bis-abends-moeglich,https://www.zeit.de/news/2026-02/05/dwd-unwetterwarnung-aufgehoben-glaette-bis-abends-moeglich,0,www.zeit.de,Winter: DWD-Unwetterwarnung aufgehoben - Glätte bis abends möglich,Hier finden Sie Informationen zu dem Thema „Winter“. Lesen Sie jetzt „DWD-Unwetterwarnung aufgehoben - Glätte bis abends möglich“.,https://img.zeit.de/news/2026-02/05/dwd-unwetterwarnung-aufgehoben-glaette-bis-abends-moeglich-image-group/wide__1300x731,2026-02-05T10:02:58Z,,"Die Unwetterwarnung vor Glatteis des Deutschen Wetterdiensts (DWD) für Berlin und Teile Brandenburgs ist aufgehoben. In Berlin sei das Gröbste geschafft, sagte DWD-Meteorologin Cathleen Hickmann am V… [+896 chars]",,de,'Winter'
https://www.stern.de/gesellschaft/regional/berlin-brandenburg/schifffahrt--eisbrecher-sollen-brennstoff-lieferungen-sichern-37109280.html,https://www.stern.de/gesellschaft/regional/berlin-brandenburg/schifffahrt--eisbrecher-sollen-brennstoff-lieferungen-sichern-37109280.html,0,www.stern.de,Schifffahrt: Eisbrecher sollen Brennstoff-Lieferungen sichern,Berlin (bb) - Trotz weitgehend eingestellter Schifffahrt halten Eisbrecher einige Wasserwege für den Gütertransport von Holz und Kohle zur Wärmeversorgung,https://image.stern.de/37109282/t/U4/v1/w1440/r1.7778/-/05--23ygogpay6v14axs2048jpeg---be37af60cc2a6045.jpg,2026-02-05T10:17:02Z,,"Kopiere den aktuellen Link
Zur Merkliste hinzufügen
Die Schifffahrt ist weitgehend zum Erliegen gekommen. Eisbrecher sorgen aber dafür, dass Heizkraftwerke weiter beliefert werden können.
Trotz we… [+1372 chars]",,de,'Kohle'
https://www.morgenpost.de/ratgeber-wissen/article407722951/muedigkeit-abnehmen-gesundheit-ernaehrung-wasser-diaet-dr-riedl-ernaehrung-fitness.html,https://www.morgenpost.de/ratgeber-wissen/article407722951/muedigkeit-abnehmen-gesundheit-ernaehrung-wasser-diaet-dr-riedl-ernaehrung-fitness.html,0,www.morgenpost.de,"Wassertrinken für mehr Energie? Dr. Riedl erklärt, was dabei entscheidend ist",Gerade im Winter leiden viele unter Antriebslosigkeit – dabei kann bereits richtiges Wassertrinken helfen. Wann und wie trinkt man am besten?,https://img.sparknews.funkemedien.de/411122028/411122028_1770288136_v16_9_1600.jpeg,2026-02-05T10:42:17Z,,"<ul><li>Umfragen zeigen: Die meisten Menschen trinken deutlich zu wenig Wasser</li><li>Langfristig kann das schwerwiegende Folgen für unsere Gesundheit haben</li><li>Dr. Riedl verrät, was Sie beim Wa… [+964 chars]",,de,'Winter'
https://www.zeit.de/news/2026-02/05/glaette-schueler-in-vorpommern-sollen-schon-nach-hause-fahren,https://www.zeit.de/news/2026-02/05/glaette-schueler-in-vorpommern-sollen-schon-nach-hause-fahren,0,www.zeit.de,Winter in MV: Glätte: Schüler in Vorpommern sollen schon nach Hause fahren,Hier finden Sie Informationen zu dem Thema „Winter in MV“. Lesen Sie jetzt „Glätte: Schüler in Vorpommern sollen schon nach Hause fahren“.,https://img.zeit.de/news/2026-02/05/glaette-schueler-in-vorpommern-sollen-schon-nach-hause-fahren-image-group/wide__1300x731,2026-02-05T10:58:10Z,,"Wegen der winterlichen Straßenverhältnisse sollen Schüler und Schülerinnen in Vorpommern-Greifswald vorsorglich nach Hause fahren. Die Verkehrsgesellschaft Vorpommern-Greifswald (VVG) bittet sie, die… [+541 chars]",,de,'Winter'
https://www.zeit.de/news/2026-02/05/tausende-strom-und-gassperren-in-berlin,https://www.zeit.de/news/2026-02/05/tausende-strom-und-gassperren-in-berlin,0,www.zeit.de,Energie: Tausende Strom- und Gassperren in Berlin,Hier finden Sie Informationen zu dem Thema „Energie“. Lesen Sie jetzt „Tausende Strom- und Gassperren in Berlin“.,https://img.zeit.de/news/2026-02/05/tausende-strom-und-gassperren-in-berlin-image-group/wide__1300x731,2026-02-05T11:33:08Z,,Wegen offener Rechnungen haben Versorger im vergangenen Jahr Tausenden Berliner Haushalten Strom oder Gas abstellen lassen. Das geht aus Antworten der Wirtschaftsverwaltung auf entsprechende parlamen… [+2161 chars],,de,'Gas'
https://www.tagesspiegel.de/berlin/energie-tausende-strom-und-gassperren-in-berlin-15221855.html,https://www.tagesspiegel.de/berlin/energie-tausende-strom-und-gassperren-in-berlin-15221855.html,0,www.tagesspiegel.de,Energie: Tausende Strom- und Gassperren in Berlin,"Ohne Strom kein Licht, ohne Gas keine Heizung: Viele Menschen in Berlin sind von Energiesperren betroffen. Welche Hilfen es gibt und was die Linke jetzt fordert.",https://www.tagesspiegel.de/images/15221854/alternates/BASE_16_9_W1400/1770291245000/stromzahler.jpeg,2026-02-05T11:34:06Z,,Wegen offener Rechnungen haben Versorger im vergangenen Jahr Tausenden Berliner Haushalten Strom oder Gas abstellen lassen. Das geht aus Antworten der Wirtschaftsverwaltung auf entsprechende parlamen… [+2211 chars],,de,'Gas'
https://www.tagesspiegel.de/berlin/wegen-offener-rechnungen-tausende-berliner-haushalte-von-strom-und-gassperren-betroffen-15221855.html,https://www.tagesspiegel.de/berlin/wegen-offener-rechnungen-tausende-berliner-haushalte-von-strom-und-gassperren-betroffen-15221855.html,0,www.tagesspiegel.de,Wegen offener Rechnungen: Tausende Berliner Haushalte von Strom- und Gassperren betroffen,"Ohne Strom kein Licht, ohne Gas keine Heizung: Viele Menschen in Berlin sind von Energiesperren betroffen. Welche Hilfen es gibt und was die Linke jetzt fordert.",https://www.tagesspiegel.de/images/15223048/alternates/BASE_16_9_W1400/1770299242000/zahlerschrank-mit-zweirichtungszahler-und-ferraris-zahler-in-dusseldorf-deutschland-dusseldorf-nordrhein-westfalen-deut.jpeg,2026-02-05T11:34:06Z,,Wegen offener Rechnungen haben Versorger im vergangenen Jahr Tausenden Berliner Haushalten Strom oder Gas abstellen lassen. Das geht aus Antworten der Wirtschaftsverwaltung auf entsprechende parlamen… [+2545 chars],,de,'Gas'
https://www.sueddeutsche.de/politik/merz-golfstaaten-besuch-partnerschaften-energielieferungen-li.3381259,https://www.sueddeutsche.de/politik/merz-golfstaaten-besuch-partnerschaften-energielieferungen-li.3381259,0,www.sueddeutsche.de,"Reise zum Golf: Friedrich Merz auf der Suche nach Geld, Gas und Macht","Die Zeiten, in denen sich Deutschland Skrupel genehmigte, sind vorbei. Zum ersten Mal bereist der Bundeskanzler Saudi-Arabien, Katar und die Vereinigten Arabischen Emirate. Umgeben von sagenhaftem Reichtum will er Geschäfte machen.",https://www.sueddeutsche.de/2026/02/04/3112cc7e-3b2d-4131-8493-a4bb72590eb6.jpg?q=60&fm=webp&width=1200&rect=0%2C328%2C4000%2C2250,2026-02-05T12:50:00Z,,"In Riad, damit fängt es schon mal an, ist der Teppich nicht rot, sondern lila. Der Kanzler schreitet, nachdem er dem Airbus der Bundeswehr mit einem Ledermäppchen in der linken Hand entstiegen ist, g… [+219 chars]",,de,'Gas'
https://www.zeit.de/news/2026-02/05/hauptsaechlich-blechschaeden-bei-unfaellen-im-osten,https://www.zeit.de/news/2026-02/05/hauptsaechlich-blechschaeden-bei-unfaellen-im-osten,0,www.zeit.de,Winter in MV: Hauptsächlich Blechschäden bei Unfällen im Osten,Hier finden Sie Informationen zu dem Thema „Winter in MV“. Lesen Sie jetzt „Hauptsächlich Blechschäden bei Unfällen im Osten“.,https://img.zeit.de/news/2026-02/05/hauptsaechlich-blechschaeden-bei-unfaellen-im-osten-image-group/wide__1300x731,2026-02-05T12:53:01Z,,Auf winterlich glatten Straßen und teils bei Regen ist es seit dem frühen Morgen im Ostteil Mecklenburg-Vorpommerns zu elf witterungsbedingten Verkehrsunfällen gekommen. Nach Angaben des Polizeipräsi… [+640 chars],,de,'Winter'
https://www.stern.de/news/behinderungen-durch-schnee-und-eisregen---angespannte-lage-in-berlin-37108926.html,https://www.stern.de/news/behinderungen-durch-schnee-und-eisregen---angespannte-lage-in-berlin-37108926.html,0,www.stern.de,Behinderungen durch Schnee und Eisregen - Angespannte Lage in Berlin,"Schneefall und Eisregen haben am Donnerstag erneut für Behinderungen und Einschränkungen vor allem im Nordosten Deutschlands gesorgt. In Berlin fielen einzelne U-Bahnen aus, am Hauptstadtflughafen BER waren zwischenzeitliche keine Starts möglich. Die Deutsche…",https://image.stern.de/37110248/t/ah/v1/w1440/r1.7778/-/05--winterdienst-in-hamburg---f5e3b038334d4b05.jpg,2026-02-05T13:22:53Z,,"Kopiere den aktuellen Link
Zur Merkliste hinzufügen
Schneefall und Eisregen haben am Donnerstag erneut für Behinderungen und Einschränkungen vor allem im Nordosten Deutschlands gesorgt. In Berlin f… [+3509 chars]",,de,'ältere Menschen'
https://www.stern.de/wirtschaft/news/energiekosten--strom--und-gaspreise-fuer-neukunden-gesunken-37110360.html,https://www.stern.de/wirtschaft/news/energiekosten--strom--und-gaspreise-fuer-neukunden-gesunken-37110360.html,0,www.stern.de,Energiekosten: Strom- und Gaspreise für Neukunden gesunken,"Wer im Januar seinen Strom- oder Gaslieferanten gewechselt hat, zahlt laut Bundesnetzagentur im Schnitt weniger als noch im Dezember. Welche Faktoren den Preisrückgang beeinflusst haben.",https://image.stern.de/37110362/t/Wp/v1/w1440/r1.7778/-/05--qfwnuetdexv4axs2048jpeg---8249f3fc7bc99ba4.jpg,2026-02-05T13:28:58Z,,"Kopiere den aktuellen Link
Zur Merkliste hinzufügen
Wer im Januar seinen Strom- oder Gaslieferanten gewechselt hat, zahlt laut Bundesnetzagentur im Schnitt weniger als noch im Dezember. Welche Fakt… [+1544 chars]",,de,'Gas'
https://www.zeit.de/news/2026-02/05/strom-und-gaspreise-fuer-neukunden-gesunken,https://www.zeit.de/news/2026-02/05/strom-und-gaspreise-fuer-neukunden-gesunken,0,www.zeit.de,Energiekosten: Strom- und Gaspreise für Neukunden gesunken,Hier finden Sie Informationen zu dem Thema „Energiekosten“. Lesen Sie jetzt „Strom- und Gaspreise für Neukunden gesunken“.,https://img.zeit.de/news/2026-02/05/strom-und-gaspreise-fuer-neukunden-gesunken-image-group/wide__1300x731,2026-02-05T13:28:58Z,,"Wer im Januar einen neuen Liefervertrag für Strom und Gas abgeschlossen hat, zahlt nach Berechnungen der Bundesnetzagentur weniger als im Dezember. Bei den Strompreisen waren dabei vor allem die gesu… [+1341 chars]",,de,'Energiekosten'
https://www.tagesspiegel.de/wirtschaft/energiekosten-strom-und-gaspreise-fur-neukunden-gesunken-15222904.html,https://www.tagesspiegel.de/wirtschaft/energiekosten-strom-und-gaspreise-fur-neukunden-gesunken-15222904.html,0,www.tagesspiegel.de,Energiekosten: Strom- und Gaspreise für Neukunden gesunken,"Wer im Januar seinen Strom- oder Gaslieferanten gewechselt hat, zahlt laut Bundesnetzagentur im Schnitt weniger als noch im Dezember. Welche Faktoren den Preisrückgang beeinflusst haben.",https://www.tagesspiegel.de/images/15222903/alternates/BASE_16_9_W1400/1770298215000/stromzahler.jpeg,2026-02-05T13:30:15Z,,"Wer im Januar einen neuen Liefervertrag für Strom und Gas abgeschlossen hat, zahlt nach Berechnungen der Bundesnetzagentur weniger als im Dezember. Bei den Strompreisen waren dabei vor allem die gesu… [+1392 chars]",,de,'Gas'
https://www.faz.net/aktuell/wirtschaft/kanzler-merz-in-qatar-loesung-fuer-das-gasproblem-gesucht-110831707.html,https://www.faz.net/aktuell/wirtschaft/kanzler-merz-in-qatar-loesung-fuer-das-gasproblem-gesucht-110831707.html,0,www.faz.net,Kanzler in Qatar: Deutschlands nächstes Gasproblem,"Die Speicher leeren sich, die Preise für Flüssiggas steigen. Die Reise des Kanzlers in die Golfregion soll verhindern, dass Deutschland zu abhängig von einem Lieferanten wird.",https://media0.faz.net/image/w1200h627/936c1d8aef6a/w4096h2140x0y505o/202602/43601.0.1737747173/es-geht-auch-um-energie.webp,2026-02-05T13:37:09Z,,Die Kältewelle in Deutschland dauert an und leert die deutschen Gasspeicher immer schneller. Zuletzt waren sie nur noch zu 31 Prozent gefüllt und haben die gesetzliche Vorgabe von 30 Prozent zum 1. F… [+6459 chars],,de,'Gas'
https://www.zeit.de/arbeit/2026-02/pilotin-julia-peukert-berufsalltag-passagiere-highlights,https://www.zeit.de/arbeit/2026-02/pilotin-julia-peukert-berufsalltag-passagiere-highlights,0,www.zeit.de,"Pilotin Julia Peukert: ""Ich ziehe an einem Joystick und dann hebt das Riesending ab""","Nach einem Fallschirmsprung wusste sie: Der Sprung war ihr egal, aber das Flugzeug faszinierend. Heute ist Julia Peukert Pilotin – in Teilzeit, weil sie zwei Kinder hat.",https://img.zeit.de/arbeit/2026-02/pilotin-julia-peukert-berufsalltag-passagiere-highlightsalexandrumagurean-bild/wide__1300x731,2026-02-05T13:38:45Z,,"Julia Peukert ist seit mehr als 20 Jahren Pilotin als eine von wenigen Frauen. Hier erzählt sie, weshalb sie ihren Job liebt und wie sich der mit ihrer Familie vereinbaren lässt.
DIE ZEIT: Frau Peuk… [+353 chars]",,de,'Kinder'
https://www.bild.de/news/inland/eisbrecher-im-dauereinsatz-frost-blockiert-gastanker-vor-ruegen-6984935f82b7e6e05f51b55d,https://www.bild.de/news/inland/eisbrecher-im-dauereinsatz-frost-blockiert-gastanker-vor-ruegen-6984935f82b7e6e05f51b55d,0,www.bild.de,Eisbrecher im Dauereinsatz - Frost blockiert Gastanker vor Rügen,"Tanker können nicht anlegen, Hiddensee nur im Notverkehr erreichbar. Eisbrecher kämpfen gegen die Eismassen.","https://images.bild.de/6984935f82b7e6e05f51b55d/60736c8dbf0749c5e92e2e4db028cfb6,35a37e0c?w=1280",2026-02-05T13:43:56Z,,"TTS-Player überspringenArtikel weiterlesenMukran Eis und Wind legen das Rügener LNG-Terminal lahm. Der Tanker Minerva Amorgos kann nicht anlegen, ein anderer Tanker sitzt fest. Der größte deutsche Os… [+1794 chars]",,de,'Gas'
https://www.sueddeutsche.de/bayern/rhoen-grabfeld-csu-junge-union-wahlwerbung-rollator-plakat-greisraete-li.3382448,https://www.sueddeutsche.de/bayern/rhoen-grabfeld-csu-junge-union-wahlwerbung-rollator-plakat-greisraete-li.3382448,0,www.sueddeutsche.de,Vermeintlich humorige Wahlwerbung: Die Junge Union hat Ärger – mit der CSU,"Die Junge Union in Rhön-Grabfeld tritt mit einer eigenen Liste zur Kommunalwahl an, sorgt jedoch mit einem Wahlplakat für Aufregung. EIn CSU-Bürgermeister sieht ältere Menschen ""lächerlich gemacht""",https://www.sueddeutsche.de/2026/02/05/b3493b0d-bdce-4f0a-a7d9-590260674d4d.jpg?q=60&fm=webp&width=1200&rect=0%2C375%2C4000%2C2250,2026-02-05T13:46:05Z,,"Wolfgang Seifert, CSU-Bürgermeister von Wülfershausen, hat sein Befremden sogar verschriftlicht. Ältere Menschen, postet er, würden von diesem Plakat pauschal lächerlich gemacht und herabgewürdigt. D… [+2588 chars]",,de,'ältere Menschen'
https://www.tagesspiegel.de/politik/hat-einen-ahnlichen-klimaeffekt-wie-lng-kretschmer-will-wieder-mehr-auf-braunkohle-setzen-15221658.html,https://www.tagesspiegel.de/politik/hat-einen-ahnlichen-klimaeffekt-wie-lng-kretschmer-will-wieder-mehr-auf-braunkohle-setzen-15221658.html,0,www.tagesspiegel.de,„Hat einen ähnlichen Klimaeffekt wie LNG“: Kretschmer will wieder mehr auf Braunkohle setzen,"Für die Energiewende hatte Deutschland auf russisches Gas gesetzt, doch das wird nun durch schmutziges und teures LNG ersetzt. Besser sei die heimische Braunkohle, findet Sachsens Ministerpräsident.",https://www.tagesspiegel.de/images/15221631/alternates/BASE_16_9_W1400/1770289237000/braunkohletagebau-janschwalde.jpeg,2026-02-05T13:47:38Z,,"Tagesspiegel Plus Exklusiv 
Für die Energiewende hatte Deutschland auf russisches Gas gesetzt, doch das wird nun durch schmutziges und teures LNG ersetzt. Besser sei die heimische Braunkohle, findet… [+27 chars]",,de,'Gas'
https://www.faz.net/aktuell/gesellschaft/teils-gefrorene-niagara-faelle-so-spektakulaer-zeigt-sich-der-winter-selten-110831603.html,https://www.faz.net/aktuell/gesellschaft/teils-gefrorene-niagara-faelle-so-spektakulaer-zeigt-sich-der-winter-selten-110831603.html,0,www.faz.net,Niagara-Fälle: So spektakulär zeigt sich der Winter selten,"Auch wenn sie nicht ganz zugefroren sind: Das Naturschauspiel, das die berühmten Niagara-Fälle im Nordosten der Vereinigten Staaten durch den arktischen Kälteeinbruch derzeit bieten, ist atemberaubend.",https://media0.faz.net/image/w1200h627/1351e0cdd74c/w3000h1567x0y217o/012026/1.10831602/nahe-den-american-falls.webp,2026-02-05T14:05:51Z,,"Atemraubender zeigt sich der Winter selten. Während der arktische Kälteeinbruch in den Vereinigten Staaten selbst eher warme Regionen wie den Südstaat Florida mit Minustemperaturen, Schnee und Stroma… [+1735 chars]",,de,'Winter'
