index,url,valid,domain,title,description,image,published,archive,content,quote,language,keyword
https://www.focus.de/immobilien/wohnen/gas-und-oelheizungen-bleiben-erlaubt-doch-kostenrisiken-steigen_5a24ce32-72c4-4683-a3a8-d588f43bf707.html,https://www.focus.de/immobilien/wohnen/gas-und-oelheizungen-bleiben-erlaubt-doch-kostenrisiken-steigen_5a24ce32-72c4-4683-a3a8-d588f43bf707.html,0,www.focus.de,"Gas- und Ölheizungen bleiben erlaubt, doch Kostenrisiken steigen","Der Reformentwurf fürs Heizungsgesetz ist endlich da. Neue Gas- und Ölheizungen bleiben erlaubt, Mieter werden geschützt. Warum das nur Kosten und Aufwand für alle bedeutet.","https://quadro.burda-forward.de/ctf/1e3d82d6-7274-489f-822f-a1fa9da33f4e.4a566ee3-7f28-429f-be7c-b5cf8cc52f13.jpeg?im=RegionOfInterestCrop=(1200,630),regionOfInterest=(1024,681.5)&hash=454f8cc3dbc97d0b0e02f8a6b9d763bca946e306c2b06233d047c821b503c597",2026-07-08T05:00:00Z,,"Gerade das Thema Heizung ist für viele Menschen emotional. Die Reform der Bundesregierung erlaubt jetzt neue, fossile Heizungen. Das birgt langfristig hohe Kostenrisiken, egal ob Sie mieten, vermiete… [+8040 chars]",,de,'Gas'
https://taz.de/Blackout-in-Kuba/!6194138/,https://taz.de/Blackout-in-Kuba/!6194138/,0,taz.de,Blackout in Kuba: Der dritte in diesem Jahr,"In Kuba werden inselweite Stromausfälle immer häufiger. Grund ist nicht nur der Mangel an Öl, sondern ein marodes System der Energieversorgung.",https://taz.de/picture/8596129/1200/Kuba-Blackout.jpeg,2026-07-08T06:40:00Z,,"In Kuba werden inselweite Stromausfälle immer häufiger. Grund ist nicht nur der Mangel an Öl, sondern ein marodes System der Energieversorgung. mehr...",,de,'Blackout'
https://www.zeit.de/news/2026-07/08/nrw-und-niederlande-staerken-gemeinsamen-hochwasserschutz,https://www.zeit.de/news/2026-07/08/nrw-und-niederlande-staerken-gemeinsamen-hochwasserschutz,0,www.zeit.de,Fünf Jahre nach Hochwasser: NRW und Niederlande stärken gemeinsamen Hochwasserschutz,Hier finden Sie Informationen zu dem Thema „Fünf Jahre nach Hochwasser“. Lesen Sie jetzt „NRW und Niederlande stärken gemeinsamen Hochwasserschutz“.,https://img.zeit.de/news/2026-07/08/nrw-und-niederlande-staerken-gemeinsamen-hochwasserschutz-image-group/wide__1300x731,2026-07-08T09:00:07Z,,Fünf Jahre nach der verheerenden Flutkatastrophe von 2021 intensivieren Nordrhein-Westfalen und die Niederlande ihre Kooperation beim Hochwasserschutz. Bei einer gemeinsamen Pressekonferenz in Aachen… [+2142 chars],,de,'Hochwasser'
https://www.dw.com/de/australien-telstra-netzausfall-stoerung-flugverkehr-bahnverkehr-zahlungssysteme/a-77871912,https://www.dw.com/de/australien-telstra-netzausfall-stoerung-flugverkehr-bahnverkehr-zahlungssysteme/a-77871912,0,www.dw.com,Großstörung bei Mobilfunkanbieter trifft ganz Australien,"Der zeitweilige Blackout im Mobilfunknetz von Telstra sorgte in Australien landesweit für Ausfälle bei Zügen, Flügen und Zahlungssystemen. Laut dem Unternehmen war ein technischer Fehler verantwortlich.",https://static.dw.com/image/77873134_6.jpg,2026-07-08T10:11:00Z,,Ein großflächiger Ausfall im Mobilfunknetz des Telekommunikationsanbieters Telstra hat Australien zeitweise lahmgelegt. Neben Zugverbindungen waren auch der Flugverkehr sowie Notrufe und Bezahlsystem… [+2306 chars],,de,'Blackout'
https://www.bild.de/politik/inland/urlaub-wird-richtig-teuer-preisschock-an-den-zapfsaeulen-zum-sommerferienbeginn-6a4df67dbb0cf80de56a1cd4,https://www.bild.de/politik/inland/urlaub-wird-richtig-teuer-preisschock-an-den-zapfsaeulen-zum-sommerferienbeginn-6a4df67dbb0cf80de56a1cd4,0,www.bild.de,Urlaub wird richtig teuer - Preis-Schock an Zapfsäulen zum Sommerferienbeginn,"Der Tankrabatt ist Geschichte, Iran- und Ukraine-Krieg eskalieren. Pünktlich zum Start der großen Sommerreisewelle ziehen die Spritpreise wieder an.","https://images.bild.de/6a4df67dbb0cf80de56a1cd4/314fb9c355ae988b08123b37b3557a97,d8b2353c?w=1280",2026-07-08T11:22:24Z,,"TTS-Player überspringenArtikel weiterlesenBerlin Der Tankrabatt ist Geschichte, Iran- und Ukraine-Krieg eskalieren. Pünktlich zum Start der großen Sommerreisewelle ziehen die Spritpreise wieder an. S… [+2802 chars]",,de,'Rohöl'
https://www.zeit.de/mobilitaet/2026-07/tankrabatt-benzinpreis-super-e10-diesel-adac,https://www.zeit.de/mobilitaet/2026-07/tankrabatt-benzinpreis-super-e10-diesel-adac,0,www.zeit.de,Tankrabatt: Spritweise steigen nach Ende des Tankrabatts kräftig,"Der Tankrabatt ist in der vergangenen Woche ausgelaufen, seitdem steigen die Spritpreise. Der ADAC kritisiert die Entwicklung unter Verweis auf den Ölpreis.",https://img.zeit.de/mobilitaet/2026-07/tankrabatt-benzinpreis-super-e10-diesel-adac-foto-1/wide__1300x731,2026-07-08T11:53:15Z,,"In der Woche nach dem Auslaufen des staatlichen Tankrabatts Anfang Juli sind die Preise an den Zapfsäulen in Deutschland wieder gestiegen. Wie der Allgemeine Deutsche Automobil-Club (ADAC) mitteilte,… [+817 chars]",,de,'Spritpreise'
https://www.zeit.de/news/2026-07/08/bund-aendert-strategie-schkopau-hofft-auf-gaskraft-zukunft,https://www.zeit.de/news/2026-07/08/bund-aendert-strategie-schkopau-hofft-auf-gaskraft-zukunft,0,www.zeit.de,Energieversorgung: Bund ändert Strategie – Schkopau hofft auf Gaskraft-Zukunft,Hier finden Sie Informationen zu dem Thema „Energieversorgung“. Lesen Sie jetzt „Bund ändert Strategie – Schkopau hofft auf Gaskraft-Zukunft“.,https://img.zeit.de/news/2026-07/08/bund-aendert-strategie-schkopau-hofft-auf-gaskraft-zukunft-image-group/wide__1300x731,2026-07-08T13:08:05Z,,"Das Braunkohlekraftwerk Schkopau könnte bessere Chancen auf eine Zukunft als Gaskraftwerk erhalten. Grund ist eine geplante Änderung der Kraftwerksstrategie der Bundesregierung, durch die Standorte i… [+1548 chars]",,de,'Gas'
https://www.zeit.de/news/2026-07/08/land-plant-finanzhilfen-fuer-strukturwandel,https://www.zeit.de/news/2026-07/08/land-plant-finanzhilfen-fuer-strukturwandel,0,www.zeit.de,Energiekosten: Land plant Finanzhilfen für Strukturwandel,Hier finden Sie Informationen zu dem Thema „Energiekosten“. Lesen Sie jetzt „Land plant Finanzhilfen für Strukturwandel“.,https://img.zeit.de/news/2026-07/08/land-plant-finanzhilfen-fuer-strukturwandel-image-group/wide__1300x731,2026-07-08T13:12:07Z,,"Thüringen plant weitere Finanzhilfen, um den schwierigen Strukturwandel nicht nur in der Automobilindustrie zu unterstützen. Ein Beteiligungsfonds, der Kapitalhilfen für expandierende Firmen ermöglic… [+2000 chars]",,de,'Energiekosten'
https://www.bild.de/politik/anschlag-auf-berliner-stromnetz-kai-wegners-8-uhr-8-luege-6a4e211b43b7fd5185001ee6,https://www.bild.de/politik/anschlag-auf-berliner-stromnetz-kai-wegners-8-uhr-8-luege-6a4e211b43b7fd5185001ee6,0,www.bild.de,Anschlag auf Berliner Stromnetz - Kai Wegners „8-Uhr-8-Lüge“,"Berlins Regierender Bürgermeister Kai Wegner (53, CDU) gerät in der Blackout-Affäre immer tiefer in Erklärungsnot. Der Grund: Anders als von ihm selbst behauptet, führte er am Morgen des Stromausfalls gar keine dienstlichen Telefonate.","https://images.bild.de/6a4e211b43b7fd5185001ee6/c76c9fcaf6fc5d173df088805c130931,4b4b523a?w=1280",2026-07-08T14:19:02Z,,"Mehr zum Video anzeigen 
Berlins Regierender Bürgermeister Kai Wegner (53, CDU) gerät in der Blackout-Affäre immer tiefer in Erklärungsnot. Der Grund: Anders als von ihm selbst behauptet, führte er … [+103 chars]",,de,'Blackout'
https://www.bild.de/regional/nordrhein-westfalen/nahe-wohngebiet-in-nrw-pilot-rettet-drei-kinder-bei-flugzeugabsturz-6a4e764870bfac5c01962e72,https://www.bild.de/regional/nordrhein-westfalen/nahe-wohngebiet-in-nrw-pilot-rettet-drei-kinder-bei-flugzeugabsturz-6a4e764870bfac5c01962e72,0,www.bild.de,Nahe Wohngebiet in NRW - Pilot rettet drei Kinder bei Flugzeugabsturz,Beim Absturz eines Kleinflugzeuges hat ein Pilot (48) sich und drei Kinder gerettet.,"https://images.bild.de/6a4e764870bfac5c01962e72/ddd515ef03d55f3c0da6d63a13a5dc12,fefb7a4f?w=1280",2026-07-08T16:42:32Z,,TTS-Player überspringenArtikel weiterlesenGrefrath (Nordrhein-Westfalen) Hier waren mindestens vier Schutzengel mit an Bord! Beim Absturz eines Kleinflugzeuges hat ein Pilot (48) sich und drei Kinder… [+992 chars],,de,'Kinder'
https://www.bild.de/regional/bayern/auftragsmord-an-dreifacher-mutter-festnahme-nach-waffenverkauf-6a4e65fabb0cf80de56a281e,https://www.bild.de/regional/bayern/auftragsmord-an-dreifacher-mutter-festnahme-nach-waffenverkauf-6a4e65fabb0cf80de56a281e,0,www.bild.de,Mutter von drei Kindern erschossen - Er verkaufte die Mordwaffe! Mann (55) festgenommen,"Verdächtiger in Augsburg festgenommen: Er soll die Tatwaffe verkauft, vor Gericht falsch ausgesagt und Zeugen beeinflusst haben.","https://images.bild.de/6a4e65fabb0cf80de56a281e/2814420e2ad9d21eb31718a66aee6365,ba4b34c0?w=1280",2026-07-08T17:01:43Z,,TTS-Player überspringenArtikel weiterlesenAugsburg Ermittler haben einen weiteren Verdächtigen im Fall des Auftragsmords an einer jungen Mutter festgenommen. Der 55-Jährige soll die spätere Tatwaffe … [+1029 chars],,de,'Kinder'
https://www.zeit.de/arbeit/2026-07/lieselotte-ahnert-psychologie-eltern-berufstaetig-familie-kinder,https://www.zeit.de/arbeit/2026-07/lieselotte-ahnert-psychologie-eltern-berufstaetig-familie-kinder,0,www.zeit.de,"Entwicklungspsychologie: »Eltern sollten zumindest wissen, mit wem ihre Kinder Zeit verbringen«","Wenn beide Eltern Vollzeit arbeiten, bleiben nur wenige Stunden mit den Kindern. Eine Psychologin erklärt, in welchen Momenten Eltern dringend selbst da sein sollten.",https://img.zeit.de/arbeit/2026-07/lieselotte-ahnert-psychologie-eltern-berufstaetig-familie-kinder-bild/wide__1300x731,2026-07-08T17:02:15Z,,"Bei 27 Prozent aller Paare mit
Kindern im Haushalt arbeiten beide Eltern Vollzeit. Für sie ist der Alltag oft herausfordernd, wie die Interviews der Serie »Volle Zeit« zeigen. Die Entwicklungspsycho… [+814 chars]",,de,'Kinder'
https://www.faz.net/aktuell/rhein-main/kassel-ermittlungen-zu-missbrauchsvorwuerfen-in-kinderheim-aktuelle-nachrichten-aus-frankfurt-hessen-faz-19735361.html,https://www.faz.net/aktuell/rhein-main/kassel-ermittlungen-zu-missbrauchsvorwuerfen-in-kinderheim-aktuelle-nachrichten-aus-frankfurt-hessen-faz-19735361.html,0,www.faz.net,Rhein-Main-Liveblog: Kassel: Ermittlungen zu Missbrauchsvorwürfen in Kinderheim,Frankfurt: Brand eines Mehrfamilienhauses +++ Queerfeindliche Angriffe gestiegen +++ Geldautomat in Dietzenbach gesprengt +++ Schweißarbeiten vermutlich Auslöser von Baustellenbrand +++  Liveblog zu Rhein-Main und Hessen,https://media0.faz.net/image/w1200h627/5f4a9f38a6e3/w4096h2140x0y447o/202607/43601.0.2315028519/die-staatsanwaltschaft-kassel.webp,2026-07-08T17:34:00Z,,"Die Staatsanwaltschaft Kassel ermittelt wegen mutmaßlicher Fälle sexualisierter Gewalt und Missstände in einem Kinderheim in Kassel. Wie ein Sprecher der Behörde bestätigte, seien derzeit vier Ermitt… [+508 chars]",,de,'Kinder'
https://t3n.de/news/jugendschutz-meta-strafen-billionen-1751987/,https://t3n.de/news/jugendschutz-meta-strafen-billionen-1751987/,0,t3n.de,"Macht Social Media Kinder abhängig? Meta droht Strafe in Höhe von 1,4 Billionen Dollar","Im August sieht sich Meta vor einem Bundesgericht Vertreter:innen von 29 US-Bundesstaaten gegenüber, die dem Konzern vorwerfen, Facebook und Instagram würden Kinder süchtig machen. Vier weitere Staaten fordern eine Billionensumme. Schon seit Längerem werfen V…",https://cdn.t3n.de/news/wp-content/uploads/2026/04/shutterstock_2380065949.jpg?class=content,2026-07-08T17:48:54Z,,"Schon seit Längerem werfen Verbraucherschützer:innen Social-Media-Konzernen wie Meta, Alphabet oder Bytedance vor, ihre Plattformen absichtlich so gestaltet zu haben, dass Kinder und Jugendliche süch… [+3117 chars]",,de,'Kinder'
https://www.welt.de/regionales/hamburg/article6a4e4ded0f71e0f715c39994/auszeichnung-familienunternehmer-des-jahres-von-pippi-langstrumpf-zur-ki-oetingers-erfolgsrezept-im-wandel-der-zeit.html,https://www.welt.de/regionales/hamburg/article6a4e4ded0f71e0f715c39994/auszeichnung-familienunternehmer-des-jahres-von-pippi-langstrumpf-zur-ki-oetingers-erfolgsrezept-im-wandel-der-zeit.html,0,www.welt.de,Von Pippi Langstrumpf zur KI – Oetingers Erfolgsrezept im Wandel der Zeit,"„Mut liegt in unserer DNA“ – mit diesem Anspruch trimmt Verlegerin Julia Bielenberg das Medienhaus Oetinger auf KI, Marktforschung und New-Work-Strukturen und zeigt, wie der Wandel im Kinder- und Jugendbuchmarkt gelingen kann. Jetzt erhielt das Unternehmen da…",https://images.welt.de/6a4e4ded0f71e0f715c39994/8af0ac45b55b6b3a1ca8cc860efde8d7-master/ci16x9-w1200/oetinger-2780-jpg,2026-07-08T17:54:19Z,,"Mut liegt in unserer DNA mit diesem Anspruch trimmt Verlegerin Julia Bielenberg das Medienhaus Oetinger auf KI, Marktforschung und New-Work-Strukturen und zeigt, wie der Wandel im Kinder- und Jugendb… [+9105 chars]",,de,'Kinder'
https://www.bild.de/news/ausland/kobras-im-hochwasser-schlangen-alarm-in-suedchina-6a4e875926384a0457a32726,https://www.bild.de/news/ausland/kobras-im-hochwasser-schlangen-alarm-in-suedchina-6a4e875926384a0457a32726,0,www.bild.de,Überflutete Zuchtfarm in China - Hochwasser spült hunderte Schlangen an,Nach Überschwemmungen in Südchina sollen Hunderte Schlangen aus einer Zuchtfarm entkommen sein.,"https://images.bild.de/6a4e875926384a0457a32726/086aaa2a94cab9ff9a6c72a4f960507d,b004014c?w=1280",2026-07-08T18:18:59Z,,"Mehr zum Video anzeigen 
Nach Überschwemmungen in Südchina sollen Hunderte Schlangen aus einer Zuchtfarm entkommen sein.
Quelle: News508.07.2026 - 20:18 Uhr",,de,'Hochwasser'
https://www.n-tv.de/politik/Behoerde-Neun-Tote-bei-israelischen-Angriffen-im-Gazastreifen-id31064747.html,https://www.n-tv.de/politik/Behoerde-Neun-Tote-bei-israelischen-Angriffen-im-Gazastreifen-id31064747.html,0,www.n-tv.de,Drei Kinder unter den Opfern: Behörde: Neun Tote bei israelischen Angriffen im Gazastreifen,"Eigentlich soll im Gazastreifen eine Waffenruhe gelten, doch das israelische Militär tötet dort immer wieder Menschen. Die Armee spricht in der Regel von Angriffen auf Kämpfer. Bei neuen Vorfällen kommen nach palästinensischen Angaben wieder Unschuldige ums L…",https://www.n-tv.de/img/31064759/1783541362/Img_16_9/1200/A-Palestinian-boy-wounded-in-an-Israeli-strike-on-a-tent-according-to-medics-receives-medical-treatment-at-Nasser-Hospital-in-Khan-Younis-in-the-southern-Gaza-Strip-July-8-2026.jpg,2026-07-08T18:35:27Z,,"Ein Junge wird nach einem israelischen Angriff in Chan Junis von Ärzten behandelt. (Foto: REUTERS)
Eigentlich soll im Gazastreifen eine Waffenruhe gelten, doch das israelische Militär tötet dort imm… [+1771 chars]",,de,'Kinder'
https://www.audi.com/de/pressemitteilungen/audi-forum-neckarsulm-ein-samstag-fuer-die-ganze-familie-18103,https://www.audi.com/de/pressemitteilungen/audi-forum-neckarsulm-ein-samstag-fuer-die-ganze-familie-18103,0,www.audi.com,Audi Forum Neckarsulm: Ein Samstag für die ganze Familie,"Am Samstag, 18. Juli lädt das Audi Forum Neckarsulm von 10 bis 14 Uhr zu einem sportlichen Mitmachtag ein. Ein besonderer Höhepunkt ist das Finale des „Radio Ton Kids Cup“. Am Nachmittag gibt es ein interaktives Kinderkonzert mit dem kleinen Roboter ADUI.
wei…",https://uploads.audi.com/system/production/media/132934/images/ee9067b034a76c9bcf88f6dd041a0f547c8dbd15/A263778_blog.png?1783432489,2026-07-09T00:00:00Z,,"Im Mittelpunkt des Tages steht neben zahlreichen Mitmachaktionen das Finale des Radio Ton Kids Cup, der in den vergangenen Wochen in den Schulen der Region stattgefunden hat. Die Teilnehmenden absolv… [+2402 chars]",,de,'Kinder'
https://www.zeit.de/news/2026-07/09/steinmeier-uebergibt-letzte-kohle-ans-haus-der-geschichte,https://www.zeit.de/news/2026-07/09/steinmeier-uebergibt-letzte-kohle-ans-haus-der-geschichte,0,www.zeit.de,Industriegeschichte: Steinmeier übergibt letzte Kohle ans Haus der Geschichte,Hier finden Sie Informationen zu dem Thema „Industriegeschichte“. Lesen Sie jetzt „Steinmeier übergibt letzte Kohle ans Haus der Geschichte“.,https://img.zeit.de/news/2026-07/09/steinmeier-uebergibt-letzte-kohle-ans-haus-der-geschichte-image-group/wide__1300x731,2026-07-09T01:30:09Z,,Bundespräsident Frank-Walter Steinmeier übergibt am Donnerstag (10.45 Uhr) das letzte in Deutschland geförderte Stück Steinkohle an das Haus der Geschichte in Bonn. Bergleute hatten Steinmeier den si… [+864 chars],,de,'Kohle'
https://www.zeit.de/news/2026-07/09/hochwasser-fuehren-zu-groesseren-wirtschaftlichen-schaeden,https://www.zeit.de/news/2026-07/09/hochwasser-fuehren-zu-groesseren-wirtschaftlichen-schaeden,0,www.zeit.de,Versicherungen: Hochwasser führen zu größeren wirtschaftlichen Schäden,Hier finden Sie Informationen zu dem Thema „Versicherungen“. Lesen Sie jetzt „Hochwasser führen zu größeren wirtschaftlichen Schäden“.,https://img.zeit.de/news/2026-07/09/hochwasser-fuehren-zu-groesseren-wirtschaftlichen-schaeden-image-group/wide__1300x731,2026-07-09T02:30:11Z,,Hochwasser verursachen einer neuen Analyse zufolge zunehmend schwerere Schäden in Europa. Der wirtschaftliche Schaden eines Hochwassers lag seit 2020 preisbereinigt im Schnitt bei ungefähr 400 Millio… [+1739 chars],,de,'Hochwasser'
https://www.tagesspiegel.de/wirtschaft/versicherungen-hochwasser-fuhren-zu-grosseren-wirtschaftlichen-schaden-15821137.html,https://www.tagesspiegel.de/wirtschaft/versicherungen-hochwasser-fuhren-zu-grosseren-wirtschaftlichen-schaden-15821137.html,0,www.tagesspiegel.de,Versicherungen: Hochwasser führen zu größeren wirtschaftlichen Schäden,"Allianz Trade hat untersucht, welche Folgen Hochwasser in Europa haben. Der Kreditversicherer rät, in den Hochwasserschutz zu investieren.",https://www.tagesspiegel.de/images/15821136/alternates/BASE_16_9_W1400/1783564345000/wiederaufbau-von-bahnstrecke.jpeg,2026-07-09T02:32:25Z,,Hochwasser verursachen einer neuen Analyse zufolge zunehmend schwerere Schäden in Europa. Der wirtschaftliche Schaden eines Hochwassers lag seit 2020 preisbereinigt im Schnitt bei ungefähr 400 Millio… [+1790 chars],,de,'Hochwasser'
https://www.zeit.de/news/2026-07/09/bund-umfrage-hochwasserschutz-fuer-viele-unzureichend,https://www.zeit.de/news/2026-07/09/bund-umfrage-hochwasserschutz-fuer-viele-unzureichend,0,www.zeit.de,Katastrophales Hochwasser: BUND-Umfrage: Hochwasserschutz für viele unzureichend,Hier finden Sie Informationen zu dem Thema „Katastrophales Hochwasser“. Lesen Sie jetzt „BUND-Umfrage: Hochwasserschutz für viele unzureichend“.,https://img.zeit.de/news/2026-07/09/bund-umfrage-hochwasserschutz-fuer-viele-unzureichend-image-group/wide__1300x731,2026-07-09T06:04:00Z,,Fünf Jahre nach der verheerenden Flutkatastrophe im Ahrtal ist der Schutz vor Starkregen und Hochwasser aus Sicht vieler Menschen in Deutschland weiterhin unzureichend. Wie eine repräsentative Umfrag… [+1791 chars],,de,'Hochwasser'
https://www.tagesspiegel.de/potsdam/landeshauptstadt/warmewende-in-potsdam-kommt-voran-neue-geothermie-bohrung-und-weiterer-grosskredit-15821111.html,https://www.tagesspiegel.de/potsdam/landeshauptstadt/warmewende-in-potsdam-kommt-voran-neue-geothermie-bohrung-und-weiterer-grosskredit-15821111.html,0,www.tagesspiegel.de,Wärmewende in Potsdam kommt voran: Neue Geothermie-Bohrung und weiterer Großkredit,"Die Stadtwerke-Tochter EWP startet mit weiteren Arbeiten, um das Gaskraftwerk im Süden zu ersetzen. Helfen soll ein neues Darlehen der Europäischen Investitionsbank.",https://www.tagesspiegel.de/images/15821116/alternates/BASE_16_9_W1400/1783557578000/baustelle-geothermie-bohrung-am-alten-tramdepot-potsdam.jpeg,2026-07-09T06:50:18Z,,Nächster Schritt für den klimafreundlichen Ersatz des altersschwachen Gas-Heizkraftwerks im Potsdamer Süden: Am kommenden Montag startet die Stadtwerke-Tochter Energie und Wasser Potsdam (EWP) weiter… [+32 chars],,de,'Gas'
https://www.tagesspiegel.de/er-lugt-um-die-alten-lugen-aufrechtzuerhalten-tagesspiegel-community-zu-wegners-reaktion-auf-den-stromausfall-15819012.html,https://www.tagesspiegel.de/er-lugt-um-die-alten-lugen-aufrechtzuerhalten-tagesspiegel-community-zu-wegners-reaktion-auf-den-stromausfall-15819012.html,0,www.tagesspiegel.de,"„Er lügt, um die alten Lügen aufrechtzuerhalten“: Tagesspiegel-Community zu Wegners Reaktion auf den Stromausfall","Kai Wegner führte am Morgen des Berliner Blackouts kein einziges Telefonat — und verschwieg es monatelang. Das Urteil vieler Leserinnen und Leser: Wer lügt, um Lügen zu decken, hat das Amt verwirkt.",https://www.tagesspiegel.de/images/15507424/alternates/BASE_16_9_W1400/1776789966000/burgercharta-fur-olympia-in-berlin.jpeg,2026-07-09T07:02:30Z,,"Berlins Regierender Bürgermeister Kai Wegner hat nach Recherchen des Tagesspiegels öffentlich falsche Angaben über sein Verhalten am Morgen des Stromausfalls gemacht. Er telefonierte nicht, wie behau… [+6973 chars]",,de,'Blackout'
https://www.focus.de/panorama/welt/wir-wissen-nicht-einmal-wer-die-rechtsnachfolger-waeren-stadt-sucht-nach-erben-um-flussufer-sicherer-zu-machen_1e60287f-393c-4b89-ac8d-c1932792b998.html,https://www.focus.de/panorama/welt/wir-wissen-nicht-einmal-wer-die-rechtsnachfolger-waeren-stadt-sucht-nach-erben-um-flussufer-sicherer-zu-machen_1e60287f-393c-4b89-ac8d-c1932792b998.html,0,www.focus.de,"„Wir wissen nicht einmal, wer die Rechtsnachfolger wären“: Stadt sucht nach Erben, um Flussufer sicherer zu machen",Die belgische Stadt Verviers möchte den Hochwasserschutz verbessern und muss dafür alle Grundstücke an einer Flusspromenade aufkaufen. Ein Grundstück bereitet allerdings Probleme.,"https://quadro.burda-forward.de/ctf/95c43342-80df-4999-9094-155bdac5eae3.418f15c0-1517-42b6-9d38-533514f8c02b.jpg?im=RegionOfInterestCrop=(1200,630),regionOfInterest=(969,991)&hash=b70b537434f04794096eba82dac63858f1048001f7d5a2f69510b387319163c8",2026-07-09T08:15:00Z,,"Seit der Flutkatastrophe im Juli 2021 verfolgt die belgische Stadt Verviers einen Plan. Sie will alle Gebäude an der Promenade des Récollets aufkaufen, abreißen und das Flussufer widerstandsfähiger g… [+2328 chars]",,de,'Hochwasser'
https://www.focus.de/politik/ausland/wir-haben-an-einem-tag-276-anrufe-erhalten-wegen-benzinknappheit-und-explodierenden-preisen-lassen-russen-ihre-autos-massenhaft-auf-gas-umruesten_77bbedf2-5160-4213-a59f-5ae7277fc927.html,https://www.focus.de/politik/ausland/wir-haben-an-einem-tag-276-anrufe-erhalten-wegen-benzinknappheit-und-explodierenden-preisen-lassen-russen-ihre-autos-massenhaft-auf-gas-umruesten_77bbedf2-5160-4213-a59f-5ae7277fc927.html,0,www.focus.de,„Wir haben an einem Tag 276 Anrufe erhalten“: Wegen Benzinknappheit und explodierenden Preisen lassen Russen ihre Autos massenhaft auf Gas umrüsten,"In Russland wird Benzin knapp, die Preise steigen. Viele Autofahrer lassen ihre Wagen deshalb auf deutlich billigeres Autogas umrüsten.","https://quadro.burda-forward.de/ctf/1131e8f3-7927-4b91-93c2-2ffc0ce477f3.16b0f154-9425-478a-b645-8ddd587641db.jpg?im=RegionOfInterestCrop=(1200,630),regionOfInterest=(1761,1296)&hash=c42ca49eb0c229d15c416c10fe4f2a855c9d61e2a079827a32d909eb6bde10cf",2026-07-09T08:48:00Z,,Russland erlebt nach ukrainischen Drohnenangriffen auf Raffinerien eine wachsende Benzinknappheit. An Tankstellen bilden sich lange Schlangen. Zudem steigen die Preise spürbar. Viele Autofahrer weich… [+2145 chars],,de,'Gas'
https://www.zeit.de/politik/deutschland/2026-07/kindergeld-reform-gesetz-antrag-automatisch-bundestag,https://www.zeit.de/politik/deutschland/2026-07/kindergeld-reform-gesetz-antrag-automatisch-bundestag,0,www.zeit.de,Kindergeld: Bundestag macht Weg für antragsloses Kindergeld frei,Für junge Familien fällt beim Kindergeld künftig ein großes Stück Bürokratie weg: Die Leistung soll ab 2027 standardmäßig ohne Antrag fließen.,https://img.zeit.de/politik/deutschland/2026-07/kindergeld-reform-gesetz-antrag-automatisch-bundestag-foto-1/wide__1300x731,2026-07-09T13:13:17Z,,"Kindergeld soll künftig nach der
Geburt automatisch und ohne Antrag ausgezahlt werden. Der
Bundestag beschloss ein entsprechendes Gesetz, mit
dem die Koalition aus Union und SPD eine Empfehlung zu… [+1779 chars]",,de,'ältere Menschen'
https://www.n-tv.de/politik/Bundestag-macht-Weg-fuer-Kindergeld-ohne-Antrag-frei-id31067865.html,https://www.n-tv.de/politik/Bundestag-macht-Weg-fuer-Kindergeld-ohne-Antrag-frei-id31067865.html,0,www.n-tv.de,Geplanter Bürokratieabbau : Bundestag macht Weg für Kindergeld ohne Antrag frei,Die Zeit nach der Geburt ist für Familien herausfordernd. Die Koalition will Eltern nun zumindest beim Kindergeld entlasten. Dieses soll künftig ohne Antrag automatisch ausgezahlt werden - wenn Bedingungen erfüllt sind.,https://www.n-tv.de/img/31067929/1783606987/Img_16_9/1200/traurig-geschwister-scheidungskind-Bildverwendung-nur-mit-Urhebervermerk-Pawel-Opaska-Shotshop-picture-alliance-Keine-Exlusivverkaeufe-moeglich.jpg,2026-07-09T14:29:35Z,,"Zunächst erhalten Familien mit einem Kind für ihr zweites Kind das automatische Kindergeld. (Foto: picture alliance / Pawel Opaska/Shotshop)
Die Zeit nach der Geburt ist für Familien herausfordernd.… [+3015 chars]",,de,'Kinder'
