index,url,valid,domain,title,description,image,published,archive,content,quote,language,keyword
https://www.tagesschau.de/inland/energiepreise-spritpreise-mehrwersteuer-100.html,https://www.tagesschau.de/inland/energiepreise-spritpreise-mehrwersteuer-100.html,0,www.tagesschau.de,Günstigere Bahntickets? Neue Vorschläge für Entlastung der Bürger,Wie kann man die Bürger angesichts der hohen Spritpreise entlasten? Die Eisenbahngewerkschaft EVG schlägt deutlich günstigere Bahntickets vor. Der Städte- und Gemeindebund plädiert für eine vorübergehende Senkung der Mehrwertsteuer.,https://images.tagesschau.de/image/50a692be-3453-4417-b120-2c6a5a597770/AAABnVy9LhI/AAABnSSvrFg/16x9-big/bahn-1120.jpg?width=1280,2026-04-05T08:11:39Z,,"Stand: 05.04.2026 10:11 Uhr
Wie kann man die Bürger angesichts der hohen Spritpreise entlasten? Die Eisenbahngewerkschaft EVG schlägt deutlich günstigere Bahntickets vor. Der Städte- und Gemeindebun… [+2582 chars]",,de,'Spritpreise'
https://www.zeit.de/news/2026-04/05/hohe-spritpreise-evg-chef-bringt-bahn-rabatte-ins-gespraech,https://www.zeit.de/news/2026-04/05/hohe-spritpreise-evg-chef-bringt-bahn-rabatte-ins-gespraech,0,www.zeit.de,Folgen des Iran-Kriegs: Hohe Spritpreise: EVG-Chef bringt Bahn-Rabatte ins Gespräch,Hier finden Sie Informationen zu dem Thema „Folgen des Iran-Kriegs“. Lesen Sie jetzt „Hohe Spritpreise: EVG-Chef bringt Bahn-Rabatte ins Gespräch“.,https://img.zeit.de/news/2026-04/05/hohe-spritpreise-evg-chef-bringt-bahn-rabatte-ins-gespraech-image-group/wide__1300x731,2026-04-05T08:44:12Z,,Entlastung für die Bürger mit Rabatten bei der Bahn? Das kann sich in der aktuellen Debatte über hohe Spritpreise zumindest der stellvertretende Aufsichtsratsvorsitzende der Deutschen Bahn gut vorste… [+1981 chars],,de,'Spritpreise'
https://www.telepolis.de/article/Schimmelbildung-vermeiden-Tipps-fuer-ein-gesundes-Raumklima-10655494.html,https://www.telepolis.de/article/Schimmelbildung-vermeiden-Tipps-fuer-ein-gesundes-Raumklima-10655494.html,0,www.telepolis.de,Schimmel vermeiden: Tipps für ein gesundes Raumklima,Schimmel in der Wohnung kann krank machen. Mit der richtigen Luftfeuchtigkeit und gezieltem Lüften lässt sich das Risiko deutlich senken.,https://heise.cloudimg.io/bound/1200x1200/q85.png-lossy-85.webp-lossy-85.foil1/_www-heise-de_/imgs/18/4/9/4/0/1/1/2/shutterstock_2645097459-a18d26d7868510cf.jpeg,2026-04-05T08:50:00Z,,"Foto: ja-aljona, shutterstock
Schimmel in der Wohnung kann krank machen. Mit der richtigen Luftfeuchtigkeit und gezieltem Lüften lässt sich das Risiko deutlich senken.
(Schimmel)Pilze sind Teil der… [+3651 chars]",,de,'Schimmel'
https://www.diepresse.com/20741369/urlauberin-vom-salzburger-untersberg-gerettet,https://www.diepresse.com/20741369/urlauberin-vom-salzburger-untersberg-gerettet,0,www.diepresse.com,Urlauberin vom Salzburger Untersberg gerettet,Die Studentin aus China war erschöpft im Schnee stecken geblieben. Wegen Nebels war keine Hubschrauberbergung möglich.,https://img.diepresse.com/public/incoming/tdk8k1-kein-titel/alternates/DPR_SOCIAL_NACHRICHTEN/kein%20Titel,2026-04-05T09:57:06Z,,"Die Studentin aus China war erschöpft im Schnee stecken geblieben. Wegen Nebels war keine Hubschrauberbergung möglich.
Eine junge Studentin aus China ist während ihres Osterurlaubes am Samstag am Sa… [+706 chars]",,de,'Schnee'
https://www.zeit.de/news/2026-04/05/spritpreise-steigen-weiter-diesel-erreicht-neues-rekordhoch,https://www.zeit.de/news/2026-04/05/spritpreise-steigen-weiter-diesel-erreicht-neues-rekordhoch,0,www.zeit.de,Ein Rekord nach dem nächsten: Spritpreise steigen weiter: Diesel erreicht neues Rekordhoch,Hier finden Sie Informationen zu dem Thema „Ein Rekord nach dem nächsten“. Lesen Sie jetzt „Spritpreise steigen weiter: Diesel erreicht neues Rekordhoch“.,https://img.zeit.de/news/2026-04/05/spritpreise-steigen-weiter-diesel-erreicht-neues-rekordhoch-image-group/wide__1300x731,2026-04-05T11:12:25Z,,"Die Spritpreise für Diesel und Super E10 in Deutschland sind erneut gestiegen. Wie der ADAC mitteilte, mussten Autofahrer gestern im Schnitt 2,425 Euro für einen Liter Diesel zahlen. Der bisherige Re… [+1048 chars]",,de,'Spritpreise'
https://www.faz.net/aktuell/politik/inland/digitale-sucht-legt-mal-das-handy-weg-accg-200698222.html,https://www.faz.net/aktuell/politik/inland/digitale-sucht-legt-mal-das-handy-weg-accg-200698222.html,0,www.faz.net,Alltag ohne Smartphones: Legt mal das Handy weg!,"Nicht nur Kinder und Jugendliche, auch viele Erwachsene hängen zu viel am Smartphone. Höchste Zeit, etwas gegen die digitale Sucht zu tun, schreibt @OliverGeorgi",https://media0.faz.net/image/w1200h627/18212e6e6f38/w3000h1567x0y216o/202604/96684bac-2e8d-11f1-9f69-66210c0a8bb7/digital-detox-das-wuenschen.webp,2026-04-05T12:42:31Z,,"Ich gebe es zu: Selbst während ich diesen Text schreibe, ist mein Smartphone nicht weit. Es liegt gleich neben dem Laptop, im Nicht stören-Modus. Was natürlich ein Hohn ist, nicht stören. Ich gucke t… [+12085 chars]",,de,'Kinder'
https://www.nzz.ch/sponsored-content/matterhorn-alpine-crossing-seilbahnreise-ueber-grenzen-hinweg-ld.1931256,https://www.nzz.ch/sponsored-content/matterhorn-alpine-crossing-seilbahnreise-ueber-grenzen-hinweg-ld.1931256,0,www.nzz.ch,SPONSORED CONTENT - Eine Seilbahnreise über Grenzen hinweg,"Am Morgen einen Kaffee in Zermatt, am Nachmittag ein Génépi in Cervinia. Dazwischen eine Seilbahnreise über Fels, Schnee und Gletscher. Das Matterhorn Alpine Crossing ist eine Verbindung von zwei Kulturen, die sich am Fuss desselben Berges begegnen.","https://img.nzz.ch/2026/03/26/52521075-ea88-425d-a5a2-d69d684848c0.jpg?width=1200&height=675&fit=bounds&quality=75&auto=webp&crop=1500,844,x0,y76&wmark=nzz",2026-04-05T22:05:00Z,,"Am Morgen einen Kaffee in Zermatt, am Nachmittag ein Génépi in Cervinia. Dazwischen eine Seilbahnreise über Fels, Schnee und Gletscher. Das Matterhorn Alpine Crossing ist eine Verbindung von zwei Kul… [+6451 chars]",,de,'Schnee'
https://www.zeit.de/news/2026-04/06/wie-es-der-vogelwelt-nach-dem-frostigen-winter-geht,https://www.zeit.de/news/2026-04/06/wie-es-der-vogelwelt-nach-dem-frostigen-winter-geht,0,www.zeit.de,Tiere: Wie es der Vogelwelt nach dem frostigen Winter geht,Hier finden Sie Informationen zu dem Thema „Tiere“. Lesen Sie jetzt „Wie es der Vogelwelt nach dem frostigen Winter geht“.,https://img.zeit.de/news/2026-04/06/wie-es-der-vogelwelt-nach-dem-frostigen-winter-geht-image-group/wide__1300x731,2026-04-06T03:00:08Z,,"Mit dem Frühling kehren viele Vögel nach Berlin und Brandenburg zurück oder können sich von dem teilweise sehr kalten Winter erholen. «Die harte Zeit ist vorbei, die Berliner Wintervogelwelt hat das … [+2385 chars]",,de,'Winter'
https://www.stern.de/gesellschaft/regional/berlin-brandenburg/tiere--wie-es-der-vogelwelt-nach-dem-frostigen-winter-geht-37284558.html,https://www.stern.de/gesellschaft/regional/berlin-brandenburg/tiere--wie-es-der-vogelwelt-nach-dem-frostigen-winter-geht-37284558.html,0,www.stern.de,Tiere: Wie es der Vogelwelt nach dem frostigen Winter geht,Nach dem eisigen Winter sind viele Vögel wieder zurück in Berlin und Brandenburg. Doch nicht alle Vogelarten haben Eis und Kälte gut überstanden. Und was macht die Vogelgrippe?,https://image.stern.de/37284560/t/aZ/v1/w1440/r1.7778/-/06--q5vhhggp7dv11axs2048jpeg---6b57bcef502b8901.jpg,2026-04-06T03:00:08Z,,"Kopiere den aktuellen Link
Zur Merkliste hinzufügen
Nach dem eisigen Winter sind viele Vögel wieder zurück in Berlin und Brandenburg. Doch nicht alle Vogelarten haben Eis und Kälte gut überstanden.… [+2577 chars]",,de,'Schnee'
https://www.stern.de/panorama/wissen/tiere--kaelte-und-vogelgrippe--wie-es-voegeln-nach-dem-winter-geht-37284554.html,https://www.stern.de/panorama/wissen/tiere--kaelte-und-vogelgrippe--wie-es-voegeln-nach-dem-winter-geht-37284554.html,0,www.stern.de,Tiere: Kälte und Vogelgrippe: Wie es Vögeln nach dem Winter geht,"Der Winter hat manchen Vögeln zugesetzt. Bei anderen war es die Vogelgrippe. Welche Tiere noch auf dem Rückflug sind und was für einen guten Frühling wichtig ist, erklärt ein Experte.",https://image.stern.de/37284556/t/Ss/v1/w1440/r1.7778/-/06--yhihpav66nv7axs2048jpeg---eb8e195851059fdd.jpg,2026-04-06T03:00:24Z,,"Kopiere den aktuellen Link
Zur Merkliste hinzufügen
Der Winter hat manchen Vögeln zugesetzt. Bei anderen war es die Vogelgrippe. Welche Tiere noch auf dem Rückflug sind und was für einen guten Früh… [+3031 chars]",,de,'Kälte'
https://www.zeit.de/news/2026-04/06/kaelte-und-vogelgrippe-wie-es-voegeln-nach-dem-winter-geht,https://www.zeit.de/news/2026-04/06/kaelte-und-vogelgrippe-wie-es-voegeln-nach-dem-winter-geht,0,www.zeit.de,Tiere: Kälte und Vogelgrippe: Wie es Vögeln nach dem Winter geht,Hier finden Sie Informationen zu dem Thema „Tiere“. Lesen Sie jetzt „Kälte und Vogelgrippe: Wie es Vögeln nach dem Winter geht“.,https://img.zeit.de/news/2026-04/06/kaelte-und-vogelgrippe-wie-es-voegeln-nach-dem-winter-geht-image-group/wide__1300x731,2026-04-06T03:00:24Z,,"Mit dem Frühling sind viele Vögel zurück in Deutschland oder erholen sich von dem teils heftigen Winter. «Sie haben den Winter gut gemeistert, wenn man bedenkt, dass er doch recht harsch war», sagte … [+2832 chars]",,de,'Kälte'
https://www.tagesspiegel.de/berlin/heimische-arten-sind-auf-klima-angepasst-wie-es-der-berliner-vogelwelt-nach-dem-frostigen-winter-geht-15438457.html,https://www.tagesspiegel.de/berlin/heimische-arten-sind-auf-klima-angepasst-wie-es-der-berliner-vogelwelt-nach-dem-frostigen-winter-geht-15438457.html,0,www.tagesspiegel.de,„Heimische Arten sind auf Klima angepasst“: Wie es der Berliner Vogelwelt nach dem frostigen Winter geht,Nach dem eisigen Winter sind viele Vögel wieder zurück in Berlin und Brandenburg. Doch nicht alle Vogelarten haben Eis und Kälte gut überstanden. Und was macht die Vogelgrippe?,https://www.tagesspiegel.de/images/15438456/alternates/BASE_16_9_W1400/1775461868000/fruhling-in-berlin.jpeg,2026-04-06T03:01:46Z,,"Mit dem Frühling kehren viele Vögel nach Berlin und Brandenburg zurück oder können sich von dem teilweise sehr kalten Winter erholen. Die harte Zeit ist vorbei, die Berliner Wintervogelwelt hat das ü… [+2656 chars]",,de,'Winter'
https://www.tagesspiegel.de/berlin/folgen-des-berliner-blackouts-hotelkosten-fur-bisher-700-antragsteller-erstattet-15438461.html,https://www.tagesspiegel.de/berlin/folgen-des-berliner-blackouts-hotelkosten-fur-bisher-700-antragsteller-erstattet-15438461.html,0,www.tagesspiegel.de,Folgen des Berliner Blackouts: Hotelkosten für bisher 700 Antragsteller erstattet,"Währende des großen Stromausfalls im Januar flüchteten Tausende im Berliner Südwesten  in Hotels, der Senat übernimmt die Kosten. Bislang wurden 700 von 2881 Anträgen positiv beschieden, teilte der Bezirk mit.",https://www.tagesspiegel.de/images/15438460/alternates/BASE_16_9_W1400/1775444530000/stromausfall-berlin.jpeg,2026-04-06T03:02:10Z,,Drei Monate nach dem großen Stromausfall im Berliner Südwesten kommt die Erstattung der Hotelkosten von Betroffenen voran. Von 2.881 gestellten Anträgen seien inzwischen etwa 700 ausgezahlt oder posi… [+2305 chars],,de,'Blackout'
https://orf.at/stories/3425138/,https://orf.at/stories/3425138/,0,orf.at,Grüner Strom statt schwarzes Gold,Die Angriffe auf Öl- und Gasanlagen in der Golfregion und die Blockade der Straße von Hormus durch den Iran treiben die Energiepreise weltweit in die Höhe. Aber nicht alle Länder sind gleichermaßen betroffen. Vor allem bisherige Bemühungen im Ausbau erneuerba…,https://ibs.orf.at/news?image=https%3A%2F%2Fassets.orf.at%2Fmims%2F2026%2F14%2F41%2Fcrops%2Fw%3D1200%2Ch%3D630%2Cq%3D75%2F2989640_master_1156141_klima_iran_krieg_erneuerbare_hum.jpg%3Fs%3D0cca5d7287bba1d3628d2813e07fee7529d49ee6,2026-04-06T05:50:12Z,,"Der Leiter der Internationalen Energieagentur (IEA), Fatih Birol, hat den Iran-Krieg unlängst als schlimmste globale Gefährdung der Energiesicherheit in der Geschichte bezeichnet. Dabei zeigt die akt… [+4947 chars]",,de,'Gas'
https://www.tagesschau.de/inland/spritpreise-entlastung-pendlerpauschale-cdu-kritik-reiche-100.html,https://www.tagesschau.de/inland/spritpreise-entlastung-pendlerpauschale-cdu-kritik-reiche-100.html,0,www.tagesschau.de,CDU-Kritik an Reiches Vorschlag zur Pendlerpauschale,"Angesichts hoher Spritpreise sucht die Bundesregierung nach Wegen, die Bevölkerung zu entlasten. Wirtschaftsministerin Reiche erwägt etwa eine höhere Pendlerpauschale. Doch selbst aus den eigenen Reihen kommt daran Kritik.",https://images.tagesschau.de/image/198aecbd-574e-4a18-b27f-d6dd446fcc61/AAABnWHDXVM/AAABnSSvrFg/16x9-big/katherina-reiche-142.jpg?width=1280,2026-04-06T08:40:28Z,,"Stand: 06.04.2026 10:40 Uhr
Angesichts hoher Spritpreise sucht die Bundesregierung nach Wegen, die Bevölkerung zu entlasten. Wirtschaftsministerin Reiche erwägt etwa eine höhere Pendlerpauschale. Do… [+2176 chars]",,de,'Spritpreise'
https://www.welt.de/wirtschaft/energie/article69d3aaa7086bb1c024ff9210/folgen-des-iran-kriegs-dieselpreis-springt-von-rekord-zu-rekord.html,https://www.welt.de/wirtschaft/energie/article69d3aaa7086bb1c024ff9210/folgen-des-iran-kriegs-dieselpreis-springt-von-rekord-zu-rekord.html,0,www.welt.de,Dieselpreis springt von Rekord zu Rekord,"Die Spritpreise erreichen immer neue Rekorde. 2,440 Euro hat ein Liter Diesel durchschnittlich am Ostersonntag gekostet. Unterdessen diskutiert die Politik weitere Maßnahmen.",https://images.welt.de/69d3aaa7086bb1c024ff9210/5986c9144c275439a66737b87356a0e4-master/ci16x9-w1200/dpa-com-20090101-260406-935-1263125-jpg,2026-04-06T13:15:53Z,,"Die Spritpreise erreichen immer neue Rekorde. 2,440 Euro hat ein Liter Diesel durchschnittlich am Ostersonntag gekostet. Unterdessen diskutiert die Politik weitere Maßnahmen.An den Tankstellen in Deu… [+4906 chars]",,de,'Spritpreise'
https://www.zeit.de/news/2026-04/07/gasfoerderung-vor-borkum-ausgeweitet-zweite-bohrung-erfolgt,https://www.zeit.de/news/2026-04/07/gasfoerderung-vor-borkum-ausgeweitet-zweite-bohrung-erfolgt,0,www.zeit.de,Umstrittenes Gasprojekt: Gasförderung vor Borkum ausgeweitet – Zweite Bohrung erfolgt,Hier finden Sie Informationen zu dem Thema „Umstrittenes Gasprojekt“. Lesen Sie jetzt „Gasförderung vor Borkum ausgeweitet – Zweite Bohrung erfolgt“.,https://img.zeit.de/news/2026-04/07/gasfoerderung-vor-borkum-ausgeweitet-zweite-bohrung-erfolgt-image-group/wide__1300x731,2026-04-06T22:01:05Z,,"Die umstrittene Gasförderung in der Nordsee nahe der Insel Borkum ist nach Angaben des Energiekonzerns One-Dyas ausgeweitet worden. Wie das niederländische Unternehmen mitteilte, wird inzwischen von … [+3516 chars]",,de,'Gas'
https://www.zeit.de/news/2026-04/07/toedlicher-winter-135-tote-durch-lawinen,https://www.zeit.de/news/2026-04/07/toedlicher-winter-135-tote-durch-lawinen,0,www.zeit.de,Ende der Skisaison: Tödlicher Winter: 135 Tote durch Lawinen,Hier finden Sie Informationen zu dem Thema „Ende der Skisaison“. Lesen Sie jetzt „Tödlicher Winter: 135 Tote durch Lawinen“.,https://img.zeit.de/news/2026-04/07/toedlicher-winter-135-tote-durch-lawinen-image-group/wide__1300x731,2026-04-07T03:53:04Z,,In Europa sind in diesem Winter so viele Menschen durch Lawinen ums Leben gekommen wie seit Jahren nicht mehr. Nach einer offiziellen Statistik starben in den Alpen und in anderen europäischen Gebirg… [+3268 chars],,de,'Winter'
https://www.stern.de/panorama/ende-der-skisaison--toedlicher-winter--135-tote-durch-lawinen-37286184.html,https://www.stern.de/panorama/ende-der-skisaison--toedlicher-winter--135-tote-durch-lawinen-37286184.html,0,www.stern.de,Ende der Skisaison: Tödlicher Winter: 135 Tote durch Lawinen,"In vielen europäischen Skigebieten ist die Saison nach dem Osterwochenende vorbei. Die Lawinenwarndienste ziehen eine düstere Bilanz. Experten meinen, dass das auch mit dem Klimawandel zu tun hat.",https://image.stern.de/37286186/t/wt/v1/w1440/r1.7778/-/07--m4rjx7uw6gv11axs2048jpeg---95194e8cbd37193a.jpg,2026-04-07T03:53:04Z,,"Kopiere den aktuellen Link
Zur Merkliste hinzufügen
In vielen europäischen Skigebieten ist die Saison nach dem Osterwochenende vorbei. Die Lawinenwarndienste ziehen eine düstere Bilanz. Experten me… [+3480 chars]",,de,'Winter'
https://www.tagesspiegel.de/gesellschaft/panorama/ende-der-skisaison-todlicher-winter-135-tote-durch-lawinen-15439990.html,https://www.tagesspiegel.de/gesellschaft/panorama/ende-der-skisaison-todlicher-winter-135-tote-durch-lawinen-15439990.html,0,www.tagesspiegel.de,Ende der Skisaison: Tödlicher Winter: 135 Tote durch Lawinen,"In vielen europäischen Skigebieten ist die Saison nach dem Osterwochenende vorbei. Die Lawinenwarndienste ziehen eine düstere Bilanz. Experten meinen, dass das auch mit dem Klimawandel zu tun hat.",https://www.tagesspiegel.de/images/15439989/alternates/BASE_16_9_W1400/1775534061000/lawinenungluck-in-sudtirol.jpeg,2026-04-07T03:54:21Z,,In Europa sind in diesem Winter so viele Menschen durch Lawinen ums Leben gekommen wie seit Jahren nicht mehr. Nach einer offiziellen Statistik starben in den Alpen und in anderen europäischen Gebirg… [+3328 chars],,de,'Winter'
https://www.zeit.de/news/2026-04/07/schausteller-warnen-vor-preisschub-auf-jahrmaerkten,https://www.zeit.de/news/2026-04/07/schausteller-warnen-vor-preisschub-auf-jahrmaerkten,0,www.zeit.de,Steigende Spritpreise: Schausteller warnen vor Preisschub auf Jahrmärkten,Hier finden Sie Informationen zu dem Thema „Steigende Spritpreise“. Lesen Sie jetzt „Schausteller warnen vor Preisschub auf Jahrmärkten“.,https://img.zeit.de/news/2026-04/07/schausteller-warnen-vor-preisschub-auf-jahrmaerkten-image-group/wide__1300x731,2026-04-07T04:00:04Z,,"Auf Jahrmärkten könnten Fahrgeschäfte und Zuckerwatte bald teurer werden. Der Grund dafür seien steigende Spritpreise und die Inflation, welche die Schaustellerbranche hart treffen würden, teilt der … [+1231 chars]",,de,'Spritpreise'
https://www.stern.de/panorama/durch-lawinen-starben-mindestens-135-menschen-in-diesem-winter-37286104.html,https://www.stern.de/panorama/durch-lawinen-starben-mindestens-135-menschen-in-diesem-winter-37286104.html,0,www.stern.de,Wintersport in Europa: In diesem Winter starben mindestens 135 Menschen durch Lawinen,Lawinen sind oft tödlich. In diesem Winter kam es in den europäischen Bergregionen zu besonders vielen Unglücken. Es kamen überdurchschnittlich viele Menschen ums Leben.,https://image.stern.de/37286106/t/qO/v1/w1440/r1.7778/-/lawinen.jpg,2026-04-07T04:05:00Z,,"Kopiere den aktuellen Link
Zur Merkliste hinzufügen
Lawinen sind oft tödlich. In diesem Winter kam es in den europäischen Bergregionen zu besonders vielen Unglücken. Es kamen überdurchschnittlich v… [+1243 chars]",,de,'Winter'
https://www.diepresse.com/20744532/toedlichster-winter-seit-jahren-135-menschen-sterben-durch-lawinen,https://www.diepresse.com/20744532/toedlichster-winter-seit-jahren-135-menschen-sterben-durch-lawinen,0,www.diepresse.com,Tödlichster Winter seit Jahren: 135 Menschen sterben durch Lawinen,"Besonders hart betroffen war in diesem Winter Italien, dahinter liegen Frankreich und Österreich.",https://img.diepresse.com/public/incoming/tvi2xg-kein-titel/alternates/DPR_SOCIAL_NACHRICHTEN/kein%20Titel,2026-04-07T04:19:50Z,,"Besonders hart betroffen war in diesem Winter Italien, dahinter liegen Frankreich und Österreich.
In Europa sind in diesem Winter so viele Menschen durch Lawinen ums Leben gekommen wie seit Jahren n… [+1156 chars]",,de,'Winter'
https://www.faz.net/aktuell/gesellschaft/ungluecke/europas-lawinen-so-viele-tote-gab-es-im-winter-2025-26-accg-200706347.html,https://www.faz.net/aktuell/gesellschaft/ungluecke/europas-lawinen-so-viele-tote-gab-es-im-winter-2025-26-accg-200706347.html,0,www.faz.net,Unglücke in europa: So viele Menschen kamen diesen Winter durch Lawinen ums Leben,In vielen europäischen Skigebieten ist die Saison vorbei. Die Lawinenwarndienste ziehen eine düstere Bilanz.,https://media0.faz.net/image/w1200h627/d5f40e46d148/w4344h2269x0y171o/202603/43601.0.1932146119/rettungskraefte-suchen-im.webp,2026-04-07T05:00:12Z,,In Europa sind in diesem Winter so viele Menschen durch Lawinen ums Leben gekommen wie seit Jahren nicht mehr. Nach einer offiziellen Statistik starben in den Alpen und in anderen europäischen Gebirg… [+3211 chars],,de,'Winter'
https://www.focus.de/finanzen/news/bundesregierung-hat-fuenf-optionen-gegen-steigende-oelpreise_fc18416e-da1b-4316-9145-963f1632764f.html,https://www.focus.de/finanzen/news/bundesregierung-hat-fuenf-optionen-gegen-steigende-oelpreise_fc18416e-da1b-4316-9145-963f1632764f.html,0,www.focus.de,Bundesregierung hat fünf Optionen gegen steigende Ölpreise,Iran-Krieg treibt Öl und Gas hoch: Welche Hilfen Berlin jetzt prüfen kann – von Tankrabatt bis Energiepauschale.,"https://quadro.burda-forward.de/ctf/4d9ca3a9-cf8d-43fe-ab65-563aa1c27d4d.f90c7fe5-ada2-4e06-b551-51354432bfa4.jpg?im=RegionOfInterestCrop=(1200,630),regionOfInterest=(483,312)&hash=e8956ac1ee346569c54e60267064d37f0270767af6525f002875383e52735c39",2026-04-07T05:07:00Z,,Die Angriffe der USA und Israels auf den Iran haben großen Einfluss auf die Energiepreise. Das Barrel Öl hat sich je nach Sorte innerhalb von anderthalb Wochen um rund 50 Prozent verteuert. Erstmals … [+5004 chars],,de,'Energiepauschale'
https://www.n-tv.de/panorama/135-Menschen-wurden-im-Winter-durch-Lawinen-getoetet-id30686435.html,https://www.n-tv.de/panorama/135-Menschen-wurden-im-Winter-durch-Lawinen-getoetet-id30686435.html,0,www.n-tv.de,Fast Verdoppelung zum Vorjahr: 135 Menschen wurden im Winter durch Lawinen getötet,Für die Skifahrer in Europa ist der vergangene Winter ein besonders tödlicher: Mehr als 130 Menschen werden durch abgehende Lawinen getötet - deutlich mehr als im Vorjahr. Experten haben gleich mehrere Gründe für die Entwicklung ausgemacht.,https://www.n-tv.de/img/30686434/1775542318/Img_16_9/1200/Rettungsdienste-suchen-an-der-Hohen-Ferse-in-Suedtirol-nach-verschuetteten-Skifahrern-die-von-einer-grossen-Lawine-erfasst-wurden-Nach-Angaben-der-italienischen-Bergwacht-loeste-sich-die-Lawine-in-hochalpinem-Gelaende-an-der-mehr-als-2-600-Meter-hohen-Hohen-Ferse-nahe-Ratschings.jpg,2026-04-07T05:16:48Z,,"Fast Verdoppelung zum Vorjahr135 Menschen wurden im Winter durch Lawinen getötet
Rettungsdienste suchen an der Hohen Ferse in Südtirol nach verschütteten Skifahrern. (Foto: picture alliance/dpa/Ital… [+3624 chars]",,de,'Winter'
https://www.zeit.de/gesellschaft/2026-04/lawinen-alpen-klimawandel-skitouren-tote,https://www.zeit.de/gesellschaft/2026-04/lawinen-alpen-klimawandel-skitouren-tote,0,www.zeit.de,Klimawandel: So viele Lawinentote in Europa wie seit Jahren nicht mehr,"In diesem Winter sind besonders viele Menschen von Lawinen getötet worden. Das liegt zum einen am Klimawandel, zum anderen am riskanten Verhalten mancher Wintersportler.",https://img.zeit.de/gesellschaft/zeitgeschehen/2026-04/toedlicher-winter-135-tote-durch-lawinen-bild/wide__1300x731,2026-04-07T06:42:07Z,,"In Europa sind in diesem Winter so viele 
Menschen durch Lawinen ums Leben gekommen wie seit Jahren nicht mehr. Laut einer offiziellen Statistik der European Avalanche Warning Service (EAWS) starben… [+410 chars]",,de,'Winter'
https://www.tagesschau.de/wirtschaft/weltwirtschaft/hormus-blockade-russland-rohstoffe-milliarden-100.html,https://www.tagesschau.de/wirtschaft/weltwirtschaft/hormus-blockade-russland-rohstoffe-milliarden-100.html,0,www.tagesschau.de,Hormus-Blockade bringt Russland milliardenschwere Zusatzerlöse,"Die faktische Sperrung der Straße von Hormus treibt Öl-, Gas- und Düngerpreise. Nach aktuellen Berechnungen erzielt Russland dadurch milliardenschwere Zusatzeinnahmen.",https://images.tagesschau.de/image/bb615ac4-bf0b-49a3-a23d-97d85226b082/AAABnWaLCos/AAABnSSvrFg/16x9-big/putin-1446.jpg?width=1280,2026-04-07T08:15:49Z,,"Stand: 07.04.2026 10:15 Uhr
Die faktische Sperrung der Straße von Hormus treibt Öl-, Gas- und Düngerpreise. Nach aktuellen Berechnungen erzielt Russland dadurch milliardenschwere Zusatzeinnahmen.
D… [+2994 chars]",,de,'Rohöl'
https://www.zeit.de/news/2026-04/07/rezept-fuer-bewegung-soll-kinder-zu-mehr-sport-animieren,https://www.zeit.de/news/2026-04/07/rezept-fuer-bewegung-soll-kinder-zu-mehr-sport-animieren,0,www.zeit.de,"Gesundheit: ""Rezept für Bewegung"" soll Kinder zu mehr Sport animieren","Hier finden Sie Informationen zu dem Thema „Gesundheit“. Lesen Sie jetzt „""Rezept für Bewegung"" soll Kinder zu mehr Sport animieren“.",https://img.zeit.de/news/2026-04/07/rezept-fuer-bewegung-soll-kinder-zu-mehr-sport-animieren-image-group/wide__1300x731,2026-04-07T09:45:52Z,,"Um Kindern und Jugendlichen den nötigen Startimpuls für ein aktives und gesundes Leben zu geben, können Ärztinnen und Ärzte in Rheinland-Pfalz nun ein «Rezept für Bewegung» verschreiben. Viele Kinder… [+2157 chars]",,de,'Kinder'
https://www.diepresse.com/20718508/in-der-katastrophe-darf-die-pflege-nicht-leiden,https://www.diepresse.com/20718508/in-der-katastrophe-darf-die-pflege-nicht-leiden,0,www.diepresse.com,In der Katastrophe darf die Pflege nicht leiden [premium],"Care-Arbeiten sind bezahlte und unbezahlte Tätigkeiten zur Versorgung von Kindern, älteren oder kranken Menschen. Bisher wird diese Versorgung bei Klimakatastrophen nicht mitgedacht. Es fehlen Daten zu Sorgearbeit im Krisenkontext.",https://img.diepresse.com/public/incoming/k3258j-abd20240916abd0168hrjpg/alternates/DPR_SOCIAL_MAGAZIN/ABD_20240916_ABD0168.HR.jpg,2026-04-07T13:51:00Z,,"Ein realistisches Szenario: Über Nacht kam Hochwasser, Wege sind blockiert, die Menschen müssen in der Früh entscheiden, ob sie zuhause in Sicherheit bleiben oder zur Arbeit fahren. Mitte September 2… [+6020 chars]",,de,'Hochwasser'
