index,url,valid,domain,title,description,image,published,archive,content,quote,language,keyword
https://www.stern.de/gesellschaft/regional/berlin-brandenburg/energieversorgung--enviam-will-gaspreis-fuer-kunden-stabil-halten-37377426.html,https://www.stern.de/gesellschaft/regional/berlin-brandenburg/energieversorgung--enviam-will-gaspreis-fuer-kunden-stabil-halten-37377426.html,0,www.stern.de,Energieversorgung: EnviaM will Gaspreis fû¥r Kunden stabil halten,Chemnitz - Kunden von EnviaM mû¥ssen trotz der Krise im Nahen Osten und stark gestiegener BûÑrsenpreise vorerst nicht mit hûÑheren Kosten fû¥r Gas rechnen.,https://image.stern.de/37377428/t/Nr/v1/w1440/r1.7778/-/07--7enxcjb5kmv7axs2048jpeg---7cec7d92ca3f03ac.jpg,2026-05-07T10:52:56Z,,"Kopiere den aktuellen Link
Zur Merkliste hinzufû¥gen
Trotz Krisen und Preissprû¥ngen bleibt der Gaspreis fû¥r EnviaM-Kunden vorerst stabil doch Neukunden triffts hûÊrter. Das steckt dahinter.
Kunden vãÎ [+2900 chars]",,de,'Gas'
https://www.tagesspiegel.de/berlin/energieversorgung-enviam-will-gaspreis-fur-kunden-stabil-halten-15569865.html,https://www.tagesspiegel.de/berlin/energieversorgung-enviam-will-gaspreis-fur-kunden-stabil-halten-15569865.html,0,www.tagesspiegel.de,Energieversorgung: EnviaM will Gaspreis fû¥r Kunden stabil halten,Trotz Krisen und Preissprû¥ngen bleibt der Gaspreis fû¥r EnviaM-Kunden vorerst stabil ã doch Neukunden trifftãs hûÊrter. Das steckt dahinter.,https://www.tagesspiegel.de/images/15569864/alternates/BASE_16_9_W1400/1778151256000/enviam.jpeg,2026-05-07T10:54:17Z,,Kunden von EnviaM mû¥ssen trotz der Krise im Nahen Osten und stark gestiegener BûÑrsenpreise vorerst nicht mit hûÑheren Kosten fû¥r Gas rechnen. Wir werden die Preise so gut es geht und so lange wie mûÑglãÎ [+2796 chars],,de,'Gas'
https://www.brigitte.de/leben/teenager-sprueche---ich-weiss-ohne-zu-probieren--dass-es-eklig-schmeckt---13757256.html,https://www.brigitte.de/leben/teenager-sprueche---ich-weiss-ohne-zu-probieren--dass-es-eklig-schmeckt---13757256.html,0,www.brigitte.de,"Teenagerperlen: ""Ich muss es nicht probieren, um zu wissen, dass es eklig schmeckt.""","Teenager kûÑnnen unberechenbar sein ã Stimmungsschwankungen, Tû¥rknallen und provokative Sprû¥che inklusive. So ziemlich alle Eltern mit pubertierenden Kindern kûÑnnen da mitreden. Diese Sprû¥che zeigen die ungeschminkte Wahrheit.",https://image.brigitte.de/13969422/t/EZ/v3/w1440/r1.7778/-/teenager-laptop-teaser.jpg,2026-05-07T11:26:00Z,,"Ja, so ein Kind im Teenageralter hat einfach seinen eigenen Kopf und das ist auch gut so, schlieûlich wollen wir ja alle, dass unsere Kinder ihren eigenen Weg gehen. Manche Entscheidungen und AktioneãÎ [+44364 chars]",,de,'Kinder'
https://www.n-tv.de/politik/Nahost-Emirate-umgehen-Blockade-der-Strasse-von-Hormus-id30797600.html,https://www.n-tv.de/politik/Nahost-Emirate-umgehen-Blockade-der-Strasse-von-Hormus-id30797600.html,0,www.n-tv.de,Schiffsdaten zeigen Durchbruch: Emirate umgehen wohl Blockade der Straûe von Hormus,"Der Iran blockiert die fû¥r den Welthandel wichtige Straûe von Hormus. Das setzt auch die Emirate unter Druck, die auf das ExportgeschûÊft mit RohûÑl angewiesen sind. Nun gelingt es offenbar mehreren Tankern, die Meerenge zu passieren.",https://www.n-tv.de/img/30784932/1778167777/Img_16_9/1200/Die-Spannungen-am-Golf-hatten-zuvor-erheblich-zugenommen.jpg,2026-05-07T14:07:53Z,,"Tanker in der Straûe von Hormus (Archivbild): Durch die Meerenge lûÊuft normalerweise ein Fû¥nftel der weltweiten Versorgung mit RohûÑl. (Foto: Altaf Qadri/AP/dpa)
Der Iran blockiert die fû¥r den WelthaãÎ [+2586 chars]",,de,'RohûÑl'
https://www.zeit.de/news/2026-05/07/grundschule-verwuestet-tatverdaechtige-sind-zwei-kinder,https://www.zeit.de/news/2026-05/07/grundschule-verwuestet-tatverdaechtige-sind-zwei-kinder,0,www.zeit.de,Hannover: Grundschule verwû¥stet - TatverdûÊchtige sind zwei Kinder,Hier finden Sie Informationen zu dem Thema ãHannoverã. Lesen Sie jetzt ãGrundschule verwû¥stet - TatverdûÊchtige sind zwei Kinderã.,https://img.zeit.de/news/2026-05/07/grundschule-verwuestet-tatverdaechtige-sind-zwei-kinder-image-group/wide__1300x731,2026-05-07T14:17:20Z,,"Nach der Verwû¥stung einer Grundschule in Hannover hat die Polizei zwei Jungen im Alter von elf und zwûÑlf Jahren als mutmaûliche TûÊter ermittelt. Die beiden Kinder seien strafunmû¥ndig, die ErmittlungeãÎ [+1027 chars]",,de,'Kinder'
https://www.stern.de/gesellschaft/regional/mecklenburg-vorpommern/gestiegene-spritpreise--mv-und-sachsen-anhalt-fordern-verlaengerung-des-tankrabatts-37378486.html,https://www.stern.de/gesellschaft/regional/mecklenburg-vorpommern/gestiegene-spritpreise--mv-und-sachsen-anhalt-fordern-verlaengerung-des-tankrabatts-37378486.html,0,www.stern.de,Gestiegene Spritpreise: MV und Sachsen-Anhalt fordern VerlûÊngerung des Tankrabatts,Die beiden BundeslûÊnder wollen die Senkung der MineralûÑlsteuer verlûÊngern ã und zwar bis zum Ende des Iran-Kriegs. Ein entsprechender Antrag soll am Freitag in den Bundesrat.,https://image.stern.de/37378488/t/Cp/v1/w1440/r1.7778/-/07--xremtmgrbhv3axs2048jpeg---7db457733589b4b3.jpg,2026-05-07T14:45:10Z,,"Kopiere den aktuellen Link
Zur Merkliste hinzufû¥gen
Die beiden BundeslûÊnder wollen die Senkung der MineralûÑlsteuer verlûÊngern und zwar bis zum Ende des Iran-Kriegs. Ein entsprechender Antrag soll aãÎ [+1310 chars]",,de,'Spritpreise'
https://www.zeit.de/news/2026-05/07/mv-und-sachsen-anhalt-fordern-verlaengerung-des-tankrabatts,https://www.zeit.de/news/2026-05/07/mv-und-sachsen-anhalt-fordern-verlaengerung-des-tankrabatts,0,www.zeit.de,Gestiegene Spritpreise: MV und Sachsen-Anhalt fordern VerlûÊngerung des Tankrabatts,Hier finden Sie Informationen zu dem Thema ãGestiegene Spritpreiseã. Lesen Sie jetzt ãMV und Sachsen-Anhalt fordern VerlûÊngerung des Tankrabattsã.,https://img.zeit.de/news/2026-05/07/mv-und-sachsen-anhalt-fordern-verlaengerung-des-tankrabatts-image-group/wide__1300x731,2026-05-07T14:45:10Z,,Angesichts gestiegener Spritpreise haben die Landesregierungen von Mecklenburg-Vorpommern und Sachsen-Anhalt eine VerlûÊngerung des Tankrabatts gefordert. Dazu haben Sie dem Bundesrat einen gemeinsameãÎ [+1121 chars],,de,'Spritpreise'
https://www.zeit.de/mobilitaet/2026-05/elektromobilitaet-autoindustrie-elektroautos-spritpreise-autofahrer,https://www.zeit.de/mobilitaet/2026-05/elektromobilitaet-autoindustrie-elektroautos-spritpreise-autofahrer,0,www.zeit.de,ElektromobilitûÊt: Ist das die Wende?,"Ein Viertel der neuen Autos in Deutschland fûÊhrt inzwischen vollelektrisch, der Trend setzt sich durch. Die hohen Spritpreise spielen womûÑglich nur eine kleine Rolle.",https://img.zeit.de/mobilitaet/2026-05/elektromobilitaet-autoindustrie-elektroautos/wide__1300x731,2026-05-08T06:08:12Z,,"Normalerweise nimmt kaum jemand Notiz davon, wenn das Kraftfahrt-Bundesamt (KBA) in Flensburg seine monatliche Statistik der Neuzulassungen in Deutschland verûÑffentlicht. Doch an diesem Donnerstag koãÎ [+735 chars]",,de,'Spritpreise'
https://www.globenewswire.com/news-release/2026/05/08/3290828/0/de/Aduro-ernennt-Branchenveteran-zur-F%C3%B6rderung-von-Anwendungen-im-Erd%C3%B6lbereich.html,https://www.globenewswire.com/news-release/2026/05/08/3290828/0/de/Aduro-ernennt-Branchenveteran-zur-F%C3%B6rderung-von-Anwendungen-im-Erd%C3%B6lbereich.html,0,www.globenewswire.com,Aduro ernennt Branchenveteran zur FûÑrderung von Anwendungen im ErdûÑlbereich,"Der ehemalige Innovationsleiter von Cenovus Energy bringt umfassende Erfahrung in den Bereichen RohûÑlveredelung, Pilotbetrieb und Raffinerieintegration mit, um die Entwicklung von Anwendungen der HydrochemolyticãÂ-Technologie fû¥r Bitumen und paraffinisches RohãÎ",https://ml.globenewswire.com/Resource/Download/64480e4b-abff-4eeb-8e76-2d847127fd05,2026-05-08T06:31:00Z,,"LONDON, Ontario, May 08, 2026 (GLOBE NEWSWIRE) -- Aduro Clean Technologies Inc. (Aduro oder das Unternehmen) (Nasdaq: ADUR) (CSE: ACT) (FSE: 9D5), ein Clean-Tech-Unternehmen, das die Kraft der ChemieãÎ [+11169 chars]",,de,'RohûÑl'
https://www.zeit.de/news/2026-05/08/spritpreise-fallen-auf-tiefsten-stand-seit-zwei-monaten,https://www.zeit.de/news/2026-05/08/spritpreise-fallen-auf-tiefsten-stand-seit-zwei-monaten,0,www.zeit.de,MobilitûÊtskosten: Spritpreise fallen auf tiefsten Stand seit zwei Monaten,Hier finden Sie Informationen zu dem Thema ãMobilitûÊtskostenã. Lesen Sie jetzt ãSpritpreise fallen auf tiefsten Stand seit zwei Monatenã.,https://img.zeit.de/news/2026-05/08/spritpreise-fallen-auf-tiefsten-stand-seit-zwei-monaten-image-group/wide__1300x731,2026-05-08T07:58:38Z,,"Die Spritpreise sind auf den niedrigsten Stand seit zwei Monaten gefallen. Ein Liter der Sorte E10 kostete im bundesweiten Tagesdurchschnitt des Donnerstags 1,984 Euro, wie der ADAC mitteilt. Das warãÎ [+1991 chars]",,de,'Spritpreise'
https://www.focus.de/auto/co2-abgabe-muss-weg-aiwanger-kritisiert-hohe-spritpreise_c86537b7-18c4-4405-9a55-1c3b1ee9cd3c.html,https://www.focus.de/auto/co2-abgabe-muss-weg-aiwanger-kritisiert-hohe-spritpreise_c86537b7-18c4-4405-9a55-1c3b1ee9cd3c.html,0,www.focus.de,ãCO2-Abgabe muss wegã ã Aiwanger kritisiert hohe Spritpreise,"Hubert Aiwanger, Koalitionspartner von Markus SûÑder in Bayern, stellt die Energiepolitik der Bundesregierung infrage und spricht sich fû¥r Klima-Diesel aus.","https://quadro.burda-forward.de/ctf/b67cc719-533e-43ad-ad35-e5c3aaa85950.33858fc4-055a-43de-af87-a6fb52073a14.jpg?im=RegionOfInterestCrop=(1200,630),regionOfInterest=(1217,832)&hash=de19d0560c90695de45b01b09b8db5ab8ddd574ad5e549ead45cc680156afda6",2026-05-08T08:48:00Z,,"Die Bundesregierung verteidigt nach wie vor die umstrittene CO2-Steuer, die Tanken und Heizen fû¥r die Deutschen quasi im Jahresrhythmus immer teurer macht. Der Bayerische Staatsminister fû¥r WirtschafãÎ [+2226 chars]",,de,'Spritpreise'
https://www.sueddeutsche.de/wirtschaft/spritpreise-fallen-benzin-tankrabatt-oelpreis-li.3480501,https://www.sueddeutsche.de/wirtschaft/spritpreise-fallen-benzin-tankrabatt-oelpreis-li.3480501,0,www.sueddeutsche.de,Tankstellen: Spritpreise fallen auf tiefsten Stand seit zwei Monaten,Der Tankrabatt und sinkende ûlpreise dû¥rften fû¥r den Rû¥ckgang bei den Benzinpreisen verantwortlich sein.,https://www.sueddeutsche.de/2026/05/08/9564f990-dbb1-4794-a9d2-3e92a1027f62.jpg?q=60&fm=webp&width=1200&rect=0%2C374%2C4000%2C2250,2026-05-08T09:11:32Z,,"Am Vortag war es sogar noch etwas deutlicher nach unten gegangen, sodass sich fû¥r beide Spritpreise krûÊftige Rû¥ckgûÊnge ergeben. Fû¥r E10 ist es der niedrigste Preis seit dem 8. MûÊrz, fû¥r Diesel der niãÎ [+1622 chars]",,de,'Spritpreise'
https://www.sueddeutsche.de/wirtschaft/bundeskartellamt-spritpreise-benzinpreise-deutschland-kontrolle-li.3478365,https://www.sueddeutsche.de/wirtschaft/bundeskartellamt-spritpreise-benzinpreise-deutschland-kontrolle-li.3478365,0,www.sueddeutsche.de,Hohe Spritpreise: ãKurz nach 12 Uhr sollte man wirklich nur im Notfall tankenã,"Andreas Mundt, der Chef des Bundeskartellamts, das schon mal als Ansammlung zahmer Stallhasen beschimpft wird, soll dafû¥r sorgen, dass die Spritpreise endlich sinken. Aber wie will er das schaffen?",https://www.sueddeutsche.de/2026/05/05/aaba847a-954d-4af9-8e47-6e1d882d7d14.jpg?q=60&fm=webp&width=1200&rect=0%2C175%2C3898%2C2193,2026-05-08T09:24:02Z,,"Andreas Mundt, der Chef des Bundeskartellamts, das schon mal als Ansammlung zahmer Stallhasen beschimpft wird, soll dafû¥r sorgen, dass die Spritpreise sinken. Aber wie will er das schaffen?
IntervieãÎ [+17 chars]",,de,'Spritpreise'
https://www.stern.de/gesellschaft/regional/berlin-brandenburg/energieversorgung--kraftwerksplaene-im-osten-bedroht--leag-protestiert-37381472.html,https://www.stern.de/gesellschaft/regional/berlin-brandenburg/energieversorgung--kraftwerksplaene-im-osten-bedroht--leag-protestiert-37381472.html,0,www.stern.de,Energieversorgung: KraftwerksplûÊne im Osten bedroht? Leag protestiert,"BeschûÊftigte des Energiekonzerns Leag haben groûe Sorge, dass der Osten beim Bau neuer Gaskraftwerke abgehûÊngt wird. Was steckt hinter dem Protest in der Lausitz?",https://image.stern.de/37381474/t/Ej/v1/w1440/r1.7778/-/08--gswjutjnplv20axs2048jpeg---5faa6498909514bc.jpg,2026-05-08T11:38:49Z,,"Kopiere den aktuellen Link
Zur Merkliste hinzufû¥gen
BeschûÊftigte des Energiekonzerns Leag haben groûe Sorge, dass der Osten beim Bau neuer Gaskraftwerke abgehûÊngt wird. Was steckt hinter dem ProtesãÎ [+2302 chars]",,de,'Blackout'
https://www.tagesspiegel.de/berlin/energieversorgung-kraftwerksplane-im-osten-bedroht-leag-protestiert-15575351.html,https://www.tagesspiegel.de/berlin/energieversorgung-kraftwerksplane-im-osten-bedroht-leag-protestiert-15575351.html,0,www.tagesspiegel.de,Energieversorgung: KraftwerksplûÊne im Osten bedroht? Leag protestiert,"BeschûÊftigte des Energiekonzerns Leag haben groûe Sorge, dass der Osten beim Bau neuer Gaskraftwerke abgehûÊngt wird. Was steckt hinter dem Protest in der Lausitz?",https://www.tagesspiegel.de/images/15575350/alternates/BASE_16_9_W1400/1778240403000/protest-in-der-lausitz-sorge-um-neue-gaskraftwerke-wachst.jpeg,2026-05-08T11:40:03Z,,BeschûÊftigte des Energiekonzerns Leag haben am Kraftwerkstandort Schwarze Pumpe in der Lausitz gegen PlûÊne des Bundeswirtschaftsministeriums zum Bau neuer Gaskraftwerke protestiert. Kein Blackout OstãÎ [+2173 chars],,de,'Blackout'
https://www.stern.de/panorama/regel-umgangen--hunderte-tankstellen-erhoehen-preise-auch-nach-zwoelf-uhr-37381456.html,https://www.stern.de/panorama/regel-umgangen--hunderte-tankstellen-erhoehen-preise-auch-nach-zwoelf-uhr-37381456.html,0,www.stern.de,Ein Bundesland ist besonders betroffen: Regel umgangen: Hunderte Tankstellen erhûÑhen Preise auch nach zwûÑlf Uhr,Hunderte Tankstellen in Deutschland halten sich nicht an die ZwûÑlf-Uhr-Regel und erhûÑhen die Spritpreise auch danach teilweise deutlich. In einer Region gibt es besonders viele VerstûÑûe.,https://image.stern.de/37381452/t/jg/v1/w1440/r1.7778/-/regel-umgangen--hunderte-tankstellen-erhoehen-preise-auch-nach-zwoelf-uhr--2-.jpg,2026-05-08T11:40:03Z,,"Kopiere den aktuellen Link
Zur Merkliste hinzufû¥gen
Hunderte Tankstellen in Deutschland halten sich nicht an die ZwûÑlf-Uhr-Regel und erhûÑhen die Spritpreise auch danach teilweise deutlich. In einerãÎ [+2121 chars]",,de,'Spritpreise'
https://www.zeit.de/wirtschaft/2026-05/spritpreise-e10-diesel-tankrabatt-adac,https://www.zeit.de/wirtschaft/2026-05/spritpreise-e10-diesel-tankrabatt-adac,0,www.zeit.de,Benzin und Diesel: Spritpreise fallen auf niedrigsten Stand der letzten zwei Monaten,"Ein Liter E10 ist so gû¥nstig wie zuletzt im MûÊrz, auch aufgrund des niedrigen ûlpreis. Obwohl die MineralûÑlkonzerne den Tankrabatt laut ADAC teilweise einbehalten.",https://img.zeit.de/wirtschaft/2026-05/spritpreise-bild/wide__1300x731,2026-05-08T11:47:53Z,,"Die Spritpreise sind auf den niedrigsten Stand seit zwei Monaten gefallen. Ein Liter der Sorte E10 kostete im bundesweiten Tagesdurchschnitt 1,984 Euro, wie der ADAC mitteilt. Diesel sank um 3,1 CentãÎ [+1917 chars]",,de,'Spritpreise'
https://www.bild.de/politik/inland/wirkt-der-tankrabatt-spritpreise-sinken-auf-zwei-monats-tief-69fde85ecd4a28c47002115a,https://www.bild.de/politik/inland/wirkt-der-tankrabatt-spritpreise-sinken-auf-zwei-monats-tief-69fde85ecd4a28c47002115a,0,www.bild.de,Wirkt der Tankrabatt? - Spritpreise sinken auf Zwei-Monats-Tief,"Kommt der Tankrabatt endlich auch an der ZapfsûÊule an? Zumindest gibt es eine Entwicklung, die Autofahrern leichte Entlastungen bringt.","https://images.bild.de/69fde85ecd4a28c47002115a/7941d07ef48d2db799371645e38aeb15,c5613e8?w=1280",2026-05-08T14:42:54Z,,"TTS-Player û¥berspringenArtikel weiterlesenMû¥nchen Kommt der Tankrabatt endlich auch an der ZapfsûÊule an? Zumindest gibt es eine Entwicklung, die Autofahrern leichte Entlastungen bringt. Die SpritpreiãÎ [+1300 chars]",,de,'Spritpreise'
https://www.tagesschau.de/wirtschaft/verbraucher/spritpreise-tankstellen-100.html,https://www.tagesschau.de/wirtschaft/verbraucher/spritpreise-tankstellen-100.html,0,www.tagesschau.de,Spritpreise fallen auf tiefsten Stand seit zwei Monaten,An den Tankstellen wird es langsam wieder gû¥nstiger: Die Preise fû¥r E10 sind Diesel sind inzwischen so niedrig wie seit Anfang MûÊrz nicht mehr. Insgesamt liegen sie aber weiter û¥ber dem Niveau vor dem Iran-Krieg.,https://images.tagesschau.de/image/9feba844-14a5-46f2-8020-7c70eb639e4f/AAABngf8yOs/AAABnSSvrFg/16x9-big/tankstelle-262.jpg?width=1280,2026-05-08T15:47:33Z,,"Stand: 08.05.2026 17:47 Uhr
An den Tankstellen wird es langsam wieder gû¥nstiger: Die Preise fû¥r E10 sind Diesel sind inzwischen so niedrig wie seit Anfang MûÊrz nicht mehr. Insgesamt liegen sie aber ãÎ [+2266 chars]",,de,'Spritpreise'
https://www.welt.de/wirtschaft/article69fdcd187e3ff373d429e3a0/energiekosten-hohe-spritpreise-weniger-lkw-auf-der-strasse-was-das-fuer-die-bahn-bedeutet.html,https://www.welt.de/wirtschaft/article69fdcd187e3ff373d429e3a0/energiekosten-hohe-spritpreise-weniger-lkw-auf-der-strasse-was-das-fuer-die-bahn-bedeutet.html,0,www.welt.de,"Hohe Spritpreise, weniger Lkw auf der Straûe ã was das fû¥r die Bahn bedeutet",Im April ist die Fahrleistung mautpflichtiger Lkw gesunken. Profitiert der Gû¥terverkehr der Bahn von den hohen Spritpreisen? Zumindest punktuell steigt die Nachfrage. Ein groûes Umladen von der Straûe auf die Schiene bleibt aber aus.,https://images.welt.de/69fdcd187e3ff373d429e3a0/40b20c190baec573dd09aa8419081baa-master/ci16x9-w1200/db241870-jpg,2026-05-08T15:54:08Z,,Im April ist die Fahrleistung mautpflichtiger Lkw gesunken. Profitiert der Gû¥terverkehr der Bahn von den hohen Spritpreisen? Zumindest punktuell steigt die Nachfrage. Ein groûes Umladen von der StraûãÎ [+4781 chars],,de,'Spritpreise'
https://www.faz.net/aktuell/wirtschaft/unternehmen/business-liveticker-spritpreise-fallen-auf-tiefsten-stand-seit-zwei-monaten-faz-200452404.html,https://www.faz.net/aktuell/wirtschaft/unternehmen/business-liveticker-spritpreise-fallen-auf-tiefsten-stand-seit-zwei-monaten-faz-200452404.html,0,www.faz.net,Business-Ticker: Spritpreise fallen auf tiefsten Stand seit zwei Monaten,"Festo, Wacker Chemie und drei Porsche-Tochtergesellschaften streichen hunderte Stellen +++ Elon Musk droht franzûÑsischer Haftbefehl +++ô Kupferkonzern Aurubis erwartet besseres Ergebnis +++ Industrieproduktion sinkt +++ Neuigkeiten im Unternehmen-Liveblog.",https://media0.faz.net/image/w1200h627/28d9c74dfdb0/w4277h2234x0y156o/202605/43601.0.2046099923/spritpreise-zum-aktuellen.webp,2026-05-08T17:59:20Z,,Der Medizintechnikkonzern Siemens Healthineers muss wegen Gegenwind im chinesischen DiagnostikgeschûÊft seine Prognose fû¥r das Gesamtjahr 2025/26 (per 30. September) senken. Wie das in Erlangen ansûÊssãÎ [+1996 chars],,de,'Spritpreise'
https://www.tagesspiegel.de/podcast-104h-blackout-36-es-brodelt-im-untergrund--die-suche-nach-den-tatern-15568620.html,https://www.tagesspiegel.de/podcast-104h-blackout-36-es-brodelt-im-untergrund--die-suche-nach-den-tatern-15568620.html,0,www.tagesspiegel.de,Podcast 104h Blackout (3/6): Es brodelt im Untergrundô ã die Suche nach den TûÊtern,An Tag 2 des Berliner Stromausfalls erscheint ein Bekennerschreiben: Vulkangruppe. Keine Unbekanntenô ã warum stochert die Polizei seit 15 Jahren im Dunkeln?,https://www.tagesspiegel.de/images/15532910/alternates/BASE_16_9_W1400/1777380481000/104-h-blackout.png,2026-05-08T18:58:51Z,,An Tag 2 des Berliner Stromausfalls taucht ein Bekennerschreiben im Internet auf. Darunter ein Name: Vulkangruppe. Dahinter steckt eine der geheimnisvollsten militanten linksextremen Strukturen DeutsãÎ [+360 chars],,de,'Blackout'
https://www.zeit.de/news/2026-05/09/zwei-kuehltuerme-von-altem-kohlekraftwerk-werden-gesprengt,https://www.zeit.de/news/2026-05/09/zwei-kuehltuerme-von-altem-kohlekraftwerk-werden-gesprengt,0,www.zeit.de,Energiewende: Zwei Kû¥hltû¥rme von altem Kohlekraftwerk werden gesprengt,Hier finden Sie Informationen zu dem Thema ãEnergiewendeã. Lesen Sie jetzt ãZwei Kû¥hltû¥rme von altem Kohlekraftwerk werden gesprengtã.,https://img.zeit.de/news/2026-05/09/zwei-kuehltuerme-von-altem-kohlekraftwerk-werden-gesprengt-image-group/wide__1300x731,2026-05-09T06:08:29Z,,An einem alten Kohlekraftwerk in Gelsenkirchen sollen am Samstag (11.00 Uhr) zwei weitere Kû¥hltû¥rme gesprengt werden. Die beiden Tû¥rme des Uniper-Kraftwerks im Stadtteil Scholven sind 114 Meter hoch ãÎ [+1498 chars],,de,'Gas'
https://www.faz.net/aktuell/wirtschaft/unternehmen/business-liveticker-bahn-kuendigt-direktverbindung-von-berlin-nach-oslo-an-faz-200452404.html,https://www.faz.net/aktuell/wirtschaft/unternehmen/business-liveticker-bahn-kuendigt-direktverbindung-von-berlin-nach-oslo-an-faz-200452404.html,0,www.faz.net,Business-Ticker: Bahn kû¥ndigt Direktverbindung von Berlin nach Oslo an,"Spritpreise fallen auf tiefsten Stand seit zwei Monaten ô +++ Festo, Wacker Chemie und drei Porsche-Tochtergesellschaften streichen hunderte Stellen +++ Elon Musk droht franzûÑsischer Haftbefehl +++ô  Neuigkeiten im Unternehmen-Liveblog.",https://media0.faz.net/image/w1200h627/2a8e615094c4/w5309h2773x0y106o/202501/43601.0.793866395/die-nachfrage-nach-zuegen-des.webp,2026-05-09T07:00:16Z,,Der Medizintechnikkonzern Siemens Healthineers muss wegen Gegenwind im chinesischen DiagnostikgeschûÊft seine Prognose fû¥r das Gesamtjahr 2025/26 (per 30. September) senken. Wie das in Erlangen ansûÊssãÎ [+1996 chars],,de,'Spritpreise'
https://www.tagesschau.de/wissen/klima/erdueberlastungstag-130.html,https://www.tagesschau.de/wissen/klima/erdueberlastungstag-130.html,0,www.tagesschau.de,Deutschland hat seine Ressourcen fû¥r dieses Jahr schon aufgebraucht,"Deutschland hat seine Ressourcen fû¥r 2026 rechnerisch schon heute verbraucht. Das zeigen Auswertungen des Global Footprint Network. Noch immer wû¥rden zu viel ûl, Gas und Kohle genutzt, kritisieren UmweltverbûÊnde.",https://images.tagesschau.de/image/f08b26ae-34a8-4e0f-a1d1-567687353088/AAABlgU1vuc/AAABnSSvrFg/16x9-big/erdueberlastungstag-115.jpg?width=1280,2026-05-10T07:13:28Z,,"Stand: 10.05.2026 09:13 Uhr
Deutschland hat seine Ressourcen fû¥r 2026 rechnerisch schon heute verbraucht. Das zeigen Auswertungen des Global Footprint Network. Noch immer wû¥rden zu viel ûl, Gas und ãÎ [+1612 chars]",,de,'Kohle'
https://vorarlberg.orf.at/stories/3353374/,https://vorarlberg.orf.at/stories/3353374/,0,vorarlberg.orf.at,Trockener Winter legte WûÊrmepumpen lahm,"An die 40 Haushalte im Talboden von Schruns und Tschagguns hatten diesen Winter massive Probleme beim Heizen. Sie konnten ihre Grundwasser-WûÊrmepumpen mehrere Monate lang nicht betreiben, weil der Grundwasserspiegel bis zu fû¥nf Meter niedriger war als normal.",https://ibs.orf.at/vbg?image=https%3A%2F%2Foekastatic.orf.at%2Fmims%2F2026%2F19%2F15%2Fcrops%2Fw%3D1200%2Ch%3D627%2Cq%3D75%2F3029678_master_1172115_260500_grundwasser_waermepumpen_00_00_05_00.jpg%3Fs%3D2517c6f34da3ebab86b113f799c86b9bf188e49c,2026-05-10T08:04:10Z,,Der Winter in Vorarlberg war heuer auûergewûÑhnlich trocken. Das hat sich auch auf das Grundwasser ausgewirkt. Im Montafon etwa wurden die langjûÊhrigen Durchschnittswerte um Meter unterschritten. Grû¥nãÎ [+3241 chars],,de,'Winter'
https://www.faz.net/aktuell/wirtschaft/unternehmen/business-liveticker-aramco-chef-auf-dem-weltmarkt-fehlt-rund-eine-milliarde-barrel-oel-faz-200452404.html,https://www.faz.net/aktuell/wirtschaft/unternehmen/business-liveticker-aramco-chef-auf-dem-weltmarkt-fehlt-rund-eine-milliarde-barrel-oel-faz-200452404.html,0,www.faz.net,Business-Ticker: Aramco-Chef: Auf dem Weltmarkt fehlt rund eine Milliarde Barrel ûl,Bahn kû¥ndigt Direktverbindung von Berlin nach Oslo an +++ Knappes und teures Kerosin: Flughafenverband befû¥rchtet FlugausfûÊlle +++ Spritpreise fallen auf tiefsten Stand seit zwei Monatenô +++ Neuigkeiten im Unternehmen-Liveblog.,https://media0.faz.net/image/w1200h627/ccbf7daa687e/w5500h2873x0y397o/202605/43601.0.2065837900/aramco-chef-amin-nasser-das.webp,2026-05-10T11:22:36Z,,Dem Weltmarkt fehlen nach EinschûÊtzung des saudiarabischen ûlkonzerns Saudi Aramco wegen des Iran-Kriegs rund eine Milliarde Barrel ûl aus den vergangenen zwei Monaten. Selbst wenn die Lieferungen wiãÎ [+1241 chars],,de,'Spritpreise'
https://www.stern.de/gesellschaft/regional/rheinland-pfalz-saarland/unwettergefahr-steigt--auf-regen-koennte-an-kleineren-gewaessern-hochwasser-folgen-37385580.html,https://www.stern.de/gesellschaft/regional/rheinland-pfalz-saarland/unwettergefahr-steigt--auf-regen-koennte-an-kleineren-gewaessern-hochwasser-folgen-37385580.html,0,www.stern.de,Unwettergefahr steigt: Auf Regen kûÑnnte an kleineren GewûÊssern Hochwasser folgen,Saarbrû¥cken (lrs) - Das Landesamt fû¥r Umwelt- und Arbeitsschutz Saarland rechnet in den kommenden Tagen mit schnell ansteigenden WasserstûÊnden und lokalen,https://image.stern.de/37385582/t/ca/v1/w1440/r1.7778/-/10--s2g5tjhnq6v4axs2048jpeg---062b1f4f931e993f.jpg,2026-05-10T12:27:45Z,,"Kopiere den aktuellen Link
Zur Merkliste hinzufû¥gen
Der Deutsche Wetterdienst hat ab dem Nachmittag im Saarland vermehrt Regen angekû¥ndigt. Auch Gewitter und Starkregen sind mûÑglich.
Das LandesamtãÎ [+1103 chars]",,de,'Hochwasser'
