index,url,valid,domain,title,description,image,published,archive,content,quote,language,keyword
https://www.zeit.de/news/2026-02/13/exxonmobil-beschaeftigte-arbeiten-wieder-unter-tarifvertraegen,https://www.zeit.de/news/2026-02/13/exxonmobil-beschaeftigte-arbeiten-wieder-unter-tarifvertraegen,0,www.zeit.de,Öl und Gas: ExxonMobil-Beschäftigte arbeiten wieder unter Tarifverträgen,Hier finden Sie Informationen zu dem Thema „Öl und Gas“. Lesen Sie jetzt „ExxonMobil-Beschäftigte arbeiten wieder unter Tarifverträgen“.,https://img.zeit.de/news/2026-02/13/exxonmobil-beschaeftigte-arbeiten-wieder-unter-tarifvertraegen-image-group/wide__1300x731,2026-02-13T15:12:01Z,,"Die Mitarbeiter des Öl- und Gaskonzerns ExxonMobil arbeiten in Deutschland wieder unter Tarifverträgen. Der US-Konzern und die Industriegewerkschaft Bergbau, Chemie, Energie (IG BCE) haben sich schon… [+746 chars]",,de,'Gas'
https://www.zeit.de/news/2026-02/13/wissenswertes-zum-riesenschneemann-jakob,https://www.zeit.de/news/2026-02/13/wissenswertes-zum-riesenschneemann-jakob,0,www.zeit.de,"Winter: So groß ist XXL-Schneemann ""Jakob"" in diesem Jahr","Hier finden Sie Informationen zu dem Thema „Winter“. Lesen Sie jetzt „So groß ist XXL-Schneemann ""Jakob"" in diesem Jahr“.",https://img.zeit.de/news/2026-02/13/wissenswertes-zum-riesenschneemann-jakob-image-group/wide__1300x731,2026-02-13T15:14:28Z,,Er ist wieder da: Riesenschneemann «Jakob» begrüßt auch in diesem Winter Gäste und Ausflügler im Fichtelgebirge. Freiwillige Helfer haben den XXL-Schneemann in Bischofsgrün im Landkreis Bayreuth geba… [+2651 chars],,de,'Winter'
https://www.zeit.de/news/2026-02/14/weitere-grundversorger-senken-strompreise,https://www.zeit.de/news/2026-02/14/weitere-grundversorger-senken-strompreise,0,www.zeit.de,Energiekosten: Weitere Grundversorger senken Strompreise,Hier finden Sie Informationen zu dem Thema „Energiekosten“. Lesen Sie jetzt „Weitere Grundversorger senken Strompreise“.,https://img.zeit.de/news/2026-02/14/weitere-grundversorger-senken-strompreise-image-group/wide__1300x731,2026-02-14T03:30:04Z,,"Weitere Grundversorger senken die Preise. Für Februar, März und April hätten regionale Grundversorger 101 Preissenkungen um durchschnittlich 15 Prozent angekündigt, teilte das Vergleichsportal Verivo… [+2054 chars]",,de,'Energiekosten'
https://www.stern.de/wirtschaft/news/energiekosten--weitere-grundversorger-senken-strompreise-37136380.html,https://www.stern.de/wirtschaft/news/energiekosten--weitere-grundversorger-senken-strompreise-37136380.html,0,www.stern.de,Energiekosten: Weitere Grundversorger senken Strompreise,Mehr als drei Millionen Haushalte profitieren von weiteren Strompreissenkungen der Grundversorger. Welche Gründe hinter den Preissenkungen stehen und wie die Haushalte noch mehr sparen könnten.,https://image.stern.de/37136382/t/Rn/v1/w1440/r1.7778/-/14--tnhj54vvvbv16axs2048jpeg---9e7c000e9d77a7a8.jpg,2026-02-14T03:30:04Z,,"Kopiere den aktuellen Link
Zur Merkliste hinzufügen
Mehr als drei Millionen Haushalte profitieren von weiteren Strompreissenkungen der Grundversorger. Welche Gründe hinter den Preissenkungen stehen… [+2263 chars]",,de,'Energiekosten'
https://www.zeit.de/news/2026-02/14/toedlicher-kohlebergbau-auf-grimberg-sterben-405-menschen,https://www.zeit.de/news/2026-02/14/toedlicher-kohlebergbau-auf-grimberg-sterben-405-menschen,0,www.zeit.de,Schwerstes Grubenunglück: Tödlicher Kohlebergbau: Auf Grimberg sterben 405 Menschen,Hier finden Sie Informationen zu dem Thema „Schwerstes Grubenunglück“. Lesen Sie jetzt „Tödlicher Kohlebergbau: Auf Grimberg sterben 405 Menschen“.,https://img.zeit.de/news/2026-02/14/toedlicher-kohlebergbau-auf-grimberg-sterben-405-menschen-image-group/wide__1300x731,2026-02-14T04:00:07Z,,"Für die Frühschicht beginnt der 20. Februar 1946 völlig normal. Die Bergleute kommen am Morgen per Fahrrad oder zu Fuß zur Schachtanlage und essen noch einen Teller Bohnensuppe, bevor sie einfahren. … [+3626 chars]",,de,'Kohle'
https://www.stern.de/gesellschaft/regional/mecklenburg-vorpommern/tourismus--winterwetter-koennte-mehr-touristen-nach-mv-locken-37136412.html,https://www.stern.de/gesellschaft/regional/mecklenburg-vorpommern/tourismus--winterwetter-koennte-mehr-touristen-nach-mv-locken-37136412.html,0,www.stern.de,Tourismus: Winterwetter könnte mehr Touristen nach MV locken,"Ein Spaziergang auf der zugefrorenen Ostsee, ein von Eis umschlossener Leuchtturm: Die extreme Kälte hat in diesem Jahr für eine ganz besondere Küstenkulisse gesorgt. Zieht das auch mehr Gäste an?",https://image.stern.de/37136414/t/mQ/v1/w1440/r1.7778/-/14--zueiwzn6agv7axs2048jpeg---1fe87664c5493da5.jpg,2026-02-14T04:00:10Z,,"Kopiere den aktuellen Link
Zur Merkliste hinzufügen
Ein Spaziergang auf der zugefrorenen Ostsee, ein von Eis umschlossener Leuchtturm: Die extreme Kälte hat in diesem Jahr für eine ganz besondere K… [+2224 chars]",,de,'Kälte'
https://www.zeit.de/news/2026-02/14/winterwetter-koennte-mehr-touristen-nach-mv-locken,https://www.zeit.de/news/2026-02/14/winterwetter-koennte-mehr-touristen-nach-mv-locken,0,www.zeit.de,Tourismus: Winterwetter könnte mehr Touristen nach MV locken,Hier finden Sie Informationen zu dem Thema „Tourismus“. Lesen Sie jetzt „Winterwetter könnte mehr Touristen nach MV locken“.,https://img.zeit.de/news/2026-02/14/winterwetter-koennte-mehr-touristen-nach-mv-locken-image-group/wide__1300x731,2026-02-14T04:00:10Z,,"Das Winterwetter zieht derzeit viele Menschen in den Norden. Gerade an der Ostseeküste meldeten einzelne Häuser mehr Gäste als üblich, sagte der Präsident des Deutschen Hotel- und Gaststättenverbande… [+2012 chars]",,de,'Winter'
https://www.nzz.ch/zuerich/als-zuerich-eine-schlittelstadt-war-ld.1920205,https://www.nzz.ch/zuerich/als-zuerich-eine-schlittelstadt-war-ld.1920205,0,www.nzz.ch,Als «die Bobs funkensprühend über das Römerhofpflaster wegstoben»: Zürich war vor hundert Jahren eine Schlittelstadt,Der Dolder bewarb Zürich als Wintersportort. Erst das Automobil bereitete dem Schlittelspass ein Ende.,"https://img.nzz.ch/2026/02/11/4edd2577-0bd4-4001-a1a5-50dfe9fb2b85.jpg?width=1200&height=674&fit=bounds&quality=75&auto=webp&crop=3330,1873,x1338,y1039&wmark=nzz",2026-02-14T04:05:00Z,,"Wer vor 1880 geboren wurde, konnte in seinem Leben ohne weiteres fünfmal eine «Seegfrorni» des Zürichsees erleben. Wenn die Eisfläche zur Begehung freigegeben wurde, erfasste die Menschen ein Freuden… [+8075 chars]",,de,'Winter'
https://www.nzz.ch/sport/ski/olympia-2026-braathen-will-brasiliens-erster-winter-olympiasieger-werden-ld.1924455,https://www.nzz.ch/sport/ski/olympia-2026-braathen-will-brasiliens-erster-winter-olympiasieger-werden-ld.1924455,0,www.nzz.ch,Für den norwegischen Skiverband war er zu exzentrisch – am Samstag will Lucas Pinheiro Braathen der erste Winter-Olympiasieger Brasiliens werden,Dank seinem Privatteam fühlt sich der Skistar heute freier. Ein neuer Film zeigt: Hinter der Leichtigkeit und Sambatänzen im Zielraum verbergen sich auch dunklere Seiten.,"https://img.nzz.ch/2026/02/13/c6cca831-f5e0-4b4a-a4f1-7553a87a4449.jpg?width=1200&height=675&fit=bounds&quality=75&auto=webp&crop=7008,3942,x0,y266&wmark=nzz",2026-02-14T04:30:00Z,,"Dank seinem Privatteam fühlt sich der Skistar heute freier. Ein neuer Film zeigt: Hinter der Leichtigkeit und Sambatänzen im Zielraum verbergen sich auch dunklere Seiten.
Zusammenfassung
Merken
Lu… [+6009 chars]",,de,'Winter'
https://www.tagesspiegel.de/sport/winterspiele-in-italien-olympia-drama-durr-denkt-an-peking-nur-positiv-zuruck-15250688.html,https://www.tagesspiegel.de/sport/winterspiele-in-italien-olympia-drama-durr-denkt-an-peking-nur-positiv-zuruck-15250688.html,0,www.tagesspiegel.de,Winterspiele in Italien: Olympia-Drama? Dürr denkt an Peking nur positiv zurück,2022 platzt der Medaillentraum von Ski-Ass Lena Dürr auf bittere Art und Weise. Vor ihrem Start in Italien blickt die Münchnerin zurück - und spricht auch über ihre Zuschauerrolle im Team-Event.,https://www.tagesspiegel.de/images/15250687/alternates/BASE_16_9_W1400/1771044409000/lena-durr.jpeg,2026-02-14T04:46:50Z,,Skirennfahrerin Lena Dürr hat ihr Olympia-Drama von 2022 nach eigener Aussage abgehakt und geht zuversichtlich in die Winterspiele von Italien. Ich habe den Tag wirklich als richtig guten Tag in Erin… [+1851 chars],,de,'Winter'
https://orf.at/stories/3419746/,https://orf.at/stories/3419746/,0,orf.at,Nebliger Winter trübt Stimmung,"Die Wetterzwischenbilanz des bisherigen Winters fällt extrem unterschiedlich aus. Während es im Westen mehr Sonnenstunden als im langjährigen Schnitt gab, waren es in Ost- und Südösterreich deutlich weniger. Das fehlende Tageslicht dort schlägt laut Fachleute…",https://ibs.orf.at/news?image=https%3A%2F%2Fassets.orf.at%2Fmims%2F2026%2F07%2F20%2Fcrops%2Fw%3D1200%2Ch%3D630%2Cq%3D75%2F2929279_master_1132220_wetter_nebel_ausblick_luk.jpg%3Fs%3D0ac4c1cfb91c70d3683d25e3e0a1ea91cd6101eb,2026-02-14T06:09:41Z,,Denn Tiefdruckgebiete sind bis in die kommende Woche hinein wetterbestimmend und bringen immer wieder Wolken und wiederholt Regen sowie Schneefall. Zwischen den Regen- und Schneefronten wird sich zum… [+3208 chars],,de,'Winter'
https://www.zeit.de/news/2026-02/14/hier-muessen-sich-narren-im-suedwesten-auf-schnee-einstellen,https://www.zeit.de/news/2026-02/14/hier-muessen-sich-narren-im-suedwesten-auf-schnee-einstellen,0,www.zeit.de,Wetter zur Fastnacht: Hier müssen sich Narren im Südwesten auf Schnee einstellen,Hier finden Sie Informationen zu dem Thema „Wetter zur Fastnacht“. Lesen Sie jetzt „Hier müssen sich Narren im Südwesten auf Schnee einstellen“.,https://img.zeit.de/news/2026-02/14/hier-muessen-sich-narren-im-suedwesten-auf-schnee-einstellen-image-group/wide__1300x731,2026-02-14T06:27:38Z,,Vielerorts ziehen am Wochenende die Narren durch die Dörfer und Städte in Baden-Württemberg - und müssen sich dabei auf eher ungemütliches Wetter einstellen. Am Samstag zeigt sich der Himmel im Südwe… [+1816 chars],,de,'Schnee'
https://www.zeit.de/news/2026-02/14/schnee-zum-valentinstag-hochwassergefahr-bleibt-bestehen,https://www.zeit.de/news/2026-02/14/schnee-zum-valentinstag-hochwassergefahr-bleibt-bestehen,0,www.zeit.de,Wetterbericht: Schnee zum Valentinstag – Hochwassergefahr bleibt bestehen,Hier finden Sie Informationen zu dem Thema „Wetterbericht“. Lesen Sie jetzt „Schnee zum Valentinstag – Hochwassergefahr bleibt bestehen“.,https://img.zeit.de/news/2026-02/14/schnee-zum-valentinstag-hochwassergefahr-bleibt-bestehen-image-group/wide__1300x731,2026-02-14T06:41:46Z,,"Zum Valentinstag wird es weiß im Freistaat: Eine Kaltfront bringt Schnee bis ins bayerische Flachland. Damit könnte sich die Hochwasserlage zumindest vorerst beruhigen, teilte der Deutsche Wetterdien… [+1289 chars]",,de,'Schnee'
https://www.welt.de/regionales/nrw/article698ddf5562ee8b267c15d076/ihk-vs-ihk-der-tiefe-graben-in-der-kohlepolitik.html,https://www.welt.de/regionales/nrw/article698ddf5562ee8b267c15d076/ihk-vs-ihk-der-tiefe-graben-in-der-kohlepolitik.html,0,www.welt.de,Der tiefe Graben in der Kohlepolitik,2023 brach die IHK Köln mit den anderen Industrie- und Handelskammern in NRW. Die Kölner wollten den vorgezogenen Kohleausstieg nicht mittragen. Das gab Ärger. Doch von Tag zu Tag fühlen sich die Rebellen stärker bestätigt.,https://images.welt.de/698ddf5562ee8b267c15d076/032a51a5e152088ad49307d8a8858b2d-master/ci16x9-w1200/gettyimages-186472329-jpg,2026-02-14T06:47:47Z,,"Als die Industrie- und Handelskammer Köln 1797 gegründet wurde, war Köln die größte Freie Reichsstadt des Heiligen Römischen Reiches. Und noch heute ist sie die größte Kammer des Landes NRW. Sie zähl… [+7058 chars]",,de,'Kohle'
https://www.morgenpost.de/blogs-kolumnen/article411196739/kai-wegners-olympische-mission-in-mailand-und-in-der-heimat.html,https://www.morgenpost.de/blogs-kolumnen/article411196739/kai-wegners-olympische-mission-in-mailand-und-in-der-heimat.html,0,www.morgenpost.de,Kai Wegners olympische Mission in Mailand und in der Heimat,"In Italien laufen die Winterspiele, in Berlin will die Kampagne für die Bewerbung die skeptischen Hauptstädter begeistern.",https://img.sparknews.funkemedien.de/411197808/411197808_1770989753_v16_9_1600.jpeg,2026-02-14T07:00:00Z,,Henrik Wüst war fast gleichzeitig mit Kai Wegner da. Politisch sind der nordrhein-westfälische Ministerpräsident und Berlins Regierender Bürgermeister Alliierte. Aber im Kampf um Olympische Sommerspi… [+3823 chars],,de,'Winter'
https://www.zeit.de/wissen/umwelt/2026-02/schnee-regen-glatteis-sonne-wetter,https://www.zeit.de/wissen/umwelt/2026-02/schnee-regen-glatteis-sonne-wetter,0,www.zeit.de,Wetter in Deutschland: Wochenende bringt Regen und Schnee,Es soll Schnee und Regen fallen am Wochenende. Am Sonntag kann es gelegentlich sonnig werden. Der Deutsche Wetterdienst warnt für den Montag vor Glatteis.,https://img.zeit.de/gesellschaft/zeitgeschehen/2026-02/dwd-wetterwarnung-schnee-regen-glatteis-nuernberg-bild-2/wide__1300x731,2026-02-14T07:28:05Z,,Am Wochenende soll es in Deutschland regnen und mancherorts auch schneien. Der Deutsche Wetterdienst (DWD) sagt vor allem in den Gebirgsregionen mehrere Zentimeter Neuschnee voraus. Im übrigen Land r… [+968 chars],,de,'Glatteis'
https://www.focus.de/kultur/kino-tv/dominik-floh-vor-rassismus-in-deutschland-auf-zypern-geniesst-er-das-schoenste-leben_0c39a9a2-d567-4aa4-8d13-d350c07e7cde.html,https://www.focus.de/kultur/kino-tv/dominik-floh-vor-rassismus-in-deutschland-auf-zypern-geniesst-er-das-schoenste-leben_0c39a9a2-d567-4aa4-8d13-d350c07e7cde.html,0,www.focus.de,Dominik floh vor Rassismus in Deutschland – auf Zypern genießt er „das schönste Leben“,"Der Winter hat Deutschland fest im Griff. Der ein oder andere träumt von Strand und Sonne. All das bietet Zypern. Das ZDF begleitet in einer neuen Folge „Abenteuer Auswandern“ mehrere Menschen, die auf der Insel ihr Glück gefunden haben.",https://quadro.burda-forward.de/ctf/e9ca74ee-790c-4dc3-9554-8c036541eab4.f2fef66a-79f7-4268-b404-660423c44fdc.jpeg?im=RegionOfInterestCrop%3D%281200%2C630%29%2CregionOfInterest%3D%28680%2C425%29&hash=6ebf880ff8bcff10fdc45a1abd3c708ddb543e19fb10bdb8161b3a4b173d6ba4,2026-02-14T07:29:00Z,,In Deutschland lässt sich die Sonne derzeit nur selten blicken und schlägt mit ihrer Abwesenheit dem ein oder anderen merkbar aufs Gemüt nicht umsonst gibt es das Wort Winterdepression. Für Dominik w… [+4419 chars],,de,'Winter'
https://www.zeit.de/news/2026-02/14/klingbeil-will-klare-regeln-bei-sozialen-medien-fuer-kinder,https://www.zeit.de/news/2026-02/14/klingbeil-will-klare-regeln-bei-sozialen-medien-fuer-kinder,0,www.zeit.de,Jugend und Social Media: Klingbeil will klare Regeln bei sozialen Medien für Kinder,Hier finden Sie Informationen zu dem Thema „Jugend und Social Media“. Lesen Sie jetzt „Klingbeil will klare Regeln bei sozialen Medien für Kinder“.,https://img.zeit.de/news/2026-02/14/klingbeil-will-klare-regeln-bei-sozialen-medien-fuer-kinder-image-group/wide__1300x731,2026-02-14T07:59:42Z,,"SPD-Chef Lars Klingbeil spricht sich für eine stärkere Regulierung der sozialen Medien für Kinder und Jugendliche aus. «Vor ein paar Jahren hätte ich jede Beschränkung abgelehnt, heute sehe ich das a… [+1483 chars]",,de,'Kinder'
https://www.ibiza-heute.de/ibiza-und-formentera-sturm-zu-karneval-na-und/,https://www.ibiza-heute.de/ibiza-und-formentera-sturm-zu-karneval-na-und/,0,www.ibiza-heute.de,Ibiza und Formentera: Sturm zu Karneval? Na und…,"Die absolute Spitzenmeldung wäre in diesen Tagen: Es stürmt nicht! Wir erleben seit Wochen eine völlig verdrehte Welt auf Ibiza und Formentera. War sonst ein oder zweimal im Winter ein Sturm so stark, dass der spanische Wetterdienst mit Warnungen GELB oder ga…",https://www.ibiza-heute.de/wp-content/uploads/2022/02/Karneval_Ibiza_3_Ruediger_Eichhorn-1.jpg,2026-02-14T08:29:28Z,,Die absolute Spitzenmeldung wäre in diesen Tagen: Es stürmt nicht! Wir erleben seit Wochen eine völlig verdrehte Welt auf Ibiza und Formentera. War sonst ein oder zweimal im Winter ein Sturm so stark… [+1760 chars],,de,'Winter'
https://www.stern.de/wirtschaft/energiekosten--grundversorger-senken-strompreise-fuer-verbraucher-37136380.html,https://www.stern.de/wirtschaft/energiekosten--grundversorger-senken-strompreise-fuer-verbraucher-37136380.html,0,www.stern.de,Energiekosten: Weitere Grundversorger senken Strompreise,Millionen deutsche Haushalte profitieren von weiteren Strompreissenkungen der Grundversorger. Was hinter den Preissenkungen steckt und wie Sie noch mehr sparen könnten.,https://image.stern.de/37136612/t/Sf/v1/w1440/r1.7778/-/strompreise-der-grundversorger.jpg,2026-02-14T08:39:00Z,,"Kopiere den aktuellen Link
Zur Merkliste hinzufügen
Millionen deutsche Haushalte profitieren von weiteren Strompreissenkungen der Grundversorger. Was hinter den Preissenkungen steckt und wie Sie no… [+2135 chars]",,de,'Energiekosten'
https://www.zeit.de/sport/2026-02/olympische-winterspiele-eiskunstlauf-michail-schaidorow,https://www.zeit.de/sport/2026-02/olympische-winterspiele-eiskunstlauf-michail-schaidorow,0,www.zeit.de,Olympische Winterspiele: Kasachen gibt's,"Der Eiskunstlauf der Männer endet mit einer Überraschung, die an einen Skandal grenzt. Der Eistanz hat den schon. Und dann gehen auch noch die Kondome aus. Der Olympiatag",https://img.zeit.de/sport/2026-02/olympische-winterspiele-eiskunstlauf-michail-schaidorow-2/wide__1300x731,2026-02-14T08:40:49Z,,"Inhalt
Auf einer Seite lesen
 Inhalt
<ol><li></li><li>Seite 2Die Gratiskondome sind leer, die Verzweiflung ist groß</li></ol>
Über wen reden heute alle?
Michail Schaidorow, seinen Nachnamen merk… [+5391 chars]",,de,'Winter'
https://www.welt.de/sport/olympia/article69836b668e80b703b0c2971f/olympia-liveticker-brasilianer-pinheiro-braathen-vor-historischem-ski-coup.html,https://www.welt.de/sport/olympia/article69836b668e80b703b0c2971f/olympia-liveticker-brasilianer-pinheiro-braathen-vor-historischem-ski-coup.html,0,www.welt.de,Brasilianer Pinheiro Braathen vor historischem Ski-Coup,Lucas Pinheiro Braathen fährt im ersten Riesenslalom-Durchgang allen davon. Die erste brasilianische Medaille bei Winter-Olympia ist damit zum Greifen nah. Außerdem: Selenskyj überreicht Orden an ukrainischen Skeleton-Piloten. Alle News im Olympia-Ticker.,https://images.welt.de/69836b668e80b703b0c2971f/5cb7878d9f04b0348e5651b183c93434/ci16x9-w1200/dpa-com-20090101-260214-99-509109-jpg,2026-02-14T08:45:00Z,,Lucas Pinheiro Braathen fährt im ersten Riesenslalom-Durchgang allen davon. Die erste brasilianische Medaille bei Winter-Olympia ist damit zum Greifen nah. Außerdem: Selenskyj überreicht Orden an ukr… [+9179 chars],,de,'Winter'
https://www.zeit.de/zeit-magazin/wochenmarkt/2025-11/feta-tacos-zwiebel-ananas-salsa-rezept-wochenmarkt,https://www.zeit.de/zeit-magazin/wochenmarkt/2025-11/feta-tacos-zwiebel-ananas-salsa-rezept-wochenmarkt,0,www.zeit.de,Feta-Tacos mit Zwiebeln und Ananassalsa: Früher war mehr Limette,"Mal kurz den Winter vergessen? Diese Tacos mit gebackenem Kräuterfeta und würziger Ananassalsa erinnern daran, dass irgendwann wieder die Sonne scheint.",https://img.zeit.de/zeit-magazin/wochenmarkt/2025-11/feta-tacos-zwiebel-ananas-salsa-rezept-wochenmarkt-bild/wide__1300x731,2026-02-14T10:00:24Z,,"Ich
werde Käse und Ananas als Kombination immer
lieben, und diese Version mit gebackenem Kräuterfeta und würziger Ananassalsa ist das perfekte Update britischer Käse-Ananas-Spießchen, einem Buffetk… [+434 chars]",,de,'Winter'
https://www.tagesspiegel.de/sport/olympische-winterspiele-gold-fur-brasilien-ski-showman-pinheiro-braathen-brilliert-15250938.html,https://www.tagesspiegel.de/sport/olympische-winterspiele-gold-fur-brasilien-ski-showman-pinheiro-braathen-brilliert-15250938.html,0,www.tagesspiegel.de,Olympische Winterspiele: Gold für Brasilien: Ski-Showman Pinheiro Braathen brilliert,Lucas Pinheiro Braathen schreibt im Riesenslalom von Bormio Geschichte. Der 25-Jährige ist eine der schillerndsten Figuren der alpinen Ski-Welt - sowohl auf als auch neben der Piste.,https://www.tagesspiegel.de/images/15251424/alternates/BASE_16_9_W1400/1771078334000/olympische-winterspiele-2026.jpeg,2026-02-14T10:15:02Z,,"Lucas Pinheiro Braathen ließ sich von den begeisterten Fans in Bormio feiern. Sein Vater hatte Freudentränen in den Augen, der geschlagene Superstar Marco Odermatt applaudierte anerkennend. Mit seine… [+3170 chars]",,de,'Winter'
https://www.zeit.de/news/2026-02/14/an-der-mosel-geht-hochwasser-zurueck-am-rhein-steigt-s-noch,https://www.zeit.de/news/2026-02/14/an-der-mosel-geht-hochwasser-zurueck-am-rhein-steigt-s-noch,0,www.zeit.de,Hochwasser: An der Mosel geht Hochwasser zurück - am Rhein steigt's noch,Hier finden Sie Informationen zu dem Thema „Hochwasser“. Lesen Sie jetzt „An der Mosel geht Hochwasser zurück - am Rhein steigt's noch“.,https://img.zeit.de/news/2026-02/14/an-der-mosel-geht-hochwasser-zurueck-am-rhein-steigt-s-noch-image-group/wide__1300x731,2026-02-14T10:15:53Z,,"An der Mosel geht das Hochwasser zurück. Am Pegel Trier sei am Freitagabend der Höchststand mit knapp sieben Metern erreicht worden, teilte die Hochwasservorhersagezentrale Rheinland-Pfalz mit. Seitd… [+1274 chars]",,de,'Hochwasser'
https://www.stern.de/gesellschaft/regional/rheinland-pfalz-saarland/hochwasser--an-der-mosel-geht-hochwasser-zurueck---am-rhein-steigt-s-noch-37136826.html,https://www.stern.de/gesellschaft/regional/rheinland-pfalz-saarland/hochwasser--an-der-mosel-geht-hochwasser-zurueck---am-rhein-steigt-s-noch-37136826.html,0,www.stern.de,Hochwasser: An der Mosel geht Hochwasser zurück - am Rhein steigt's noch,"Trier (lrs) - An der Mosel geht das Hochwasser zurück. Am Pegel Trier sei am Freitagabend der Höchststand mit knapp sieben Metern erreicht worden, teilte",https://image.stern.de/37136828/t/4J/v1/w1440/r1.7778/-/14--jghddvdmvgv3axs2048jpeg---a354a10350c0ee9e.jpg,2026-02-14T10:15:53Z,,"Kopiere den aktuellen Link
Zur Merkliste hinzufügen
Am Mittelrhein werden steigende Wasserstände vorhersagt. Am Pegel Koblenz soll am Sonntag der Höchststand erreicht sein.
An der Mosel geht das H… [+1410 chars]",,de,'Hochwasser'
https://www.bild.de/leben-wissen/haustiere/was-machen-wespen-im-winter-erstaunliche-ueberlebens-strategie-6967afb69f36d5bf769fb9ba,https://www.bild.de/leben-wissen/haustiere/was-machen-wespen-im-winter-erstaunliche-ueberlebens-strategie-6967afb69f36d5bf769fb9ba,0,www.bild.de,Echte Kämpferinnen - Wie Wespen den kalten Winter überleben,Viele Menschen fragen sich: Wo sind die Wespen im Winter? Sterben sie oder überleben die Tiere? Die Antwort ist überraschend – und ziemlich gnadenlos.,"https://images.bild.de/6967afb69f36d5bf769fb9ba/2c0941ef66fd45f1e8aebb76e27f82c8,f7038547?w=1280",2026-02-14T11:25:54Z,,"TTS-Player überspringenArtikel weiterlesenViele Menschen fragen sich: Wo sind die Wespen im Winter? Sterben sie oder überleben die Tiere? Und wenn ja, wie? Die Antwort ist überraschend und ziemlich g… [+2775 chars]",,de,'Schimmel'
https://www.zeit.de/news/2026-02/14/wintersport-nur-noch-auf-kunstschnee-moeglich,https://www.zeit.de/news/2026-02/14/wintersport-nur-noch-auf-kunstschnee-moeglich,0,www.zeit.de,Wetter: Wintersport nur noch auf Kunstschnee möglich,Hier finden Sie Informationen zu dem Thema „Wetter“. Lesen Sie jetzt „Wintersport nur noch auf Kunstschnee möglich“.,https://img.zeit.de/news/2026-02/14/wintersport-nur-noch-auf-kunstschnee-moeglich-image-group/wide__1300x731,2026-02-14T11:39:41Z,,Die milden Temperaturen der vergangenen Tage haben den Schnee im Thüringer Wald schmelzen lassen. Wintersport ist nach Angaben des Regionalverbundes Thüringer Wald am ersten Winterferien-Wochenende n… [+611 chars],,de,'Schnee'
https://www.stern.de/gesellschaft/regional/berlin-brandenburg/wetterausblick--frostiges-wochenende-in-berlin-und-brandenburg-37137010.html,https://www.stern.de/gesellschaft/regional/berlin-brandenburg/wetterausblick--frostiges-wochenende-in-berlin-und-brandenburg-37137010.html,0,www.stern.de,Wetterausblick: Frostiges Wochenende in Berlin und Brandenburg,"Nachdem Schnee und Glatteis vielerorts weggetaut sind, sinken die Temperaturen ab Samstagabend wieder unter den Gefrierpunkt. Polizei und Flughafen melden zunächst eine ruhige Verkehrslage.",https://image.stern.de/37137012/t/EF/v1/w1440/r1.7778/-/14--eosetjpg4ev17axs2048jpeg---58bb948c514e5527.jpg,2026-02-14T11:54:46Z,,"Kopiere den aktuellen Link
Zur Merkliste hinzufügen
Nachdem Schnee und Glatteis vielerorts weggetaut sind, sinken die Temperaturen ab Samstagabend wieder unter den Gefrierpunkt. Polizei und Flughaf… [+1203 chars]",,de,'Schnee'
https://www.tagesschau.de/wetter/winter-wetter-schnee-regen-glatteis-wochenende-100.html,https://www.tagesschau.de/wetter/winter-wetter-schnee-regen-glatteis-wochenende-100.html,0,www.tagesschau.de,Das Wochenende bringt Schnee und Glatteis,"Der Winter in Deutschland dreht noch eine Runde. Narren, Jecken und Ausflügler am Valentinstag brauchen dicke Jacken und Regenschirme. Vielerorts sind Schnee und Regen angesagt. Im Norden kam es bereits zu wetterbedingten Unfällen.",https://images.tagesschau.de/image/c2e741ca-1845-4b4d-b2f0-23194e6c7e00/AAABnFwB-yA/AAABmyZE0EA/16x9-big/schnee-1156.jpg?width=1280,2026-02-14T12:25:42Z,,"Stand: 14.02.2026 13:25 Uhr
Der Winter in Deutschland dreht noch eine Runde. Narren, Jecken und Ausflügler am Valentinstag brauchen dicke Jacken und Regenschirme. Vielerorts sind Schnee und Regen an… [+1722 chars]",,de,'Winter'
