index,url,valid,domain,title,description,image,published,archive,content,quote,language,keyword
https://www.golem.de/sonstiges/zustimmung/auswahl.html?from=https://www.golem.de/news/kostenbremse-fuer-mieter-an-der-waermepumpe-kommt-auch-die-cdu-nicht-vorbei-2605-208224.html&referer=https://t.co/ebfc59cca2,https://www.golem.de/sonstiges/zustimmung/auswahl.html?from=https://www.golem.de/news/kostenbremse-fuer-mieter-an-der-waermepumpe-kommt-auch-die-cdu-nicht-vorbei-2605-208224.html&referer=https://t.co/ebfc59cca2,0,www.golem.de,Kostenbremse fû¥r Mieter: An der WûÊrmepumpe kommt auch die CDU nicht vorbei,"Zukû¥nftig sollen die steigenden Kosten fû¥r ûl- und Gasheizung zwischen Mietern und Vermietern geteilt werden. Das Risiko explodierender Heizkosten wird damit verteilt. (WûÊrmepumpe, Umweltschutz)",,2026-05-01T10:20:02Z,,"Besuchen Sie Golem.de wie gewohnt mit Werbung und Tracking,
 indem Sie der Nutzung aller Cookies zustimmen.
 Details zum Tracking finden Sie im Privacy Center.
Skript wurde nicht geladen. InformatãÎ [+607 chars]",,de,'Gas'
https://taz.de/Hohe-Spritpreise/!6175509/,https://taz.de/Hohe-Spritpreise/!6175509/,0,taz.de,Hohe Spritpreise: Tankrabatt zeigt erste Wirkung an ZapfsûÊulen,"Fû¥r Benzin und Diesel gelten jetzt fû¥r zwei Monate niedrigere Steuern. Das soll dafû¥r sorgen, dass Tanken nicht noch teurer wird. Die Kritik ist groû.",https://taz.de/picture/8413999/1200/385723052.jpeg,2026-05-01T12:57:00Z,,"Fû¥r Benzin und Diesel gelten jetzt fû¥r zwei Monate niedrigere Steuern. Das soll dafû¥r sorgen, dass Tanken nicht noch teurer wird. Die Kritik ist groû. mehr...",,de,'Spritpreise'
https://www.zeit.de/politik/deutschland/2026-05/tankrabatt-benzinpreise-dieselpreise-tankstelle-krise,https://www.zeit.de/politik/deutschland/2026-05/tankrabatt-benzinpreise-dieselpreise-tankstelle-krise,0,www.zeit.de,"Tankrabatt: Sprit auch mittags billiger, ADAC und Kartellamt û¥ben trotzdem Kritik",Dank des Tankrabatts sind die Spritpreise auch nach 12 Uhr deutlich unter dem Vortagesniveau geblieben. Das Bundeskartellamt sieht aber noch Nachholbedarf.,https://img.zeit.de/mobilitaet/2026-05/spritsteuer-senkung-benzin-bild/wide__1300x731,2026-05-01T14:06:37Z,,Mit dem Start des Tankrabatts sind die Preise fû¥r Benzin und Diesel in Deutschland zwar deutlich gesunken laut dem Bundeskartellamt und dem ADAC ist der Rabatt aber nicht komplett an die Verbraucher,,,
https://www.faz.net/aktuell/wirtschaft/unternehmen/pck-raffinerie-es-ist-noch-oel-in-der-pipeline-accg-200787542.html,https://www.faz.net/aktuell/wirtschaft/unternehmen/pck-raffinerie-es-ist-noch-oel-in-der-pipeline-accg-200787542.html,0,www.faz.net,PCK-Raffinerie: ãEs ist noch ûl in der Pipelineã,Russland stoppt den RohûÑltransit nach Deutschland. Die PCK-Raffinerie sucht nach Alternativen. ZunûÊchst lûÊuft der Betrieb ohne BeeintrûÊchtigung weiter.,https://media0.faz.net/image/w1200h627/e2bb2c24cb88/w7999h4179x0y596o/202604/43601.0.2033485857/muss-nun-ohne-oel-aus.webp,2026-05-01T15:24:32Z,,Eine der grûÑûten Raffinerien in Deutschland fûÊhrt auf Reserve: Zum 1. Mai hat Russland die Durchleitung von kasachischem RohûÑl nach Deutschland û¥ber die Pipeline Freundschaft (Druschba) gestoppt. BetãÎ [+4701 chars],,de,'RohûÑl'
https://www.faz.net/aktuell/wirtschaft/kommt-der-tankrabatt-auch-wirklich-an-accg-200788906.html,https://www.faz.net/aktuell/wirtschaft/kommt-der-tankrabatt-auch-wirklich-an-accg-200788906.html,0,www.faz.net,Spritpreise: Was kommt vom Tankrabatt wirklich an?,Seit dem 1. Mai gilt in Deutschland ein auf zwei Monate befristeter Tankrabatt. Nach dem Scheitern der 12-Uhr-Regel hoffen Autofahrer nun auf niedrigere Preise.,https://media0.faz.net/image/w1200h627/f6fc978fe4f6/w5389h2815x0y551o/202604/43601.0.1991227236/tankrabatt-seit-mitternacht.webp,2026-05-01T16:01:21Z,,Der seit dem 1. Mai in Deutschland geltende Tankrabatt hat sich in den ersten Stunden nach der Einfû¥hrung nur zum Teil in sinkenden Preisen an den ZapfsûÊulen niedergeschlagen. Am Freitagmorgen waren ãÎ [+5498 chars],,de,'Spritpreise'
https://www.sueddeutsche.de/politik/news-banaszak-gruenen-chef-tankrabatt-spritpreise-infantino-gaza-flotte-bolsonaro-li.3477008,https://www.sueddeutsche.de/politik/news-banaszak-gruenen-chef-tankrabatt-spritpreise-infantino-gaza-flotte-bolsonaro-li.3477008,0,www.sueddeutsche.de,SZ am Abend: Nachrichten vom 1. Mai 2026,"News aktuell: Banaszak im Interview, Tankrabatt drû¥ckt Spritpreise, Infantino kandidiert erneut",https://www.sueddeutsche.de/2026/05/01/c039ee8e-e4c9-484b-91fd-3ff8cbad62af.jpg?q=60&fm=webp&width=1200&rect=0%2C81%2C4000%2C2250,2026-05-01T16:06:51Z,,Tankrabatt drû¥ckt Preise von Benzin und Diesel. Der Tankrabatt zur Entlastung von stark gestiegenen Preisen infolge des Iran-Kriegs zeigt erste Wirkung. Zum Start gingen die Preise fû¥r Benzin und DieãÎ [+2584 chars],,de,'Spritpreise'
https://www.tagesschau.de/wirtschaft/verbraucher/oelpreise-opec-100.html,https://www.tagesschau.de/wirtschaft/verbraucher/oelpreise-opec-100.html,0,www.tagesschau.de,OPEC ohne die VAE - was heiût das fû¥r die ûl- und Spritpreise?,Die OPEC verliert eines ihrer wichtigsten Mitglieder: Nach Streit û¥ber die ûlfûÑrdermengen treten die Vereinigten Arabischen Emirate aus dem ûl-Kartell aus. Werden Benzin und Kerosin nun billiger? Von Heidi Radvilas.,https://images.tagesschau.de/image/35e01dbc-31b2-4c66-a058-4f261efbf7bf/AAABnd2cu2U/AAABnSSvrFg/16x9-big/abu-dhabi-128.jpg?width=1280,2026-05-01T16:47:27Z,,"Stand: 01.05.2026 18:47 Uhr
Die OPEC verliert eines ihrer wichtigsten Mitglieder: Nach Streit û¥ber die ûlfûÑrdermengen treten die Vereinigten Arabischen Emirate aus dem ûl-Kartell aus. Werden Benzin ãÎ [+3133 chars]",,de,'Spritpreise'
https://www.faz.net/aktuell/wirtschaft/das-aendert-sich-fuer-mieter-im-neuen-heizungsgesetz-200787023.html,https://www.faz.net/aktuell/wirtschaft/das-aendert-sich-fuer-mieter-im-neuen-heizungsgesetz-200787023.html,0,www.faz.net,Kostenbremse fû¥r die WûÊrmewende: Das ûÊndert sich fû¥r Mieter im neuen Heizungsgesetz,"Vermieter und Mieter sollen Teile der Kosten fû¥r ûl und Gas je zur HûÊlfte tragen. Die Koalition zeigt neue Geschlossenheit, Klimaschû¥tzer und Wohneigentû¥mer halten den Entwurf fû¥r falsch ã aus gegenteiligen Grû¥nden.",https://media0.faz.net/image/w1200h627/e8c69e0655a1/w3000h1567x0y214o/202601/43601.0.1642267411/schoen-warm-und-schoen-gruen.webp,2026-05-01T18:16:02Z,,Die Bundesregierung will Mieter von Teilen der hohen Betriebskosten fû¥r neue Gas- oder ûlheizungen entlasten. Kû¥nftig sollen die Wohnungseigentû¥mer rund die HûÊlfte der zusûÊtzlichen laufenden AusgabenãÎ [+5819 chars],,de,'Heizkosten'
https://www.zeit.de/news/2026-05/02/eon-verspricht-bestandskunden-stabile-strom-und-gaspreise,https://www.zeit.de/news/2026-05/02/eon-verspricht-bestandskunden-stabile-strom-und-gaspreise,0,www.zeit.de,Energiekosten: Eon verspricht Bestandskunden stabile Strom- und Gaspreise,Hier finden Sie Informationen zu dem Thema ãEnergiekostenã. Lesen Sie jetzt ãEon verspricht Bestandskunden stabile Strom- und Gaspreiseã.,https://img.zeit.de/news/2026-05/02/eon-verspricht-bestandskunden-stabile-strom-und-gaspreise-image-group/wide__1300x731,2026-05-02T02:30:04Z,,Deutschlands grûÑûter Energieversorger Eon will in diesem Jahr bei Strom und Gas nicht mehr an der Preisschraube drehen. ô¨Wir als Eon werden die Strom- und Gaspreise fû¥r unsere Bestandskundinnen und -ãÎ [+3321 chars],,de,'Gas'
https://www.stern.de/gesellschaft/regional/rheinland-pfalz-saarland/bruecken--neue-landgrafenbruecke-soll-hochwasser-im-ahrtal-standhalten-37361564.html,https://www.stern.de/gesellschaft/regional/rheinland-pfalz-saarland/bruecken--neue-landgrafenbruecke-soll-hochwasser-im-ahrtal-standhalten-37361564.html,0,www.stern.de,Brû¥cken: Neue Landgrafenbrû¥cke soll Hochwasser im Ahrtal standhalten,"Nach der Flut 2021 entstehen im Ahrtal neue Brû¥cken: Die Landgrafenbrû¥cke soll kû¥nftig sogar hundertjûÊhrlichem Hochwasser standhalten ã und bietet mehr Platz fû¥r Verkehr, Radfahrer und FuûgûÊnger.",https://image.stern.de/37361566/t/Sr/v1/w1440/r1.7778/-/02--fsmkbkst3sv6axs2048jpeg---da16f3b483a1b031.jpg,2026-05-02T03:00:05Z,,"Kopiere den aktuellen Link
Zur Merkliste hinzufû¥gen
Nach der Flut 2021 entstehen im Ahrtal neue Brû¥cken: Die Landgrafenbrû¥cke soll kû¥nftig sogar hundertjûÊhrlichem Hochwasser standhalten und bietet ãÎ [+3157 chars]",,de,'Hochwasser'
https://www.n-tv.de/wirtschaft/Wirtschaftsweise-Schnitzer-Die-schlimmsten-Folgen-des-Iran-Krieges-kommen-noch-id30777658.html,https://www.n-tv.de/wirtschaft/Wirtschaftsweise-Schnitzer-Die-schlimmsten-Folgen-des-Iran-Krieges-kommen-noch-id30777658.html,0,www.n-tv.de,Lebensmittel und Energie teurer: Wirtschaftsweise Schnitzer: Die schlimmsten Folgen des Iran-Krieges kommen noch,"Die Vorsitzende der Wirtschaftsweisen, Monika Schnitzer, stellt die Deutschen auf steigende Preise als Folge des Nahost-Konfliktes ein. Der Staat kûÑnne nicht ""den Sommerurlaubô durch Schulden auf Kosten unserer Kinder subventionieren"", mahnt die ûkonomin.",https://www.n-tv.de/img/30410847/1777700188/Img_16_9/1200/Monika-Schnitzer-Vorsitzende-des-Sachverstaendigenrates-zur-Begutachtung-der-gesamtwirtschaftlichen-Entwicklung-aufgenommen-im-Rahmen-der-Vorstellung-des-Jahresgutachtens-2025-26-des-Sachverstaendigenrat-zur-Begutachtung-der-gesamtwirtschaftlichen-Entwicklung-in-Berlin-12-11-2025.jpg,2026-05-02T03:34:28Z,,"HûÑhere Spritpreise signalisierten die Knappheit von ûl, argumentiert Monikaô Schnitzer. (Foto: IMAGO/photothek/Florian Gaertner)
Die Vorsitzende der Wirtschaftsweisen, Monika Schnitzer, stellt die DeãÎ [+2341 chars]",,de,'Spritpreise'
https://www.zeit.de/news/2026-05/02/adac-tankrabatt-kommt-nicht-ganz-bei-autofahrern-an,https://www.zeit.de/news/2026-05/02/adac-tankrabatt-kommt-nicht-ganz-bei-autofahrern-an,0,www.zeit.de,Spritpreise: ADAC: Tankrabatt kommt nicht ganz bei Autofahrern an,Hier finden Sie Informationen zu dem Thema ãSpritpreiseã. Lesen Sie jetzt ãADAC: Tankrabatt kommt nicht ganz bei Autofahrern anã.,https://img.zeit.de/news/2026-05/02/adac-tankrabatt-kommt-nicht-ganz-bei-autofahrern-an-image-group/wide__1300x731,2026-05-02T08:47:32Z,,Die MineralûÑlkonzerne haben den Tankrabatt laut ADAC am ersten Tag nicht komplett an die Autofahrer weitergegeben. Nach Berechnungen des Automobilclubs fiel der Preisrû¥ckgang bei Diesel und Benzin anãÎ [+1159 chars],,de,'Spritpreise'
https://www.zeit.de/news/2026-05/02/zwei-kinder-von-parkeisenbahn-in-mainz-erfasst-und-verletzt,https://www.zeit.de/news/2026-05/02/zwei-kinder-von-parkeisenbahn-in-mainz-erfasst-und-verletzt,0,www.zeit.de,Rettungseinsatz: Zwei Kinder von Parkeisenbahn in Mainz erfasst und verletzt,Hier finden Sie Informationen zu dem Thema ãRettungseinsatzã. Lesen Sie jetzt ãZwei Kinder von Parkeisenbahn in Mainz erfasst und verletztã.,https://img.zeit.de/news/2026-05/02/zwei-kinder-von-parkeisenbahn-in-mainz-erfasst-und-verletzt-image-group/wide__1300x731,2026-05-02T19:35:32Z,,"Zwei Kinder sind im Mainzer Volkspark von der Parkeisenbahn erfasst und verletzt worden. Zur Schwere der Verletzungen der beiden gab es von der Polizei keine Auskû¥nfte. Zu dem Unfall kam es, als der ãÎ [+458 chars]",,de,'Kinder'
https://www.zeit.de/news/2026-05/03/trotz-steuersenkung-spritpreise-steigen-laut-adac-wieder,https://www.zeit.de/news/2026-05/03/trotz-steuersenkung-spritpreise-steigen-laut-adac-wieder,0,www.zeit.de,Kraftstoffpreise: Trotz Steuersenkung: Spritpreise steigen laut ADAC wieder,Hier finden Sie Informationen zu dem Thema ãKraftstoffpreiseã. Lesen Sie jetzt ãTrotz Steuersenkung: Spritpreise steigen laut ADAC wiederã.,https://img.zeit.de/news/2026-05/03/trotz-steuersenkung-spritpreise-steigen-laut-adac-wieder-image-group/wide__1300x731,2026-05-03T09:00:14Z,,Von der Steuersenkung zur Entlastung der Autofahrer kûÑnnen die Verbraucher nach EinschûÊtzung des ADAC bislang nicht in voller HûÑhe profitieren. Nach Beobachtung des Autofahrerclubs lagen die bundesweãÎ [+1231 chars],,de,'Spritpreise'
https://www.zeit.de/news/2026-05/03/sturm-und-schnee-statt-sonne-griechenland-friert-im-mai,https://www.zeit.de/news/2026-05/03/sturm-und-schnee-statt-sonne-griechenland-friert-im-mai,0,www.zeit.de,Wetter: Sturm und Schnee statt Sonne ã Griechenland friert im Mai,Hier finden Sie Informationen zu dem Thema ãWetterã. Lesen Sie jetzt ãSturm und Schnee statt Sonne ã Griechenland friert im Maiã.,https://img.zeit.de/news/2026-05/03/sturm-und-schnee-statt-sonne-griechenland-friert-im-mai-image-group/wide__1300x731,2026-05-03T09:26:47Z,,"Eine ungewûÑhnliche KûÊltewelle hat Griechenland Anfang Mai fest im Griff. Statt frû¥hlingshafter Temperaturen sorgt eine ô¨Kaltluft-Invasionô£, wie Meteorologen in griechischen Medien berichten, fû¥r ein ãÎ [+1457 chars]",,de,'Schnee'
https://www.zeit.de/news/2026-05/03/kriegsrelikt-explodiert-unter-lagerfeuer-kinder-verletzt,https://www.zeit.de/news/2026-05/03/kriegsrelikt-explodiert-unter-lagerfeuer-kinder-verletzt,0,www.zeit.de,ûsterreich: Kriegsrelikt explodiert unter Lagerfeuer - Kinder verletzt,Hier finden Sie Informationen zu dem Thema ãûsterreichã. Lesen Sie jetzt ãKriegsrelikt explodiert unter Lagerfeuer - Kinder verletztã.,https://img.zeit.de/news/2026-05/03/kriegsrelikt-explodiert-unter-lagerfeuer-kinder-verletzt-image-group/wide__1300x731,2026-05-03T16:13:05Z,,"In ûsterreich sind fû¥nf Kinder bei einer Explosion in einem Lagerfeuer verletzt worden. Wie die Polizei am Sonntag mitteilte, explodierte am Vorabend im Bundesland OberûÑsterreich ein Kriegsrelikt untãÎ [+922 chars]",,de,'Kinder'
https://noe.orf.at/stories/3352333/,https://noe.orf.at/stories/3352333/,0,noe.orf.at,37 Millionen Euro FûÑrderung fû¥r Wasserinfrastruktur,"In NiederûÑsterreich sollen 276 Projekte von einer FûÑrdergenehmigung des Bundes û¥ber insgesamt rund 140 Millionen Euro fû¥r Trinkwasserversorgung, Abwasserentsorgung, Hochwasserschutz und ûkologisierung von GewûÊssern  profitieren.",https://ibs.orf.at/noe?image=https%3A%2F%2Foekastatic.orf.at%2Fmims%2F2025%2F21%2F01%2Fcrops%2Fw%3D1200%2Ch%3D627%2Cq%3D75%2F2638186_master_1013601_npthayatalbr-david-loescher.jpg%3Fs%3D18dc1a22e54d158019e54e20e05203af89a92e52,2026-05-04T03:25:01Z,,"Europa bekommt die Auswirkungen des Klimawandels besonders stark zu spû¥ren. Der Kontinent erlebte 2025 einen enormen Rû¥ckgang der Schnee- und Eisbedeckung, Dû¥rren, Hitzewellen, WaldbrûÊnde und MeereseãÎ [+4774 chars]",,de,'Hochwasser'
https://www.bild.de/leben-wissen/auto/kaugummi-im-autositz-effektiv-entfernen-69f30b6a6ae0ff2bebbd3674,https://www.bild.de/leben-wissen/auto/kaugummi-im-autositz-effektiv-entfernen-69f30b6a6ae0ff2bebbd3674,0,www.bild.de,Diese Hausmittel helfen - So entfernen Sie Kaugummi aus dem Autositz,"KûÊlte und Essig helfen, hartnûÊckige Kaugummireste schonend aus Autositzen zu entfernen. Tipps fû¥r Stoff- und Ledersitze.","https://images.bild.de/69f30b6a6ae0ff2bebbd3674/f58789205a90249040159885a4290e98,4b18b311?w=1280",2026-05-04T05:31:20Z,,"TTS-Player û¥berspringenArtikel weiterlesenEin Kaugummi im Autositz kann den schûÑnsten Tag ruinieren.Doch mit ein paar Tricks lûÊsst sich das klebrige Malheur beheben!
Der Schlû¥ssel zur Entfernung istãÎ [+940 chars]",,de,'KûÊlte'
https://www.stern.de/kultur/tv/40-jahre--fernsehgarten---so-feiert-andrea-kiewel-die-jubilaeums-staffel-im-zdf-37365198.html,https://www.stern.de/kultur/tv/40-jahre--fernsehgarten---so-feiert-andrea-kiewel-die-jubilaeums-staffel-im-zdf-37365198.html,0,www.stern.de,"ZDF-Fernsehgarten: 40 Jahre ""Fernsehgarten"": So feiert Andrea Kiewel die JubilûÊums-Staffel im ZDF","Ein Kultformat feiert groûes JubilûÊum: Seit 40 Jahren unterhûÊlt der ""ZDF-Fernsehgarten"" sein Publikum mit einer einzigartigen TV-Mixtur. Gastgeberin Andrea Kiewel begeht die JubilûÊumsstaffel angemessen mit bester Unterhaltung und allerlei ûberraschungen.",https://image.stern.de/37365194/t/Kl/v1/w1440/r1.7778/-/zdf-fernsehgarten--1-.jpg,2026-05-04T06:00:04Z,,"Kopiere den aktuellen Link
Zur Merkliste hinzufû¥gen
Ein Kultformat feiert groûes JubilûÊum: Seit 40 Jahren unterhûÊlt der ""ZDF-Fernsehgarten"" sein Publikum mit einer einzigartigen TV-Mixtur. GastgebeãÎ [+3790 chars]",,de,'KûÊlte'
https://www.morgenpost.de/berlin/article411892848/nach-dem-mega-stromausfall-in-berlin-so-wurde-beim-schutz-aufgeruestet.html,https://www.morgenpost.de/berlin/article411892848/nach-dem-mega-stromausfall-in-berlin-so-wurde-beim-schutz-aufgeruestet.html,0,www.morgenpost.de,Nach dem Mega-Stromausfall in Berlin: So wurde beim Schutz aufgerû¥stet,Nach dem massiven Blackout Anfang des Jahres im Berliner Sû¥dwesten hat der Senat Konsequenzen gezogen. Wie das Stromnetz geschû¥tzt wird.,https://img.sparknews.funkemedien.de/411773514/411773514_1776757740_v16_9_1600.jpeg,2026-05-04T07:34:13Z,,Vier Monate nach dem groûen Stromausfall im Berliner Sû¥dwesten sieht Wirtschaftssenatorin Franziska Giffey deutliche Fortschritte beim Schutz des Stromnetzes. Wir haben nach den Ereignissen Anfang deãÎ [+1509 chars],,de,'Blackout'
https://www.zeit.de/news/2026-05/04/spritpreise-steigen-tagesschnitt-ueber-2-euro,https://www.zeit.de/news/2026-05/04/spritpreise-steigen-tagesschnitt-ueber-2-euro,0,www.zeit.de,Tankrabatt: Spritpreise steigen - Tagesschnitt û¥ber 2 Euro,Hier finden Sie Informationen zu dem Thema ãTankrabattã. Lesen Sie jetzt ãSpritpreise steigen - Tagesschnitt û¥ber 2 Euroã.,https://img.zeit.de/news/2026-05/04/spritpreise-steigen-tagesschnitt-ueber-2-euro-image-group/wide__1300x731,2026-05-04T07:47:57Z,,"Die Spritpreise sind û¥ber das Wochenende deutlich gestiegen und setzen sich û¥ber der Marke von 2 Euro fest. Ein Liter Super E10 kostete im bundesweiten Tagesdurchschnitt des Sonntags 2,017 Euro, wie ãÎ [+1662 chars]",,de,'Spritpreise'
https://www.zeit.de/wirtschaft/2026-05/tankrabatt-spritpreise-benzin-diesel-tagesschnitt-zwei-euro,https://www.zeit.de/wirtschaft/2026-05/tankrabatt-spritpreise-benzin-diesel-tagesschnitt-zwei-euro,0,www.zeit.de,"Tankrabatt: Spritpreise steigen wieder, Tagesschnitt weiter û¥ber zwei Euro",Mit dem Tankrabatt fallen 17 Cent Energiesteuer pro Liter Benzin weg. Auf die Spritpreise setzt sich das allerdings nicht voll um ã die steigen bereits wieder.,https://img.zeit.de/politik/deutschland/2026-05/tankrabatt-spritpreise-benzin-diesel-tagesschnitt-zwei-euro-bild/wide__1300x731,2026-05-04T08:52:41Z,,Die Preise fû¥r Diesel und Benzin sind û¥ber das Wochenende im Schnitt deutlich gestiegen. Das zeigen die Zahlen des ADAC. Ein Liter Super E10 kostete am Sonntag im bundesweiten Tagesdurchschnitt demnaãÎ [+701 chars],,de,'Spritpreise'
https://www.zeit.de/news/2026-05/04/nach-anschlag-normalitaet-fuer-kinder-noch-weit-entfernt,https://www.zeit.de/news/2026-05/04/nach-anschlag-normalitaet-fuer-kinder-noch-weit-entfernt,0,www.zeit.de,Anschlag auf Weihnachtsmarkt: Nach Anschlag: NormalitûÊt fû¥r Kinder noch weit entfernt,Hier finden Sie Informationen zu dem Thema ãAnschlag auf Weihnachtsmarktã. Lesen Sie jetzt ãNach Anschlag: NormalitûÊt fû¥r Kinder noch weit entferntã.,https://img.zeit.de/news/2026-05/04/nach-anschlag-normalitaet-fuer-kinder-noch-weit-entfernt-image-group/wide__1300x731,2026-05-04T09:52:29Z,,"Kinder, die den Anschlag auf dem Magdeburger Weihnachtsmarkt miterleben mussten, sind nach der EinschûÊtzung eines Experten erheblich in ihrer Entwicklung beeintrûÊchtigt. ûngste, Schreckhaftigkeit, AtãÎ [+2720 chars]",,de,'Kinder'
https://www.stern.de/panorama/adac--tankrabatt-wird-nicht-vollstaendig-an-verbraucher-weitergegeben-37366750.html,https://www.stern.de/panorama/adac--tankrabatt-wird-nicht-vollstaendig-an-verbraucher-weitergegeben-37366750.html,0,www.stern.de,Spritpreise sinken nicht genug: ADAC: Tankrabatt wird nicht vollstûÊndig an Verbraucher weitergegeben,Der Tankrabatt greift und RohûÑl wird gû¥nstiger ã doch die Spritpreise sinken laut ADAC nicht stark genug. Die Ersparnis durch die gesenkte Energiesteuer komme demnach nicht voll bei Verbraucherinnen und Verbrauchern an.,https://image.stern.de/37366746/t/7z/v1/w1440/r1.7778/-/adac--tankrabatt-wird-nicht-vollstaendig-an-verbraucher-weitergegeben--2-.jpg,2026-05-04T12:15:03Z,,"Kopiere den aktuellen Link
Zur Merkliste hinzufû¥gen
Der Tankrabatt greift und RohûÑl wird gû¥nstiger doch die Spritpreise sinken laut ADAC nicht stark genug. Die Ersparnis durch die gesenkte EnergiesãÎ [+2265 chars]",,de,'RohûÑl'
https://www.sueddeutsche.de/muenchen/muenchen-hauptbahnhof-fruehjahrsputz-li.3475191,https://www.sueddeutsche.de/muenchen/muenchen-hauptbahnhof-fruehjahrsputz-li.3475191,0,www.sueddeutsche.de,Verkehr in Mû¥nchen: Der Hauptbahnhof wird hûÊufiger gereinigt ã ein Schmuckstû¥ck wird er trotzdem nicht,"Kaugummis, Zigarettenkippen, Rollsplitt: ûber den Winter hat sich viel Dreck gesammelt. Nun startet die Bahn eine groû angelegte Putzaktion und die Stadt rûÊumt im Bahnhofsviertel auf.",https://www.sueddeutsche.de/2026/05/04/3e37c893-7f38-4b54-bd63-8b76fcc6d3b4.jpg?q=60&fm=webp&width=1200&rect=0%2C209%2C4000%2C2250,2026-05-04T13:55:09Z,,"Sollte es nicht selbstverstûÊndlich sein, dass die Stationen regelmûÊûig gereinigt werden? Das schon, erklûÊrt Mareike Schoppe, Chefin der 150 BahnhûÑfe im S-Bahnbereich Mû¥nchen. Aber viele ReinigungsarbãÎ [+3442 chars]",,de,'KûÊlte'
https://taz.de/Reform-des-Heizungsgesetzes/!6176120/,https://taz.de/Reform-des-Heizungsgesetzes/!6176120/,0,taz.de,Reform des Heizungsgesetzes: Kein Schutz fû¥r MieôÙteôÙr:inôÙnen,VerôÙmieôÙteôÙr:inôÙnen sollen sich teilweise an den Betriebskosten fû¥r neue Gas- und ûlheizungen beteiligen. Das wird sie nicht vom Einbau abhalten.,https://taz.de/picture/8417316/1200/41075687.jpeg,2026-05-04T14:57:00Z,,VerôÙmieôÙteôÙr:inôÙnen sollen sich teilweise an den Betriebskosten fû¥r neue Gas- und ûlheizungen beteiligen. Das wird sie nicht vom Einbau abhalten. mehr...,,de,'Gas'
https://www.faz.net/aktuell/rhein-main/wirtschaft/frittenfett-als-biokraftstoff-was-kuechenabfaelle-beitragen-koennen-200786898.html,https://www.faz.net/aktuell/rhein-main/wirtschaft/frittenfett-als-biokraftstoff-was-kuechenabfaelle-beitragen-koennen-200786898.html,0,www.faz.net,Frittenfett: Aus der Fritteuse in den Tank,Aus Kû¥chenabfûÊllen stellt das Unternehmen Mû¥nzer aus ûsterreich Biodiesel her und sammelt dafû¥r auch in Hessen ûl aus Fritteusen. Vielleicht sind es wichtige Tropfen gegen die RohûÑlknappheit.,https://media0.faz.net/image/w1200h627/65ac180a857a/w6144h3210x0y443o/202604/43601.0.1989888326/lecker-und-lukrativ.webp,2026-05-04T15:45:57Z,,"Knallgelb ist der Container auf dem Wertstoffhof in Neu-Isenburg. Er ûÊhnelt einem Glascontainer, ist aber nur halb so groû. Und es gibt noch einen wesentlichen Unterschied: hier sollen nûÊmlich nicht ãÎ [+2775 chars]",,de,'RohûÑl'
https://www.faz.net/aktuell/finanzen/finanzmarkt/spritpreis-die-tankrabatte-der-regierung-versagen-200795532.html,https://www.faz.net/aktuell/finanzen/finanzmarkt/spritpreis-die-tankrabatte-der-regierung-versagen-200795532.html,0,www.faz.net,Teure Spritpreise: Warum die Tankrabatte an den Tankstellen versagen,"So teuer wie im April war Tanken noch nie. Die Steuersenkung fû¥r Benzin wird bislang nur zum Teil an Autofahrer weitergegeben. An manchen Tankstellen bilden sich mittags kurz vor zwûÑlf Uhr Schlangen von all denjenigen, die noch schnell tanken wollen.",https://media0.faz.net/image/w1200h627/b93ee56ae36f/w6144h3210x0y443o/202605/43601.0.2036457650/jet-tankstelle-in-bamberg.webp,2026-05-04T19:32:49Z,,"Die meisten Autofahrer waren zuletzt nicht richtig glû¥cklich mit den neuen Regelungen fû¥r Tankstellen, wie Umfragen des Autoklubs ADAC zeigen. Mit zwei Eingriffen in den Tankstellenmarkt wollte die BãÎ [+5992 chars]",,de,'Spritpreise'
https://www.bild.de/news/wetter/kaeltewelle-trifft-deutschland-temperaturen-stuerzen-um-bis-zu-20-grad-ab-69f85e9ad3209c4cbd891532,https://www.bild.de/news/wetter/kaeltewelle-trifft-deutschland-temperaturen-stuerzen-um-bis-zu-20-grad-ab-69f85e9ad3209c4cbd891532,0,www.bild.de,Eisheilige kommen frû¥her - KûÊltewelle klaut uns 20 Grad,Polarluft rollt û¥ber Deutschland und bringt KûÊlte sowie anhaltenden Regen.,"https://images.bild.de/69f85e9ad3209c4cbd891532/ab13a79d2bf75cc66f9c2f92a7b0aaee,3697b3b?w=1280",2026-05-05T03:51:14Z,,"TTS-Player û¥berspringenArtikel weiterlesenJetzt kommt der WetterKnall: Statt Sonne satt bringt die neue Woche Regen, KûÊlte und einen Temperatursturz von regional bis zu 20 Grad! Es wird ungemû¥tlich: ãÎ [+3283 chars]",,de,'KûÊlte'
