index,url,valid,domain,title,description,image,published,archive,content,quote,language,keyword
https://www.faz.net/aktuell/rhein-main/wirtschaft/fernwaerme-wird-auch-in-frankfurt-teurer-die-heizkosten-werden-steigen-110471886.html,https://www.faz.net/aktuell/rhein-main/wirtschaft/fernwaerme-wird-auch-in-frankfurt-teurer-die-heizkosten-werden-steigen-110471886.html,0,www.faz.net,Heizkosten: Mainova erhöht Fernwärme-Preis,"Die Tarife in Frankfurt steigen um bis zu 36 Prozent. Hauptgrund dafür sind die Kosten für den Um- und Ausbau des Wärmenetzes. Der Energieversorger Mainova gibt sich überzeugt, dass sich diese Art des Heizens dennoch durchsetzen wird.",https://media1.faz.net/ppmedia/aktuell/1514016394/1.10471885/facebook_teaser/ein-schweisser-verbindet-zwei.jpg,2025-05-12T14:48:20Z,http://archive.md/20250512172742/https://www.faz.net/aktuell/rhein-main/wirtschaft/fernwaerme-wird-auch-in-frankfurt-teurer-die-heizkosten-werden-steigen-110471886.html,Bewohner von Häusern mit Fernwärme-Anschluss in Frankfurt müssen sich auf einen kräftigen Anstieg ihrer Heizkosten gefasst machen. Der örtliche Energieversorger Mainova erhöht zum 1. Juli die Wärmepr… [+5899 chars],,de,'Kohle'
https://www.stern.de/gesellschaft/regional/nordrhein-westfalen/flutkatastrophe--bad-muenstereifel-hat-nun-fruehwarnsystem-gegen-hochwasser-35716972.html,https://www.stern.de/gesellschaft/regional/nordrhein-westfalen/flutkatastrophe--bad-muenstereifel-hat-nun-fruehwarnsystem-gegen-hochwasser-35716972.html,0,www.stern.de,Flutkatastrophe: Bad Münstereifel hat nun Frühwarnsystem gegen Hochwasser,Im Juli 2021 hat das Hochwasser Millionenschäden angerichtet. Künftig will Bad Münstereifel besser gewappnet sein. Die Stadt überwacht nun die Wasserstände an der Erft und anderen Gewässern.,https://image.stern.de/35716974/t/ti/v1/w1440/r1.7778/-/12--gy2wjiypjhv6axs2048jpeg---3f80ca68c0d0e9bc.jpg,2025-05-12T16:10:51Z,https://web.archive.org/web/20250512190058/https://www.stern.de/gesellschaft/regional/nordrhein-westfalen/flutkatastrophe--bad-muenstereifel-hat-nun-fruehwarnsystem-gegen-hochwasser-35716972.html,"Kopiere den aktuellen Link
Zur Merkliste hinzufügen
Im Juli 2021 hat das Hochwasser Millionenschäden angerichtet. Künftig will Bad Münstereifel besser gewappnet sein. Die Stadt überwacht nun die Wa… [+1479 chars]",,de,'Hochwasser'
https://www.zeit.de/2025/19/fernwaerme-preisdeckel-heizkosten-verbraucher-preiskontrolle,https://www.zeit.de/2025/19/fernwaerme-preisdeckel-heizkosten-verbraucher-preiskontrolle,0,www.zeit.de,Fernwärme: Deckelt die Heizkosten,"Bei der Fernwärme sind Kunden ihrem Versorger ausgeliefert, ein echter Wettbewerb findet nicht statt. Es braucht eine strenge Preiskontrolle.",https://img.zeit.de/2025/19/fernwaerme-preisdeckel-heizkosten-verbraucher-preiskontrolle-bild/wide__1300x731,2025-05-12T16:48:43Z,https://web.archive.org/web/20250512021123/https://www.zeit.de/2025/19/fernwaerme-preisdeckel-heizkosten-verbraucher-preiskontrolle,"Über eine mollig warme Wohnung zu reden, ist derzeit nicht sonderlich beliebt. Zum einen passiert politisch weitaus Aufregenderes, zum anderen steigen draußen die Temperaturen und die Sonne scheint. … [+518 chars]",,de,'Heizkosten'
https://www.bild.de/sport/fussball/rettung-finanziell-wichtig-preussens-millionen-endspiel-682201933e1ca14e7f761e8d,https://www.bild.de/sport/fussball/rettung-finanziell-wichtig-preussens-millionen-endspiel-682201933e1ca14e7f761e8d,0,www.bild.de,Rettung finanziell wichtig - Preußens Millionen-Endspiel!,Für Zweitligist Preußen Münster geht es am Sonntag im heißen Saisonfinale beim SSV Ulm nicht nur um den Klassenerhalt. Sondern auch um richtig viel Kohle...,"https://images.bild.de/682201933e1ca14e7f761e8d/e52823d2129455e294d1a4f5fcc63b0f,b817ae99?w=1280",2025-05-12T17:02:49Z,https://web.archive.org/web/20250512200945/https://www.bild.de/sport/fussball/rettung-finanziell-wichtig-preussens-millionen-endspiel-682201933e1ca14e7f761e8d,"Noch einmal Vollgas für 90 Minuten. Alles raushauen, was im schwarz-weiß-grünen Tank ist. Um so am Sonntag in Ulm (15:30 Uhr/live bei Sky) den erhofften Klassenerhalt über die Ziellinie zu bringen...… [+4718 chars]",,de,'Kohle'
https://www.bild.de/politik/forscher-warnen-cyber-attacken-auf-krankenhaeuser-steigen-rasant-6821c09ff3279f6203e2e614,https://www.bild.de/politik/forscher-warnen-cyber-attacken-auf-krankenhaeuser-steigen-rasant-6821c09ff3279f6203e2e614,0,www.bild.de,Forscher warnen - Cyber-Attacken auf Krankenhäuser steigen rasant!,"Ein Blackout legte Spanien lahm, sorgte für Chaos – auch in der medizinischen Versorgung. Forscher warnen: Cyber-Attacken auf Krankenhäuser nehmen stark zu.","https://images.bild.de/6821c09ff3279f6203e2e614/7c2930311d39388895f8c1662392534e,c87002c5?w=1280",2025-05-12T20:32:10Z,http://archive.md/20250512212037/https://www.bild.de/politik/forscher-warnen-cyber-attacken-auf-krankenhaeuser-steigen-rasant-6821c09ff3279f6203e2e614,"Deutschland hat ein Problem: Cyber-Angriffe auf u.a. Krankenhäuser und Bankensysteme nehmen dramatisch zu.
Das Hasso-Plattner-Institut (HPI, Potsdam) warnt deshalb in BILD: Deutschland muss seine di… [+4044 chars]",,de,'Blackout'
https://www.zeit.de/news/2025-05/13/kinder-aus-migrantenfamilien-starten-spaeter-in-kita-zeit,https://www.zeit.de/news/2025-05/13/kinder-aus-migrantenfamilien-starten-spaeter-in-kita-zeit,0,www.zeit.de,Kinderbetreuung: Kinder aus Migrantenfamilien starten später in Kita-Zeit,Hier finden Sie Informationen zu dem Thema „Kinderbetreuung“. Lesen Sie jetzt „Kinder aus Migrantenfamilien starten später in Kita-Zeit“.,https://img.zeit.de/news/2025-05/13/kinder-aus-migrantenfamilien-starten-spaeter-in-kita-zeit-image-group/wide__1300x731,2025-05-13T02:04:35Z,,In Sachsen-Anhalt besuchen Kinder aus Familien mit Migrationshintergrund deutlich später die Kita als Kinder aus deutschen Familien. Während das Durchschnittsalter bei Kindern ohne Migrationshintergr… [+1902 chars],,de,'Kinder'
https://www.stern.de/gesellschaft/regional/bayern/museumstag--roemer--prunk-und-katakomben---der-museumstag-in-bayern-35717480.html,https://www.stern.de/gesellschaft/regional/bayern/museumstag--roemer--prunk-und-katakomben---der-museumstag-in-bayern-35717480.html,0,www.stern.de,"Museumstag: Römer, Prunk und Katakomben - der Museumstag in Bayern","München (lby) - Wie luxuriös lebten die Römer? Wie fühlt es sich in einem Kohlebergwerk an, tief unter der Erde? Und womit fing man in Schlössern früher",https://image.stern.de/35717482/t/WW/v1/w1440/r1.7778/-/13--32w4j5p2jgv11axs2048jpeg---f9014d580c17ef6c.jpg,2025-05-13T02:30:39Z,https://web.archive.org/web/20250513031552/https://www.stern.de/gesellschaft/regional/bayern/museumstag--roemer--prunk-und-katakomben---der-museumstag-in-bayern-35717480.html,"Kopiere den aktuellen Link
Zur Merkliste hinzufügen
Musizieren und essen wie die Römer oder in die Tiefe reisen? Das geht beim Internationalen Museumstag in Bayern.
Wie luxuriös lebten die Römer? … [+2111 chars]",,de,'Kohle'
https://www.bild.de/politik/inland/preisexplosion-bei-fernwaerme-deutsche-mieter-zahlen-mehr-6821e871c956e61cc27b57be,https://www.bild.de/politik/inland/preisexplosion-bei-fernwaerme-deutsche-mieter-zahlen-mehr-6821e871c956e61cc27b57be,0,www.bild.de,Abrechnungen ausgewertet - Heizkosten-Schock für Millionen Mieter,"Fernwärme, Gas und Öl: Heizkosten steigen für Millionen Deutsche, wie eine Ista-Analyse zeigt.","https://images.bild.de/6821e871c956e61cc27b57be/9a51c4c34851b836dc87ca63ec276820,d0c6add1?w=1280",2025-05-13T02:46:03Z,http://archive.md/20250513030331/https://www.bild.de/politik/inland/preisexplosion-bei-fernwaerme-deutsche-mieter-zahlen-mehr-6821e871c956e61cc27b57be,"Millionen deutsche Mieter müssen sich auf gestiegene Heizkosten und entsprechende Nachzahlungen gefasst machen!
Das ergab eine Auswertung des Immobiliendienstleisters Ista von rund 900.000 Nebenkost… [+307 chars]",,de,'Heizkosten'
https://www.faz.net/aktuell/finanzen/pro-finanzen/den-msci-world-fuer-kinder-kaufen-mit-dem-richtigen-etf-110471684.html,https://www.faz.net/aktuell/finanzen/pro-finanzen/den-msci-world-fuer-kinder-kaufen-mit-dem-richtigen-etf-110471684.html,0,www.faz.net,Damit am 18. Geburtstag 120.000 Euro im Depot sind,"Ob zur Taufe, Kommunion oder Konfirmation: Ein Junior-Depot ist ein schönes Geschenk für Kinder oder Heranwachsende. Mit dieser Anleitung kann es zum Erfolg werden.",https://media1.faz.net/ppmedia/aktuell/politik/3628938941/1.10471683/facebook_teaser_fplus/geldgeschenke-zur-konfirmation.jpg,2025-05-13T06:12:36Z,http://archive.md/20250513062326/https://www.faz.net/aktuell/finanzen/pro-finanzen/den-msci-world-fuer-kinder-kaufen-mit-dem-richtigen-etf-110471684.html,"Der Mai ist gekommen und mit ihm die Zeit der Taufen, Kommunionen und Konfirmationen. Ein beliebtes Geschenk ist und bleibt: Geld. Von der Goldmünze zur Taufe über Aktien von Firmen, die es heute gar… [+151 chars]",,de,'Kinder'
https://www.diepresse.com/19678270/das-ist-der-wahre-grund-fuer-den-blackout-in-spanien-vor-zwei-wochen,https://www.diepresse.com/19678270/das-ist-der-wahre-grund-fuer-den-blackout-in-spanien-vor-zwei-wochen,0,www.diepresse.com,Das ist der wahre Grund für den Blackout in Spanien vor zwei Wochen,"Ein neuer detaillierter Bericht zeigt nun, wer als Kandidat für den Stromausfall in Spanien und Teilen Portugals gilt. Das ganze spielte sich im Süden von Spanien ab.",https://img.diepresse.com/public/incoming/kvzbo2-397030160.jpg/alternates/DPR_SOCIAL_NACHRICHTEN/397030160.jpg,2025-05-13T07:45:38Z,,"Ein neuer detaillierter Bericht zeigt nun, wer als Kandidat für den Stromausfall in Spanien und Teilen Portugals gilt. Das ganze spielte sich im Süden von Spanien ab.
Dem landesweiten Stromausfall i… [+2536 chars]",,de,'Blackout'
https://www.focus.de/immobilien/abzocke-am-bau-rentnerin-ingrid-fiel-auf-dachhai-herein-so-koennen-sie-sich-schuetzen_83dd2f04-f9e9-418e-ac0c-7c2274b84658.html,https://www.focus.de/immobilien/abzocke-am-bau-rentnerin-ingrid-fiel-auf-dachhai-herein-so-koennen-sie-sich-schuetzen_83dd2f04-f9e9-418e-ac0c-7c2274b84658.html,0,www.focus.de,"Abzocke am Bau: Rentnerin Ingrid fiel auf ""Dachhai"" herein – so können Sie sich schützen","Sogenannte ""Dachhaie"" kosten Bürgerinnen und Bürger oftmals viel Geld. Angeblich lose Ziegel, Undichte, Schimmel - die Liste der Mängel ist bei diesen Betrieben meist lang. Zu lang. Dabei ist es einfach, ihren Betrug zu durchkreuzen. Rentnerin Ingrid Eichener…",https://quadro.burda-forward.de/ctf/92b36268-0f9c-43b1-bcde-2db3ee17412f.e5046914-f3dd-48d9-96ab-455bc88c6a98.jpeg?im=RegionOfInterestCrop%3D%281200%2C630%29%2CregionOfInterest%3D%28321%2C140%29&hash=5c8564074993b8cabc67ec3abb3f0911d8ef30b37c355c297232edbd62c6ab9b,2025-05-13T08:44:31Z,https://web.archive.org/web/20250513225051/https://www.focus.de/immobilien/abzocke-am-bau-rentnerin-ingrid-fiel-auf-dachhai-herein-so-koennen-sie-sich-schuetzen_83dd2f04-f9e9-418e-ac0c-7c2274b84658.html,"Obacht! Dachdeckerfirmen täuschen Schäden vor und zocken dann gnadenlos ab - wie bei Frau Eichiner aus Gröbenzell. Dabei ist ein Dachcheck sinnvoll, um größere Schäden zu vermeiden. Man muss nur den … [+2421 chars]",,de,'Schimmel'
https://www.zeit.de/gesellschaft/zeitgeschehen/2025-05/christina-block-sorgerecht-kinder-daenemark-urteil-verfassungsgericht,https://www.zeit.de/gesellschaft/zeitgeschehen/2025-05/christina-block-sorgerecht-kinder-daenemark-urteil-verfassungsgericht,0,www.zeit.de,Steakhaus-Erbin: Christina Block scheitert in Sorgerrechtsstreit vor Verfassungsgericht,Das Bundesverfassungsgericht sieht sich nicht zuständig für den Sorgerechtsstreit von Christina Block. Die in Dänemark lebenden Kinder dürfen beim Vater bleiben.,https://img.zeit.de/administratives/sharing/fallback-image/wide__1300x731,2025-05-13T12:11:43Z,http://archive.md/20250513125312/https://www.zeit.de/gesellschaft/zeitgeschehen/2025-05/christina-block-sorgerecht-kinder-daenemark-urteil-verfassungsgericht,"Im Sorgerechtsstreit um zwei ihrer Kinder hat die Erbin der Steakhaus-Kette Block House, Christina Block, eine Niederlage vor dem Bundesverfassungsgericht erlitten. Das Gericht entschied, dass die vo… [+830 chars]",,de,'Kinder'
https://www.tagesspiegel.de/wirtschaft/viele-mieter-werden-mehr-zahlen-mussen-als-je-zuvor-heizkosten-steigen-offenbar-bis-zu-27-prozent-13684372.html,https://www.tagesspiegel.de/wirtschaft/viele-mieter-werden-mehr-zahlen-mussen-als-je-zuvor-heizkosten-steigen-offenbar-bis-zu-27-prozent-13684372.html,0,www.tagesspiegel.de,„Viele Mieter werden mehr zahlen müssen als je zuvor“: Heizkosten steigen offenbar bis zu 27 Prozent,"Fernwärmekunden müssen sich auf deutlich steigende Heizkostenabrechnungen einstellen, teilt der Immobiliendienstleister Ista mit. Auch für Gaskunden wird es demnach teurer.",https://www.tagesspiegel.de/images/13124938/alternates/BASE_16_9_W1400/1738330450000/thermostat-an-einem-heizkorper.jpeg,2025-05-13T12:46:35Z,http://archive.md/20250513132355/https://www.tagesspiegel.de/wirtschaft/viele-mieter-werden-mehr-zahlen-mussen-als-je-zuvor-heizkosten-steigen-offenbar-bis-zu-27-prozent-13684372.html,"Der Immobiliendienstleister Ista rechnet bei den Heizkostenabrechnungen für das vergangene Jahr mit deutlich gestiegenen Kosten. 
Die Tagesspiegel-App Aktuelle Nachrichten, Hintergründe und Analysen… [+2171 chars]",,de,'Heizkosten'
https://www.dw.com/de/weltraum-neue-deutsche-raumkapsel-startet-f%C3%BCr-die-forschung/a-72521498,https://www.dw.com/de/weltraum-neue-deutsche-raumkapsel-startet-f%C3%BCr-die-forschung/a-72521498,0,www.dw.com,Weltraum: Neue deutsche Raumkapsel startet für die Forschung,"Sie heißt Nxy, wie die griechische Göttin der Nacht. Der erste Auftrag für Deutschlands erstes Raumschiff: wissenschaftliche Experimente in der Schwerelosigkeit, vor allem mit Schimmelsporen. ""Mission possible"" (Mission möglich) - diesen hoffnungsvollen Namen…",https://static.dw.com/image/72522099_6.jpg,2025-05-13T12:56:00Z,,"""Mission possible"" (Mission möglich)  - diesen hoffnungsvollen Namen hat die deutsche Entwicklerfirma, The Exploration Company (TEC), dem Jungfernflug ihres Raumschiffs gegeben. Voraussichtlich Anfan… [+3971 chars]",,de,'Schimmel'
https://taz.de/Nach-unaufgeklaertem-Blackout/!6084594/,https://taz.de/Nach-unaufgeklaertem-Blackout/!6084594/,0,taz.de,Nach unaufgeklärtem Blackout: Spanische Atomlobby sieht ihre große Chance,"Nach dem Mega-Stromausfall setzt die spanische Opposition alles daran, die Energiewende dafür verantwortlich zu machen. Ihre Alternative: Atomstrom.",https://taz.de/picture/7694916/1200/38376192-1.jpeg,2025-05-13T13:04:00Z,,"Nach dem Mega-Stromausfall setzt die spanische Opposition alles daran, die Energiewende dafür verantwortlich zu machen. Ihre Alternative: Atomstrom. mehr...",,de,'Blackout'
https://www.tagesspiegel.de/berlin/kinder-sind-keine-kleinen-erwachsenen-als-schulerin-rate-ich-zu-gemeinsamen-klassenregeln-13655719.html,https://www.tagesspiegel.de/berlin/kinder-sind-keine-kleinen-erwachsenen-als-schulerin-rate-ich-zu-gemeinsamen-klassenregeln-13655719.html,0,www.tagesspiegel.de,Kinder sind keine kleinen Erwachsenen: Als Schülerin rate ich zu gemeinsamen Klassenregeln,"Natürlich braucht es Ansagen, wenn rote Linien überschritten werden. Doch Kinder sind nun mal keine kleinen Erwachsenen. Unterricht muss spannend sein und Regeln sollten gemeinsam erarbeitet werden.",https://www.tagesspiegel.de/images/13647730/alternates/BASE_16_9_W1400/1747147716000/karla-finzel-schulerpraktikantin-tagesspiegel.jpeg,2025-05-13T14:51:06Z,,"Es gibt eine wichtige Sache, die Lehrer und Lehrerinnen meiner Meinung nach viel zu oft vergessen: Kinder sind keine kleinen Erwachsenen. Sie haben einen stärkeren Bewegungsdrang und wenn Kinder im U… [+3327 chars]",,de,'Kinder'
https://www.bild.de/news/ausland/eltern-aus-horror-haus-in-spanien-tragen-auch-im-knast-masken-68231624578c1a37977595e2,https://www.bild.de/news/ausland/eltern-aus-horror-haus-in-spanien-tragen-auch-im-knast-masken-68231624578c1a37977595e2,0,www.bild.de,Sie sperrten ihre Kinder in Spanien ein - Eltern aus Horror-Haus tragen auch im Knast Masken,"Sie sollen auch im Gefängnis Angst vor einer Ansteckung haben. Das deutsche Paar sitzt in Haft, weil sie ihre Kinder jahrelang einsperrten.","https://images.bild.de/68231624578c1a37977595e2/84e452bb69608d2d36c021763a2a9131,564b35df?w=1280",2025-05-13T14:52:00Z,,"Oviedo (Spanien) Ihre Angst vor der Corona-Pandemie soll sie dazu gebracht haben, ihre drei Söhne jahrelang einzusperren. Das deutsche Ehepaar Christian und Melissa S. zog mit seinen Zwillingen (8) u… [+2070 chars]",,de,'Kinder'
https://www.morgenpost.de/bezirke/treptow-koepenick/article408996933/perfekter-sound-dieses-event-im-fez-wuhlheide-begeistert-kinder.html,https://www.morgenpost.de/bezirke/treptow-koepenick/article408996933/perfekter-sound-dieses-event-im-fez-wuhlheide-begeistert-kinder.html,0,www.morgenpost.de,Perfekter Sound: Dieses Event im FEZ Wuhlheide begeistert Kinder,Am kommenden Wochenende können Kinder und Jugendliche aus Berlin in Treptow-Köpenick in die Welt elektronischer Musik eintauchen. Da erwartet sie im FEZ in der Wuhlheide.,https://img.sparknews.funkemedien.de/408996932/408996932_1747053580_v16_9_1600.jpeg,2025-05-13T15:15:00Z,,"Berlin. Am kommenden Wochenende können Kinder und Jugendliche aus Berlin in die Welt elektronischer Musik eintauchen. Da erwartet sie im FEZ.
Das FEZ in der Wuhlheide lässt sich immer wieder etwas e… [+3066 chars]",,de,'Kinder'
https://burgenland.orf.at/stories/3305162/,https://burgenland.orf.at/stories/3305162/,0,burgenland.orf.at,Lokalaugenschein: Handyverbot in MS Großwarasdorf,"Seit 1. Mai sind Handys bis zur 8. Schulstufe per Verordnung verboten. Im Burgenland betrifft das mehr als 19.000 Kinder. In der Mittelschule Großwarasdorf (Oberpullendorf) gab es bereits eine ähnliche Handy-Regelung, die nun verschärft wurde.",https://ibs.orf.at/bgl?image=https%3A%2F%2Foekastatic.orf.at%2Fmims%2F2025%2F20%2F99%2Fcrops%2Fw%3D1200%2Ch%3D627%2Cq%3D75%2F2624001_master_1007699_handy2.jpg%3Fs%3D73807cb52443211a64404e5e05f49c0a572729f1,2025-05-13T15:58:46Z,,"Seit dem 1. Mai müssen die Schülerinnen und Schüler der Zweisprachigen Mittelschule in Großwarasdorf die Handys, Smartwatches oder andere Geräte gleich beim Eingang ausschalten und verstauen. Auch hi… [+1459 chars]",,de,'Kinder'
https://www.morgenpost.de/berlin/article409003726/in-diesen-bezirken-sind-berlins-kinder-besonders-unsportlich.html,https://www.morgenpost.de/berlin/article409003726/in-diesen-bezirken-sind-berlins-kinder-besonders-unsportlich.html,0,www.morgenpost.de,In diesen Bezirken sind Berlins Kinder besonders unsportlich,Mit dem Deutschen Motorik-Test (DMT) wird die Leistungsfähigkeit der Drittklässler untersucht. Besonders drei Berliner Bezirke bereiten Sorge.,https://img.sparknews.funkemedien.de/407168476/407168476_1747141146_v16_9_1600.jpeg,2025-05-13T16:00:00Z,http://archive.md/20250513164807/https://www.morgenpost.de/berlin/article409003726/in-diesen-bezirken-sind-berlins-kinder-besonders-unsportlich.html,Berlin. Mit dem Deutschen Motorik-Test (DMT) wird die Leistungsfähigkeit der Drittklässler untersucht. Besonders drei Berliner Bezirke bereiten Sorge.,,de,'Kinder'
https://www.morgenpost.de/ratgeber-wissen/article409005277/mutter-kind-verhaeltnis-forscher-sehen-parallele-bei-schimpansen.html,https://www.morgenpost.de/ratgeber-wissen/article409005277/mutter-kind-verhaeltnis-forscher-sehen-parallele-bei-schimpansen.html,0,www.morgenpost.de,Mutter-Kind-Verhältnis: Forscher sehen Parallele bei Schimpansen,Auch bei Menschenaffen wie Schimpansen kann eine gestörte Beziehung zur Mutter das restliche Leben von Kindern entscheidend prägen.,https://img.sparknews.funkemedien.de/409006936/409006936_1747136926_v16_9_1600.jpeg,2025-05-13T17:09:17Z,,"Berlin. Auch bei Menschenaffen wie Schimpansen kann eine gestörte Beziehung zur Mutter das restliche Leben von Kindern entscheidend prägen.
Die erste und wohl prägendste Beziehung der meisten Mensch… [+4242 chars]",,de,'Kinder'
https://stadt-bremerhaven.de/gemini-wird-zum-universellen-assistenten-fuer-alle-android-geraete/,https://stadt-bremerhaven.de/gemini-wird-zum-universellen-assistenten-fuer-alle-android-geraete/,0,stadt-bremerhaven.de,Gemini wird zum universellen Assistenten für alle Android-Geräte,"Google gibt Gas und rollt seinen KI-Assistenten Gemini auf weitere Android-Plattformen aus. Nach dem erfolgreichen Start auf Smartphones wird die künstliche Intelligenz nun bald auch auf Smartwatches mit Wear OS, Android Auto, Google TV und sogar auf AR/VR-He…",https://stadt-bremerhaven.de/wp-content/uploads/2025/05/TAS_Gemini_Across_Devices_Blog_H.width-2200.format-webp.jpg,2025-05-13T17:19:56Z,,Google gibt Gas und rollt seinen KI-Assistenten Gemini auf weitere Android-Plattformen aus. Nach dem erfolgreichen Start auf Smartphones wird die künstliche Intelligenz nun bald auch auf Smartwatches… [+2129 chars],,de,'Kinder'
https://www.bild.de/news/in-baden-wuerttemberg-2-kinder-9-von-auto-erfasst-maedchen-in-lebensgefahr-682388fe700e7511edfc29b7,https://www.bild.de/news/in-baden-wuerttemberg-2-kinder-9-von-auto-erfasst-maedchen-in-lebensgefahr-682388fe700e7511edfc29b7,0,www.bild.de,In Baden-Württemberg - Auto erfasst 2 Kinder – Mädchen (9) in Lebensgefahr,Zwei Kinder wurden am Dienstag in Ba.-Wü. auf einem Gehweg von einem Auto angefahren.,"https://images.bild.de/682388fe700e7511edfc29b7/2c623ccc888c78b7dcee7b65b1a95d30,499042d6?w=1280",2025-05-13T18:06:03Z,http://archive.md/20250513195349/https://www.bild.de/news/in-baden-wuerttemberg-2-kinder-9-von-auto-erfasst-maedchen-in-lebensgefahr-682388fe700e7511edfc29b7,"Dornstadt Schrecklicher Unfall in Baden-Württemberg: Zwei neunjährige Kinder wurden am Dienstagnachmittag auf dem Gehweg von einem Auto angefahren und schwer verletzt.
Das Drama ereignete sich gegen… [+990 chars]",,de,'Kinder'
https://www.kraftfuttermischwerk.de/blogg/ueber-pfeifhasen/,https://www.kraftfuttermischwerk.de/blogg/ueber-pfeifhasen/,0,www.kraftfuttermischwerk.de,Über Pfeifhasen,"Heute lernte ich: Pfeifhasen haben in der Zeit, in der kein Schnee liegt, richtig zu tun, um Vorräte anzusammeln. „Die Nahrung der Pfeifhasen besteht vorwiegend…Mehr lesen ->Über Pfeifhasen",https://www.kraftfuttermischwerk.de/blogg/wp-content/uploads2/2025/05/Bildschirmfoto-2025-05-14-um-07.40.18.jpg,2025-05-14T05:40:45Z,,"Heute lernte ich: Pfeifhasen haben in der Zeit, in der kein Schnee liegt, richtig zu tun, um Vorräte anzusammeln. 
„Die Nahrung der Pfeifhasen besteht vorwiegend aus Gräsern, Kräutern und Pflanzenst… [+397 chars]",,de,'Schnee'
https://www.brigitte.de/leben/sprueche-aus-den-wechseljahren--erkennst-du-dich-wieder--13981652.html,https://www.brigitte.de/leben/sprueche-aus-den-wechseljahren--erkennst-du-dich-wieder--13981652.html,0,www.brigitte.de,"Hitzig und ehrlich: ""Ich habe keine Hitzewallungen, ich mache mich unabhängig von Heizkosten""","Willkommen in den Wechseljahren! Hitzewallung, Heulkrampf, Hormonchaos – und das alles vor dem ersten Kaffee. Wetten du erkennst dich wieder?",https://image.brigitte.de/13982470/t/Pj/v2/w1440/r1.7778/-/momente-wechseljahre-teaser.jpg,2025-05-14T08:17:00Z,https://web.archive.org/web/20250514094122/https://www.brigitte.de/leben/sprueche-aus-den-wechseljahren--erkennst-du-dich-wieder--13981652.html,"Willkommen in den Wechseljahren! Wenn der Körper neue Wege geht, sind Überraschungen vorprogrammiert. Diese Strecke sammelt ehrliche, alltägliche Szenen aus einer Zeit des hormonellen Wandels mal zum… [+1709 chars]",,de,'Heizkosten'
https://www.faz.net/aktuell/stil/eltern-familie/toxische-eltern-wirken-nach-aussen-oft-normal-woran-man-sie-dennoch-erkennt-110449802.html,https://www.faz.net/aktuell/stil/eltern-familie/toxische-eltern-wirken-nach-aussen-oft-normal-woran-man-sie-dennoch-erkennt-110449802.html,0,www.faz.net,Woran erkennt man toxische Eltern?,Toxische Eltern wirken nach außen oft ganz normal. Auch Kinder hinterfragen das Verhalten oft nicht. Es gibt aber eindeutige Hinweise.,https://media1.faz.net/ppmedia/aktuell/85534826/1.10449799/facebook_teaser_fplus/toxische-eltern-machen-ihre.jpg,2025-05-14T09:52:38Z,http://archive.md/20250514121848/https://www.faz.net/aktuell/stil/eltern-familie/toxische-eltern-wirken-nach-aussen-oft-normal-woran-man-sie-dennoch-erkennt-110449802.html,"Vor drei Jahren erzählte Wolfgang Scheck seiner Mutter am Rande einer Familienfeier stolz, dass er von Beruf Uhrmacher bei einem Frankfurter Juwelier eine in seiner Freizeit selbst entworfene und geb… [+426 chars]",,de,'Kinder'
https://www.zeit.de/arbeit/2025-05/diskussion-erbschaft-konflikt-geschwister-zusammenhalt,https://www.zeit.de/arbeit/2025-05/diskussion-erbschaft-konflikt-geschwister-zusammenhalt,0,www.zeit.de,"Erbschaft: ""Die Kinder müssen jetzt meine Kindheit nachspielen""",Fünf Geschwister bekommen nach dem Tod der Mutter ein altes Bauernhaus. Und diskutieren über jedes Detail. Wie vererbt man Zusammenhalt?,https://img.zeit.de/arbeit/2025-05/diskussion-erbschaft-konflikt-geschwister-zusammenhalt-2/wide__1300x731,2025-05-14T11:13:45Z,http://archive.md/20250514112430/https://www.zeit.de/arbeit/2025-05/diskussion-erbschaft-konflikt-geschwister-zusammenhalt,"Wie fühlt es sich an, plötzlich
Erbe
zu sein? Hört man auf zu arbeiten, oder hat man noch mehr Arbeit damit, das
Geld zu investieren? Macht das unerwartete Vermögen glücklich, oder streitet
man s… [+546 chars]",,de,'Kinder'
