index,url,valid,domain,title,description,image,published,archive,content,quote,language,keyword
https://www.handelsblatt.com/politik/deutschland/energie-ab-2024-sollen-neue-oel-und-gasheizungen-verboten-werden-/29006986.html,https://www.handelsblatt.com/politik/deutschland/energie-ab-2024-sollen-neue-oel-und-gasheizungen-verboten-werden-/29006986.html,0,www.handelsblatt.com,Gesetzentwurf: Habeck und Geywitz wollen neue reine Öl- und Gasheizungen ab 2024 verbieten,"Ein Referentenentwurf sieht zudem vor, dass solche Anlagen 20 Jahre später gänzlich verschwinden müssen. Die Umsetzung der Pläne könnte an verfügbaren Kapazitäten scheitern.",https://www.handelsblatt.com/images/robert-habeck/29007120/2-format2003.jpg,2023-03-01T12:29:28Z,https://web.archive.org/web/20230301133807/https://www.handelsblatt.com/politik/deutschland/energie-ab-2024-sollen-neue-oel-und-gasheizungen-verboten-werden-/29006986.html,"Robert HabeckDer Wirtschaftsminister will den Einbau neuer Öl- und Gasheizungen untersagen.
(Foto: IMAGO/Metodi Popow) 
Berlin, Düsseldorf Bundeswirtschaftsminister Robert Habeck (Grüne) und Bundes… [+1098 chars]",,de,'Gas'
https://www.bild.de/regional/ruhrgebiet/politik-und-wirtschaft/michael-lewis-uebernimmt-bei-uniper-neuer-chef-fuer-den-gas-riesen-83061186.bild.html,https://www.bild.de/regional/ruhrgebiet/politik-und-wirtschaft/michael-lewis-uebernimmt-bei-uniper-neuer-chef-fuer-den-gas-riesen-83061186.bild.html,0,www.bild.de,Michael Lewis übernimmt bei Uniper - Neuer Boss für den Gas-Riesen,Eon-Manager Michael Lewis wird Vorstandschef des verstaatlichten Gasimporteurs Uniper.Foto: WOLFGANG RATTAY/REUTERS,"https://images.bild.de/63ff38f299202577d39374d2/a717b68f1827c9d43027dd4bab6cb352,67c0934f?w=1280",2023-03-01T12:51:01Z,,"Erwarteter Rückgang bleibt aus: Inflation im Februar weiter bei 8,7 Prozent 
Erwarteter Rückgang bleibt aus: Inflation im Februar weiter bei 8,7 Prozent 
Erwarteter Rückgang bleibt aus: Inflation i… [+577 chars]",,de,'Gas'
https://www.stern.de/news/streit-in--ampel--ueber-verbot-von-oel--und-gasheizungen-ab-2024-spitzt-sich-zu-33241358.html,https://www.stern.de/news/streit-in--ampel--ueber-verbot-von-oel--und-gasheizungen-ab-2024-spitzt-sich-zu-33241358.html,0,www.stern.de,"Streit in ""Ampel"" über Verbot von Öl- und Gasheizungen ab 2024 spitzt sich zu","Der Streit zwischen der FDP und den Koalitionspartnern über das geplante Verbot neuer Öl- und Gasheizungen ab 2024 spitzt sich zu. Während die Liberalen am Mittwoch Widerstand gegen die Pläne ankündigten, erinnerten die Grünen die Partei an zuvor getroffene V…",https://image.stern.de/33242382/t/it/v1/w1440/r1.7778/-/01--thermostat-einer-heizung---9bcdbcd0f9998bdd.jpg,2023-03-01T13:00:43Z,https://web.archive.org/web/20230301132248/https://www.stern.de/news/streit-in--ampel--ueber-verbot-von-oel--und-gasheizungen-ab-2024-spitzt-sich-zu-33241358.html,Der Streit zwischen der FDP und den Koalitionspartnern über das geplante Verbot neuer Öl- und Gasheizungen ab 2024 spitzt sich zu. Während die Liberalen am Mittwoch Widerstand gegen die Pläne ankündi… [+3718 chars],,de,'Gas'
https://www.focus.de/finanzen/gesetzesentwurf-von-robert-habeck-aus-fuer-oelheizung-wie-focus-online-leser-auf-das-angekuendigte-gesetz-reagieren_id_187077953.html,https://www.focus.de/finanzen/gesetzesentwurf-von-robert-habeck-aus-fuer-oelheizung-wie-focus-online-leser-auf-das-angekuendigte-gesetz-reagieren_id_187077953.html,0,www.focus.de,Gesetzesentwurf - Bürger ärgern sich über Habecks Heizungs-Hammer und haben eine Hoffnung,"Das Vorhaben der Bundesregierung, das Verbot von reinen Öl- oder Gasheizungen vorzuziehen, sorgt unter Hausbesitzern für Aufruhr. Reaktionen von FOCUS-online-Lesern zeigen, wie groß die Unsicherheit ist.Von FOCUS-online-Redakteurin Mirjam Moll",https://p6.focus.de/img/fotos/id_187048837/habeck1.jpg?im=Crop%3D%280%2C72%2C3467%2C1736%29%3BResize%3D%281200%2C627%29&impolicy=perceptual&quality=medium&hash=46c9e4171cb1bd6ad24f5710ee62869d85bb26367e2aeb53835b97256cb9bee0,2023-03-01T13:10:54Z,https://web.archive.org/web/20230301145406/https://www.focus.de/finanzen/gesetzesentwurf-von-robert-habeck-aus-fuer-oelheizung-wie-focus-online-leser-auf-das-angekuendigte-gesetz-reagieren_id_187077953.html,"Das Vorhaben der Bundesregierung, das Verbot von reinen Öl- oder Gasheizungen vorzuziehen, sorgt unter Hausbesitzern für Aufruhr. Reaktionen von FOCUS-online-Lesern zeigen, wie groß die Unsicherheit … [+5042 chars]",,de,'Gas'
https://www.sueddeutsche.de/wirtschaft/inflation-deutschland-preise-1.5760629,https://www.sueddeutsche.de/wirtschaft/inflation-deutschland-preise-1.5760629,0,www.sueddeutsche.de,"Verbraucherpreise: Inflation liegt weiter bei 8,7 Prozent","Das Statistische Bundesamt veröffentlicht seine Schätzung für den Februar: Vor allem Lebensmittel kosten deutlich mehr, der Anstieg der Energiekosten ist nicht mehr ganz so hoch.",https://www.sueddeutsche.de/image/sz.1.5760630/1200x675?v=1677677689,2023-03-01T13:17:13Z,https://web.archive.org/web/20230301133843/https://www.sueddeutsche.de/wirtschaft/inflation-deutschland-preise-1.5760629,"Das Statistische Bundesamt veröffentlicht seine Schätzung für den Februar: Vor allem Lebensmittel kosten deutlich mehr, der Anstieg der Energiekosten ist nicht mehr ganz so hoch.Die Inflation in Deut… [+1990 chars]",,de,'Gas'
https://www.focus.de/immobilien/wohnen/verbot-von-neuen-oel-und-gaskesseln-wann-sie-laut-habecks-heizungsverbot-ihr-altes-geraet-austauschen-muessen_id_187149814.html,https://www.focus.de/immobilien/wohnen/verbot-von-neuen-oel-und-gaskesseln-wann-sie-laut-habecks-heizungsverbot-ihr-altes-geraet-austauschen-muessen_id_187149814.html,0,www.focus.de,Verbot von neuen Öl- und Gaskesseln - Wann Sie laut Habecks Heizungsverbot Ihr altes Gerät austauschen müssen,"Wenn die Temperaturen im Wohnzimmer auch bei Minusgraden angenehm warm sind, liegt das in Deutschland oft an Gas und Öl. Das soll sich ändern. Die Bundesregierung will schon ab 2024 neue Gas- und Öl-Heizungen verbieten. Das trifft alle, die ihre alte Anlage f…",https://p6.focus.de/img/fotos/id_187150453/gettyimages-1367981681.jpg?im=Crop%3D%280%2C290%2C3461%2C1730%29%3BResize%3D%281200%2C627%29&impolicy=perceptual&quality=medium&hash=ac2601585296c32cb9d9c23dc234bcc29d544551cad80fd4173c271af9e67a5a,2023-03-01T13:39:13Z,https://web.archive.org/web/20230301145507/https://www.focus.de/immobilien/wohnen/verbot-von-neuen-oel-und-gaskesseln-wann-sie-laut-habecks-heizungsverbot-ihr-altes-geraet-austauschen-muessen_id_187149814.html,"Wenn die Temperaturen im Wohnzimmer auch bei Minusgraden angenehm warm sind, liegt das in Deutschland oft an Gas und Öl. Das soll sich ändern. Die Bundesregierung will schon ab 2024 neue Gas- und Öl-… [+5846 chars]",,de,'Gas'
https://www.tagesspiegel.de/politik/verbot-neuer-ol-und-gasheizungen-grune-und-spd-wundern-sich-uber-widerstand-der-fdp-9435053.html,https://www.tagesspiegel.de/politik/verbot-neuer-ol-und-gasheizungen-grune-und-spd-wundern-sich-uber-widerstand-der-fdp-9435053.html,0,www.tagesspiegel.de,Verbot neuer Öl- und Gasheizungen: Grüne und SPD wundern sich über Widerstand der FDP,Die Parteien Grüne und SPD haben auf die Reaktion der FDP bezüglich des ab dem Jahr 2024 geplanten Verbots von neuen Öl- und Gasheizungen reagiert.,https://www.tagesspiegel.de/politik/images/anlieferung-von-heizol/alternates/BASE_16_9_W1400/anlieferung-von-heizoel.jpeg,2023-03-01T14:12:14Z,https://web.archive.org/web/20230301142352/https://www.tagesspiegel.de/politik/verbot-neuer-ol-und-gasheizungen-grune-und-spd-wundern-sich-uber-widerstand-der-fdp-9435053.html,"Die Grünen haben die Reaktion der FDP auf das geplante Verbot von Öl- und Gasheizungen ab 2024 kritisiert. Das sei eine Vereinbarung aus dem Koalitionsvertrag, sagte Parteichef Omid Nouripour den Sen… [+3965 chars]",,de,'Gas'
https://www.focus.de/politik/der-china-versteher/analyse-vom-china-versteher-xi-hat-seine-duestere-diktatoren-allianz-auf-duennem-eis-gebaut_id_187073580.html,https://www.focus.de/politik/der-china-versteher/analyse-vom-china-versteher-xi-hat-seine-duestere-diktatoren-allianz-auf-duennem-eis-gebaut_id_187073580.html,0,www.focus.de,Analyse vom China-Versteher - Xi hat seine düstere Diktatoren-Allianz auf dünnem Eis gebaut,"China gibt sich im russischen Angriffskrieg gegen die Ukraine neutral, dabei wäre die Volksrepublik sehr an einem Sieg durch Putin interessiert. Die Freundschaft der beiden Staaten ist enorm wichtig für Chinas Allianz der Diktaturen.Von FOCUS-online-Gastautor…",https://p6.focus.de/img/fotos/id_187074841/xi-putin.jpg?im=Crop%3D%280%2C210%2C3600%2C1800%29%3BResize%3D%281200%2C627%29&hash=9e17d86768eacb9a5fa682f5f82d85e84fc940b9d98e3399df556d40201827b8,2023-03-01T14:25:37Z,https://web.archive.org/web/20230301145451/https://www.focus.de/politik/der-china-versteher/analyse-vom-china-versteher-xi-hat-seine-duestere-diktatoren-allianz-auf-duennem-eis-gebaut_id_187073580.html,"China gibt sich im russischen Angriffskrieg gegen die Ukraine neutral, dabei wäre die Volksrepublik sehr an einem Sieg durch Putin interessiert. Die Freundschaft der beiden Staaten ist enorm wichtig … [+4297 chars]",,de,'Gas'
https://www.stern.de/news/aussenminister--ukraine-hat-schwierigsten-winter-ihrer-geschichte-ueberstanden-33242732.html,https://www.stern.de/news/aussenminister--ukraine-hat-schwierigsten-winter-ihrer-geschichte-ueberstanden-33242732.html,0,www.stern.de,Außenminister: Ukraine hat schwierigsten Winter ihrer Geschichte überstanden,"Die Ukraine hat nach den Worten ihres Außenministers den schwierigsten Winter ihrer Geschichte überstanden. ""Er war kalt und dunkel, aber wir waren unbesiegbar"", erklärte Außenminister Dmytro Kuleba am Mittwoch. Staatschef Wolodymyr Selenskyj verwies darauf, …",https://image.stern.de/33242734/t/Xy/v1/w1440/r1.7778/-/01--eine-aeltere-frau-in-ihrem-zerschossenen-hinterhof-nahe-bachmut---60ac1a91493a82ae.jpg,2023-03-01T14:51:18Z,https://web.archive.org/web/20230301150535/https://www.stern.de/news/aussenminister--ukraine-hat-schwierigsten-winter-ihrer-geschichte-ueberstanden-33242732.html,"Die Ukraine hat nach den Worten ihres Außenministers den schwierigsten Winter ihrer Geschichte überstanden. ""Er war kalt und dunkel, aber wir waren unbesiegbar"", erklärte Außenminister Dmytro Kuleba … [+2828 chars]",,de,'Gas'
https://www.focus.de/finanzen/interview-mit-daniel-foest-zwei-worte-fehlten-ploetzlich-in-habecks-heiz-gesetz_id_187135091.html,https://www.focus.de/finanzen/interview-mit-daniel-foest-zwei-worte-fehlten-ploetzlich-in-habecks-heiz-gesetz_id_187135091.html,0,www.focus.de,Interview mit Daniel Föst - Zwei Worte fehlten plötzlich in Habecks Heiz-Gesetz,"Das Quasi-Verbot von neuen Öl- und Gasheizungen ab dem Jahr 2024 hat für immenses Aufsehen gesorgt. Der FDP-Bauexperte Daniel Föst erklärt im Interview, warum er den Gesetzentwurf aus dem Wirtschaftsministerium für „brutal“ hält und was Robert Habeck bei dem …",https://p6.focus.de/img/fotos/id_187149474/habeck1.jpg?im=Crop%3D%280%2C79%2C3463%2C1732%29%3BResize%3D%281200%2C627%29&impolicy=perceptual&quality=medium&hash=76b5b85e2e49fc185ba00b09cab4f085f21633464fcc9086fa84bec9f859d440,2023-03-01T15:13:33Z,https://web.archive.org/web/20230301164045/https://www.focus.de/finanzen/interview-mit-daniel-foest-zwei-worte-fehlten-ploetzlich-in-habecks-heiz-gesetz_id_187135091.html,"Das Quasi-Verbot von neuen Öl- und Gasheizungen ab 2024 hat für Aufsehen gesorgt. Der FDP-Bauexperte Daniel Föst erklärt im Interview, warum er den Gesetzentwurf aus dem Wirtschafts- und Klimaministe… [+7423 chars]",,de,'Gas'
https://www.n-tv.de/wirtschaft/Preiserhoehungen-sind-ein-gefaehrliches-Spiel-article23953100.html,https://www.n-tv.de/wirtschaft/Preiserhoehungen-sind-ein-gefaehrliches-Spiel-article23953100.html,0,www.n-tv.de,"Versuchung für Energieversorger: Preiserhöhungen sind ""ein gefährliches Spiel""","Ab heute greifen die Preisbremsen für Gas und Strom - und zwar rückwirkend. Im Interview erklärt der einflussreiche Ökonom und Energieexperte Südekum, was an dem Vorwurf dran ist, die Maßnahme halte die Preise hoch, und vor welcher gefährlichen Versuchung Ver…",https://bilder2.n-tv.de/img/incoming/crop23953197/8091328286-cImg_16_9-w1200/imago0202646233h.jpg,2023-03-01T15:13:38Z,https://web.archive.org/web/20230301151549/https://www.n-tv.de/wirtschaft/Preiserhoehungen-sind-ein-gefaehrliches-Spiel-article23953100.html,"Ab heute greifen die Preisbremsen für Gas und Strom - und zwar rückwirkend. Im Interview erklärt der einflussreiche Ökonom und Energieexperte Südekum, was an dem Vorwurf dran ist, die Maßnahme halte … [+5380 chars]",,de,'Gas'
https://futurezone.at/digital-life/erdsonden-erdwaerme-waermepumpen-wien-energie-are-photovoltaik-klimaschutz-village/402347568,https://futurezone.at/digital-life/erdsonden-erdwaerme-waermepumpen-wien-energie-are-photovoltaik-klimaschutz-village/402347568,0,futurezone.at,Weg vom Gas: Mit 500 Erdsonden werden 2.000 Wohnungen geheizt,"In Wien entsteht bis 2027 ein einzigartiges Viertel, in dem klimafreundlich mit Erdwärme geheizt und gekühlt werden soll.",https://image.futurezone.at/images/facebook/7678053/village_im_dritten_bohrungen_erdwrmesonden_1_c_markus_schieder.jpg,2023-03-01T15:33:11Z,https://web.archive.org/web/20230301173910/https://futurezone.at/digital-life/erdsonden-erdwaerme-waermepumpen-wien-energie-are-photovoltaik-klimaschutz-village/402347568,"In Wien entsteht bis 2027 ein einzigartiges Viertel, in dem klimafreundlich mit Erdwärme geheizt und gekühlt werden soll. 
Village im Dritten: Baustellenbesichtigung
© Bild: Barbara Wimmer
Das Grü… [+1387 chars]",,de,'Gas'
https://www.tagesspiegel.de/politik/grune-gegen-liberale-ampel-streit-um-heizungen-spitzt-sich-zu-9434816.html,https://www.tagesspiegel.de/politik/grune-gegen-liberale-ampel-streit-um-heizungen-spitzt-sich-zu-9434816.html,0,www.tagesspiegel.de,Grüne gegen Liberale: Ampel-Streit um Heizungen spitzt sich zu,Es gibt Ärger wegen des Verbots von Öl- und Gasheizungen ab 2024 spitzt sich zu. Die Grünen erinnern die FDP an ihren Koalitionsvertrag - die Liberalen wollen die Pläne stoppen.,https://www.tagesspiegel.de/politik/images/schornstein-einer-gasheizung/alternates/BASE_16_9_W1400/schornstein-einer-gasheizung.jpeg,2023-03-01T15:34:38Z,https://web.archive.org/web/20230301162520/https://www.tagesspiegel.de/politik/grune-gegen-liberale-ampel-streit-um-heizungen-spitzt-sich-zu-9434816.html,Der Streit zwischen der FDP und den Koalitionspartnern über das geplante Verbot neuer Öl- und Gasheizungen ab 2024 spitzt sich zu. Während die Liberalen am Mittwoch Widerstand gegen die Pläne ankündi… [+4206 chars],,de,'Gas'
https://www.sueddeutsche.de/wirtschaft/verstaatlichter-gasimporteur-neuer-uniper-chef-kommt-von-eon-1.5760838,https://www.sueddeutsche.de/wirtschaft/verstaatlichter-gasimporteur-neuer-uniper-chef-kommt-von-eon-1.5760838,0,www.sueddeutsche.de,Verstaatlichter Gasimporteur: Neuer Uniper-Chef kommt von Eon,"Michael Lewis kennt viele Uniper-Mitarbeitende noch von früher. Auf ihn warten große Aufgaben bei dem Konzern, der im vergangenen Jahr einen Nettoverlust von 19,1 Milliarden Euro angehäuft hatte.",https://www.sueddeutsche.de/image/sz.1.5760876/1200x675?v=1677685390,2023-03-01T15:43:14Z,https://web.archive.org/web/20230301155226/https://www.sueddeutsche.de/wirtschaft/verstaatlichter-gasimporteur-neuer-uniper-chef-kommt-von-eon-1.5760838,"Michael Lewis kennt viele Uniper-Mitarbeitende noch von früher. Auf ihn warten große Aufgaben bei dem Konzern, der im vergangenen Jahr einen Nettoverlust von 19,1 Milliarden Euro angehäuft hatte.Der … [+2731 chars]",,de,'Gas'
