index,url,valid,domain,title,description,image,published,archive,content,quote,language,keyword
https://www.welt.de/finanzen/verbraucher/plus245085280/Deutschlandticket-bis-Heizkosten-Zuschuss-Was-sich-im-Mai-aendert.html,https://www.welt.de/finanzen/verbraucher/plus245085280/Deutschlandticket-bis-Heizkosten-Zuschuss-Was-sich-im-Mai-aendert.html,0,www.welt.de,Deutschlandticket bis Heizkosten-Zuschuss – Das ändert sich für Sie im Mai,"Der neue Monat verspricht endlich Entlastung für alle, die im vergangenen Jahr Tausende Euro für Heizöl, Pellets oder Kohle ausgeben mussten. Bahnfahrer starten in eine Preis-Ära und die Nutzer von WhatsApp, Amazon und Facebook werden von neuen EU-Regeln prof…",https://img.welt.de/img/finanzen/verbraucher/mobile245087450/6781359897-ci16x9-w1200-fnov-fpotl-fpi157750653/kombo-mai-deutschland-ticket-heizung-meta.jpg,2023-05-01T04:05:36Z,,Der Mai bringt einige Erleichterungen für Pendler und andere Bahnfahrer. Die Corona-Pandemie rückt noch weiter in den Hintergrund. Doch die fast beispiellose Inflation lastet weiterhin auf den Verbra… [+107 chars],,de,'Heizkosten'
https://www.zeit.de/news/2023-05/01/mueller-ueber-soziale-medien-wir-verlieren-unsere-kinder,https://www.zeit.de/news/2023-05/01/mueller-ueber-soziale-medien-wir-verlieren-unsere-kinder,0,www.zeit.de,Schulleiterin: Müller über soziale Medien: «Wir verlieren unsere Kinder»,,,2023-05-01T06:38:20Z,,"When browsing with ads:
We collect personal data and also transmit it to third-party providers
 that help us improve and finance our digital content. Some of the information stored on your device, … [+732 chars]",,de,'Kinder'
https://consent.google.com/ml?continue=https://news.google.com/rss/articles/CBMie2h0dHBzOi8vd3d3LmZyLmRlL3ZlcmJyYXVjaGVyL3ZvbS1idW5kLTQ5LWV1cm8tdGlja2V0LWpvYnRpY2tldC1hcmJlaXRuZWhtZXItYXJiZWl0Z2ViZXItYmFobi1zcGFyZW4tenVzY2h1c3MtOTIyMjYxMTQuaHRtbNIBAA?oc%3D5&gl=FR&hl=en-US&cm=2&pc=n&src=1,https://consent.google.com/ml?continue=https://news.google.com/rss/articles/CBMie2h0dHBzOi8vd3d3LmZyLmRlL3ZlcmJyYXVjaGVyL3ZvbS1idW5kLTQ5LWV1cm8tdGlja2V0LWpvYnRpY2tldC1hcmJlaXRuZWhtZXItYXJiZWl0Z2ViZXItYmFobi1zcGFyZW4tenVzY2h1c3MtOTIyMjYxMTQuaHRtbNIBAA?oc%3D5&gl=FR&hl=en-US&cm=2&pc=n&src=1,0,consent.google.com,"49-Euro-Ticket als Jobticket: So bekommen Angestellte das Deutschlandticket für 34,30 Euro - fr.de","<ol><li>49-Euro-Ticket als Jobticket: So bekommen Angestellte das Deutschlandticket für 34,30 Euro  fr.de
</li><li>Start zum 1. Mai: Was man zum Deutschlandticket wissen muss  tagesschau.de
</li><li>Deutschlandticket bis Heizkosten-Zuschuss: Was sich im Mai…",,2023-05-01T07:38:00Z,,"We use cookies and data to<ul><li>Deliver and maintain Google services</li><li>Track outages and protect against spam, fraud, and abuse</li><li>Measure audience engagement and site statistics to unde… [+1131 chars]",,de,'Heizkosten'
https://www.handelsblatt.com/politik/deutschland/energie-vergleichsportal-energiekosten-fuer-haushalte-sinken-verband-grosse-heizungsflaechen-fuer-waermepumpe-nicht-unbedingt-noetig-/28616386.html,https://www.handelsblatt.com/politik/deutschland/energie-vergleichsportal-energiekosten-fuer-haushalte-sinken-verband-grosse-heizungsflaechen-fuer-waermepumpe-nicht-unbedingt-noetig-/28616386.html,0,www.handelsblatt.com,+++ Energiekrise +++: Vergleichsportal: Energiekosten für Haushalte sinken – Verband: Große Heizungsflächen für Wärmepumpe nicht unbedingt nötig,Habeck für niedrigeren Industriestrompreis mit staatlicher Hilfe +++ Bundesnetzagentur: „Stromversorgung im nächsten Winter ist sicher“ +++ Der Newsblog.,https://www.handelsblatt.com/images/luft-und-wasserwaermepumpe/29124750/2-format2003.jpg,2023-05-01T07:56:19Z,,"<li>Herr Max Heck28.04.2023, 10:29 Uhr
Erneuerbare Energien decken im ersten Quartal 50 Prozent des deutschen Stromverbrauchs!
Und bei ""Dunkelflaute""? 
</li><li>Herr Max Heck26.04.2023, 10:36 Uhr… [+6887 chars]",,de,'Energiekosten'
https://www.stern.de/gesellschaft/regional/mecklenburg-vorpommern/energie--land-sichert-zahlungsfaehigkeit-von-wohnungsunternehmen-33425654.html,https://www.stern.de/gesellschaft/regional/mecklenburg-vorpommern/energie--land-sichert-zahlungsfaehigkeit-von-wohnungsunternehmen-33425654.html,0,www.stern.de,Energie: Land sichert Zahlungsfähigkeit von Wohnungsunternehmen,"Das Land Mecklenburg-Vorpommern stellt fünf Millionen Euro bereit, um die Zahlungsfähigkeit von Wohnungsunternehmen gegen hohe Energiekostenabschläge zu sichern. Die Unternehmen müssten den Energieversorgern höhere Abschläge zahlen, könnten ihren Mietern dies…",https://image.stern.de/6681672/t/31/v5/w1440/r1.7778/-/video-fallback-image.jpg,2023-05-01T08:51:39Z,,"Das Land Mecklenburg-Vorpommern stellt fünf Millionen Euro bereit, um die Zahlungsfähigkeit von Wohnungsunternehmen gegen hohe Energiekostenabschläge zu sichern. Die Unternehmen müssten den Energieve… [+1734 chars]",,de,'Energiekosten'
https://www.handelsblatt.com/finanzen/steuern-recht/steuern/erdgas-waerme-soforthilfegesetz-ist-die-besteuerung-der-gas-soforthilfe-systemwidrig/29116366.html,https://www.handelsblatt.com/finanzen/steuern-recht/steuern/erdgas-waerme-soforthilfegesetz-ist-die-besteuerung-der-gas-soforthilfe-systemwidrig/29116366.html,0,www.handelsblatt.com,Erdgas-Wärme-Soforthilfegesetz : Ist die Besteuerung der Gas-Soforthilfe systemwidrig?,Im Dezember mussten Bürger mit Gas- oder Fernwärme-Heizung keinen Abschlag zahlen. Manche müssen diese Entlastung allerdings als Einkommen versteuern. Weshalb das problematisch ist.,https://www.handelsblatt.com/images/heizung/29116694/2-format2003.jpg,2023-05-01T09:20:40Z,,Frankfurt Die Bundesregierung brachte wegen der gestiegenen Gaspreise infolge des Ukrainekriegs eine Soforthilfe auf den Weg. Die Kosten für den Dezember-Abschlag übernahm der Bund. Technisch wurde d… [+3942 chars],,de,'Gas'
https://www.tagesspiegel.de/wissen/spater-schnee-kleiner-lichtblick-fur-schweizer-gletscher-9745775.html,https://www.tagesspiegel.de/wissen/spater-schnee-kleiner-lichtblick-fur-schweizer-gletscher-9745775.html,0,www.tagesspiegel.de,Später Schnee: Kleiner Lichtblick für Schweizer Gletscher,"Nach einem verheerenden Jahr für die Alpengletscher lassen neueste Messungen etwas aufatmen. Ob der gefallene Schnee vor Sommerschmelze schützen kann, ist aber fraglich.",https://www.tagesspiegel.de/images/morteratschgletscher/alternates/BASE_16_9_W1400/morteratschgletscher.jpeg,2023-05-01T09:58:41Z,,Den Schweizer Gletschern ist dank später Schneefälle in den vergangenen Wochen ein absoluter Minimal-Rekord der Schneemenge in diesem Jahr erspart geblieben. Allerdings liegt fast überall kaum mehr S… [+2661 chars],,de,'Schnee'
https://consent.google.com/ml?continue=https://news.google.com/rss/articles/CBMiYWh0dHBzOi8vd2ViLmRlL21hZ2F6aW5lL3BvbGl0aWsvZGV1dHNjaGxhbmR0aWNrZXQtZ2lsdC1zdGFydHByb2JsZW1lLWJlc3RlbGx1bmctdmVydHJpZWItMzgxNjUxMzDSAQA?oc%3D5&gl=FR&hl=en-US&cm=2&pc=n&src=1,https://consent.google.com/ml?continue=https://news.google.com/rss/articles/CBMiYWh0dHBzOi8vd2ViLmRlL21hZ2F6aW5lL3BvbGl0aWsvZGV1dHNjaGxhbmR0aWNrZXQtZ2lsdC1zdGFydHByb2JsZW1lLWJlc3RlbGx1bmctdmVydHJpZWItMzgxNjUxMzDSAQA?oc%3D5&gl=FR&hl=en-US&cm=2&pc=n&src=1,0,consent.google.com,Deutschlandticket gilt - Startprobleme bei Bestellung und Vertrieb - WEB.DE News,"<ol><li>Deutschlandticket gilt - Startprobleme bei Bestellung und Vertrieb  WEB.DE News
</li><li>Trick für das Deutschlandticket - So können Sie das 49-Euro-Ticket einzeln kaufen  fr.de
</li><li>Deutschlandticket bis Heizkosten-Zuschuss: Was sich im Mai änd…",,2023-05-01T15:28:22Z,,"We use cookies and data to<ul><li>Deliver and maintain Google services</li><li>Track outages and protect against spam, fraud, and abuse</li><li>Measure audience engagement and site statistics to unde… [+1131 chars]",,de,'Heizkosten'
https://www.kicker.de/arsenal-gegen-wolfsburg-2023-frauen-champions-league-4836083/spielbericht,https://www.kicker.de/arsenal-gegen-wolfsburg-2023-frauen-champions-league-4836083/spielbericht,0,www.kicker.de,Bremer in vorletzter Minute: Wolfsburg steht im Champions-League-Finale,Ein Blackout in der 119. Minute hat den FC Arsenal das Ticket fürs Champions-League-Finale gekostet. Der VfL Wolfsburg setzte sich in einem höchst kräftezehrenden Spiel mit 3:2 nach Verlängerung durch.,"https://derivates.kicker.de/image/upload/c_crop,x_188,y_401,w_2705,h_1522/w_1200,q_auto/v1/2023/05/01/efee762f-25c3-451b-a264-b5e8eb71fcb9.jpeg",2023-05-01T19:53:25Z,,Ein Blackout in der 119. Minute hat den FC Arsenal das Ticket fürs Champions-League-Finale gekostet. Der VfL Wolfsburg setzte sich in einem höchst kräftezehrenden Spiel mit 3:2 nach Verlängerung durc… [+3757 chars],,de,'Blackout'
https://www.n-tv.de/ratgeber/So-wird-das-Eigenheim-unabhaengiger-von-externer-Energie-article24085821.html,https://www.n-tv.de/ratgeber/So-wird-das-Eigenheim-unabhaengiger-von-externer-Energie-article24085821.html,0,www.n-tv.de,Die Illusion vom Nullenergiehaus: So wird das Eigenheim unabhängiger von externer Energie,"Der Name wird oft missverstanden: Nullenergiehäuser versprechen nicht, dass man keine Energiekosten mehr hat. Sie sind ein Weg, autarker zu werden. Aber nicht der einzige.",https://bilder3.n-tv.de/img/incoming/crop24085258/7881327966-cImg_16_9-w1200/Fur-die-Dammung-einer-Fassade-gibt-es-unterschiedliche-Optionen-Steinwollplatten-sind-eine-davon.jpg,2023-05-02T04:39:17Z,,"Der Name wird oft missverstanden: Nullenergiehäuser versprechen nicht, dass man keine Energiekosten mehr hat. Sie sind ein Weg, autarker zu werden. Aber nicht der einzige.
Ein Haus, das nur die Ener… [+3968 chars]",,de,'Energiekosten'
https://www.zeit.de/wirtschaft/unternehmen/2023-04/installateure-heizungen-waermepumpen-gasheizungen-waermewende,https://www.zeit.de/wirtschaft/unternehmen/2023-04/installateure-heizungen-waermepumpen-gasheizungen-waermewende,0,www.zeit.de,"Installateure für Heizungen: Gas, Wasser, Gold","Jahrzehntelang haben Installateure Öl- und Gasheizungen verbaut und gutes Geld damit verdient. Von Wärmepumpen wurde eher abgeraten, auch wegen intransparenter Geschäfte.",,2023-05-02T07:18:30Z,https://web.archive.org/web/20230502110639/https://www.zeit.de/wirtschaft/unternehmen/2023-04/installateure-heizungen-waermepumpen-gasheizungen-waermewende,"When browsing with ads:
We collect personal data and also transmit it to third-party providers
 that help us improve and finance our digital content. Some of the information stored on your device, … [+732 chars]",,de,'Gas'
https://www.kicker.de/infantino-droht-tv-blackout-bei-der-frauen-wm-moeglich-949511/artikel,https://www.kicker.de/infantino-droht-tv-blackout-bei-der-frauen-wm-moeglich-949511/artikel,0,www.kicker.de,Infantino droht: TV-Blackout bei der Frauen-WM möglich,Die FIFA hat den Druck im Poker um die TV-Rechte für die Weltmeisterschaft bei den Frauen erhöht. Gianni Infantino hält auch einen TV-Blackout für nicht unmöglich.,"https://derivates.kicker.de/image/upload/w_4000,h_2250,c_fill,g_auto:subject/w_1200,q_auto/v1/2023/05/02/83dc5b05-23d8-4e44-bd91-bc739c6eedf8.jpeg",2023-05-02T09:12:55Z,https://web.archive.org/web/20230502092844/https://www.kicker.de/infantino-droht-tv-blackout-bei-der-frauen-wm-moeglich-949511/artikel,"Die FIFA hat den Druck im Poker um die TV-Rechte für die Weltmeisterschaft bei den Frauen erhöht. Gianni Infantino hält auch einen TV-Blackout für nicht unmöglich. 
 FIFA-Präsident Gianni Infantino … [+2102 chars]",,de,'Blackout'
https://kaernten.orf.at/stories/3205549/,https://kaernten.orf.at/stories/3205549/,0,kaernten.orf.at,Schneeräumer abgestürzt und schwer verletzt,"Am Dienstagvormittag ist im Fleißtal (Nationalpark Hohe Tauern) bei einer hochalpinen Baustelle ein Lader bei Schneeräumarbeiten im steilen Gelände 50 Meter abgestürzt, der Lenker wurde schwer verletzt.",https://ibs.orf.at/ktn?image=https%3A%2F%2Foekastatic.orf.at%2Fmojo%2F1_4_1%2Fstoryserver%2Foeka%2Fcommon%2Fimages%2Fog-fallback-ktn.png%3Fs%3Dd1ef40bef2ffd65644b4df37900c0e4d80e97249,2023-05-02T10:05:23Z,,"Der Lenker wurde aus dem Fahrzeug geschleudert und mit dem Rettungshubschrauber C7 per Seilbergung gerettet. Er wurde nach ersten Informationen schwer verletzt.
Der Lader stürzte rund 50 Meter ab, a… [+121 chars]",,de,'Schnee'
https://ooe.orf.at/stories/3205536/,https://ooe.orf.at/stories/3205536/,0,ooe.orf.at,Vermisste Amerikanerin: Leiche lag unter Schnee,"Nachdem am Montag in der Nähe des Laudachsees (Bezirk Gmunden) eine bereits stark verweste weibliche Leiche gefunden wurde, verdichten sich die Hinweise darauf, dass es sich um eine seit Mitte März vermisste 22-jährige Amerikanerin handeln dürfte. So wurde be…",https://ibs.orf.at/ooe?image=https%3A%2F%2Foekastatic.orf.at%2Fmims%2F2023%2F14%2F55%2Fcrops%2Fw%3D1200%2Ch%3D627%2Cq%3D75%2F1741036_master_644955_suchaktion3.jpg%3Fs%3D117a0ed013468b578ccb6f68ad009355be5fc44d,2023-05-02T10:12:32Z,,"Die Suche nach der 22-Jährigen hatte seit dem 17. März immer wieder für Aufsehen gesorgt und mehrmals die Einsatzkräfte beschäftigt. Denn weil die junge Frau nicht gesagt hatte, wohin sie wandern wür… [+1411 chars]",,de,'Schnee'
https://orf.at/stories/3314719/,https://orf.at/stories/3314719/,0,orf.at,In OÖ vermisste Amerikanerin: Leiche unter Schnee,,https://orf.at/mojo/1_4_1/storyserver//news/common/images/og-fallback-news.png,2023-05-02T10:15:20Z,,"Nachdem gestern in der Nähe des Laudachsees (Oberösterreich) eine bereits stark verweste weibliche Leiche gefunden wurde, verdichten sich die Hinweise darauf, dass es sich um eine seit Mitte März ver… [+169 chars]",,de,'Schnee'
https://www.dw.com/de/wm-2023-fifa-chef-gianni-infantino-droht-mit-tv-blackout/a-65493326,https://www.dw.com/de/wm-2023-fifa-chef-gianni-infantino-droht-mit-tv-blackout/a-65493326,0,www.dw.com,WM 2023: FIFA-Chef Gianni Infantino droht mit TV-Blackout,Im Poker um die Vergabe der Fernsehrechte für die Frauenfußball-WM 2023 in Neuseeland und Australien fährt FIFA-Präsident Gianni Infantino die Ellbogen aus. Gianni Infantino pokert hoch. Der Präsident des Fußball-Weltverbands FIFA verstößt gegen ein ungeschri…,https://static.dw.com/image/64863479_6.jpg,2023-05-02T13:30:00Z,,Gianni Infantino pokert hoch. Der Präsident des Fußball-Weltverbands FIFA verstößt gegen ein ungeschriebenes Gesetz der Finanzwelt: Bei laufenden Verhandlungen bewahrt man normalerweise Stillschweige… [+4220 chars],,de,'Blackout'
https://www.faz.net/aktuell/politik/inland/weitere-laender-ergreifen-notmassnahmen-gegen-antibiotikamangel-18864302.html,https://www.faz.net/aktuell/politik/inland/weitere-laender-ergreifen-notmassnahmen-gegen-antibiotikamangel-18864302.html,0,www.faz.net,Arzeniengpässe: Weitere Länder ergreifen Notmaßnahmen gegen Antibiotikamangel,Auch Baden-Württemberg und Brandenburg haben inzwischen Notmaßnahmen gegen den Medikamentenmangel für Kinder ergriffen. Arzneimittelhersteller und Krankenkassen fordern aber langfristige Lösungen.,https://media0.faz.net/ppmedia/aktuell/politik/844334881/1.8864324/facebook_teaser/karl-lauterbach-spd-ist-stolz.jpg,2023-05-02T18:52:51Z,https://web.archive.org/web/20230503065215/https://www.faz.net/aktuell/politik/inland/weitere-laender-ergreifen-notmassnahmen-gegen-antibiotikamangel-18864302.html,"Immer mehr Bundesländer ergreifen Notmaßnahmen gegen den Mangel bei Antibiotikasäften für Kinder. Nach Bremen, Bayern und Nordrhein-Westfalen teilten auch Baden-Württemberg und Brandenburg am Diensta… [+3673 chars]",,de,'Kinder'
https://www.zeit.de/news/2023-05/03/noch-platz-fuer-ukrainische-kita-kinder-aber-nicht-ueberall,https://www.zeit.de/news/2023-05/03/noch-platz-fuer-ukrainische-kita-kinder-aber-nicht-ueberall,0,www.zeit.de,Bildungsministerium: Noch Platz für ukrainische Kita-Kinder: Aber nicht überall,,,2023-05-03T03:43:27Z,,"When browsing with ads:
We collect personal data and also transmit it to third-party providers
 that help us improve and finance our digital content. Some of the information stored on your device, … [+732 chars]",,de,'Kinder'
https://www.stern.de/gesellschaft/regional/niedersachsen-bremen/erdgasfoerderung--greenpeace-protest-sorgt-fuer-aufruhr-am-landtag-33431380.html,https://www.stern.de/gesellschaft/regional/niedersachsen-bremen/erdgasfoerderung--greenpeace-protest-sorgt-fuer-aufruhr-am-landtag-33431380.html,0,www.stern.de,Erdgasförderung: Greenpeace-Protest sorgt für Aufruhr am Landtag,"""Gasbohrung vor Borkum stoppen"" und ""No new gas"" heißt es auf riesigen Bannern, die Aktivisten von Greenpeace am niedersächsischen Landtag aufgehängt haben. Die Reaktionen der Landespolitik gehen entzwei - nur einer schweigt.",https://image.stern.de/33431382/t/hG/v3/w1440/r1.7778/-/03--urnnewsmldpacom2009010123050399537859v3w800h600l58t56r2487b1578jpeg---e9c6d11bba688f80.jpg,2023-05-03T09:30:28Z,,"""Gasbohrung vor Borkum stoppen"" und ""No new gas"" heißt es auf riesigen Bannern, die Aktivisten von Greenpeace am niedersächsischen Landtag aufgehängt haben. Die Reaktionen der Landespolitik gehen ent… [+3578 chars]",,de,'Gas'
https://consent.google.com/ml?continue=https://news.google.com/rss/articles/CBMilAFodHRwczovL3d3dy5uZHIuZGUvbmFjaHJpY2h0ZW4vbmllZGVyc2FjaHNlbi9oYW5ub3Zlcl93ZXNlci1sZWluZWdlYmlldC9HcmVlbnBlYWNlLUFrdGlvbi1TcGV6aWFsa3JhZWZ0ZS1yYWV1bWVuLURhY2gtdm9uLUxhbmR0YWcsZ3JlZW5wZWFjZTc1MC5odG1s0gEA?oc%3D5&gl=FR&hl=en-US&cm=2&pc=n&src=1,https://consent.google.com/ml?continue=https://news.google.com/rss/articles/CBMilAFodHRwczovL3d3dy5uZHIuZGUvbmFjaHJpY2h0ZW4vbmllZGVyc2FjaHNlbi9oYW5ub3Zlcl93ZXNlci1sZWluZWdlYmlldC9HcmVlbnBlYWNlLUFrdGlvbi1TcGV6aWFsa3JhZWZ0ZS1yYWV1bWVuLURhY2gtdm9uLUxhbmR0YWcsZ3JlZW5wZWFjZTc1MC5odG1s0gEA?oc%3D5&gl=FR&hl=en-US&cm=2&pc=n&src=1,0,consent.google.com,Greenpeace-Aktion: Spezialkräfte räumen Dach von Landtag - NDR.de,"<ol><li>Greenpeace-Aktion: Spezialkräfte räumen Dach von Landtag  NDR.de
</li><li>Greenpeace-Aktivisten verhüllen Landtag in Hannover: Protest gegen Borkum-Gas  t-online
</li><li>Hannover: Greenpeace verhüllt Landtag und protestiert gegen Gasbohrung  HAZ
<…",,2023-05-03T10:11:00Z,,"We use cookies and data to<ul><li>Deliver and maintain Google services</li><li>Track outages and protect against spam, fraud, and abuse</li><li>Measure audience engagement and site statistics to unde… [+1131 chars]",,de,'Gas'
https://www.zeit.de/2023/19/ding-liren-schachweltmeister-china,https://www.zeit.de/2023/19/ding-liren-schachweltmeister-china,0,www.zeit.de,"Ding Liren: ""Ich bin mehr am Schnee interessiert""","Er spuckt keine lauten Töne und unterscheidet sich sehr von seinen Vorgängern: eine Begegnung mit Ding Liren, dem neuen Schachweltmeister aus China.",,2023-05-03T10:15:52Z,,"When browsing with ads:
We collect personal data and also transmit it to third-party providers
 that help us improve and finance our digital content. Some of the information stored on your device, … [+732 chars]",,de,'Schnee'
https://www.stern.de/gesellschaft/regional/hessen/energie--fast-vier-fuenftel-der-haushalte-heizen-mit-gas-oder-heizoel-33432596.html,https://www.stern.de/gesellschaft/regional/hessen/energie--fast-vier-fuenftel-der-haushalte-heizen-mit-gas-oder-heizoel-33432596.html,0,www.stern.de,Energie: Fast vier Fünftel der Haushalte heizen mit Gas oder Heizöl,"Fast vier Fünftel aller hessischen Haushalte haben 2022 mit Gas oder Heizöl geheizt. Das geht aus aktuellen Ergebnissen des Mikrozensus hervor, wie das Statistische Landesamt in Wiesbaden am Mittwoch mitteilte. Demnach heizten 54 Prozent der rund 2,88 Million…",https://image.stern.de/33432598/t/3b/v1/w1440/r1.7778/-/03--urnnewsmldpacom2009010123050399542027v1w800h600l555t315r1621b1571jpeg---b292c7be83b5942e.jpg,2023-05-03T10:49:16Z,,"Fast vier Fünftel aller hessischen Haushalte haben 2022 mit Gas oder Heizöl geheizt. Das geht aus aktuellen Ergebnissen des Mikrozensus hervor, wie das Statistische Landesamt in Wiesbaden am Mittwoch… [+1655 chars]",,de,'Gas'
https://www.zeit.de/news/2023-05/03/fast-vier-fuenftel-der-haushalte-heizen-mit-gas-oder-heizoel,https://www.zeit.de/news/2023-05/03/fast-vier-fuenftel-der-haushalte-heizen-mit-gas-oder-heizoel,0,www.zeit.de,Energie: Fast vier Fünftel der Haushalte heizen mit Gas oder Heizöl,,,2023-05-03T10:49:16Z,,"When browsing with ads:
We collect personal data and also transmit it to third-party providers
 that help us improve and finance our digital content. Some of the information stored on your device, … [+732 chars]",,de,'Gas'
https://www.handelsblatt.com/unternehmen/energie/neue-gasheizung-lohnt-sich-der-neukauf-jetzt-noch/29058054.html,https://www.handelsblatt.com/unternehmen/energie/neue-gasheizung-lohnt-sich-der-neukauf-jetzt-noch/29058054.html,0,www.handelsblatt.com,Energiewende: Lohnt sich jetzt noch eine Gasheizung?,Eine Gasheizung ist in der Anschaffung günstiger als eine Wärmepumpe. Aber Gas ist teuer – und könnte sich künftig noch deutlich verteuern. Was sich über 20 Jahre rechnet.,https://www.handelsblatt.com/images/gaszaehler/29119496/3-format2003.jpg,2023-05-03T10:59:32Z,https://web.archive.org/web/20230503205030/https://www.handelsblatt.com/unternehmen/energie/neue-gasheizung-lohnt-sich-der-neukauf-jetzt-noch/29058054.html,"GaszählerGasheizung oder Wärmepumpe? Was verursacht höhere Kosten?
(Foto: IMAGO/Wolfgang Maria Weber)
Düsseldorf Ein Gesetzesentwurf der Bundesregierung löst dieser Tage bei Verbrauchern viele Sorg… [+1269 chars]",,de,'Gas'
https://futurezone.at/science/sonneneruption-leben-auf-der-erde-angekurbelt-vladimir-airapetian-nasa-kensei-kobayashi/402435252,https://futurezone.at/science/sonneneruption-leben-auf-der-erde-angekurbelt-vladimir-airapetian-nasa-kensei-kobayashi/402435252,0,futurezone.at,Sonneneruptionen könnten Leben auf der Erde angekurbelt haben,"2 Forscher haben gezeigt, wie Sonnenpartikel mit dem Gas der Erdatmosphäre kollidieren und Amino- und Carbonsäure bilden.",https://image.futurezone.at/images/facebook/7623858/sonneneruption.jpeg,2023-05-03T11:20:53Z,,"03.05.2023
2 Forscher haben gezeigt, wie Sonnenpartikel mit dem Gas der Erdatmosphäre kollidieren und Amino- und Carbonsäure bilden.
Aus den grundlegenden Komponenten der fühen Erdatmosphäre können… [+607 chars]",,de,'Gas'
https://oesterreich.orf.at/stories/3205737/,https://oesterreich.orf.at/stories/3205737/,0,oesterreich.orf.at,Strom- und Gasverbrauch deutlich gesunken,"Der Winter 2022/23 war deutlich wärmer als der Winter des Vorjahres. Das führte zu einem deutlich geringeren Verbrauch von Strom und Gas. Der Stromabsatz an Verbraucherinnen und Verbraucher ging um 7,2 Prozent zurück, teilte die E-Control mit. Der Gasverbrauc…",https://ibs.orf.at/oes?image=https%3A%2F%2Foekastatic.orf.at%2Fmojo%2F1_4_1%2Fstoryserver%2Foeka%2Fcommon%2Fimages%2Fog-fallback-oes.png%3Fs%3Dec233e47ded343c91da59ce7aee601c044282ef3,2023-05-03T11:23:55Z,https://web.archive.org/web/20230503142857/https://oesterreich.orf.at/stories/3205737/,"Auch im März 2023 wurde ein um 7,5 Prozent geringerer Stromverbrauch verzeichnet als im März 2022. Die Stromerzeugung war im März um 0,6 Prozent niedriger als im Vorjahresmonat.
Hälfte des Stroms au… [+1200 chars]",,de,'Gas'
https://orf.at/stories/3314878/,https://orf.at/stories/3314878/,0,orf.at,Strom- und Gasverbrauch deutlich gesunken,,https://orf.at/mojo/1_4_1/storyserver//news/common/images/og-fallback-news.png,2023-05-03T11:27:15Z,,"Der vergangene Winter war deutlich wärmer als der Winter des Vorjahres. Das führte zu einem deutlich geringeren Verbrauch von Strom und Gas. Der Stromabsatz an Verbraucher ging um 7,2 Prozent zurück,… [+97 chars]",,de,'Gas'
https://www.focus.de/klima/analyse/iea-bericht-wie-die-oel-und-gasindustrie-durch-effizienz-boost-emissionen-senken-kann_id_192786667.html,https://www.focus.de/klima/analyse/iea-bericht-wie-die-oel-und-gasindustrie-durch-effizienz-boost-emissionen-senken-kann_id_192786667.html,0,www.focus.de,Das Geld dafür wäre da - Mit fünf einfachen Schritten können Öl- und Gasindustrie sofort sauberer werden,"Auf dem Weg in eine klimaneutrale Zukunft muss sich die Menschheit dringend von fossilen Rohstoffen lossagen. Aber was können Öl- und Gasindustrie in der Zwischenzeit schon bewirken? Eine ganze Menge, notiert die Internationale Energieagentur (IEA) in einem n…",https://p6.focus.de/img/fotos/id_192787476/oelfoerderung.jpg?im=Crop%3D%280%2C289%2C3463%2C1731%29%3BResize%3D%281200%2C627%29&hash=43ffc8d3931184f2a5999e680d09ab9d8401efcf01c34990edc9440941ffa8b6,2023-05-03T11:43:50Z,,Auf dem Weg in eine klimaneutrale Zukunft muss sich die Menschheit dringend von fossilen Rohstoffen lossagen. Aber was können Öl- und Gasindustrie in der Zwischenzeit schon bewirken? Eine ganze Menge… [+2815 chars],,de,'Gas'
https://www.kicker.de/infantinos-drohung-mit-dem-blackout-der-markt-laesst-sich-nicht-erpressen-949670/artikel,https://www.kicker.de/infantinos-drohung-mit-dem-blackout-der-markt-laesst-sich-nicht-erpressen-949670/artikel,0,www.kicker.de,Infantinos Drohung mit dem Blackout: Der Markt lässt sich nicht erpressen,"Noch immer ist nicht klar, ob und wo die Weltmeisterschaft der Frauen im kommenden Sommer im TV zu sehen sein wird. FIFA-Chef Gianni Infantino will mehr Geld und droht mit dem Blackout, doch damit droht dem Fußball noch größerer Schaden. Ein Kommentar von kic…","https://derivates.kicker.de/image/upload/c_crop,x_0,y_265,w_4000,h_2250/w_1200,q_auto/v1/2023/05/03/c2b59d32-0e33-40ed-a88d-24db368b76e7.jpeg",2023-05-03T11:45:00Z,https://web.archive.org/web/20230503173640/https://www.kicker.de/infantinos-drohung-mit-dem-blackout-der-markt-laesst-sich-nicht-erpressen-949670/artikel,"Noch immer ist nicht klar, ob und wo die Weltmeisterschaft der Frauen im kommenden Sommer im TV zu sehen sein wird. FIFA-Chef Gianni Infantino will mehr Geld und droht mit dem Blackout, doch damit dr… [+2403 chars]",,de,'Blackout'
