index,url,valid,domain,title,description,image,published,archive,content,quote,language,keyword
https://www.stern.de/gesellschaft/regional/hessen/wetter--hochwasser-behoerde-warnt-vor-ueberschwemmungen-in-hessen-35128100.html,https://www.stern.de/gesellschaft/regional/hessen/wetter--hochwasser-behoerde-warnt-vor-ueberschwemmungen-in-hessen-35128100.html,0,www.stern.de,Wetter: Hochwasser-Behörde warnt vor Überschwemmungen in Hessen,"Ex-Hurrikan ""Kirk"" könnte Überflutungen nach Hessen bringen. Das Landesamt für Naturschutz und Umwelt warnt davor, dass am Mittwoch vor allem kleine und mittlere Gewässer betroffen sein könnten.",https://image.stern.de/35128102/t/Zn/v1/w1440/r1.7778/-/08--ftht4eshl4v26axw800h600jpeg---2cbe3103889a5f6b.jpg,2024-10-08T16:03:45Z,https://web.archive.org/web/20241008164107/https://www.stern.de/gesellschaft/regional/hessen/wetter--hochwasser-behoerde-warnt-vor-ueberschwemmungen-in-hessen-35128100.html,"Ex-Hurrikan ""Kirk"" könnte Überflutungen nach Hessen bringen. Das Landesamt für Naturschutz und Umwelt warnt davor, dass am Mittwoch vor allem kleine und mittlere Gewässer betroffen sein könnten.
Das… [+380 chars]",,de,'Hochwasser'
https://www.zeit.de/news/2024-10/08/hochwasser-behoerde-warnt-vor-ueberschwemmungen-in-hessen,https://www.zeit.de/news/2024-10/08/hochwasser-behoerde-warnt-vor-ueberschwemmungen-in-hessen,0,www.zeit.de,Wetter: Hochwasser-Behörde warnt vor Überschwemmungen in Hessen,Hier finden Sie Informationen zu dem Thema „Wetter“. Lesen Sie jetzt „Hochwasser-Behörde warnt vor Überschwemmungen in Hessen“.,https://img.zeit.de/news/2024-10/08/hochwasser-behoerde-warnt-vor-ueberschwemmungen-in-hessen-image-group/wide__1300x731,2024-10-08T16:03:45Z,,"Das Hessische Landesamt für Naturschutz, Umwelt und Geologie warnt vor örtlich stark steigenden Wasserständen in Hessen. Am Mittwoch könnten vor allem an kleinen und mittleren Gewässern Meldestufen ü… [+215 chars]",,de,'Hochwasser'
https://www.faz.net/aktuell/rhein-main/schlafende-kinder-in-ginsheim-gustavsburg-missbraucht-aktuelle-nachrichten-aus-frankfurt-hessen-faz-19735361.html,https://www.faz.net/aktuell/rhein-main/schlafende-kinder-in-ginsheim-gustavsburg-missbraucht-aktuelle-nachrichten-aus-frankfurt-hessen-faz-19735361.html,0,www.faz.net,Aktuelle Nachrichten aus Frankfurt und Rhein-Main | FAZ,Hochwasser-Behörde warnt vor Überschwemmungen in Hessen +++ Seniorin in Frankfurt von U-Bahn erfasst +++ Bad Vilbel: Mann nach Messerstichen notoperiert +++ Sturm in der Nacht zum Donnerstag +++ Liveblog für Frankfurt und Hessen.,https://media1.faz.net/ppmedia/aktuell/gesellschaft/2583727910/1.10034805/facebook_teaser/zu-dem-mutmasslichen.jpg,2024-10-08T16:23:27Z,https://web.archive.org/web/20241008163401/https://www.faz.net/aktuell/rhein-main/schlafende-kinder-in-ginsheim-gustavsburg-missbraucht-aktuelle-nachrichten-aus-frankfurt-hessen-faz-19735361.html,Bad Vilbel. Wegen mehrerer Messerstiche ist ein 19 Jahre alter Mann notoperiert worden. Staatsanwaltschaft und Polizei ermitteln nun gegen zwei 16 und 17 Jahre Deutsche und einen 16 Jahre alten eritr… [+1242 chars],,de,'Hochwasser'
https://www.bild.de/leben-wissen/wissenschaft/nach-heftigen-regenfaellen-teile-der-sahara-versinken-im-hochwasser-670543aed8476a4127f49710,https://www.bild.de/leben-wissen/wissenschaft/nach-heftigen-regenfaellen-teile-der-sahara-versinken-im-hochwasser-670543aed8476a4127f49710,0,www.bild.de,Massive Regenmengen - Teile der Sahara versinken im Hochwasser,Es sieht aus wie eine Fata Morgana. Doch diese Wassermassen sind real: Nach heftigen Regenfällen sind Teile der Wüste Sahara überschwemmt.,"https://images.bild.de/670543aed8476a4127f49710/d5a302ab7bee51bcc5632073579c7f2b,898c9a8?w=1280",2024-10-08T16:37:55Z,http://archive.md/20241009143240/https://www.bild.de/leben-wissen/wissenschaft/nach-heftigen-regenfaellen-teile-der-sahara-versinken-im-hochwasser-670543aed8476a4127f49710,"Es sieht aus wie eine riesige Fata Morgana. Doch diese Wassermassen sind keine optische Täuschung! Teile der Sahara sind derzeit tatsächlich überschwemmt.
Was auf den Betrachter faszinierend wirkt, … [+2158 chars]",,de,'Hochwasser'
https://www.focus.de/panorama/kinderporno-bande-hinter-der-darknet-plattform-alice-in-wonderland-verbarg-sich-das-grauen_id_260377744.html,https://www.focus.de/panorama/kinderporno-bande-hinter-der-darknet-plattform-alice-in-wonderland-verbarg-sich-das-grauen_id_260377744.html,0,www.focus.de,Kinderporno-Bande - Hinter der Darknet-Plattform „Alice in Wonderland“ verbarg sich das Grauen,Der Name der Darknet-Plattform klingt wie ein bekanntes Märchen: „Alice in Wonderland“. Dahinter aber verbarg sich das Grauen. Nach FOCUS-online-Informationen verbreiteten mindestens 200.000 Pädokriminelle aus fünf Kontinenten in den abgeschotteten Foren Bild…,https://p6.focus.de/img/fotos/id_260377743/grosse-kinderporno-plattform-nach-ermittlungen-abgeschaltet.jpg?im=Crop%3D%280%2C281%2C3453%2C1726%29%3BResize%3D%281200%2C627%29&impolicy=perceptual&quality=mediumHigh&hash=9b5eba436f886626a93d1cdc7719f671da36fe7f2fda89f847aca98276c6efcf,2024-10-08T16:42:47Z,https://web.archive.org/web/20241008172735/https://www.focus.de/panorama/kinderporno-bande-hinter-der-darknet-plattform-alice-in-wonderland-verbarg-sich-das-grauen_id_260377744.html,Der Name der Darknet-Plattform klingt wie ein bekanntes Märchen: Alice in Wonderland. Dahinter aber verbarg sich das Grauen. Nach FOCUS-online-Informationen verbreiteten mindestens 200.000 Pädokrimin… [+9127 chars],,de,'Kinder'
https://www.n-tv.de/politik/Luxemburgs-Grossherzog-Henri-beginnt-mit-der-Amtsuebergabe-article25278237.html,https://www.n-tv.de/politik/Luxemburgs-Grossherzog-Henri-beginnt-mit-der-Amtsuebergabe-article25278237.html,0,www.n-tv.de,Prinz Guillaume befördert: Luxemburgs Großherzog Henri beginnt mit der Amtsübergabe,Der Termin steht längst fest - doch bis zum Amtsverzicht von Großherzog Henri ist noch ein bisschen Zeit. Das luxemburgische Staatsoberhaupt aber will kürzertreten und nimmt nun mehr seinen Sohn in die Pflicht. Seine Kinder will Guillaume aber weiter zur Schu…,https://bilder3.n-tv.de/img/incoming/crop25278234/0601329123-cImg_16_9-w1200/487002482.jpg,2024-10-08T16:48:23Z,https://web.archive.org/web/20241008172713/https://www.n-tv.de/politik/Luxemburgs-Grossherzog-Henri-beginnt-mit-der-Amtsuebergabe-article25278237.html,Der Termin steht längst fest - doch bis zum Amtsverzicht von Großherzog Henri ist noch ein bisschen Zeit. Das luxemburgische Staatsoberhaupt aber will kürzertreten und nimmt nun mehr seinen Sohn in d… [+3725 chars],,de,'Kinder'
https://www.faz.net/aktuell/rhein-main/mann-greift-frau-am-frankfurter-mainufer-an-und-verletzt-sie-schwer-aktuelle-nachrichten-aus-frankfurt-hessen-faz-19735361.html,https://www.faz.net/aktuell/rhein-main/mann-greift-frau-am-frankfurter-mainufer-an-und-verletzt-sie-schwer-aktuelle-nachrichten-aus-frankfurt-hessen-faz-19735361.html,0,www.faz.net,Aktuelle Nachrichten aus Frankfurt und Rhein-Main | FAZ,Schlafende Kinder in Ginsheim-Gustavsburg missbraucht: Täter war ein Fremder +++ Hochwasser-Behörde warnt vor Überschwemmungen in Hessen +++ Seniorin in Frankfurt von U-Bahn erfasst +++ Liveblog für Frankfurt und Hessen.,https://media1.faz.net/ppmedia/aktuell/2169590736/1.10034913/facebook_teaser/am-frankfurter-mainufer-auf.jpg,2024-10-08T17:02:48Z,https://web.archive.org/web/20241008175715/https://www.faz.net/aktuell/rhein-main/mann-greift-frau-am-frankfurter-mainufer-an-und-verletzt-sie-schwer-aktuelle-nachrichten-aus-frankfurt-hessen-faz-19735361.html,Bad Vilbel. Wegen mehrerer Messerstiche ist ein 19 Jahre alter Mann notoperiert worden. Staatsanwaltschaft und Polizei ermitteln nun gegen zwei 16 und 17 Jahre Deutsche und einen 16 Jahre alten eritr… [+1242 chars],,de,'Hochwasser'
https://noe.orf.at/stories/3276372/,https://noe.orf.at/stories/3276372/,0,noe.orf.at,Schneeberg stellt sich im Tourismus neu auf,Die Schneeberg-Sesselbahn in Losenheim (Bezirk Neunkirchen) hat neue Pläne für den Tourismus. Mit sieben Mountainbikestrecken will man neue Gäste in die Region bringen. Das Skifahren auf einem Kunststoffmattenhang im Sommer ist mittlerweile Geschichte.,https://ibs.orf.at/noe?image=https%3A%2F%2Foekastatic.orf.at%2Fmims%2F2024%2F41%2F39%2Fcrops%2Fw%3D1200%2Ch%3D627%2Cq%3D75%2F2380143_master_909039_6_cnoevog_schwarzkoenig.jpg%3Fs%3Da2fb1da33caf1fe7cad3c0e291e90720af65adee,2024-10-08T17:43:53Z,https://web.archive.org/web/20241008180417/https://noe.orf.at/stories/3276372/,"Sieben neue Mountainbikestrecken sollen rund um die Schneeberg-Sesselbahn entstehen. Die Arbeiten sollen im Frühjahr 2025 beginnen, die ersten Strecken im Frühjahr 2026 befahrbar sein. Geplant sind T… [+2123 chars]",,de,'Schnee'
https://t3n.de/news/shortseller-belastet-roblox-aktie-1650556/,https://t3n.de/news/shortseller-belastet-roblox-aktie-1650556/,0,t3n.de,Investoren getäuscht? Shortseller-Bericht belastet Roblox schwer – Aktie knickt ein,Ein Bericht des berüchtigten Shortsellers Hindenburg Research belastet Roblox schwer. Die Online-Spieleplattform soll die Zahl der Nutzer:innen massiv aufgebläht haben und Kinder zu wenig schützen. Worum es genau geht.weiterlesen auf t3n.de,https://t3n.de/news/wp-content/uploads/2023/07/roblox.jpg,2024-10-08T19:02:27Z,https://web.archive.org/web/20241008225312/https://t3n.de/news/shortseller-belastet-roblox-aktie-1650556/,"Block, Carl Icahn, Lordstown Motors, Nikola, Tether oder Twitter das sind nur einige Firmen, die in den vergangenen Jahren ins Visier von Hindenburg Research geraten sind. Jetzt sorgt der Shortseller… [+3046 chars]",,de,'Kinder'
https://www.faz.net/aktuell/feuilleton/kunst-und-architektur/vom-krieg-ins-irrenhaus-freiburger-ausstellung-zur-weimarer-republik-110031719.html,https://www.faz.net/aktuell/feuilleton/kunst-und-architektur/vom-krieg-ins-irrenhaus-freiburger-ausstellung-zur-weimarer-republik-110031719.html,0,www.faz.net,Vom Krieg ins Irrenhaus: Freiburger Ausstellung zur Kunst der Weimarer Republik,"Resignation und Protest: In Freiburg zeigt das Museum für Neue Kunst die Weimarer Republik in Glanz, Elend und Revolutionsseligkeit. Und wirft einen Blick auf die Kinder, die in jenen Jahren allzu schnell groß werden mussten.",https://media1.faz.net/ppmedia/aktuell/3093727481/1.10031715/facebook_teaser/fuehlt-er-sich-eigentlich-wohl.jpg,2024-10-08T19:13:19Z,https://web.archive.org/web/20241008192227/https://www.faz.net/aktuell/feuilleton/kunst-und-architektur/vom-krieg-ins-irrenhaus-freiburger-ausstellung-zur-weimarer-republik-110031719.html,Dass die Kuratoren der Ausstellung Modern Times zur Kunst der Zwanzigerjahre des vorigen Jahrhunderts gerade diesen Ausschnitt aus Charlie Chaplins gleichnamigem Film an den Beginn des Rundgangs im F… [+4208 chars],,de,'Kinder'
https://www.stern.de/gesellschaft/erziehungsexperte-im-interview---wir-muten-kindern-zu-wenig-zu--35070184.html,https://www.stern.de/gesellschaft/erziehungsexperte-im-interview---wir-muten-kindern-zu-wenig-zu--35070184.html,0,www.stern.de,"Soziologe Schneider: ""Kinder sind heute weniger lebenstüchtig, weil wir ihnen zu wenig zumuten""","Kinder seien kompetenter, als wir annehmen, erklärt der Soziologe Norbert F. Schneider im Interview. Er plädiert für eine weniger perfektionistische Erziehungskultur.",https://image.stern.de/35084908/t/sy/v1/w1440/r1.7778/-/kinder-erziehung.jpg,2024-10-08T19:32:00Z,https://web.archive.org/web/20241008201007/https://www.stern.de/gesellschaft/erziehungsexperte-im-interview---wir-muten-kindern-zu-wenig-zu--35070184.html,"Herr Schneider, was ist gute Erziehung?Sie ist eine Idee, ein kulturelles Leitbild, das sich ständig wandelt. Wir haben eine Idee, was typisch kindlich ist. Eine Idee, was eine gute Mutter, einen gut… [+168 chars]",,de,'Kinder'
https://www.stern.de/wirtschaft/news/finanzen--umfrage--viele-sparer-legen-geld-fuer-krisenzeiten-beiseite-35128562.html,https://www.stern.de/wirtschaft/news/finanzen--umfrage--viele-sparer-legen-geld-fuer-krisenzeiten-beiseite-35128562.html,0,www.stern.de,Finanzen: Umfrage: Viele Sparer legen Geld für Krisenzeiten beiseite,"Ob als ""Notgroschen"" oder finanzielles Polster - vor allem ältere Menschen in Deutschland halten derzeit ihr Geld zusammen, um sich für schlechte Zeiten zu wappnen.",https://image.stern.de/35128564/t/P3/v1/w1440/r1.7778/-/09--pdx36rmjikv35axw800h600jpeg---8f506d2538dc0eb5.jpg,2024-10-09T02:00:36Z,,"Ob als ""Notgroschen"" oder finanzielles Polster - vor allem ältere Menschen in Deutschland halten derzeit ihr Geld zusammen, um sich für schlechte Zeiten zu wappnen.
Viele Menschen legen derzeit Geld… [+2719 chars]",,de,'ältere Menschen'
https://www.tagesspiegel.de/wirtschaft/finanzen-umfrage-viele-sparer-legen-geld-fur-krisenzeiten-beiseite-12502985.html,https://www.tagesspiegel.de/wirtschaft/finanzen-umfrage-viele-sparer-legen-geld-fur-krisenzeiten-beiseite-12502985.html,0,www.tagesspiegel.de,Finanzen: Umfrage: Viele Sparer legen Geld für Krisenzeiten beiseite,"Ob als „Notgroschen“ oder finanzielles Polster - vor allem ältere Menschen in Deutschland halten derzeit ihr Geld zusammen, um sich für schlechte Zeiten zu wappnen.",https://www.tagesspiegel.de/images/12502982/alternates/BASE_16_9_W1400/1728439346000/illustration-umfrage-zum-sparverhalten.jpeg,2024-10-09T02:02:26Z,,Viele Menschen legen derzeit Geld für Krisenzeiten auf die hohe Kante. Bei einer repräsentativen Online-Umfrage des Meinungsforschungsinstituts YouGov im Auftrag der Postbank gaben 41 Prozent der Bef… [+2634 chars],,de,'ältere Menschen'
https://www.focus.de/finanzen/news/finanzen-umfrage-viele-sparer-legen-geld-fuer-krisenzeiten-beiseite_id_260378153.html,https://www.focus.de/finanzen/news/finanzen-umfrage-viele-sparer-legen-geld-fuer-krisenzeiten-beiseite_id_260378153.html,0,www.focus.de,Finanzen - Umfrage: Viele Sparer legen Geld für Krisenzeiten beiseite,"Ob als «Notgroschen» oder finanzielles Polster - vor allem ältere Menschen in Deutschland halten derzeit ihr Geld zusammen, um sich für schlechte Zeiten zu wappnen.",https://p6.focus.de/img/finanzen/news/id_260378152/geld-auf-die-hohe-kante-als-notgroschen-oder-fuer-krisenzeiten-vielen-menschen-sind-diese-ziele-beim-sparen-derzeit-besonders-wichtig.-foto-illustration-.jpg?im=Crop%3D%280%2C118%2C2048%2C1024%29%3BResize%3D%281200%2C627%29&impolicy=perceptual&quality=mediumHigh&hash=a9ad47e4cfa403f72c7c10e01728fe41ec58eb021c956c63e5c026d4ec1a0f68,2024-10-09T02:05:06Z,,Viele Menschen legen derzeit Geld für Krisenzeiten auf die hohe Kante. Bei einer repräsentativen Online-Umfrage des Meinungsforschungsinstituts YouGov im Auftrag der Postbank gaben 41 Prozent der Bef… [+2544 chars],,de,'ältere Menschen'
https://www.tagesschau.de/wissen/gesundheit/herztod-junge-menschen-100.html,https://www.tagesschau.de/wissen/gesundheit/herztod-junge-menschen-100.html,0,www.tagesschau.de,Wenn das Herz im jungen Alter stehen bleibt,Tausende Menschen sterben jedes Jahr am plötzlichen Herztod - und das trifft nicht nur Ältere. Auch bei jungen Erwachsenen und selbst Kindern kann das Herz schon durch ein Weckerklingeln lebensbedrohlich aus dem Takt geraten. Von B. Augustin.,https://images.tagesschau.de/image/667e8251-20e0-4644-a9a9-52b6cb17d594/AAABkmwCsAk/AAABkZLhkrw/16x9-1280/mann-boden-100.jpg,2024-10-09T04:50:20Z,http://archive.md/20241009051646/https://www.tagesschau.de/wissen/gesundheit/herztod-junge-menschen-100.html,"Stand: 09.10.2024 06:50 Uhr
Tausende Menschen sterben jedes Jahr am plötzlichen Herztod - und das trifft nicht nur Ältere. Auch bei jungen Erwachsenen und selbst Kindern kann das Herz schon durch ei… [+5014 chars]",,de,'ältere Menschen'
https://www.diepresse.com/18931700/roboter-buddy-reagiert-auf-gefuehle-und-motiviert-zum-sport,https://www.diepresse.com/18931700/roboter-buddy-reagiert-auf-gefuehle-und-motiviert-zum-sport,0,www.diepresse.com,Roboter Buddy reagiert auf Gefühle und motiviert zum Sport,"In Salzburg entwickeln Forschende mit Partnern aus Frankreich und den Niederlanden einen kleinen Roboter, der ältere Menschen dabei coacht, länger ein selbstständiges Leben führen zu können.",https://img.diepresse.com/public/incoming/3l5r3o-Buddy-mit-Oliver-Jung_02_cSalzburg-Research.JPG/alternates/DPR_SOCIAL_MAGAZIN/Buddy-mit-Oliver-Jung_02_cSalzburg-Research.JPG,2024-10-09T05:00:00Z,,"In Salzburg entwickeln Forschende mit Partnern aus Frankreich und den Niederlanden einen kleinen Roboter, der ältere Menschen dabei coacht, länger ein selbstständiges Leben führen zu können.
Einsamk… [+3374 chars]",,de,'ältere Menschen'
https://www.zeit.de/news/2024-10/09/mykoplasmen-teils-schwere-erkrankungen-bei-kindern,https://www.zeit.de/news/2024-10/09/mykoplasmen-teils-schwere-erkrankungen-bei-kindern,0,www.zeit.de,Atemwegserkrankungen: Mykoplasmen - teils schwere Erkrankungen bei Kindern,Hier finden Sie Informationen zu dem Thema „Atemwegserkrankungen“. Lesen Sie jetzt „Mykoplasmen - teils schwere Erkrankungen bei Kindern“.,https://img.zeit.de/news/2024-10/09/mykoplasmen-teils-schwere-erkrankungen-bei-kindern-image-group/wide__1300x731,2024-10-09T10:47:33Z,,"In Mecklenburg-Vorpommern haben derzeit ungewöhnlich viele Kinder und Jugendliche mit Atemwegserkrankungen durch Infektionen mit bestimmten Bakterien, sogenannten Mykoplasmen, zu kämpfen. Dabei gebe … [+1757 chars]",,de,'Kinder'
https://www.zeit.de/news/2024-10/09/kasse-sprachstoerungen-und-mangel-an-bewegung-bei-kindern,https://www.zeit.de/news/2024-10/09/kasse-sprachstoerungen-und-mangel-an-bewegung-bei-kindern,0,www.zeit.de,Gesundheit: Kasse: Sprachstörungen und Mangel an Bewegung bei Kindern,Hier finden Sie Informationen zu dem Thema „Gesundheit“. Lesen Sie jetzt „Kasse: Sprachstörungen und Mangel an Bewegung bei Kindern“.,https://img.zeit.de/news/2024-10/09/kasse-sprachstoerungen-und-mangel-an-bewegung-bei-kindern-image-group/wide__1300x731,2024-10-09T11:44:39Z,,Bei Kindern in Rheinland-Pfalz nimmt laut einer Studie der Barmer die Häufigkeit von Sprachstörungen deutlich zu. Zudem gebe es Defizite bei der motorischen Entwicklung. Nach Angaben der Krankenkasse… [+2386 chars],,de,'Kinder'
https://www.zeit.de/news/2024-10/09/buchstabennudeln-zurueckgerufen-schimmelgefahr,https://www.zeit.de/news/2024-10/09/buchstabennudeln-zurueckgerufen-schimmelgefahr,0,www.zeit.de,Rückruf: Buchstabennudeln zurückgerufen - Schimmelgefahr,Hier finden Sie Informationen zu dem Thema „Rückruf“. Lesen Sie jetzt „Buchstabennudeln zurückgerufen - Schimmelgefahr“.,https://img.zeit.de/news/2024-10/09/buchstabennudeln-zurueckgerufen-schimmelgefahr-image-group/wide__1300x731,2024-10-09T11:58:16Z,,"Der bayerische Hersteller Bernbacher ruft Buchstabennudeln zurück. Den Angaben zufolge kann nicht ausgeschlossen werden, dass Nudeln vereinzelt mit Schimmel befallen sind. 
Betroffen sind demnach «D… [+474 chars]",,de,'Schimmel'
https://www.stern.de/gesellschaft/regional/bayern/rueckruf--buchstabennudeln-zurueckgerufen---schimmelgefahr-35130164.html,https://www.stern.de/gesellschaft/regional/bayern/rueckruf--buchstabennudeln-zurueckgerufen---schimmelgefahr-35130164.html,0,www.stern.de,Rückruf: Buchstabennudeln zurückgerufen - Schimmelgefahr,Vorsicht bei Buchstabennudeln der Firma Bernbacher: Einige Packungen werden vom Unternehmen zurückgerufen. Es besteht die Gefahr von Schimmel an den Nudeln.,https://image.stern.de/35130166/t/kI/v1/w1440/r1.7778/-/09--mgr4mrqbs7v5axw800h600jpeg---0e3c43748bf5dfea.jpg,2024-10-09T11:58:16Z,https://web.archive.org/web/20241009122805/https://www.stern.de/gesellschaft/regional/bayern/rueckruf--buchstabennudeln-zurueckgerufen---schimmelgefahr-35130164.html,"Vorsicht bei Buchstabennudeln der Firma Bernbacher: Einige Packungen werden vom Unternehmen zurückgerufen. Es besteht die Gefahr von Schimmel an den Nudeln.
Der bayerische Hersteller Bernbacher ruft… [+641 chars]",,de,'Schimmel'
https://www.zeit.de/news/2024-10/09/preise-fuer-haushaltsenergie-sinken-deutlich,https://www.zeit.de/news/2024-10/09/preise-fuer-haushaltsenergie-sinken-deutlich,0,www.zeit.de,Energiekosten: Preise für Haushaltsenergie sinken deutlich,Hier finden Sie Informationen zu dem Thema „Energiekosten“. Lesen Sie jetzt „Preise für Haushaltsenergie sinken deutlich“.,https://img.zeit.de/news/2024-10/09/preise-fuer-haushaltsenergie-sinken-deutlich-image-group/wide__1300x731,2024-10-09T12:03:04Z,,Die Preise für die zum Heizen benötigte Energie in Hessen sind nach Angaben des Statistischen Landesamtes in den vergangenen Monaten zurückgegangen. Allerdings liegen sie weiterhin erheblich über dem… [+2094 chars],,de,'Gas'
https://www.zeit.de/news/2024-10/09/gaspedal-statt-bremse-85-jaehriger-baut-unfall,https://www.zeit.de/news/2024-10/09/gaspedal-statt-bremse-85-jaehriger-baut-unfall,0,www.zeit.de,Unfallfahrt: Gaspedal statt Bremse – 85-Jähriger baut Unfall,Hier finden Sie Informationen zu dem Thema „Unfallfahrt“. Lesen Sie jetzt „Gaspedal statt Bremse – 85-Jähriger baut Unfall“.,https://img.zeit.de/news/2024-10/09/gaspedal-statt-bremse-85-jaehriger-baut-unfall-image-group/wide__1300x731,2024-10-09T12:18:05Z,,"Ein 85 Jahre alter Autofahrer hat in Werningshausen (Landkreis Sömmerda) während der Fahrt Gas- und Bremspedal verwechselt ein Unfall ist die Folge gewesen. Der Senior wurde dabei schwer verletzt, wi… [+249 chars]",,de,'Gas'
https://www.morgenpost.de/bezirke/tempelhof-schoeneberg/article407431468/neuer-spielplatz-in-tempelhof-mit-diesen-besonderheiten.html,https://www.morgenpost.de/bezirke/tempelhof-schoeneberg/article407431468/neuer-spielplatz-in-tempelhof-mit-diesen-besonderheiten.html,0,www.morgenpost.de,Neuer Spielplatz in Tempelhof – Mit diesen Besonderheiten,Berlin-Lichtenrade könnte mit diesem Spielplatz zum neuen Kinderparadies avancieren. Die Entwürfe überzeugen zumindest auf dem Papier.,https://img.sparknews.funkemedien.de/407432194/407432194_1728481696_v16_9_1600.jpeg,2024-10-09T12:40:19Z,,"Berlin. Berlin-Lichtenrade könnte mit diesem Spielplatz zum neuen Kinderparadies avancieren. Die Entwürfe überzeugen zumindest auf dem Papier.
Duftplanzen, Tasthöhle und Wasser: An der Nuthestraße i… [+2509 chars]",,de,'ältere Menschen'
https://www.zeit.de/news/2024-10/09/nach-chemie-experiment-kinder-klagen-ueber-beschwerden,https://www.zeit.de/news/2024-10/09/nach-chemie-experiment-kinder-klagen-ueber-beschwerden,0,www.zeit.de,Schule: Nach Chemie-Experiment - Kinder klagen über Beschwerden,Hier finden Sie Informationen zu dem Thema „Schule“. Lesen Sie jetzt „Nach Chemie-Experiment - Kinder klagen über Beschwerden“.,https://img.zeit.de/news/2024-10/09/nach-chemie-experiment-kinder-klagen-ueber-beschwerden-image-group/wide__1300x731,2024-10-09T14:15:40Z,,Nach einem Experiment im Chemieunterricht an einer Schule in Alpen (Kreis Wesel) haben mehrere Kinder über gesundheitliche Beschwerden geklagt. Nach einer ersten Sichtung vor Ort seien 14 Kinder betr… [+535 chars],,de,'Kinder'
https://www.zeit.de/2024/43/erdgas-energiepolitik-klimapolitik-lobbyismus-forschung,https://www.zeit.de/2024/43/erdgas-energiepolitik-klimapolitik-lobbyismus-forschung,0,www.zeit.de,Erdgas: Die Gaslüge,"Erdgas ist relativ sauber und klimafreundlich – auf dieser Erzählung beruht die deutsche Energiepolitik. Nur stimmt sie nicht. Von einer Brücke, die ins Nirgendwo führt.",https://img.zeit.de/2024/43/die-gasluege-teaser/wide__1300x731,2024-10-09T14:46:07Z,http://archive.md/20241009151112/https://www.zeit.de/2024/43/erdgas-energiepolitik-klimapolitik-lobbyismus-forschung,"Gas rußt nicht. Und Gas klebt nicht. Anders als Kohle färbt es den Himmel nicht schwarz, wenn es aus dem Schornstein dringt. Anders als Öl bildet es keinen schmierigen Film auf dem Meer, wenn eine Pi… [+597 chars]",,de,'Gas'
https://www.zeit.de/news/2024-10/09/handy-am-steuer-zwei-kinder-und-zwei-erwachsene-verletzt,https://www.zeit.de/news/2024-10/09/handy-am-steuer-zwei-kinder-und-zwei-erwachsene-verletzt,0,www.zeit.de,Verkehrsunfall: Handy am Steuer: Zwei Kinder und zwei Erwachsene verletzt,Hier finden Sie Informationen zu dem Thema „Verkehrsunfall“. Lesen Sie jetzt „Handy am Steuer: Zwei Kinder und zwei Erwachsene verletzt“.,https://img.zeit.de/news/2024-10/09/handy-am-steuer-zwei-kinder-und-zwei-erwachsene-verletzt-image-group/wide__1300x731,2024-10-09T21:44:20Z,,"Weil eine Autofahrerin auf ihr Handy geschaut hat, ist es im Landkreis Forchheim zu einem Unfall mit vier Verletzen gekommen - darunter zwei Kinder. Nach Angaben der Polizei war die 48-Jährige in Hau… [+484 chars]",,de,'Kinder'
https://www.zeit.de/news/2024-10/10/neue-vorgaben-fuer-kinder-und-jugendliche-in-polizeizellen,https://www.zeit.de/news/2024-10/10/neue-vorgaben-fuer-kinder-und-jugendliche-in-polizeizellen,0,www.zeit.de,Reul legt Verordnung vor: Neue Vorgaben für Kinder und Jugendliche in Polizeizellen,Hier finden Sie Informationen zu dem Thema „Reul legt Verordnung vor“. Lesen Sie jetzt „Neue Vorgaben für Kinder und Jugendliche in Polizeizellen“.,https://img.zeit.de/news/2024-10/10/neue-vorgaben-fuer-kinder-und-jugendliche-in-polizeizellen-image-group/wide__1300x731,2024-10-10T03:00:38Z,,"Polizeizellen sollen auch für Kinder oder Jugendliche altersgerecht angepasst werden. Das sieht eine neue Verordnung von Innenminister Herbert Reul (CDU) vor, die nach dpa-Informationen diese Woche v… [+2177 chars]",,de,'Kinder'
