index,url,valid,domain,title,description,image,published,archive,content,quote,language,keyword
https://www.faz.net/aktuell/politik/ausland/hungersnot-in-teilen-des-gazastreifens-erklaert-110650613.html,https://www.faz.net/aktuell/politik/ausland/hungersnot-in-teilen-des-gazastreifens-erklaert-110650613.html,0,www.faz.net,Gazakrieg: Eine Portion Reis am Tag für eine ganze Familie,"Viele Menschen im Gazastreifen leiden Hunger. Oft würden Eltern für ihre Kinder auf Essen verzichten, berichtet eine UNICEF-Vertreterin.",https://media0.faz.net/ppmedia/w1200/aktuell/610220824/1.10650610/facebook_teaser/ein-konvoi-mit.jpg.webp,2025-08-22T15:32:07Z,,Wie zwei verschiedene Welten nimmt Tess Ingram von UNICEF die aktuelle Lage im Gazastreifen im Vergleich zu ihrem letzten Besuch im Februar wahr. Sie ist aktuell wieder dort. Eine ganze Familie ernäh… [+334 chars],,de,'Kinder'
https://www.diepresse.com/20016790/ex-regulator-martin-graf-zu-hohen-kosten-die-e-control-haette-laengst-handeln-muessen,https://www.diepresse.com/20016790/ex-regulator-martin-graf-zu-hohen-kosten-die-e-control-haette-laengst-handeln-muessen,0,www.diepresse.com,Ex-Regulator Martin Graf zu hohen Kosten: „Die E-Control hätte längst handeln müssen“ [premium],"Die Debatte über die hohen Energiekosten lenke von strukturellen Defiziten ab, sagt Ex-Regulator und Energie-Steiermark-Chef Martin Graf. Auch das neue Stromgesetz löse nicht alle Probleme. In seinen Augen hätte es nie so weit kommen müssen – wenn die E-Contr…",https://img.diepresse.com/public/incoming/9tk1cn-Martin-Graf/alternates/DPR_SOCIAL_NACHRICHTEN/Martin%20Graf,2025-08-22T18:09:14Z,,"Der Umbau des Energiesystems ist eine heikle Operation. Wie heikel, zeigt der öffentliche Disput über das Elektrizitätswirtschaftsgesetz (ElWG), das den Ausbau der sauberen Kraftwerke und Stromnetze … [+4324 chars]",,de,'Energiekosten'
https://www.stern.de/gesellschaft/regional/hamburg-schleswig-holstein/klimaschutz--umweltminister--kein-ccs-unter-dem-festland-35995548.html,https://www.stern.de/gesellschaft/regional/hamburg-schleswig-holstein/klimaschutz--umweltminister--kein-ccs-unter-dem-festland-35995548.html,0,www.stern.de,Klimaschutz: Umweltminister: Kein CCS unter dem Festland,Ein Einsatz der umstrittenen CCS-Technik zur Speicherung von Kohlendioxid ist für Umweltminister Tobias Goldschmidt eine Notlösung. Eines werde Schleswig-Holstein nicht machen.,https://image.stern.de/35995550/t/9i/v1/w1440/r1.7778/-/23--xjefjyqtlcv6axs2048jpeg---f666cd32cecb41d8.jpg,2025-08-23T03:00:41Z,,"Kopiere den aktuellen Link
Zur Merkliste hinzufügen
Ein Einsatz der umstrittenen CCS-Technik zur Speicherung von Kohlendioxid ist für Umweltminister Tobias Goldschmidt eine Notlösung. Eines werde S… [+3014 chars]",,de,'Kohle'
https://www.zeit.de/familie/2025-08/norbert-f-schneider-eltern-kinder-erziehung-familie,https://www.zeit.de/familie/2025-08/norbert-f-schneider-eltern-kinder-erziehung-familie,0,www.zeit.de,"Norbert F. Schneider: ""Die Eltern entmündigen ihre Kinder""","Eltern machen sich das Leben unnötig kompliziert, sagt der Familienforscher Norbert F. Schneider. Sie sollten ihre Servicementalität aufgeben – zum Besten des Kindes.",https://img.zeit.de/familie/2025-08/norbert-schneider-mut-tut-gut-kinder-mikromanagement-eltern-erschoepfung-bild-3/wide__1300x731,2025-08-23T12:46:27Z,https://web.archive.org/web/20250823085441/https://www.zeit.de/familie/2025-08/norbert-f-schneider-eltern-kinder-erziehung-familie,"Schließen
Artikelzusammenfassung
Elternschaft ist heute unnötig kompliziert und überladen mit Erwartungen, die zu Überforderung führen. Eltern sollen perfekt sein und alle Bedürfnisse ihrer Kinder … [+551 chars]",,de,'Kinder'
https://www.zeit.de/kultur/2025-08/judith-simon-ki-chatbots-abhaengigkeit-bildung-ethik,https://www.zeit.de/kultur/2025-08/judith-simon-ki-chatbots-abhaengigkeit-bildung-ethik,0,www.zeit.de,"Judith Simon: ""Kinder sind durch KI viel verletzlicher""","Es blinkt, es bimmelt, dann fängt der KI-Chatbot zu flirten an. Die Ethikerin Judith Simon warnt vor emotionaler Abhängigkeit und analysiert, was dahintersteckt.",https://img.zeit.de/kultur/2025-08/judith-simon-ki-chatbots-abhaengigkeit-bildung-ethik-bild/wide__1300x731,2025-08-23T18:11:47Z,https://web.archive.org/web/20250824054214/https://www.zeit.de/kultur/2025-08/judith-simon-ki-chatbots-abhaengigkeit-bildung-ethik,"Wenn die Ethikprofessorin Judith Simon über Internetkonzerne spricht, wird sie deutlich: Man dürfe sich von deren Technologien nicht einlullen lassen, sagt sie im Interview. Eigentlich hat sie Urlaub… [+389 chars]",,de,'Kinder'
https://www.stern.de/gesellschaft/regional/hessen/natur--bestand-der-eisvoegel-in-hessen-erholt-sich-leicht-35996740.html,https://www.stern.de/gesellschaft/regional/hessen/natur--bestand-der-eisvoegel-in-hessen-erholt-sich-leicht-35996740.html,0,www.stern.de,Natur: Bestand der Eisvögel in Hessen erholt sich leicht,"Bessere Gewässerqualität und mildere Winter helfen den seltenen ""Fliegenden Edelsteinen"". Was bringt die kleinen flinken Fischjäger mit so schillernd buntem Gefieder weiterhin in Bedrängnis?",https://image.stern.de/35996742/t/zs/v1/w1440/r1.7778/-/24--zeirzyghdev15axs2048jpeg---426163fceab9d5fa.jpg,2025-08-24T02:00:44Z,,"Kopiere den aktuellen Link
Zur Merkliste hinzufügen
Bessere Gewässerqualität und mildere Winter helfen den seltenen ""Fliegenden Edelsteinen"". Was bringt die kleinen flinken Fischjäger mit so schill… [+2709 chars]",,de,'Winter'
https://www.bild.de/sport/mehr-sport/wieder-kohle-regen-fuer-poker-profi-oesterreicher-zerlegt-seine-naechsten-gegner-68aa95d35d3e123a945a9238,https://www.bild.de/sport/mehr-sport/wieder-kohle-regen-fuer-poker-profi-oesterreicher-zerlegt-seine-naechsten-gegner-68aa95d35d3e123a945a9238,0,www.bild.de,Wieder Kohle-Regen für Poker-Profi - Österreicher zerlegt seine nächsten Gegner,Er hat dein Lauf seines Lebens! Der österreichische Poker-Profi Klemens Roiter hat gerade einfach den Poker-Gott auf seiner Seite. Bei der European Poker...,"https://images.bild.de/68aa95d35d3e123a945a9238/15cefb093021ad841dc9276bd0f9c0d2-landscape,c30ddae5?w=1280",2025-08-24T04:56:24Z,,"Er hat dein Lauf seines Lebens!
Der österreichische Poker-Profi Klemens Roiter hat gerade einfach den Poker-Gott auf seiner Seite. Bei der European Poker Tour in Barcelona schnappt er sich das 30.00… [+2058 chars]",,de,'Kohle'
https://www.tagesspiegel.de/berlin/kultur-lausitz-festival-bietet-grosse-kunst-in-krasser-gegend-14220026.html,https://www.tagesspiegel.de/berlin/kultur-lausitz-festival-bietet-grosse-kunst-in-krasser-gegend-14220026.html,0,www.tagesspiegel.de,Kultur: Lausitz Festival bietet „große Kunst“ in „krasser Gegend“,"Aus einer Brikettfabrik wird eine Bühne: Mit Shakespeare-Sonetten ist das Lausitz Festival in der historischen „Louise“ gestartet – und zeigt, wie sich die Region von der Kohle zur Kultur wandelt.",https://www.tagesspiegel.de/images/14222018/alternates/BASE_16_9_W1400/1756051380000/lausitz-festival-probe-in-brikettfabrik.jpeg,2025-08-24T06:02:02Z,https://web.archive.org/web/20250828204520/https://www.tagesspiegel.de/berlin/kultur-lausitz-festival-bietet-grosse-kunst-in-krasser-gegend-14220026.html,In der ältesten noch funktionstüchtigen Brikettfabrik Europas ist das Lausitz Festival eröffnet worden. In der historischen Brikettfabrik Louise in Uebigau-Wahrenbrück (Landkreis Elbe-Elster) erlebte… [+1262 chars],,de,'Kohle'
https://www.zeit.de/news/2025-08/25/china-nimmt-weiter-mehr-kohlekraft-ans-stromnetz,https://www.zeit.de/news/2025-08/25/china-nimmt-weiter-mehr-kohlekraft-ans-stromnetz,0,www.zeit.de,Klima: China nimmt weiter mehr Kohlekraft ans Stromnetz,Hier finden Sie Informationen zu dem Thema „Klima“. Lesen Sie jetzt „China nimmt weiter mehr Kohlekraft ans Stromnetz“.,https://img.zeit.de/news/2025-08/25/china-nimmt-weiter-mehr-kohlekraft-ans-stromnetz-image-group/wide__1300x731,2025-08-25T00:00:38Z,https://web.archive.org/web/20250825012121/https://www.zeit.de/news/2025-08/25/china-nimmt-weiter-mehr-kohlekraft-ans-stromnetz,China hat im ersten Halbjahr 2025 so viel Kohlekraft neu ans Netz genommen wie seit neun Jahren nicht mehr. Und das trotz seines rapiden Ausbaus bei erneuerbaren Energien. Einer Analyse des Zentrums … [+2474 chars],,de,'Kohle'
https://www.faz.net/aktuell/wirtschaft/klima-nachhaltigkeit/energieversorgung-china-baut-erneuerbare-und-kohle-aus-110653087.html,https://www.faz.net/aktuell/wirtschaft/klima-nachhaltigkeit/energieversorgung-china-baut-erneuerbare-und-kohle-aus-110653087.html,0,www.faz.net,Energieversorgung: In China boomen Erneuerbare – aber Kohle auch,Die Dimensionen sind riesig: 2025 baut China seine Kapazitäten für Wind- und Solarenergie 25-mal stärker aus als Deutschland. Aber auch viele neue Kohlekraftwerke gehen ans Netz. Wie lange setzt Peking noch darauf?,https://media1.faz.net/ppmedia/w1200/aktuell/wirtschaft/1738229892/1.10653101/facebook_teaser/ein-arbeiter-in-nordchina.jpg.webp,2025-08-25T01:29:43Z,,China hat im ersten Halbjahr 2025 so viel Kohlekraft neu ans Netz genommen wie seit neun Jahren nicht mehr. Und das trotz seines rapiden Ausbaus bei erneuerbaren Energien. Einer Analyse des Zentrums … [+2409 chars],,de,'Kohle'
https://www.n-tv.de/wirtschaft/China-schliesst-so-viele-Kohlekraftwerke-an-wie-seit-2016-nicht-article25985236.html,https://www.n-tv.de/wirtschaft/China-schliesst-so-viele-Kohlekraftwerke-an-wie-seit-2016-nicht-article25985236.html,0,www.n-tv.de,Trotz 500 Gigawatt Erneuerbarer: China schließt viele neue Kohlekraftwerke an,"Mit einer Kapazität von insgesamt 80 Gigawatt nimmt China so viele Kohlekraftwerke ans Netz wie lange nicht. Die Regierung gibt dabei an, die Kraftwerke nur flexibel zu nutzen, wenn nicht genügend erneuerbare Energie produziert werde. Analysten kritisieren, d…",https://www.n-tv.de/img/incoming/crop25985239/6151328534-cImg_16_9-w1200/AP25044127230318.jpg,2025-08-25T05:13:45Z,https://web.archive.org/web/20250825070359/https://www.n-tv.de/wirtschaft/China-schliesst-so-viele-Kohlekraftwerke-an-wie-seit-2016-nicht-article25985236.html,"Mit einer Kapazität von insgesamt 80 Gigawatt nimmt China so viele Kohlekraftwerke ans Netz wie lange nicht. Die Regierung gibt dabei an, die Kraftwerke nur flexibel zu nutzen, wenn nicht genügend er… [+2691 chars]",,de,'Kohle'
https://www.zeit.de/wirtschaft/2025-08/kohleindustrie-china-erneuerbare-emissionen-wachstum,https://www.zeit.de/wirtschaft/2025-08/kohleindustrie-china-erneuerbare-emissionen-wachstum,0,www.zeit.de,Kohleindustrie: China nimmt wieder mehr Kohlekraftwerke ans Netz,"In China ist seit Jahresbeginn Kohlekraft mit einer Kapazität von 21 Gigawatt ans Netz gegangen, ein Höchstwert seit 2016. Zugleich boomen erneuerbare Energieträger.",https://img.zeit.de/wirtschaft/2025-08/kohleindustrie-china-erneuerbare/wide__1300x731,2025-08-25T05:29:43Z,,China hat im ersten Halbjahr 2025 so viel Kohlekraft neu ans Netz genommen wie seit neun Jahren nicht mehr. Zugleich boomt in dem Land auch der Ausbau erneuerbarer Energien. Einer Analyse des Zentrum… [+2797 chars],,de,'Kohle'
https://www.stern.de/familie/merinowolle-richtig-waschen--so-pflegen-sie-die-sensiblen-fasern-35440702.html,https://www.stern.de/familie/merinowolle-richtig-waschen--so-pflegen-sie-die-sensiblen-fasern-35440702.html,0,www.stern.de,Geniales Garn: Merinowolle waschen: Warum die feinen Fasern Fluch und Segen zugleich sind,Merino ist magisch. Die feinen Fasern der australischen Schafe wärmen im Winter und kühlen im Sommer. Nur beim Waschen ist die beliebte Merinowolle etwas zickig.,https://image.stern.de/35441468/t/mG/v2/w1440/r1.7778/-/merinowolle-waschen-aufmacher-februar-2025.jpg,2025-08-25T07:19:00Z,https://web.archive.org/web/20250825102039/https://www.stern.de/familie/merinowolle-richtig-waschen--so-pflegen-sie-die-sensiblen-fasern-35440702.html,"Kopiere den aktuellen Link
Zur Merkliste hinzufügen
Merino ist magisch. Die feinen Fasern der australischen Schafe wärmen im Winter und kühlen im Sommer. Nur beim Waschen ist die beliebte Merinowol… [+4021 chars]",,de,'Winter'
https://www.stern.de/news/trotz-rekordausbau-von-erneuerbaren--china-produziert-immer-mehr-kohlestrom-35999066.html,https://www.stern.de/news/trotz-rekordausbau-von-erneuerbaren--china-produziert-immer-mehr-kohlestrom-35999066.html,0,www.stern.de,Trotz Rekordausbau von Erneuerbaren: China produziert immer mehr Kohlestrom,"Die Produktion von Strom aus Kohle hat in China im ersten Halbjahr diesen Jahres stark zugenommen. Zwar erreicht die Energieproduktion aus erneuerbaren Quellen in dem Land ebenfalls immer neue Rekorde, ein geplanter weiterer Ausbau der Kohleverbrennung beunru…",https://image.stern.de/35999068/t/UD/v1/w1440/r1.7778/-/25--kohle---546eae3b8fceafaf.jpg,2025-08-25T09:22:49Z,,"Kopiere den aktuellen Link
Zur Merkliste hinzufügen
Die Produktion von Strom aus Kohle hat in China im ersten Halbjahr diesen Jahres stark zugenommen. Zwar erreicht die Energieproduktion aus erneue… [+1791 chars]",,de,'Kohle'
https://orf.at/stories/3403472/,https://orf.at/stories/3403472/,0,orf.at,China: Produktion von Kohlestrom stark zugenommen,,https://orf.at/mojo/1_4_1/storyserver//news/common/images/og-fallback-news.png,2025-08-25T09:28:15Z,,"Die Produktion von Strom aus Kohle hat in China im ersten Halbjahr dieses Jahres stark zugenommen. Zwar erreicht die Energieproduktion aus erneuerbaren Quellen in dem Land ebenfalls neue Höchstwerte,… [+1751 chars]",,de,'Kohle'
https://www.bild.de/sport/fussball/3-mio-fuer-knight-woerl-das-plant-hannover-96-mit-der-transfer-kohle-68ac1f728c33b226bcae6fa9,https://www.bild.de/sport/fussball/3-mio-fuer-knight-woerl-das-plant-hannover-96-mit-der-transfer-kohle-68ac1f728c33b226bcae6fa9,0,www.bild.de,3 Mio. für Knight und Wörl - Das plant 96 mit der frischen Transfer-Kohle,Hannover 96 hat Josh Knight und Marius Wörl für viel Geld verkauft. Kommt jetzt noch ein Kracher für den Aufstieg?,"https://images.bild.de/68ac1f728c33b226bcae6fa9/1e08a292093e11922f386bee4dd16b76,d9c44ad2?w=1280",2025-08-25T09:36:54Z,http://archive.md/20250825094505/https://www.bild.de/sport/fussball/3-mio-fuer-knight-woerl-das-plant-hannover-96-mit-der-transfer-kohle-68ac1f728c33b226bcae6fa9,"Hannover 96 hat Josh Knight und Marius Wörl für viel Geld verkauft. Kommt jetzt noch ein Kracher für den Aufstieg?
Die ganze Geschichte lesen Sie mit BILDplus.",,de,'Kohle'
https://www.zeit.de/news/2025-08/25/neues-hochwasserschutzlager-in-schoenebeck,https://www.zeit.de/news/2025-08/25/neues-hochwasserschutzlager-in-schoenebeck,0,www.zeit.de,250.000 Sandsäcke: Neues Hochwasserschutzlager in Schönebeck,Hier finden Sie Informationen zu dem Thema „250.000 Sandsäcke“. Lesen Sie jetzt „Neues Hochwasserschutzlager in Schönebeck“.,https://img.zeit.de/news/2025-08/25/neues-hochwasserschutzlager-in-schoenebeck-image-group/wide__1300x731,2025-08-25T12:02:22Z,https://web.archive.org/web/20250825122325/https://www.zeit.de/news/2025-08/25/neues-hochwasserschutzlager-in-schoenebeck,"Damit Einsatzkräfte bei Hochwasser schneller reagieren können, ist in Schönebeck (Salzlandkreis) ein neues Hochwasserschutzlager errichtet worden. Ziel sei es, im Hochwasserfall eine schnelle Verfügb… [+1376 chars]",,de,'Hochwasser'
https://www.stern.de/gesellschaft/regional/sachsen-anhalt/250-000-sandsaecke--neues-hochwasserschutzlager-in-schoenebeck-35999750.html,https://www.stern.de/gesellschaft/regional/sachsen-anhalt/250-000-sandsaecke--neues-hochwasserschutzlager-in-schoenebeck-35999750.html,0,www.stern.de,250.000 Sandsäcke: Neues Hochwasserschutzlager in Schönebeck,"Im Hochwasserfall heißt es vor allem: Sandsäcke füllen und Wasser abpumpen. Damit Material schnell zum Einsatzort gebracht werden kann, gibt es jetzt ein neues Zentrallager.",https://image.stern.de/35999752/t/cK/v1/w1440/r1.7778/-/25--pyh4rctra6v4axs2048jpeg---8b878ab40a171da2.jpg,2025-08-25T12:02:22Z,,"Kopiere den aktuellen Link
Zur Merkliste hinzufügen
Im Hochwasserfall heißt es vor allem: Sandsäcke füllen und Wasser abpumpen. Damit Material schnell zum Einsatzort gebracht werden kann, gibt es j… [+1565 chars]",,de,'Hochwasser'
https://kaernten.orf.at/stories/3319043/,https://kaernten.orf.at/stories/3319043/,0,kaernten.orf.at,Sommerschule in Kärnten gestartet,"In Kärnten beginnt die Sommerschule an 62 Standorten mit 3100 angemeldeten Kindern. Die Initiative bietet Schülern die Möglichkeit, Lerninhalte zu festigen und Deutsch zu erlernen. Die freiwillige Teilnahme erfreut sich großer Beliebtheit bei Schülern und Elt…",https://ibs.orf.at/ktn?image=https%3A%2F%2Foekastatic.orf.at%2Fmims%2F2025%2F35%2F05%2Fcrops%2Fw%3D1200%2Ch%3D627%2Cq%3D75%2F2743953_master_1057105_kh_typ_sz_sommerschule_250825_1_00_00_00_00.jpg%3Fs%3Ddafe539692ea27e68842a1557fa826716a3fa04d,2025-08-25T14:21:21Z,https://web.archive.org/web/20250825152424/https://kaernten.orf.at/stories/3319043/,"Katja Wulz, die Organisatorin der Sommerschule in Velden, berichtet, dass das Lernen mit Freude im Vordergrund steht: Das Wichtigste an der Sommerschule ist uns, dass die Kinder mit Freude lernen und… [+2342 chars]",,de,'Kinder'
https://taz.de/Aufnahme-von-Kindern-aus-Gaza/!6106335/,https://taz.de/Aufnahme-von-Kindern-aus-Gaza/!6106335/,0,taz.de,Aufnahme von Kindern aus Gaza: Auch Hamburg will human sein,"Der Senat signalisiert Bereitschaft, verletzte Kinder aus Gaza medizinisch zu versorgen. Nötig seien dafür klare Vorgaben des federführenden Bundes.",https://taz.de/picture/7890920/1200/verletztes-Kind-dpa-Mohammad-Abu-Elsebah-1.jpeg,2025-08-25T14:29:00Z,https://web.archive.org/web/20250827022043/https://taz.de/Aufnahme-von-Kindern-aus-Gaza/!6106335/,"Der Senat signalisiert Bereitschaft, verletzte Kinder aus Gaza medizinisch zu versorgen. Nötig seien dafür klare Vorgaben des federführenden Bundes. mehr...",,de,'Kinder'
https://www.diepresse.com/20030878/es-geht-nicht-nur-um-ratings-es-geht-auch-um-unsere-kinder,https://www.diepresse.com/20030878/es-geht-nicht-nur-um-ratings-es-geht-auch-um-unsere-kinder,0,www.diepresse.com,"Es geht nicht nur um Ratings, es geht auch um unsere Kinder [premium]","Die Ratingagenturen zweifeln an der finanziellen Zukunft Österreichs. Hohe Defizite und steigende Schulden wirken sich negativ auf das Vertrauen aus. Jetzt zählt nicht schöne Rhetorik, sondern ein glaubwürdiger Kurswechsel bei der Budgetpolitik.",https://img.diepresse.com/public/incoming/prcj32-AUSTRIA-POLITICS/alternates/DPR_SOCIAL_MEINUNG/AUSTRIA-POLITICS,2025-08-25T15:02:40Z,https://web.archive.org/web/20250825153808/https://www.diepresse.com/20030878/es-geht-nicht-nur-um-ratings-es-geht-auch-um-unsere-kinder,"In Zeiten, in denen schlechte Nachrichten dominieren, überbringen wir zuerst die guten Nachrichten: Die drei großen Ratingagenturen Fitch, Moodys und S&amp;P beurteilen Österreichs aktuelle Finanzlag… [+3361 chars]",,de,'Kinder'
https://www.stern.de/news/polens-praesident-blockiert-verlaengerung-der-hilfen-fuer-gefluechtete-ukrainer-36000504.html,https://www.stern.de/news/polens-praesident-blockiert-verlaengerung-der-hilfen-fuer-gefluechtete-ukrainer-36000504.html,0,www.stern.de,Polens Präsident blockiert Verlängerung der Hilfen für geflüchtete Ukrainer,"Polens rechtsnationalistischer Präsident Karol Nawrocki hat ein Gesetz zur Verlängerung der Sozialhilfen für Kinder von geflüchteten Ukrainerinnen und Ukrainer blockiert. Die Hilfen sollten seiner Ansicht nach nur Eltern zustehen, ""die in Polen arbeiten wolle…",https://image.stern.de/36000506/t/qE/v1/w1440/r1.7778/-/25--polens-praesident-karol-nawrocki---826f1eeb1df733a0.jpg,2025-08-25T15:29:50Z,,"Kopiere den aktuellen Link
Zur Merkliste hinzufügen
Polens rechtsnationalistischer Präsident Karol Nawrocki hat ein Gesetz zur Verlängerung der Sozialhilfen für Kinder von geflüchteten Ukrainerinne… [+1601 chars]",,de,'Kinder'
https://www.focus.de/panorama/welt/mutter-prueft-ob-ihre-tochter-gut-in-den-kindergarten-kommt-und-beobachtet-ruehrenden-moment_6bd99328-f47e-4e4a-9dcd-1ea3d0695f4a.html,https://www.focus.de/panorama/welt/mutter-prueft-ob-ihre-tochter-gut-in-den-kindergarten-kommt-und-beobachtet-ruehrenden-moment_6bd99328-f47e-4e4a-9dcd-1ea3d0695f4a.html,0,www.focus.de,"Mutter prüft, ob ihre Tochter gut in den Kindergarten kommt – und beobachtet rührenden Moment","Mutter prüft, ob ihre Tochter gut in den Kindergarten kommt – unvorbereitet auf das, was sie sieht",https://quadro.burda-forward.de/ctf/6c322ee2-e3ec-414a-bc49-18a4fe999d59.af1e817f-8c12-4bf3-babd-c2b2ba3a7520.jpg?im=RegionOfInterestCrop%3D%281200%2C630%29%2CregionOfInterest%3D%281069%2C707%29&hash=90de83c8dda4b2a06590c468535d9ca8f58a75f20def3b8c0ac2cadb3b026ff9,2025-08-25T15:40:35Z,https://web.archive.org/web/20250825173731/https://www.focus.de/panorama/welt/mutter-prueft-ob-ihre-tochter-gut-in-den-kindergarten-kommt-und-beobachtet-ruehrenden-moment_6bd99328-f47e-4e4a-9dcd-1ea3d0695f4a.html,"Der erste Tag im Kindergarten ist für Klein und Groß ein aufregendes Ereignis umso schöner, wenn man Unterstützung von der Familie erfährt. Dieses Glück hat Lia (5) aus den USA, wie eine rührende Auf… [+1952 chars]",,de,'Kinder'
https://www.faz.net/aktuell/feuilleton/medien-und-film/medienpolitik/nrw-medienminister-liminski-ist-gegen-social-media-verbot-110653762.html,https://www.faz.net/aktuell/feuilleton/medien-und-film/medienpolitik/nrw-medienminister-liminski-ist-gegen-social-media-verbot-110653762.html,0,www.faz.net,Altersbeschränkung: Liminski: Social-Media-Verbot rechtlich fragwürdig,Die schädlichen Folgen von Social Media sind bekannt. Politiker diskutieren ein Verbot für Kinder und Jugendliche. Einige sehen dadurch die Rechte junger Menschen bedroht. Jetzt melden sich Hendrik Streeck und Nathanael Liminski.,https://media1.faz.net/ppmedia/w1200/aktuell/feuilleton/medien-und-film/medienpolitik/3458344704/1.10654369/facebook_teaser/an-vielen-schulen-herrscht.jpg.webp,2025-08-25T15:45:44Z,https://web.archive.org/web/20250825160833/https://www.faz.net/aktuell/feuilleton/medien-und-film/medienpolitik/nrw-medienminister-liminski-ist-gegen-social-media-verbot-110653762.html,"Dass es Kinder und Jugendliche zu schützen gilt, darin sind sich alle einig. Längst sind die Risiken bekannt, die mit dem unregulierten Konsum sozialer Medien insbesondere durch junge Nutzer in Verbi… [+4044 chars]",,de,'Kinder'
https://vorarlberg.orf.at/stories/3318980/,https://vorarlberg.orf.at/stories/3318980/,0,vorarlberg.orf.at,Verpflichtende Kinderschutz-Konzepte gefordert,"Ein Fall von Gewalt zwischen Kindern in einem Vorarlberger Ferienlager hat nun zu einem Gerichtsurteil geführt. Dem Verein, der die Ferienfreizeit anbietet, wurden schwere Versäumnisse vorgeworfen. Verpflichtende Konzepte zum Kinderschutz seien unbedingt notw…",https://ibs.orf.at/vbg?image=https%3A%2F%2Foekastatic.orf.at%2Fmims%2F2025%2F08%2F60%2Fcrops%2Fw%3D1200%2Ch%3D627%2Cq%3D75%2F2528248_master_968760_downloadmedium_44.jpg%3Fs%3D91e48e7503ccc9b8eef63890c4715ba0bcc0cf51,2025-08-25T16:02:18Z,https://web.archive.org/web/20250825185235/https://vorarlberg.orf.at/stories/3318980/,"Bei einem Ferienlager sei ein Kinderschutzkonzept ein absolutes Muss, sagte Psychologin Gössler auf ORF-Nachfrage am Montag. Sie ist beim Vorarlberger Kinderdorf für Qualitätsentwicklung und Kindersc… [+5382 chars]",,de,'Kinder'
https://www.bild.de/news/inland/drama-um-block-kinder-anwalt-zeigt-gerhard-delling-an-68ab02a47e689a64b6fe758b,https://www.bild.de/news/inland/drama-um-block-kinder-anwalt-zeigt-gerhard-delling-an-68ab02a47e689a64b6fe758b,0,www.bild.de,Prozess um Block-Kinder - Strafanzeige gegen Delling,Stephan Hensel erstattet Strafanzeige gegen Gerhard Delling wegen Verleumdung im Zusammenhang mit Kinderpornografie-Vorwürfen.,"https://images.bild.de/68ab02a47e689a64b6fe758b/535c0e0d60a889dd58fbb7431a6abea9,f4b6dfe3?w=1280",2025-08-25T17:49:29Z,https://web.archive.org/web/20250825180850/https://www.bild.de/news/inland/drama-um-block-kinder-anwalt-zeigt-gerhard-delling-an-68ab02a47e689a64b6fe758b,"Alle Gewinner des SPORT BILD-Awards-Abends Große Ehre für Boris Becker!
Alle Gewinner des SPORT BILD-Awards-Abends Große Ehre für Boris Becker!
Alle Gewinner des SPORT BILD-Awards-Abends Große Ehre… [+528 chars]",,de,'Kinder'
https://taz.de/Chinas-setzt-auf-Kohle-und-Erneuerbare/!6106319/,https://taz.de/Chinas-setzt-auf-Kohle-und-Erneuerbare/!6106319/,0,taz.de,Chinas setzt auf Kohle und Erneuerbare: Ambivalentes energiepolitisches Modell,China baut die erneuerbaren Energien aus wie kein anderes Land auf der Welt. Trotzdem setzt die Volksrepublik auch auf die klimaschädliche Kohle.,https://taz.de/picture/7891801/1200/39079282-1.jpeg,2025-08-25T18:03:00Z,https://web.archive.org/web/20250825204048/https://taz.de/Chinas-setzt-auf-Kohle-und-Erneuerbare/!6106319/,China baut die erneuerbaren Energien aus wie kein anderes Land auf der Welt. Trotzdem setzt die Volksrepublik auch auf die klimaschädliche Kohle. mehr...,,de,'Kohle'
