index,url,valid,domain,title,description,image,published,archive,content,quote,language,keyword
https://www.welt.de/vermischtes/video253929142/Livestream-Tornados-reissen-Daecher-ab-Sorge-vor-Fluten-So-wuetet-Hurrikan-Milton-in-Florida.html,https://www.welt.de/vermischtes/video253929142/Livestream-Tornados-reissen-Daecher-ab-Sorge-vor-Fluten-So-wuetet-Hurrikan-Milton-in-Florida.html,0,www.welt.de,"Tornados reißen Dächer ab, Sorge vor Fluten – So wütet Hurrikan „Milton“ in Florida",Hurrikan „Milton“ hat Floridas Küste erreicht und für einen Blackout gesorgt. Schon vor seinem Eintreffen hat er mehrere Tornados ausgelöst. Gleichzeitig wächst die Sorge vor einer Vier-Meter-Flut. Sehen Sie die diese und weitere Nachrichten bei WELT TV.,https://img.welt.de/img/masters/mobile160492822/7651629427-ci16x9-w1200/welt-fallback-jpg.jpg,2024-10-10T04:06:00Z,,Hurrikan Milton hat Floridas Küste erreicht und für einen Blackout gesorgt. Schon vor seinem Eintreffen hat er mehrere Tornados ausgelöst. Gleichzeitig wächst die Sorge vor einer Vier-Meter-Flut. Seh… [+98 chars],,de,'Blackout'
https://www.welt.de/vermischtes/video253929142/Livestream-Hurrikan-Milton-trifft-Florida-Biden-spricht-von-Jahrhundertereignis.html,https://www.welt.de/vermischtes/video253929142/Livestream-Hurrikan-Milton-trifft-Florida-Biden-spricht-von-Jahrhundertereignis.html,0,www.welt.de,Hurrikan „Milton“ trifft Florida – Biden spricht von Jahrhundertereignis,"Hurrikan „Milton“ hat Floridas Küste erreicht und für einen Blackout gesorgt. Nach Medienangaben sind über zwei Millionen Haushalte ohne Strom. Es gibt erste Berichte über Tote, Verletzte und massive Schäden. Sehen Sie die diese und weitere Nachrichten bei WE…",https://img.welt.de/img/masters/mobile160492822/7651629427-ci16x9-w1200/welt-fallback-jpg.jpg,2024-10-10T04:06:00Z,,"Hurrikan Milton hat Floridas Küste erreicht und für einen Blackout gesorgt. Nach Medienangaben sind über zwei Millionen Haushalte ohne Strom. Es gibt erste Berichte über Tote, Verletzte und massive S… [+109 chars]",,de,'Blackout'
https://www.welt.de/vermischtes/video253933186/Hurrikan-Milton-trifft-auf-Florida-erste-Berichte-ueber-Tote-und-Verletzte.html,https://www.welt.de/vermischtes/video253933186/Hurrikan-Milton-trifft-auf-Florida-erste-Berichte-ueber-Tote-und-Verletzte.html,0,www.welt.de,Hurrikan „Milton“ trifft auf Florida – „Zwei Millionen Menschen ohne Strom“,"Hurrikan „Milton“ hat Floridas Küste erreicht und für einen Blackout gesorgt. Nach Medienberichten sind rund zwei Millionen Menschen ohne Strom. Es gibt auch erste Nachrichten über Tote, Verletzte und massive Schäden. WELT-Korrespondent Michael Wüllenweber be…",https://img.welt.de/img/bildergalerien/mobile253933184/3027936707-ci16x9-w1200/On-heels-of-Helene-storm-Milton-expected-to-strengthen-into-majo.jpg,2024-10-10T05:11:31Z,http://archive.md/20241011191545/https://www.welt.de/vermischtes/video253933186/Hurrikan-Milton-trifft-auf-Florida-erste-Berichte-ueber-Tote-und-Verletzte.html,"Hurrikan Milton hat Floridas Küste erreicht und für einen Blackout gesorgt. Nach Medienberichten sind rund zwei Millionen Menschen ohne Strom. Es gibt auch erste Nachrichten über Tote, Verletzte und … [+121 chars]",,de,'Blackout'
https://steiermark.orf.at/stories/3276564/,https://steiermark.orf.at/stories/3276564/,0,steiermark.orf.at,Blackout: Kommunikationsübung mit Pannen,Eine steiermarkweite Blackout-Kommunikationsübung ist am Mittwoch nicht ganz ohne Probleme verlaufen. Einige Gemeinden konnten nur über den vor 15 Jahren abgeschafften analogen Feuerwehrfunk erreicht werden; tausende Personen erhielten mehrmals Warn-SMS aufgr…,https://ibs.orf.at/stm?image=https%3A%2F%2Foekastatic.orf.at%2Fmims%2F2024%2F41%2F12%2Fcrops%2Fw%3D1200%2Ch%3D627%2Cq%3D75%2F2381625_master_909612_apa_themenbild_blackout_.jpg%3Fs%3Dc90748099aa480bc7995c402c78678b6c155dff5,2024-10-10T05:14:00Z,,"Bei der Kommunikationsübung wurde getestet, ob und wie Behörden im Ernstfall miteinander kommunizieren können. Ziel war es, so Harald Eitner, Leiter der Fachabteilung für Katastrophenschutz in der St… [+1941 chars]",,de,'Blackout'
https://www.welt.de/vermischtes/video253933620/Hurrikan-Milton-trifft-auf-Florida-Mammut-Flut-von-vier-Metern-Hoehe-ist-groesste-Gefahr.html,https://www.welt.de/vermischtes/video253933620/Hurrikan-Milton-trifft-auf-Florida-Mammut-Flut-von-vier-Metern-Hoehe-ist-groesste-Gefahr.html,0,www.welt.de,„Anrollende Mammut-Flut von vier Metern Höhe ist größte Gefahr“,"Hurrikan „Milton“ hat Floridas Küste erreicht und für einen Blackout gesorgt. Nach Medienberichten sind rund zwei Millionen Menschen ohne Strom. „Die größte Gefahr ist die anrollende Mammut-Flut von vier Metern Höhe“, berichtet WELT-Korrespondent Michael Wüll…",https://img.welt.de/img/vermischtes/mobile253933720/9957930557-ci16x9-w1200/Wuelle-Schalte-9966-jpg.jpg,2024-10-10T06:24:40Z,http://archive.md/20241011185818/https://www.welt.de/vermischtes/video253933620/Hurrikan-Milton-trifft-auf-Florida-Mammut-Flut-von-vier-Metern-Hoehe-ist-groesste-Gefahr.html,Hurrikan Milton hat Floridas Küste erreicht und für einen Blackout gesorgt. Nach Medienberichten sind rund zwei Millionen Menschen ohne Strom. Die größte Gefahr ist die anrollende Mammut-Flut von vie… [+121 chars],,de,'Blackout'
https://wien.orf.at/stories/3276608/,https://wien.orf.at/stories/3276608/,0,wien.orf.at,Wienflussradweg bleibt weiter gesperrt,"Noch zwei bis drei Wochen wird es nach Angaben der Stadt Wien dauern, bis der Wienflussradweg wieder freigegeben werden kann. Grund dafür sind die Aufräumarbeiten nach dem Hochwasser. Die Auhofstraße wird als Ausweichroute empfohlen.",https://ibs.orf.at/wie?image=https%3A%2F%2Foekastatic.orf.at%2Fmims%2F2024%2F41%2F92%2Fcrops%2Fw%3D1200%2Ch%3D627%2Cq%3D75%2F2381800_master_909692_wf.jpg%3Fs%3D539888a4b69caa6c545ebe387afd45f09bd6ec3c,2024-10-10T08:27:50Z,,Der Radweg verläuft von Auhof bis zur Kennedybrücke kreuzungsfrei im Flussbett der Wien. Bei Hochwasser muss er allerdings gesperrt werden. Mitte September führte der Wienfluss laut MA 45 ein 1.000-j… [+744 chars],,de,'Hochwasser'
https://www.kino.de/film/disneys-snow-white-2025/news/fuer-neuen-fantasy-film-disney-aendert-schneewittchen-namensursprung/,https://www.kino.de/film/disneys-snow-white-2025/news/fuer-neuen-fantasy-film-disney-aendert-schneewittchen-namensursprung/,0,www.kino.de,Für neuen Fantasy-Film: Disney ändert Schneewittchen-Namensursprung,Mit „Schneewittchen“ bringt Disney die Neuverfilmung seines Klassikers in die Kinos. Diese birgt eine andere Ursprungsgeschichte für den Namen der Prinzessin.,https://crops.giga.de/fe/a8/62/c87938cd7268bb624c0f57f391_YyAyMDEyeDExMzIrNCs1NTACcmUgMTkyMCAxMDgwA2Y4YzljMmIyMDc5.jpg,2024-10-10T09:20:22Z,,"Mit „Schneewittchen“ bringt Disney die Neuverfilmung seines Klassikers in die Kinos. Diese birgt eine andere Ursprungsgeschichte für den Namen der Prinzessin.
Mit Neuverfilmungen ist es so eine Sach… [+5702 chars]",,de,'Schnee'
https://www.n-tv.de/mediathek/audio/panorama/Ex-Hurrikan-Kirk-bringt-Orkanboeen-und-Hochwasser-Warnkarten-zeigen-wo-es-heute-gefaehrlich-wird-article25282348.html,https://www.n-tv.de/mediathek/audio/panorama/Ex-Hurrikan-Kirk-bringt-Orkanboeen-und-Hochwasser-Warnkarten-zeigen-wo-es-heute-gefaehrlich-wird-article25282348.html,0,www.n-tv.de,"Karten zeigen Gefahrenmeldungen: Ex-Hurrikan ""Kirk"" bringt Orkanböen und Hochwasser","In großen Teilen Deutschlands wird es heute ungemütlich: Wetterdienste warnen vor Orkanböen und extremen Regenfällen. Aktuelle ntv.de-Karten zeigen, worauf sich die Menschen in den unterschiedlichen Regionen einstellen müssen.",https://bilder2.n-tv.de/img/Bilder_dpa_Import/crop25279961/3801327199-cImg_16_9-w1200/Kirk-bringt-Windstarken-von-mehr-als-100-Kilometern-pro-Stunde.jpg,2024-10-10T09:20:54Z,,"In großen Teilen Deutschlands wird es heute ungemütlich: Wetterdienste warnen vor Orkanböen und extremen Regenfällen. Aktuelle ntv.de-Karten zeigen, worauf sich die Menschen in den unterschiedlichen … [+2061 chars]",,de,'Hochwasser'
https://wien.orf.at/stories/3276610/,https://wien.orf.at/stories/3276610/,0,wien.orf.at,S80 fährt wieder ab 9. November,Die „Neue“ Westbahnstrecke kann früher als bisher angekündigt wieder befahren werden. Auch in Wien steht nach dem Hochwasser der Fahrplan für die Wiederinbetriebnahme wichtiger Zugverbindungen fest.,https://ibs.orf.at/wie?image=https%3A%2F%2Foekastatic.orf.at%2Fmims%2F2019%2F37%2F61%2Fcrops%2Fw%3D1200%2Ch%3D627%2Cq%3D75%2F293173_master_90461_praterstern_wien_nord_04_coe.jpg%3Fs%3D877eefcb166264df0d8d3e79f58e14ceabfba30e,2024-10-10T09:51:55Z,,Mit 4. November ist die Wiederinbetriebnahme der neuen Weststrecke im Bereich Wienerwald Tunnel und Lainzer Tunnel und damit ein Pendelverkehr Wien Westbahnhof Tullnerfeld (CJX5) vorgesehen mehr dazu… [+847 chars],,de,'Hochwasser'
https://www.diepresse.com/18950331/oebb-weststrecke-der-etappenplan-bis-zum-normalzustand,https://www.diepresse.com/18950331/oebb-weststrecke-der-etappenplan-bis-zum-normalzustand,0,www.diepresse.com,ÖBB-Weststrecke: Der Etappenplan bis zum Normalzustand,"Ab 15. Dezember fahren Züge auf der Weststrecke wieder wie gewohnt, schon davor kann der Bahnhof Tullnerfeld in Betrieb genommen werden. Die ÖBB wird das Hochwasser aber noch viel länger beschäftigen.",https://img.diepresse.com/public/incoming/d7qooz-Eisenbahn/alternates/DPR_SOCIAL_NACHRICHTEN/Eisenbahn,2024-10-10T10:11:15Z,,"Ab 15. Dezember fahren Züge auf der Weststrecke wieder wie gewohnt, schon davor kann der Bahnhof Tullnerfeld in Betrieb genommen werden. Die ÖBB wird das Hochwasser aber noch viel länger beschäftigen… [+6373 chars]",,de,'Hochwasser'
https://www.diepresse.com/18951416/radweg-am-wienfluss-bleibt-nach-hochwasser-noch-zwei-bis-drei-wochen-gesperrt,https://www.diepresse.com/18951416/radweg-am-wienfluss-bleibt-nach-hochwasser-noch-zwei-bis-drei-wochen-gesperrt,0,www.diepresse.com,Radweg am Wienfluss bleibt nach Hochwasser noch zwei bis drei Wochen gesperrt,"Ab kommender Woche werde mit den Abschlussarbeiten begonnen, so die Stadt. Die Mobilitätsagentur empfiehlt die Auhofstraße als Ausweichroute.",https://img.diepresse.com/public/incoming/gouoz4-Wienfluss/alternates/DPR_SOCIAL_NACHRICHTEN/Wienfluss,2024-10-10T10:43:51Z,,"Ab kommender Woche werde mit den Abschlussarbeiten begonnen, so die Stadt. Die Mobilitätsagentur empfiehlt die Auhofstraße als Ausweichroute.
Der Wienflussradweg im Westen Wiens bleibt aufgrund der … [+1109 chars]",,de,'Hochwasser'
https://noe.orf.at/stories/3276643/,https://noe.orf.at/stories/3276643/,0,noe.orf.at,Katastrophengebiet-Status wird am Abend aufgehoben,Der nach dem Hochwasser von Mitte September noch bestehende Status als Katastrophengebiet für Teile Niederösterreichs soll am Donnerstagabend aufgehoben werden. Die Einstufung galt noch für die Bezirke Tulln und St. Pölten-Land sowie für die Landeshauptstadt.,https://ibs.orf.at/noe?image=https%3A%2F%2Foekastatic.orf.at%2Fmims%2F2024%2F38%2F74%2Fcrops%2Fw%3D1200%2Ch%3D627%2Cq%3D75%2F2354636_master_897874_unwetter_situation_in_niederoesterreich_grosssierning_10.jpg%3Fs%3Da88003e1979671ea2268de70e6366e2d7ca2cb69,2024-10-10T10:57:11Z,,"Über 93.000 Einsatzkräfte standen bisher im Einsatz, davon fast 60.000 Kameradinnen und Kameraden der Freiwilligen Feuerwehr. Im Tullnerfeld laufen aktuell noch lokale Pumparbeiten, im Pielachtal wer… [+3057 chars]",,de,'Hochwasser'
https://www.stern.de/gesellschaft/regional/rheinland-pfalz-saarland/hochwasser--dauerregen-laesst-mosel-ueber-die-ufer-treten-35133140.html,https://www.stern.de/gesellschaft/regional/rheinland-pfalz-saarland/hochwasser--dauerregen-laesst-mosel-ueber-die-ufer-treten-35133140.html,0,www.stern.de,Hochwasser: Dauerregen lässt Mosel über die Ufer treten,"Bei Bernkastel-Kues mussten wegen des Hochwassers mehrere Straßen gesperrt werden. Nach und nach sollen die Wasserstände nun fallen, ganz trocken wird es aber auch am Wochenende nicht.",https://image.stern.de/35133142/t/P1/v1/w1440/r1.7778/-/10--p3byyxwchzv8axw800h600jpeg---0bd8f20cfdaa4e4a.jpg,2024-10-10T11:38:36Z,,"Bei Bernkastel-Kues mussten wegen des Hochwassers mehrere Straßen gesperrt werden. Nach und nach sollen die Wasserstände nun fallen, ganz trocken wird es aber auch am Wochenende nicht.
Anhaltender D… [+1723 chars]",,de,'Hochwasser'
https://www.zeit.de/news/2024-10/10/dauerregen-laesst-mosel-ueber-die-ufer-treten,https://www.zeit.de/news/2024-10/10/dauerregen-laesst-mosel-ueber-die-ufer-treten,0,www.zeit.de,Hochwasser: Dauerregen lässt Mosel über die Ufer treten,Hier finden Sie Informationen zu dem Thema „Hochwasser“. Lesen Sie jetzt „Dauerregen lässt Mosel über die Ufer treten“.,https://img.zeit.de/news/2024-10/10/dauerregen-laesst-mosel-ueber-die-ufer-treten-image-group/wide__1300x731,2024-10-10T11:38:36Z,,Anhaltender Dauerregen hat in Rheinland-Pfalz und im Saarland für Hochwasser an mehreren Gewässern gesorgt. Bei Bernkastel-Kues (Landkreis Bernkastel-Wittlich) mussten mehrere Straßen in den Mittagss… [+2121 chars],,de,'Hochwasser'
https://www.bild.de/news/ausland/kaprun-hintertux-und-co-skipisten-in-oesterreich-bereits-offen-6707887c1c37d93523670152,https://www.bild.de/news/ausland/kaprun-hintertux-und-co-skipisten-in-oesterreich-bereits-offen-6707887c1c37d93523670152,0,www.bild.de,Schnee vom Frühjahr gebunkert - Die Skilifte fahren schon wieder!,In den österreichischen Alpen startete bereits der Skibetrieb. Grund: Die Österreicher haben tatsächlich noch Schnee vom letzten Jahr im Gefrierfach!,"https://images.bild.de/6707887c1c37d93523670152/853827c0c490e2edc0c11bd639dec9c6,8f4792b6?w=1280",2024-10-10T12:10:13Z,,"Kaprun (Österreich) Der Schnee von gestern, der macht's möglich!
Wegen heftiger Schneefälle und weil die Österreicher noch Schnee von der letzten Saison übrig haben, hat die Skisaison in den Alpen f… [+1200 chars]",,de,'Schnee'
https://orf.at/stories/3372295/,https://orf.at/stories/3372295/,0,orf.at,Sorge vor hartem Winter in der Ukraine,"Am Samstag hätte sich die Kontaktgruppe für die Verteidigung der Ukraine in Ramstein in Deutschland treffen sollen, um über das weitere Vorgehen zu beraten – nun wurde der Gipfel aber auf unbestimmte Zeit verschoben. Doch die Zeit drängt, vor allem in Hinblic…",https://ibs.orf.at/news?image=https%3A%2F%2Fassets.orf.at%2Fmims%2F2024%2F41%2F98%2Fcrops%2Fw%3D1200%2Ch%3D630%2Cq%3D75%2F2380809_master_909298_ukraine_winter_appelle_warnungen_afp.jpg%3Fs%3Ddbcca13bfa74336c8fc3fad24c74fc92fd1c315b,2024-10-11T04:04:38Z,,"Der Bürgermeister von Kiew, Witali Klitschko, äußerte am Donnerstag bei einem Besuch in Deutschland während eines Gebetes die Hoffnung auf Frieden. Viele Städte und Gemeinden in der Ukraine seien zer… [+4580 chars]",,de,'Kälte'
https://www.diepresse.com/18951670/die-freerider-warten-schon,https://www.diepresse.com/18951670/die-freerider-warten-schon,0,www.diepresse.com,Die Freerider warten schon,Etwas mehr Schnee als in der Vorsaison – dafür gäb’s schon Ideen.,https://img.diepresse.com/public/incoming/b7qofk-imago0551637818h.jpg/alternates/DPR_SOCIAL_MAGAZIN/imago0551637818h.jpg,2024-10-11T06:00:00Z,,"Etwas mehr Schnee als in der Vorsaison dafür gäbs schon Ideen. 
Alles schön weiß das ist der Idealfall freier Wintertage. Tannen, Dörfer, Skiberge putzig eingeschneit und doch keine Wolke am Himmel,… [+1602 chars]",,de,'Schnee'
https://www.focus.de/wissen/im-herbst-und-winter-5-dinge-sollten-autofahrer-jetzt-wieder-im-auto-haben_id_242415317.html,https://www.focus.de/wissen/im-herbst-und-winter-5-dinge-sollten-autofahrer-jetzt-wieder-im-auto-haben_id_242415317.html,0,www.focus.de,Im Herbst und Winter - 5 Dinge sollten Autofahrer jetzt wieder im Auto haben,"Niedrige Temperaturen, Nässe und Eis lassen Autos gerne ausfallen. Deshalb ist es besonders wichtig, für den Fall einer Autopanne gut ausgerüstet zu sein. Diese Dinge sollten Sie im Notfall unbedingt dabei haben.",https://p6.focus.de/img/fotos/id_260374953/5-dinge-die-jeder-autofahrer-jetzt-dabei-haben-sollte-758301449.jpg?im=Crop%3D%280%2C177%2C2121%2C1060%29%3BResize%3D%281200%2C627%29&impolicy=perceptual&quality=mediumHigh&hash=95a524b7cf4a757855cd232fa6aa90956dbe91e42126c9b065e2c9d5605d6c70,2024-10-11T10:11:51Z,,"Niedrige Temperaturen, Nässe und Eis lassen Autos gerne ausfallen. Deshalb ist es besonders wichtig, für den Fall einer Autopanne gut ausgerüstet zu sein. Diese Dinge sollten Sie im Notfall unbedingt… [+3308 chars]",,de,'Winter'
https://www.morgenpost.de/ratgeber-wissen/article407444350/mit-smarten-geraeten-heizkosten-sparen-so-gehtE28099s.html,https://www.morgenpost.de/ratgeber-wissen/article407444350/mit-smarten-geraeten-heizkosten-sparen-so-gehtE28099s.html,0,www.morgenpost.de,Mit smarten Geräten Heizkosten sparen – so geht’s!,"tink bietet eine Reihe von intelligenten Heizungsprodukten exzellenter Hersteller an, die auf Energieeffizienz, ein gesundes Raumklima und Automatisierung ausgerichtet sind. Wir stellen Ihnen die wichtigsten Produkte vor.",https://img.sparknews.funkemedien.de/407445244/407445244_1728640018_v16_9_1600.jpeg,2024-10-11T10:22:42Z,,"tink bietet eine Reihe von intelligenten Heizungsprodukten exzellenter Hersteller an, die auf Energieeffizienz, ein gesundes Raumklima und Automatisierung ausgerichtet sind. Wir stellen Ihnen die wic… [+4681 chars]",,de,'Heizkosten'
https://www.zeit.de/kultur/2024-10/naturkatastrophen-klimawandel-einfluss-mensch-verschwoerung,https://www.zeit.de/kultur/2024-10/naturkatastrophen-klimawandel-einfluss-mensch-verschwoerung,0,www.zeit.de,Naturkatastrophen: Die Rückkehr der Götter,Hurrikane und Hochwasser gelten wieder als unvermeidliche Naturkatastrophen – oder gleich als Verschwörung von Gegnern. Warum fliehen Menschen zurück in die Unmündigkeit?,https://img.zeit.de/politik/2024-10/zwe-politisch-motiviert-hurrikan/wide__1300x731,2024-10-11T11:45:01Z,http://archive.md/20241011115221/https://www.zeit.de/kultur/2024-10/naturkatastrophen-klimawandel-einfluss-mensch-verschwoerung,"Dieser Artikel ist Teil von ZEIT am Wochenende, Ausgabe 41/2024.
Bevor Hurrikan Milton auf die Westküste Floridas traf, erklärte die Influencerin Caroline Calloway, sich nicht in Sicherheit bringen … [+666 chars]",,de,'Hochwasser'
https://www.stern.de/gesellschaft/regional/berlin-brandenburg/kinderbetreuung--kita-streik-in-berlin-endgueltig-verboten-35136382.html,https://www.stern.de/gesellschaft/regional/berlin-brandenburg/kinderbetreuung--kita-streik-in-berlin-endgueltig-verboten-35136382.html,0,www.stern.de,Kinderbetreuung: Kita-Streik in Berlin endgültig verboten,Schwere Schlappe für Verdi & Co. vor dem Landesarbeitsgericht. Ein unbefristeter Streik an kommunalen Kitas darf endgültig nicht stattfinden. Die Gewerkschaft ist enttäuscht - es fließen sogar Tränen.,https://image.stern.de/35136384/t/bm/v2/w1440/r1.7778/-/11--jpidiak757v10axw800h600jpeg---b46e9e9452e863cd.jpg,2024-10-11T13:18:49Z,,Schwere Schlappe für Verdi &amp; Co. vor dem Landesarbeitsgericht. Ein unbefristeter Streik an kommunalen Kitas darf endgültig nicht stattfinden. Die Gewerkschaft ist enttäuscht - es fließen sogar Tr… [+4753 chars],,de,'Kinder'
https://www.sueddeutsche.de/panorama/neuseeland-kinder-vater-verschwunden-lux.NELw6B7tgxQa2FbDz4CyR6,https://www.sueddeutsche.de/panorama/neuseeland-kinder-vater-verschwunden-lux.NELw6B7tgxQa2FbDz4CyR6,0,www.sueddeutsche.de,Neuseeland: Verschwunden in der Wildnis,"Ein Vater soll mit drei Kindern abgetaucht sein und durch die neuseeländischen Wälder streifen. Nun wurden sie das erste Mal seit Jahren wieder gesichtet, von Teenagern auf Schweinejagd.",https://www.sueddeutsche.de/2024/10/11/bc7a0911-aa3c-443f-9269-7e639d3a16cd.png?q=60&fm=webp&width=1200&rect=124%2C129%2C1821%2C1024,2024-10-11T13:52:21Z,http://archive.md/20241011140549/https://www.sueddeutsche.de/panorama/neuseeland-kinder-vater-verschwunden-lux.NELw6B7tgxQa2FbDz4CyR6,"Ein Vater soll mit drei Kindern abgetaucht sein und durch die neuseeländischen Wälder streifen. Nun wurden sie das erste Mal seit Jahren wieder gesichtet, von Teenagern auf Schweinejagd. Jeden Morgen… [+534 chars]",,de,'Kinder'
https://www.stern.de/gesellschaft/regional/rheinland-pfalz-saarland/ministerium-fuer-bildung--deutsch-sprachkurse-fuer-schueler-in-den-herbstferien-35136774.html,https://www.stern.de/gesellschaft/regional/rheinland-pfalz-saarland/ministerium-fuer-bildung--deutsch-sprachkurse-fuer-schueler-in-den-herbstferien-35136774.html,0,www.stern.de,Ministerium für Bildung: Deutsch-Sprachkurse für Schüler in den Herbstferien,Knapp 2.400 Kinder und Jugendliche können auch in diesen Herbstferien wieder Deutschkurse belegen. Sie richten sich vor allem an neu zugewanderte Schüler.,https://image.stern.de/35136776/t/Si/v1/w1440/r1.7778/-/11--oeh5wicmwhv8axw800h600jpeg---9612fd0b7aa15c1c.jpg,2024-10-11T13:57:22Z,,"Knapp 2.400 Kinder und Jugendliche können auch in diesen Herbstferien wieder Deutschkurse belegen. Sie richten sich vor allem an neu zugewanderte Schüler.
Das rheinland-pfälzische Ministerium für Bi… [+524 chars]",,de,'Kinder'
https://www.tagesspiegel.de/potsdam/landeshauptstadt/sauna-verbot-fur-kinder-sinkt-bald-wieder-die-altersgrenze-im-potsdamer-blu-12516728.html,https://www.tagesspiegel.de/potsdam/landeshauptstadt/sauna-verbot-fur-kinder-sinkt-bald-wieder-die-altersgrenze-im-potsdamer-blu-12516728.html,0,www.tagesspiegel.de,Sauna-Verbot für Kinder: Sinkt bald wieder die Altersgrenze im Potsdamer Blu?,Nach Kritik an den neuen Regeln suchen die städtische Koordinatorin für Jugendinteressen und die Bäderbetriebe nach einem Kompromiss.,https://www.tagesspiegel.de/images/7996591/alternates/BASE_16_9_W1400/1662030490000/schwimmhalle-blu-in-potsdam.jpeg,2024-10-11T14:01:58Z,,Das von den Bäderbetrieben verfügte zeitweise Kinderverbot in der Sauna der Schwimmhalle Blu könnte wieder abgeschwächt werden. Im Jugendhilfeausschuss berichtete die städtische Koordinatorin für Kin… [+264 chars],,de,'Kinder'
https://www.bild.de/sport/fussball/dynamo-dresden-warum-jong-min-seo-aus-norwegen-fluechtete-67091c8cbcb9c020eaf3a5f2,https://www.bild.de/sport/fussball/dynamo-dresden-warum-jong-min-seo-aus-norwegen-fluechtete-67091c8cbcb9c020eaf3a5f2,0,www.bild.de,„Schnee bis zur Hüfte“ - Wie Seo zum Wiedersehen mit Dynamo kam,"Jong-min Seo (22) trifft mit dem Chemnitzer FC Sachsenpokal-Hit auf Ex-Klub Dynamo Dresden. BILD verrät die kuriose Geschichte, wie es dazu kam.Foto: IMAGO/Dennis Hetzschold","https://images.bild.de/67091c8cbcb9c020eaf3a5f2/587ae03fbe3c8691905fac2dcd795e4a,6ea51ebd?w=1280",2024-10-11T14:06:12Z,,"Heimspielpremiere, Derby-Stimmung und erstes Duell mit dem Ex-Klub: Für Jong-min Seo (22) vom Chemnitzer FC wird der Sachsenpokal-Hit Samstag (14.05 Uhr) gegen Dynamo Dresden ein echtes Highlight. In… [+2315 chars]",,de,'Schnee'
https://www.sueddeutsche.de/politik/ukraine-russland-selenskij-putin-olay-scholz-bundestag-militaerhilfe-biden-lux.Ja7E8ZyNnwAx2HKxXtBxxA,https://www.sueddeutsche.de/politik/ukraine-russland-selenskij-putin-olay-scholz-bundestag-militaerhilfe-biden-lux.Ja7E8ZyNnwAx2HKxXtBxxA,0,www.sueddeutsche.de,Russischer Angriffskrieg: Die Ukraine vor einem harten Winter,"Das Land erhält weitere Militärhilfe von Deutschland – doch bei der Europatour von Präsident Wolodimir Selenskij wird deutlich, dass Debatten für ein Kriegsende an Fahrt gewinnen.",https://www.sueddeutsche.de/2024/10/11/68ad90b8-ef82-4105-a2bf-d7e55028107b.jpeg?q=60&fm=webp&width=1200&rect=0%2C0%2C3000%2C1688,2024-10-11T15:00:28Z,,"Es war schon der vierte Besuch in Deutschland in diesem Jahr, und vor den Fahnen der Ukraine und Deutschland machte Kanzler Olaf Scholz (SPD) am Freitag klar: Lieber Wolodimir, Deutschland steht weit… [+5607 chars]",,de,'Heizkosten'
https://www.zeit.de/news/2024-10/11/frau-soll-blumenkuebel-auf-kinder-in-garten-geworfen-haben,https://www.zeit.de/news/2024-10/11/frau-soll-blumenkuebel-auf-kinder-in-garten-geworfen-haben,0,www.zeit.de,Kriminalität: Frau soll Blumenkübel auf Kinder in Garten geworfen haben,Hier finden Sie Informationen zu dem Thema „Kriminalität“. Lesen Sie jetzt „Frau soll Blumenkübel auf Kinder in Garten geworfen haben“.,https://img.zeit.de/news/2024-10/11/frau-soll-blumenkuebel-auf-kinder-in-garten-geworfen-haben-image-group/wide__1300x731,2024-10-11T15:00:56Z,,Eine Seniorin soll in Durach (Landkreis Oberallgäu) von ihrem Balkon aus unter anderem gefüllte Blumentöpfe auf ihre Nachbarn geworfen haben. Drei von ihnen hätten am Mittwoch im Gefahrenbereich gest… [+613 chars],,de,'Kinder'
https://www.n-tv.de/ratgeber/Ab-diesem-Alter-tauschen-Sie-Winterreifen-besser-aus-article25278180.html,https://www.n-tv.de/ratgeber/Ab-diesem-Alter-tauschen-Sie-Winterreifen-besser-aus-article25278180.html,0,www.n-tv.de,Wechselsaison beginnt: Ab diesem Alter tauschen Sie Winterreifen besser aus,"Reifen härten auf Dauer aus. Winterreifen haben eine weichere Gummimischung als Pneus für den Sommer. Bei der Frage, wann neue gekauft werden sollten, spielt das Alter daher auch eine große Rolle.",https://bilder3.n-tv.de/img/incoming/crop23581334/1131328228-cImg_16_9-w1200/267521176.jpg,2024-10-11T17:25:47Z,,"Reifen härten auf Dauer aus. Winterreifen haben eine weichere Gummimischung als Pneus für den Sommer. Bei der Frage, wann neue gekauft werden sollten, spielt das Alter daher auch eine große Rolle.
A… [+2038 chars]",,de,'Winter'
