index,url,valid,domain,title,description,image,published,archive,content,quote,language,keyword
https://www.zeit.de/news/2026-02/19/kaelte-als-waffe-der-vierte-kriegswinter-in-kiew,https://www.zeit.de/news/2026-02/19/kaelte-als-waffe-der-vierte-kriegswinter-in-kiew,0,www.zeit.de,Krieg in der Ukraine: Kälte als Waffe - der vierte Kriegswinter in Kiew,Hier finden Sie Informationen zu dem Thema „Krieg in der Ukraine“. Lesen Sie jetzt „Kälte als Waffe - der vierte Kriegswinter in Kiew“.,https://img.zeit.de/news/2026-02/19/kaelte-als-waffe-der-vierte-kriegswinter-in-kiew-image-group/wide__1300x731,2026-02-19T05:00:12Z,,"Zum Ende des vierten Kriegsjahres erlebt die Ukraine ihren schlimmsten Winter. Zweistellige Minusgrade, Schnee und Glatteis machen den Menschen über Wochen den ohnehin schwierigen Alltag zusätzlich z… [+5845 chars]",,de,'Glatteis'
https://www.stern.de/politik/ausland/krieg-in-der-ukraine--kaelte-als-waffe---der-vierte-kriegswinter-in-kiew-37150414.html,https://www.stern.de/politik/ausland/krieg-in-der-ukraine--kaelte-als-waffe---der-vierte-kriegswinter-in-kiew-37150414.html,0,www.stern.de,Krieg in der Ukraine: Kälte als Waffe - der vierte Kriegswinter in Kiew,"Kalte Wohnungen, vereiste Wasserrohre und immer neue Stromausfälle. Vor allem arme und gebrechliche Menschen haben mit den Folgen der russischen Angriffe zu kämpfen.",https://image.stern.de/37150416/t/0T/v1/w1440/r1.7778/-/19--b7eakzmlo7v6axs2048jpeg---39e67ebcd48b02af.jpg,2026-02-19T05:00:12Z,,"Kopiere den aktuellen Link
Zur Merkliste hinzufügen
Kalte Wohnungen, vereiste Wasserrohre und immer neue Stromausfälle. Vor allem arme und gebrechliche Menschen haben mit den Folgen der russischen … [+6026 chars]",,de,'Kälte'
https://www.tagesspiegel.de/internationales/krieg-in-der-ukraine-kalte-als-waffe-der-vierte-kriegswinter-in-kiew-15268488.html,https://www.tagesspiegel.de/internationales/krieg-in-der-ukraine-kalte-als-waffe-der-vierte-kriegswinter-in-kiew-15268488.html,0,www.tagesspiegel.de,Krieg in der Ukraine: Kälte als Waffe - der vierte Kriegswinter in Kiew,"Kalte Wohnungen, vereiste Wasserrohre und immer neue Stromausfälle. Vor allem arme und gebrechliche Menschen haben mit den Folgen der russischen Angriffe zu kämpfen.",https://www.tagesspiegel.de/images/15268487/alternates/BASE_16_9_W1400/1771477340000/ukraine-krieg-kiew.jpeg,2026-02-19T05:02:20Z,,"Zum Ende des vierten Kriegsjahres erlebt die Ukraine ihren schlimmsten Winter. Zweistellige Minusgrade, Schnee und Glatteis machen den Menschen über Wochen den ohnehin schwierigen Alltag zusätzlich z… [+5871 chars]",,de,'Kälte'
https://www.zeit.de/politik/2026-02/gasversorgung-deutschland-gasspeicher-katherina-reiche-nachrichtenpodcast,https://www.zeit.de/politik/2026-02/gasversorgung-deutschland-gasspeicher-katherina-reiche-nachrichtenpodcast,0,www.zeit.de,Gasversorgung: In Deutschland wird das Gas knapp,"Deutschlands Gasspeicher sind leer wie selten. Das liegt nicht nur am kalten Winter. Und: Ist Glyphosat krebserregend? Bayer weist das zurück, zahlt aber nun Milliarden.",https://img.zeit.de/politik/2017-09/illu-podcast-news/wide__8ed8a6__1300x731,2026-02-19T05:10:07Z,,"In Deutschland sinken die Gasspeicherstände. Der Füllstand liegt derzeit im Schnitt nur noch bei 24 Prozent, in Bayern sind es knapp 18 Prozent. Besonders der Süden ist betroffen: Dort gibt es vergle… [+1669 chars]",,de,'Gas'
https://www.zeit.de/news/2026-02/19/winter-legt-in-bayern-nach,https://www.zeit.de/news/2026-02/19/winter-legt-in-bayern-nach,0,www.zeit.de,Wetter: Winter legt in Bayern nach,Hier finden Sie Informationen zu dem Thema „Wetter“. Lesen Sie jetzt „Winter legt in Bayern nach“.,https://img.zeit.de/news/2026-02/19/winter-legt-in-bayern-nach-image-group/wide__1300x731,2026-02-19T05:32:51Z,,Der Winter gibt in weiten Teilen Bayerns noch nicht auf. Am Donnerstag wird in einem breiten Streifen von Unter- über Mittelfranken bis zum Bayerwald teilweise kräftiger Schneefall erwartet. Auch in … [+669 chars],,de,'Winter'
https://www.stern.de/gesellschaft/regional/baden-wuerttemberg/wetterbericht--wo-schneefall--gefrierender-regen-und-sturmboeen-drohen-37150456.html,https://www.stern.de/gesellschaft/regional/baden-wuerttemberg/wetterbericht--wo-schneefall--gefrierender-regen-und-sturmboeen-drohen-37150456.html,0,www.stern.de,"Wetterbericht: Wo Schneefall, gefrierender Regen und Sturmböen drohen","Schwarzwald, Odenwald, Rhein: Wer sich aufs Wochenende freut, sollte das Wetter im Blick behalten. Starker Wind und Glatteis könnten Pläne über den Haufen werfen.",https://image.stern.de/37150458/t/EE/v1/w1440/r1.7778/-/19--eluboap4vxv3axs2048jpeg---54a73cb96aa6e700.jpg,2026-02-19T05:37:02Z,,"Kopiere den aktuellen Link
Zur Merkliste hinzufügen
Schwarzwald, Odenwald, Rhein: Wer sich aufs Wochenende freut, sollte das Wetter im Blick behalten. Starker Wind und Glatteis könnten Pläne über d… [+2464 chars]",,de,'Schnee'
https://www.zeit.de/news/2026-02/19/schneefall-in-nordrhein-westfalen-nur-von-kurzer-dauer,https://www.zeit.de/news/2026-02/19/schneefall-in-nordrhein-westfalen-nur-von-kurzer-dauer,0,www.zeit.de,Winterwetter: Schneefall in Nordrhein-Westfalen nur von kurzer Dauer,Hier finden Sie Informationen zu dem Thema „Winterwetter“. Lesen Sie jetzt „Schneefall in Nordrhein-Westfalen nur von kurzer Dauer“.,https://img.zeit.de/news/2026-02/19/schneefall-in-nordrhein-westfalen-nur-von-kurzer-dauer-image-group/wide__1300x731,2026-02-19T05:48:27Z,,Der in der Nacht in vielen Teilen Nordrhein-Westfalens gefallene Schnee ist nur von kurzer Dauer. Am Wochenende werden laut Deutschem Wetterdienst wieder steigende Temperaturen und reichlich Regen er… [+962 chars],,de,'Schnee'
https://www.zeit.de/news/2026-02/19/winter-legt-nach-es-faellt-noch-einmal-reichlich-schnee,https://www.zeit.de/news/2026-02/19/winter-legt-nach-es-faellt-noch-einmal-reichlich-schnee,0,www.zeit.de,Wetter: Winter legt nach: Es fällt noch einmal reichlich Schnee,Hier finden Sie Informationen zu dem Thema „Wetter“. Lesen Sie jetzt „Winter legt nach: Es fällt noch einmal reichlich Schnee“.,https://img.zeit.de/news/2026-02/19/winter-legt-nach-es-faellt-noch-einmal-reichlich-schnee-image-group/wide__1300x731,2026-02-19T06:04:23Z,,Teils unwetterartiges Winterwetter mit kräftigen Schneemengen steht Teilen Deutschlands in Haus. Von Nordrhein-Westfalen über Hessen und Rheinland-Pfalz bis nach Ostbayern schneit es in der ersten Ta… [+1111 chars],,de,'Winter'
https://www.stern.de/gesellschaft/regional/hamburg-schleswig-holstein/wetter--von-frost-zu-fruehling--norddeutschland-erlebt-wetterwechsel-37150572.html,https://www.stern.de/gesellschaft/regional/hamburg-schleswig-holstein/wetter--von-frost-zu-fruehling--norddeutschland-erlebt-wetterwechsel-37150572.html,0,www.stern.de,Wetter: Von Frost zu Frühling? Norddeutschland erlebt Wetterwechsel,"Frost, Glatteis und dann plötzlich milde 10 Grad: In Norddeutschland schlägt das Wetter am Wochenende um. Was der Deutsche Wetterdienst für die kommenden Tage vorhersagt.",https://image.stern.de/37150574/t/dW/v1/w1440/r1.7778/-/19--2chpfpbsc2v6axs2048jpeg---489b5fab7a83b3c5.jpg,2026-02-19T06:43:14Z,,"Kopiere den aktuellen Link
Zur Merkliste hinzufügen
Frost, Glatteis und dann plötzlich milde 10 Grad: In Norddeutschland schlägt das Wetter am Wochenende um. Was der Deutsche Wetterdienst für die k… [+1530 chars]",,de,'Glatteis'
https://www.tagesspiegel.de/gesellschaft/panorama/erneuter-wintereinbruch-trifft-deutschland-schnee-frost--und-am-wochenende-dann-plotzlich-fruhling-15268660.html,https://www.tagesspiegel.de/gesellschaft/panorama/erneuter-wintereinbruch-trifft-deutschland-schnee-frost--und-am-wochenende-dann-plotzlich-fruhling-15268660.html,0,www.tagesspiegel.de,"Erneuter Wintereinbruch trifft Deutschland: Schnee, Frost – und am Wochenende dann plötzlich Frühling","Kräftiger Schneefall, gefährliches Glatteis und Unfälle sorgen am Donnerstag für Probleme. Doch schon ab Samstag steigen die Temperaturen in Teilen Deutschlands zweistellig.",https://www.tagesspiegel.de/images/15268588/alternates/BASE_16_9_W1400/1771484818000/winter-in-hamburg.jpeg,2026-02-19T07:23:05Z,,Ein Wintereinbruch mit teils unwetterartigem Schneefall hat am Donnerstag weite Teile Deutschlands erneut lahmgelegt. Vom Münsterland über Hessen bis nach Ostbayern schneit es seit den frühen Morgens… [+2717 chars],,de,'Glatteis'
https://www.morgenpost.de/berlin/article411256383/notfaelle-wegen-glatteis-in-berlin-charitC3A9-betreibt-sogar-extra-op-saal.html,https://www.morgenpost.de/berlin/article411256383/notfaelle-wegen-glatteis-in-berlin-charitC3A9-betreibt-sogar-extra-op-saal.html,0,www.morgenpost.de,Notfälle wegen Glatteis in Berlin – Charité betreibt sogar Extra-OP-Saal,Extremer Frost sorgt in Berlin für Chaos: Immer mehr Menschen landen nach Stürzen in der Notaufnahme – wie dramatisch war die Lage wirklich?,https://img.sparknews.funkemedien.de/411256382/411256382_1771486210_v16_9_1600.jpeg,2026-02-19T07:30:09Z,,"Seit Wochen herrscht in Berlin strenger Frost, viele Gehwege sind immer wieder spiegelglatt. Eine erste Auswertung mehrerer Kliniken zeigt: Zu Jahresbeginn mussten deutlich mehr Patientinnen und Pati… [+3023 chars]",,de,'Glatteis'
https://www.zeit.de/gesellschaft/2026-02/winterchaos-schnee-unfaelle-dwd,https://www.zeit.de/gesellschaft/2026-02/winterchaos-schnee-unfaelle-dwd,0,www.zeit.de,Deutscher Wetterdienst: Unwetterartiger Wintereinbruch sorgt für Schnee und Glatteis,Fünf bis 20 Zentimeter Neuschnee in sechs Stunden: Der Wetterdienst warnt erneut vor winterlichem Unwetter. Vor allem im Süden ist auch Glatteis möglich.,https://img.zeit.de/mobilitaet/2026-02/winter-wetter-schnee-und-glaetteunfaelle-bild/wide__1300x731,2026-02-19T09:00:24Z,,Der Deutsche Wetterdienst (DWD) warnt erneut vor Unwettern in vielen Teilen Deutschlands. Von Nordrhein-Westfalen über Hessen und Rheinland-Pfalz bis nach Ostbayern soll es demnach in der ersten Tage… [+690 chars],,de,'Winter'
https://www.stern.de/panorama/extremwetter--frankreich-kaempft-gegen-fluten----venedig-ohne-gondeln--37150696.html,https://www.stern.de/panorama/extremwetter--frankreich-kaempft-gegen-fluten----venedig-ohne-gondeln--37150696.html,0,www.stern.de,"Extremwetter in Europa: Frankreich kämpft gegen Schnee und Fluten: „Wie Venedig ohne Gondeln""",In den österreichischen Alpen kommt es immer wieder zu Lawinenabgängen. Auch Frankreich bleibt nicht von Extremwetter-Ereignissen verschont: Der Südwesten versinkt in Hochwasser.,https://image.stern.de/37150930/t/uV/v3/w1440/r1.7778/-/hochwasser-und-lawinen-in-frankreich-und-oesterreich.jpg,2026-02-19T09:22:00Z,,"Zugang zu stern+statt 11,96 
 nur 1  
<ul><li>Alles von stern+ mit erstklassigen Inhalten von GEO und Capital</li><li>4 Wochen testen, dann 2,99  je Woche</li><li>jederzeit kündbar</li></ul>",,de,'Hochwasser'
https://www.zeit.de/zeit-magazin/wochenmarkt/2025-04/gemuese-pie-rezept-wochenmarkt,https://www.zeit.de/zeit-magazin/wochenmarkt/2025-04/gemuese-pie-rezept-wochenmarkt,0,www.zeit.de,"Winter-Pie mit Rosenkohl, Lauch und Käsekartoffeln: Auch Wintergemüse darf außergewöhnlich sein!","Immer dieselben Lauch- und Kartoffelgerichte im Winter? Muss nicht sein. Dieser Winter-Pie, eine vegetarische Variante des Shepherd's Pie, ist das beste Beispiel.",https://img.zeit.de/zeit-magazin/wochenmarkt/2025-04/gemuese-pie-teaser/wide__1300x731,2026-02-19T09:38:47Z,,"Erinnern Sie sich an
die Familienurlaube aus Ihrer Kindheit? Urlaube
an immer denselben Orten, Besuche bei immer denselben entfernten Verwandten, und Übernachtungen in immer derselben
lachsfarbene… [+498 chars]",,de,'Winter'
https://www.zeit.de/news/2026-02/19/schnee-legt-busverkehr-in-teilen-hessens-lahm,https://www.zeit.de/news/2026-02/19/schnee-legt-busverkehr-in-teilen-hessens-lahm,0,www.zeit.de,Wetter: Schnee legt Busverkehr in Teilen Hessens lahm,Hier finden Sie Informationen zu dem Thema „Wetter“. Lesen Sie jetzt „Schnee legt Busverkehr in Teilen Hessens lahm“.,https://img.zeit.de/news/2026-02/19/schnee-legt-busverkehr-in-teilen-hessens-lahm-image-group/wide__1300x731,2026-02-19T10:31:38Z,,Heftige Schneefälle und rutschige Straßen haben am Morgen in vielen Regionen Hessens zu starken Einschränkungen im Busverkehr geführt. Auf zahlreichen Linien wurde der Verkehr verspätet aufgenommen o… [+638 chars],,de,'Schnee'
https://www.tagesschau.de/wissen/gesundheit/nahrungsergaenzungsmittel-erkaeltung-100.html,https://www.tagesschau.de/wissen/gesundheit/nahrungsergaenzungsmittel-erkaeltung-100.html,0,www.tagesschau.de,Erkältungszeit: Wann Nahrungsergänzungsmittel wirklich etwas bringen,"In der Erkältungszeit greifen viele zu Nahrungsergänzungsmitteln, um ihrem Immunsystem etwas Gutes zu tun. Wer sie einnimmt, ist aber nicht automatisch weniger krank. Worauf man im Winter achten sollte. Von Nina Kunze.",https://images.tagesschau.de/image/7e9a539f-9a6b-40ad-8d2e-f1fb33226621/AAABnHU3nD4/AAABmyZE0EA/16x9-big/nahrungsergaenzung-drogerie-100.jpg?width=1280,2026-02-19T10:46:24Z,,"Stand: 19.02.2026 11:46 Uhr
In der Erkältungszeit greifen viele zu Nahrungsergänzungsmitteln, um ihrem Immunsystem etwas Gutes zu tun. Wer sie einnimmt, ist aber nicht automatisch weniger krank. Wor… [+6432 chars]",,de,'ältere Menschen'
https://www.welt.de/wissenschaft/article6996c57b85232894521349cf/venedig-videos-zeigen-wie-tausende-fische-durch-die-strassen-der-lagunenstadt-schwimmen.html,https://www.welt.de/wissenschaft/article6996c57b85232894521349cf/venedig-videos-zeigen-wie-tausende-fische-durch-die-strassen-der-lagunenstadt-schwimmen.html,0,www.welt.de,"Videos zeigen, wie tausende Fische durch Venedigs Straßen schwimmen","Tausende Fische tummeln sich in den schmalen Gassen der Lagunenstadt, die von der Flut überschwemmt werden. Doch wovor flüchten die Tiere?",https://images.welt.de/6996c57b85232894521349cf/e9a0115cfb6cf025031eefc74e8f583a/ci16x9-w1200/gettyimages-2220783797-jpg,2026-02-19T10:52:31Z,,"Tausende Fische tummeln sich in den schmalen Gassen der Lagunenstadt, die von der Flut überschwemmt werden. Doch wovor flüchten die Tiere?Wo sonst Touristen flanieren, schwimmen plötzlich Tausende Fi… [+1739 chars]",,de,'Hochwasser'
https://www.zeit.de/news/2026-02/19/schnee-sorgt-fuer-unfallmeldungen-im-minutentakt,https://www.zeit.de/news/2026-02/19/schnee-sorgt-fuer-unfallmeldungen-im-minutentakt,0,www.zeit.de,Wintereinbruch: Schnee sorgt für Unfallmeldungen im Minutentakt,Hier finden Sie Informationen zu dem Thema „Wintereinbruch“. Lesen Sie jetzt „Schnee sorgt für Unfallmeldungen im Minutentakt“.,https://img.zeit.de/news/2026-02/19/schnee-sorgt-fuer-unfallmeldungen-im-minutentakt-image-group/wide__1300x731,2026-02-19T11:09:07Z,,"Die starken Schneefälle haben auch die Polizei in Südosthessen am Morgen stark beschäftigt. Die Unfallmeldungen seien nahezu im Minutentakt eingegangen, teilte das Polizeipräsidium in Offenbach mit. … [+427 chars]",,de,'Schnee'
https://www.bild.de/regional/hessen/hochwasser-egal-die-bahn-faehrt-6995a1864a95124d25564e68,https://www.bild.de/regional/hessen/hochwasser-egal-die-bahn-faehrt-6995a1864a95124d25564e68,0,www.bild.de,"Spektakuläre Fotos - Hochwasser? Egal, die Bahn fährt!",Die Auen sind überschwemmt. Nur eine Bahnstrecke hält sich in diesem Bereich über Wasser und trotzt den Überflutungen.,"https://images.bild.de/6995a1864a95124d25564e68/07a3b7192075849de7f389da3544eef0,fe8e2542?w=1280",2026-02-19T11:09:30Z,,TTS-Player überspringenArtikel weiterlesenNidderau (Hessen) Land unter? Für Autos schon. Das Regen- und Tauwetter der letzten Tage hat die Wasserstände vieler Gewässer kräftig steigen lassen. So auch… [+2132 chars],,de,'Hochwasser'
https://www.focus.de/wissen/britischer-wissenschaftler-kreiert-futuristischen-schuh-der-verhindern-kann-dass-aeltere-menschen-umfallen_69681188-3813-47b7-a7ce-8a9dbb6ee856.html,https://www.focus.de/wissen/britischer-wissenschaftler-kreiert-futuristischen-schuh-der-verhindern-kann-dass-aeltere-menschen-umfallen_69681188-3813-47b7-a7ce-8a9dbb6ee856.html,0,www.focus.de,"Britischer Wissenschaftler kreiert futuristischen Schuh, der verhindern kann, dass ältere Menschen umfallen","Dr. Jiayang Li hat eine spezielle Sohle mit Sensoren entwickelt, die die Sturzgefahr älterer Menschen ermitteln soll. Das Konzept könnte preisgünstig in Massenproduktion gehen. Tests stehen noch aus.",https://quadro.burda-forward.de/ctf/aeb96a2a-039b-454c-a2ae-648ed8280b23.6d48b0b6-0784-4767-905e-8c0313ac633a.jpeg?im=RegionOfInterestCrop%3D%281200%2C630%29%2CregionOfInterest%3D%28462%2C231%29&hash=99e9cf8492dd2f99c313710aea7cd41b4d0a311125f1b01cf381d607a73b2646,2026-02-19T12:00:00Z,,"Ein futuristischer Schuh soll verhindern, dass ältere Menschen stürzen. Entwickelt wurde die Sohle mit Hunderten Sensoren von Dr. Jiayang Li, Dozent für Elektrotechnik, an der Univerity of Bristol in… [+2380 chars]",,de,'ältere Menschen'
https://www.stern.de/news/urteil--land-hessen-muss-fuer-unfall-nahe-holzlagerplatz-nicht-haften-37152124.html,https://www.stern.de/news/urteil--land-hessen-muss-fuer-unfall-nahe-holzlagerplatz-nicht-haften-37152124.html,0,www.stern.de,Urteil: Land Hessen muss für Unfall nahe Holzlagerplatz nicht haften,"Ereignet sich bei Winterwetter direkt neben einem vom Land Hessen betriebenen sogenannten Holznasslagerplatz ein Unfall, muss dieses kein Schmerzensgeld zahlen. Das Land habe keine Verkehrssicherungspflichten verletzt, teilte das Oberlandesgericht Frankfurt a…",https://image.stern.de/37152126/t/nK/v1/w1440/r1.7778/-/19--holzlager---f9a28b9ab548f1ab.jpg,2026-02-19T12:24:11Z,,"Kopiere den aktuellen Link
Zur Merkliste hinzufügen
Ereignet sich bei Winterwetter direkt neben einem vom Land Hessen betriebenen sogenannten Holznasslagerplatz ein Unfall, muss dieses kein Schmerz… [+1856 chars]",,de,'Winter'
https://www.faz.net/aktuell/wirtschaft/kindergeld-soll-kuenftig-automatisch-fliessen-accg-200554751.html,https://www.faz.net/aktuell/wirtschaft/kindergeld-soll-kuenftig-automatisch-fliessen-accg-200554751.html,0,www.faz.net,Weniger Bürokratie: Kindergeld soll künftig automatisch fließen,Bislang müssen Eltern Kindergeld bei der Familienkasse beantragen. Dieser Schritt soll nach Plänen der Bundesregierung bald entfallen.,https://media0.faz.net/image/w1200h627/b36f7442a9ad/w4736h2474x0y328o/202602/43601.0.1793907713/weniger-buerokratie-fuer.webp,2026-02-19T12:40:22Z,,"Das Kindergeld soll nach der Geburt eines Kindes künftig automatisch ohne Antrag ausgezahlt werden, um Familien von Bürokratie zu entlasten. Dies sieht ein Gesetzentwurf des Bundesfinanzministeriums … [+1414 chars]",,de,'ältere Menschen'
https://www.focus.de/panorama/welt/wie-ein-mann-auf-seinem-hausboot-den-winter-uebersteht-und-wie-viel-es-kostet_b6ee5bfc-d7d3-4778-b38b-6b9cb13ca278.html,https://www.focus.de/panorama/welt/wie-ein-mann-auf-seinem-hausboot-den-winter-uebersteht-und-wie-viel-es-kostet_b6ee5bfc-d7d3-4778-b38b-6b9cb13ca278.html,0,www.focus.de,Wie ein Mann auf seinem Hausboot den Winter übersteht – und wie viel es kostet,"Ein Brite verbringt die kalten Monate auf seinem Boot am Kanal. Mit Ofen, Solarmodulen und Gas sorgt er für Wärme und Strom – und senkt so seine Ausgaben erheblich.",https://quadro.burda-forward.de/ctf/015cefa5-238d-4ad6-a0b4-e491fd3ef7d0.26b405c6-b9bc-42db-aa81-7cdaabe16f69.jpg?im=RegionOfInterestCrop%3D%281200%2C630%29%2CregionOfInterest%3D%28877%2C772%29&hash=164ab7a60756b549184fb8277258c1f65c12523bd97a47ad77ed682eadf706ce,2026-02-19T13:00:00Z,,"Sam Barker aus der englischen Stadt Leighton Buzzard verbringt den Winter auf seinem schmalen und flachen Boot am Grand-Union-Kanal. Wenn die Temperaturen auf bis zu minus sechs Grad fallen, friert d… [+2310 chars]",,de,'Winter'
https://www.stern.de/news/hochwasser-und-wintersturm-fuehren-in-frankreich-zu-verkehrsstoerungen-37152678.html,https://www.stern.de/news/hochwasser-und-wintersturm-fuehren-in-frankreich-zu-verkehrsstoerungen-37152678.html,0,www.stern.de,Hochwasser und Wintersturm führen in Frankreich zu Verkehrsstörungen,"Nach einer Rekordserie von 36 Regentagen in Frankreich sind zahlreiche Orte im Westen des Landes von Hochwasser und Überschwemmungen betroffen. In Bordeaux trat am Donnerstag die Garonne über die Ufer und erreichte einen Pegelstand von 6,85 Metern, knapp unte…",https://image.stern.de/37152680/t/af/v1/w1440/r1.7778/-/19--ueberschwemmung-in-frankreich---b9fb42b2afb3a1aa.jpg,2026-02-19T14:20:13Z,,"Kopiere den aktuellen Link
Zur Merkliste hinzufügen
Nach einer Rekordserie von 36 Regentagen in Frankreich sind zahlreiche Orte im Westen des Landes von Hochwasser und Überschwemmungen betroffen. I… [+1703 chars]",,de,'Winter'
https://www.zeit.de/news/2026-02/19/iglu-und-eisberge-am-ostseestrand-vor-zempin,https://www.zeit.de/news/2026-02/19/iglu-und-eisberge-am-ostseestrand-vor-zempin,0,www.zeit.de,Winterwetter: Iglu und Eisberge am Ostseestrand vor Zempin,Hier finden Sie Informationen zu dem Thema „Winterwetter“. Lesen Sie jetzt „Iglu und Eisberge am Ostseestrand vor Zempin“.,https://img.zeit.de/news/2026-02/19/iglu-und-eisberge-am-ostseestrand-vor-zempin-image-group/wide__1300x731,2026-02-19T15:10:40Z,,"Eisiger Frost, Meeresströmung und Wind haben am Ostseestrand vor Zempin auf Usedom Eisbrocken zu meterhohen Bergen aufgetürmt. Das Winter-Spektakel lockte in den vergangenen Tagen zahlreiche Menschen… [+567 chars]",,de,'Winter'
https://www.zeit.de/news/2026-02/19/landstrasse-nahe-saarbruecken-wegen-hochwasser-gesperrt,https://www.zeit.de/news/2026-02/19/landstrasse-nahe-saarbruecken-wegen-hochwasser-gesperrt,0,www.zeit.de,Hochwasser: Landstraße nahe Saarbrücken wegen Hochwasser gesperrt,Hier finden Sie Informationen zu dem Thema „Hochwasser“. Lesen Sie jetzt „Landstraße nahe Saarbrücken wegen Hochwasser gesperrt“.,https://img.zeit.de/news/2026-02/19/landstrasse-nahe-saarbruecken-wegen-hochwasser-gesperrt-image-group/wide__1300x731,2026-02-19T15:25:12Z,,"Aufgrund von Hochwasser ist eine Landstraße nahe Saarbrücken bis auf weiteres voll gesperrt worden. Die Dauer der Sperrung der Straße zwischen Rußhütte und Fischbach sei zunächst unklar, teilte der L… [+377 chars]",,de,'Hochwasser'
https://www.stern.de/gesellschaft/regional/rheinland-pfalz-saarland/hochwasser--landstrasse-nahe-saarbruecken-wegen-hochwasser-gesperrt-37152984.html,https://www.stern.de/gesellschaft/regional/rheinland-pfalz-saarland/hochwasser--landstrasse-nahe-saarbruecken-wegen-hochwasser-gesperrt-37152984.html,0,www.stern.de,Hochwasser: Landstraße nahe Saarbrücken wegen Hochwasser gesperrt,Saarbrücken/Neunkirchen (lrs) - Aufgrund von Hochwasser ist eine Landstraße nahe Saarbrücken bis auf weiteres voll gesperrt worden. Die Dauer der Sperrung,https://image.stern.de/37152986/t/7a/v1/w1440/r1.7778/-/19--ilv5tuhjv6v3axs2048jpeg---194be03812b5dc20.jpg,2026-02-19T15:25:12Z,,"Kopiere den aktuellen Link
Zur Merkliste hinzufügen
Bei Saarbrücken muss eine Umleitung in Kauf genommen werden. Noch ist unklar, wie lange die Einschränkung besteht.
Aufgrund von Hochwasser ist e… [+507 chars]",,de,'Hochwasser'
https://www.zeit.de/news/2026-02/19/aktuell-noch-gute-bedingungen-fuer-wintersport-in-thueringen,https://www.zeit.de/news/2026-02/19/aktuell-noch-gute-bedingungen-fuer-wintersport-in-thueringen,0,www.zeit.de,Wintersport: Aktuell noch gute Bedingungen für Wintersport in Thüringen,Hier finden Sie Informationen zu dem Thema „Wintersport“. Lesen Sie jetzt „Aktuell noch gute Bedingungen für Wintersport in Thüringen“.,https://img.zeit.de/news/2026-02/19/aktuell-noch-gute-bedingungen-fuer-wintersport-in-thueringen-image-group/wide__1300x731,2026-02-19T15:42:47Z,,Zum Ende der Schulferien liegt in mehr als der Hälfte der Wintersportgebiete in Thüringen Schnee. Nach Angaben des Regionalverbunds Thüringer Wald sind derzeit rund 467 Kilometer Loipen für den Langl… [+598 chars],,de,'Winter'
https://www.zeit.de/news/2026-02/19/wie-ein-blackout-preuss-bricht-schweigen-zum-staffel-drama,https://www.zeit.de/news/2026-02/19/wie-ein-blackout-preuss-bricht-schweigen-zum-staffel-drama,0,www.zeit.de,"Biathlon bei Olympia: ""Wie ein Blackout"": Preuß bricht Schweigen zum Staffel-Drama","Hier finden Sie Informationen zu dem Thema „Biathlon bei Olympia“. Lesen Sie jetzt „""Wie ein Blackout"": Preuß bricht Schweigen zum Staffel-Drama“.",https://img.zeit.de/news/2026-02/19/wie-ein-blackout-preuss-bricht-schweigen-zum-staffel-drama-image-group/wide__1300x731,2026-02-19T16:32:54Z,,"Biathlon-Weltmeisterin Franziska Preuß konzentriert sich nach ihrem Fehlschuss-Drama in der Frauenstaffel voll auf das letzte Rennen bei den Olympischen Winterspielen in Antholz. «Ich versuche alles,… [+2449 chars]",,de,'Blackout'
https://www.stern.de/sport/biathlon-bei-olympia---wie-ein-blackout---preuss-bricht-schweigen-zum-staffel-drama-37153222.html,https://www.stern.de/sport/biathlon-bei-olympia---wie-ein-blackout---preuss-bricht-schweigen-zum-staffel-drama-37153222.html,0,www.stern.de,"Biathlon bei Olympia: ""Wie ein Blackout"": Preuß bricht Schweigen zum Staffel-Drama","Biathletin Franziska Preuß braucht lange, um die Enttäuschung der Staffel zu verkraften. Erst mehr als einen Tag später meldet sie sich zu Wort - und verrät den Plan für ihr letztes Olympia-Rennen.",https://image.stern.de/37153224/t/ju/v1/w1440/r1.7778/-/19--omtkmu7drfv5axs2048jpeg---399bbd05c9ce1e09.jpg,2026-02-19T16:32:54Z,,"Kopiere den aktuellen Link
Zur Merkliste hinzufügen
Biathletin Franziska Preuß braucht lange, um die Enttäuschung der Staffel zu verkraften. Erst mehr als einen Tag später meldet sie sich zu Wort -… [+2662 chars]",,de,'Blackout'
