index,url,valid,domain,title,description,image,published,archive,content,quote,language,keyword
https://www.telepolis.de/article/Warum-das-Bildungsversprechen-bricht-und-was-das-fuer-unsere-Kinder-heisst-11168163.html,https://www.telepolis.de/article/Warum-das-Bildungsversprechen-bricht-und-was-das-fuer-unsere-Kinder-heisst-11168163.html,0,www.telepolis.de,Warum das Bildungsversprechen bricht – und was das für unsere Kinder heißt,"Generation Master, Generation Zweifel: Abschlüsse wachsen, Sicherheit nicht. Und am Horizont steht die KI.",https://heise.cloudimg.io/bound/1200x1200/q85.png-lossy-85.webp-lossy-85.foil1/_www-heise-de_/imgs/18/5/0/2/3/5/1/4/Master_Bildung_1-1864dae1590e3aec.jpg,2026-02-06T12:45:00Z,,"Bild: shutterstock.com
Generation Master, Generation Zweifel: Abschlüsse wachsen, Sicherheit nicht. Und am Horizont steht die KI.
Wer alles richtig macht, sollte nicht fallen. So lautete das unausg… [+5857 chars]",,de,'ältere Menschen'
https://www.zeit.de/news/2026-02/06/jan-hofer-stuerzt-bei-glatteis-ironisches-danke-an-den-nabu,https://www.zeit.de/news/2026-02/06/jan-hofer-stuerzt-bei-glatteis-ironisches-danke-an-den-nabu,0,www.zeit.de,Glätte in Berlin: Jan Hofer stürzt bei Glatteis - ironisches Danke an den Nabu,Hier finden Sie Informationen zu dem Thema „Glätte in Berlin“. Lesen Sie jetzt „Jan Hofer stürzt bei Glatteis - ironisches Danke an den Nabu“.,https://img.zeit.de/news/2026-02/06/jan-hofer-stuerzt-bei-glatteis-ironisches-danke-an-den-nabu-image-group/wide__1300x731,2026-02-06T12:50:35Z,,Ex-«Tagesschau»-Sprecher Jan Hofer ist in Berlin bei Glatteis schwer gestürzt und hat sich daraufhin auf Instagram zu Wort gemeldet - durchaus kritisch gegenüber dem Naturschutzbund (Nabu). Der 76-Jä… [+2123 chars],,de,'Glatteis'
https://www.zeit.de/news/2026-02/06/unbekannte-faehrt-kinder-auf-dem-schulweg-an-und-fluechtet,https://www.zeit.de/news/2026-02/06/unbekannte-faehrt-kinder-auf-dem-schulweg-an-und-fluechtet,0,www.zeit.de,Bad Säckingen: Unbekannte fährt Kinder auf dem Schulweg an und flüchtet,Hier finden Sie Informationen zu dem Thema „Bad Säckingen“. Lesen Sie jetzt „Unbekannte fährt Kinder auf dem Schulweg an und flüchtet“.,https://img.zeit.de/news/2026-02/06/unbekannte-faehrt-kinder-auf-dem-schulweg-an-und-fluechtet-image-group/wide__1300x731,2026-02-06T12:53:22Z,,Eine unbekannte SUV-Fahrerin hat in Bad Säckingen (Kreis Waldshut) zwei Kinder auf dem Schulweg angefahren und ist anschließend geflüchtet. Die Jungen im Alter von acht und zehn Jahren gingen über ei… [+629 chars],,de,'Kinder'
https://www.welt.de/vermischtes/article6985da80ad1f115725eceb65/jan-hofer-danke-nabu-ex-tagesschau-sprecher-stuerzt-schwer-auf-vereistem-gehweg.html,https://www.welt.de/vermischtes/article6985da80ad1f115725eceb65/jan-hofer-danke-nabu-ex-tagesschau-sprecher-stuerzt-schwer-auf-vereistem-gehweg.html,0,www.welt.de,"„Danke, Nabu!“ – Ex-Tagesschau-Sprecher Jan Hofer stürzt schwer auf vereistem Gehweg","Glatte Gehwege und Straßen: Berlin ist im Winter-Ausnahmezustand. Zahlreiche Menschen haben sich bereits verletzt, unter ihnen ist auch Ex-Tagesschau-Sprecher Jan Hofer. Auf Instagram erzählt er von seinem Sturz auf den Kopf und richtet sich direkt an den Nab…",https://images.welt.de/6985da80ad1f115725eceb65/346157a3c77b9dcb9dee61c2d1f82f19-master/ci16x9-w1200/525529217-jpg,2026-02-06T13:36:26Z,,"Glatte Gehwege und Straßen: Berlin ist im Winter-Ausnahmezustand. Zahlreiche Menschen haben sich bereits verletzt, unter ihnen ist auch Ex-Tagesschau-Sprecher Jan Hofer. Auf Instagram erzählt er von … [+2394 chars]",,de,'Winter'
https://www.zeit.de/news/2026-02/06/kommen-und-gehen-kraniche-im-winterwetter-durcheinander,https://www.zeit.de/news/2026-02/06/kommen-und-gehen-kraniche-im-winterwetter-durcheinander,0,www.zeit.de,"Vogelzug: ""Kommen und Gehen"" - Kraniche im Winterwetter-Durcheinander","Hier finden Sie Informationen zu dem Thema „Vogelzug“. Lesen Sie jetzt „""Kommen und Gehen"" - Kraniche im Winterwetter-Durcheinander“.",https://img.zeit.de/news/2026-02/06/kommen-und-gehen-kraniche-im-winterwetter-durcheinander-image-group/wide__1300x731,2026-02-06T14:16:02Z,,"Erste Kraniche sind aus ihren Winterquartieren in einige Teile Sachsen-Anhalts zurückgekehrt. Gleichzeitig gebe es aus Hierbleibern bestehende «Kranich-Trupps», die ihnen entgegenkommen, sagte Axel S… [+1950 chars]",,de,'Winter'
https://www.diepresse.com/20553729/betrueger-sperren-senioren-in-psychiatrie-ein,https://www.diepresse.com/20553729/betrueger-sperren-senioren-in-psychiatrie-ein,0,www.diepresse.com,Betrüger sperren Senioren in Psychiatrie ein [premium],In Hubei wurden ältere Menschen unter falscher Diagnose in psychiatrischen Klinken gefangen gehalten. Die Spitalsbetreiber kassierten so Versicherungsgelder.,https://img.diepresse.com/public/incoming/4y7zqp-imago-images-0790533385/alternates/DPR_SOCIAL_NACHRICHTEN/imago%20images%200790533385,2026-02-06T15:58:46Z,,"Seoul/Peking. Das chinesische Gesundheitssystem wird regelmäßig von Korruptionsfällen geplagt, doch der jüngste Skandal ist an Grausamkeit kaum zu überbieten: Mehrere psychiatrische Kliniken in der z… [+3829 chars]",,de,'ältere Menschen'
https://www.zeit.de/2026/06/olympische-winterspiele-2026-italien-milano-cortina-klimawandel,https://www.zeit.de/2026/06/olympische-winterspiele-2026-italien-milano-cortina-klimawandel,0,www.zeit.de,Olympische Winterspiele 2026: Schnee von morgen,"Der Klimawandel kommt, die Russen kommen nicht – warum man sich trotz allem auf Olympia freut. Und freuen darf.",https://img.zeit.de/2026/06/schnee-von-morgen-bild-2/wide__1300x731,2026-02-06T16:50:55Z,,"Wüsste man es nicht besser, könnte man Olympia glatt für eine rheinische Erfindung halten. Stets überschlagen sich vor dem Start die Nachrichten, was alles nicht funktionieren wird. Aber getreu dem k… [+686 chars]",,de,'Schnee'
https://www.focus.de/panorama/kinderbande-terrorisiert-leipziger-sie-schubsen-poebeln-und-klauen_d4f1751c-0e05-42a5-a92c-f867c42dec92.html,https://www.focus.de/panorama/kinderbande-terrorisiert-leipziger-sie-schubsen-poebeln-und-klauen_d4f1751c-0e05-42a5-a92c-f867c42dec92.html,0,www.focus.de,"Kinderbande terrorisiert Leipziger: ""Sie schubsen, pöbeln und klauen""","Seit Monaten terrorisiert eine Kinderbande Leipzig. Mehr als 200 Straftaten gehen bereits auf ihr Konto, vor allem Raubüberfälle. Auch eine Schule ist betroffen.",https://quadro.burda-forward.de/ctf/fd21e07f-7ba5-4fbf-93ea-b0f8636a3ead.f29a4f65-9b89-494d-b979-d4f4f4a15f6e.jpeg?im=RegionOfInterestCrop%3D%281200%2C630%29%2CregionOfInterest%3D%282712%2C1590%29&hash=550c424c7b6808a5e9a17fc55d48811bab1c5d6325c1642bbd20e9b9f5a60273,2026-02-06T17:06:00Z,,"Es ist Freitagmittag vor der Montessori-Schule in Leipzig-Grünau. Schneebälle fliegen durch die Luft, die Grundschüler freuen sich auf das bevorstehende Wochenende. Vor einem geparkten VW-Van mit off… [+7269 chars]",,de,'ältere Menschen'
https://www.bild.de/leben-wissen/schwimmende-deponie-in-bosnien-fluss-erstickt-im-muell-6984f6627f5bc5017ea80e31,https://www.bild.de/leben-wissen/schwimmende-deponie-in-bosnien-fluss-erstickt-im-muell-6984f6627f5bc5017ea80e31,0,www.bild.de,Schwimmende Deponie in Bosnien - Fluss erstickt im Müll,"In Visegrad, Bosnien spült Hochwasser Plastik, Holz, Metall, alte Haushaltsgeräte und sogar medizinischen Müll aus illegalen Deponien entlang der Flüsse.","https://images.bild.de/6984f6627f5bc5017ea80e31/c872c693092bd2d8593457e69ce914eb,90fb3f26?w=1280",2026-02-06T17:12:49Z,,"+++Trump löscht Affen-Video mit den Obamas wieder
+++Trump löscht Affen-Video mit den Obamas wieder
+++Trump löscht Affen-Video mit den Obamas wieder
+++Trump löscht Affen-Video mit den Obamas wie… [+308 chars]",,de,'Hochwasser'
https://www.nzz.ch/international/keine-versicherungen-oder-hafendienste-mehr-fuer-russische-schiffe-neues-eu-sanktionspaket-zielt-auf-oel-und-gas-ld.1923752,https://www.nzz.ch/international/keine-versicherungen-oder-hafendienste-mehr-fuer-russische-schiffe-neues-eu-sanktionspaket-zielt-auf-oel-und-gas-ld.1923752,0,www.nzz.ch,Keine Versicherungen oder Hafendienste mehr für russische Schiffe: Neues EU-Sanktionspaket zielt auf Öl und Gas,"Die Betreiber von russischen Tankern fälschen gemäss EU-Staaten Dokumente, um den Öl-Preisdeckel zu umgehen. Ein neuer Mechanismus soll dem nun einen Riegel schieben.","https://img.nzz.ch/2026/02/06/d71bc808-b2a0-4ef7-9f40-81e466998f35.jpg?width=1200&height=675&fit=bounds&quality=75&auto=webp&crop=4608,2592,x0,y240&wmark=nzz",2026-02-06T17:15:30Z,,"Die Betreiber von russischen Tankern fälschen gemäss EU-Staaten Dokumente, um den Ölpreisdeckel zu umgehen. Ein neuer Mechanismus soll dem nun einen Riegel schieben.
Dank seiner Schattenflotte verdi… [+3022 chars]",,de,'Gas'
https://www.bild.de/leben-wissen/mein-recht-verbraucherportal/glatteis-nabu-chef-attackiert-behoerden-im-streusalz-zoff-6985f3cf00d739e7f4058246,https://www.bild.de/leben-wissen/mein-recht-verbraucherportal/glatteis-nabu-chef-attackiert-behoerden-im-streusalz-zoff-6985f3cf00d739e7f4058246,0,www.bild.de,Glatteis in Berlin - Nabu-Chef attackiert Behörden im Streusalz-Zoff,Nabu-Chef kritisiert Berlins Wintermanagement und sieht Streusalz-Streit als Ablenkung.,"https://images.bild.de/6985f3cf00d739e7f4058246/7df0574c2ef83e45bbf01c9466fca15d,e3763a38?w=1280",2026-02-06T18:03:33Z,,"TTS-Player überspringenArtikel weiterlesenBerlin Das Glätte-Chaos wütet in Deutschland, besonders hart traf es in den letzten Wochen Berlin: Krankenhäuser melden volle Stationen, Rettungsdienste fahr… [+3085 chars]",,de,'ältere Menschen'
https://www.zeit.de/wissen/2026-02/temperatur-unterschiede-deutschand-winter-wetter,https://www.zeit.de/wissen/2026-02/temperatur-unterschiede-deutschand-winter-wetter,0,www.zeit.de,Temperaturunterschiede in Deutschland: Winterchaos und Frühlingsgefühle,"Im Nordosten des Landes friert alles zu, Freiburg erwartet Frühlingswetter. Wie kann das sein? Und bleibt das jetzt so? Ziehen Sie sich warm an.",https://img.zeit.de/wissen/2026-02/wetterlage-deutschland-winter/wide__1300x731,2026-02-06T19:00:20Z,,"Wer dieser Tage in Hamburg, Bremen oder im brandenburgischen Landkreis Elbe-Elster vor die Tür muss, stapft dabei über mehrere Lagen Schnee, Blitzeis und Streusalz. Für Donnerstag warnte der Deutsche… [+627 chars]",,de,'Glatteis'
https://www.faz.net/aktuell/feuilleton/medien-und-film/kino/neuer-schimmelreiter-film-gretas-stimme-am-meeresstrand-110832129.html,https://www.faz.net/aktuell/feuilleton/medien-und-film/kino/neuer-schimmelreiter-film-gretas-stimme-am-meeresstrand-110832129.html,0,www.faz.net,Neuer „Schimmelreiter“-Film: Eine Greta Thunberg in Hauke Haiens Kopf,"Der Meeresspiegel steigt, aber die Deiche kann man nicht unendlich erhöhen: Francis Meletzky dreht einen „Schimmelreiter“ für unsere Zeit und reiht ein Klischee ans andere.",https://media0.faz.net/image/w1200h627/8131f8394621/w3000h1567x0y372o/022026/1.10832126/etwas-lebiges-muss-hinein.webp,2026-02-06T20:18:27Z,,"Als Hauke Haien (Max Hubacher), als Deichgraf zuständig für den Küstenschutz, in einer aufgeheizten Versammlung für seine Idee wirbt, den vordersten Küstendeich aufzugeben und dafür den dahinterliege… [+3979 chars]",,de,'Schimmel'
https://www.zeit.de/news/2026-02/07/schnee-lockt-urlauber-thueringer-wald-gut-gebucht,https://www.zeit.de/news/2026-02/07/schnee-lockt-urlauber-thueringer-wald-gut-gebucht,0,www.zeit.de,Wintertourismus: Schnee lockt Urlauber – Thüringer Wald gut gebucht,Hier finden Sie Informationen zu dem Thema „Wintertourismus“. Lesen Sie jetzt „Schnee lockt Urlauber – Thüringer Wald gut gebucht“.,https://img.zeit.de/news/2026-02/07/schnee-lockt-urlauber-thueringer-wald-gut-gebucht-image-group/wide__1300x731,2026-02-07T03:00:39Z,,"Gute Schneebedingungen vor Beginn der Winterferien sorgen für reichlich Buchungen im Thüringer Wald. Viele Gastgeber in den Wintersportzentren melden eine hohe Auslastung, wie der Thüringer Regionalv… [+1944 chars]",,de,'Schnee'
https://www.morgenpost.de/blogs-kolumnen/article411128252/glaette-in-berlin-wenn-alle-auf-den-fruehling-hoffen-auch-im-senat.html,https://www.morgenpost.de/blogs-kolumnen/article411128252/glaette-in-berlin-wenn-alle-auf-den-fruehling-hoffen-auch-im-senat.html,0,www.morgenpost.de,Glätte in Berlin: Wenn alle auf den Frühling hoffen – auch im Senat,"Im Glättechaos gibt es nicht einen Schuldigen, aber viele, die unentschlossen oder ungeschickt agieren. Der große Wunsch: dass der Winter bald endet.",https://img.sparknews.funkemedien.de/411134167/411134167_1770384209_v16_9_1600.jpeg,2026-02-07T05:00:00Z,,"Franziska Giffey machte vor, wie es funktioniert. Mit Besen, Schaufel und Streugut (um ganz genau zu sein: Lavagranulat) war sie vor ihrem Bürgerbüro in Rudow im Einsatz, um den Gehweg von Eis und Sc… [+3711 chars]",,de,'Winter'
https://www.zeit.de/2026-02/glatteis-nebel-norden-nordosten-wetter,https://www.zeit.de/2026-02/glatteis-nebel-norden-nordosten-wetter,0,www.zeit.de,Wetter: Wetterdienst warnt vor Glatteis im Norden und Nordosten Deutschlands,Auch am Samstag müssen die Menschen in nördlichen Teilen des Landes mit Gefahr durch Glätte rechnen. Im Breisgau soll es dagegen bis zu 12 Grad warm werden.,https://img.zeit.de/2026-02/winterwetter-flughafen-berlin-brandenburg-bild/wide__1300x731,2026-02-07T05:19:49Z,,"Im Norden, Nordosten und der nördlichen Mitte Deutschlands besteht auch heute wieder Gefahr durch Glatteis. Grund sind gefrierender Sprühregen, Schneeregen oder leichter Schneefall, wie der Deutsche … [+1647 chars]",,de,'Glatteis'
https://wien.orf.at/stories/3340631/,https://wien.orf.at/stories/3340631/,0,wien.orf.at,Fußgängerampeln für viele zu kurz Grün,"Das Kuratorium für Verkehrssicherheit (KfV) übt Kritik an den kurzen Grünphasen für Fußgänger in Wien. Auch mehrere Seniorenverbände fordern längere Ampelzeiten, zu kurze Grünphasen würden besonders ältere Menschen unter Stress setzen.",https://ibs.orf.at/wie?image=https%3A%2F%2Foekastatic.orf.at%2Fmims%2F2026%2F06%2F10%2Fcrops%2Fw%3D1200%2Ch%3D627%2Cq%3D75%2F2921959_master_1129510_downloadmedium.jpg%3Fs%3D9f0ad884ebb35571cfdd1342c0959e392abcceeb,2026-02-07T05:35:00Z,,Laut dem KfV seien die Grünphasen bei Fußgängerampeln besonders für ältere Menschen zu kurz bemessen. Viele Seniorinnen und Senioren würden den Schutzweg aufgrund der kurzen Grünphasen nicht mehr bet… [+3430 chars],,de,'ältere Menschen'
https://www.focus.de/gesundheit/ratgeber/medical-gaslighting-beim-arzt-warum-viele-darunter-leiden_cd152ea1-fed1-45bb-943a-c53d6fc9749a.html,https://www.focus.de/gesundheit/ratgeber/medical-gaslighting-beim-arzt-warum-viele-darunter-leiden_cd152ea1-fed1-45bb-943a-c53d6fc9749a.html,0,www.focus.de,Medical Gaslighting beim Arzt – warum viele darunter leiden,"Wenn Ärzte Symptome ihrer Patienten kleinreden, spricht man von Medical Gaslighting. Die Folgen reichen von späten Diagnosen bis zu schweren körperlichen und seelischen Schäden.",https://quadro.burda-forward.de/ctf/f6af90b6-ac43-42a1-9d14-e65f805e826d.7ff75f9c-0fae-4622-bf58-08bac4ac2274.png?im=RegionOfInterestCrop%3D%281200%2C630%29%2CregionOfInterest%3D%28600%2C375%29&hash=5b89aca98b25e91e3428d69d29af89828b8bdac32f42852b58dab6d8bbe609f5,2026-02-07T06:00:00Z,,"Wenn Ärzte oder anderes medizinisches Personal die Symptome von Patienten herunterspielen, sie nicht ernst nehmen oder den Eindruck vermitteln, die Betroffenen würden übertreiben, spricht man von Med… [+3440 chars]",,de,'ältere Menschen'
https://steiermark.orf.at/stories/3340622/,https://steiermark.orf.at/stories/3340622/,0,steiermark.orf.at,Hochwasserschutz gerät teils ins Stocken,"In der Steiermark geraten wichtige Hochwasserschutzprojekte ins Stocken. Obwohl im Vorjahr rekordverdächtige 70 Millionen Euro investiert wurden, drohen sich viele Vorhaben zu verzögern. Das Land hingegen betont, nicht auf Kosten des Hochwasserschutzes zu spa…",https://ibs.orf.at/stm?image=https%3A%2F%2Foekastatic.orf.at%2Fmims%2F2024%2F43%2F28%2Fcrops%2Fw%3D1200%2Ch%3D627%2Cq%3D75%2F2399514_master_917128_15d7a368-d8e9-4da0-b737-7e31892d8ca0.jpg%3Fs%3D0babe601a89eb3d27978b5ae57806e8a8493eb94,2026-02-07T06:00:00Z,,Schlimme Unwetter sind im Jahr 2025 hingegen ausgeblieben. Dennoch drängen viele Gemeinden auf ihre Projekt-Umsetzungen und werden enttäuscht. Das Rückhaltebecken Lammerbach bei Kindberg etwa sollte … [+2311 chars],,de,'Hochwasser'
https://www.zeit.de/news/2026-02/07/winter-ad-nieselregen-zum-start-ins-wochenende,https://www.zeit.de/news/2026-02/07/winter-ad-nieselregen-zum-start-ins-wochenende,0,www.zeit.de,Wetter in Bayern: Winter adé? Nieselregen zum Start ins Wochenende,Hier finden Sie Informationen zu dem Thema „Wetter in Bayern“. Lesen Sie jetzt „Winter adé? Nieselregen zum Start ins Wochenende“.,https://img.zeit.de/news/2026-02/07/winter-ad-nieselregen-zum-start-ins-wochenende-image-group/wide__1300x731,2026-02-07T06:24:49Z,,"Das Wochenende startet für die Menschen in Bayern mit Nieselregen und mit Plusgraden. Ist der vielerorts bislang schneereich ausgefallene Winter nun vorbei? 
Nach Angaben des Deutschen Wetterdiensts… [+596 chars]",,de,'Winter'
https://www.urlaubspiraten.de/pauschalreisen/alicante-staedtetrip,https://www.urlaubspiraten.de/pauschalreisen/alicante-staedtetrip,0,www.urlaubspiraten.de,Winter satt? ✈️ Besuche eine der sonnigsten Städte Europas! ☀️,"Kein Witz, das spanische Alicante gehört zu den sonnigsten Städten Europas, durchschnittlich scheint die Sonne 349 Stunden pro Monat und ab März erwarten euch durchschnittlich um die 19 bis 21 °C Tagestemperatur. ☀️✈️ Bei diesem eisigen Winter hilft neben der…",https://image.urlaubspiraten.de/720/image/upload/v1770367888/Impressions%20and%20Other%20Assets/shutterstock_2057814977_aoimfl.jpg,2026-02-07T07:35:00Z,,"Wir nutzen Cookies, um deine Nutzererfahrung zu verbessern, dir persönlich auf dich zugeschnittene Inhalte liefern zu können und die Nutzung unserer App zu analysieren. Wenn du auf ""alle akzeptieren""… [+435 chars]",,de,'Winter'
https://www.bild.de/news/massengrab-norderney-meeresbewohner-fallen-dem-winter-zum-opfer-69865a1f8bd5edbc27b8d619,https://www.bild.de/news/massengrab-norderney-meeresbewohner-fallen-dem-winter-zum-opfer-69865a1f8bd5edbc27b8d619,0,www.bild.de,Massengrab Norderney - Meeresbewohner fallen dem Winter zum Opfer,"An den Stränden von Norderney werden derzeit tausende Seesterne, Krebse und Muscheln tot angespült – sie sind in einer Winterruhe, ihr Stoffwechsel fährt...","https://images.bild.de/69865a1f8bd5edbc27b8d619/05ba25f8f71becfa9b827299c637228d,ea4d643f?w=1280",2026-02-07T07:43:37Z,,"Mehr zum Video anzeigen 
An den Stränden von Norderney werden derzeit tausende Seesterne, Krebse und Muscheln tot angespült sie sind in einer Winterruhe, ihr Stoffwechsel fährt runter, sie bewegen s… [+114 chars]",,de,'Winter'
https://www.faz.net/aktuell/sport/olympische-winterspiele/ski-alpin-lindsey-vonns-fragwuerdige-botschaft-bei-olympia-2026-accg-110833024.html,https://www.faz.net/aktuell/sport/olympische-winterspiele/ski-alpin-lindsey-vonns-fragwuerdige-botschaft-bei-olympia-2026-accg-110833024.html,0,www.faz.net,abfahrt trotz Verletzung: Lindsey Vonns fragwürdige Botschaft,"Teilprothese im rechten Knie, ein frischer Riss des vorderen Kreuzbandes im linken: Die 41 Jahre alte Lindsey Vonn will trotzdem beim Abfahrtsrennen der Winterspiele starten. Koste es, was es wolle.",https://media0.faz.net/image/w1200h627/f8fef90b89bb/w2113h1104x516y651o/202602/43601.0.1741659492/lindsey-vonn-beim-olympischen.webp,2026-02-07T08:18:08Z,,"Sie ist die größte Attraktion im Zirkus. Und sie ist sich dessen bewusst. Auch deshalb will Lindsey Vonn unbedingt bei den Winterspielen starten koste es, was es wolle.
Eine Teilprothese nach Totals… [+3089 chars]",,de,'Winter'
https://vorarlberg.orf.at/stories/3340992/,https://vorarlberg.orf.at/stories/3340992/,0,vorarlberg.orf.at,Forer kämpft um Slopestyle-Finaleinzug,Als erster Vorarlberger ist heute Ski-Freestyler Julius Forer bei den Olympischen Winterspielen 2026 in Italien am Start. Für den Dornbirner steht ab 14.00 Uhr die Qualifikation im Slopestyle auf dem Programm.,https://ibs.orf.at/vbg?image=https%3A%2F%2Foekastatic.orf.at%2Fmims%2F2026%2F06%2F97%2Fcrops%2Fw%3D1200%2Ch%3D627%2Cq%3D75%2F2925067_master_1130697_gepa-20260203-101-999-0029.jpg%3Fs%3D05e3ed3bc1bdb4f9cc7c2642661d7bc478627023,2026-02-07T08:43:31Z,,"Für Forer, der auch in der Disziplin Big Air antritt, ist die Qualifikation für die Olympischen Spiele der bisherige Höhepunkt seiner Karriere. Ein Kreuzbandriss warf ihn 2023 zurück, doch der 25-Jäh… [+802 chars]",,de,'Winter'
https://www.stern.de/auto/tempolimit-im-winter--ab-wann-gilt-dieses-schild-mit-der-schneeflocke--35159774.html,https://www.stern.de/auto/tempolimit-im-winter--ab-wann-gilt-dieses-schild-mit-der-schneeflocke--35159774.html,0,www.stern.de,Straßenverkehr: Tempolimit mit Schneeflocken-Schild: Wann gilt das eigentlich?,Gilt es oder nicht? Diese Frage stellen sich bei einem Tempolimit mit Schneeflocken-Symbol viele Autofahrer. Die meisten würden sich falsch entscheiden – besonders im Sommer.,https://image.stern.de/35159772/t/RX/v1/w1440/r1.7778/-/schneeflocke-tempolimit-verkehrsschild.jpg,2026-02-07T08:44:00Z,,"Kopiere den aktuellen Link
Zur Merkliste hinzufügen
Gilt es oder nicht? Diese Frage stellen sich bei einem Tempolimit mit Schneeflocken-Symbol viele Autofahrer. Die meisten würden sich falsch entsc… [+2653 chars]",,de,'Schnee'
https://www.tagesspiegel.de/internationales/krieg-in-der-ukraine-selenskyj-akws-produzieren-nach-angriffen-weniger-strom-15228503.html,https://www.tagesspiegel.de/internationales/krieg-in-der-ukraine-selenskyj-akws-produzieren-nach-angriffen-weniger-strom-15228503.html,0,www.tagesspiegel.de,Krieg in der Ukraine: Selenskyj: AKWs produzieren nach Angriffen weniger Strom,Russische Raketen- und Drohnenangriffe legen wichtige Energieanlagen in der Westukraine lahm. Selenskyj fordert eine globale Antwort. Wie hart trifft es die Ukraine mitten im Winter?,https://www.tagesspiegel.de/images/15229252/alternates/BASE_16_9_W1400/1770480227000/wolodymyr-selenskyj.jpeg,2026-02-07T08:50:23Z,,Infolge heftiger russischer Raketenangriffe auf wichtige Umspannwerke und Hochspannungsleitungen produzieren ukrainische Atomkraftwerke weniger Strom. Ein Reaktor schaltete sich automatisch ab. Das i… [+858 chars],,de,'Winter'
https://www.morgenpost.de/sport/hertha/article411134390/naechstes-sechs-punkte-spiel-kann-hertha-bsc-in-elversberg-gewinnen.html,https://www.morgenpost.de/sport/hertha/article411134390/naechstes-sechs-punkte-spiel-kann-hertha-bsc-in-elversberg-gewinnen.html,0,www.morgenpost.de,Nächstes Sechs-Punkte-Spiel: Kann Hertha BSC in Elversberg gewinnen?,Die Sieglosserie zieht sich für die Berliner dahin wie der schier endlose Winter. Endet sie im Saarland? Verfolgen Sie das Spiel im Liveticker.,https://img.sparknews.funkemedien.de/411134838/411134838_1770385295_v16_9_1600.jpeg,2026-02-07T09:00:00Z,,"Der Kampf um den Aufstieg in die Bundesliga gleicht einem Schneckenrennen. Hertha BSC ist um den Anschluss bemüht, tritt nach den jüngsten sechs Ligaspielen ohne Sieg aber auf der Stelle. Zuletzt kam… [+302 chars]",,de,'Winter'
https://www.sueddeutsche.de/sport/ski-alpin-olympia-2026-abfahrt-maenner-heute-live-tv-stream-zeitplan-termine-ueberblick-li.3367106,https://www.sueddeutsche.de/sport/ski-alpin-olympia-2026-abfahrt-maenner-heute-live-tv-stream-zeitplan-termine-ueberblick-li.3367106,0,www.sueddeutsche.de,Olympische Winterspiele: Olympia 2026: Alle Ski-Alpin-Wettbewerbe im Zeitplan,"Am 6. Februar werden die Olympischen Winterspiele 2026 eröffnet, bereits einen Tag später starten die Ski-Alpin-Wettbewerbe. Der Zeitplan zu allen Rennen in der Übersicht.",https://www.sueddeutsche.de/2026/01/30/bd808f4f-a0af-48a1-86eb-550d653b21e6.jpg?q=60&fm=webp&width=1200&rect=0%2C191%2C3665%2C2062,2026-02-07T09:03:00Z,,"Zeitplan zu allen Ski-Alpin-Rennen bei Olympia 2026
In zehn Wettbewerben kämpfen die Fahrerinnen und Fahrer dieses Jahr um olympisches Edelmetall. Damit gibt es zu den beiden vergangenen Spielen ein… [+6423 chars]",,de,'Winter'
https://www.zeit.de/news/2026-02/07/kalt-und-grau-winterwetter-im-norden-haelt-an,https://www.zeit.de/news/2026-02/07/kalt-und-grau-winterwetter-im-norden-haelt-an,0,www.zeit.de,Wetter: Kalt und grau: Winterwetter im Norden hält an,Hier finden Sie Informationen zu dem Thema „Wetter“. Lesen Sie jetzt „Kalt und grau: Winterwetter im Norden hält an“.,https://img.zeit.de/news/2026-02/07/kalt-und-grau-winterwetter-im-norden-haelt-an-image-group/wide__1300x731,2026-02-07T10:51:12Z,,In Hamburg und Schleswig-Holstein bleibt das Wetter am Wochenende und zum Wochenstart kalt und grau. Der Deutsche Wetterdienst (DWD) rechnet am Sonntag im Norden mit einem bedeckten Himmel. Örtlich k… [+2030 chars],,de,'Schnee'
https://www.zeit.de/news/2026-02/07/freiwillige-raeumen-schnee-fuer-rugby-laenderspiel-in-dessau,https://www.zeit.de/news/2026-02/07/freiwillige-raeumen-schnee-fuer-rugby-laenderspiel-in-dessau,0,www.zeit.de,Rugby-EM: Freiwillige räumen Schnee für Rugby-Länderspiel in Dessau,Hier finden Sie Informationen zu dem Thema „Rugby-EM“. Lesen Sie jetzt „Freiwillige räumen Schnee für Rugby-Länderspiel in Dessau“.,https://img.zeit.de/news/2026-02/07/freiwillige-raeumen-schnee-fuer-rugby-laenderspiel-in-dessau-image-group/wide__1300x731,2026-02-07T11:55:08Z,,"Damit das Rugby-Länderspiel zwischen Deutschland und Portugal nicht ausfallen muss, haben Freiwillige im Dessauer Paul-Greifzu-Stadion Schnee geräumt. Wie die Stadt mitteilte, lag auf dem Rasen zulet… [+1071 chars]",,de,'Schnee'
