index,url,valid,domain,title,description,image,published,archive,content,quote,language,keyword
https://www.sueddeutsche.de/kultur/mit-dem-sturm-um-die-wette-rennen-bilderbuch-brian-floca-illustration-sydney-smith-kritik-li.3507867,https://www.sueddeutsche.de/kultur/mit-dem-sturm-um-die-wette-rennen-bilderbuch-brian-floca-illustration-sydney-smith-kritik-li.3507867,0,www.sueddeutsche.de,Kinderliteratur: Wir stehen da und spüren alles,"Ganz auf Augenhöhe mit der bildenden Kunst wirkt das Bilderbuch „Mit dem Sturm um die Wette rennen“, das Sydney Smith illustriert hat. Ein Glück, wenn Kinder so sehen lernen.",https://www.sueddeutsche.de/2026/07/02/242c186b-81a6-40ae-954b-f98c10969a6a.jpg?q=60&fm=webp&width=1200&rect=0%2C519%2C4000%2C2250,2026-07-05T10:40:46Z,,"Zwei Geschwister entdecken ihre Welt: Buch auf, Blick vom Balkon, Bruder und Schwester schauen mit dem Rücken zum Betrachter ins Grüne. Noch ist alles licht, nur die Wäsche hat der Wind schon von der… [+235 chars]",,de,'Kinder'
https://www.bild.de/news/ausland/auf-indoor-spielplatz-in-dortmund-polizei-streckt-mann-mit-elektroschocker-nieder-6a4a3f7cad32e994f875c370,https://www.bild.de/news/ausland/auf-indoor-spielplatz-in-dortmund-polizei-streckt-mann-mit-elektroschocker-nieder-6a4a3f7cad32e994f875c370,0,www.bild.de,Auf Indoor-Spielplatz in Dortmund - Polizei streckt Mann mit Elektroschocker nieder,"Dortmund : Vor den Augen mehrerer Kinder soll ein 26-Jähriger auf einem Indoorspielplatz einen anderen Besucher bedroht haben. Als die Polizisten eingreifen, eskaliert die Situation.","https://images.bild.de/6a4a3f7cad32e994f875c370/6ad5c702c3ab1c0a51f66ef1ccc3f881,d4ca3c05?w=1280",2026-07-05T12:24:31Z,,"Mehr zum Video anzeigen 
Dortmund : Vor den Augen mehrerer Kinder soll ein 26-Jähriger auf einem Indoorspielplatz einen anderen Besucher bedroht haben. Als die Polizisten eingreifen, eskaliert die S… [+64 chars]",,de,'Kinder'
https://www.bild.de/regional/dortmund/nach-streit-am-autoscooter-polizei-streckt-mann-in-indoor-spielplatz-nieder-6a4a22bcac819a6f6bcafda6,https://www.bild.de/regional/dortmund/nach-streit-am-autoscooter-polizei-streckt-mann-in-indoor-spielplatz-nieder-6a4a22bcac819a6f6bcafda6,0,www.bild.de,Nach Streit am Autoscooter - Polizei streckt Mann in Indoor-Spielplatz nieder,"In Dortmund eskalierte ein Streit in einem Indoorspielplatz, obwohl Kinder anwesend waren. Die Polizei setzte einen Taser ein.","https://images.bild.de/6a4a22bcac819a6f6bcafda6/0beb4f4fc087cc3d4ce6baeb57f53af2,d02e95d0?w=1280",2026-07-05T12:27:54Z,,TTS-Player überspringenArtikel weiterlesenDortmund Geburtstagsfeiern und Familienausflüge Kinder lieben Indoor-Spielplätze. Am Samstagabend rückte in Dortmund (NRW) in einem solchen jedoch die Polize… [+1554 chars],,de,'Kinder'
https://www.welt.de/sport/fussball/wm/article6a47ab7b0b14ed961bb50abf/wm-2026-harry-kane-der-koenig-der-loewen.html,https://www.welt.de/sport/fussball/wm/article6a47ab7b0b14ed961bb50abf/wm-2026-harry-kane-der-koenig-der-loewen.html,0,www.welt.de,Der König der Löwen,Harry Kane trifft wie am Fließband. Doch gegen Gastgeber Mexiko stehen England und der von der Schippe gesprungene Thomas Tuchel vor ihrer bislang größten Aufgabe bei dieser Weltmeisterschaft.,https://images.welt.de/6a47ab7b0b14ed961bb50abf/f7c775dd09d88044855b2ab4ca30f2ee/ci16x9-w1200/gyi-2280771113-jpg,2026-07-05T13:53:51Z,,Harry Kane trifft wie am Fließband. Doch gegen Gastgeber Mexiko stehen England und der von der Schippe gesprungene Thomas Tuchel vor ihrer bislang größten Aufgabe bei dieser Weltmeisterschaft.Exakt 2… [+8719 chars],,de,'Gas'
https://www.tagesspiegel.de/berlin/104-stunden-ohne-strom-expertenkommission-legt-bericht-zu-blackout-im-januar-vor-15804035.html,https://www.tagesspiegel.de/berlin/104-stunden-ohne-strom-expertenkommission-legt-bericht-zu-blackout-im-januar-vor-15804035.html,0,www.tagesspiegel.de,104 Stunden ohne Strom: Expertenkommission legt Bericht zu Blackout im Januar vor,"Nach dem größten Stromausfall seit dem Zweiten Weltkrieg in Berlin hat eine Expertenrunde Bilanz gezogen, was aus dem Vorfall im Januar zu lernen ist. Welche Schutzmaßnahmen sind künftig notwendig?",https://www.tagesspiegel.de/images/15804034/alternates/BASE_16_9_W1400/1783301466000/stromnetz-berlin.jpeg,2026-07-06T01:31:06Z,,"Welche Lehren in Berlin aus dem tagelangen Stromausfall Anfang des Jahres gezogen werden sollten, will eine Expertenkommission am Montag (ab 11.30 Uhr) erläutern. Die Kommission wurde bereits Ende Ja… [+1423 chars]",,de,'Blackout'
https://www.zeit.de/news/2026-07/06/ungepixelte-kinder-soap-star-dumitru-kritisiert-influencer,https://www.zeit.de/news/2026-07/06/ungepixelte-kinder-soap-star-dumitru-kritisiert-influencer,0,www.zeit.de,Soziale Medien: Ungepixelte Kinder: Soap-Star Dumitru kritisiert Influencer,Hier finden Sie Informationen zu dem Thema „Soziale Medien“. Lesen Sie jetzt „Ungepixelte Kinder: Soap-Star Dumitru kritisiert Influencer“.,https://img.zeit.de/news/2026-07/06/ungepixelte-kinder-soap-star-dumitru-kritisiert-influencer-image-group/wide__1300x731,2026-07-06T03:55:04Z,,"Schauspieler Marc Dumitru («Alles was zählt») übt scharfe Kritik an sogenannten Mom- und Dadfluencern, die ihre Kinder für jedermann erkennbar in den sozialen Medien präsentieren. «Ich sehe den Trend… [+1605 chars]",,de,'Kinder'
https://www.morgenpost.de/berlin/article412494048/nach-stromausfall-im-januar-expertenkommission-legt-bericht-vor.html,https://www.morgenpost.de/berlin/article412494048/nach-stromausfall-im-januar-expertenkommission-legt-bericht-vor.html,0,www.morgenpost.de,Nach Stromausfall im Januar – Expertenkommission legt Bericht vor,100.000 Menschen ohne Strom und Heizung: Berlin präsentiert heute die Lehren aus dem tagelangen Blackout Anfang des Jahres.,https://img.sparknews.funkemedien.de/412494047/412494047_1783321163_v16_9_1600.jpeg,2026-07-06T06:59:21Z,,Monate nach dem tagelangen Stromausfall in Berlin zieht eine Expertenkommission am Montag offiziell Bilanz. Ab 11.30 Uhr stellt das vom Senat Ende Januar eingesetzte Gremium seinen Bericht im Roten R… [+1084 chars],,de,'Blackout'
https://www.focus.de/immobilien/mieten/die-haelfte-der-deutschen-laesst-staatliche-hilfen-liegen_46454c08-9223-4f75-9e73-4e765dc445eb.html,https://www.focus.de/immobilien/mieten/die-haelfte-der-deutschen-laesst-staatliche-hilfen-liegen_46454c08-9223-4f75-9e73-4e765dc445eb.html,0,www.focus.de,Die Hälfte der Deutschen lässt staatliche Hilfen liegen,"Viele Familien verschenken Kinderzuschlag und Wohngeld. Prüfen Sie jetzt, ob Ihnen 2026 Hunderte Euro im Monat zustehen.","https://quadro.burda-forward.de/ctf/5fc277c6-1571-4262-85d4-a939ab798f2d.b18663f0-b13f-477c-b1c2-3d4b439bb1b2.jpeg?im=RegionOfInterestCrop=(1200,630),regionOfInterest=(400,300)&hash=ad1d38045dbc052fe15e744e29aa3b1e5e8105e7bf646b03ebd655c66dfa976f",2026-07-06T07:51:00Z,,"Viele Menschen in Deutschland nehmen Sozialleistungen nicht wahr, obwohl sie eigentlich Anspruch darauf hätten. Oft wissen Betroffene nicht, was ihnen zusteht. So schätzt die Bundesregierung etwa sel… [+4334 chars]",,de,'Heizkosten'
https://www.zeit.de/news/2026-07/06/kleinbus-prallt-gegen-dachvorsprung-kinder-leicht-verletzt,https://www.zeit.de/news/2026-07/06/kleinbus-prallt-gegen-dachvorsprung-kinder-leicht-verletzt,0,www.zeit.de,Unfall mit Schulbus: Kleinbus prallt gegen Dachvorsprung – Kinder leicht verletzt,Hier finden Sie Informationen zu dem Thema „Unfall mit Schulbus“. Lesen Sie jetzt „Kleinbus prallt gegen Dachvorsprung – Kinder leicht verletzt“.,https://img.zeit.de/news/2026-07/06/kleinbus-prallt-gegen-dachvorsprung-kinder-leicht-verletzt-image-group/wide__1300x731,2026-07-06T09:02:33Z,,"Ein Kleinbus mit Grundschulkindern ist auf dem Weg zur Schule in Salem (Bodenseekreis) von der Straße abgekommen und gegen eine Wand geprallt. Nach Auskunft der Polizei waren 25 Kinder an Bord, 8 von… [+528 chars]",,de,'Kinder'
https://www.zeit.de/news/2026-07/06/warum-auch-immer-wieder-kinder-mit-e-scootern-verungluecken,https://www.zeit.de/news/2026-07/06/warum-auch-immer-wieder-kinder-mit-e-scootern-verungluecken,0,www.zeit.de,Verkehr: Warum auch immer wieder Kinder mit E-Scootern verunglücken,Hier finden Sie Informationen zu dem Thema „Verkehr“. Lesen Sie jetzt „Warum auch immer wieder Kinder mit E-Scootern verunglücken“.,https://img.zeit.de/news/2026-07/06/warum-auch-immer-wieder-kinder-mit-e-scootern-verungluecken-image-group/wide__1300x731,2026-07-06T10:52:58Z,,"Unfälle mit E-Scootern häufen sich in Hessen - und immer wieder werden dabei auch Kinder schwer verletzt oder sogar getötet, obwohl sie noch gar nicht mit den Rollern unterwegs sein dürfen. So starb … [+4741 chars]",,de,'Kinder'
https://www.tagesspiegel.de/berlin/expertenbericht-zum-blackout-berlin-steht-blank-da--und-ist-nicht-krisenfest-15806926.html,https://www.tagesspiegel.de/berlin/expertenbericht-zum-blackout-berlin-steht-blank-da--und-ist-nicht-krisenfest-15806926.html,0,www.tagesspiegel.de,Expertenbericht zum Blackout: „Berlin steht blank da“ – und ist nicht krisenfest,Nach den Anschlägen auf das Berliner Stromnetz fällt eine Expertenkommission ein vernichtendes Urteil: Berlin steht im Katastrophenfall blank da und muss dringend nachrüsten.,https://www.tagesspiegel.de/images/15529399/alternates/BASE_16_9_W1400/1777301503000/stromausfall-nach-anschlag-im-sudwesten-von-berlin.jpeg,2026-07-06T13:25:34Z,,"Das, was Teile des Berliner Südwestens in den ersten Tagen des noch jungen Jahres erleben mussten, das war Terror. So steht es direkt im ersten Satz des Berichts einer unabhängigen Expertenkommission… [+4662 chars]",,de,'Blackout'
https://www.zeit.de/news/2026-07/06/regierung-will-25-euro-zuschlag-fuer-arme-kinder-streichen,https://www.zeit.de/news/2026-07/06/regierung-will-25-euro-zuschlag-fuer-arme-kinder-streichen,0,www.zeit.de,Finanzen: Regierung will 25-Euro-Zuschlag für arme Kinder streichen,Hier finden Sie Informationen zu dem Thema „Finanzen“. Lesen Sie jetzt „Regierung will 25-Euro-Zuschlag für arme Kinder streichen“.,https://img.zeit.de/news/2026-07/06/regierung-will-25-euro-zuschlag-fuer-arme-kinder-streichen-image-group/wide__1300x731,2026-07-06T15:44:51Z,,Für von Armut betroffene Kinder und Jugendliche soll ein staatlicher Zuschlag in Höhe von 25 Euro pro Monat gestrichen werden. Das geht aus einem vom Bundeskabinett auf den Weg gebrachten Gesetz herv… [+2247 chars],,de,'Kinder'
https://www.tagesspiegel.de/gesellschaft/panorama/energiekrise-erneuter-strom-blackout-legt-ganz-kuba-lahm-15808659.html,https://www.tagesspiegel.de/gesellschaft/panorama/energiekrise-erneuter-strom-blackout-legt-ganz-kuba-lahm-15808659.html,0,www.tagesspiegel.de,Energiekrise: Erneuter Strom-Blackout legt ganz Kuba lahm,Wegen alter Infrastruktur und eines Ölembargos der USA kommt es in Kuba täglich zu langen Stromausfällen - oft auch landesweit. Die Ursachen des aktuellen Blackouts werden geprüft.,https://www.tagesspiegel.de/images/15808658/alternates/BASE_16_9_W1400/1783357924000/inselweiter-stromausfall-auf-kuba.jpeg,2026-07-06T17:12:04Z,,"Auf der Karibikinsel Kuba ist das Stromnetz erneut landesweit zusammengebrochen. Die Ursachen des vollständigen Ausfalls werden untersucht, wie die staatliche Stromgesellschaft UNE auf X mitteilte. D… [+807 chars]",,de,'Blackout'
https://www.welt.de/politik/ausland/article6a4bdf071cbe5f3a786a8e7a/ursache-unbekannt-kubas-netz-zusammengebrochen-zehn-millionen-menschen-ohne-strom.html,https://www.welt.de/politik/ausland/article6a4bdf071cbe5f3a786a8e7a/ursache-unbekannt-kubas-netz-zusammengebrochen-zehn-millionen-menschen-ohne-strom.html,0,www.welt.de,Kubas Netz zusammengebrochen – zehn Millionen Menschen ohne Strom,"Ein landesweiter Blackout legt Kuba lahm. Zehn Millionen Menschen sitzen im Dunkeln, die Regierung sucht die Ursache. Das marode Netz und die verschärften US-Sanktionen gegen Ölimporte treiben die Energiekrise der Insel auf eine neue Stufe.",https://images.welt.de/6a4bdf071cbe5f3a786a8e7a/73f68c62eafe76236e24d1212671f42d-master/ci16x9-w1200/urn-newsml-dpa-com-20090101-250911-99-990031,2026-07-06T17:14:04Z,,Das nationale Stromnetz auf Kuba ist nach Angaben des Netzbetreibers UNE am Montagmittag zusammengebrochen. Rund zehn Millionen Menschen auf der Karibikinsel waren dadurch ohne Strom. Die Ursache des… [+801 chars],,de,'Blackout'
https://www.faz.net/aktuell/politik/ausland/kuba-kompletter-blackout-nach-landesweitem-stromausfall-accg-201004385.html,https://www.faz.net/aktuell/politik/ausland/kuba-kompletter-blackout-nach-landesweitem-stromausfall-accg-201004385.html,0,www.faz.net,Im Dunkeln: Blackout auf Kuba nach landesweitem Stromausfall,Die Wiederherstellung der Versorgung läuft. Aber bis zum späten Nachmittag ‌konnte nur ein Prozent des Bedarfs der Hauptstadt Havanna gedeckt werden.,https://media0.faz.net/image/w1200h627/39f8eb0ae2e1/w5616h2934x0y405o/202607/43601.0.2306300656/strassenverkaeufer-unterhalten.webp,2026-07-07T01:51:30Z,,Auf Kuba ist am Montag das landesweite Stromnetz zusammengebrochen. Die Behörden begannen langsam mit der Wiederherstellung der Versorgung. Zunächst würden wichtige Einrichtungen wie Krankenhäuser un… [+1287 chars],,de,'Blackout'
https://www.zeit.de/news/2026-07/07/was-laesst-sich-beim-tankstopp-abseits-der-autobahn-sparen,https://www.zeit.de/news/2026-07/07/was-laesst-sich-beim-tankstopp-abseits-der-autobahn-sparen,0,www.zeit.de,Spritpreise: Was lässt sich beim Tankstopp abseits der Autobahn sparen?,Hier finden Sie Informationen zu dem Thema „Spritpreise“. Lesen Sie jetzt „Was lässt sich beim Tankstopp abseits der Autobahn sparen?“.,https://img.zeit.de/news/2026-07/07/was-laesst-sich-beim-tankstopp-abseits-der-autobahn-sparen-image-group/wide__1300x731,2026-07-07T02:00:26Z,,"Wer zum Tanken die Autobahn verlässt, kann nach Angaben des ADAC kräftig Geld sparen. Im Landesdurchschnitt sind das nach einer Untersuchung des Verkehrsclubs rund 17 Cent in Brandenburg bei Super E1… [+1760 chars]",,de,'Spritpreise'
https://www.zeit.de/news/2026-07/07/neue-regeln-beim-elterngeld-was-plant-prien,https://www.zeit.de/news/2026-07/07/neue-regeln-beim-elterngeld-was-plant-prien,0,www.zeit.de,Zeit für Kinder: Neue Regeln beim Elterngeld: Was plant Prien?,Hier finden Sie Informationen zu dem Thema „Zeit für Kinder“. Lesen Sie jetzt „Neue Regeln beim Elterngeld: Was plant Prien?“.,https://img.zeit.de/news/2026-07/07/neue-regeln-beim-elterngeld-was-plant-prien-image-group/wide__1300x731,2026-07-07T02:30:07Z,,"Füttern, wickeln, baden, singen, spielen: Wer künftig für sein Baby eine berufliche Auszeit nimmt, muss sich auf Änderungen beim Elterngeld einstellen. Familienministerin Karin Prien (CDU) hat ein ne… [+5197 chars]",,de,'Kinder'
https://www.welt.de/sport/fussball/wm/video6a4c6164b2ab39bc4a3237a3/usa-belgien-highlights-bitterer-blackout-keeper-freese-laedt-zum-toreschiessen-ein.html,https://www.welt.de/sport/fussball/wm/video6a4c6164b2ab39bc4a3237a3/usa-belgien-highlights-bitterer-blackout-keeper-freese-laedt-zum-toreschiessen-ein.html,0,www.welt.de,Bitterer Blackout – Keeper Freese lädt Belgien ein,"Vor dem 3:1 unterläuft dem Keeper der USA ein krasser Aussetzer. Statt den Ball zu klären, verliert er ihn außerhalb des eigenen Strafraums. Die Szene im Video.",https://images.welt.de/6a4c6164b2ab39bc4a3237a3/648a00f210952790e2cd2e2ee8110aa6/ci16x9-w1200/apdpa-d15cd753462f477e807e2d129cba29dc-jpg,2026-07-07T02:30:57Z,,Die WELT als ePaper: Die vollständige Ausgabe steht Ihnen bereits am Vorabend zur Verfügung so sind Sie immer hochaktuell informiert. Weitere Informationen https://epaper.welt.de,,de,'Blackout'
https://www.sueddeutsche.de/panorama/kuba-stromausfall-energiekrise-li.3511558,https://www.sueddeutsche.de/panorama/kuba-stromausfall-energiekrise-li.3511558,0,www.sueddeutsche.de,Blackout: Landesweiter Stromausfall auf Kuba,"Alle Bemühungen, die Versorgung wiederherzustellen, fruchten vorerst nicht. Die Stromausfälle hängen mit der von den USA verhängten Ölblockade zusammen.",https://www.sueddeutsche.de/2026/03/31/631d91a1-1674-4cb9-9a60-9d6ad51dae04.jpg?q=60&fm=webp&width=1200&rect=0%2C209%2C4000%2C2250,2026-07-07T04:16:07Z,,"Der Zusammenbruch ist der jüngste Rückschlag für die Insel, die bereits unter einer schweren Energie-, Treibstoff- und Medikamentenknappheit leidet. Seit Monaten kommt es zu stunden- und tagelangen S… [+823 chars]",,de,'Blackout'
https://taz.de/Leben-mit-Hitze/!6187924/,https://taz.de/Leben-mit-Hitze/!6187924/,0,taz.de,Leben mit Hitze: Last exit Badezimmer,"Niemand muss unter Hitze leiden. Es gibt Möglichkeiten, Wohnungen gegen Hitze zu präparieren. Schließlich haben wir ja auch Heizungen gegen die Kälte.",https://taz.de/picture/8589168/1200/41573145.jpeg,2026-07-07T05:39:00Z,,"Niemand muss unter Hitze leiden. Es gibt Möglichkeiten, Wohnungen gegen Hitze zu präparieren. Schließlich haben wir ja auch Heizungen gegen die Kälte. mehr...",,de,'Kälte'
https://www.diepresse.com/35523915/tornados-und-gewitterstuerme-tote-und-hunderte-verletzte-in-china,https://www.diepresse.com/35523915/tornados-und-gewitterstuerme-tote-und-hunderte-verletzte-in-china,0,www.diepresse.com,Tornados und Gewitterstürme: Tote und hunderte Verletzte in China,"Tödiche Wetterkapriolen in mehreren Teilen Chinas: In der Region Guangxi sind Dämme gebrochen, es gilt die höchste Hochwasser-Alarmstufe. In Gansu wird nach Verschütteten nach einem Erdrutsch gesucht.",https://img.diepresse.com/public/incoming/cpzzsb-asia-weatherchina/alternates/WEBP_WIDE_1200/ASIA-WEATHERCHINA,2026-07-07T06:11:10Z,,"Die Presse auf Google als bevorzugte Nachrichtenquelle hinzufügen.
 Durch Gewitter und starke Stürme sind in Zentral- und Südchina mindestens 15 Menschen getötet und hunderte weitere verletzt worden… [+1738 chars]",,de,'Hochwasser'
https://www.zeit.de/news/2026-07/07/zwei-kinder-auf-gueterzug-nothalt-nach-riskanter-aktion,https://www.zeit.de/news/2026-07/07/zwei-kinder-auf-gueterzug-nothalt-nach-riskanter-aktion,0,www.zeit.de,Notfälle: Zwei Kinder auf Güterzug: Nothalt nach riskanter Aktion,Hier finden Sie Informationen zu dem Thema „Notfälle“. Lesen Sie jetzt „Zwei Kinder auf Güterzug: Nothalt nach riskanter Aktion“.,https://img.zeit.de/news/2026-07/07/zwei-kinder-auf-gueterzug-nothalt-nach-riskanter-aktion-image-group/wide__1300x731,2026-07-07T08:24:48Z,,"Zwei Kinder haben sich in Lebensgefahr gebracht, indem sie auf einem Güterzug mitgefahren sind. Der 12-jährige Junge und das 13-jährige Mädchen kletterten nach Angaben der Polizei am Montagabend im B… [+463 chars]",,de,'Kinder'
https://www.diepresse.com/35290786/ploetzlich-fallen-die-oelpreise-aber-warum-bleibt-der-sprit-teuer,https://www.diepresse.com/35290786/ploetzlich-fallen-die-oelpreise-aber-warum-bleibt-der-sprit-teuer,0,www.diepresse.com,"Plötzlich fallen die Ölpreise, aber warum bleibt der Sprit teuer? [premium]",Die Preise für Rohöl sind deutlich gesunken und befinden sich wieder auf dem Niveau von vor dem Iran-Krieg. Warum man davon an den Tankstellen (noch) wenig spürt.,https://img.diepresse.com/public/incoming/1qcifq-imago-images-101667674/alternates/WEBP_WIDE_1200/imago%20images%20101667674,2026-07-07T08:55:26Z,,Die Lage auf den internationalen Rohölmärkten hat sich beruhigt. Ein Barrel der Nordseesorte Brent notiert inzwischen bei rund 73 US-Dollar und befindet sich damit wieder auf dem Niveau von vor Ausbr… [+4173 chars],,de,'Rohöl'
https://www.zeit.de/news/2026-07/07/bund-listet-versaeumnisse-beim-hochwasserschutz-auf,https://www.zeit.de/news/2026-07/07/bund-listet-versaeumnisse-beim-hochwasserschutz-auf,0,www.zeit.de,Hochwasserschutz: BUND listet Versäumnisse beim Hochwasserschutz auf,Hier finden Sie Informationen zu dem Thema „Hochwasserschutz“. Lesen Sie jetzt „BUND listet Versäumnisse beim Hochwasserschutz auf“.,https://img.zeit.de/news/2026-07/07/bund-listet-versaeumnisse-beim-hochwasserschutz-auf-image-group/wide__1300x731,2026-07-07T12:48:53Z,,"Der Bund für Umwelt und Naturschutz Deutschland (BUND) sieht Sachsen noch immer nicht ausreichend auf Wetterextreme vorbereitet. Statt Flüssen mehr Raum zu geben, würden wichtige Überflutungsflächen … [+2116 chars]",,de,'Hochwasser'
https://www.tagesspiegel.de/berlin/anders-als-zuvor-behauptet-wegner-hat-am-morgen-des-stromausfalls-mit-niemandem-dienstlich-telefoniert-15807013.html,https://www.tagesspiegel.de/berlin/anders-als-zuvor-behauptet-wegner-hat-am-morgen-des-stromausfalls-mit-niemandem-dienstlich-telefoniert-15807013.html,0,www.tagesspiegel.de,Anders als zuvor behauptet: Wegner hat am Morgen des Stromausfalls mit niemandem dienstlich telefoniert,"Berlins Regierender Bürgermeister bestritt bislang, die Öffentlichkeit zum Blackout getäuscht zu haben. Doch daran mehren sich Zweifel. Die Senatskanzlei machte ebenfalls unwahre Angaben.",https://www.tagesspiegel.de/images/15807992/alternates/BASE_16_9_W1400/1783427211000/expertenkommission-stromausfall-legt-bericht-vor.jpeg,2026-07-07T12:57:32Z,,Berlins Regierender Bürgermeister Kai Wegner (CDU) hat über seine Telefonate am Morgen des Stromausfalls in der Öffentlichkeit offenbar wissentlich die Unwahrheit gesagt. Dies ergibt sich aus mitgete… [+6221 chars],,de,'Blackout'
https://www.golem.de/sonstiges/zustimmung/auswahl.html?from=https://www.golem.de/news/kauft-einen-dell-dell-aktie-steigt-nach-trump-aussage-2607-210600.html&referer=https://t.co/99eabcb559,https://www.golem.de/sonstiges/zustimmung/auswahl.html?from=https://www.golem.de/news/kauft-einen-dell-dell-aktie-steigt-nach-trump-aussage-2607-210600.html&referer=https://t.co/99eabcb559,0,www.golem.de,"""Kauft einen Dell"": Dell-Aktie steigt nach Trump-Aussage","Bei der Vorstellung der sogenannten Trump-Konten für Kinder lobt der US-Präsident die Spenden des Dell-Gründers und beeinflusst damit den Aktienkurs des Herstellers. (USA, Dell)",,2026-07-07T13:30:01Z,,"Besuchen Sie Golem.de wie gewohnt mit Werbung und Tracking,
 indem Sie der Nutzung aller Cookies zustimmen.
 Details zum Tracking finden Sie im Privacy Center.
Skript wurde nicht geladen. Informat… [+607 chars]",,de,'Kinder'
https://www.golem.de/sonstiges/zustimmung/auswahl.html?from=https://www.golem.de/news/anzeige-stabile-tablethalterung-fuers-auto-fuer-nur-16-96-euro-bei-amazon-2607-210609.html&referer=https://t.co/9b106e8f42,https://www.golem.de/sonstiges/zustimmung/auswahl.html?from=https://www.golem.de/news/anzeige-stabile-tablethalterung-fuers-auto-fuer-nur-16-96-euro-bei-amazon-2607-210609.html&referer=https://t.co/9b106e8f42,0,www.golem.de,"Anzeige: Stabile Tablethalterung fürs Auto für nur 16,96 Euro bei Amazon","Amazon hat eine Tablethalterung fürs Auto im Angebot, mit der Kinder auf der Rückbank bequem Filme und Serien anschauen können. (Technik/Hardware)",,2026-07-07T14:58:01Z,,"Besuchen Sie Golem.de wie gewohnt mit Werbung und Tracking,
 indem Sie der Nutzung aller Cookies zustimmen.
 Details zum Tracking finden Sie im Privacy Center.
Skript wurde nicht geladen. Informat… [+607 chars]",,de,'Kinder'
https://www.welt.de/politik/deutschland/article6a4d1baadfc0c82fa2909487/nach-stromausfall-wegner-erneut-unter-druck-regierender-buergermeister-sagte-wohl-nicht-die-wahrheit-ueber-telefonate.html,https://www.welt.de/politik/deutschland/article6a4d1baadfc0c82fa2909487/nach-stromausfall-wegner-erneut-unter-druck-regierender-buergermeister-sagte-wohl-nicht-die-wahrheit-ueber-telefonate.html,0,www.welt.de,Wegner erneut unter Druck – Regierender Bürgermeister sagte wohl nicht die Wahrheit über Telefonate,"Kai Wegners Darstellung zum ersten Blackout‑Tag wackelt erneut: Laut Senatskanzlei gab es nach dem Stromausfall im Januar vormittags keine dienstlichen Telefonate, nur Textnachrichten. Wegner hatte das im Januar anders dargestellt.",https://images.welt.de/6a4d1baadfc0c82fa2909487/ae48f69cf10931855489873688271473-master/ci16x9-w1200/dpa-com-260707-936-35094-jpg,2026-07-07T16:14:04Z,,"Kai Wegners Darstellung zum ersten BlackoutTag wackelt erneut: Laut Senatskanzlei gab es nach dem Stromausfall im Januar vormittags keine dienstlichen Telefonate, nur Textnachrichten. Wegner hatte da… [+1951 chars]",,de,'Blackout'
https://www.bild.de/politik/inland/berliner-stromausfall-jetzt-fliegt-wegners-telefon-unwahrheit-auf-6a4d13ad486ea1079bcfe9f0,https://www.bild.de/politik/inland/berliner-stromausfall-jetzt-fliegt-wegners-telefon-unwahrheit-auf-6a4d13ad486ea1079bcfe9f0,0,www.bild.de,Neue Enthüllung zum Berliner Blackout - Jetzt fliegt Wegners Telefon-Unwahrheitauf,Neue Angaben zum Blackout-Tag setzen Kai Wegner wegen falscher Telefon-Aussagen unter Druck.,"https://images.bild.de/6a4d13ad486ea1079bcfe9f0/0f99a8a79eb2fb78847ccb9965e62c59,798c13b5?w=1280",2026-07-07T16:16:29Z,,"TTS-Player überspringenArtikel weiterlesenBerlin Die Blackout-Affäre holt Berlins Regierenden Bürgermeister Kai Wegner (53, CDU) erneut ein: Anders als von ihm selbst behauptet, führte der CDU-Politi… [+2154 chars]",,de,'Blackout'
https://www.basicthinking.de/blog/2026/07/08/eisen-als-energiespeicher/,https://www.basicthinking.de/blog/2026/07/08/eisen-als-energiespeicher/,0,www.basicthinking.de,Eisen als Energiespeicher: Bekommen alte Kohlekraftwerke eine neue Aufgabe?,"Der Beitrag Eisen als Energiespeicher: Bekommen alte Kohlekraftwerke eine neue Aufgabe? erschien zuerst beim Online-Magazin BASIC thinking. Über unseren Newsletter UPDATE startest du jeden Morgen bestens informiert in den Tag.
Europas Energiesystem braucht Sp…",https://www.basicthinking.de/blog/wp-content/uploads/2026/07/eisenpulver-als-energiespeicher-1.webp,2026-07-08T03:46:44Z,,"Europas Energiesystem braucht Speicher, die grünen Strom über Wochen oder Monate verfügbar halten. Wasserstoff allein reicht dafür möglicherweise nicht aus. Eine neue Studie zeigt, dass Eisenpulver a… [+3754 chars]",,de,'Kohle'
