index,url,valid,domain,title,description,image,published,archive,content,quote,language,keyword
https://www.stern.de/gesellschaft/regional/rheinland-pfalz-saarland/schlechtwetter-sommer--dehoga-sieht-betriebe-in-bedraengnis----katastrophaler-juli--35940350.html,https://www.stern.de/gesellschaft/regional/rheinland-pfalz-saarland/schlechtwetter-sommer--dehoga-sieht-betriebe-in-bedraengnis----katastrophaler-juli--35940350.html,0,www.stern.de,"Schlechtwetter-Sommer: Dehoga sieht Betriebe in Bedrängnis - ""Katastrophaler Juli""",Mainz (lrs) - Die Gastronomie in Rheinland-Pfalz schlägt Alarm angesichts des verregneten Sommers. Die Schlechtwetterlage treffe die Branche in ihrer,https://image.stern.de/35940352/t/6o/v1/w1440/r1.7778/-/01--3f62sl7kndv7axs2048jpeg---42727d79359e369e.jpg,2025-08-01T01:30:39Z,https://web.archive.org/web/20250803055705/https://www.stern.de/gesellschaft/regional/rheinland-pfalz-saarland/schlechtwetter-sommer--dehoga-sieht-betriebe-in-bedraengnis----katastrophaler-juli--35940350.html,"Kopiere den aktuellen Link
Zur Merkliste hinzufügen
Regen und Kälte vermiesen der rheinland-pfälzischen Gastronomie das wichtigste Geschäft des Jahres. Der Verband sieht die Branche unter Druck.
D… [+2528 chars]",,de,'Kälte'
https://www.zeit.de/news/2025-08/01/greenpeace-protestiert-auf-bohrplatz-gegen-gasfoerderung,https://www.zeit.de/news/2025-08/01/greenpeace-protestiert-auf-bohrplatz-gegen-gasfoerderung,0,www.zeit.de,Umstrittenes Energieprojekt: Greenpeace protestiert auf Bohrplatz gegen Gasförderung,Hier finden Sie Informationen zu dem Thema „Umstrittenes Energieprojekt“. Lesen Sie jetzt „Greenpeace protestiert auf Bohrplatz gegen Gasförderung“.,https://img.zeit.de/news/2025-08/01/greenpeace-protestiert-auf-bohrplatz-gegen-gasfoerderung-image-group/wide__1300x731,2025-08-01T05:58:40Z,https://web.archive.org/web/20250825054826/https://www.zeit.de/news/2025-08/01/greenpeace-protestiert-auf-bohrplatz-gegen-gasfoerderung,Wenige Tage vor dem Beginn der umstrittenen Erdgasbohrung in der Gemeinde Reichling (Landkreis Landsberg am Lech) unweit des Ammersees sind Umweltschützer in das umzäunte Gelände eingedrungen. Auf ei… [+3761 chars],,de,'Gas'
https://www.bild.de/sport/mehr-sport/laura-dahlmeier-us-kletterer-sass-mit-im-rettungshubschrauber-688c58ad9c92705a2cd068a6,https://www.bild.de/sport/mehr-sport/laura-dahlmeier-us-kletterer-sass-mit-im-rettungshubschrauber-688c58ad9c92705a2cd068a6,0,www.bild.de,US-Kletterer saß mit im Hubschrauber - „Ich konnte Laura im Schnee entdecken“,Biathlon-Königin Laura Dahlmeier verunglückte bei einer Bergtour in Pakistan. Ein US-Kletterer saß mit im Rettungshubschrauber und erzählt: „Ich konnte Laura im Schnee entdecken“,"https://images.bild.de/688c58ad9c92705a2cd068a6/e78a2dcbda7d71e5f04a32bd4b700c3b,ecbc95e1?w=1280",2025-08-01T07:14:37Z,,"Laura Dahlmeier (31) wurde am 28. Juli im Karakorum-Gebirge in Pakistan auf rund 5700 Metern Höhe von einem Steinschlag getroffen. Ihre Kletterpartnerin setzte einen Notruf ab.
Der Militärhubschraub… [+200 chars]",,de,'Schnee'
https://www.zeit.de/2025/32/ferienbetreuung-eltern-kinder-sommerferien-urlaubstage,https://www.zeit.de/2025/32/ferienbetreuung-eltern-kinder-sommerferien-urlaubstage,0,www.zeit.de,"Ferienbetreuung: Hilfe, es sind Ferien!","Drei Kinder, zwei Monate durchwurschteln: die Sommerferien, ein institutionalisierter Betreuungsnotstand. Eltern brauchen mehr Urlaubstage oder mehr Betreuungsangebote.",https://img.zeit.de/2025/32/hilfe-es-sind-ferien-bild-1/wide__1300x731,2025-08-01T07:20:53Z,http://archive.md/20250731073207/https://www.zeit.de/2025/32/ferienbetreuung-eltern-kinder-sommerferien-urlaubstage,"Schließen
Artikelzusammenfassung
Eltern stehen jedes Jahr vor der Herausforderung, die Sommerferien zu meistern, während Institutionen wie Kitas und Schulen schließen und Betreuungslücken entstehen… [+817 chars]",,de,'Kinder'
https://www.focus.de/panorama/ich-konnte-laura-im-schnee-entdecken-bergsteiger-marvell-ueber-dahlmeier_68af7a26-bdbe-4f59-ae04-302753ac983b.html,https://www.focus.de/panorama/ich-konnte-laura-im-schnee-entdecken-bergsteiger-marvell-ueber-dahlmeier_68af7a26-bdbe-4f59-ae04-302753ac983b.html,0,www.focus.de,"""Ich konnte Laura im Schnee entdecken"": Bergsteiger Marvell über Dahlmeier","Ein Steinschlag trifft Laura Dahlmeier auf 5.700 Metern Höhe. Ihre Seilpartnerin sieht das Unglück - und kann nicht helfen. Jetzt spricht ein amerikanischer Bergsteiger, der im Rettungshubschrauber saß.",https://quadro.burda-forward.de/ctf/b6302beb-cf72-412a-bcee-f40c9a2e5d81.81acf4b2-1be4-4c91-9a24-cf2e3ae769e0.jpeg?im=RegionOfInterestCrop%3D%281200%2C630%29%2CregionOfInterest%3D%28915%2C661%29&hash=272f15edd145c7580d4a0e67daa2734ecf3d8773431b6f7c1a71dcb900388640,2025-08-01T09:02:15Z,,"Nach dem tödlichen Unglück von Laura Dahlmeier im Karakorum in Pakistan hat ihre Seilpartnerin Details zum Hergang am 28. Juli geschildert. Ich habe beobachtet, wie die Laura ein riesengroßer Stein g… [+2290 chars]",,de,'Schnee'
https://www.businessinsider.de/wirtschaft/usa-und-europa-schliessen-energie-pakt-diese-lng-aktien-profitieren-davon/,https://www.businessinsider.de/wirtschaft/usa-und-europa-schliessen-energie-pakt-diese-lng-aktien-profitieren-davon/,0,www.businessinsider.de,Diese Aktien profitieren vom Energie-Pakt zwischen Trump und der EU,"Europa hat Donald Trump zugesagt, Gas, Kohle und Öl für 750 Milliarden Dollar in den USA einzukaufen. Selbst wenn diese Summe in der Form nie zustandekommt, stehen die Zeichen für den Energieexporteurs USA auf Expansion. Vor allem der Bedarf an LNG verspricht…",https://images.welt.de/6888d8cdfb78b37c64a194bc/ab5e505e7fc4602fcade7f48708a04ac-master/ci16x9-w1200/dwosb-teaser-cheniere-fb,2025-08-01T10:39:34Z,http://archive.md/20250731183608/https://www.businessinsider.de/wirtschaft/usa-und-europa-schliessen-energie-pakt-diese-lng-aktien-profitieren-davon/,"Europa hat Donald Trump zugesagt, Gas, Kohle und Öl für 750 Milliarden Dollar in den USA einzukaufen. Selbst wenn diese Summe in der Form nie zustandekommt, stehen die Zeichen für den Energieexporteu… [+77 chars]",,de,'Kohle'
https://www.zeit.de/familie/2025-06/getrennte-eltern-kind-alltag-doppelleben,https://www.zeit.de/familie/2025-06/getrennte-eltern-kind-alltag-doppelleben,0,www.zeit.de,Getrennte Eltern: Bei Papa ist mein Sohn ein anderer,"Kinder getrennter Eltern passen sich oft an zwei unterschiedliche Zuhause an. Eine Mutter wundert sich über das Doppelleben des Kindes – und versteht, warum das gut ist.",https://img.zeit.de/familie/2025-07/getrennte-eltern-kind-alltag/wide__1300x731,2025-08-01T13:05:33Z,https://web.archive.org/web/20250802130500/https://www.zeit.de/familie/2025-06/getrennte-eltern-kind-alltag-doppelleben,"Dieser Artikel ist Teil von ZEIT am Wochenende, Ausgabe 31/2025. 
""Apoche bleibt gleich"", quäkte mein Sohn an einem Mittwoch vor zwei Jahren, als er nach ein paar Tagen bei seinem Vater wieder bei m… [+328 chars]",,de,'Kinder'
https://www.faz.net/aktuell/politik/inland/oel-und-gas-vor-usedom-gefunden-bohren-wo-andere-urlaub-machen-110616360.html,https://www.faz.net/aktuell/politik/inland/oel-und-gas-vor-usedom-gefunden-bohren-wo-andere-urlaub-machen-110616360.html,0,www.faz.net,"Öl- und Gas vor Usedom: Bohren, wo andere Urlaub machen",Vor Usedom entdeckt ein Unternehmen enorme Mengen Öl und Gas. Polen kann sein Glück kaum fassen. Umweltschützer befürchten eine Katastrophe.,https://media0.faz.net/ppmedia/aktuell/wirtschaft/3318392161/1.10616362/facebook_teaser/gefaehrdete-ostseeidylle-blick.jpg,2025-08-01T13:07:25Z,http://archive.md/20250801132841/https://www.faz.net/aktuell/politik/inland/oel-und-gas-vor-usedom-gefunden-bohren-wo-andere-urlaub-machen-110616360.html,"Am weiten Sandstrand des Seebads Ahlbeck werden am Morgen die ersten Strandkörbe bezogen. Kinder stürzen sich in die Wellen, ältere Leute spazieren an der Gischt entlang. Eine Ostseeidylle.
Wäre da … [+11574 chars]",,de,'Gas'
https://www.zeit.de/politik/2025-08/kinder-gaza-evakuierung-bundesregierung-nachrichtenpodcast,https://www.zeit.de/politik/2025-08/kinder-gaza-evakuierung-bundesregierung-nachrichtenpodcast,0,www.zeit.de,Kinder in Gaza: Warum Deutschland kaum Kinder aus Gaza aufnimmt,Deutschlands Hilfe für verletzte Kinder aus Gaza bleibt gering. Warum tut sich die Bundesregierung damit so schwer? Und: Warum sterben so viele Menschen in den Bergen?,https://img.zeit.de/politik/2017-09/illu-podcast-news/wide__8ed8a6__1300x731,2025-08-02T03:57:44Z,,"Alle zehn Minuten wird in Gaza ein Kind getötet oder verletzt, so die Bilanz des UN-Kinderhilfswerks Unicef. Während EU-Länder wie Italien und Spanien ihre Hilfe angeboten haben und schwer verletzte … [+1894 chars]",,de,'Kinder'
https://www.stern.de/panorama/wissen/klimawandel--gletscherschmelze-in-den-alpen-besonders-frueh-35943656.html,https://www.stern.de/panorama/wissen/klimawandel--gletscherschmelze-in-den-alpen-besonders-frueh-35943656.html,0,www.stern.de,Klimawandel: Gletscherschmelze in den Alpen besonders früh,"Jeden Winter füttert Schnee im Hochgebirge die Gletscher an, bevor die Sommerschmelze kommt. In diesem Jahr hat die Schmelze in den Alpen besonders früh begonnen. Warum?",https://image.stern.de/35943658/t/34/v1/w1440/r1.7778/-/02--2suu66r5vfv9axs2048jpeg---d04964d2f15fb8ab.jpg,2025-08-02T04:30:37Z,,"Kopiere den aktuellen Link
Zur Merkliste hinzufügen
Jeden Winter füttert Schnee im Hochgebirge die Gletscher an, bevor die Sommerschmelze kommt. In diesem Jahr hat die Schmelze in den Alpen besonde… [+2774 chars]",,de,'Schnee'
https://www.tagesspiegel.de/wissen/klimawandel-gletscherschmelze-in-den-alpen-besonders-fruh-14123528.html,https://www.tagesspiegel.de/wissen/klimawandel-gletscherschmelze-in-den-alpen-besonders-fruh-14123528.html,0,www.tagesspiegel.de,Klimawandel: Gletscherschmelze in den Alpen besonders früh,"Jeden Winter füttert Schnee im Hochgebirge die Gletscher an, bevor die Sommerschmelze kommt. In diesem Jahr hat die Schmelze in den Alpen besonders früh begonnen. Warum?",https://www.tagesspiegel.de/images/14123525/alternates/BASE_16_9_W1400/1754109144000/gletscherschwund-schweiz.jpeg,2025-08-02T04:32:24Z,,"Es sieht nicht gut aus für die Alpengletscher in diesem Jahr: Das legt der Gletscherschwundtag nahe. Es ist der Tag, an dem der Winterschnee geschmolzen ist und es an die Substanz der Gletscher geht.… [+2635 chars]",,de,'Schnee'
https://www.n-tv.de/wissen/Gletscher-schmelzen-in-diesem-Jahr-besonders-frueh-article25941200.html,https://www.n-tv.de/wissen/Gletscher-schmelzen-in-diesem-Jahr-besonders-frueh-article25941200.html,0,www.n-tv.de,Zu wenig Schnee im Winter: Gletscher schmelzen in diesem Jahr besonders früh,Es ist ein Riesenproblem für die Alpen - und ein Alarmzeichen: Die Gletscherschmelze beginnt immer früher. Mehr noch: Seit mehr als 20 Jahren gibt es in der Schweiz kein Gletscherwachstum mehr.,https://www.n-tv.de/img/incoming/crop25941199/2691324554-cImg_16_9-w1200/b012f323bdd947788d23d24470eeb8c7.jpg,2025-08-02T06:59:05Z,,"Es ist ein Riesenproblem für die Alpen - und ein Alarmzeichen: Die Gletscherschmelze beginnt immer früher. Mehr noch: Seit mehr als 20 Jahren gibt es in der Schweiz kein Gletscherwachstum mehr.
Es s… [+2547 chars]",,de,'Winter'
https://www.transfermarkt.de/sturm-graz-holt-ex-herthaner-christensen-wird-uns-sofort-helfen-konnen-quot-/view/news/458037,https://www.transfermarkt.de/sturm-graz-holt-ex-herthaner-christensen-wird-uns-sofort-helfen-konnen-quot-/view/news/458037,0,www.transfermarkt.de,Sturm Graz holt Keeper Christensen: „Wird uns sofort helfen können“,Der SK Sturm Graz hat Oliver Christensen von der ACF Fiorentina verpflichtet. Der 26-jährige Torhüter schließt sich dem österreichischen Vizemeister leihweise bis zum Winter an und soll den verletzten [...],https://tmssl.akamaized.net/images/foto/big/oliver-christensen-fiorentina-2023-2324-1693301083-115225.jpg?lm=1693301129,2025-08-02T09:10:29Z,,"Halbjahres-Leihe von Fiorentina 
Der SK Sturm Graz hat Oliver Christensen von der ACF Fiorentina verpflichtet. Der 26-jährige Torhüter schließt sich dem österreichischen Vizemeister leihweise bis zu… [+1460 chars]",,de,'Winter'
https://www.urlaubspiraten.de/pauschalreisen/pullman-khao-lak-resort,https://www.urlaubspiraten.de/pauschalreisen/pullman-khao-lak-resort,0,www.urlaubspiraten.de,Luxusurlaub in Khao Lak,"Ahoi Piraten, der erfüllt vielleicht noch nicht ganz die Erwartungen, die wir an ihn hatten (️☂️).. dafür könnt ihr den Winter aber umso sonniger gestalten! ☀️Aktuell gibt es vergleichsweise günstige Flüge nach Thailand mit Etihad, sodass ihr euch einen 2-w…",https://image.urlaubspiraten.de/720/image/upload/v1754123910/Impressions%20and%20Other%20Assets/Bildschirmfoto_2025-08-02_um_10.37.17_bltujm.png,2025-08-02T11:16:00Z,,"Ahoi Piraten, der erfüllt vielleicht noch nicht ganz die Erwartungen, die wir an ihn hatten ().. dafür könnt ihr den Winter aber umso sonniger gestalten! 
Aktuell gibt es vergleichsweise günstige Fl… [+654 chars]",,de,'Winter'
https://www.zeit.de/news/2025-08/02/traktor-ueberschlaegt-sich-zwei-kinder-schwer-verletzt,https://www.zeit.de/news/2025-08/02/traktor-ueberschlaegt-sich-zwei-kinder-schwer-verletzt,0,www.zeit.de,Rettungshubschrauber nötig: Traktor überschlägt sich - Zwei Kinder schwer verletzt,Hier finden Sie Informationen zu dem Thema „Rettungshubschrauber nötig“. Lesen Sie jetzt „Traktor überschlägt sich - Zwei Kinder schwer verletzt“.,https://img.zeit.de/news/2025-08/02/traktor-ueberschlaegt-sich-zwei-kinder-schwer-verletzt-image-group/wide__1300x731,2025-08-02T13:00:02Z,,"Beim Überschlag eines Traktors in Baden-Württemberg im Kreis Heidenheim sind zwei Kinder schwer verletzt worden. Einer der beiden vierjährigen Jungen wurde aus dem Traktor geschleudert, wie die Poliz… [+856 chars]",,de,'Kinder'
https://www.faz.net/aktuell/gesellschaft/ungluecke/gerstetten-traktor-ueberschlaegt-sich-zwei-kinder-schwer-verletzt-110619756.html,https://www.faz.net/aktuell/gesellschaft/ungluecke/gerstetten-traktor-ueberschlaegt-sich-zwei-kinder-schwer-verletzt-110619756.html,0,www.faz.net,Baden-Württemberg: Traktor überschlägt sich – zwei Kinder schwer verletzt,"Ein Traktorfahrer will in einen landwirtschaftlichen Weg einbiegen, als ein Auto das Fahrzeug von hinten rammt. Der Traktor überschlägt sich, zwei vier Jahre alte Kinder sowie die beiden Fahrer werden schwer verletzt.",https://media0.faz.net/ppmedia/aktuell/gesellschaft/4030643128/1.10619758/facebook_teaser/ein-traktor-sowie-das-am.jpg,2025-08-02T13:59:01Z,,"Beim Überschlag eines Traktors im Kreis Heidenheim sind zwei Kinder schwer verletzt worden. Einer der beiden vierjährigen Jungen wurde aus dem Traktor geschleudert, wie die Polizei mitteilte. Ein Ret… [+872 chars]",,de,'Kinder'
https://www.n-tv.de/sport/fussball/Blut-und-Gehirnerschuetterung-Wirbel-um-Schalke-Held-Katic-article25941737.html,https://www.n-tv.de/sport/fussball/Blut-und-Gehirnerschuetterung-Wirbel-um-Schalke-Held-Katic-article25941737.html,0,www.n-tv.de,Schiedsrichter verpennen Warnung: Blut und Gehirnerschütterung: Wirbel um Schalke-Held Katic,"Nikola Katic erlebt ein turbulentes und folgenreiches Pflichtspieldebüt für Schalke. Der Abwehrspieler wird nach einem Kopf-Zusammenprall lange behandelt, darf dann aber weiterspielen, obwohl die Ärzte warnen. Anschließend passiert Katic ein Blackout.",https://www.n-tv.de/img/incoming/crop25941744/3251325848-cImg_16_9-w1200/539373395.jpg,2025-08-02T15:01:48Z,,"Nikola Katic erlebt ein turbulentes und folgenreiches Pflichtspieldebüt für Schalke. Der Abwehrspieler wird nach einem Kopf-Zusammenprall lange behandelt, darf dann aber weiterspielen, obwohl die Ärz… [+2650 chars]",,de,'Blackout'
https://www.diepresse.com/19961726/spielt-trump-mit-der-nuklearen-angst,https://www.diepresse.com/19961726/spielt-trump-mit-der-nuklearen-angst,0,www.diepresse.com,Spielt Trump mit der nuklearen Angst? [premium],"Der US-Präsident irritiert mit der Verlegung atomarer U-Boote. Der Befehl zeigt, dass es mit dem Tauwetter zwischen den USA und Russland endgültig vorbei ist, auch wenn deshalb wohl nicht gleich ein nuklearer Winter droht.",https://img.diepresse.com/public/incoming/6fv9i9-TOPSHOT-BRITAIN-SCOTLAND-US-EU-TRUMP/alternates/DPR_SOCIAL_MEINUNG/TOPSHOT-BRITAIN-SCOTLAND-US-EU-TRUMP,2025-08-02T15:23:33Z,,"Der US-Präsident irritiert mit der Verlegung atomarer U-Boote. Der Befehl zeigt, dass es mit dem Tauwetter zwischen den USA und Russland endgültig vorbei ist, auch wenn deshalb wohl nicht gleich ein … [+876 chars]",,de,'Winter'
https://t3n.de/news/expertenkommission-soll-mindestalter-fuer-social-media-pruefen-1700484/,https://t3n.de/news/expertenkommission-soll-mindestalter-fuer-social-media-pruefen-1700484/,0,t3n.de,Expertenkommission soll Mindestalter für Social Media prüfen,"Immer mehr Politiker:innen betonen, dass Kinder und Jugendliche besser vor den negativen Auswirkungen sozialer Netzwerke geschützt werden müssen. Kommt bald ein Verbot wie in Australien? Eine Altersbeschränkung für Social-Media-Plattformen wird auch in Deutsc…",https://t3n.de/news/wp-content/uploads/2022/02/Kind-Bett-Smartphone.jpg,2025-08-02T17:55:26Z,,"Eine Altersbeschränkung für Social-Media-Plattformen wird auch in Deutschland immer wahrscheinlicher. Wie der Tagesspiegel berichtet, hat sich jetzt auch Bundesdigitalminister Karsten Wildberger von … [+4460 chars]",,de,'Kinder'
https://taz.de/Ertrinken-in-Uganda/!6101622/,https://taz.de/Ertrinken-in-Uganda/!6101622/,0,taz.de,Ertrinken in Uganda: Wenn Kinder im Abwasserkanal sterben,"In Uganda sterben täglich neun Menschen im Wasser. Doch anstatt sich um die Infrastruktur zu kümmern, verordnet die Regierung der Bevölkerung Schwimmkurse.",https://taz.de/picture/7847760/1200/38950812-1.jpeg,2025-08-02T18:12:00Z,,"In Uganda sterben täglich neun Menschen im Wasser. Doch anstatt sich um die Infrastruktur zu kümmern, verordnet die Regierung der Bevölkerung Schwimmkurse. mehr...",,de,'Kinder'
https://www.bild.de/news/ausland/familien-verkauften-sie-paedophilen-bande-missbraucht-kinder-in-bunker-688494f450947b73a5069e10,https://www.bild.de/news/ausland/familien-verkauften-sie-paedophilen-bande-missbraucht-kinder-in-bunker-688494f450947b73a5069e10,0,www.bild.de,Familien verkauften Kinder - Pädophilen-Bande missbraucht Kinder in Bunker,Ein monströser Missbrauchsfall erschüttert die Vereinigten Staaten. Kinder sollen dabei von ihren eigenen Familien verkauft worden sein.,"https://images.bild.de/688494f450947b73a5069e10/74e9fb360faa174423e3cb9fad75d8b2,e63ff2e6?w=1280",2025-08-02T18:41:54Z,http://archive.md/20250802184950/https://www.bild.de/news/ausland/familien-verkauften-sie-paedophilen-bande-missbraucht-kinder-in-bunker-688494f450947b73a5069e10,"Ein monströser Missbrauchsfall erschüttert die USA: Pädophile vergingen sich in einem Bunker jahrelang an mindestens 10 Kindern. 
Lesen Sie mit BILDplus alle Hintergründe zum Fall und wie die Ermitt… [+44 chars]",,de,'Kinder'
https://orf.at/stories/3401505/,https://orf.at/stories/3401505/,0,orf.at,Vater von aus Dschungel geretteten Kindern verurteilt,,https://orf.at/mojo/1_4_1/storyserver//news/common/images/og-fallback-news.png,2025-08-02T19:36:09Z,https://web.archive.org/web/20250803004759/https://orf.at/stories/3401505/,Rund zwei Jahre nach der spektakulären Rettung von vier Geschwistern aus dem kolumbianischen Regenwald ist der Vater der beiden jüngeren Kinder wegen sexuellen Missbrauchs zu 32 Jahren Haft verurteil… [+836 chars],,de,'Kinder'
https://www.nzz.ch/wirtschaft/handy-gesperrt-kind-online-warum-digitale-elternkontrollen-so-oft-versagen-ld.1894701,https://www.nzz.ch/wirtschaft/handy-gesperrt-kind-online-warum-digitale-elternkontrollen-so-oft-versagen-ld.1894701,0,www.nzz.ch,"Handy gesperrt, Kind online: Warum digitale Elternkontrollen so oft versagen",Im Kinderzimmer tobt der Kampf ums Handy. Parental-Control-Apps versprechen Schutz vor der digitalen Masslosigkeit. Doch im Alltag lassen sich die Smartphone-Bremsen leicht aushebeln.,"https://img.nzz.ch/2025/07/23/c266c9da-b0d3-4045-b84f-aa0ba77e0894.jpeg?width=1200&height=674&fit=bounds&quality=75&auto=webp&crop=4500,2531,x0,y234&wmark=nzz",2025-08-02T19:45:00Z,https://web.archive.org/web/20250802212633/https://www.nzz.ch/wirtschaft/handy-gesperrt-kind-online-warum-digitale-elternkontrollen-so-oft-versagen-ld.1894701,"Die Ruhe ist normalerweise ein Warnzeichen. Kein Protest. Kein Fragen nach Bildschirmzeit. Man schaut ins Wohnzimmer. Hat das Kind, als man hereinkam, eine schnelle Bewegung gemacht, um das Handy zu … [+8959 chars]",,de,'Kinder'
https://www.stern.de/politik/deutschland/krieg--auch-duesseldorf-will-kinder-aus-gaza-und-israel-aufnehmen-35944692.html,https://www.stern.de/politik/deutschland/krieg--auch-duesseldorf-will-kinder-aus-gaza-und-israel-aufnehmen-35944692.html,0,www.stern.de,Krieg: Auch Düsseldorf will Kinder aus Gaza und Israel aufnehmen,"Düsseldorf - Nach Hannover will auch Düsseldorf Kinder aus dem Gazastreifen und Israel aufnehmen, die besonders schutzbedürftig oder traumatisiert sind.",https://image.stern.de/35944694/t/wA/v1/w1440/r1.7778/-/02--qsrytcertfv6axs2048jpeg---4e482e7814f21658.jpg,2025-08-02T21:06:05Z,https://web.archive.org/web/20250804030944/https://www.stern.de/politik/deutschland/krieg--auch-duesseldorf-will-kinder-aus-gaza-und-israel-aufnehmen-35944692.html,"Kopiere den aktuellen Link
Zur Merkliste hinzufügen
Hannover machte den Anfang und will ganz konkret Hilfe leisten. Nun will eine weitere Stadt mitziehen.
Nach Hannover will auch Düsseldorf Kinder… [+1289 chars]",,de,'Kinder'
https://www.zeit.de/news/2025-08/02/auch-duesseldorf-will-kinder-aus-gaza-und-israel-aufnehmen,https://www.zeit.de/news/2025-08/02/auch-duesseldorf-will-kinder-aus-gaza-und-israel-aufnehmen,0,www.zeit.de,Krieg: Auch Düsseldorf will Kinder aus Gaza und Israel aufnehmen,Hier finden Sie Informationen zu dem Thema „Krieg“. Lesen Sie jetzt „Auch Düsseldorf will Kinder aus Gaza und Israel aufnehmen“.,https://img.zeit.de/news/2025-08/02/auch-duesseldorf-will-kinder-aus-gaza-und-israel-aufnehmen-image-group/wide__1300x731,2025-08-02T21:06:05Z,,"Nach Hannover will auch Düsseldorf Kinder aus dem Gazastreifen und Israel aufnehmen, die besonders schutzbedürftig oder traumatisiert sind. Mit Blick auf die Ankündigung der niedersächsischen Landesh… [+1171 chars]",,de,'Kinder'
https://www.tagesspiegel.de/politik/krieg-auch-dusseldorf-will-kinder-aus-gaza-und-israel-aufnehmen-14125403.html,https://www.tagesspiegel.de/politik/krieg-auch-dusseldorf-will-kinder-aus-gaza-und-israel-aufnehmen-14125403.html,0,www.tagesspiegel.de,Krieg: Auch Düsseldorf will Kinder aus Gaza und Israel aufnehmen,Hannover machte den Anfang und will ganz konkret Hilfe leisten. Nun will eine weitere Stadt mitziehen.,https://www.tagesspiegel.de/images/14125400/alternates/BASE_16_9_W1400/1754168832000/stephan-keller.jpeg,2025-08-02T21:07:12Z,https://web.archive.org/web/20250804030615/https://www.tagesspiegel.de/politik/krieg-auch-dusseldorf-will-kinder-aus-gaza-und-israel-aufnehmen-14125403.html,"Nach Hannover will auch Düsseldorf Kinder aus dem Gazastreifen und Israel aufnehmen, die besonders schutzbedürftig oder traumatisiert sind. Mit Blick auf die Ankündigung der niedersächsischen Landesh… [+1223 chars]",,de,'Kinder'
https://www.stern.de/gesellschaft/regional/hessen/betriebe-mit-umsatzeinbussen--dehoga--wetterextreme-belasten-gastgewerbe-35944752.html,https://www.stern.de/gesellschaft/regional/hessen/betriebe-mit-umsatzeinbussen--dehoga--wetterextreme-belasten-gastgewerbe-35944752.html,0,www.stern.de,Betriebe mit Umsatzeinbußen: Dehoga: Wetterextreme belasten Gastgewerbe,"Mal Hitze und Gewitter, mal Kälte und Regen - der wechselhafte Sommer vermiest der hessischen Gastronomie das wichtigste Geschäft des Jahres. Der Verband sieht die Branche in der Krise.",https://image.stern.de/35944754/t/4-/v1/w1440/r1.7778/-/03--qg6jrnpr2zv5axs2048jpeg---1a2026f1654a1d66.jpg,2025-08-03T01:35:38Z,,"Kopiere den aktuellen Link
Zur Merkliste hinzufügen
Mal Hitze und Gewitter, mal Kälte und Regen - der wechselhafte Sommer vermiest der hessischen Gastronomie das wichtigste Geschäft des Jahres. Der… [+3431 chars]",,de,'Kälte'
https://www.stern.de/gesellschaft/regional/rheinland-pfalz-saarland/namensrecht-reloaded--reform-ohne-run----wunsch-nach-doppelnamen-ueberschaubar--35944840.html,https://www.stern.de/gesellschaft/regional/rheinland-pfalz-saarland/namensrecht-reloaded--reform-ohne-run----wunsch-nach-doppelnamen-ueberschaubar--35944840.html,0,www.stern.de,"Namensrecht reloaded: Reform ohne Run - ""Wunsch nach Doppelnamen überschaubar""",Mainz/Ludwigshafen/Koblenz/Trier (lrs) - Seit rund drei Monaten gilt in Deutschland ein neues Namensrecht. Echte Doppelnamen für Eheleute und Kinder sind,https://image.stern.de/35944842/t/h3/v1/w1440/r1.7778/-/03--rf5iwybivcv12axs2048jpeg---41ad316cac2c7421.jpg,2025-08-03T03:00:42Z,https://web.archive.org/web/20250804030424/https://www.stern.de/gesellschaft/regional/rheinland-pfalz-saarland/namensrecht-reloaded--reform-ohne-run----wunsch-nach-doppelnamen-ueberschaubar--35944840.html,"Kopiere den aktuellen Link
Zur Merkliste hinzufügen
Stiefkinder, Geschiedene, Ehepaare das neue Namensrecht verspricht mehr Flexibilität. Nicht immer hält es, was Bürgerinnen und Bürger sich erhoff… [+5373 chars]",,de,'Kinder'
