index,url,valid,domain,title,description,image,published,archive,content,quote,language,keyword
https://www.focus.de/regional/wetter/alarmstufe-rot-glatteis-unfall-in-baden-wuerttemberg-polizeiauto-ueberschlaegt-sich-fuenf-verletzte_id_260609286.html,https://www.focus.de/regional/wetter/alarmstufe-rot-glatteis-unfall-in-baden-wuerttemberg-polizeiauto-ueberschlaegt-sich-fuenf-verletzte_id_260609286.html,0,www.focus.de,"Alarmstufe Rot - Glatteis-Unfall in Baden-Württemberg – Polizeiauto überschlägt sich, fünf Verletzte","Der Winter ist da. Der Deutsche Wetterdienst warnt in ganz Deutschland vor Glätte, in vielen Landkreisen gilt sogar die Warnstufe Rot.",https://p6.focus.de/img/fotos/id_260609014/5fb44800d1b0dc4c.jpg?im=Crop%3D%280%2C578%2C3462%2C1733%29%3BResize%3D%281200%2C627%29&impolicy=perceptual&quality=mediumHigh&hash=e012da17cbd737336c61452a47aac85beebfcb99d854b1cccf02cb33cc51f127,2025-01-05T11:11:28Z,,"Der Winter ist da. Der Deutsche Wetterdienst warnt in ganz Deutschland vor Glätte, in vielen Landkreisen gilt sogar die Warnstufe Rot. <ul><li>Oben im Video: Gefrierender Regen, Eispanzer drohen! Mas… [+1994 chars]",,de,'Winter'
https://steiermark.orf.at/stories/3287820/,https://steiermark.orf.at/stories/3287820/,0,steiermark.orf.at,Flug München-Graz musste gestrichen werden,Schnee und Glatteis haben am Wochenende in Deutschland und Österreich für Probleme gesorgt – auch im Flugverkehr. So musste der Morgenflug von München nach Graz annulliert werden.,https://ibs.orf.at/stm?image=https%3A%2F%2Foekastatic.orf.at%2Fmims%2F2024%2F44%2F70%2Fcrops%2Fw%3D1200%2Ch%3D627%2Cq%3D75%2F2405153_master_919270_08c7795d-7691-46ef-b10f-005761781507.jpg%3Fs%3Dabe0128da4565292682a9680fc7659cac60abd0c,2025-01-05T11:29:00Z,,"Wegen Schnee und Glätte gibt es an deutschen Airports Einschränkungen im Flugverkehr. Laut Website des Münchner Flughafens wurden einige Flüge annulliert, die Sonntag früh hätten starten sollen. Daru… [+975 chars]",,de,'Glatteis'
https://www.zeit.de/news/2025-01/05/winter-zieht-nach-norden,https://www.zeit.de/news/2025-01/05/winter-zieht-nach-norden,0,www.zeit.de,Wettervorhersage: Winter zieht nach Norden,Hier finden Sie Informationen zu dem Thema „Wettervorhersage“. Lesen Sie jetzt „Winter zieht nach Norden“.,https://img.zeit.de/news/2025-01/05/winter-zieht-nach-norden-image-group/wide__1300x731,2025-01-05T11:34:16Z,https://web.archive.org/web/20250105171733/https://www.zeit.de/news/2025-01/05/winter-zieht-nach-norden,"Das Winterwetter verschiebt sich Richtung Norden. Am Sonntagnachmittag erreichen die Niederschläge auch die Gebiete nordöstlich der Elbe, wie der Deutsche Wetterdienst (DWD) in Offenbach vorhersagt. … [+1261 chars]",,de,'Winter'
https://www.tagesspiegel.de/gesellschaft/panorama/wintereinbruch-glatteis-und-schnee-bringen-verkehr-durcheinander-12962728.html,https://www.tagesspiegel.de/gesellschaft/panorama/wintereinbruch-glatteis-und-schnee-bringen-verkehr-durcheinander-12962728.html,0,www.tagesspiegel.de,Wintereinbruch: Glatteis und Schnee bringen Verkehr durcheinander,"Erst schneit es in Deutschland, dann folgt eine Warmfront, die bundesweit für Glatteisgefahr sorgt. Die Folge: ausgefallene Flüge, Beeinträchtigungen im Bahnverkehr und zahlreiche Verkehrsunfälle.",https://www.tagesspiegel.de/images/12963328/alternates/BASE_16_9_W1400/1736085378000/winterwetter-in-nordrhein-westfalen.jpeg,2025-01-05T11:35:24Z,,"Der Winter ist zurück in Deutschland und mit ihm Schnee und Glätte. Abgesagte Flüge, ausgefallen Züge und zahlreiche Verkehrsunfälle waren die Folge. Der Deutsche Wetterdienst (DWD) warnte vor Glatte… [+4319 chars]",,de,'Winter'
https://www.stern.de/gesellschaft/regional/niedersachsen-bremen/wintereinbruch--schnee-in-niedersachsen-und-bremen-35355766.html,https://www.stern.de/gesellschaft/regional/niedersachsen-bremen/wintereinbruch--schnee-in-niedersachsen-und-bremen-35355766.html,0,www.stern.de,Wintereinbruch: Schnee in Niedersachsen und Bremen,"Hannover/Bremen/Braunlage (lni) - Der Sonntag ist verschneit in Niedersachsen und Bremen, im Harz reicht es sogar schon zum Schlittenfahren. Im Laufe des",https://image.stern.de/35355768/t/DS/v1/w1440/r1.7778/-/05--j4cblttbciv9axs2048jpeg---8f13f9e413dde91c.jpg,2025-01-05T11:58:54Z,,"Kopiere den aktuellen Link
Es schneit im Norden. Hält sich das Winterwetter oder ist es nur eine schöne Wochenenderscheinung?
Der Sonntag ist verschneit in Niedersachsen und Bremen, im Harz reicht … [+1799 chars]",,de,'Schnee'
https://www.zeit.de/news/2025-01/05/schnee-in-niedersachsen-und-bremen,https://www.zeit.de/news/2025-01/05/schnee-in-niedersachsen-und-bremen,0,www.zeit.de,Wintereinbruch: Schnee in Niedersachsen und Bremen,Hier finden Sie Informationen zu dem Thema „Wintereinbruch“. Lesen Sie jetzt „Schnee in Niedersachsen und Bremen“.,https://img.zeit.de/news/2025-01/05/schnee-in-niedersachsen-und-bremen-image-group/wide__1300x731,2025-01-05T11:58:54Z,,"Der Sonntag ist verschneit in Niedersachsen und Bremen, im Harz reicht es sogar schon zum Schlittenfahren. Im Laufe des Tages soll sich der Schnee jedoch in Regen verwandeln, warnt der Deutsche Wette… [+1711 chars]",,de,'Schnee'
https://www.n-tv.de/panorama/Nach-kurzem-Tauwetter-kommt-der-Winter-zurueck-article25467907.html,https://www.n-tv.de/panorama/Nach-kurzem-Tauwetter-kommt-der-Winter-zurueck-article25467907.html,0,www.n-tv.de,Die Wetterwoche im Schnellcheck: Nach kurzem Tauwetter kommt der Winter zurück,"Zum Wochenstart taut Deutschland auf, es wird bis zu 14 Grad warm. Doch dann bringt ein neues Tief wieder Kälte und Glätte. Dabei kann es wieder bis in die tieferen Lagen Schnee geben.",https://bilder2.n-tv.de/img/incoming/crop25467909/3931325906-cImg_16_9-w1200/0179e26fdc06ab139a65a2cc4b81a88f.jpg,2025-01-05T12:03:36Z,,"Zum Wochenstart taut Deutschland auf, es wird bis zu 14 Grad warm. Doch dann bringt ein neues Tief wieder Kälte und Glätte. Dabei kann es wieder bis in die tieferen Lagen Schnee geben.
Die nächste W… [+3402 chars]",,de,'Winter'
https://www.n-tv.de/panorama/Polizeiauto-ueberschlaegt-sich-auf-der-A81-article25467862.html,https://www.n-tv.de/panorama/Polizeiauto-ueberschlaegt-sich-auf-der-A81-article25467862.html,0,www.n-tv.de,Spiegelglatte Straßen: Polizeiauto überschlägt sich auf der A81,"Die Warnungen der Meteorologen waren berechtigt. Schnee, Eisregen sowie spiegelglatte Straßen stören Bahn, Flug- und auch den Straßenverkehr. Doch einige Autofahrer scheinen nicht zugehört zu haben. Die Freiburger Polizei stellt bei vielen Unfallfahrern Somme…",https://bilder3.n-tv.de/img/incoming/crop25467918/2851324751-cImg_16_9-w1200/500425157.jpg,2025-01-05T12:05:13Z,,"Die Warnungen der Meteorologen waren berechtigt. Schnee, Eisregen sowie spiegelglatte Straßen stören Bahn, Flug- und auch den Straßenverkehr. Doch einige Autofahrer scheinen nicht zugehört zu haben. … [+3214 chars]",,de,'Schnee'
https://www.dw.com/de/der-winter-ist-da-das-chaos-auch/a-71220565,https://www.dw.com/de/der-winter-ist-da-das-chaos-auch/a-71220565,0,www.dw.com,"Der Winter ist da, das Chaos auch","Ein mit wolkenbeladenes Atlantik-Tief stößt in Mitteleuropa auf Kaltluft. Die Folge: ein plötzlicher Wintereinbruch, der in Deutschland und Großbritannien Unfälle, Flugausfälle, Bahnverspätungen beschert.",https://static.dw.com/image/71220329_6.jpg,2025-01-05T12:19:00Z,,"Der Winter ist da - vielleicht etwas zu plötzlich. Schneefall und einsetzender Eisregen haben in Deutschland zu Flugausfällen, Störungen im Bahnverkehr und zahlreichen Unfällen auf Straßen geführt. M… [+3060 chars]",,de,'Winter'
https://www.stern.de/gesellschaft/regional/hamburg-schleswig-holstein/wetter--milder-wochenstart---vorher-nochmals-glatteisgefahr-35355826.html,https://www.stern.de/gesellschaft/regional/hamburg-schleswig-holstein/wetter--milder-wochenstart---vorher-nochmals-glatteisgefahr-35355826.html,0,www.stern.de,Wetter: Milder Wochenstart - vorher nochmals Glatteisgefahr,Nach einem frostigen Wochenende soll es wieder wärmer werden im Norden. Vorher könnte es aber stellenweise nochmals glatt werden. Autofahrer sollen dementsprechend fahren.,https://image.stern.de/35355828/t/r4/v1/w1440/r1.7778/-/05--2jui3ll2uxv6axs2048jpeg---e5c551cbe3da06de.jpg,2025-01-05T12:19:39Z,,"Kopiere den aktuellen Link
Nach einem frostigen Wochenende soll es wieder wärmer werden im Norden. Vorher könnte es aber stellenweise nochmals glatt werden. Autofahrer sollen dementsprechend fahren.… [+1795 chars]",,de,'Glatteis'
https://www.zeit.de/news/2025-01/05/milder-wochenstart-vorher-nochmals-glatteisgefahr,https://www.zeit.de/news/2025-01/05/milder-wochenstart-vorher-nochmals-glatteisgefahr,0,www.zeit.de,Wetter: Milder Wochenstart - vorher nochmals Glatteisgefahr,Hier finden Sie Informationen zu dem Thema „Wetter“. Lesen Sie jetzt „Milder Wochenstart - vorher nochmals Glatteisgefahr“.,https://img.zeit.de/news/2025-01/05/milder-wochenstart-vorher-nochmals-glatteisgefahr-image-group/wide__1300x731,2025-01-05T12:19:39Z,,Zum Wochenstart sagen Experten für Norddeutschland wieder deutlich mildere Temperaturen voraus. Bei bedecktem Himmel und teils Regen rechnet der Deutsche Wetterdienst (DWD) für Montag in Schleswig-Ho… [+1634 chars],,de,'Glatteis'
https://www.stern.de/gesellschaft/regional/bayern/verkehr--glaette-sorgt-fuer-unfaelle-und-gestrichene-fluege-in-bayern-35355632.html,https://www.stern.de/gesellschaft/regional/bayern/verkehr--glaette-sorgt-fuer-unfaelle-und-gestrichene-fluege-in-bayern-35355632.html,0,www.stern.de,Verkehr: Glätte sorgt für Unfälle und gestrichene Flüge in Bayern,Nach dem Schnee kommt Regen: Die Glätte macht sich auf den Straßen und im Flugverkehr bemerkbar. Das große Chaos bleibt aber aus. Was bringt der Feiertag?,https://image.stern.de/35355856/t/lq/v1/w1440/r1.7778/-/05--e576aluhxxv5axs2048jpeg---d99cfda597735af8.jpg,2025-01-05T12:37:45Z,,"Kopiere den aktuellen Link
Nach dem Schnee kommt Regen: Die Glätte macht sich auf den Straßen und im Flugverkehr bemerkbar. Das große Chaos bleibt aber aus. Was bringt der Feiertag?
Gestrichene Flü… [+3379 chars]",,de,'Schnee'
https://www.zeit.de/news/2025-01/05/winterwetter-fuehrt-zu-autounfaellen,https://www.zeit.de/news/2025-01/05/winterwetter-fuehrt-zu-autounfaellen,0,www.zeit.de,"Schnee, Glätte und Matsch: Winterwetter führt zu Autounfällen","Hier finden Sie Informationen zu dem Thema „Schnee, Glätte und Matsch“. Lesen Sie jetzt „Winterwetter führt zu Autounfällen“.",https://img.zeit.de/news/2025-01/05/winterwetter-fuehrt-zu-autounfaellen-image-group/wide__1300x731,2025-01-05T13:00:14Z,,"Bei Schnee und Glätte ist es in Nordrhein-Westfalen zu einigen Autounfällen gekommen. Wie die Polizei am Sonntag mitteilte, kam eine 20 Jahre alte Fahrerin am frühen Samstagmorgen in Wiehl im Oberber… [+625 chars]",,de,'Schnee'
https://www.zeit.de/news/2025-01/05/winterwetter-fuehrt-zu-unfaellen-und-verspaetungen-im-suedwesten,https://www.zeit.de/news/2025-01/05/winterwetter-fuehrt-zu-unfaellen-und-verspaetungen-im-suedwesten,0,www.zeit.de,Schnee und Glatteis: Winterwetter führt zu Unfällen und Verspätungen im Südwesten,Hier finden Sie Informationen zu dem Thema „Schnee und Glatteis“. Lesen Sie jetzt „Winterwetter führt zu Unfällen und Verspätungen im Südwesten“.,https://img.zeit.de/news/2025-01/05/winterwetter-fuehrt-zu-unfaellen-und-verspaetungen-im-suedwesten-image-group/wide__1300x731,2025-01-05T13:34:42Z,,"Das winterliche Wetter hat auf den Straßen von Baden-Württemberg zu mehreren Unfällen geführt. Es seien vor allem Blechschäden entstanden, teilten die Polizeipräsidien mit. Vereinzelt wurden Menschen… [+2451 chars]",,de,'Glatteis'
https://www.stern.de/gesellschaft/regional/baden-wuerttemberg/schnee-und-glatteis--winterwetter-fuehrt-zu-unfaellen-und-verspaetungen-im-suedwesten-35355926.html,https://www.stern.de/gesellschaft/regional/baden-wuerttemberg/schnee-und-glatteis--winterwetter-fuehrt-zu-unfaellen-und-verspaetungen-im-suedwesten-35355926.html,0,www.stern.de,Schnee und Glatteis: Winterwetter führt zu Unfällen und Verspätungen im Südwesten,In der Nacht bildete sich an vielen Orten in Baden-Württemberg Glatteis. Bei den winterlichen Bedingungen kam es nicht nur zu Unfällen auf den Straßen.,https://image.stern.de/35355928/t/aS/v1/w1440/r1.7778/-/05--v4hpskb6f3v9axs2048jpeg---4170dcb5a709311d.jpg,2025-01-05T13:34:42Z,,"Kopiere den aktuellen Link
In der Nacht bildete sich an vielen Orten in Baden-Württemberg Glatteis. Bei den winterlichen Bedingungen kam es nicht nur zu Unfällen auf den Straßen.
Das winterliche We… [+2592 chars]",,de,'Winter'
https://www.zeit.de/gesellschaft/2025-01/wetter-winter-glatteis-unfaelle-flugverkehr,https://www.zeit.de/gesellschaft/2025-01/wetter-winter-glatteis-unfaelle-flugverkehr,0,www.zeit.de,Glatteisgefahr: Winterwetter verschiebt sich nach Norden,Im Süden Deutschlands hat das Winterwetter zu gefährlichem Glatteis und Einschränkungen im Verkehr geführt. Nun zieht es weiter Richtung Norden.,https://img.zeit.de/gesellschaft/zeitgeschehen/2025-01/winterwetter-schnee-glaette-norden-deutschland-bild/wide__1300x731,2025-01-05T13:51:57Z,,"Das Winterwetter, das im Süden Deutschlands zu Glatteis und Einschränkungen im Flug- und Bahnverkehr geführt hat, zieht gen Norden. Am Sonntagnachmittag 
erreichen die Niederschläge auch die Gebiete… [+1707 chars]",,de,'Glatteis'
https://www.stern.de/panorama/wintereinbruch--glatteis-und-schnee-bringen-verkehr-durcheinander-35355740.html,https://www.stern.de/panorama/wintereinbruch--glatteis-und-schnee-bringen-verkehr-durcheinander-35355740.html,0,www.stern.de,Wintereinbruch: Glatteis und Schnee bringen Verkehr durcheinander,"Erst schneit es in Deutschland, dann folgt eine Warmfront, die bundesweit für Glatteisgefahr sorgt. Die Folge: ausgefallene Flüge, Beeinträchtigungen im Bahnverkehr und zahlreiche Verkehrsunfälle.",https://image.stern.de/35355950/t/ls/v1/w1440/r1.7778/-/05--2ecj7jpqbtv14axs2048jpeg---dce31385cf0b0313.jpg,2025-01-05T13:54:29Z,,"Kopiere den aktuellen Link
Erst schneit es in Deutschland, dann folgt eine Warmfront, die bundesweit für Glatteisgefahr sorgt. Die Folge: ausgefallene Flüge, Beeinträchtigungen im Bahnverkehr und za… [+3111 chars]",,de,'Schnee'
https://www.bild.de/news/inland/glatteisfront-ueber-deutschland-erste-unfaelle-in-bayern-sachsen-677a81ab0195b908c189aeff,https://www.bild.de/news/inland/glatteisfront-ueber-deutschland-erste-unfaelle-in-bayern-sachsen-677a81ab0195b908c189aeff,0,www.bild.de,Unfälle nicht nur in Deutschland - Glatteis-Crash mit 95 Autos,"Eine massive Glatteisfront sorgt für gefährliche Straßenverhältnisse in Deutschland, mit Unfällen in Bayern und Sachsen sowie Verkehrschaos in Kasachstan.","https://images.bild.de/677a81ab0195b908c189aeff/dcb15cd2418646b81f53a413d7b2ebbd,d8108962?w=1280",2025-01-05T14:04:00Z,,"Mehr zum Video anzeigen 
Eine massive Glatteisfront zieht über Deutschland und sorgt für gefährliche Straßenverhältnisse. In Bayern und Sachsen kommt es zu ersten Unfällen. Aber auch in anderen Länd… [+111 chars]",,de,'Glatteis'
https://www.stern.de/gesellschaft/regional/hessen/wetter--dutzende-glaetteunfaelle---flug--und-zugverkehr-beeintraechtigt-35355590.html,https://www.stern.de/gesellschaft/regional/hessen/wetter--dutzende-glaetteunfaelle---flug--und-zugverkehr-beeintraechtigt-35355590.html,0,www.stern.de,Wetter: Dutzende Glätteunfälle - Flug- und Zugverkehr beeinträchtigt,Das Winterwetter mit Schnee und Eisregen hat in Hessen nicht nur auf vielen Straßen für Probleme gesorgt. Dank steigender Temperaturen dürfte die Rutschgefahr aber zunächst gebannt sein.,https://image.stern.de/35355982/t/Qr/v1/w1440/r1.7778/-/05--px33tzuh75v1axs2048jpeg---df97eebc8d9d625a.jpg,2025-01-05T14:16:07Z,,"Kopiere den aktuellen Link
Das Winterwetter mit Schnee und Eisregen hat in Hessen nicht nur auf vielen Straßen für Probleme gesorgt. Dank steigender Temperaturen dürfte die Rutschgefahr aber zunächs… [+2871 chars]",,de,'Schnee'
https://www.stern.de/panorama/wetter/warnung-vor-glatteis--karten-zeigen-die-wetterlage-35355434.html,https://www.stern.de/panorama/wetter/warnung-vor-glatteis--karten-zeigen-die-wetterlage-35355434.html,0,www.stern.de,Wetter in Deutschland: Glatteis: Vorsicht auf den Straßen – auch Flughäfen und Bahn betroffen,Am Sonntag wird es in Deutschland glatt: Von Südwesten nach Nordosten fällt verbreitet zeitweise gefrierender Regen. Das Wetter sorgt auch für Schwierigkeiten im Verkehr.,https://image.stern.de/35355436/t/T3/v1/w1440/r1.7778/-/glaette-wetter-deutschland.jpg,2025-01-05T15:18:00Z,,"Kopiere den aktuellen Link
Am Sonntag wird es in Deutschland glatt: Von Südwesten nach Nordosten fällt verbreitet zeitweise gefrierender Regen. Das Wetter sorgt auch für Schwierigkeiten im Verkehr.… [+5060 chars]",,de,'Glatteis'
https://www.bild.de/regional/baden-wuerttemberg/schnee-und-glatteis-winterwetter-fuehrt-zu-verkehrs-chaos-im-laendle-677a97563a06652744b2204b,https://www.bild.de/regional/baden-wuerttemberg/schnee-und-glatteis-winterwetter-fuehrt-zu-verkehrs-chaos-im-laendle-677a97563a06652744b2204b,0,www.bild.de,Unfälle +++ Verspätungen am Airport - Winterwetter führt zu Verkehrs-Chaos im Ländle,Stuttgart – Das Winterwetter hat das Ländle in einen weißen Traum verwandelt. Doch im Verkehr führten Schnee und Glatteis zum chaotischen Zuständen.,"https://images.bild.de/677a97563a06652744b2204b/031755c80bd00cfadc0d70da0a77a91f,3782a0fd?w=1280",2025-01-05T15:24:32Z,,"Stuttgart Das Winterwetter hat das Ländle über Nacht in einen weißen Traum verwandelt. Doch im Verkehr führten Schnee und Glatteis zum chaotischen Zuständen. 
Es kam zu etlichen Unfällen, vor allem … [+2350 chars]",,de,'Glatteis'
https://www.morgenpost.de/bezirke/spandau/article408007820/mieterberatung-legt-jahresbilanz-vor-ein-problem-dominiert.html,https://www.morgenpost.de/bezirke/spandau/article408007820/mieterberatung-legt-jahresbilanz-vor-ein-problem-dominiert.html,0,www.morgenpost.de,Mieterberatung legt Jahresbilanz vor: Ein Problem dominiert,Der Alternative Mieter- und Verbraucherschutzbund (AMV) meldet für 2024 einen neuen Beratungsrekord: Die Zahl der Hilfesuchenden stieg auf 3.859. Hauptgrund: Heizkosten.,https://img.sparknews.funkemedien.de/408018236/408018236_1736090936_v16_9_1600.jpeg,2025-01-05T15:28:51Z,http://archive.md/20250105211521/http://www.morgenpost.de/bezirke/spandau/article408007820/mieterberatung-legt-jahresbilanz-vor-ein-problem-dominiert.html,Spandau. Der Alternative Mieter- und Verbraucherschutzbund meldet neue Rekordzahlen. Vor allem hohe Heizkosten belasten die Mieter.,,de,'Heizkosten'
https://www.tagesspiegel.de/berlin/drohendes-glatteis-in-berlin-flughafen-ber-halbiert-zahl-der-ankunfte--20-fluge-ausgefallen-12963784.html,https://www.tagesspiegel.de/berlin/drohendes-glatteis-in-berlin-flughafen-ber-halbiert-zahl-der-ankunfte--20-fluge-ausgefallen-12963784.html,0,www.tagesspiegel.de,Drohendes Glatteis in Berlin: Flughafen BER halbiert Zahl der Ankünfte vorsorglich,"Normalerweise landen am Hauptstadtflughafen rund 40 Maschinen pro Stunde. Um trotz drohenden Glatteises eine sichere Abfertigung der Flugzeuge zu gewährleisten, reduziert der BER die Zahl.",https://www.tagesspiegel.de/images/12963781/alternates/BASE_16_9_W1400/1736091324000/wetter-flughafen-berlin.jpeg,2025-01-05T15:35:24Z,,"Wegen des Winterwetters in Europa sind am Hauptstadtflughafen BER im Laufe des Sonntags rund 20 Flüge ausgefallen. Teilweise konnten die Maschinen an anderen europäischen Flughäfen nicht starten, sag… [+765 chars]",,de,'Glatteis'
https://www.n-tv.de/sport/Friedrich-der-Grosse-stuermt-am-Monster-Anstieg-weit-nach-vorne-article25468152.html,https://www.n-tv.de/sport/Friedrich-der-Grosse-stuermt-am-Monster-Anstieg-weit-nach-vorne-article25468152.html,0,www.n-tv.de,"Tour de Ski endet mit Podest: ""Friedrich der Große"" stürmt am Monster-Anstieg weit nach vorne","Friedrich Moch beendet den brutalen Anstieg zur Alpe Cermis auf Rang drei. Es ist der erste Podestplatz des Winters für die deutschen Langläufer. ""Frie"" ist schwer begeistert. Der Bundestrainer auch. Bei den Frauen rettet Victoria Carl ihre Platzierung in den…",https://bilder4.n-tv.de/img/incoming/crop25468147/2371328152-cImg_16_9-w1200/imago1057135109h.jpg,2025-01-05T15:58:53Z,,"Friedrich Moch beendet den brutalen Anstieg zur Alpe Cermis auf Rang drei. Es ist der erste Podestplatz des Winters für die deutschen Langläufer. ""Frie"" ist schwer begeistert. Der Bundestrainer auch.… [+2727 chars]",,de,'Winter'
https://www.stern.de/gesellschaft/regional/niedersachsen-bremen/verschneites-wetter--wintertrubel-im-norden-mit-tierischen-zwischenfaellen-35356180.html,https://www.stern.de/gesellschaft/regional/niedersachsen-bremen/verschneites-wetter--wintertrubel-im-norden-mit-tierischen-zwischenfaellen-35356180.html,0,www.stern.de,Verschneites Wetter: Wintertrubel im Norden mit tierischen Zwischenfällen,"Eine festgefrorene Ente und Fische auf dem Trockenen - das winterliche Wetter hat im Norden nicht nur Glatteis, sondern auch kuriose Nachrichten verursacht.",https://image.stern.de/35356182/t/Ze/v1/w1440/r1.7778/-/05--q4kczx6xmhv6axs2048jpeg---4647c5b6cbce5e43.jpg,2025-01-05T16:23:12Z,,"Kopiere den aktuellen Link
Eine festgefrorene Ente und Fische auf dem Trockenen - das winterliche Wetter hat im Norden nicht nur Glatteis, sondern auch kuriose Nachrichten verursacht.
Schnee hat ma… [+2388 chars]",,de,'Winter'
https://www.zeit.de/news/2025-01/05/wintertrubel-im-norden-mit-tierischen-zwischenfaellen,https://www.zeit.de/news/2025-01/05/wintertrubel-im-norden-mit-tierischen-zwischenfaellen,0,www.zeit.de,Verschneites Wetter: Wintertrubel im Norden mit tierischen Zwischenfällen,Hier finden Sie Informationen zu dem Thema „Verschneites Wetter“. Lesen Sie jetzt „Wintertrubel im Norden mit tierischen Zwischenfällen“.,https://img.zeit.de/news/2025-01/05/wintertrubel-im-norden-mit-tierischen-zwischenfaellen-image-group/wide__1300x731,2025-01-05T16:23:12Z,,Schnee hat manche Teile Niedersachsens am Wochenende vorübergehend in eine zauberhafte Winterlandschaft verwandelt. Das Wochenende in Niedersachsen und Bremen brachte aber auch eine Vielzahl an Glätt… [+2242 chars],,de,'Winter'
https://www.morgenpost.de/berlin/article408018293/ber-halbiert-starts-und-landungen-vorsorglich.html,https://www.morgenpost.de/berlin/article408018293/ber-halbiert-starts-und-landungen-vorsorglich.html,0,www.morgenpost.de,Blitzeis-Gefahr! BER halbiert Starts und Landungen,Bis zum späten Nachmittag blieb Schneeregen und Blitzeis in Berlin aus. Doch der BER halbiert die Start- und Lande-Kapazitäten vorsorglich.,https://img.sparknews.funkemedien.de/408018917/408018917_1736094086_v16_9_1600.jpeg,2025-01-05T16:31:06Z,,"Berlin. Bis zum späten Nachmittag blieb Schneeregen und Blitzeis in Berlin aus. Doch der BER halbiert die Start- und Lande-Kapazitäten vorsorglich.
Es war ein Warten auf die angesagte Regenfront am … [+1983 chars]",,de,'Schnee'
https://www.stern.de/panorama/wetter/winterwetter-in-deutschland-fuehrt-zu-vielen-unfaellen-und-flugausfaellen-35356226.html,https://www.stern.de/panorama/wetter/winterwetter-in-deutschland-fuehrt-zu-vielen-unfaellen-und-flugausfaellen-35356226.html,0,www.stern.de,Wetter: Flugausfälle und Unfälle: Winter erwischt Deutschland kalt,"Wer an diesem Wochenende in Deutschland unterwegs war, dürfte Probleme bekommen haben. Als sicheres Verkehrsmittel galten dieses Wochenende weder Auto noch Zug oder Flugzeug.",https://image.stern.de/35356238/t/Rb/v1/w1440/r1.7778/-/deutschland-autounfall-winter.jpg,2025-01-05T17:32:00Z,,"Kopiere den aktuellen Link
Wer an diesem Wochenende in Deutschland unterwegs war, dürfte Probleme bekommen haben. Als sicheres Verkehrsmittel galten dieses Wochenende weder Auto noch Zug oder Flugze… [+3020 chars]",,de,'Glatteis'
https://www.n-tv.de/panorama/Winterwetter-sorgt-fuer-ausgefallene-Fluege-verspaetete-Zuege-und-Verkehrsunfaelle-article25468248.html,https://www.n-tv.de/panorama/Winterwetter-sorgt-fuer-ausgefallene-Fluege-verspaetete-Zuege-und-Verkehrsunfaelle-article25468248.html,0,www.n-tv.de,"Glatteis und Schnee: Winterwetter sorgt für ausgefallene Flüge, verspätete Züge und Verkehrsunfälle",Der Winter ist zurück in Deutschland und sorgt für erhebliche Behinderungen. Zahlreiche Unfälle und Ausfälle im Flug- und Bahnverkehr sind die Folgen. Außerdem überschlägt sich ein Polizeiauto und eine Jugendliche bricht in einen zugefrorenen See ein.,https://bilder3.n-tv.de/img/incoming/crop25468246/2121326135-cImg_16_9-w1200/500478629.jpg,2025-01-05T17:46:34Z,,Der Winter ist zurück in Deutschland und sorgt für erhebliche Behinderungen. Zahlreiche Unfälle und Ausfälle im Flug- und Bahnverkehr sind die Folgen. Außerdem überschlägt sich ein Polizeiauto und ei… [+3074 chars],,de,'Glatteis'
https://www.zeit.de/gesellschaft/2025-01/schnee-eisregen-unfaelle-fluege-ausfaelle,https://www.zeit.de/gesellschaft/2025-01/schnee-eisregen-unfaelle-fluege-ausfaelle,0,www.zeit.de,"Winterwetter: Schneefall sorgt für Flugausfälle, Bahnchaos und Verkehrsunfälle","Annullierte Flüge, Zugausfälle und Unfälle auf glatten Straßen: Schnee und Eis haben am Wochenende für Chaos gesorgt. Ab Montag sollen die Temperaturen wieder steigen.",https://img.zeit.de/gesellschaft/2025-01/schnee-eisregen-unfaelle-fluege-ausfaelle-bild/wide__1300x731,2025-01-05T21:51:27Z,,"Schnee und Eisregen haben in mehreren Teilen Deutschlands am Wochenende zu Flugausfällen, Störungen im Bahnverkehr und zahlreichen Unfällen auf Straßen geführt. Allein am Flughafen Frankfurt wurden 1… [+1294 chars]",,de,'Schnee'
