index,url,valid,domain,title,description,image,published,archive,content,quote,language,keyword
https://www.stern.de/wirtschaft/news/energieversorgung--ministerin-reiche-verteidigt-plaene-fuer-neue-gaskraftwerke-35729656.html,https://www.stern.de/wirtschaft/news/energieversorgung--ministerin-reiche-verteidigt-plaene-fuer-neue-gaskraftwerke-35729656.html,0,www.stern.de,Energieversorgung: Ministerin Reiche verteidigt Pläne für neue Gaskraftwerke,Die neue Bundesregierung plant den Bau neuer Gaskraftwerke für mehr Energiesicherheit. Das stößt auf Kritik. Wirtschaftsministerin Reiche weist diese zurück.,https://image.stern.de/35729658/t/to/v1/w1440/r1.7778/-/16--7nse6rwlopv4axs2048jpeg---a869f2f6e19d4dcc.jpg,2025-05-16T09:45:04Z,https://web.archive.org/web/20250516134529/https://www.stern.de/wirtschaft/news/energieversorgung--ministerin-reiche-verteidigt-plaene-fuer-neue-gaskraftwerke-35729656.html,"Kopiere den aktuellen Link
Zur Merkliste hinzufügen
Die neue Bundesregierung plant den Bau neuer Gaskraftwerke für mehr Energiesicherheit. Das stößt auf Kritik. Wirtschaftsministerin Reiche weist d… [+2010 chars]",,de,'Gas'
https://www.tagesspiegel.de/wirtschaft/energieversorgung-ministerin-reiche-verteidigt-plane-fur-neue-gaskraftwerke-13703434.html,https://www.tagesspiegel.de/wirtschaft/energieversorgung-ministerin-reiche-verteidigt-plane-fur-neue-gaskraftwerke-13703434.html,0,www.tagesspiegel.de,Energieversorgung: Ministerin Reiche verteidigt Pläne für neue Gaskraftwerke,Die neue Bundesregierung plant den Bau neuer Gaskraftwerke für mehr Energiesicherheit. Das stößt auf Kritik. Wirtschaftsministerin Reiche weist diese zurück.,https://www.tagesspiegel.de/images/13703431/alternates/BASE_16_9_W1400/1747388765000/wirtschaftsministerin-katherina-reiche-cdu.jpeg,2025-05-16T09:46:05Z,,"Bundeswirtschaftsministerin Katherina Reiche hat die Pläne der Bundesregierung zum Bau neuer Gaskraftwerke verteidigt. Es brauche gesicherte Leistung, wenn Kohle aus Klimaschutzgründen und wegen des … [+2550 chars]",,de,'Gas'
https://www.n-tv.de/politik/Wirtschaftsministerin-Reiche-verteidigt-sich-gegen-Lobby-Vorwurf-article25772535.html,https://www.n-tv.de/politik/Wirtschaftsministerin-Reiche-verteidigt-sich-gegen-Lobby-Vorwurf-article25772535.html,0,www.n-tv.de,Bräuchten Gaskraftwerke dringend: Wirtschaftsministerin Reiche verteidigt sich gegen Lobby-Vorwurf,"Wirtschaftsministerin Katherina Reiche arbeitet vor ihrem Ministeramt für einen Verband, der viele Gasanbieter vertritt. Nun fordert sie mehr Gaskraftwerke - und erntet den Vorwurf, zu lobbyieren. Sie verteidigt sich und verweist auf technische Möglichkeiten.…",https://www.n-tv.de/img/incoming/crop25772545/6551322485-cImg_16_9-w1200/518314451.jpg,2025-05-16T11:26:38Z,,"Wirtschaftsministerin Katherina Reiche arbeitet vor ihrem Ministeramt für einen Verband, der viele Gasanbieter vertritt. Nun fordert sie mehr Gaskraftwerke - und erntet den Vorwurf, zu lobbyieren. Si… [+2864 chars]",,de,'Gas'
https://www.zeit.de/familie/2025-05/pubertaet-kinder-eltern-beziehung-entfremdung,https://www.zeit.de/familie/2025-05/pubertaet-kinder-eltern-beziehung-entfremdung,0,www.zeit.de,Pubertät: Was für eine nice Zumutung,"Kinder werden nicht über Nacht zum Teenager. Dennoch erscheinen sie in der Pubertät wie eine fremde Person. Das ist vor allem eine Phase, in der Eltern wachsen müssen.",https://img.zeit.de/familie/2025-05/pubertaet-kinder-eltern-beziehung/wide__1300x731,2025-05-16T11:34:26Z,http://archive.md/20250516114258/https://www.zeit.de/familie/2025-05/pubertaet-kinder-eltern-beziehung-entfremdung,"Dieser Artikel ist Teil von ZEIT am Wochenende, Ausgabe 20/2025.
Man hat sein Kind noch gar nicht richtig kennengelernt, da beginnt schon die
Entfremdung. Denn mit dem ersten Atemzug fängt das Kind… [+508 chars]",,de,'Kinder'
https://www.zeit.de/news/2025-05/16/reizgas-in-schultoilette-versprueht-mehrere-kinder-verletzt,https://www.zeit.de/news/2025-05/16/reizgas-in-schultoilette-versprueht-mehrere-kinder-verletzt,0,www.zeit.de,Schulen: Reizgas in Schultoilette versprüht - mehrere Kinder verletzt,Hier finden Sie Informationen zu dem Thema „Schulen“. Lesen Sie jetzt „Reizgas in Schultoilette versprüht - mehrere Kinder verletzt“.,https://img.zeit.de/news/2025-05/16/reizgas-in-schultoilette-versprueht-mehrere-kinder-verletzt-image-group/wide__1300x731,2025-05-16T12:48:17Z,,Ein Unbekannter hat in einer Schultoilette in Nürnberg Reizgas versprüht und damit mehrere Schüler leicht verletzt. Mindestens zehn Schüler erlitten Polizeiangaben zufolge Reizungen an Hals und Augen… [+418 chars],,de,'Kinder'
https://www.diepresse.com/19693188/haben-erneuerbare-mit-spaniens-blackout-zu-tun,https://www.diepresse.com/19693188/haben-erneuerbare-mit-spaniens-blackout-zu-tun,0,www.diepresse.com,Haben Erneuerbare mit Spaniens Blackout zu tun?,"Gerhard Christiner von der APG erklärt, was beim Blackout in Spanien wirklich passiert sein könnte, und was in Österreich beim Netzausbau besser laufen sollte.",https://img.diepresse.com/public/incoming/cs5olj-SPAIN-ENERGYOUTAGES/alternates/DPR_PODCAST_AUFGUSS/SPAIN-ENERGYOUTAGES%20,2025-05-16T13:39:25Z,,"Gerhard Christiner von der APG erklärt, was beim Blackout in Spanien wirklich passiert sein könnte, und was in Österreich beim Netzausbau besser laufen sollte. 
Über Stunden hinweg hielt ganz Europa… [+1616 chars]",,de,'Blackout'
https://www.stern.de/geo/junko-tabei--die-frau--die-den-mount-everest-bezwang-35731110.html,https://www.stern.de/geo/junko-tabei--die-frau--die-den-mount-everest-bezwang-35731110.html,0,www.stern.de,"Junko Tabei: Die Frau, die den höchsten Berg der Welt bezwang",Vor 50 Jahren steht eine Japanerin auf dem höchsten Gipfel der Erde. Ein Foto von ihr im Schnee belegt ihre nie da gewesene Leistung – und symbolisiert einen Durchbruch für Frauen.,https://image.stern.de/35731106/t/32/v4/w1440/r1.7778/-/junkotabei-everest-1975-pa-116852143.jpg,2025-05-16T14:25:00Z,https://web.archive.org/web/20250516154435/https://www.stern.de/geo/junko-tabei--die-frau--die-den-mount-everest-bezwang-35731110.html,"Kopiere den aktuellen Link
Zur Merkliste hinzufügen
Vor 50 Jahren steht eine Japanerin auf dem höchsten Gipfel der Erde. Ein Foto von ihr im Schnee belegt ihre nie da gewesene Leistung und symbolis… [+3488 chars]",,de,'Schnee'
https://www.bild.de/sport/fussball/vfb-stuttgart-aufgepasst-ballert-sich-der-vfb-zum-koenigsklassen-etat-68274a6ea6a34a0a03285c86,https://www.bild.de/sport/fussball/vfb-stuttgart-aufgepasst-ballert-sich-der-vfb-zum-koenigsklassen-etat-68274a6ea6a34a0a03285c86,0,www.bild.de,Von wegen Luft raus! - Ballert sich der VfB zum Königsklassen-Etat?,"In der Liga nur im Mittelfeld, geht es für den VfB Stuttgart in den letzten zwei Spielen der Saison noch um richtig viel Kohle für den Etat. BILD weiß mehr.","https://images.bild.de/68274a6ea6a34a0a03285c86/5cc97260339a5e9c8e5be61ab0beb078,30ec6c9f?w=1280",2025-05-16T14:31:08Z,https://web.archive.org/web/20250516164324/http://www.bild.de/sport/fussball/vfb-stuttgart-aufgepasst-ballert-sich-der-vfb-zum-koenigsklassen-etat-68274a6ea6a34a0a03285c86,"Dass der VfB in der Bundesligatabelle im Mittelfeld landet, steht schon vor dem letzten Spiel am Samstag (15.30 Uhr/Sky und Highlights bei BILD.de) fest. Aber es geht trotzdem noch um richtig Kohle!… [+1364 chars]",,de,'Kohle'
https://www.zeit.de/news/2025-05/16/frankfurt-bekommt-neues-kindertheater-am-zoo,https://www.zeit.de/news/2025-05/16/frankfurt-bekommt-neues-kindertheater-am-zoo,0,www.zeit.de,Kultur für Kinder: Frankfurt bekommt neues Kindertheater am Zoo,Hier finden Sie Informationen zu dem Thema „Kultur für Kinder“. Lesen Sie jetzt „Frankfurt bekommt neues Kindertheater am Zoo“.,https://img.zeit.de/news/2025-05/16/frankfurt-bekommt-neues-kindertheater-am-zoo-image-group/wide__1300x731,2025-05-16T14:44:53Z,https://web.archive.org/web/20250517172107/https://www.zeit.de/news/2025-05/16/frankfurt-bekommt-neues-kindertheater-am-zoo,Frankfurt soll am Zoo einen neuen Kultur- und Lernort für junge Menschen bekommen. Der Magistrat beschloss laut Stadt die Sanierung des denkmalgeschützten Zoogesellschaftshauses am Frankfurter Zoo un… [+1711 chars],,de,'Kinder'
https://www.zeit.de/news/2025-05/17/deutlich-mehr-kinder-in-sachsen-anhalts-frauenschutzhaeusern,https://www.zeit.de/news/2025-05/17/deutlich-mehr-kinder-in-sachsen-anhalts-frauenschutzhaeusern,0,www.zeit.de,Häusliche Gewalt: Deutlich mehr Kinder in Sachsen-Anhalts Frauenschutzhäusern,Hier finden Sie Informationen zu dem Thema „Häusliche Gewalt“. Lesen Sie jetzt „Deutlich mehr Kinder in Sachsen-Anhalts Frauenschutzhäusern“.,https://img.zeit.de/news/2025-05/17/deutlich-mehr-kinder-in-sachsen-anhalts-frauenschutzhaeusern-image-group/wide__1300x731,2025-05-17T02:00:47Z,,"In den Frauenschutzhäusern in Sachsen-Anhalt sind zuletzt deutlich mehr Kinder aufgenommen worden. Nach 565 im Jahr 2023 waren es im vergangenen Jahr 594 Kinder gewesen, wie eine Sprecherin des Lande… [+2605 chars]",,de,'Kinder'
https://www.bild.de/sport/fussball/fortuna-duesseldorf-kohle-krepierer-vorm-finale-um-die-relegation-68271e064d5626496324c8e9,https://www.bild.de/sport/fussball/fortuna-duesseldorf-kohle-krepierer-vorm-finale-um-die-relegation-68271e064d5626496324c8e9,0,www.bild.de,Klub extrem verärgert - Kohle-Krepierer vorm Fortuna-Finale!,Der Prozess um die Corona-Millionen von Fortuna Düsseldorf gegen die Bezirksregierung Düsseldorf geht in die nächste Runde. Finanz-Boss Arnd Hovemann ist deswegen sauer.,"https://images.bild.de/68271e064d5626496324c8e9/4e8a776c3e2058d530ff2d0e85bf1af7,15c55647?w=1280",2025-05-17T03:00:58Z,https://web.archive.org/web/20250517054932/https://www.bild.de/sport/fussball/fortuna-duesseldorf-kohle-krepierer-vorm-finale-um-die-relegation-68271e064d5626496324c8e9,"Wegen dieses Themas ist Fortuna Düsseldorf so richtig auf dem Baum...
Seit einiger Zeit kämpft der Klub gerichtlich gegen die Bezirksregierung Düsseldorf, die 1,7 Millionen Euro Corona-Soforthilfen … [+3428 chars]",,de,'Kohle'
https://www.nzz.ch/wissenschaft/unser-energiesystem-wurde-auf-die-anforderungen-von-1880-gebaut-ld.1884395,https://www.nzz.ch/wissenschaft/unser-energiesystem-wurde-auf-die-anforderungen-von-1880-gebaut-ld.1884395,0,www.nzz.ch,Blackout in Spanien: «Unser Energiesystem wurde auf die Anforderungen von 1880 gebaut»,"Bisher haben Kohle-, Gas- oder Atomkraftwerke das Netz stabil gehalten. Das ändert sich, wenn mehr Wind- und Solarkraft eingespeist wird. ETH-Ingenieur Florian Dörfler über die Probleme der Energiewende und die Lehren aus dem Stromausfall in Spanien.","https://img.nzz.ch/2025/03/29/12f5683e-0547-4036-aef8-e20e9d45ef19.jpeg?width=1200&height=674&fit=bounds&quality=75&auto=webp&crop=4724,2657,x0,y246&wmark=nzz",2025-05-17T03:30:00Z,https://web.archive.org/web/20250517051938/http://www.nzz.ch/wissenschaft/unser-energiesystem-wurde-auf-die-anforderungen-von-1880-gebaut-ld.1884395,"Strommasten, Windräder und ein Kohlekraftwerk: Im Zuge der Energiewende prallen in Deutschland die neue und die alte Energielandschaft aufeinander.
Der Stromausfall, der vor zwei Wochen Spanien und … [+12986 chars]",,de,'Kohle'
https://www.bild.de/lifestyle/grillen/grills-im-vergleich-welche-art-von-grill-ist-am-besten-660fc8f3b484e05aabe37575,https://www.bild.de/lifestyle/grillen/grills-im-vergleich-welche-art-von-grill-ist-am-besten-660fc8f3b484e05aabe37575,0,www.bild.de,"Holzkohle, Gas- und Elektrogrill - Welcher Grill ist der Richtige?",Die Grillsaison startet: Doch welcher Grill passt am besten zu Ihren Bedürfnissen? BILD zeigt hier alle Arten im Vergleich.,"https://images.bild.de/660fc8f3b484e05aabe37575/8d2869676c8566f942998d88a6408999,2dfa30dc?w=1280",2025-05-17T07:06:00Z,,Warme Sommer und der verlockende Duft von gegrilltem Essen liegt in der Luft Die Grillsaison hat begonnen! Doch welchen Grill sollten Sie benutzen? Auf welchem Rost braten die Würste am besten und wo… [+2372 chars],,de,'Kohle'
https://www.zeit.de/2025/20/kinder-von-politikern-caroline-bosbach-frederik-bouffier-johannes-kretschmann,https://www.zeit.de/2025/20/kinder-von-politikern-caroline-bosbach-frederik-bouffier-johannes-kretschmann,0,www.zeit.de,Kinder von Politikern: Kinder an der Macht,"Sie sahen von klein auf, wie Spitzenpolitik Menschen aufreiben kann. Und doch folgten Caroline Bosbach, Frederik Bouffier und Johannes Kretschmann ihren Vätern. Wieso?",https://img.zeit.de/2025/20/kinder-an-der-macht-bild-8/wide__1300x731,2025-05-17T07:16:19Z,http://archive.md/20250518032735/https://www.zeit.de/2025/20/kinder-von-politikern-caroline-bosbach-frederik-bouffier-johannes-kretschmann,"Duzen oder Siezen? Für Caroline Bosbach und Frederik Bouffier ist das keine Frage: Sie kennen sich seit ihrer Jugend, als beide Familien zufällig in derselben Clubanlage auf Ibiza Urlaub gemacht habe… [+335 chars]",,de,'Kinder'
https://www.tagesschau.de/ausland/amerika/infrastruktur-west-virginia-100.html,https://www.tagesschau.de/ausland/amerika/infrastruktur-west-virginia-100.html,0,www.tagesschau.de,US-Infrastruktur: Die vergessenen Orte von West Virginia,"Die goldenen Zeiten im einstigen Kohlerevier West Virginias sind lange vorbei. Seitdem die Kohlekonzerne fort sind, ist die Infrastruktur marode. So kommt es, dass hier viele Menschen ohne sauberes Leitungswasser leben. Von Kerstin Klein.",https://images.tagesschau.de/image/d62a1f9f-a3f9-4898-9aa8-ae5c53ae5639/AAABltN5yME/AAABkZLhkrw/16x9-1280/mcdowell-ortschaft-100.jpg,2025-05-17T12:15:59Z,https://web.archive.org/web/20250517135445/https://www.tagesschau.de/ausland/amerika/infrastruktur-west-virginia-100.html,"Stand: 17.05.2025 14:15 Uhr
Die goldenen Zeiten im einstigen Kohlerevier West Virginias sind lange vorbei. Seitdem die Kohlekonzerne fort sind, ist die Infrastruktur marode. So kommt es, dass hier v… [+4786 chars]",,de,'Kohle'
https://www.morgenpost.de/wirtschaft/article409013454/heizkosten-an-der-boerse-handeln-fuer-verbraucher-wird-es-teuer.html,https://www.morgenpost.de/wirtschaft/article409013454/heizkosten-an-der-boerse-handeln-fuer-verbraucher-wird-es-teuer.html,0,www.morgenpost.de,Heizkosten an der Börse handeln: Für Verbraucher wird es teuer,"Die Zukunft der Energiekosten: In Amerika werden CO₂-Zertifikate gehandelt, die die Preise für Benzin und Heizwärme beeinflussen. Wie das funktioniert.",https://img.sparknews.funkemedien.de/404505168/404505168_1687154523_v16_9_1600.jpeg,2025-05-17T13:30:07Z,https://web.archive.org/web/20250517135232/https://www.morgenpost.de/wirtschaft/article409013454/heizkosten-an-der-boerse-handeln-fuer-verbraucher-wird-es-teuer.html,"Berlin. Noch ist der CO-Preis politisch festgelegt. Doch in den USA hat der Handel an der Börse begonnen. Der zeigt: Es dürfte teuer werden.
Wie sich die Energiekosten für Privathaushalte in den kom… [+3985 chars]",,de,'Energiekosten'
https://www.zeit.de/news/2025-05/18/vier-verletzte-bei-unfall-in-hamburg-darunter-zwei-kinder,https://www.zeit.de/news/2025-05/18/vier-verletzte-bei-unfall-in-hamburg-darunter-zwei-kinder,0,www.zeit.de,Verkehrsunfall: Vier Verletzte bei Unfall in Hamburg – darunter zwei Kinder,Hier finden Sie Informationen zu dem Thema „Verkehrsunfall“. Lesen Sie jetzt „Vier Verletzte bei Unfall in Hamburg – darunter zwei Kinder“.,https://img.zeit.de/news/2025-05/18/vier-verletzte-bei-unfall-in-hamburg-darunter-zwei-kinder-image-group/wide__1300x731,2025-05-18T08:27:21Z,,"Bei einem Unfall in Hamburg-Eppendorf sind am Samstagabend vier Menschen leicht verletzt worden, darunter zwei Kinder. Nach Angaben der Polizei soll ein 33-jähriger Autofahrer vermutlich zu schnell u… [+462 chars]",,de,'Kinder'
https://www.zeit.de/news/2025-05/18/jennifer-lawrence-kinder-haben-ist-brutal-und-unglaublich,https://www.zeit.de/news/2025-05/18/jennifer-lawrence-kinder-haben-ist-brutal-und-unglaublich,0,www.zeit.de,"Filmfestspiele Cannes: Jennifer Lawrence: Kinder haben ist ""brutal und unglaublich""","Hier finden Sie Informationen zu dem Thema „Filmfestspiele Cannes“. Lesen Sie jetzt „Jennifer Lawrence: Kinder haben ist ""brutal und unglaublich""“.",https://img.zeit.de/news/2025-05/18/jennifer-lawrence-kinder-haben-ist-brutal-und-unglaublich-image-group/wide__1300x731,2025-05-18T09:30:57Z,,"Hollywood-Star Jennifer Lawrence hat Erfahrungen aus ihrem Leben als zweifache Mutter geteilt. Die 34-Jährige bekam vor wenigen Monaten ihr zweites Kind. «Kinder zu haben, verändert alles», sagte sie… [+1229 chars]",,de,'Kinder'
https://www.diepresse.com/19696971/ohne-energie-kein-wachstum-donald-trump-draengt-afrika-zurueck-zu-kohle-oel-und-gas,https://www.diepresse.com/19696971/ohne-energie-kein-wachstum-donald-trump-draengt-afrika-zurueck-zu-kohle-oel-und-gas,0,www.diepresse.com,"Ohne Energie kein Wachstum: Donald Trump drängt Afrika zurück zu Kohle, Öl und Gas [premium]","Kein Strom, kein Wohlstand. Diese simple Rechnung ist für fast 600 Millionen Menschen in Afrika bittere Realität. Der Westen versprach Erlösung durch mehr Strom dank Sonne, Wind und Wasser. Dann kam Donald Trump.",https://img.diepresse.com/public/incoming/frb23p-FILES-GABON-ECONOMY-OIL-ENERGY/alternates/DPR_SOCIAL_MAGAZIN/FILES-GABON-ECONOMY-OIL-ENERGY,2025-05-18T10:54:10Z,,"Kein Strom, kein Wohlstand. Diese simple Rechnung ist für fast 600 Millionen Menschen in Afrika bittere Realität. Der Westen versprach Erlösung durch mehr Strom dank Sonne, Wind und Wasser. Dann kam … [+1090 chars]",,de,'Kohle'
https://www.sueddeutsche.de/muenchen/muenchen-radfahrer-radsternfahrt-li.3241443,https://www.sueddeutsche.de/muenchen/muenchen-radfahrer-radsternfahrt-li.3241443,0,www.sueddeutsche.de,ADFC-Radsternfahrt: Tausende Radler für mehr Verkehrssicherheit,"Bei der Radsternfahrt in München versammelten sich Tausende Fahrradbegeisterte, um für mehr Sicherheit und bessere Radwege zu demonstrieren. Familien, Kinder und Radfans zeigten mit kreativen Schildern und Fahnen ihre Leidenschaft.",https://www.sueddeutsche.de/2025/05/18/165b3e38-0207-42de-bbe7-88f9de73b429.jpeg?q=60&fm=webp&width=1200&rect=0%2C210%2C4000%2C2250,2025-05-18T15:13:26Z,http://archive.md/20250518155144/https://www.sueddeutsche.de/muenchen/muenchen-radfahrer-radsternfahrt-li.3241443,"Zur Radsternfahrt des Allgemeinen Deutschen Fahrrad-Clubs (ADFC) München sind an diesem Sonntag Tausende Fahrrad-Begeisterte aufgebrochen. Viele sind als Familie unterwegs, manche Kleinen radeln selb… [+3949 chars]",,de,'ältere Menschen'
https://www.zeit.de/familie/2025-05/benehmen-kinder-erziehung-alltag-komplimente,https://www.zeit.de/familie/2025-05/benehmen-kinder-erziehung-alltag-komplimente,0,www.zeit.de,Benehmen der Kinder: Redest du wirklich von meinem Kind?,Nirgends benehmen sich Kinder so schlecht wie zu Hause. Anderswo blüht die Brut zu höflichen Engeln auf. Mit diesem Wissen könnten Eltern etwas Gutes für sich selbst tun.,https://img.zeit.de/familie/2025-05/benehmen-kinder-erziehung-alltag/wide__1300x731,2025-05-18T16:17:46Z,http://archive.md/20250518162614/https://www.zeit.de/familie/2025-05/benehmen-kinder-erziehung-alltag-komplimente,"Meine
achtjährige Tochter hat einen Freund, E. Dieser wird von seinen Eltern als, nun ja, halbwüchsiger Tyrann empfunden. Er
scheint zu Hause jede Menge Ärger zu machen und maßgeblich zur Erschöpfu… [+1193 chars]",,de,'Kinder'
https://www.zeit.de/news/2025-05/18/zwei-kinder-werden-bei-unfall-schwer-verletzt,https://www.zeit.de/news/2025-05/18/zwei-kinder-werden-bei-unfall-schwer-verletzt,0,www.zeit.de,Zu spät reagiert: Zwei Kinder werden bei Unfall schwer verletzt,Hier finden Sie Informationen zu dem Thema „Zu spät reagiert“. Lesen Sie jetzt „Zwei Kinder werden bei Unfall schwer verletzt“.,https://img.zeit.de/news/2025-05/18/zwei-kinder-werden-bei-unfall-schwer-verletzt-image-group/wide__1300x731,2025-05-18T16:18:43Z,,"Bei einem Unfall auf der Autobahn 7 im Ostalbkreis sind fünf Menschen verletzt worden, darunter sind auch zwei Kinder. Sie erlitten schwere Verletzungen, wie die Polizei mitteilte. Insgesamt waren am… [+532 chars]",,de,'Kinder'
https://www.zeit.de/news/2025-05/19/dicker-statt-fitter-wenn-die-grundschule-ins-gewicht-faellt,https://www.zeit.de/news/2025-05/19/dicker-statt-fitter-wenn-die-grundschule-ins-gewicht-faellt,0,www.zeit.de,Gesundheit bei Kindern: Dicker statt fitter - wenn die Grundschule ins Gewicht fällt,Hier finden Sie Informationen zu dem Thema „Gesundheit bei Kindern“. Lesen Sie jetzt „Dicker statt fitter - wenn die Grundschule ins Gewicht fällt“.,https://img.zeit.de/news/2025-05/19/dicker-statt-fitter-wenn-die-grundschule-ins-gewicht-faellt-image-group/wide__1300x731,2025-05-19T02:00:43Z,,Immer mehr Kinder in Baden-Württemberg bringen zu viele Kilos auf die Waage. Das geht aus dem Fitnessbarometer 2025 der Kinderturnstiftung Baden-Württemberg für Jungen und Mädchen im Alter zwischen d… [+3216 chars],,de,'Kinder'
https://www.faz.net/aktuell/sport/mehr-sport/norwegen-vater-und-leichtathletik-trainer-gjert-ingebrigtsen-vor-gericht-110484160.html,https://www.faz.net/aktuell/sport/mehr-sport/norwegen-vater-und-leichtathletik-trainer-gjert-ingebrigtsen-vor-gericht-110484160.html,0,www.faz.net,"Der Fall Ingebrigtsen vor Gericht: „Unbehagen und Angst, die uns begleiten“","Der Vater und Leichtathletik-Trainer Gjert Ingebrigtsen steht vor Gericht, weil seine erfolgreichen Kinder ihm Manipulation und Misshandlung vorwerfen. Der Fall wirft Fragen auf – nicht nur in Norwegen.",https://media1.faz.net/ppmedia/aktuell/politik/4100600788/1.10484189/facebook_teaser_fplus/eine-zeichnung-des-angeklagten.jpg,2025-05-19T04:34:26Z,https://web.archive.org/web/20250519054929/http://www.faz.net/aktuell/sport/mehr-sport/norwegen-vater-und-leichtathletik-trainer-gjert-ingebrigtsen-vor-gericht-110484160.html,"Zugang zu allen FAZ+ Beiträgen12,80 
 jetzt nur 0,99 
Zugang zu allen FAZ+ Beiträgen12,80 
 jetzt nur 0,99 
<ul><li>Mit einem Klick online kündbar</li></ul>",,de,'Kinder'
https://www.focus.de/panorama/welt/bergtod-wie-seine-mutter-spitzenkoch-shaun-rollier-mit-29-verstorben_8ed13ee4-e5da-4f25-b79b-98326b27fdba.html,https://www.focus.de/panorama/welt/bergtod-wie-seine-mutter-spitzenkoch-shaun-rollier-mit-29-verstorben_8ed13ee4-e5da-4f25-b79b-98326b27fdba.html,0,www.focus.de,Bergtod wie seine Mutter Spitzenkoch Shaun Rollier mit 29 verstorben,"Shaun Rollier war auf einer Bergtour in den Schweizer Alpen, als sich plötzlich eine Lawine löste. Die Gastro-Szene trauert um den jungen Starkoch.",https://quadro.burda-forward.de/ctf/9f32f4d1-6690-46ce-8631-5a0544fa2421.55bfeec7-3f37-4068-9146-630d8cfe8544.png?im=RegionOfInterestCrop%3D%281200%2C630%29%2CregionOfInterest%3D%28343%2C438%29&hash=5be93b3e30fc13d5a2e1fe973deb3bbfb6a0c40b9c25a2020279f3dff20f8444,2025-05-19T08:34:15Z,,Schock in der Gastro-Szene: Der Star-Koch Shaun Rollier ist bei einem Lawinenunglück in den Schweizer Alpen ums Leben gekommen. Der 29-jährige war mit Freunden am Sonntag vor einer Woche zu der Bergt… [+1639 chars],,de,'Gas'
https://www.focus.de/panorama/welt/selbes-schicksal-wie-seine-mutter-star-koch-stirbt-mit-nur-29-jahren-bei-skitour_8ed13ee4-e5da-4f25-b79b-98326b27fdba.html,https://www.focus.de/panorama/welt/selbes-schicksal-wie-seine-mutter-star-koch-stirbt-mit-nur-29-jahren-bei-skitour_8ed13ee4-e5da-4f25-b79b-98326b27fdba.html,0,www.focus.de,Selbes Schicksal wie seine Mutter: Star-Koch stirbt mit nur 29 Jahren bei Skitour,"Shaun Rollier war auf einer Bergtour in den Schweizer Alpen, als sich plötzlich eine Lawine löste. Die Gastro-Szene trauert um den jungen Starkoch.",https://quadro.burda-forward.de/ctf/9f32f4d1-6690-46ce-8631-5a0544fa2421.55bfeec7-3f37-4068-9146-630d8cfe8544.png?im=RegionOfInterestCrop%3D%281200%2C630%29%2CregionOfInterest%3D%28343%2C438%29&hash=5be93b3e30fc13d5a2e1fe973deb3bbfb6a0c40b9c25a2020279f3dff20f8444,2025-05-19T08:34:15Z,https://web.archive.org/web/20250519085115/https://www.focus.de/panorama/welt/selbes-schicksal-wie-seine-mutter-star-koch-stirbt-mit-nur-29-jahren-bei-skitour_8ed13ee4-e5da-4f25-b79b-98326b27fdba.html,Schock in der Gastro-Szene: Der Star-Koch Shaun Rollier ist bei einem Lawinenunglück in den Schweizer Alpen ums Leben gekommen. Der 29-jährige war mit Freunden am Sonntag vor einer Woche zu der Bergt… [+1637 chars],,de,'Schnee'
https://www.stern.de/gesellschaft/regional/rheinland-pfalz-saarland/altersleiden--rheinland-pfaelzer-leiden-oft-unter-bluthochdruck-35736146.html,https://www.stern.de/gesellschaft/regional/rheinland-pfalz-saarland/altersleiden--rheinland-pfaelzer-leiden-oft-unter-bluthochdruck-35736146.html,0,www.stern.de,Altersleiden: Rheinland-Pfälzer leiden oft unter Bluthochdruck,Einer Auswertung der Barmer-Krankenkasse zufolge leiden viele ältere Menschen in Rheinland-Pfalz unter zu hohen Blutdruck- und Cholesterinwerten. Das Land liegt oft über dem Bundesdurchschnitt.,https://image.stern.de/35736148/t/cN/v1/w1440/r1.7778/-/19--kded46lar3v11axs2048jpeg---6e837815a8fb3548.jpg,2025-05-19T09:28:50Z,,"Kopiere den aktuellen Link
Zur Merkliste hinzufügen
Einer Auswertung der Barmer-Krankenkasse zufolge leiden viele ältere Menschen in Rheinland-Pfalz unter zu hohen Blutdruck- und Cholesterinwerten.… [+3194 chars]",,de,'ältere Menschen'
