index,url,valid,domain,title,description,image,published,archive,content,quote,language,keyword
https://www.n-tv.de/wirtschaft/Osteuropa-zittert-vor-ETS-2-Heizkosten-in-Polen-koennten-um-150-Prozent-steigen-article26128402.html,https://www.n-tv.de/wirtschaft/Osteuropa-zittert-vor-ETS-2-Heizkosten-in-Polen-koennten-um-150-Prozent-steigen-article26128402.html,0,www.n-tv.de,"Zittern vor deutscher Klimawaffe: ""Heizkosten in Polen könnten durch ETS-2 um 150 Prozent steigen""","2027 zündet die EU die nächste Stufe des Emissionshandels: Sie nimmt Wärme und Verkehr auf, greift Privathaushalten also beim Tanken und Heizen in die Tasche. Speziell in Osteuropa droht ein Schock beim Blick auf die Zapfsäule oder die Heizkostenrechnung, wie…",https://www.n-tv.de/img/incoming/crop26128604/2391327033-cImg_16_9-w1200/502480517.jpg,2025-11-01T05:20:59Z,,"2027 zündet die EU die nächste Stufe des Emissionshandels: Sie nimmt Wärme und Verkehr auf, greift Privathaushalten also beim Tanken und Heizen in die Tasche. Speziell in Osteuropa droht ein Schock b… [+9696 chars]",,de,'Gas'
https://www.focus.de/kultur/kino-tv/kein-strom-kein-gas-ich-brauche-das-geld-zum-trinken_4784ed8f-39dd-4120-ba8b-e75681ee3444.html,https://www.focus.de/kultur/kino-tv/kein-strom-kein-gas-ich-brauche-das-geld-zum-trinken_4784ed8f-39dd-4120-ba8b-e75681ee3444.html,0,www.focus.de,"Kein Strom, kein Gas: „Ich brauche das Geld zum Trinken“",Vor zehn Jahren machte der Sender VOX den sozialen Brennpunkt „Asternweg“ in Kaiserslautern bundesweit bekannt. Grundlegend verbessert hat sich an der miserablen Wohnsituation der Sozialschwachen seither wenig.,https://quadro.burda-forward.de/ctf/72ced5b4-8a52-43d5-b3f9-363f99646715.8278011f-b0f7-4aa8-904e-e541a2005693.png?im=RegionOfInterestCrop%3D%281200%2C630%29%2CregionOfInterest%3D%28557.5%2C298%29&hash=6fd5413767b2de607cd4c49f10366f2952a873a5b3d180fb63c04443100b2934,2025-11-01T22:48:01Z,,"Ich bin stolz, Kalkhöfler zu sein, sagt Helmut Kallenbach. Das war vor zehn Jahren. Mittlerweile ist er tot. Der Krebs hatte sich in den damals 44-Jährigen hineingefressen. Zehn Jahre nach der ersten… [+4791 chars]",,de,'Gas'
https://www.zeit.de/news/2025-11/03/enviam-senkt-erneut-strom-und-gaspreise-fuer-ostdeutschland,https://www.zeit.de/news/2025-11/03/enviam-senkt-erneut-strom-und-gaspreise-fuer-ostdeutschland,0,www.zeit.de,Energiepreise: EnviaM senkt erneut Strom- und Gaspreise für Ostdeutschland,Hier finden Sie Informationen zu dem Thema „Energiepreise“. Lesen Sie jetzt „EnviaM senkt erneut Strom- und Gaspreise für Ostdeutschland“.,https://img.zeit.de/news/2025-11/03/enviam-senkt-erneut-strom-und-gaspreise-fuer-ostdeutschland-image-group/wide__1300x731,2025-11-03T10:09:29Z,,"Die Preise für Strom, Erdgas und Wärmestrom für Kundinnen und Kunden des ostdeutschen Energieversorgers EnviaM und Mitgas sollen zum Jahreswechsel erneut sinken. Grund seien rückläufige Kosten bei de… [+1986 chars]",,de,'Gas'
https://www.stern.de/auto/fuenf-autos-unter-15-000-euro--welche-sich-perfekt-fuer-den-winter-eignen-36159076.html,https://www.stern.de/auto/fuenf-autos-unter-15-000-euro--welche-sich-perfekt-fuer-den-winter-eignen-36159076.html,0,www.stern.de,"Ratgeber: Fünf Autos unter 15.000 Euro, die sich perfekt für den Winter eignen","Die kühlen Herbststürme sind durch und der erste Schnee der Saison ist gefallen. Wohl dem, der einen wintertauglichen Wagen hat, der einem das Wetter nicht übelnimmt.",https://image.stern.de/36159094/t/dJ/v3/w1440/r1.7778/-/range-rover-evoque-1.jpg,2025-11-03T13:15:00Z,,"Kopiere den aktuellen Link
Zur Merkliste hinzufügen
Die kühlen Herbststürme sind durch und der erste Schnee der Saison ist gefallen. Wohl dem, der einen wintertauglichen Wagen hat, der einem das We… [+679 chars]",,de,'Schnee'
https://www.golem.de/sonstiges/zustimmung/auswahl.html?from=https://www.golem.de/news/anzeige-rudergeraet-von-merach-jetzt-bis-zu-170-euro-rabatt-sichern-2511-201790.html&referer=https://t.co/cbcea58bfd,https://www.golem.de/sonstiges/zustimmung/auswahl.html?from=https://www.golem.de/news/anzeige-rudergeraet-von-merach-jetzt-bis-zu-170-euro-rabatt-sichern-2511-201790.html&referer=https://t.co/cbcea58bfd,0,www.golem.de,Anzeige: Rudergerät von Merach - jetzt bis zu 170 Euro Rabatt sichern,"Die Rudergeräte von Merach ermöglichen es, im Herbst und Winter gemütlich zu Hause zu trainieren und dabei jede Menge Geld zu sparen. (Fitness, Wearable)",,2025-11-03T13:43:02Z,,"Besuchen Sie Golem.de wie gewohnt mit Werbung und Tracking,
 indem Sie der Nutzung aller Cookies zustimmen.
 Details zum Tracking finden Sie im Privacy Center.
Skript wurde nicht geladen. Informat… [+607 chars]",,de,'Winter'
https://www.welt.de/sport/article6908ade30580923d09985d5c/drama-im-himalaya-zwei-bergsteiger-nach-heftigem-schneefall-in-nepal-vermisst.html,https://www.welt.de/sport/article6908ade30580923d09985d5c/drama-im-himalaya-zwei-bergsteiger-nach-heftigem-schneefall-in-nepal-vermisst.html,0,www.welt.de,Nach Zyklon und heftigem Schneefall – Zwei Bergsteiger in Nepal vermisst,Zwei Bergsteiger aus Italien wollen den 6887 Meter hohen Panbari im Himalaya besteigen. Dann fängt es in Nepal heftig an zu schneien. Seit Tagen besteht kein Kontakt zu den Männern mehr. Ein Hubschrauber rettet nur den Leiter der Expedition.,https://images.welt.de/6908ade30580923d09985d5c/e388e11125bfe2cd6c75589f4bf79b28-master/ci16x9-w1200/afp-79f66cq-jpg,2025-11-03T13:55:49Z,,Zwei Bergsteiger aus Italien wollen den 6887 Meter hohen Panbari im Himalaya besteigen. Dann fängt es in Nepal heftig an zu schneien. Seit Tagen besteht kein Kontakt zu den Männern mehr. Ein Hubschra… [+1584 chars],,de,'Schnee'
https://www.nzz.ch/wissenschaft/schweizer-klimaszenarien-2025-temperaturanstieg-und-folgen-ld.1909399,https://www.nzz.ch/wissenschaft/schweizer-klimaszenarien-2025-temperaturanstieg-und-folgen-ld.1909399,0,www.nzz.ch,"Tropennächte, Starkregen, weniger Schnee: Neue Szenarien zeigen, wie stark der Klimawandel die Schweiz verändert","Die Klimaszenarien zeigen in grösserem Detail als zuvor, wie die Erderwärmung das Land beeinflusst. Neben der Hitze dürften vor allem Veränderungen beim Niederschlag für Probleme sorgen.","https://img.nzz.ch/2025/11/04/d064ec31-1a6e-4522-8b71-d27e6db5665d.png?width=1200&height=675&fit=bounds&quality=75&auto=webp&crop=1201,676,x0,y113&wmark=nzz",2025-11-04T10:00:00Z,,Selbst im November laden in diesen Tagen Temperaturen bis 15 Grad zum Flanieren ein. Auch dem Laien schwant: Solche Wetterbedingungen sind dank dem Klimawandel wahrscheinlicher geworden. Wie sich das… [+5891 chars],,de,'Schnee'
https://www.zeit.de/news/2025-11/05/enbw-senkt-preise-fuer-strom-und-gas,https://www.zeit.de/news/2025-11/05/enbw-senkt-preise-fuer-strom-und-gas,0,www.zeit.de,Zuschuss für Netze: EnBW senkt Preise für Strom und Gas,Hier finden Sie Informationen zu dem Thema „Zuschuss für Netze“. Lesen Sie jetzt „EnBW senkt Preise für Strom und Gas“.,https://img.zeit.de/news/2025-11/05/enbw-senkt-preise-fuer-strom-und-gas-image-group/wide__1300x731,2025-11-05T04:00:27Z,,"Viele Verbraucher zahlen beim Energieversorger EnBW zum Jahreswechsel weniger für Gas, Haushalts- und Wärmestrom. Bereits zum 1. Dezember sinken die Preise für das Laden von Elektrofahrzeugen, wie de… [+3320 chars]",,de,'Gas'
