index,url,valid,domain,title,description,image,published,archive,content,quote,language,keyword
https://www.bild.de/regional/baden-wuerttemberg/deutschland-sagt-danke-die-helden-der-grossen-flut-66618384cec1b34b13ac2d4d,https://www.bild.de/regional/baden-wuerttemberg/deutschland-sagt-danke-die-helden-der-grossen-flut-66618384cec1b34b13ac2d4d,0,www.bild.de,"Das sind die Fluthelfer  - „Manche weinen, bis sie eingeschlafen sind“","Das Wasser ist gegangen, die Helfer sind gekommen. In den Hochwasser-Gebieten stehen alle zusammen, um den Schutt beiseitezuräumen und zu helfen.","https://images.bild.de/66618384cec1b34b13ac2d4d/7349f2cfa4999c056993a51874a47f15,db7f0c27?w=1280",2024-06-10T07:54:53Z,,"Rudersberg Das Wasser ist gegangen, die Helfer sind gekommen. In den Hochwasser-Gebieten stehen alle zusammen, um den Schutt beiseitezuräumen und den Betroffenen wieder ein normales Leben zu ermöglic… [+7396 chars]",,de,'Hochwasser'
https://www.faz.net/aktuell/gesellschaft/wasserstand-der-donau-sinkt-langsam-19777703.html,https://www.faz.net/aktuell/gesellschaft/wasserstand-der-donau-sinkt-langsam-19777703.html,0,www.faz.net,Wasserstand der Donau sinkt langsam,Das Hochwasser der Donau fließt langsam ab – teils wird jedoch abermals mit starkem Regen gerechnet. Das bayerische Gastgewerbe fürchtet Stornierungen zur Sommerreisezeit.,https://media1.faz.net/ppmedia/aktuell/gesellschaft/4283794005/1.9777781/facebook_teaser/auch-in-passau-geht-das-wasser.jpg,2024-06-10T08:21:17Z,,"Das Hochwasser der Donau in der Drei-Flüsse-Stadt Passau geht langsam zurück. Am Montagmorgen registrierte der Hochwassernachrichtendienst (HND) Bayern am Messpunkt Ilzstadt/Donau 7,64 Meter, wie die… [+1655 chars]",,de,'Hochwasser'
https://www.golem.de/sonstiges/zustimmung/auswahl.html?from=https://www.golem.de/news/rettungsaktion-zwei-deutsche-sterben-wegen-in-fluss-gefallenen-handys-2406-185894.html&referer=https://t.co/c88ca65538,https://www.golem.de/sonstiges/zustimmung/auswahl.html?from=https://www.golem.de/news/rettungsaktion-zwei-deutsche-sterben-wegen-in-fluss-gefallenen-handys-2406-185894.html&referer=https://t.co/c88ca65538,0,www.golem.de,Rettungsaktion: Zwei Deutsche sterben wegen in Fluss gefallene Handys,"Zwei Männer sind in der Maas ertrunken. Sie wollten einem weiteren Mann helfen, dessen Handy in den Fluss gefallen war. (Hochwasser, Handy)",,2024-06-10T08:43:01Z,,"Besuchen Sie Golem.de wie gewohnt mit Werbung und Tracking,
 indem Sie der Nutzung aller Cookies zustimmen.
 Details zum Tracking finden Sie im Privacy Center.
Skript wurde nicht geladen. Informat… [+607 chars]",,de,'Hochwasser'
https://www.bild.de/sport/fussball/bundesliga-mario-basler-bietet-sich-bei-diesem-klub-an-6665e05645ebfd355dc988cb,https://www.bild.de/sport/fussball/bundesliga-mario-basler-bietet-sich-bei-diesem-klub-an-6665e05645ebfd355dc988cb,0,www.bild.de,*** BILDplus Inhalt *** Wenn die Kohle stimmt! - Basler bietet sich bei DIESEM Bundesligisten an,Kult-Kicker Mario Basler würde bei einem Erstligisten einen speziellen Job annehmen. Welchen? Und bei welchem Bundesliga-Klub genau?,"https://images.bild.de/6665e05645ebfd355dc988cb/93ba0b2a5f91132742f9bcbaa510c149,fdcfe490?w=1280",2024-06-10T08:48:07Z,,"Kult-Kicker Mario Basler würde gerne in der Bundesliga arbeiten und bietet sich bei einem Klub an. 
Bei BILDplus lesen wie, bei welchen Verein sich der einstige Bayern-Star ein Engagement vorstellen… [+69 chars]",,de,'Kohle'
https://www.stern.de/gesellschaft/regional/bayern/deggendorf--mehrere-surfer-bei-hochwasser-auf-isarwelle-34785102.html,https://www.stern.de/gesellschaft/regional/bayern/deggendorf--mehrere-surfer-bei-hochwasser-auf-isarwelle-34785102.html,0,www.stern.de,Deggendorf: Mehrere Surfer bei Hochwasser auf Isarwelle,"Trotz der angespannten Hochwasserlage im Landkreis Deggendorf sind vermehrt Menschen auf der sogenannten Isarwelle in Plattling gesurft. Eine Frau wurde dabei nun am Sonntag leicht verletzt, wie die Polizei am Montag mitteilte. Sie sei von der Welle erfasst u…",https://image.stern.de/34785104/t/hs/v1/w1440/r1.7778/-/10--urnnewsmldpacom2009010124061099339643v3w800h600l640t391r1920b1176jpeg---3b9eb1d904eb9df8.jpg,2024-06-10T08:56:56Z,,"Trotz der angespannten Hochwasserlage im Landkreis Deggendorf sind vermehrt Menschen auf der sogenannten Isarwelle in Plattling gesurft. Eine Frau wurde dabei nun am Sonntag leicht verletzt, wie die … [+337 chars]",,de,'Hochwasser'
https://www.zeit.de/video/2024-06/6354726478112/hochwasser-schwere-ueberschwemmungen-in-der-steiermark,https://www.zeit.de/video/2024-06/6354726478112/hochwasser-schwere-ueberschwemmungen-in-der-steiermark,0,www.zeit.de,Hochwasser: Schwere Überschwemmungen in der Steiermark,Heftige Regenfälle haben am Wochenende in Teilen Österreichs für Überschwemmungen und Schäden gesorgt. Mehrere Wahllokale waren dadurch am Sonntag nicht zugänglich.,https://img.zeit.de/video/2024-06/6354726478112-still/wide__1300x731,2024-06-10T09:31:18Z,,"Schließen
Hier können Sie interessante Artikel speichern, um sie später zu lesen und wiederzufinden.
Sie haben bereits ein Konto?
 Hier anmelden.",,de,'Hochwasser'
https://www.bild.de/regional/muenchen/nach-hochwasser-in-bayern-hoteliers-befuerchten-stornowelle-6666cb173cd76512c9daa56d,https://www.bild.de/regional/muenchen/nach-hochwasser-in-bayern-hoteliers-befuerchten-stornowelle-6666cb173cd76512c9daa56d,0,www.bild.de,Nach Hochwasser in Bayern - Hoteliers befürchten Stornowelle,"Das bayerische Gastgewerbe sorgt sich um eine Welle von Stornierungen aufgrund von Hochwasserängsten, obwohl viele Gebiete nicht betroffen sind.","https://images.bild.de/6666cb173cd76512c9daa56d/ef39e6cf01e7d5bc27da334e39124ced,c6ab6cd3?w=1280",2024-06-10T10:05:35Z,,"München Die Hochwasserlage in Teilen Bayerns entspannt sich weiter, doch jetzt bangt das Gastgewerbe vor einer Stornowelle kurz vor Beginn der Sommerreisezeit. 
Aktuell häufen sich bei uns Rückmeldu… [+840 chars]",,de,'Hochwasser'
https://www.stern.de/gesellschaft/regional/bayern/hochwasser--verbraucherzentrale-beraet-flutgeschaedigte-kostenlos-34785372.html,https://www.stern.de/gesellschaft/regional/bayern/hochwasser--verbraucherzentrale-beraet-flutgeschaedigte-kostenlos-34785372.html,0,www.stern.de,Hochwasser: Verbraucherzentrale berät Flutgeschädigte kostenlos,"Die bayerische Verbraucherzentrale bietet Geschädigten aus den Hochwassergebieten im Freistaat eine kostenlose Beratung an. ""Unsere Energieberater kommen zu den Betroffenen nach Hause, sehen sich das Gebäude an und geben eine erste Einschätzung"", sagte Sigrid…",https://image.stern.de/34785374/t/ck/v1/w1440/r1.7778/-/10--urnnewsmldpacom2009010124061099340615v3w800h600l640t425r1920b1278jpeg---7edfb64ccd354ea6.jpg,2024-06-10T10:05:46Z,,"Die bayerische Verbraucherzentrale bietet Geschädigten aus den Hochwassergebieten im Freistaat eine kostenlose Beratung an. ""Unsere Energieberater kommen zu den Betroffenen nach Hause, sehen sich das… [+842 chars]",,de,'Hochwasser'
https://www.freitag.de/autoren/jan-van-aken/linke-tief-bei-europawahl-fuenf-punkte-um-zu-linker-politik-zurueckzufinden,https://www.freitag.de/autoren/jan-van-aken/linke-tief-bei-europawahl-fuenf-punkte-um-zu-linker-politik-zurueckzufinden,0,www.freitag.de,"Gastbeitrag | Linke am Tiefpunkt: Fünf Punkte, um zu linker Politik zurückzufinden","Nur 2,7 Prozent hat die Linke bei den Europawahlen geholt. Jan van Aken, Parteimitglied und ehemaliger außenpolitischer Sprecher der Linksfraktion, nutzt diesen Moment des Tiefs – und schlägt fünf Punkte vor, um die Linke neu aufzubauen Die Linke ist noch da!…",https://www.freitag.de/autoren/jan-van-aken/linke-tief-bei-europawahl-fuenf-punkte-um-zu-linker-politik-zurueckzufinden/@@images/social_image,2024-06-10T10:08:00Z,,"Die Linke ist noch da! Ich weiß, es fühlt sich gerade nicht so an, aber ich bin zutiefst davon überzeugt, dass wir die Talsohle jetzt durchschritten haben. Ab jetzt kann es nach vorne gehen. Daran än… [+7844 chars]",,de,'Kälte'
https://www.faz.net/aktuell/feuilleton/debatten/hochwasser-und-klimawandel-auch-in-deutschland-gibt-es-schon-klimavertriebene-19775977.html,https://www.faz.net/aktuell/feuilleton/debatten/hochwasser-und-klimawandel-auch-in-deutschland-gibt-es-schon-klimavertriebene-19775977.html,0,www.faz.net,Hochwasser und Klimawandel: „Auch in Deutschland gibt es schon Klimavertriebene“,"Die Politikwissenschaftlerin Kira Vinke spricht über Katastrophenschutz angesichts zunehmender Extremwetterlagen, die Dringlichkeit, die Erderwärmung einzudämmen, und Deutschlands erste Klimavertriebene.",https://media0.faz.net/ppmedia/aktuell/gesellschaft/2442927971/1.9775974/facebook_teaser_fplus/nach-dem-extremen-regen.jpg,2024-06-10T10:51:05Z,,"Frau Vinke, hat die Erderwärmung einen Anteil an den Regenfällen, die im Süden Deutschlands zu Hochwasser geführt haben?
Ja, denn wärmere Luft trägt mehr Feuchtigkeit, die dann wieder abregnet. Seit… [+518 chars]",,de,'Hochwasser'
https://www.stern.de/gesellschaft/regional/nordrhein-westfalen/hochwasser--vermisster-angler-tot-im-rhein-gefunden-34785798.html,https://www.stern.de/gesellschaft/regional/nordrhein-westfalen/hochwasser--vermisster-angler-tot-im-rhein-gefunden-34785798.html,0,www.stern.de,Hochwasser: Vermisster Angler tot im Rhein gefunden,"Ein möglicherweise vom Hochwasser überraschter Angler ist Tage nach einer Vermisstenmeldung tot im Rhein entdeckt worden. In der Nähe von Rheinberg am Niederrhein wurde am Samstagabend eine Leiche gefunden, wie die Polizei am Montag mitteilte. Die Ermittlunge…",https://image.stern.de/34785800/t/9_/v1/w1440/r1.7778/-/10--urnnewsmldpacom2009010124061099342063v3w800h600l911t540r2191b1393jpeg---5913c1f249fb9358.jpg,2024-06-10T11:46:09Z,,Ein möglicherweise vom Hochwasser überraschter Angler ist Tage nach einer Vermisstenmeldung tot im Rhein entdeckt worden. In der Nähe von Rheinberg am Niederrhein wurde am Samstagabend eine Leiche ge… [+1060 chars],,de,'Hochwasser'
https://www.zeit.de/news/2024-06/10/vermisster-angler-tot-im-rhein-gefunden,https://www.zeit.de/news/2024-06/10/vermisster-angler-tot-im-rhein-gefunden,0,www.zeit.de,Hochwasser: Vermisster Angler tot im Rhein gefunden,Hier finden Sie Informationen zu dem Thema „Hochwasser“. Lesen Sie jetzt „Vermisster Angler tot im Rhein gefunden“.,https://img.zeit.de/news/2024-06/10/vermisster-angler-tot-im-rhein-gefunden-image-group/wide__1300x731,2024-06-10T11:46:09Z,,Ein möglicherweise vom Hochwasser überraschter Angler ist Tage nach einer Vermisstenmeldung tot im Rhein entdeckt worden. In der Nähe von Rheinberg am Niederrhein wurde am Samstagabend eine Leiche ge… [+1904 chars],,de,'Hochwasser'
https://www.n-tv.de/ratgeber/Schimmel-an-der-Wand-nicht-mit-Essig-entfernen-article24971499.html,https://www.n-tv.de/ratgeber/Schimmel-an-der-Wand-nicht-mit-Essig-entfernen-article24971499.html,0,www.n-tv.de,Irrtümer zu lästigen Pilzen: Schimmel an der Wand nicht mit Essig entfernen,Schimmel in der Wohnung ist gefürchtet. Wie kann ich ihn vermeiden oder beseitigen? Darüber gibt es einige Irrtümer. Diese drei sollten Sie kennen.,https://bilder4.n-tv.de/img/incoming/crop23916891/8261325080-cImg_16_9-w1200/Kleine-Schimmelflecken-kann-man-selbst-entfernen.jpg,2024-06-10T13:07:41Z,,"Schimmel in der Wohnung ist gefürchtet. Wie kann ich ihn vermeiden oder beseitigen? Darüber gibt es einige Irrtümer. Diese drei sollten Sie kennen.
Hinter den Schrank oder in den Abstellraum geguckt… [+3404 chars]",,de,'Hochwasser'
https://www.welt.de/regionales/hamburg/article251952870/Klimaschutz-Wir-muessen-bei-der-Reduktion-von-Treibhausgasen-vorankommen.html,https://www.welt.de/regionales/hamburg/article251952870/Klimaschutz-Wir-muessen-bei-der-Reduktion-von-Treibhausgasen-vorankommen.html,0,www.welt.de,„Wir müssen bei der Reduktion von Treibhausgasen vorankommen“,"Der norwegische Konzern Yara ist der weltweit führende Hersteller von Ammoniak. Nun nimmt das Unternehmen eine Pilotanlage in Betrieb, um die Chemikalie ohne Ausstoß von Kohlendioxid herzustellen. Konzernchef Holsether beschreibt die Perspektiven von „grünem“…",https://img.welt.de/img/regionales/hamburg/mobile251952866/4397932837-ci16x9-w1200/Svein-Tore-Holsether-2.jpg,2024-06-10T13:16:36Z,,"Der norwegische Konzern Yara ist der weltweit führende Hersteller von Ammoniak. Nun nimmt das Unternehmen eine Pilotanlage in Betrieb, um die Chemikalie ohne Ausstoß von Kohlendioxid herzustellen. Ko… [+8668 chars]",,de,'Kohle'
https://www.focus.de/wissen/natur/kein-sommer-im-juni-kaeltefront-schlaegt-im-juni-zu-wie-die-schafskaelte-den-sommer-beeinflusst_id_259987962.html,https://www.focus.de/wissen/natur/kein-sommer-im-juni-kaeltefront-schlaegt-im-juni-zu-wie-die-schafskaelte-den-sommer-beeinflusst_id_259987962.html,0,www.focus.de,Kein Sommer im Juni? - Kältefront schlägt im Juni zu: Wie die Schafskälte den Sommer beeinflusst,"Die derzeitigen Temperaturen lassen eine Schafskälte in Teilen von Deutschland vermuten. Hier erfahren Sie, was hinter diesem Wetterphänomen steckt.Von FOCUS-online-Redakteurin Julia Mosberger",https://p6.focus.de/img/fotos/id_259988062/schafskaelte.jpg?im=Crop%3D%280%2C288%2C3464%2C1732%29%3BResize%3D%281200%2C627%29&impolicy=perceptual&quality=mediumHigh&hash=457ee200095f7369488828cce0f65800d347d557433e3c9f46f08d1080c08294,2024-06-10T13:53:50Z,,"Die derzeitigen Temperaturen lassen eine Schafskälte in Teilen von Deutschland vermuten. Hier erfahren Sie, was hinter diesem Wetterphänomen steckt.Die Schafskälte naht! Dieses erstaunliche Wetterphä… [+3020 chars]",,de,'Kälte'
https://www.sueddeutsche.de/bayern/hochwasser-bayern-schaeden-landwirtschaft-vohburg-lux.3SeofRN7XrRmkk94rFuBSw,https://www.sueddeutsche.de/bayern/hochwasser-bayern-schaeden-landwirtschaft-vohburg-lux.3SeofRN7XrRmkk94rFuBSw,0,www.sueddeutsche.de,Hochwasser in Bayern: „Hundert Prozent kaputt“,"Die Schäden der Jahrhundertflut in der Landwirtschaft sind noch nicht bezifferbar, aber fest steht, dass sie extrem hoch sind. Ein Besuch bei Markus Schrödl und Konrad Pflügl, die ihre Felder im Donaumoos nahe Vohburg haben. Die stehen jetzt unter Wasser.",https://www.sueddeutsche.de/2024/06/10/f1e110e2-a960-4e07-87b5-cfab6683d7a1.jpeg?q=60&fm=webp&width=1200&rect=undefined%2Cundefined%2Cundefined%2Cundefined,2024-06-10T13:57:41Z,,"Die Schäden der Jahrhundertflut in der Landwirtschaft sind noch nicht bezifferbar, aber fest steht, dass sie extrem hoch sind. Ein Besuch bei Markus Schrödl und Konrad Pflügl, die ihre Felder im Dona… [+669 chars]",,de,'Hochwasser'
https://www.stern.de/gesellschaft/regional/bayern/hochwasser--kaniber--schaeden-fuer-landwirtschaft-noch-nicht-zu-beziffern-34786554.html,https://www.stern.de/gesellschaft/regional/bayern/hochwasser--kaniber--schaeden-fuer-landwirtschaft-noch-nicht-zu-beziffern-34786554.html,0,www.stern.de,Hochwasser: Kaniber: Schäden für Landwirtschaft noch nicht zu beziffern,"Nach Worten von Landwirtschaftsministerin Michaela Kaniber (CSU) ist immer noch nicht abzuschätzen, wie hoch die durch das Hochwasser verursachten Schäden für die Landwirtschaft sind. Noch immer sei das Wasser noch nicht komplett abgelaufen, sagte sie beim Be…",https://image.stern.de/34786556/t/K3/v1/w1440/r1.7778/-/10--urnnewsmldpacom2009010124061099344766v3w800h600l640t425r1920b1278jpeg---589603a8dde2e947.jpg,2024-06-10T15:03:39Z,,"Nach Worten von Landwirtschaftsministerin Michaela Kaniber (CSU) ist immer noch nicht abzuschätzen, wie hoch die durch das Hochwasser verursachten Schäden für die Landwirtschaft sind. Noch immer sei … [+1067 chars]",,de,'Hochwasser'
https://stadt-bremerhaven.de/prince-of-persia-lost-crown-im-dezember-auch-auf-dem-mac/,https://stadt-bremerhaven.de/prince-of-persia-lost-crown-im-dezember-auch-auf-dem-mac/,0,stadt-bremerhaven.de,Prince of Persia: Lost Crown: Im Dezember auch auf dem Mac,"Prince of Persia: The Lost Crown kommt diesen Winter auf den Mac und ermöglicht es noch mehr Spielern, in eine von der Zeit zerbrochene Welt einzutauchen. Die Spieler schlüpfen in die Rolle von Sargon, dem jüngsten Mitglied einer Elitekriegergruppe namens...Z…",https://stadt-bremerhaven.de/wp-content/uploads/2024/06/Swing-bar-scene-_Lower-City_1920x1080.jpg,2024-06-10T15:30:20Z,,"Prince of Persia: The Lost Crown kommt diesen Winter auf den Mac und ermöglicht es noch mehr Spielern, in eine von der Zeit zerbrochene Welt einzutauchen. Die Spieler schlüpfen in die Rolle von Sargo… [+1223 chars]",,de,'Winter'
https://www.stern.de/gesellschaft/regional/bayern/wetter--weitere-entspannung-in-hochwasserregionen--regen-laesst-nach-34785216.html,https://www.stern.de/gesellschaft/regional/bayern/wetter--weitere-entspannung-in-hochwasserregionen--regen-laesst-nach-34785216.html,0,www.stern.de,Wetter: Weitere Entspannung in Hochwasserregionen: Regen lässt nach,"In Bayerns Hochwasserregionen herrschte noch einmal Verunsicherung, weil es am Wochenende erneut starke Regenfälle gab. Die Pegelstände stiegen, doch längst nicht so dramatisch wie zuvor.",https://image.stern.de/34785218/t/qF/v3/w1440/r1.7778/-/10--urnnewsmldpacom2009010124061099340076v3w800h600l640t425r1920b1278jpeg---6aa2759bf12b962f.jpg,2024-06-10T15:56:25Z,,"In Bayerns Hochwasserregionen herrschte noch einmal Verunsicherung, weil es am Wochenende erneut starke Regenfälle gab. Die Pegelstände stiegen, doch längst nicht so dramatisch wie zuvor.
Nach erneu… [+3424 chars]",,de,'Hochwasser'
https://versicherungswirtschaft-heute.de/unternehmen-und-management/2024-06-11/wie-enzo-chef-sascha-wolf-mit-smarten-wohngebaeudepolicen-wachsen-will-wir-werden-im-jahresverlauf-vier-bis-acht-weitere-versicherer-als-kooperationspartner-aufnehmen/,https://versicherungswirtschaft-heute.de/unternehmen-und-management/2024-06-11/wie-enzo-chef-sascha-wolf-mit-smarten-wohngebaeudepolicen-wachsen-will-wir-werden-im-jahresverlauf-vier-bis-acht-weitere-versicherer-als-kooperationspartner-aufnehmen/,0,versicherungswirtschaft-heute.de,Wie Enzo-Chef Sascha Wolf mit smarten Wohngebäudepolicen wachsen will: „Wir werden im Jahresverlauf vier bis acht weitere Versicherer als Kooperationspartner aufnehmen“,"Derzeit sind die Wohngebäudeversicherer mit den massiven Schäden durch das Hochwasser in Süddeutschland konfrontiert – dabei gerät leicht außer Acht, dass der weitaus größte Kostenblock der Sparte auf Leitungswasserschäden entfällt. Das Heidelberger Start-up …",https://versicherungswirtschaft-heute.de/wp-60d20-content/uploads/2024/06/Enzo_Wolf_Follmann-1200x800.jpg,2024-06-10T23:00:00Z,,Das Gründerteam von Enzo: Sascha Wolf (links) und Marvin Follmann. Bildquelle: EnzoDerzeit sind die Wohngebäudeversicherer mit den massiven Schäden durch das Hochwasser in Süddeutschland konfrontiert… [+592 chars],,de,'Hochwasser'
https://ooe.orf.at/stories/3260645/,https://ooe.orf.at/stories/3260645/,0,ooe.orf.at,Hochwasserschutz kurz vor Bewilligung,"In Zwettl an der Rodl (Bezirk Urfahr-Umgebung) wird seit Jahrzehnten über einen Hochwasserschutz diskutiert. Auch wenn bei den derzeitigen starken Regenfällen der Distel- und der Schauerbach keine Probleme bereiteten, kam es in der Vergangenheit zu größeren S…",https://ibs.orf.at/ooe?image=https%3A%2F%2Foekastatic.orf.at%2Fmims%2F2023%2F37%2F54%2Fcrops%2Fw%3D1200%2Ch%3D627%2Cq%3D75%2F1941020_master_729454_zwettl.jpg%3Fs%3D0409c1ba2db025b8d9fa9369e56cad408a2657f8,2024-06-11T03:46:24Z,,"Die beiden Bäche haben zuletzt in den Jahren 1987 und 2002 größere Schäden angerichtet. Als Hochwasserschutz-Maßnahmen bräuchte es für den Distelbach einen Damm: Acht Meter hoch, 100 Meter breit. Für… [+767 chars]",,de,'Hochwasser'
https://www.zeit.de/news/2024-06/11/kinderbesuche-auf-intensivstationen-nicht-ausschliessen,https://www.zeit.de/news/2024-06/11/kinderbesuche-auf-intensivstationen-nicht-ausschliessen,0,www.zeit.de,Medizin: Kinderbesuche auf Intensivstationen nicht ausschließen,Hier finden Sie Informationen zu dem Thema „Medizin“. Lesen Sie jetzt „Kinderbesuche auf Intensivstationen nicht ausschließen“.,https://img.zeit.de/news/2024-06/11/kinderbesuche-auf-intensivstationen-nicht-ausschliessen-image-group/wide__1300x731,2024-06-11T03:58:58Z,,Kinderbesuche auf Intensivstationen sollten kein Tabu sein. Laut der Deutschen Interdisziplinären Vereinigung für Intensiv- und Notfallmedizin (Divi) mit Sitz in Berlin können solche Besuche sowohl d… [+995 chars],,de,'Kinder'
https://www.stern.de/gesellschaft/regional/bayern/unwetter--kulturgueter-im-hochwasser--bayern-plant-notfallverbund-34787548.html,https://www.stern.de/gesellschaft/regional/bayern/unwetter--kulturgueter-im-hochwasser--bayern-plant-notfallverbund-34787548.html,0,www.stern.de,Unwetter: Kulturgüter im Hochwasser? Bayern plant Notfallverbund,"Hochwasser und Unwetter sorgen immer wieder für verheerende Schäden. Auch Museen oder Bibliotheken können betroffen sein. Um Kulturgüter zu schützen, soll nun eine Vereinbarung getroffen werden.",https://image.stern.de/34787550/t/1g/v1/w1440/r1.7778/-/11--urnnewsmldpacom2009010124061199350218v3w800h600l284t53r2093b1487jpeg---951b388f6769fc5c.jpg,2024-06-11T04:27:02Z,,"Hochwasser und Unwetter sorgen immer wieder für verheerende Schäden. Auch Museen oder Bibliotheken können betroffen sein. Um Kulturgüter zu schützen, soll nun eine Vereinbarung getroffen werden.
Kul… [+2088 chars]",,de,'Hochwasser'
https://burgenland.orf.at/magazin/stories/3260681/,https://burgenland.orf.at/magazin/stories/3260681/,0,burgenland.orf.at,Hochwasser: Schwierige Suche nach vermisstem Mann,"Im Südburgenland bleibt die Lage nach den heftigen Unwettern angespannt. Die Nacht auf Dienstag ist zwar ruhig verlaufen, die Pegelstände der Bäche und Flüsse sind aber nach wie vor hoch. Das erschwert auch die Suche nach dem vermissten 77-jährigen Mann aus M…",https://ibs.orf.at/bgl?image=https%3A%2F%2Foekastatic.orf.at%2Fmims%2F2024%2F24%2F31%2Fcrops%2Fw%3D1200%2Ch%3D627%2Cq%3D75%2F2238473_master_850131_240610_bh_nachzieher_unwetter-00_02_12_22.jpg%3Fs%3D315fd260afe3f48b69b11b67b63fe485d5f3d6ae,2024-06-11T04:39:09Z,,"Es wird vermutet, dass der Mann mit seinem Fahrzeug am Sonntag in den Teichbach bei Mischendorf (Bezirk Oberwart) geraten sein könnte mehr dazu in Mischendorf: Mann nach Unwettern weiter vermisst. Ob… [+1094 chars]",,de,'Hochwasser'
https://www.zeit.de/news/2024-06/11/intensivstationen-warum-auch-kinder-zu-besuch-kommen-duerfen,https://www.zeit.de/news/2024-06/11/intensivstationen-warum-auch-kinder-zu-besuch-kommen-duerfen,0,www.zeit.de,Medizin: Intensivstationen: Warum auch Kinder zu Besuch kommen dürfen,Hier finden Sie Informationen zu dem Thema „Medizin“. Lesen Sie jetzt „Intensivstationen: Warum auch Kinder zu Besuch kommen dürfen“.,https://img.zeit.de/news/2024-06/11/intensivstationen-warum-auch-kinder-zu-besuch-kommen-duerfen-image-group/wide__1300x731,2024-06-11T04:58:32Z,,"Feuerwehrleute, Taucher und Astronauten sind Motive in vielen Kinderbüchern. Technische Geräte wie Atemmasken gelten hier als spannend. Doch wenn es darum geht, Kinder mit zu Besuch auf Intensivstati… [+6759 chars]",,de,'Kinder'
https://www.faz.net/aktuell/stil/leib-seele/eltern-am-handy-smartphone-sucht-trifft-nicht-nur-kinder-19771662.html,https://www.faz.net/aktuell/stil/leib-seele/eltern-am-handy-smartphone-sucht-trifft-nicht-nur-kinder-19771662.html,0,www.faz.net,Auch Eltern können auch handysüchtig sein,"Eltern werfen häufig ihren Kindern vor, zu lange am Handy zu hängen. Doch was, wenn es umgekehrt ist? Auch Eltern können in Sachen Smartphone suchtgefährdet sein. Zwei Bekenntnisse.",https://media0.faz.net/ppmedia/aktuell/947007071/1.9771660/facebook_teaser_fplus/gross-und-klein-am-telefon.jpg,2024-06-11T06:42:58Z,,"Natürlich gehöre ich auch zu den Müttern, die in regelmäßigen Abständen ihre Kinder ermahnen: Bist du schon wieder am Handy? Kannst du das nicht mal weglegen? Handyzeit ist vorbei! Heute kein Handy m… [+188 chars]",,de,'Kinder'
https://www.morgenpost.de/vermischtes/article229058667/schafskaelte-kaelte-juni-eisheilige-2024-datum-bedeutung-wetter-hintergrund.html,https://www.morgenpost.de/vermischtes/article229058667/schafskaelte-kaelte-juni-eisheilige-2024-datum-bedeutung-wetter-hintergrund.html,0,www.morgenpost.de,Kälteeinbruch im Juni: Was sind Eisheilige und Schafskälte?,“Orientiert euch an den Eisheiligen“ – die alte Bauernregel kennen viele. Doch was genau bedeuten eigentlich die Eisheiligen?,https://img.sparknews.funkemedien.de/242549352/242549352_1718095097_v16_9_1600.jpeg,2024-06-11T08:38:00Z,,"Berlin. Eine Kälterückfall im Juni holt Deutschland ein. Was steckt wirklich hinter den sogenannten Eisheiligen und der Schafskälte?
<ul><li>Wer dachte, der Kälteeinbruch im Mai wäre der letzte gewe… [+4463 chars]",,de,'Kälte'
https://www.kicker.de/fuer-die-aussenpositionen-wolfsburg-holt-nationalspielerin-linder-aus-hoffenheim-1022927/artikel,https://www.kicker.de/fuer-die-aussenpositionen-wolfsburg-holt-nationalspielerin-linder-aus-hoffenheim-1022927/artikel,0,www.kicker.de,Für die Außenpositionen: Wolfsburg holt Nationalspielerin Linder aus Hoffenheim,"Felicitas Rauch ist seit dem Winter weg, Dominique Janssen im Sommer auch. Nun hat der VfL Wolfsburg eine neue Linksverteidigerin unter Vertrag genommen: DFB-Stammspielerin Sarai Linder kommt von der TSG Hoffenheim.",https://derivates.kicker.de/image/upload/c_crop%2Cx_1%2Cy_0%2Cw_2999%2Ch_1687/w_1200%2Cq_auto/v1/2024/05/08/ef3c43db-8ae5-43d0-8260-5f763f51024e.jpeg,2024-06-11T10:12:08Z,,"Felicitas Rauch ist seit dem Winter weg, Dominique Janssen im Sommer auch. Nun hat der VfL Wolfsburg eine neue Linksverteidigerin unter Vertrag genommen: DFB-Stammspielerin Sarai Linder kommt von der… [+3461 chars]",,de,'Winter'
